user_input,retrieved_contexts,response,reference,context_precision,context_recall,faithfulness,answer_relevancy
"월요일 7, 8교시에 들을 수 있는 교양 있으면 알려줘.","['제1학기 성적 열람 및 정정 일정:\n2025-06-30 (월요일)\n2025-07-01 (화요일)\n2025-07-02 (수요일)\n2025-07-03 (목요일)\n2025-07-04 (금요일)', '[언어학연구방법론] 4학년 대상 / 교수: 이해윤 / 월요일 7,8교시 / 강의실 4210호 / 학점: 2 / 전공필수 과목 아님 / 온라인강의 아님 / P/F 평가 과목 아님 / 원어강의 아님', '[세계사와한국] 전체 학년 대상 / 교수: 이수기 / 수요일 7,8교시 / 강의실 2311호 / 학점: 2 / 전공필수 과목 아님 / 온라인강의 아님 / P/F 평가 과목 아님 / 원어강의 아님\n\n[신화와종교] 전체 학년 대상 / 교수: 강미라 / 월요일 7,8교시 / 강의실 2303-3호 / 학점: 2 / 전공필수 과목 아님 / 온라인강의 아님 / P/F 평가 과목 아님 / 원어강의 아님\n\n[역사란무엇인가] 전체 학년 대상 / 교수: 서상현 / 월요일 3,4교시 / 강의실 2502호 / 학점: 2 / 전공필수 과목 아님 / 온라인강의 아님 / P/F 평가 과목 아님 / 원어강의 아님\n\n[요가경전강독] 전체 학년 대상 / 교수: 최원호 / 금요일 7,8교시 / 강의실 2313호 / 학점: 2 / 전공필수 과목 아님 / 온라인강의 아님 / P/F 평가 과목 아님 / 원어강의 아님', '[역사란무엇인가] 전체 학년 대상 / 교수: 서상현 / 화요일 7,8교시 / 강의실 2502호 / 학점: 2 / 전공필수 과목 아님 / 온라인강의 아님 / P/F 평가 과목 아님 / 원어강의 아님\n\n[윤리적사고와문제해결] 전체 학년 대상 / 교수: 김신 / 목요일 3,4교시 / 강의실 5208호 / 학점: 2 / 전공필수 과목 아님 / 온라인강의 아님 / P/F 평가 과목 아님 / 원어강의 아님\n\n[종교철학입문] 전체 학년 대상 / 교수: 조명동 / 월요일 7,8교시 / 강의실 2503호 / 학점: 2 / 전공필수 과목 아님 / 온라인강의 아님 / P/F 평가 과목 아님 / 원어강의 아님\n\n[철학으로의초대] 전체 학년 대상 / 교수: 김영걸 / 화요일 5,6교시 / 강의실 2504호 / 학점: 2 / 전공필수 과목 아님 / 온라인강의 아님 / P/F 평가 과목 아님 / 원어강의 아님', '[시사토론중국어] 3학년 대상 / 교수: 남종호 / 화요일 7,8교시 / 강의실 1309호 / 학점: 2 / 전공필수 과목 아님 / 온라인강의 아님 / P/F 평가 과목 아님 / 원어강의 아님\n\n[제자백가다시읽기] 3학년 대상 / 교수: 이은주 / 수요일 7,8교시 / 강의실 2315호 / 학점: 2 / 전공필수 과목 아님 / 온라인강의 아님 / P/F 평가 과목 아님 / 원어강의 아님\n\n[제자백가다시읽기] 3학년 대상 / 교수: 이은주 / 월요일 7,8교시 / 강의실 2315호 / 학점: 2 / 전공필수 과목 아님 / 온라인강의 아님 / P/F 평가 과목 아님 / 원어강의 아님', '[미네르바인성교육] 전체 학년 대상 / 교수: 박남용 / 목요일 5,6교시 / 강의실 2408호 / 학점: 2 / 전공필수 과목 아님 / 온라인강의 아님 / P/F 평가 과목 아님 / 원어강의 아님\n\n[분노와용서] 전체 학년 대상 / 교수: 조준래 / 수요일 7,8교시 / 강의실 2309호 / 학점: 2 / 전공필수 과목 아님 / 온라인강의 아님 / P/F 평가 과목 아님 / 원어강의 아님\n\n[사람다운삶을위한관계] 전체 학년 대상 / 교수: 박성준 / 금요일 7,8교시 / 강의실 2412호 / 학점: 2 / 전공필수 과목 아님 / 온라인강의 아님 / P/F 평가 과목 아님 / 원어강의 아님', '[실용스페인어기초다지기] 전체 학년 대상 / 교수: 이강국 / 월요일 7,8교시 / 강의실 1303호 / 학점: 2 / 전공필수 과목 아님 / 온라인강의 아님 / P/F 평가 과목 아님 / 원어강의 아님\n\n[아랍어의이해1] 전체 학년 대상 / 교수: 이계연 / 목요일 5,6교시 / 강의실 0503호 / 학점: 2 / 전공필수 과목 아님 / 온라인강의 아님 / P/F 평가 과목 아님 / 원어강의 아님\n\n[애니메이션일본어] 전체 학년 대상 / 교수: 김용미 / 금요일 3,4교시 / 강의실 2311호 / 학점: 2 / 전공필수 과목 아님 / 온라인강의 아님 / P/F 평가 과목 아님 / 원어강의 아님', '[공공브랜딩] 4학년 대상 / 교수: 이효복 / 화요일 7,8,9교시 / 강의실 0512호 / 학점: 3 / 전공필수 과목 아님 / 온라인강의 아님 / P/F 평가 과목 아님 / 원어강의 아님', '[논리학입문] 전체 학년 대상 / 교수: 정재환 / 목요일 3,4교시 / 강의실 2407-1호 / 학점: 2 / 전공필수 과목 아님 / 온라인강의 아님 / P/F 평가 과목 아님 / 원어강의 아님\n\n[동서문명교류사] 전체 학년 대상 / 교수: 이영희 / 목요일 7,8교시 / 강의실 4214호 / 학점: 2 / 전공필수 과목 아님 / 온라인강의 아님 / P/F 평가 과목 아님 / 원어강의 아님\n\n[동아시아근현대사] 전체 학년 대상 / 교수: 정일교 / 월요일 3,4교시 / 강의실 2407호 / 학점: 2 / 전공필수 과목 아님 / 온라인강의 아님 / P/F 평가 과목 아님 / 원어강의 아님', '[인문학명저산책] 전체 학년 대상 / 교수: 조준래 / 목요일 7,8교시 / 강의실 2501호 / 학점: 2 / 전공필수 과목 아님 / 온라인강의 아님 / P/F 평가 과목 아님 / 원어강의 아님\n\n[인문학의이해-문학,역사,철학] 전체 학년 대상 / 교수: 소병선 / 목요일 7,8교시 / 강의실 4411호 / 학점: 2 / 전공필수 과목 아님 / 온라인강의 아님 / P/F 평가 과목 아님 / 원어강의 아님\n\n[창의적독서와자기발견] 전체 학년 대상 / 교수: 한상효 / 월요일 3,4교시 / 강의실 2504호 / 학점: 2 / 전공필수 과목 아님 / 온라인강의 아님 / P/F 평가 과목 아님 / 원어강의 아님\n\n[한시로읽는동양의삶과미학] 전체 학년 대상 / 교수: 박남용 / 화요일 1,2교시 / 강의실 2406호 / 학점: 2 / 전공필수 과목 아님 / 온라인강의 아님 / P/F 평가 과목 아님 / 원어강의 아님', '[미네르바인문(2)읽기와토의.토론] 1학년 대상 / 교수: 양선이 / 월요일 7,8,9교시 / 강의실 2214호 / 학점: 3 / 전공필수 과목 아님 / 온라인강의 아님 / P/F 평가 과목 아님 / 원어강의 아님\n\n[미네르바인문(2)읽기와토의.토론] 1학년 대상 / 교수: 양선이 / 수요일 4,5,6교시 / 강의실 2412호 / 학점: 3 / 전공필수 과목 아님 / 온라인강의 아님 / P/F 평가 과목 아님 / 원어강의 아님\n\n[미네르바인문(2)읽기와토의.토론] 1학년 대상 / 교수: 양선이 / 목요일 4,5,6교시 / 강의실 2214호 / 학점: 3 / 전공필수 과목 아님 / 온라인강의 아님 / P/F 평가 과목 아님 / 원어강의 아님\n\n[미네르바인문(2)읽기와토의.토론] 1학년 대상 / 교수: 이정은 / 화요일 1,2,3교시 / 강의실 2408호 / 학점: 3 / 전공필수 과목 아님 / 온라인강의 아님 / P/F 평가 과목 아님 / 원어강의 아님', '[서양명작의이해와감상] 전체 학년 대상 / 교수: 김경랑 / 수요일 7,8교시 / 강의실 2301호 / 학점: 2 / 전공필수 과목 아님 / 온라인강의 아님 / P/F 평가 과목 아님 / 원어강의 아님\n\n[설득과소통의레토릭] 전체 학년 대상 / 교수: 한우섭 / 금요일 1,2교시 / 강의실 2303-2호 / 학점: 2 / 전공필수 과목 아님 / 온라인강의 아님 / P/F 평가 과목 아님 / 원어강의 아님\n\n[언어와문화(교양)] 전체 학년 대상 / 교수: 박주연 / 목요일 5,6교시 / 강의실 2402-1호 / 학점: 2 / 전공필수 과목 아님 / 온라인강의 아님 / P/F 평가 과목 아님 / 원어강의 아님\n\n[언어와현대미디어사회] 전체 학년 대상 / 교수: 윤상호 / 화요일 7,8교시 / 강의실 2307호 / 학점: 2 / 전공필수 과목 아님 / 온라인강의 아님 / P/F 평가 과목 아님 / 원어강의 아님', '[인문학명저산책] 전체 학년 대상 / 교수: 조준래 / 목요일 7,8교시 / 강의실 2309호 / 학점: 2 / 전공필수 과목 아님 / 온라인강의 아님 / P/F 평가 과목 아님 / 원어강의 아님\n\n[젠더와문학] 전체 학년 대상 / 교수: 홍구슬 / 금요일 5,6교시 / 강의실 1507호 / 학점: 2 / 전공필수 과목 아님 / 온라인강의 아님 / P/F 평가 과목 아님 / 원어강의 아님\n\n[졸업하기전에읽어야할러시아고전명작] 전체 학년 대상 / 교수: 전미라 / 화요일 7,8교시 / 강의실 2412호 / 학점: 2 / 전공필수 과목 아님 / 온라인강의 아님 / P/F 평가 과목 아님 / 원어강의 아님', '[심리언어학] 4학년 대상 / 교수: 전종섭 / 수요일 7,8,9교시 / 강의실 4210호 / 학점: 3 / 전공필수 과목 아님 / 온라인강의 아님 / P/F 평가 과목 아님 / 원어강의 아님\n\n[언어학연구방법론] 4학년 대상 / 교수: 이해윤 / 월요일 7,8교시 / 강의실 4210호 / 학점: 2 / 전공필수 과목 아님 / 온라인강의 아님 / P/F 평가 과목 아님 / 원어강의 아님', '[생명과학과불교철학특강] 3학년 대상 / 교수: 김원명 / 월요일 7,8,9교시 / 강의실 4216호 / 학점: 3 / 전공필수 과목 아님 / 온라인강의 아님 / P/F 평가 과목 아님 / 원어강의 아님\n\n[존재론] 3학년 대상 / 교수: 김영걸 / 목요일 7,8,9교시 / 강의실 4216호 / 학점: 3 / 전공필수 과목 아님 / 온라인강의 아님 / P/F 평가 과목 아님 / 원어강의 아님\n\n[합리론] 3학년 대상 / 교수: 한우섭 / 금요일 4,5,6교시 / 강의실 4216호 / 학점: 3 / 전공필수 과목 아님 / 온라인강의 아님 / P/F 평가 과목 아님 / 원어강의 아님\n\n[문학과철학] 4학년 대상 / 교수: 송석랑 / 월요일 4,5,6교시 / 강의실 4214호 / 학점: 3 / 전공필수 과목 아님 / 온라인강의 아님 / P/F 평가 과목 아님 / 원어강의 아님', '[종교철학입문] 전체 학년 대상 / 교수: 조명동 / 월요일 7,8교시 / 강의실 2503호 / 학점: 2 / 전공필수 과목 아님 / 온라인강의 아님 / P/F 평가 과목 아님 / 원어강의 아님\n\n[철학으로의초대] 전체 학년 대상 / 교수: 김영걸 / 화요일 5,6교시 / 강의실 2504호 / 학점: 2 / 전공필수 과목 아님 / 온라인강의 아님 / P/F 평가 과목 아님 / 원어강의 아님\n\n[한국사의이해] 전체 학년 대상 / 교수: 정동민 / 목요일 7,8교시 / 강의실 2503호 / 학점: 2 / 전공필수 과목 아님 / 온라인강의 아님 / P/F 평가 과목 아님 / 원어강의 아님', '[미네르바인문(1)읽기와 쓰기] 1학년 대상 / 교수: 서세영 / 목요일 7,8,9교시 / 강의실 2415호 / 학점: 3 / 전공필수 과목 아님 / 온라인강의 아님 / P/F 평가 과목 아님 / 원어강의 아님', '[스포츠방송저널리즘실습] 3학년 대상 / 교수: 이승구 / 월요일 7,8,9교시 / 강의실 0212호 / 학점: 3 / 전공필수 과목 아님 / 온라인강의 아님 / P/F 평가 과목 맞음 / 원어강의 아님', '[공연예술기획] 3학년 대상 / 교수: 서정미 / 화요일 7,8,9교시 / 강의실 4213호 / 학점: 3 / 전공필수 과목 아님 / 온라인강의 아님 / P/F 평가 과목 아님 / 원어강의 아님\n\n[문화콘텐츠창업개발] 3학년 대상 / 교수: 배은석 / 화요일 4,5,6교시 / 강의실 4415호 / 학점: 3 / 전공필수 과목 아님 / 온라인강의 아님 / P/F 평가 과목 아님 / 원어강의 아님\n\n[축제와문화콘텐츠2] 3학년 대상 / 교수: 김남희 / 목요일 7,8,9교시 / 강의실 4415호 / 학점: 3 / 전공필수 과목 아님 / 온라인강의 아님 / P/F 평가 과목 아님 / 원어강의 아님', '## [list] ##\n- ※ 세계문화예술경영전공 교과는 (2) 융합전공 공통기초 및 (3) 융합전공 전공교과 교과목\n- 내에서 최소 30학점 이상을 이수해야 함\n- ※ 인문기반 융합전공을 이중전공으로 선택하는 경우, “융합전공 연계기초 교과목 일람표\n- (전공교류 교과목 현황)”에 개설된 교과목 안에서 12학점 이내로 들을 수 있음.\n- 연계기초 교과목은 학과 소속과 관계없이 목록에 포함된 수업을 모두 들을 수 있음\n- ※ 융합전공 연계기초 및 공통기초과목은 필수가 아닌 권고사항임\n- ※ 융합전공 공통기초 교과목은 ‘전공교류 교과목 현황’의 <공통기초> 참조 (공통기초\n- 교과목 내에서 3학점만 인정)\n- ※ 7+1, 교환학생의 해외이수학점 및 인턴십 프로그램의 경우 유관성이 있는 해당\n- 과목이나 내용에 따라 전공학점 및 연계기초 과목을 대체할 수 있으며, 이는 세계\n- 문화예술경영 관련 내규에 따라 인정됨\n\n## [footer] ##\n- 49 -', '덕션의 과정을 실습하는 프로그램에 참여합니다. (스튜디오/편집실)\n-  스토리콘텐츠 창작 프로그램: 영화 시나리오, 드라마 대본, 웹소설 등 \n스토리콘텐츠 기획과 창작을 위한 프로그램에 참여합니다. (창작실)\nDivision of Digital Contents\n디지털콘텐츠학부\n전화번호 031-330-4067\n홈페이지 dicon.hufs.ac.kr\n학과(부) 행사 및 동아리 활동 \n-  콘텐츠 제작 대회 및 마켓: 특정 주제와 장르로 콘텐츠를 제작하고 이\n를 전시할 수 있는 마켓을 제공합니다. 게임, 애니메이션, 웹디자인 등 \n다양한 분야에 참가하여 본인의 역량을 강화하고 발휘할 수 있는 열\n린 소통의 장입니다.\n-  비즈니스 강연 및 워크숍: 디지털콘텐츠와 관련한 주요 비즈니스 전\n문가를 초청하여 강연 및 워크숍을 개최합니다. 현업에서의 경험과 통\n찰력을 얻을 수 있는 기회를 넘어서, 실무 인맥을 형성할 수 있는 기\n회를 제공합니다.\n-  콘텐츠 기반 창업 프로젝트: 창업에 흥미를 느끼는 학생을 위해 콘텐\n츠를 중심으로 한 창업 아이디어 구상부터 비즈니스 모델 개발까지 창\n업 프로세스 전반을 경험할 수 있도록 합니다. 실제 사업가로 나아가\n는데 필요한 역량을 갖출 수 있는 기회입니다.\n-  다양한 동아리: 디자인 커뮤니티 동아리, 콘텐츠 제작 동아리, AR/\nVR 체험 동아리, 스토리 창작 동아리, 창업 및 비즈니스 동아리 등 전\n공 분야에서의 역량을 함께 키울 수 있는 다양한 커뮤니티에 참여할 \n수 있습니다.\n슬기로운 대학생활 \n1학년  디지털 문화콘텐츠/디지털 테크놀로지/빅데이터 등의 기본 개념\n을 배우고 디지털콘텐츠 분야에 대한 이해도를 높이는 시기입니\n다. 1학년의 학습 내용이 2~4학년으로 연계되므로, 디지털콘텐\n츠에 대한 기초 내용을 잘 학습하고 기억하는 것이 중요합니다.\n2학년  수업의 종류가 많아지므로, 학생이 원하는 분야를 선택해서 들을 \n수 있습니다. 한 가지 분야에 초점을 맞춰도 되지만 자신의 잠재\n력이 잘 드러날 수 있는 비주얼콘텐츠/스토리콘텐츠/K-콘텐츠/\n콘텐츠비즈니스 중에서 2가지 이상 분야의 다양한 수업의 수강\n을 권장합니다.\n3학년  더욱 심화된 내용을 통해 진로 선택에 있어 도움이 되는 분야를 \n정해 집중적으로 수강하기를 권장합니다. 현장실습을 고려하고 \n있다면 1~3학년까지 배웠던 수업을 정리하는 일도 중요합니다.', '2928\nDivision of Global Business & Technology\nGlobal Business & \nTechnology학부\n전화번호 031-330-4509\n홈페이지 gbt.hufs.ac.kr\n전공소개 \nGBT학부에서는 “정보기술을 잘 활용할 수 있는 경영인”을 양성합니다. \n미래에는 인공지능과 빅데이터 등 첨단 정보기술이 모든 비즈니스에 활\n용될 것이므로 이러한 정보기술에 대한 이해와 활용 능력이 점점 더 중\n요해질 것입니다. GBT학부는 이러한 시대적 요구에 부응하여 소셜 미\n디어, 빅데이터, 인공지능과 같은 신기술들을 비즈니스 모델과 융합하\n여 경제와 산업, 문화에 걸쳐 새로운 상품과 비즈니스를 창출할 수 있는 \n‘융합형 인재’를 육성하고 있습니다. 이를 위해 영어 커뮤니케이션 능력\n과 경영학 지식, IT 역량을 갖출 수 있는 커리큘럼을 구성하였고 각 분야\n의 전문가들이 체계적이고 전문화된 교육을 진행하고 있습니다.\nGBT 학부에서는 산학 협력 프로그램 및 인턴쉽 프로그램을 운영하\n며 실무 중심의 현장 체험형 교육 기회를 제공하고 있습니다. 또한 \nResidential College, 세계 유명 대학과의 협력을 통한 복수학위제, 학\n과 전용 교환학생 제도 등을 운영하여 국제적 감각을 지닌 리더로 성장\n할 기회를 제공하고 있습니다. GBT학부는 구글, 아마존 같은 글로벌 빅\n테크 기업에서 주도적으로 일할 수 있는 인재를 양성하는 것을 목표로 \n하고 있으며 이미 성공적인 사례가 나오고 있습니다.\n필요역량 및 소양 \n-  GBT학부는 경영학과 IT기술의 융합학부이므로 인공지능, 컴퓨터프로\n그래밍 언어 등 새로운 기술에 대한 호기심과 관심이 있으면 좋고, 이\n러한 IT기술을 활용한 비즈니스에 대한 관심이 필요합니다.\n-  한국어, 영어를 사용한 커뮤니케이션 역량, 데이터 수집 및 분석 역량, \n팀을 이끌 수 있는 리더십 역량, 서로 다른 문화를 이해하고 차이를 수\n용할 수 있는 역량 등이 핵심역량이라고 할 수 있습니다. \n-  GBT학부의 수업에서도 이러한 역량을 집중적으로 가르치고 있으며 \n스스로 상당한 역량을 갖춘 학생들은 수업에 더욱 흥미를 느낄 수 있\n으며 더욱 크게 성장할 것입니다. \n우리 학과(부)·전공 매력 \n-  모든 교수님이 참여하여 전공을 소개하는 GBT Special Lecture 과\n목 운영\n-  학생들이 중심이 되는 마케팅학회, 데이터분석학회 등 전공 관련 학\n회 운영', '## [list] ##\n- 4) 전공으로 미인정된 타 학과 전공교류과목, 각종 전공 변경 후 동일 이수영역에 남아\n- 있는 전 전공 교과목, 잘못 분류된 교과목 등이 있는지 반드시 확인한 후 이수학점을\n- 계산할 것(추후 졸업예비사정 시 졸업요건 미충족이 될 수 있음)\n- 5) 국내․외 학점교류프로그램 성적은 8학기 개강 전까지 처리할 것을 권장함(미처리 시\n- 졸업예정자 분류 또는 졸업 확정에서 누락될 수 있음)\n- 6) 글로벌자유전공학부로 입학하여 전공을 배정받은 학생은 학번에 관계없이 배정받은\n- 전공 이수학점 표에 따름\n\n## [list] ##\n- ※ 이 경우 교양필수 이수 규정도 배정받은 전공의 이수 규정에 따르므로 유의할 것\n- ※ 교양 외국어 필수는 아래 표 참고하여 이수\n\n## [table] ##\n| 구분 | 교양 외국어 필수 |\n| --- | --- |\n| S등급 | ‧ 기존 글로벌자유전공학부 규정에 따라 이수(6학점) ▶ English for HASS 또는 English for STEM 3학점 ▶ English Writing for HASS 또는 English Writing for STEM 3학점 |\n| A, B, C등급 | ‧ 배정받은 학과(단과대학)의 규정에 따라 필수 학점만 채우면 되며 교과목은 기존 글로벌자유전공학부 규정에 있는 CE영역 교과목을 수강함 예) 글로벌자유전공학부 → 철학과 ▶ 인문대학 규정에 따라 교양 외국어 6학점만 이수하면 되고 교과목은 대학외국어가 아닌 CE영역 교과목을 수강함 |\n\n## [heading1] ##\n# 자유선택(자선)학점이란?\n\n## [heading1] ##\n# 가. 성적표에 자선으로 표기되는 경우', '(비교과) 전공탐색 연계한 자기탐색, 진로탐색 프로그램 지원\n1학년(여름방학) 학과 설명회\n2학기 희망 전공의 학문기초 교과목을 선택할 수 있도록 정보제공 \n1학년 2학기 전공 진입 전 기초교육 \n(교과) 교양 교과목 이수 및 희망 전공의 학문기초 교과목 이수 \n(비교과) 다양한 프로그램 연계 전공탐색학기제 운영 \n슬기로운 대학생활 \n자유전공학부(글로벌)는 전공이 정해지지 않아 학생들에게 보다 많은 \n경험을 제공할 수 있는 발판을 마련합니다. 다른 학생들과 다르게 자유\n전공학부(글로벌) 학생들은 전공을 미리 선택하지 않은 상태로 학교에 \n입학하게 됩니다. 이런 기회를 토대로 다양한 수업들을 통해서 자신과 \n잘 맞는 전공을 탐색하여 자신이 원하는 진로를 스스로 개척해 나가는 \n미래를 가져가시길 바랍니다.\nQ&A \nQ1. 2학년 진급시 주전공으로 선택할 수 있는 학과를 알고 싶습니다.\nA1.  입학 시 글로벌캠퍼스의 모든 학과(부)를 주전공으로 선택할 수 있\n는 기회가 부여됩니다. 단, 우크라이나학과와 한국학과는 2학년 배\n정이 불가하여 선택할 수 없습니다.\nQ2.  2학년 진급시 이중(부)전공으로 선택할 수 있는 학과를 알고 싶\n습니다.\nA2.  서울, 글로벌캠퍼스 구분 없이 모든 학과를 선택할 수 있습니다. 단, \n글로벌캠퍼스의 융합인재학부와 서울캠퍼스 사범대학의 학과는 해\n당 모집단위의 커리큘럼 특성 상 선택할 수 없습니다.\nQ3.  2학년 진급 시 학과 선택을 할 때, 선발기준에 대해서 알고 싶습\n니다.\nA3.  2학년 진급 시 이루어지는 학과 선택과정에서의 선발기준은 따로 \n존재하지 않습니다. 자유전공학부(글로벌)에 입학한 모든 신입생들\n에게 원하는 전공을 자유롭게 선택할 수 있는 기회를 제공하고 있\n으니 참고 바랍니다.\nOpen Major Division(Global Campus)\n자유전공학부(글로벌)\n전화번호 031-330-4797\n홈페이지 gomd.hufs.ac.kr\n글로벌캠퍼스 GLOBAL CAMPUS\nDIVISION OF \nCLIMATE CHANGE\n기후변화융합학부\n기후변화융합학부 68', '해를 바탕으로 다양한 분야에 응용될 수 있습니다. 인간의 건강에 직결되\n는 의약학 분야(Red Biotech), 산업적 소재를 생산하는 공학분야(White \nBiotech), 유용 식물을 연구하는 농업 분야(Green Biotech), 그리고 해양\n자원분야(Blue Biotech)가 대표적인 예입니다. 지난 20여 년간 IT가 인류\n의 삶을 혁신했다면, 향후에는 BT(Bio Technology)가 그 주인공이 될 것이\n라는 게 미래학자들의 예측입니다. 우리 학과에서는 생명공학에 대한 시대\n적 요구에 부응하는 인재 양성을 위해 수준 높은 강의와 교과과정을 운영 \n중입니다. 고가의 첨단장비를 완비해 학부생이 직접 연구에 참여하는 기회\n도 확대하고 있습니다. 생명공학은 기본적으로 생명과학 지식에 기반을 둔 \n학문입니다. 이에 생명과학자로서 갖춰야 할 소양인 ‘논리적 사고’와 ‘현상\n에 대한 비판적 관찰 능력‘이 반드시 요구됩니다. 또한, 이를 이용해 BT 산\n업 발전에 기여할 도전정신도 필요합니다. 학생들은 향후에 전공 과정에서 \n생물학지식 전반을 완벽히 습득과 함께 연관 과학 분야들을 통합하여 이해\n하게 될 것입니다. 또한 교과서와 전공 논문을 읽을 수 있는 영어 실력의 배\n양도 빼놓을 수 없습니다. 이러한 통합적 교육을 통해 국제화된 과학 인재\n로 거듭나는 데 필요한 소양과 자기 주도적 역량을 강화하게 될 것입니다.\n필요역량 및 소양 \n생명 현상에 대한 호기심과 논리적 사고를 갖출 수 있으면 좋습니다. 특\n히, 물리, 화학, 수학과 같은 기초 과학에 대한 이해도가 높을수록 생명 \n현상과 그 기저에 있는 원리를 이해하고 응용하는 데 도움이 됩니다. \n아울러, 글을 잘 쓰고 이해하는 능력이 있다면 교재를 읽고 이해하고 \n그를 바탕으로 과학적 가설을 세워 증명하는 과정을 이해할 수 있습니\n다. 마지막으로, 영어 독해력을 기르면 유수의 우수한 논문들을 읽고 이\n를 통해 연구자의 첫걸음을 내디딜 수 있는 힘을 기를 수 있게 됩니다. \n우리 학과(부)·전공 매력 \n-  논리적사고 + 비판적 관찰력 + 도전적 정신 함양\n-  학부생의 다양한 연구 참여기회\n-  미래 생명과학 인재를 위한 소양과 역량 강화\n-  국제적 혁신 연구를 수행할 생명공학 전문가 양성\n주요 실적 \n-  과학기술정보통신부, 보건복지부 등 정부 주요 기관 지원을 받는 다\n양한 연구 과제 수행\n-  바이오융합센터 운영\n-  다수의 바이오벤처 창업', '## [heading1] ##\n# 나. 재수강 연결\n\n## [table] ##\n| 원칙 | ① 이전 취득성적과 동일한 과목 이수 ② 타 대학 취득성적 및 학점인정 성적은 재수강 불가 ③ 동일과목이 여러 학과에 개설되어 있는 경우 → 최초 수강한 학과의 교과목 으로 재수강 ④ 교양 선택은 영역 간 자유롭게 재수강 가능(단, 교양 필수, RC, CE영역 제외) ※ 새로 재수강하는 교양 영역으로 학점이 산정되므로 영역 간 이수학점 유의 ※ 자선에서 교양으로 이수구분 변경한 경우 본래 수강하였던 자선 교과목으로 재수강하여야 함 ⑤ 계절학기 수강신청 시 직전 정규학기 수강과목 재수강 불가 ※ [예시] 2025-1학기 수강과목을 2025-여름계절학기에 재수강 불가 |\n| --- | --- |\n| 예외 | ① 해당 과목이 폐지되어 동일과목이 존재하지 않는 경우 ※ 전공과목 폐지 여부 → ☎해당학과 문의 ② 교양 선택 영역에 해당하는 경우 → 위 ①, ②의 경우 종합정보시스템에서 본인이 직접 재수강할 이전 성적 선 택 가능함. 단, 본인이 직접 선택할 수 없는 경우 학사종합지원센터 전화문의 |\n\n## [paragraph] ##\n※ 재수강 연결 대상과목 구분 및 연결 방법', '문화, 역사 등)을 쌓을 수 있는 지역학 교과목이 많이 개설되어 있습니\n다. 지역학 전공자로서 가능한 다양한 과목을 통해 진정한 중앙아시아\n를 학습하고자 하는 마음가짐이 무엇보다도 중요합니다. \n-  중앙아시아 국가들은 1991년 독립한 신생국가입니다. 중앙아시아와 \n관련된 정치·경제·역사·문학 등 다양한 분야의 서적을 읽고 기본 배경\n지식을 쌓으면 좋습니다. 특히 중앙아시아는 주변 러시아, 중국 등 주\n변 국가들과의 연관성도 높기 때문에 국제 문제에 대한 관심과 기본적\n인 시사 상식을 갖추면 학습하는 데 도움이 됩니다. \n-  입학 전 입문서로는 ‘변화하는 중앙아시아 사회와 문화’(이지은, \n2022)를 읽어보길 권합니다. 독립 이후 중앙아시아 사회가 어떤 부분\n은 유지하고 어떤 부분은 변화해가며 무엇이 오늘날 중앙아시아 사회\n를 이해하는 데 핵심이 되는지 알 수 있습니다. \n-  현지 언어를 배워보고 싶으면, 국가평생교육원의 K-MOOC에서 ‘우즈\n베크어 기초생활회화 (A1 상/하)’ 또는 사이버한국외대 평생교육원의 \n특수외국어 강좌에서 ‘우즈베크어 첫걸음(A1)’을 통해서 기본적인 우\n즈베크어 체계를 학습해볼 수 있습니다. (카자흐어는 개발 중에 있습\n니다) 언어교재로는 우즈베크어 표준교재 A1(2018), 카자흐어 표준\n교재 A1(발간 예정) 등을 추천합니다.\n우리 학과(부)·전공 매력 \n-  국내 유일 중앙아시아 전문 교수들이 중앙아시아 지역학 전문가(언어\n와 지역학 통합)를 양성하는 학과입니다. \n-  최고 수준의 다중언어(우즈베크어, 카자흐어, 러시아어) 커리큘럼 및 \n국제교류프로그램을 제공합니다. \n-  우즈베크, 카자흐 현지 교수의 전문화된 언어 교육 프로그램을 구비\n하고 있습니다. \n-  ‘특수외국어능력평가시험 우즈베크어’에 응시하면 공인된 우즈베크어 \n평가 인증서를 취득할 수 있습니다. \n-  지역학 전공자로서의 전문성을 더 강화하고자 한다면, 일반대학원 터\n키/중앙아시아/몽골학과에 진학 가능합니다.\n-  학과 관련 카카오톡 채널을 운영(한국외대 중앙아시아학과)하고 있어 \n학생뿐만 아니라 일반인들 누구도 중앙아시아에 관심이 있으면 본 채\n널을 통해 문의할 수 있습니다. \n주요 실적 \n-  특수외국어교육사업: 멘토링, 탄뎀, 대사관 인턴십, 온라인 인턴십(우\n즈베키스탄, 카자흐스탄), 다문화가정 번역 봉사 등 \n-  중앙아시아연구소 연계 운영: 시사 지역 정보 뉴스 제공, 신흥지역연', '6766\n전공소개 \n자유전공학부(글로벌)는 글로벌캠퍼스에 2023년도에 신설된 학부입\n니다. 1학년 동안 다양한 분야의 전공 탐색 기회를 제공하여 학생들에게 \n자신이 맞는 전공을 선택할 시간을 충분히 배정하고자 노력하고 있으\n며, 이를 통해 주전공 및 이중전공 선택 시 보다 정확하고 합리적인 의사\n결정을 하도록 돕고 있습니다. 무엇보다도 우리 자유전공학부(글로벌)\n에서는 1학년 때 다양한 교과목 수업 수강을 통하여 어떤 전공을 선택\n하더라도 쉽게 적응할 수 있는 커리큘럼을 제공하고자 노력 중이며, 이\n를 위해 미네르바 인문영역, Residential College 영어 영역, 소프트웨\n어 기초영역 등 다양한 기초 수업을 진행 중에 있습니다. \n필요역량 및 소양 \n자유전공학부(글로벌)는 1학년 동안 교내 다양한 전공 탐색의 기회를 제\n공하는 데 주요 목적이 있습니다. 교과 측면에서 전공선택과 관련된 다\n양한 과목들을 두루두루 학습하면서, 동시에 자신에게 맞는 전공 분야\n를 찾는 노력이 중요합니다. 인문계열 과목을 통해서는 다양한 사회 분\n야에 대한 통찰 및 사고 활동을 통해서 사회현상을 바라보는 시각을 기\n르고, 문학 작품을 통해선 종합적인 인문학적 소양을 기르면 좋겠습니\n다. 자연계열 과목을 통해서는 논리적 사고 및 입증 과정을 통해서 세\n상을 구성하는 다양한 과학적 원리를 탐구하며, 이들을 실생활에 집약\n한 공학 부분에선, 이들 학문이 우리 사회에 어떻게 활용되는지 대해 탐\n구하면 좋겠습니다.\n우리 학과(부)·전공 매력 \n1)  1학년 동안 지도교수 지도 아래 다양한 학사/진로지도 및 멘토링 제\n공을 받을 수 있습니다.\n2)  교내외 전공탐색박람회 등 다양한 프로그램을 통해서 전공 탐색의 \n기회가 제공 됩니다.\n3)  1학년 동안 다양한 교과 프로그램을 통해 미래 전공에 대한 충분한 고\n민과 체험을 제공받을 수 있습니다.\n전공탐색 교육과정 \n1학년 1학기  교양 교육 중심\n(교과) 교양 교육을 통한 기초소양 함양, 전공탐색 \n(비교과) 전공탐색 연계한 자기탐색, 진로탐색 프로그램 지원\n1학년(여름방학) 학과 설명회\n2학기 희망 전공의 학문기초 교과목을 선택할 수 있도록 정보제공 \n1학년 2학기 전공 진입 전 기초교육 \n(교과) 교양 교과목 이수 및 희망 전공의 학문기초 교과목 이수 \n(비교과) 다양한 프로그램 연계 전공탐색학기제 운영 \n슬기로운 대학생활', '게 수집하고 활용이 되고 있는지에 대한 관심이 있고, 공학기술의 실\n생활적용에 흥미를 가지고 있으면 좋습니다.\n-  생물, 물리, 수학, 컴퓨터 등에 대한 기초가 첨단의료기기 및 의료데이\n터의 활용과 관련된 전공과목을 이수하는 데에 도움이 될 것입니다. \n우리 학과(부)·전공 매력 \n-  의학과 공학의 만남이라는 첨단 융복합 학문의 전문가를 양성\n-  빅데이터, 인공지능, 첨단의료기기 등 IT 중심의 바이오메디컬 분야 \n핵심 인재 양성\n-  긴밀한 산학연병 협력으로 현장형 인재 중심 교육 실현 및 현장실\n습 지원 \n-  평생 지도 교수 제도를 통한 지속적인 학생 상담 및 경력 관리 \n주요 실적 \n-  한국연구재단, 범부처전주기의료기기연구개발사업단, 한국지능정보\n사회진흥원 등의 지원으로 바이오메디컬공학 분야의 산학연병 협동\n연구를 수행 중입니다.\n-  학부학생들이 보건복지부, 한국보건산업진흥원, 산업통상자원부, \nMICCAI 주관의 다수의 공모전에서 최우수상, 우수상 등을 수상했습\n니다.\n-  학부학생들이 매년 국내외 바이오메디컬공학 관련 분야의 주요학술\n대회(ISMRM, MICCAI, MIDL, RSNA, ICMRI 등)에서 연구성과를 발\n표했습니다.\n주요 전공과목 \n-  생체신호계측기기설계및실습: 생체 신호 계측 시스템의 이해를 위\n한 기초 과목으로 전자 회로 및 반도체 시스템에 대한 개념을 이해하\n고, 인체 내에서 정보 전달을 위해 발생 되는 전기적인 신호를 측정하\n고 해석하는 데에 필수적인 전자회로의 내용을 공부하고 실습합니다.\n-  바이오메디컬인공지능: 바이오메디컬 데이터에 대한 인공지능 적용\n을 위한 딥러닝의 기초를 배우고, 컴퓨터를 이용해 실제 데이터에 적\n용할 수 있는 능력을 배양합니다.\n-  의료영상처리및실습: 디지털 영상 처리의 기초가 되는 다양한 이론과 \n방법을 배우고, 컴퓨터를 이용하여 실제 의료영상에 적용할 수 있는 \n능력을 배양합니다. 실습을 통해 의료영상의 분류, 영역 검출 및 분할, \n정합 등의 과정을 진행하는 방법을 익힙니다.\n-  의생명정보학: 의생명정보학 분야의 대표적인 데이터들을 소개하고, \n각각의 데이터들에 대해 이해하고 이를 다운로드 받아 다뤄보는 것 이\n외에 실제 시퀀스데이터를 가지고 분석하는 여러 가지 툴들을 다뤄보\n고, 이를 통해 실제 분석하는 것으로 진행합니다.\n-  바이오메디컬공학특강: 바이오메디컬공학 분야와 연관된 산업체, 연', '잘해야 하나요?\nA3.  수학은 반도체공학의 기초 학문으로서 필요합니다. 고교 수학이 준\n비가 미흡한 학생들을 위해 1학년 교양으로 수학을 배우게 합니다. \n현재 우리 대학교에서는 어문계 학생들도 공학 관련 복수전공 및 부\n전공을 선택하고 있습니다. 따라서 수학 과목들을 성실히 배울 자\n세가 있는 학생이라면, 누구나 반도체공학에 도전할 수 있습니다.\nDivision of Semiconductor and Electronics Engineering\n(Electronics Major)\n반도체전자공학부\n(전자공학전공)\n전화번호 031-330-4094\n홈페이지 ee.hufs.ac.kr\n전공소개 \n반도체전자공학부의 전자공학전공은 1993년에 신설된 전자공학과가 \n2024학년도부터 개편된 전공으로서 ‘국제적 감각과 첨단기술을 주도하\n는 반도체·전자공학 전문가 양성’이라는 교육목표를 가지고 있습니다. 특\n히 반도체/회로설계 분야와 통신시스템 분야에 대한 집중 교육을 실시함\n으로써 시스템반도체 설계와 응용 2024학년도부터 반도체전자공학부로 \n확대됨에 따라 반도체 분야의 이론과 실습 교육을 더욱 강화할 예정이며, \n학생들이 반도체 및 전자공학 전문가로서의 역량을 갖출 수 있도록 돕고 \n있습니다. 특히 반도체전공은 SoC, 메모리, 초고주파 회로 등의 설계를 위\n한 전문 과목을, 전자공학전공은 반도체, 회로, 통신, 신호처리 등의 분야\n에 대해 집중 교육함으로써 학생들은 졸업 후 전자공학 전문가로서 역량\n을 마음껏 발휘할 수 있습니다. \n필요역량 및 소양 \n-  공학의 시작은 호기심입니다. 스마트폰, IoT, 레이더, 스마트 자동차, \n등의 기기에 관심이 많고, 그 기기들의 내부구조나 동작원리가 궁금했\n던 학생이라면 누구든 환영합니다. \n-  교과 측면에서는 전자공학의 출발점인 수학, 물리 과목과, 컴퓨터 활\n용이나 원리에 흥미가 있으면 절반의 가능성은 가진 셈이고, 나머지의 \n절반은 우리 학부에서 함께 채워갈 수 있을 것입니다. \n우리 학과(부)·전공 매력 \n-  반도체전자공학부(전자공학전공)\n-  반도체, 회로설계, 통신시스템에 특화된 커리큘럼 제공\n-  실무·연구 능력 향상을 위한 다양한 인턴 프로그램 제공\n-  국제적 감각을 지니고 첨단기술 개발을 주도하는 전자공학 전문가 양성\n주요 실적 \n-  경기 BRIDGE 사업 참여\n-  체코&공학 글로벌 인턴쉽 프로그램 참여\n-  반도체설계교육센터 IDEC캠퍼스사업 참여', '라 환경공학 분야, 청정에너지 분야, 생명공학 응용분야에 대한 깊이 있\n는 학습을 하게 됩니다. 더불어 교과 시간에 학습한 내용을 토대로 석/\n박사과정의 대학원생들과 함께 구체적인 연구 및 실습을 할 수 있도록 \n교과과정이 편성되어 있으며, 6개의 실험실에서 대학원생과 교수님의 \n지도 아래 연구실험을 할 수 있는 기회가 주어집니다.\n졸업 후 진로 \n-  공기업, 공공기관: 한국환경공단, 국립환경과학원, 한국산업환경기술\n원, 한국석유공사, 한국수자원공사, 한국수력원자력, 한국지역난방공\n사, 대한지적공사, 국립공원관리공단 등\n-  일반기업: 삼성전자, LG화학, SK네트웍스, 현대중공업, 대한항공, 웅\n진케미칼 등\n-  기타 국내외 대학원 진학\nQ&A \nQ1. 환경학을 공부하기 위해 특별히 공부해야 할 기초 과목들이 있나요?\nA1.  환경학 과목은 수학, 화학, 통계 등의 요소와 연결되는 학문이므로 \n기초적인 지식이 있으면 더욱 도움이 됩니다. 물론 고등학교 때 수\n학, 화학 과목에 관심 없는 학생이어도 대학 진학 후 다른 과의 기초\n과목을 함께 수강하면서 공부하면 충분히 가능합니다.\nQ2. 환경학과에 입학하면 취업이 잘 되나요?\nA2.  각 기업의 환경 관련 부서가 하나 이상 있고 연구소, 환경 관련 업체 \n등 다양하게 취업의 문이 열려있으므로 학부 과정을 졸업한 학생들\n도 취업률이 높은 편입니다. 또한 우리 과를 졸업한 선배들이 공기\n업, 대학교수 등 분야별로 포진되어 있기 때문에 후배들에게 더 많\n은 취업의 기회를 주고자 노력하고 있습니다.\nDept. of Bioscience and Biotechnology\n생명공학과\n전화번호 031-330-4272\n홈페이지 bio.hufs.ac.kr\n전공소개 \n20세기 중반 분자생물학의 태동으로 생명체 연구의 패러다임이 바뀌었\n고, 2003년 게놈 프로젝트의 완성은 생명공학의 신기원을 열었습니다. 초\n거대 다국적 제약업체는 물론 국내·외 굴지의 대기업들이 생명공학 분야\n로 사업영역을 확장하는 중입니다. 생명공학은 생명과학에 대한 기본적 이\n해를 바탕으로 다양한 분야에 응용될 수 있습니다. 인간의 건강에 직결되\n는 의약학 분야(Red Biotech), 산업적 소재를 생산하는 공학분야(White \nBiotech), 유용 식물을 연구하는 농업 분야(Green Biotech), 그리고 해양\n자원분야(Blue Biotech)가 대표적인 예입니다. 지난 20여 년간 IT가 인류', '들이 담당할 핵심분야는 의료영상시스템/바이오시스템 개발, 의료영상 \n분석을 위한 알고리즘 개발, 디지털헬스케어 시스템 구축, 의료용 로봇 \n등의 기기 개발과 관련한 설계 및 제조에 이릅니다.\nQ&A \nQ1.   바이오메디컬공학부에서는 하드웨어와 소프트웨어 중에 어떤 분야\n를 주로 배우게 되나요?\nA1.   바이오메디컬공학분야에서의 하드웨어는 진단, 치료, 웰니스기기 \n등을 포함하고, 소프트웨어는 의생명데이터, 생체(영상 또는 비영\n상)신호데이터의 분석 및 활용 등을 포함합니다. 바이오메디컬공학\n부에서는 하드웨어와 소프트웨어 분야를 함께 교육합니다. 앞으로\n는 하드웨어와 소프트웨어 분야의 융합을 통해 더 큰 가치를 창출\n할 수 있을 것으로 기대되고 있습니다. 물론, 본인의 적성에 맞추어 \n하드웨어 또는 소프트웨어 분야의 트랙으로 전공과목을 집중하여 \n들을 수도 있습니다.\nQ2.  생명정보학이라는 분야는 무엇이며 실제로 어떤 일을 하게 되나요?\nA2.  생명정보학이라는 분야는 이름에서 알 수 있듯이 의생명 데이터라\n는 정보를 분석하여 새로운 정보를 찾아내는 학문이라고 생각할 수 \n있습니다. 의생명 데이터라는 것이 단순히 DNA와 같은 유전체 데\n이터를 넘어서, DNA, RNA, Protein, microbiome (장내 미생물) \n등에 대한 연구를 포괄한다고 할 수 있습니다. 예를 들면, DNA를 분\n석하여, 유전 질환 관련 변이를 찾아내어 질병의 정확한 진단에 이\n용한다던지, 맞춤형 의료 혹은 정밀 의료라고 일컫는, 즉, 각 개인의 \ngenotype에 따른 치료법을 제시해주는 연구들이 요즘 중요시되고 \n있고, 생명정보학이 이러한 분야를 포괄한다고 말할 수 있습니다. \nQ3.  인공지능은 의료영상처리 분야에서 어떻게 활용될 수 있나요?\nA3.  MRI, CT, x-ray, ultrasound, pathology 등 다양한 종류의 의료영\n상데이터를 생성하는 과정에서도 인공지능이 적용이 될 수 있습니\n다. 인공지능기법을 적용하여 영상의 획득시간을 단축시킬 수도 있\n고, 의료영상의 품질을 관리 및 평가하거나 향상시킬 수도 있습니\n다. 또한, 기존 의료영상데이터로부터 진단에 도움이 되는 정보를 \n추출하는 데에 적용이 될 수 있습니다. 다른 측면으로는 사람의 이\n해하기 어려운 고차원 데이터에 대한 분석을 통해 새로운 정보를 효\n과적으로 추출하는 데에 활용이 될 수도 있습니다.\n글로벌캠퍼스 GLOBAL CAMPUS', '5554\n전공소개 \n디지털콘텐츠학부는 현대의 글로벌한 디지털콘텐츠 산업 분야에서 독\n자적으로 활동할 수 있는 능력을 갖춘 콘텐츠 전문가를 양성하는 데 교\n육 목표를 두고 있습니다. 이를 위해 학생이 호기심을 키우고, 창의성을 \n발휘하고, 세계 시민으로서 책임의 정신을 기를 수 있도록 하는 내실화\n된 교육 커리큘럼을 제공합니다. 학생은 콘텐츠와 테크놀로지 기반의 \n지식과 정보를 습득하고 실무를 위한 실습 활동에 참여할 수 있습니다. \n학생은 이러한 기회를 통해 우리 학부의 커리큘럼 내에서 디지털콘텐츠 \n전반에 관한 핵심적인 역량을 쌓을 수 있습니다. 졸업 이후 콘텐츠 기획 \n및 제작, 개발 분야를 넘어서 콘텐츠 유통•투자•정책 결정, 콘텐츠 비\n즈니스 등 다양한 영역으로 무한하게 뻗어나갈 수 있는 발판을 제공하\n고자 합니다. 나아가, 최근 AR, VR, AI 등 새로운 기술의 도입으로 디지\n털콘텐츠가 더욱 혁신적인 방향으로 발전하는 상황 속에서, 이에 걸맞\n은 인재로 성장할 수 있도록 노력하고 있습니다. \n필요역량 및 소양 \n-  디지털콘텐츠 전반에 대한 관심을 가지고, 이에 몰입할 수 있는 역량\n이 필요합니다.\n-  디지털콘텐츠의 제작과 분석 역량을 함양할 수 있도록 창의성과 논리\n성을 발휘할 수 있는 적극적인 태도가 필요합니다.\n-  디지털콘텐츠 산업은 현재도 급변하고 있기에, 새로운 지식을 습득하\n고 변화에 빠르게 적응할 수 있는 열린 자세가 필요합니다.\n-  디지털콘텐츠 관련 테크놀로지에 대한 관심으로 기술과 공학을 접목\n할 수 있는 역량이 필요합니다.\n우리 학과(부)·전공 매력 \n-  디지털콘텐츠와 테크놀로지를 이끌어 갈 세계 시민 양성\n-  디지털콘텐츠의 최신 트렌드와 지식을 반영한 교육과정 운영\n-  디지털콘텐츠 산업과 밀접한 협력 체계를 갖춘 실무 연계 교육기회 \n제공\n-  디지털콘텐츠 전문가로서 글로벌 역량을 갖춘 인재로 성장할 수 있는 \n독자적인 프로그램 제공\n주요 전공과목 \n-  비주얼콘텐츠: 비주얼콘텐츠의 동향과 장르를 비평적으로 분석하며, \n이를 통해 비주얼 스토리 작성에 필요한 통찰력을 키울 수 있도록 합\n니다. 뿐만 아니라, 최신 비주얼콘텐츠 제작 기술을 이해할 수 있는 기\n회를 제공하는 수업입니다. 나아가, 시각언어의 의미론적인 측면을 탐\n색하고, 이러한 이론적 기반 위에서 창의적인 비주얼콘텐츠를 제작하\n기 위한 능력을 함양할 수 있습니다.', '1514\n전공소개 \n체코·슬로바키아학과는 체코어와 슬로바키아어를 교육하는 국내 유일\n의 고등교육 기관으로 어문학, 지역학을 비롯한 다양한 문화를 공부할 \n수 있는 곳입니다. 안정된 정치, 경제적 기반과 높은 문화 수준을 자랑하\n는 체코와 슬로바키아는 한국과의 정치, 외교, 경제, 문화를 비롯한 다양\n한 글로벌 이슈에 있어 긴밀한 협력관계를 맺고 있으며, 우리 학과는 양\n국 관계에 있어 중요한 역할을 담당하는 글로벌 전문가를 양성하는 기\n관입니다. 전공자들은 두 개의 특수외국어 습득을 위한 체계화된 교과\n과정들과 해외연수, 인턴십 등의 다양한 교육프로그램들을 이수하게 됩\n니다. 체코어와 슬로바키아어 학습, 문학을 포함한 문화와 지역에 대한 \n전문적인 내용을 공부하므로 특수외국어에 관한 관심과 해당 지역에 대\n한 흥미가 있으면 좋습니다.\n필요역량 및 소양 \n-  교과의 측면에서는 인문학적 소양을 위한 체코와 슬로바키아에 대한 \n역사와 사회문화에 관한 관심을 가지고 준비하고, 전공과 관련한 다양\n한 문학작품 등의 저서를 읽는 것도 좋습니다. \n-  체코와 슬로바키아에 관한 지역전문가 양성에 필요한 지역에 대한 다\n양한 정보를 찾아보고 숙지하는 올바른 이해 역시 중요합니다. \n-  체코·슬로바키아학과에는 공학도와 함께 공부하고, 해외에서 현장실\n습을 진행하는 융복합 과목이 있으므로 이런 과목에 관한 관심도 필\n요합니다. \n우리 학과(부)·전공 매력 \n-  체코와 슬로바키아 관련 국내 유일의 어문학 및 지역학 전문가 양성\n-  체계화된 교과과정과 다양한 비교과 과정을 통한 통합적 교육\n-  산업경영공학과, 전자공학과와 함께하는 캡스톤 수업을 통한 융복합 \n교육\n-  해외 진출 국내 유수 기업에서의 인턴십 운영\n주요 실적 \n-  2022학년도/2023학년도 대학혁신사업 HUFS 학과 특성화 프로그\n램 진행 \n-  동유럽발칸연구소 “인문사회연구소 사업단” 참여\n-  동유럽발칸연구소 운영 참여\n-  체코문화원과 함께 ‘수사나 로드(Susanna Roth) 세계 체코문학번역\n대회’ 한국 주관 기관 \n주요 전공과목 \n-  체코·슬로바키아 어학: 체코어와 슬로바키아어를 문법, 회화, 통번역 \n연습 등을 통해 기초부터 체계적으로 배워서 최종적으로 체코어와 슬\n로바키아어를 이해하고 활용할 수 있도록 합니다. \n-  체코·슬로바키아 문학: 체코·슬로바키아 문학에 대한 지식을 통시적', '3736\nDept. of Environmental Science\n환경학과\n전화번호 031-330-4270\n홈페이지 envi.hufs.ac.kr\n전공소개 \n환경학이란 인류의 삶의 질 향상과 지속가능한 발전을 궁극적 목표로 하\n는 학문으로 생물학, 화학, 물리학, 통계학, 공학 등 다양한 학문 분야를 \n포함하는 종합 학문의 성격을 띠고 있습니다. 산업이 다양화·고도화되\n면서 각종 환경문제가 야기됨에 따라 환경오염의 심각성이 인식되고 있\n고 환경보전에 대한 인류의 관심이 점차 심화되고 있습니다. 환경은 인\n간이 살아가는 데 있어서 생활 전반에 중요한 부분을 차지하고 있으며 \n이제 지구온난화·물 부족 등의 환경문제는 어느 한 지역 또는 한 국가에 \n국한되는 국지적, 지역적 차원의 문제가 아니라 범지구적 차원의 문제\n라고 할 수 있습니다. 이로 인해 환경 관련 기술 개발을 위한 투자와 전\n문지식을 가진 환경기술자의 사회적 요구가 나날이 증가하고 있기 때문\n에 향후 무궁무진한 비전을 가진 학문이라 할 수 있습니다.\n필요역량 및 소양 \n-  환경학은 평소 환경에 대한 많은 관심과 사명감이 있고 지적 호기심을 \n가진 학생이라면 누구든지 접할 수 있는 학문입니다. \n-  환경학에 필요한 적성은 환경 분야에 조금이라도 관심을 갖고 있고 과\n학, 수학 과목을 특히 좋아하면 쉽게 배울 수 있는 학문입니다. \n-  기초이론을 공학적으로 응용할 수 있는 사고력과 응용력이 요망되며 \n응용 분야가 광범위하여 환경학 전반을 이해할 수 있는 폭넓은 시야를 \n가진다면 학습의 동력이 배가될 것입니다.\n우리 학과(부)·전공 매력 \n-  대기, 수질, 생물 등 5개의 실험실을 운영하여 심도깊은 연구를 할 수 \n있는 기회 제공\n-  각종 환경오염분석/방지기기를 경험해 볼 수 있는 교과과정 운영\n-  환경공학뿐 아니라 환경정책에 관한 사회적 시각을 넓힐 수 있도록 외\n부전문가 초청강연의 기회 제공\n-  취득가능한 자격증: 대기환경기사(한국산업인력공단), 수질환경기사(\n한국산업인력공단), 폐기물처리기사(한국산업인력공단), 토양환경기\n사(한국산업인력공단) 등\n주요 실적 \n-  연 1회 환경학과 졸업생분들과 함께하는 동문모임을 개최하여 취업 등\n의 정보를 제공합니다.\n-  외국인 교수님의 영어수업으로 양질의 강의를 수강할 수 있습니다.\n-  트랙별 교과과정을 운영하여 1학년을 마치고 2학년 때부터 원하는 분\n야의 과목을 집중적으로 수강할 수 있습니다.', '통해 다채로운 한국문화 관련 세부 전공을 개척해 나갈 수 있습니다. \nQ3. 한국어 교원 자격증이 무엇인가요? \nA3.  한국어 교원 자격증은 국립국어원 주관하에 문화체육관광부에서 \n부여하는 자격증으로서 한국어가 모국어가 아닌 외국인이나 다문\n화가정을 대상으로 한국어를 가르칠 수 있는 자격증입니다. 한국학\n과 내의 일정 영역별 학점을 이수하면 국내외에서 한국어 교사로 활\n동할 수 있는 한국어교원 자격증을 취득할 수 있습니다. \n글로벌캠퍼스 GLOBAL CAMPUS\n경상대학\nGlobal Business & Technology학부 28\n국제금융학과 30\nCOLLEGE OF ECONOMICS\nAND BUSINESS', '1312\n전공소개 \n2007년 유럽연합 회원국이 된 루마니아(인구: 8위, 국토면적: 9위)는 ‘\n유럽의 보석’이라 불릴 정도로 아름다운 자연환경과 풍부한 천연자원으\n로 동유럽 국가 중에서 경제적 성장잠재력이 가장 높은 나라로 주목받\n고 있습니다. 1987년 설립된 루마니아학과는 루마니아(Romania)와 몰\n도바(Moldova)공화국의 어문학 및 지역학을 공부할 수 있는 국내 유일\n의 고등교육기관입니다. 라틴어에 뿌리를 둔 루마니아어의 실질적인 구\n사력 및 문헌 이해 능력의 배양과 더불어 루마니아 지역학 관련 지식의 \n습득으로 현지에 특화된 전문가를 양성하고 있습니다. 우리나라의 공기\n업을 비롯한 대기업과 중소기업들이 판매 및 제조법인 등 다양한 형태로 \n루마니아에 투자하거나 사업진출을 도모하고 있습니다.\n필요역량 및 소양 \n교과의 측면에서는 발칸반도, 나아가 동부 유럽에 대한 역사와 문화에 \n대해 관심을 갖고 특히 루마니아의 역사와 사회문화에 대해 흥미를 가\n지고 있으면 좋습니다. 또한 전공과 관련해서 문학, 지역학 등 다양한 분\n야의 서적을 읽는 것도 도움이 됩니다. 이는 단순히 언어만 배우는 게 아\n닌 루마니아의 문화, 정치, 역사 등 다양한 분야에 대해 입학 후 배우기 \n때문입니다. 아울러, 언어적인 측면에서는 루마니아어를 모르더라도 새\n로운 언어를 배우는 데에 두려움을 갖지 말고 호기심을 가지고 적극적\n인 자세를 함양하는 게 도움이 되리라 생각합니다.\n우리 학과(부)·전공 매력 \n-  루마니아어는 동유럽 유일의 라틴 로망스어로 이태리어, 프랑스어, \n스페인어와 유사\n-  루마니아를 포함한 중부유럽 전체를 조망하며 국내외 연구기관과 유\n기적 연계\n-  루마니아 진출 및 유관 한국기업과의 협업\n-  취득 가능한 자격증: 유럽 언어 공통 기준(Common European \nFramework of Reference for Languages, CEFR by CE) 평가등급, \nFLEX 루마니아어 졸업인증\n주요 전공과목 \n1학년  루마니아학입문, 기초루마니아어문법작문, 초급루마니아어번역\n연습, 초급루마니아어회화, 초급시청각루마니아어, 초급루마니\n아어문법작문\n2학년  루마니아사정, 중급루마니아어문법작문, 중급루마니아어번역연\n습, 중급루마니아어회화, 루마니아문화, 고급루마니아어문법작문\n3학년  고급루마니아어회화, 루마니아 문학사, 루마니아 현대문학, 루마', ""과의 협력에 매우 우호적이며, 한국의 문화, 경제, 언어 등에 대한 깊\n은 애정을 갖고 있습니다.\nQ3.  중앙아시아에 직접 갈 수 있는 프로그램에는 어떤 것들이 있나요?\nA3.  학기 중에는 7+1 프로그램과 교환학생 프로그램을 통해 중앙아시아 \n국가 내 현지 대학교에서 수학할 수 있으며, 전략지역 전문가 아너\n스 프로그램을 통해 해외 연수뿐 아니라 현지에서의 해외인턴도 지\n원하고 있습니다. 또한 자비유학과 방학 중에 다녀올 수 있는 단기 \n어학연수 프로그램을 통해 자유롭게 선택하여 다녀올 수 있습니다.\nQ4.  중앙아시아학과에 대한 궁금증이 있다면 어디에 물어볼 수 있나요? \n학과 소식을 접할 수 있는 방법이 있나요?  \nA4.  카카오톡에서 '한국외대 중앙아시아학과'를 검색하여 학과 관련 궁\n금증 및 문의사항을 해결할 수 있습니다. 학과 소식은 네이버 밴드\n에서 '한국외대 중앙아시아학과'에 가입하여 학과 최신 소식을 얻을 \n수 있습니다. 만일 우즈베크어 관련한 학습 기회나 체험 기회 등에 \n대한 정보가 필요하면 네이버 밴드 ‘특수외국어교육진흥사업 우즈\n베크어’에 들러보세요~ \nDivision of African Studies\n아프리카학부\n전화번호 031-330-4242\n홈페이지 hufsafrica.hufs.ac.kr\n전공소개 \n아프리카학부는 국내 유일의 아프리카 관련 고등교육기관입니다. 1983\n년 스와힐리어과에서 시작해 현재까지 40년의 역사를 갖고 있는 아프\n리카학부는 스와힐리(Swahili)어 외에도 하우사(Hausa, 서아프리카)와 \n암하라(Amhara, 에티오피아) 등 아프리카의 주요 언어를 교육하고 있\n습니다. 세 언어는 모두 정부에서 지정한 국가전략 언어에 포함되어 있\n습니다. 스와힐리어과는 1998년 아프리카어과, 2008년에는 아프리카\n학부로 체제를 확장해 주요 아프리카어를 바탕으로 역사학, 문학, 정치\n학, 국제관계학, 경제학, 인류학, 개발학 등 아프리카 대륙을 이해하기 \n위한 필수 교과목을 개설해 아프리카에 관심있는 학생들의 지적 소양을 \n넓혀주고 있습니다. 본 학부 교수진은 아프리카 현지 대학뿐 아니라 영\n국과 미국, 유럽과 일본 등에서 박사학위를 받은 우수인력들입니다. 교\n수진과 아프리카에 열정을 갖고 있는 학생들이 시너지 효과를 일으키고 \n있어 학생들의 만족도를 높여주고 있습니다. \n필요역량 및 소양 \n우리 사회와 교육체계 안에서 아프리카에 대한 인식과 인지도가 떨어지"", '듈 중에서 둘을 더 택해야 합니다. 학생들이 모든 모듈을 완전히 자\n유롭게 선택할 수 있게 하는 것이 궁극적인 목표지만 어느 정도의 \n방향성을 제시하고 교육과정을 안정적으로 유지하기 위해서 현재\n로서는 “언어에서 하나, 나머지에서 둘”을 선택하는 시스템을 운\n영 중이며 선택과정에서 성적과 면담 등 약간의 제약이 있습니다.\nQ4.  융합인재학부에는 모듈도 있고 세부모듈도 있던데 정확히 설명해\n주세요.\nA4.  현재는 5개의 모듈 중 3개가 3~4개의 세부모듈로 나뉘어 있습니\n다. 자신이 선택한 모듈이 세부모듈로 나뉘어 있으면 그 중에 하나\n를 골라야 합니다.\n -  모듈1(통번역: 영어, 아랍어, 중국어)\n -  모듈2(국제전략: 미주·영연방, 중동·이슬람, 중화권, 이탈리아·EU)\n -  모듈3(문화산업콘텐츠: 테크노미디어디자인, 패션관광문화산업, \n게임한류문화산업)\n -  모듈4(융합비즈니스)\n -  모듈5(ICT & AI)\n  모듈1의 영어통번역, 아랍어통번역, 중국어통번역 또는 모듈2의 이\n탈리아어·EU전략 중 1개는 필수 세부모듈로서 반드시 선택해서 이\n수해야 합니다.\n글로벌캠퍼스 GLOBAL CAMPUS\nCulture & Technology\n융합대학\n디지털콘텐츠학부 54\n투어리즘 & 웰니스학부 56\n글로벌스포츠산업학부 57\nCOLLEGE OF \nCULTURE & TECHNOLOGY']","월요일 7, 8교시에 수강할 수 있는 교양 과목은 다음과 같습니다:

1. **신화와종교**
   - 교수: 강미라
   - 강의실: 2303-3호
   - 학점: 2

2. **제자백가다시읽기**
   - 교수: 이은주
   - 강의실: 2315호
   - 학점: 2

3. **실용스페인어기초다지기**
   - 교수: 이강국
   - 강의실: 1303호
   - 학점: 2

4. **생명과학과불교철학특강**
   - 교수: 김원명
   - 강의실: 4216호
   - 학점: 3

이 과목들은 전공필수가 아니며, 다양한 학문적 배경을 가진 학생들이 수강할 수 있습니다. 혹시 더 도와드릴까요?","월요일 7,8교시에 들을 수 있는 교양 과목에는 '인간과 사회', '대중문화 예술의 이해', '비즈니스협상' 등이 있습니다.",0.0,0.0,1.0,0.7983880254047356
글스산 졸업하면 뭐해?,"['3학년  통번역을 중점적으로 다루며 졸업시험을 위한 FLEX 준비도 시\n작하게 됩니다. \n4학년  인터뷰하기, 이력서 쓰기, 계약 서류 작성하기와 같은 실용 그\n리스어·불가리아어를 가르칩니다. 그리스·불가리아에 대한 다면\n적, 다각도적인 심화 교육을 위해 그리스·불가리아 데이터를 활\n용한 빅데이터 분석, 메타버스 활용 수업, 무역 실습 등을 동시\n에 운영합니다. \n졸업 후 진로 \n-  정부 및 공공기관: 대사관, 정부 산하 공기업 및 준정부기관\n-  기업: 국내, 아테네 및 소피아 소재 대기업, 방송사, 항공사, 언론사, \n광고·PR사, IT 등\n-  학계: 대학교수, 국내외 연구기관 연구원, 국내외 석·박사 진학\n-  창업: 한국-그리스, 한국-불가리아 수출입 및 이커머스 기업 창업', '을 공부해 두는 것이 좋습니다. 졸업 후 취업 또는 진학에 관계없이 영어 \n구사 능력은 항시 요구되므로 대학 입학 이후부터 읽기, 듣기, 말하기, \n쓰기 모든 분야에서 영어 능력을 지속적으로 계발하는 것이 매우 중요\n합니다. 고학년 기간에는 이론적인 지식이 아니라 연구실 인턴을 통해 \n관심분야의 연구를 경험해보며 자신의 진로를 준비하는 것이 좋습니다.\n졸업 후 진로 \n-  기업체: 석유화학, 반도체/전자, 에너지, 신소재, 재료, 바이오, 의료 및 \n제약, 화장품 및 식품 분야\n-  정부 및 공공기관: 국가/지방 공무원 및 정부 산하 공기업\n-  학자 및 연구직: 대학 교수, 국공립연구소 및 정부 출연 연구소, 기\n업 연구소\n-  기타: 교사(교직이수), 창업\nQ&A', '네 분야 중 학생이 선택한 분야에 초점을 맞추어 강의를 듣게 됩니다.\n3학년  2학년에 수강한 분야들 중 하나 혹은 두 분야에 초점을 맞추어 수\n업을 들으면서 졸업논문 프로젝트를 위한 강의도 수강하게 됩니다.\n4학년  실습이나 연습 과목 위주로 수강하면서 졸업논문 계획서 제출, \n졸업논문 작성 및 완성본 제출을 하게 됩니다.\n졸업 후 진로 \n-  기업: 마케팅, 콘텐츠 비즈니스, 콘텐츠 기획, 해외전략기획 \n-  공기업: 관광, 민간외교, 문화교류, 전시, 기록관리 \n-  대학원: 국제대학원, 일반대학원의 한국어교육 및 한국학 관련 학과 \nQ&A \nQ1. 한국학과 학생들은 졸업 후 주로 어떤 분야로 진출하나요? \nA1.  한국학과 졸업생들은 학과에서 이수한 전공 교육에 기초하여 국내·외', '전공 공부에 도움이 됩니다. \n2학년  자연스럽고 유창한 그리스어·불가리아어 구사 능력을 기르기 위\n해 회화, 강독 심화 과목을 수강하게 됩니다. 언어와 더불어 기본\n적인 문화에서 더 나아가 역사, 지중해 유산, 지리연구 등 지역학 \n과목을 함께 수강합니다.\n3학년  통번역을 중점적으로 다루며 졸업시험을 위한 FLEX 준비도 시\n작하게 됩니다. \n4학년  인터뷰하기, 이력서 쓰기, 계약 서류 작성하기와 같은 실용 그\n리스어·불가리아어를 가르칩니다. 그리스·불가리아에 대한 다면\n적, 다각도적인 심화 교육을 위해 그리스·불가리아 데이터를 활\n용한 빅데이터 분석, 메타버스 활용 수업, 무역 실습 등을 동시\n에 운영합니다. \n졸업 후 진로 \n-  정부 및 공공기관: 대사관, 정부 산하 공기업 및 준정부기관\n-  기업: 국내, 아테네 및 소피아 소재 대기업, 방송사, 항공사, 언론사, \n광고·PR사, IT 등\n-  학계: 대학교수, 국내외 연구기관 연구원, 국내외 석·박사 진학', '본인의 관심과 희망에 따라 그리스학 또는 불가리아학을 직접 선택\n합니다. 그리스학 전공생과 불가리아학 전공생 모두 원하는 수업을 \n수강할 수 있도록 언제나 강의실의 문은 열려있습니다.\nQ3.  졸업 후 어떤 분야로 진출할 수 있나요?\nA3.  졸업 후에는 그리스나 불가리아에 소재한 국내 대기업의 현지법\n인, 무역 통상 관련 기관이나 기업으로 취업이 용이합니다. 또한 양\n국 주재 대사관 또는 국가공무원, KOTRA, 상공회의소 등으로 진로\n를 정할 수 있습니다. 각 기업에서는 한국에 유일하게 존재하는 그\n리스·불가리아학과를 졸업한 것에 좋은 인상을 가지고, 도전정신을 \n높이 삽니다. 교육이나 연구 분야에서는 국내외 대학교 교수, 유럽 \n지역 문화, 외교 안보 분야 및 에너지 분야에 연구원으로 진출할 수 \n있습니다. 이외에도 국내 유수의 금융기관, IT기업, 항공해운기업, \n언론 방송 분야에서 활동할 수 있습니다. \nQ4.  그리스·불가리아학과에 대한 자세한 정보를 얻을 수 있나요?', '리합니다. 또한, 어학 이외에도 언론, 상경, 사회, 이공계열을 자유\n롭게 부전공, 제2전공 및 복수 전공으로 하여 철학적 사고력을 바\n탕으로 다른 전공에서 실력을 발휘하여 다양한 분야에 진출할 수 \n있습니다. 1988년 교직 과정 인가 이후 많은 동문이 교사 자격증\n을 취득하고 학교 선생님을 하고 있으며, 또 2007년 논술 교육인\n증 프로그램 실시 이후 많은 학생들이 이 자격을 동시에 취득하고 \n졸업하고 있습니다. 특히 논술 교육인증 프로그램은 국내 최초로 \n실시하여 앞으로 MEET, LEET 및 각종 공무원 시험에서 실시되는 \n논술 및 추리논증 시험을 대비하는 데에도 유리합니다.\nQ3.  철학과를 졸업하면 무엇을 하나요?\nA3.  철학과 졸업생들은 전공 공부를 통해 사물을 종합적으로 바라보면', '해결하세요. 처음에는 힘들고 오랜 시간이 걸리겠지만, 이러한 어려\n움 통과해야 성장하고 시대가 요구하는 인재가 되는 것입니다.\n3.  산책 등 스스로 생각하는 습관을 만들고 동시에 글쓰기 실력을 기르\n세요. 한편, ChatGPT에게 다양한 질문과 요구를 연습하는 것도 논리\n적으로 생각을 정리하여 표현하는 능력을 기르는 좋은 방법입니다.\n졸업 후 진로 \n수학과 졸업생의 진로를 아래와 같이 크게 세 분야로 나눌 수 있습니다. \n우리 수학과는 항상 시대의 요구를 살펴 학생들이 사회에서 제 몫을 다 \n할 수 있도록 최선을 다해 노력하고 있습니다.\n-   IT 분야: 프로그램 개발자, data engineer, MLOps, data analysis \n수학과 졸업생들은 논리를 전개할 수 있는 능력과 사고력으로 높은 \n수준의 프로그래밍에 강합니다. 우리 과에는 수치해석을 전공하신 교\n수님뿐만 아니라 컴퓨터공학에 전문성을 가지신 교수님도 계셔서 IT \n분야에 진출을 원하는 학생들에게 수준 높은 교육이 가능합니다.\n-  금융 분야: 은행, 증권사, 보험계리사 \n우리 학과에는 금융 수학을 전공하신 두 분의 교수님이 계십니다. 관\n련 학회의 회장을 하시는 등 학계에서 중추적인 역할을 하실 뿐만 아\n니라 다양한 활동을 활발히 하고 계십니다. 그래서 졸업생들이 은행, \n증권사에서 혹은 보험계리사 등으로 왕성하게 활동 중입니다.\n-  교육과 연구 분야: 중-고등학교 교사, 교수 \n평균으로 볼 때 우리 학과는 최근 10년간 임용시험 합격자를 꾸준하\n게 배출하고 있습니다. 또한 미국 명문대학교에서 교수로 활동하고 \n있는 졸업생도 있는 등 교육 분야에서 졸업생들의 활동이 괄목할 만\n합니다. 수학이라는 전공 특성으로 출판 등 다양한 교육계에서 활동\n하는 졸업생들도 많습니다.\nQ&A \nQ1.  수학과를 졸업하면, 진로 선택이 교육과 연구 분야로 제한되나요?\nA1.   수학과 졸업생의 장점은 엄밀한 논리 전개와 사고의 자유로움입니\n다. 기술의 발달로 다양한 분야의 많은 직무가 자동화되어 수준 높\n은 사고를 할 수 있는 인재가 시대의 요구입니다. 이러한 면에서 수\n학과 졸업생은 IT분야뿐 아니라 금융권 등 다양한 분야에 진출하고 \n있습니다. 또한 우리 학과는 졸업생들이 많이 진출하는 금융과 IT \n분야에 맞춤형 커리쿨럼을 제공하고 있습니다.\nQ2. 수학과의 전공 수학은 고등학교 수학과 다른가요?', '을 공부해 두는 것이 좋습니다. 졸업 후 취업 또는 진학에 관계없이 영어 \n구사 능력은 항시 요구되므로 대학 입학 이후부터 읽기, 듣기, 말하기, \n쓰기 모든 분야에서 영어 능력을 지속적으로 계발하는 것이 매우 중요\n합니다. 고학년 기간에는 이론적인 지식이 아니라 연구실 인턴을 통해 \n관심분야의 연구를 경험해보며 자신의 진로를 준비하는 것이 좋습니다.\n졸업 후 진로 \n-  기업체: 석유화학, 반도체/전자, 에너지, 신소재, 재료, 바이오, 의료 및 \n제약, 화장품 및 식품 분야\n-  정부 및 공공기관: 국가/지방 공무원 및 정부 산하 공기업\n-  학자 및 연구직: 대학 교수, 국공립연구소 및 정부 출연 연구소, 기\n업 연구소\n-  기타: 교사(교직이수), 창업\nQ&A \nQ1.  한국외대 화학과에 진학하려고 하는데 영어를 잘해야 하나요?\nA1.   한국외대 화학과에서는 원서 전공 교과목 수업과 영어 졸업논문 발\n표 등을 통해 화학 전문 영어를 습득하게 합니다. 또한, 외국어 대', '기본 지식을 배우고 필요한 기술 및 연구 능력을 배양합니다.\n학과(부) 특별 프로그램 \n-  졸업생들의 정성으로 모은 동문장학금 지급(가계 곤란자와 성적우수자) \n-  매 학기 성적 우수자 장학금 지급\n-  교수-학생, 졸업생-3·4학생 멘토링 프로그램 운영\n-  본교 석·박사과정 진학 시 장학생 우선선발 등(본교 내규에 따름)\n학과(부) 행사 및 동아리 활동 \n-  홈커밍 데이: 재학생과 졸업생 선배님들과의 친목 활동\n-  학회: 관심 있는 분야를 연구, 공부', '수님뿐만 아니라 컴퓨터공학에 전문성을 가지신 교수님도 계셔서 IT \n분야에 진출을 원하는 학생들에게 수준 높은 교육이 가능합니다.\n-  금융 분야: 은행, 증권사, 보험계리사 \n우리 학과에는 금융 수학을 전공하신 두 분의 교수님이 계십니다. 관\n련 학회의 회장을 하시는 등 학계에서 중추적인 역할을 하실 뿐만 아\n니라 다양한 활동을 활발히 하고 계십니다. 그래서 졸업생들이 은행, \n증권사에서 혹은 보험계리사 등으로 왕성하게 활동 중입니다.\n-  교육과 연구 분야: 중-고등학교 교사, 교수 \n평균으로 볼 때 우리 학과는 최근 10년간 임용시험 합격자를 꾸준하\n게 배출하고 있습니다. 또한 미국 명문대학교에서 교수로 활동하고 \n있는 졸업생도 있는 등 교육 분야에서 졸업생들의 활동이 괄목할 만\n합니다. 수학이라는 전공 특성으로 출판 등 다양한 교육계에서 활동\n하는 졸업생들도 많습니다.\nQ&A \nQ1.  수학과를 졸업하면, 진로 선택이 교육과 연구 분야로 제한되나요?', '금을 지급합니다.\n슬기로운 대학생활 \n1학년 과정에서는 자연과학의 필수적인 기초지식과 환경문제와 관련된 \n교양과정을 학습한 후, 2, 3, 4학년 과정에서는 개인의 적성과 관심에 따\n라 환경공학 분야, 청정에너지 분야, 생명공학 응용분야에 대한 깊이 있\n는 학습을 하게 됩니다. 더불어 교과 시간에 학습한 내용을 토대로 석/\n박사과정의 대학원생들과 함께 구체적인 연구 및 실습을 할 수 있도록 \n교과과정이 편성되어 있으며, 6개의 실험실에서 대학원생과 교수님의 \n지도 아래 연구실험을 할 수 있는 기회가 주어집니다.\n졸업 후 진로', '해석하고 실제 물리적 학습 내용을 바탕으로 반도체 등에 적용 가능한 \n기본 지식을 배우고 필요한 기술 및 연구 능력을 배양합니다.\n학과(부) 특별 프로그램 \n-  졸업생들의 정성으로 모은 동문장학금 지급(가계 곤란자와 성적우수자) \n-  매 학기 성적 우수자 장학금 지급\n-  교수-학생, 졸업생-3·4학생 멘토링 프로그램 운영\n-  본교 석·박사과정 진학 시 장학생 우선선발 등(본교 내규에 따름)\n학과(부) 행사 및 동아리 활동 \n-  홈커밍 데이: 재학생과 졸업생 선배님들과의 친목 활동\n-  학회: 관심 있는 분야를 연구, 공부', '슬기로운 대학생활 \n산업공학은 세부 전공의 범위가 넓고 다양합니다. 입학 후 1,2학년은 다\n양한 전공과목을 배우고 이 중에 본인의 적성에 맞는 세부 전공을 찾는 \n과정입니다. 3학년에는 본격적으로 깊은 전공 지식을 배웁니다. 4학년 \n1학기에는 그 동안 배운 전공 지식을 총동원해서 캡스톤디자인 프로젝\n트를 수행합니다. 이 과정에서 이론으로 배운 지식을 실제 문제해결 과\n정에 적용하는 방법을 배우고 더불어 졸업 후 큰 도움이 되는 특허 작성, \n논문/학회 발표, 시스템 제작 등을 수행합니다. 4학년 2학기에는 그 동\n안 배운 지식과 경험을 가지고 관심있는 기업에서 인턴과정을 수행하거\n나 더 깊은 공부를 하기 위한 대학원 과정을 준비합니다.\n졸업 후 진로', '니라 다양한 활동을 활발히 하고 계십니다. 그래서 졸업생들이 은행, \n증권사에서 혹은 보험계리사 등으로 왕성하게 활동 중입니다.\n-  교육과 연구 분야: 중-고등학교 교사, 교수 \n평균으로 볼 때 우리 학과는 최근 10년간 임용시험 합격자를 꾸준하\n게 배출하고 있습니다. 또한 미국 명문대학교에서 교수로 활동하고 \n있는 졸업생도 있는 등 교육 분야에서 졸업생들의 활동이 괄목할 만\n합니다. 수학이라는 전공 특성으로 출판 등 다양한 교육계에서 활동\n하는 졸업생들도 많습니다.\nQ&A \nQ1.  수학과를 졸업하면, 진로 선택이 교육과 연구 분야로 제한되나요?\nA1.   수학과 졸업생의 장점은 엄밀한 논리 전개와 사고의 자유로움입니\n다. 기술의 발달로 다양한 분야의 많은 직무가 자동화되어 수준 높', '-  학계: 대학교수, 국내외 연구기관 연구원, 국내외 석·박사 진학\n-  창업: 한국-그리스, 한국-불가리아 수출입 및 이커머스 기업 창업\n-  금융: 금융권 공기업, 은행, 증권, 투자회사\nQ&A \nQ1.  그리스어, 불가리아어를 전혀 몰라도 입학할 수 있나요?\nA1.  모든 신입생은 알파벳부터 공부하기 시작합니다. 알파벳부터 시작\n해서 외국인과 내국인 교수님이 작문, 문법, 회화, 독해, 통·번역, 실\n무 언어 등으로 나누어 수업을 진행합니다. 학년이 올라감에 따라', '학습을 할 수 있습니다. 그리고 현지에서 어학연수를 통해 그리스어\n와 불가리아어를 배울 수 있습니다.\nQ2.  그리스·불가리아학과에서는 그리스어와 불가리아어를 둘 다 배우\n는 것인가요?\nA2.  두 언어 중 하나를 선택하면 됩니다. 입학 직후, 전공 설명회를 듣고 \n본인의 관심과 희망에 따라 그리스학 또는 불가리아학을 직접 선택\n합니다. 그리스학 전공생과 불가리아학 전공생 모두 원하는 수업을 \n수강할 수 있도록 언제나 강의실의 문은 열려있습니다.\nQ3.  졸업 후 어떤 분야로 진출할 수 있나요?\nA3.  졸업 후에는 그리스나 불가리아에 소재한 국내 대기업의 현지법\n인, 무역 통상 관련 기관이나 기업으로 취업이 용이합니다. 또한 양\n국 주재 대사관 또는 국가공무원, KOTRA, 상공회의소 등으로 진로', '졸업 후 진로 \n1.취업: 학사급 연구원: 기업 및 국가 기관 연구소\n2.진학/연구\n- 대학원 석, 박사 및 석.박 통합과정 진학 또는 해외 대학원 진학\n-  석사 및 박사 학위 취득 후 각각 석사급, 박사급 연구원: 기업, 학교 및 \n국가 기관 연구소\n3.바이오벤처 창업\nQ&A \nQ1. 생명공학과에 입학하려면 영어를 잘해야 하나요?\nA1.  생명공학과 대부분의 수업은 원서로 진행되며, 관련 전문 용어는 영\n어로 배워야 하므로 수업 내용을 잘 이해하기 위해서는 영어 실력이 \n뒷받침되어야 합니다.\nQ2. 생명공학과 졸업 후 취업은 잘 되나요?\nA2.  최근 코로나19 이후 바이오 연구 인력의 중요성은 점점 증가하고 있\n습니다. 생명공학과 졸업 후 제약, 바이오산업과 관련된 다양한 기\n업들에서 일할 수 있습니다.', 'FLEX 대체 ( 교내 )\n\n7. 나 .\n\n서울캠퍼스 시행예정\n\n4. 졸업논문\n\n가 . 졸업논문 작성계획서 제출 마감일 : 2025. 4. 23.( 수 )\n\n※ 졸업논문 제출 마감일은 학과에 문의\n\n나 . 제 1 전공 , 제 2 전공 , 이중전공 : 해당학과에서 배정한 졸업논문 지도교수로부터 졸업논문 작성에 관한 지도를 받아 기일 내에 소속 학과장실에 제출함\n\n다 . 졸업논문의 분량은 200 자 원고지 100 매 이상 분량을 원칙으로 함\n\n라 . 졸업논문을 기한 내에 제출하지 않는 학생은 졸업사정 대상에서 제외됨\n\n※ 졸업논문을 제출하고자 하는 학생은 3 학년 2 학기 초 또는 졸업학기의 직전 학기 초에 졸업논문 작성계획서를 작성하여 소속 학과장실에 제출하여야함', '서 최고라 자부\n-  재학생들 관련 경진 대회 수상 다수(교수진의 전폭적인 지원을 통해 \n졸업 후 취업 가능성 최대화)\n주요 실적 \n-  대학생 산업공학프로젝트 경진대회 최근 5년간 대상 2회 등 다수 수상\n-  산업공학회 석사논문경진대회 최근 5년간 대상, 최우수상 포함 다\n수 수상\n-  INFORMS Analytics & OR Student Team Competition Third \nPrize 2년 연속 수상\n-  국내 대학 산업공학과 중에 각종 학회, 경진대회 압도적인 수상 실\n적 보유\n주요 전공과목 \n-  경영과학 (Operations Research): 선형계획법 및 네트워크 이론을 \n중심으로 결정론적 최적화 이론 및 알고리즘을 학습하고 실제 문제의 \n모형화 방법 및 해법을 배웁니다.', '권기수 교수님은 브릭스 전공 전공 소속입니다.', '그리고 토론 등의 방법으로 수업을 합니다. 철학은 크게 동양철학\n과 서양철학으로 나뉩니다. 동양철학은 분야에 따라 유가철학, 도\n가철학, 불교철학으로 구분되고, 지역에 따라 한국철학, 중국철학, \n인도철학으로 구분됩니다. 동양철학 공부를 위해서는 한문과 중국\n어, 일본어 그리고 영어를 익히는 것이 좋습니다. 서양철학은 주제\n에 따라 논리학, 인식론, 형이상학, 존재론, 윤리학, 현상학, 해석학, \n언어철학, 과학철학, 심리철학, 미학, 수사학, 논술 등으로 구분됩니\n다. 시대적으로 서양고/중세철학, 서양근/현대철학으로 구분되고 \n지역에 따라 독일철학, 프랑스철학, 영미철학 등으로 구분됩니다. \n이외에 영화와 철학, 문학과 철학, 문화와 철학 등의 응용분야를 공\n부합니다. 서양철학 공부를 위해서는 영어, 프랑스어, 독일어, 희랍\n어, 라틴어 등을 익히는 것이 좋습니다.\nQ2.  한국외국어대학교 철학과만의 특징이 있나요?\nA2.  우리 한국외국어대학교 철학과의 특성을 다른 대학교와 비교해 볼 \n때, 철학을 제1전공으로 하면서 세계 모든 나라의 언어를 제2전공\n으로 하는 것이 가능하기 때문에 세계 어떤 문화권 철학도 공부할 \n수 있는 장점이 있습니다. 그래서 유학을 희망하는 학생들에게 유\n리합니다. 또한, 어학 이외에도 언론, 상경, 사회, 이공계열을 자유\n롭게 부전공, 제2전공 및 복수 전공으로 하여 철학적 사고력을 바\n탕으로 다른 전공에서 실력을 발휘하여 다양한 분야에 진출할 수 \n있습니다. 1988년 교직 과정 인가 이후 많은 동문이 교사 자격증\n을 취득하고 학교 선생님을 하고 있으며, 또 2007년 논술 교육인\n증 프로그램 실시 이후 많은 학생들이 이 자격을 동시에 취득하고 \n졸업하고 있습니다. 특히 논술 교육인증 프로그램은 국내 최초로 \n실시하여 앞으로 MEET, LEET 및 각종 공무원 시험에서 실시되는 \n논술 및 추리논증 시험을 대비하는 데에도 유리합니다.\nQ3.  철학과를 졸업하면 무엇을 하나요?\nA3.  철학과 졸업생들은 전공 공부를 통해 사물을 종합적으로 바라보면\n서도 예리하게 분석하는 안목 그리고 창의적 사유력을 기르게 되\n기 때문에 교직을 비롯하여 언론계, PD, 작가 등으로 많이 진출하\n였으며, 기타 일반 기업체, 금융기관, 국가기관, 영화계, 컴퓨터프\n로그래밍 등 매우 다양한 분야에 진출하고 있습니다.', '4학년  전공심화과목을 수강하고, 본인 진로와 관련된 강좌를 집중적으로 \n이수합니다. 학과 전임교수의 지도하에 졸업논문을 작성합니다. \n졸업 후 진로 \n-  정부 및 공공기관: 국공립 박물관의 학예직공무원, 국가기록원 및 지\n자체·대학역사관의 기록연구사, 공무원 등\n-  교육 및 연구: 대학교수, 역사교사, 역사문화 관련 연구소 및 박물관\n의 큐레이터 등\n-  기업체: 일반기업체 및 벤처기업 회사원\n-  기타: 문화예술종사자, 프로그래머 등\nQ&A \nQ1.  역사학을 공부하려면 암기력이 중요한가요?\nA1.  꼭 그렇지만은 않습니다. 역사학은 사료를 검증, 분석하고, 추론하\n면서 역사의 지속과 변화를 탐구하는 학문입니다. 우리 사학과에서 \n공부하면서 이러한 학술적 능력과 함께 창의력을 체계적으로 함양\n할 수 있습니다.\nQ2.  사학을 공부하고 졸업하면 순수한 학술연구 외에 전공 관련해서 \n어떤 일을 할 수 있나요?\nA2.  적지 않은 졸업생들이 기록연구사, 역사교사, 학예연구원 등으로 \n활발하게 활동하고 있습니다. 최근에는 역사콘텐츠의 중요성이 제\n고되면서, 문화예술, 게임분야에서 활약하는 졸업생들도 늘어나\n고 있습니다. \n학과(부) 행사 및 동아리 활동 \n-  동사무소(동양철학): 공자, 맹자 등 특정 철학자의 사상에만 국한되지 \n않고, 전반적인 동양 철학사의 흐름과 이에 따른 사상적 차이들을 학\n습하며 이에 대한 의견을 학회원들끼리 토의합니다.\n-  엑스페르고(서양철학): 혼자 읽고 이해하기엔 버거운 여러 철학 고전 \n서적들을 함께 읽어나가며 자유롭게 토론합니다. 이를 통해 철학자들\n의 사유를 이해하고 비판적 시각을 통해 스스로의 철학적 사유를 기르\n는 훈련을 할 수 있습니다.\n-  앤솔로지(예술철학): 아름다움과 예술 이전의 논의들을 학습한 후 현\n대 문화를 파악하는 여러 방법들을 공부합니다.\n-  LOPES(서양철학사&데이터분석): 영어 원문 번역방식의 서양철학사 \n스터디와 데이터 분석을 통해 통계분석용 프로그램 및 다양한 데이터 \n분석기법과 머신러닝 같은 기술 등을 학습합니다.\n-  철학인의 밤: 학생들의 학술 세미나 및 친목 활동 \n-  철학과 한마당 행사: 연말 중 시행되는 철학과 선배, 교수님들이 함\n께하는 행사로 다양한 이벤트 등과 함께 선배, 교수님과 담소를 나누\n는 친목 활동 \n-  한국외대 총장배 토론대회: 2008년도부터 시작된 토론대회로 인문', '2026년 전기 학위수여식 일정:\n2026-02-20 (금요일)', '## [paragraph] ##\n※ 각 교과목은 3학점/3시간으로 구성\n\n## [list] ##\n- - 공통기초과목은 교양과목으로서 학생들은 컴퓨팅사고를 수강해야 함\n- - 전공 교과목은 AI융합전공 공통 및 Software&AI트랙(A), BME학부(B), 컴퓨터공학부\n- (C), 융합형 교과목(I, II) 영역으로 구성됨\n- - 자료구조는 1학기는 컴퓨터공학부, 2학기는 AI융합전공에서 선택(중복불가)\n- - 캡스톤설계 I은 AI융합전공 Software&AI 트랙 1학기에 개설하는 종합설계, BME전공\n- 1학기에 개설하는 BME캡스톤디자인실습, 컴퓨터공학전공에 매학기 개설하는 캡스톤\n- 설계 중에서 선택\n\n## [footer] ##\n- 55 -', '## [paragraph] ##\n- 전공 교과목은 AI융합전공 공통 및 Software&AI트랙 개설교과목이나, BME학부 개설\n교과목이나, 컴퓨터공학부의 개설 교과목을 이수함으로써 <바이오데이터사이언스>\n전공 학점을 충족시킬 수 있음.\n\n## [list] ##\n- ‧ AI융합전공 공통 및 Software&AI에서 개설되는 교과목(A)은 위에서 지정된 과목\n- 이외의 교과목은 지도교수의 승인에 의해 (A) 영역 교과목으로 인정받을 수 있음.\n- ‧ 바이오메디컬공학전공에서 개설되는 교과목(B)은 위에서 지정된 과목 교과목은 지도\n- 교수의 승인에 의해 (B) 영역 교과목으로 인정받을 수 있음.\n- ‧ 컴퓨터공학전공에서 개설되는 교과목(C)은 위에서 지정된 과목 이외의 교과목은\n- 지도교수의 승인에 의해 (C) 영역 교과목으로 인정받을 수 있음.\n\n## [paragraph] ##\n- ‘전공’ 인정과목\n\n## [list] ##\n- ‧ 운영학과(BME학부, 컴퓨터공학부, AI융합전공 공통 및 Software&AI)에 개설된 유사\n- 과목(주임교수 사전 승인)\n- ‧ 2학점의 관련 과목이 3학점인 ‘언어와공학’의 선택과목으로 인정될 때는 2학점만\n- 이수한 것으로 인정. 단, 2학점인 과목은 ‘언어와 공학’의 필수과목으로 인정될 수는 없음\n\n## [paragraph] ##\n4) 학생 선발\n\n## [paragraph] ##\n- 바이오데이터사이언스 융합전공은 모든 전공의 학생들이 선택할 수 있음. 각 전공의\n학생들이 이 융합전공을 이수하는 방식은 다음과 같음\n\n## [paragraph] ##\n<바이오데이터사이언스> 전공이수 방식', '## [paragraph] ##\n4) 학생 선발\n\n## [paragraph] ##\n- 바이오데이터사이언스 융합전공은 모든 전공의 학생들이 선택할 수 있음. 각 전공의\n학생들이 이 융합전공을 이수하는 방식은 다음과 같음\n\n## [paragraph] ##\n<바이오데이터사이언스> 전공이수 방식\n\n## [table] ##\n| 학생 구분 | 수강 과목 | 기대 효과 |\n| --- | --- | --- |\n| SW 전공학생 (컴퓨터공학부, 정보통신공학과) | SW 전공 57학점 SW 영역 추가 21학점 바이오메디컬영역 21학점 | - SW 영역 교과목 78학점 이수 - 바이오메디컬영역 21학점 이수 - SW 전공 과목을 <전공> 또는 <이중전공>으로 구분할 수 있음 |\n| 바이오메디컬전공 학생 | BME 전공 57학점 바이오메디컬영역 21학점 SW 영역 21학점 | - 바이오메디컬 영역 78학점 이수 - SW 영역 21학점 이수 - BME 전공 과목을 <전공> 또는 <이중전공>으로 구분할 수 있음 |\n| 기타 전공 학생 | 본인 전공 54학점 바이오데이터사이언스 42학점 | - 바이오데이터사이언스 융합전공 42학점 이수 |\n\n## [paragraph] ##\n5) 졸업 요건 : 졸업논문 심사(지도교수가 배정되어 졸업 논문을 지도함)\n\n## [list] ##\n- 6) 문의처 : 바이오메디컬공학부(031-330-4723)\n\n## [footer] ##\n- 56 -', '## [heading1] ##\n# ⑩ AI융합전공(Software&AI, Language&AI, Business&AI 트랙)\n\n## [heading1] ##\n# ※ 신규신청 불가\n\n## [heading1] ##\n# (1) 개요 및 교육목표\n\n## [paragraph] ##\n미래 산업이 AI 기반의 소프트웨어 중심으로 재편되면서 AI-SW 인재 양성이 국가적 핵심과제가\n되었고, 특히 소프트웨어 개발 능력과 함께 언어, 문화, 경제 등 여러 분야의 지식을 겸비한\n융복합형 전문인력이 요구되고 있다. 이러한 사회적 요구에 부응하여 본 과정은 AI 분야와\n언어, 비즈니스, 공학 지식을 결합한 AI 소프트웨어 융합인재 양성을 목표로 한다. 2학년은\n공통 과정을 이수하며, 3학년 진입 시에 다음 트랙 중 하나를 선택해야 한다.\n\n## [heading1] ##\n# 가. Software & AI 트랙\n\n## [paragraph] ##\n인문학 소양을 갖춘 융합형 IT 전문인력 양성을 목표로 한다. 이를 위해 핵심 소프트웨어\n교과목과 종합설계, 인턴십으로 구성된 교과과정을 중심으로 최근 AI와 관련한 사회적\n요구에 부응하기 위해 데이터사이언스, 빅데이터처리, 기계학습, 딥러닝 등 소프트웨어와\nAI 융합 교육을 제공한다.\n\n## [heading1] ##\n# 나. Language & AI 트랙\n\n## [paragraph] ##\n언어학(Language)과 공학(AI)이 융합된 교육 과정을 통해, 인문·사회 계열의 학생들도\n실용 기술 분야로 진출할 수 있도록 실질적인 도움을 주는 것이 목표이다. 인공지능 기술의\n발전과 함께 차세대 사용자 인터페이스로 떠오르고 있는 음성 언어 및 자연어 처리 기반의\n인터페이스를 실현하는데 필요한, 언어 이론의 과학적 분석 및 데이터 처리 능력을 갖춘\n전문 인력을 양성하기 위한 필수 교육을 제공한다.\n\n## [heading1] ##\n# 다. Business & AI 트랙', '## [heading1] ##\n# 다. Business & AI 트랙\n\n## [paragraph] ##\nBusiness & AI 트랙은 4차 산업혁명을 대표하는 인공지능(AI)기술의 활용이 다양한 비즈니스\n영역에서 어떻게 기업과 소비자를 변화시키고 있는지 이해하는 것을 목표로 한다. 이를 위해\n경영학 관련 과목과 AI 관련 과목의 단순한 동시 학습이 아닌, 한 개의 과목 안에서 AI\n기술에 대한 이해와 이에 대한 경영학적 접근이 같은 흐름으로 완성될 수 있도록 교과목을\n운영한다. 또한 인턴십, 산학협력 프로젝트 등 다양한 비교과활동을 통해 산업 현장에서\n실제 필요로 하는 지식/기술 기반 교육을 실천한다.\n\n## [paragraph] ##\n(2) 이수자격\n\n## [paragraph] ##\nAI융합전공 진입 시에는 자격 제한이 없음.\n단, 컴퓨터공학부, 정보통신공학과, 산업경영공학과 학생은 Software & AI 트랙을 선택할\n수 없음\n\n## [footer] ##\n- 57 -', '## [paragraph] ##\n(3) 트랙 선택 시기 : 3학년 진입 전 트랙 선택\n※ 이중전공 변경 신청(재학 중 1회만 가능)으로 트랙 변경 가능\n\n## [table] ##\n| 2학년 | 3학년 | 3학년 |\n| --- | --- | --- |\n| 2학년 | 서울캠퍼스 | 글로벌캠퍼스 |\n| AI융합전공 | Language & AI 트랙 (언어공학사) | - |\n| AI융합전공 | Software & AI 트랙 (공학사) | Software & AI 트랙 (공학사) |\n| AI융합전공 | - | Business & AI 트랙 (경영공학사) |\n\n## [heading1] ##\n# (4) 교과과정 및 전공교류 과목', '## [heading1] ##\n# (4) 교과과정 및 전공교류 과목\n\n## [table] ##\n| AI 융합 교과과정 | AI 융합 교과과정 | AI 융합 교과과정 | AI 융합 교과과정 |\n| --- | --- | --- | --- |\n| 학년 | Language & AI 트랙 | Software & AI 트랙 | Business & AI 트랙 |\n| 1 | 컴퓨팅사고(교양), 컴퓨터프로그래밍(교양) | 컴퓨팅사고(교양), 컴퓨터프로그래밍(교양) | 컴퓨팅사고(교양), 컴퓨터프로그래밍(교양) |\n| 2 | 고급파이썬프로그래밍(공통)* 컴퓨터수학(공통)* 언어와논리 확률과통계(공통)* 자료구조(공통) 언어공학개론* 인지과학입문 | 고급파이썬프로그래밍(공통) 컴퓨터수학(공통) 공학설계 컴퓨터논리개론 확률과통계(공통) 자료구조(공통)* 컴퓨터구조 | 고급파이썬프로그래밍(공통)* 컴퓨터수학(공통) Business AI 개론* 확률과통계(공통) 자료구조(공통) 비즈니스애널리틱스1 |\n| 3 | 컴퓨터와언어학* 언어분석을위한프로그래밍* 코퍼스와언어자료 언어데이터분석의기초* 언어분석을위한통계 | 데이터사이언스 알고리즘* 운영체제 데이터베이스 기계학습 컴퓨터네트워크 소프트웨어공학* | 비즈니스 애널리틱스 2 비즈니스데이터베이스 금융공학 이론 및 실습 AI 마케팅 Business AI 사례연구 소셜콘텐츠분석 |\n| 4 | 실용언어처리 언어와 데이터베이스 실용음성처리 언어분석을위한기계학습 | 인공지능 웹프로그래밍 종합설계* 빅데이터 정보보안 | 텍스트마이닝 비즈니스머신러닝 이론 및 실습 비즈니스 딥러닝 Business AI 프로젝트(캡스톤디자인)* |\n| Ÿ *로 표시된 과목은 트랙 필수과목임 | Ÿ *로 표시된 과목은 트랙 필수과목임 | Ÿ *로 표시된 과목은 트랙 필수과목임 | Ÿ *로 표시된 과목은 트랙 필수과목임 |', '## [list] ##\n- 가. <Business & AI> 트랙 전공교류 과목 : Business & AI 전공의 전공교류교과목과 동일\n- 나. <Language & AI> 트랙의 졸업 이수요건에 포함된 언어학기초 과목은 언어 계열 학과에\n- 개설된 언어학 개론 성격의 교과목을 뜻함: 영어학개론, 불어학개론, 독어학개론, 언어학\n- 입문 등의 교과목이며, 2학점 또는 3학점의 1 과목을 이수하면 됨\n- 다. 미네르바 교양대학의 “컴퓨팅사고(3학점)” 또는 “컴퓨터프로그래밍(3학점)” 한 과목만\n- AI융합(공통영역) 전공학점으로 인정\n\n## [footer] ##\n- 58 -', '## [paragraph] ##\n* 2020학번부터 미네르바 교양대학의 “컴퓨터프로그래밍”, “컴퓨팅사고” 이수를 권장함\n(두 과목을 모두 이수하는 경우, 한 과목은 전공교류 이중전공으로 이수하고, 한 과목은\n교양필수로 이수해야 함. 두 과목 중 한 과목만 이수하는 경우 교양필수로 이수해야 함)\n\n## [heading1] ##\n# (5) 수강안내\n\n## [list] ##\n- 가. 트랙 선택 전 공통 과목은 소속 캠퍼스에서 수강\n- 나. 소속 캠퍼스에 개설되지 않은 트랙(<Language & AI>, <Business & AI>)을 선택한 경우에\n- 한해 캠퍼스 교차 수강 가능\n- 다. <Software & AI> 트랙 교과목은 소속 캠퍼스에 개설된 과목 수강\n- 라. 전공 과목은 본 전공생, 해당 학년 우선으로 수강 기회 부여\n\n## [paragraph] ##\n(6) 이수요건 : 총 42학점 이수 및 트랙별 이수요건 충족 필수', '## [paragraph] ##\n(6) 이수요건 : 총 42학점 이수 및 트랙별 이수요건 충족 필수\n\n## [table] ##\n| 트랙 | 졸업요건 |\n| --- | --- |\n| Software & AI | ① 트랙 필수과목 수강 ②  트랙(공통과목 포함)에서 트랙 필수 과목을 포함한 30학점 이상 이수 ③ 졸업논문 통과 - 졸업논문은 <종합설계> 과목(필수)을 이수한 후 다음 학기에 작성 제출함 - 단, 8학기 이상 등록생으로서 부득이한 사유가 인정된 경우, 주임교수의 승인을 얻어 종합설계 수강과 졸업논문 작성을 병행할 수 있음. |\n| Language & AI | ① 트랙 필수과목 수강 ②  트랙(공통과목 포함)에서 트랙 필수 과목을 포함한 33학점 이상 이수, 언어학기초과목(*) 2학점 또는 3학점 이수 ③ 졸업시험 통과 * 언어학기초 과목은 언어 계열 학과에 개설된 언어학 개론 성격의 교과목임 (예 : 영어학개론, 불어학개론, 독어학개론, 언어학입문 등) - 상세 내용은 수강편람 또는 전공 홈페이지 참조 |\n| Business & AI | ① 트랙 필수과목 수강 ②  트랙에서 공통과목, 필수과목을 제외하고 18학점 이상 이수 |\n\n## [heading1] ##\n# (7) 문의처 : AI융합전공(\uf000 http://ai.hufs.ac.kr)\n\n## [table] ##\n| 트랙 | 문의처 |\n| --- | --- |\n| AI융합전공 공통과정 | AI융합전공 사무실 (☎ 02-2173-2643 / Email: aic@hufs.ac.kr) |\n| Software & AI | 컴퓨터공학부 (☎ 031-330-4268 / Email: ces@hufs.ac.kr) |\n| Language & AI | 언어공학연구소 (☎ 02-2173-2872 / Email: langai@hufs.ac.kr) |\n| Business & AI | AI융합전공 사무실 (☎ 02-2173-2643 / Email: bizai@hufs.ac.kr) |\n\n## [footer] ##\n- 59 -', '## [heading1] ##\n# ⑪ Business & AI전공\n\n## [heading1] ##\n# (1) 개요\n\n## [paragraph] ##\n4차 산업혁명과 미래 산업이 AI 기반의 소프트웨어 중심으로 재편되면서, AI 기술과 비즈니스\n지식을 융합하여 혁신적 경영 전략을 설계할 수 있는 전문 인재 양성이 필수적이다. 본 전공은\n인공지능(AI) 기술이 다양한 비즈니스 환경에서 어떻게 활용되어 기업과 소비자 행동을 변화시\n키는지를 이해하며, 이를 기반으로 데이터를 기반으로 한 의사결정, 마케팅 혁신, 프로세스 최적\n화 등 다양한 경영 문제 해결 능력을 개발하며, 글로벌 시장에서 실질적인 비즈니스 가치를 창\n출할 수 있는 융합형 인재를 양성하는 것을 목표로 한다.\n\n## [paragraph] ##\n(2) 교육목표\n\n## [paragraph] ##\n가. AI 기술의 비즈니스 활용 이해\n\n## [paragraph] ##\n- AI 기술이 다양한 비즈니스 분야에서 제공하는 데이터 기반 의사결정과 프로세스 혁신\n의 가능성을 이해하고, 이를 실제 경영 환경에서 적용할 수 있는 능력을 배양한다.\n\n## [heading1] ##\n# 나. 통합적 사고 및 실무 능력 배양\n\n## [paragraph] ##\n-\n\n## [paragraph] ##\n경영학과 AI 기술을 단순히 독립적으로 학습하는 것을 넘어, 각 과목에서 AI 기술에 대\n한 이해와 경영학적 접근을 통합적으로 다룰 수 있는 교과과정을 통해 통합적 사고 능\n력을 함양한다.\n\n## [paragraph] ##\n(3) 학생선발\n\n## [paragraph] ##\n모든 전공의 학생들이 선택할 수 있음.\n\n## [paragraph] ##\n(4) 교과과정\n\n## [heading1] ##\n# 가. 교과 목록', '## [paragraph] ##\n(3) 학생선발\n\n## [paragraph] ##\n모든 전공의 학생들이 선택할 수 있음.\n\n## [paragraph] ##\n(4) 교과과정\n\n## [heading1] ##\n# 가. 교과 목록\n\n## [table] ##\n| 학년 | 교과목명 |\n| --- | --- |\n| 2 | Business AI 개론* 비즈니스인공지능수학 비즈니스 애널리틱스 |\n| 3 | 고급 비즈니스 어낼리틱스 실습 금융공학 이론 및 실습 비즈니스데이터베이스 소셜콘텐츠분석 AI마케팅 Business AI 사례연구 빅데이터분석 |\n| 4 | 텍스트마이닝 비즈니스 머신러닝 이론 및 실습 비즈니스 딥러닝 비즈니스 시계열 분석 Business AI 프로젝트 실습 (캡스톤디자인) |\n\n## [paragraph] ##\n* 전공필수 교과목\n\n## [footer] ##\n- 60 -', '## [heading1] ##\n# 나. 주요 공지 사항\n\n## [list] ##\n- - 2학년 교과목중에서 ⸢고급파이썬프로그래밍⸥, ⸢자료구조⸥, ⸢확률과 통계⸥는 소속 캠퍼스\n- AI융합전공에서 개설되는 전공교류과목(아래 전공교류과목 참고)을 수강\n- - 2025학년도 1학기부터 개설되는 교과목은 양캠퍼스 교차수업 형태로 개설 우선\n\n## [paragraph] ##\n(5) 전공교류과목\n가. 서울캠퍼스\n\n## [table] ##\n| 개설학과(전공) | 교과목명 |\n| --- | --- |\n| AI융합전공 | 고급파이썬프로그래밍 컴퓨터수학 자료구조 확률과 통계 |\n| 융복합소프트웨어전공 | 고급파이썬프로그래밍 인공지능 |\n\n## [heading1] ##\n# 나. 글로벌캠퍼스\n\n## [table] ##\n| 개설학과(전공) | 교과목명 |\n| --- | --- |\n| AI융합전공 | 고급파이썬프로그래밍 컴퓨터수학 자료구조 확률과 통계 |\n| 국제금융학과 | 파이낸스어낼리틱스 파생금융상품론 금융프로그래밍 고급비즈니스어낼리틱스실습 경영학원론 마케팅관리 재무관리 회계원리 |\n| GBT전공 | 경영학원론 마케팅관리 회계원리 컴퓨터프로그래밍 객체지향프로그래밍 빅데이터분석 |\n| 미네르바교양대학 | 컴퓨터프로그래밍 |\n| AI데이터융합전공 | 객체지향프로그래밍 |\n\n## [heading1] ##\n# 다. 주요 공지 사항\n\n## [list] ##\n- - 소속 캠퍼스에 개설된 전공교류과목을 선택하여 수강해야 하며 캠퍼스 교차 수강 불가\n- - Business AI 전공에서는 타학과(전공)에서 개설되는 전공교류과목의 수강을 보장하지 않\n\n## [footer] ##\n- 61 -', '## [paragraph] ##\n으며, 개별적으로 수강 신청하고 이수한 후 ‘이수구분변경신청’하여 이중전공 인정\n\n## [paragraph] ##\n- AI융합전공에서 개설되는 ⸢고급파이썬프로그래밍⸥, ⸢자료구조⸥, ⸢확률과 통계⸥는 개별적으\n로 이수를 권장\n\n## [heading1] ##\n# (6) 이수 및 졸업요건\n\n## [list] ##\n- 가. 총 42학점 이수\n- 나. 필수과목 ⸢Business AI 개론⸥ 수강 및 이수\n- 다. Business & AI 전공에서 필수과목을 제외하고 18학점 이상 이수\n\n## [heading1] ##\n# (7) 수여 학위: 경영공학사\n\n## [paragraph] ##\n(8) 문의처\n\n## [list] ##\n- 가. 홈페이지: bizai.hufs.ac.kr\n- 나. 이메일: bizai@hufs.ac.kr\n- 다. 전공 주임 연구실 및 전화번호: 인문경상관 335호 / 031-330-4509\n\n## [footer] ##\n- 62 -', '## [heading1] ##\n# 다. 학습자설계융합전공\n\n## [paragraph] ##\n(학사공지 - 학습자설계융합전공 공지문 참고)\n\n## [list] ##\n- 1) 학습자설계융합전공이 승인된 학생은 매학기말 해당학기 수강한 과목에 대하여 학사\n- 종합 지원센터 방문하여 이수구분을 수정하여야 함\n- 2) 학과의 교과과정 개편에 따라 교과목 명이 변경되거나 기존 설계한 교과목이 폐지되어\n- 졸업학점의 이수가 어려울 경우에 한하여 교과목을 변경할 수 있음(해당학과의 학과장\n- 확인 필요)\n- 단, 위의 사유 이외의 경우 교과목을 추가하거나 변경하는 것은 허용하지 않음\n- (필요 시 자선과목으로 수강하기 바람)\n\n## [heading1] ##\n# ① 지역경제개발협력전공\n\n## [list] ##\n- 1) 교육목표 : 개도국 지역경제 및 개발협력 분야 전문가 양성, 개도국 관련 언어 및\n- 지역학과와 상경계 및 행정학과 융합을 통한 개발협력 및 개도국 전문가 양성을\n- 목표로 함\n- 2) 향후 진로 : UN, OECD, World Bank 등 개도국 지원 국제기구, KOTRA, KOICA,\n- ODA, KSP(Knowledge Sharing Program) 등 국내 개도국 지원기관\n- 3) 이수 교과 과정(아래 표를 제외한 학점 인정불가)', '## [table] ##\n| 개설 학과 | 교과목명 | 최소학점 | 최소학점 | 비고 |\n| --- | --- | --- | --- | --- |\n| 개설 학과 | 교과목명 | 15학번 이후 | 14학번 이전 | 비고 |\n| 서울 경제학전공 | 경제학원론(1), (2) 거시경제학 미시경제학 계량경제학 경제발전론 개발협력의경제학 경제정책론 지역비교경제론 공공경제학 국제무역론 국제금융론 | 18 | 24 | 2019-1학기 까지만 글로벌캠퍼스 경상대학 교과목 수강 인정 2019-2학기부터 서울캠퍼스 개설학과 수강만 인정 |\n| 서울 행정학과 | 행정학개론 정책학개론 정책집행론 정책분석론 정책평가론 | 6 | 9 | 서울/글로벌 수강 |\n| 글로벌 외국어관련학과 | 1. 하나의 외국어로 이수 (타학과의 전공교류는 인정하지 않음) 2. 글로벌캠퍼스에 없는 학과의 경우 서울캠퍼스에서 이수 | 18 | 21 | 1전공이 언어관련학과일 경우 동일언어 추가이수가능 (전공→이중으로 이수구분 변경해야함) |\n| 학번별 최소 이수 학점 | 학번별 최소 이수 학점 | 42 | 54 |  |\n\n## [paragraph] ##\n※ 국내외 교류학점으로 대체 불가하며 반드시 명기된 과목들로 이수하여야 함\n\n## [paragraph] ##\n4) 수여학위명 및 졸업요건 : 학번별 이중전공 학점 이수 완료 시 ‘경제학사’ 수여\n\n## [footer] ##\n- 63 -', '## [heading1] ##\n# ② 보험계리학전공\n\n## [list] ##\n- 1) 교육목표 : 보험계리사가 되기 위한 폭넓은 지식의 함양. 여러 학과내의 개설된\n- 보험관련 수업들을 보험계리사라는 목표 아래, 체계적으로 수강함\n- 2) 향후진로 : 보험수리와 관련된 제반 업무 수행\n- 3) 이수 교과과정(아래 표를 제외한 학점 인정불가)']","'글스산'은 '글로벌스포츠산업학부'를 의미합니다. 졸업 후에는 다음과 같은 진로를 선택할 수 있습니다:

1. **스포츠 매니지먼트 및 이벤트 기획**: 스포츠 클럽, 리그, 대회, 이벤트 등을 기획하고 운영하는 직무입니다.
2. **스포츠 마케팅 및 홍보**: 스포츠 산업에서 제품, 서비스, 이벤트 등을 마케팅하고 홍보하는 업무를 수행합니다.
3. **스포츠 데이터 분석가**: 스포츠 경기에서 발생하는 다양한 데이터를 수집하고 분석하여 팀이나 선수의 성과를 향상시키는 데 필요한 정보를 도출하는 직무입니다.
4. **스포츠 미디어**: 스포츠 뉴스, 인터뷰, 해설, 하이라이트, 분석 등 다양한 스포츠 관련 콘텐츠를 제작하고 편집하여 방송, 인터넷, 모바일 등에서 전달하는 업무를 수행합니다.

졸업 후에는 이러한 분야에서 활동하며 스포츠 산업의 다양한 측면에서 경력을 쌓을 수 있습니다. 혹시 더 도와드릴까요?","글로벌스포츠산업학부를 졸업하면 주로 다음과 같은 분야에서 활동하게 됩니다:
1. 스포츠매니지먼트 및 이벤트 기획
2. 스포츠 마케팅 및 홍보
3. 스포츠 데이터 분석가
4. 스포츠 미디어
이 외에도 졸업 후에는 대학원 진학이나 관련 분야의 연구를 진행할 수 있는 기회도 있습니다.",0.3074074073971605,1.0,0.8571428571428571,0.7664451568106881
졸업하기 전에 무슨 영어성적 제출해야 된다고 했던거 같은데 그건 뭐야?,"['[글로벌] 2025년 전기(2월 졸업) 졸업예비사정 결과 조회 안내\n\n(* 교원자격증 취득 관련 : 교직 담당자 (031-330-4953) 에게 문의 )\n\n다 . 학과에서 제출한 졸업시험 및 논문 , 단과대학 교학과에 제출한 외국어인증은 기준 시점 까지 반영되었으므로 이상이 있을 경우 반드시 학과 및 단과대학 교학과 문의\n\n학과사무실 연락처 검색 ( 클릭 시 이동 )\n\n라 . 졸업 또는 졸업대기 ( 수료 ) 를 원하는 학생은 1 월 14 일 ( 화 ) 오전 까지 미비된 요건을 완료 바람 .\n\n마 . 외국어연수평가원/외국어교육센터\xa0이수자는\xa0프로그램\xa0종강에 따라 기관에서 명단\xa0반영 예정\n\n4. 추가 확인 필요 사항\n\n가 . 이수구분 수정 ( 교류과목 자선 -> 전공 , 전공인정 교양과목 -> 전공 자선 -> 교양 등 ) 을 하지 않아 학점이 미비 된 학생은 반드시 단과대학 교학과에 7 월 18 일 ( 목 ) 까지 이수구분 변경 ( 첨부 ) 을 하여야 졸업 또는 수료가 가능함 .\n\n이수구분 변경신청\xa0안내 ( 클릭 시 이동 )\n\n나 . 외국어인증 서류 제출 1 월 14 일 ( 화 ) 까지 단과대학 교학과로 제출 가능함\n\n( 단 , 외국어연수평가원 여름방학 특별과정 이수자는 과정 종료일 당일 수료증 제출자에 한하여 졸업사정에 반영함 )\n\n※ 특별한 사정이 있어 1 월 14 일 ( 화 ) 까지 제출이 어려운 학생은 학적 담당자 (031-330-4027) 에게 별도 문의 바람\n\n외국어 인증 안내 ( 클릭 시 이동 )\n\n다 . 글로벌 지역학사 / 지역전문가과정 신청자 중\n\n2 월 졸업 또는 졸업대기 ( 학점완료 후 졸업을 미룬 상태 ) 예정인 학생은\n\n첨부 된 서류 작성하여 학과 확인 받은 후 학사종합지원센터 학적 담당 (hufsmil@hufs.ac.kr) 에게\n\n1 월 14 일 ( 화 ) 까지 제출 하여야 학위증 및 졸업증명서에 지역학사 또는 지역전문가 반영됨 .\n\n( 단 , 미제출 하여도 졸업 또는 졸업대기가 가능함 .)\n\n( 방문제출 또는 이메일제출 가능하며 기제출자는 제출 불필요 . 졸업 / 졸업대기 이후 학위명 변경 불가 함 .)', '졸업시험 성적보고서 및 졸업논문 심사보고서 제출 마감 일정:\n2025-06-13 (금요일)\n2025-12-12 (금요일)', '(서울) 2025년 전기(2월 졸업) 졸업예비사정 결과 조회 안내\n\n이수구분 변경신청서 서식함 게시글 바로가기 클릭\n\n- 졸업희망자는 외국어인증 서류를 1/14 오전 까지 단과대학 교학과로 제출 바람\n\n( 단 , 외국어연수평가원 겨울방학 특별과정 이수자는 과정 종료일 당일 수료증 제출자에 한하여 ( 야간반의 경우 다음날 오전까지 ) 졸업사정에 반영함 )\n\n외국어인증신청서 제출안내 학사공지 게시글 바로가기 클릭\n\n- 코어사업 지역학사 / 지역전문가과정 / 학석사연계과정 신청자 중 이번 졸업 또는 수료 ( 학점완료 후 졸업을 미룬 상태 ) 를 희망하는 학생은 관련 서류 작성하여 학과 확인 받은 후 학사종합지원센터에 1/14 오전 까지 제출하여야 학위증 및 졸업증명서에 지역학사 또는 지역전문학과정 이수가 반영 됨 .\n\n( 방문제출 ( 학사종합지원센터 1 번창구 ) 또는 이메일 haksamil@hufs.ac.kr 제출 가능하며 기제출자는 제출 불필요 . 졸업 이후 학위명 변경 불가 함 .)\n\n관련 서류 학사공지 게시글 바로가기 클릭\n\n- 2024 학년도 2 학기 현장실습 학점 인정 후 졸업이 필요한 학생은 1/21 까지 학점인정 처리를 완료 하기 바람 .\n\n관련 진로취업지원센터 문의\n\n* 부득이한 사정으로 1 월 14 일까지 제출이 어려운 학생은 별도 문의바람 .\n\n5. 문의처\n\n- 졸업시험 / 논문 , 전공필수 관련 : 해당학과 사무실 ( 연락처 : 02-2173- 아래의 내선번호 )\n\nELLT 학과 ( 영어학과 )\n\n2266\n\n태국어과\n\n2299\n\n경제학부\n\n2333\n\n영미문학 . 문화학과 ( 영문학과 )\n\n2267\n\n베트남어과\n\n2300\n\n국제통상학과\n\n2332\n\nEICC 학과 ( 영어통번역학과 )\n\n2268\n\n페르시아어 . 이란학과\n\n2303\n\n경영학부\n\n2334\n\n프랑스어학부\n\n2282\n\n인도어과\n\n2301\n\n영어교육과\n\n2342\n\n독일어과\n\n2283\n\n터키 . 아제르바이잔어과\n\n2302\n\n프랑스어교육과\n\n2343\n\n노어과\n\n2284\n\n몽골어과\n\n2415\n\n독일어교육과\n\n2344\n\n스페인어과\n\n2285\n\n중국언어문화학부', '| 제출마감일 | 재학기간 동안\xa01회,\xa0외국어 인증 신청서를 제출하고자 하는 학기 말까지 ※\xa0졸업예정자는 졸업하고자 하는 최종 학기 말까지 반드시 제출해야함. | 재학기간 동안\xa01회,\xa0외국어 인증 신청서를 제출하고자 하는 학기 말까지 ※\xa0졸업예정자는 졸업하고자 하는 최종 학기 말까지 반드시 제출해야함. | 재학기간 동안\xa01회,\xa0외국어 인증 신청서를 제출하고자 하는 학기 말까지 ※\xa0졸업예정자는 졸업하고자 하는 최종 학기 말까지 반드시 제출해야함. | 재학기간 동안\xa01회,\xa0외국어 인증 신청서를 제출하고자 하는 학기 말까지 ※\xa0졸업예정자는 졸업하고자 하는 최종 학기 말까지 반드시 제출해야함. |\n| 제출처 | 학생의\xa01전공 소속 단과대학 담당에게\xa0E-mail\xa0제출 | 학생의\xa01전공 소속 단과대학 담당에게\xa0E-mail\xa0제출 | 학생의\xa01전공 소속 단과대학 담당에게\xa0E-mail\xa0제출 | 학생의\xa01전공 소속 단과대학 담당에게\xa0E-mail\xa0제출 |', '| 제출마감일 | 재학기간 동안\xa01회,\xa0외국어 인증 신청서를 제출하고자 하는 학기 말까지 ※\xa0졸업예정자는 졸업하고자 하는 최종 학기 말까지 반드시 제출해야함. | 재학기간 동안\xa01회,\xa0외국어 인증 신청서를 제출하고자 하는 학기 말까지 ※\xa0졸업예정자는 졸업하고자 하는 최종 학기 말까지 반드시 제출해야함. | 재학기간 동안\xa01회,\xa0외국어 인증 신청서를 제출하고자 하는 학기 말까지 ※\xa0졸업예정자는 졸업하고자 하는 최종 학기 말까지 반드시 제출해야함. | 재학기간 동안\xa01회,\xa0외국어 인증 신청서를 제출하고자 하는 학기 말까지 ※\xa0졸업예정자는 졸업하고자 하는 최종 학기 말까지 반드시 제출해야함. |', '을 공부해 두는 것이 좋습니다. 졸업 후 취업 또는 진학에 관계없이 영어 \n구사 능력은 항시 요구되므로 대학 입학 이후부터 읽기, 듣기, 말하기, \n쓰기 모든 분야에서 영어 능력을 지속적으로 계발하는 것이 매우 중요\n합니다. 고학년 기간에는 이론적인 지식이 아니라 연구실 인턴을 통해 \n관심분야의 연구를 경험해보며 자신의 진로를 준비하는 것이 좋습니다.\n졸업 후 진로 \n-  기업체: 석유화학, 반도체/전자, 에너지, 신소재, 재료, 바이오, 의료 및 \n제약, 화장품 및 식품 분야\n-  정부 및 공공기관: 국가/지방 공무원 및 정부 산하 공기업\n-  학자 및 연구직: 대학 교수, 국공립연구소 및 정부 출연 연구소, 기\n업 연구소\n-  기타: 교사(교직이수), 창업\nQ&A', '을 공부해 두는 것이 좋습니다. 졸업 후 취업 또는 진학에 관계없이 영어 \n구사 능력은 항시 요구되므로 대학 입학 이후부터 읽기, 듣기, 말하기, \n쓰기 모든 분야에서 영어 능력을 지속적으로 계발하는 것이 매우 중요\n합니다. 고학년 기간에는 이론적인 지식이 아니라 연구실 인턴을 통해 \n관심분야의 연구를 경험해보며 자신의 진로를 준비하는 것이 좋습니다.\n졸업 후 진로 \n-  기업체: 석유화학, 반도체/전자, 에너지, 신소재, 재료, 바이오, 의료 및 \n제약, 화장품 및 식품 분야\n-  정부 및 공공기관: 국가/지방 공무원 및 정부 산하 공기업\n-  학자 및 연구직: 대학 교수, 국공립연구소 및 정부 출연 연구소, 기\n업 연구소\n-  기타: 교사(교직이수), 창업\nQ&A \nQ1.  한국외대 화학과에 진학하려고 하는데 영어를 잘해야 하나요?\nA1.   한국외대 화학과에서는 원서 전공 교과목 수업과 영어 졸업논문 발\n표 등을 통해 화학 전문 영어를 습득하게 합니다. 또한, 외국어 대', '[공통] 외국어인증 신청서 제출 안내\n\n[공통] 외국어인증 신청서 제출 안내\n\n외국어인증 신청서 제출 안내\n\n외국어인증 신청서 제출에 대해 아래와 같이 안내합니다 .\n\n1. 외국어인증이란\n\n서울캠퍼스 수강편람 바로가기\n\n(수강편람목록- 수강편람 중 해당 페이지 참조)\n\n글로벌캠퍼스 수강편람 바로가기\n\n(수강편람목록- 수강편람 중 해당 페이지 참조 )\n\n2. 외국어인증 신청서 제출 안내\n\n제출서류\n\n1. 외국어인증 신청서(첨부파일 참조)\n\n2. 제출시점 기준 유효기간(2년) 이내의 인증 시험 성적 ( 또는 대체 과정 수료증 )\n\n※성적표 미리보기 캡쳐본\xa0성적 처리 불가\n\n제출마감일\n\n재학기간 동안 1 회 , 외국어 인증 신청서를 제출하고자 하는 학기 말 까지\n\n※ 졸업예정자는 졸업하고자 하는 최종 학기 말까지 반드시 제출해야함 .\n\n제출처\n\n학생의 1 전공 소속 단과대학 담당에게 E-mail 제출\n\n서울캠퍼스\n\n영어대학 / 아시어언어문화대학 / AI융합대학', '[글로벌] 2025년 전기(2월 졸업) 졸업예비사정 결과 조회 안내\n\n(* 교원자격증 취득 관련 : 교직 담당자 (031-330-4953) 에게 문의 )\n\n다 . 학과에서 제출한 졸업시험 및 논문 , 단과대학 교학과에 제출한 외국어인증은 기준 시점 까지 반영되었으므로 이상이 있을 경우 반드시 학과 및 단과대학 교학과 문의\n\n학과사무실 연락처 검색 ( 클릭 시 이동 )\n\n라 . 졸업 또는 졸업대기 ( 수료 ) 를 원하는 학생은 1 월 14 일 ( 화 ) 오전 까지 미비된 요건을 완료 바람 .\n\n마 . 외국어연수평가원/외국어교육센터\xa0이수자는\xa0프로그램\xa0종강에 따라 기관에서 명단\xa0반영 예정\n\n4. 추가 확인 필요 사항\n\n가 . 이수구분 수정 ( 교류과목 자선 -> 전공 , 전공인정 교양과목 -> 전공 자선 -> 교양 등 ) 을 하지 않아 학점이 미비 된 학생은 반드시 단과대학 교학과에 7 월 18 일 ( 목 ) 까지 이수구분 변경 ( 첨부 ) 을 하여야 졸업 또는 수료가 가능함 .', '(서울) 2025년 전기(2월 졸업) 졸업예비사정 결과 조회 안내\n\n이수구분 변경신청서 서식함 게시글 바로가기 클릭\n\n- 졸업희망자는 외국어인증 서류를 1/14 오전 까지 단과대학 교학과로 제출 바람\n\n( 단 , 외국어연수평가원 겨울방학 특별과정 이수자는 과정 종료일 당일 수료증 제출자에 한하여 ( 야간반의 경우 다음날 오전까지 ) 졸업사정에 반영함 )\n\n외국어인증신청서 제출안내 학사공지 게시글 바로가기 클릭\n\n- 코어사업 지역학사 / 지역전문가과정 / 학석사연계과정 신청자 중 이번 졸업 또는 수료 ( 학점완료 후 졸업을 미룬 상태 ) 를 희망하는 학생은 관련 서류 작성하여 학과 확인 받은 후 학사종합지원센터에 1/14 오전 까지 제출하여야 학위증 및 졸업증명서에 지역학사 또는 지역전문학과정 이수가 반영 됨 .\n\n( 방문제출 ( 학사종합지원센터 1 번창구 ) 또는 이메일 haksamil@hufs.ac.kr 제출 가능하며 기제출자는 제출 불필요 . 졸업 이후 학위명 변경 불가 함 .)', '네 분야 중 학생이 선택한 분야에 초점을 맞추어 강의를 듣게 됩니다.\n3학년  2학년에 수강한 분야들 중 하나 혹은 두 분야에 초점을 맞추어 수\n업을 들으면서 졸업논문 프로젝트를 위한 강의도 수강하게 됩니다.\n4학년  실습이나 연습 과목 위주로 수강하면서 졸업논문 계획서 제출, \n졸업논문 작성 및 완성본 제출을 하게 됩니다.\n졸업 후 진로 \n-  기업: 마케팅, 콘텐츠 비즈니스, 콘텐츠 기획, 해외전략기획 \n-  공기업: 관광, 민간외교, 문화교류, 전시, 기록관리 \n-  대학원: 국제대학원, 일반대학원의 한국어교육 및 한국학 관련 학과 \nQ&A \nQ1. 한국학과 학생들은 졸업 후 주로 어떤 분야로 진출하나요? \nA1.  한국학과 졸업생들은 학과에서 이수한 전공 교육에 기초하여 국내·외', '[글로벌] 2025학년도 1학기 졸업논문 제출 및 졸업시험 일정 공고\n\n다 . 졸업시험 응시원서 제출 시 학생 본인의 연락처를 정확히 기재할 것\n\n라 . 졸업시험은 과목별 40 점이상 , 전과목 평균 60 점 이상 취득하여야 합격임\n\n마 . 졸업논문은 D° 이상 판정 받아야 합격임\n\n※ 졸업시험 및 졸업논문 관련서식은 첨부파일 참조\n\n2025. 4.\n\n글로벌캠퍼스 교무처장\n\n| 0 |\n|:------------------------------------|\n| 졸업논문 제출 및 졸업시험 일정 공고 |', 'FLEX 대체 ( 교내 )\n\n7. 나 .\n\n서울캠퍼스 시행예정\n\n4. 졸업논문\n\n가 . 졸업논문 작성계획서 제출 마감일 : 2025. 4. 23.( 수 )\n\n※ 졸업논문 제출 마감일은 학과에 문의\n\n나 . 제 1 전공 , 제 2 전공 , 이중전공 : 해당학과에서 배정한 졸업논문 지도교수로부터 졸업논문 작성에 관한 지도를 받아 기일 내에 소속 학과장실에 제출함\n\n다 . 졸업논문의 분량은 200 자 원고지 100 매 이상 분량을 원칙으로 함\n\n라 . 졸업논문을 기한 내에 제출하지 않는 학생은 졸업사정 대상에서 제외됨\n\n※ 졸업논문을 제출하고자 하는 학생은 3 학년 2 학기 초 또는 졸업학기의 직전 학기 초에 졸업논문 작성계획서를 작성하여 소속 학과장실에 제출하여야함', '가 . 해당학과 : 자세한 사항은 첨부파일 참조\n\n나 . 시험일자 : 2025. 5. 24( 토 ) 오전 10:00 서울캠퍼스 시행예정\n\n※ 정확한 시간 / 장소는 추후 통지\n\n다 . 접수기간 : 2025. 4. 16.( 수 ) ~ 4. 23.( 수 ) 해당학과 사무실에 신청 ( 기한 이후 추가 신청 불가 )\n\n* 7 학기 이상 재적생만 신청가능\n\n8. 유의 사항\n\n가 . 졸업시험 및 졸업논문 심사에 통과한 자는 졸업 시까지 그 자격이 유효함 ( 단 , 학적을 상실한 때에는 그 자격을 인정하지 아니함 )\n\n나 . 제 2 전공 , 이중전공자도 해당학과 문의 / 학과에 따른 졸업시험 응시 , 논문 제출 등 pass 하기 바람\n\n다 . 졸업시험 응시원서 제출 시 학생 본인의 연락처를 정확히 기재할 것', '[공통] 외국어인증 신청서 제출 안내\n\n| 제출서류 | 1. 외국어인증 신청서(첨부파일 참조) 2. 제출시점 기준 유효기간(2년) 이내의 인증 시험 성적(또는 대체 과정 수료증) ※성적표 미리보기 캡쳐본\xa0성적 처리 불가 | 1. 외국어인증 신청서(첨부파일 참조) 2. 제출시점 기준 유효기간(2년) 이내의 인증 시험 성적(또는 대체 과정 수료증) ※성적표 미리보기 캡쳐본\xa0성적 처리 불가 | 1. 외국어인증 신청서(첨부파일 참조) 2. 제출시점 기준 유효기간(2년) 이내의 인증 시험 성적(또는 대체 과정 수료증) ※성적표 미리보기 캡쳐본\xa0성적 처리 불가 | 1. 외국어인증 신청서(첨부파일 참조) 2. 제출시점 기준 유효기간(2년) 이내의 인증 시험 성적(또는 대체 과정 수료증) ※성적표 미리보기 캡쳐본\xa0성적 처리 불가 |\n| 제출마감일 | 재학기간 동안\xa01회,\xa0외국어 인증 신청서를 제출하고자 하는 학기 말까지 ※\xa0졸업예정자는 졸업하고자 하는 최종 학기 말까지 반드시 제출해야함. | 재학기간 동안\xa01회,\xa0외국어 인증 신청서를 제출하고자 하는 학기 말까지 ※\xa0졸업예정자는 졸업하고자 하는 최종 학기 말까지 반드시 제출해야함. | 재학기간 동안\xa01회,\xa0외국어 인증 신청서를 제출하고자 하는 학기 말까지 ※\xa0졸업예정자는 졸업하고자 하는 최종 학기 말까지 반드시 제출해야함. | 재학기간 동안\xa01회,\xa0외국어 인증 신청서를 제출하고자 하는 학기 말까지 ※\xa0졸업예정자는 졸업하고자 하는 최종 학기 말까지 반드시 제출해야함. |\n| 제출처 | 학생의\xa01전공 소속 단과대학 담당에게\xa0E-mail\xa0제출 | 학생의\xa01전공 소속 단과대학 담당에게\xa0E-mail\xa0제출 | 학생의\xa01전공 소속 단과대학 담당에게\xa0E-mail\xa0제출 | 학생의\xa01전공 소속 단과대학 담당에게\xa0E-mail\xa0제출 |\n| 제출처 | 서울캠퍼스 | 영어대학 /\xa0아시어언어문화대학 / AI융합대학 | haksa7@hufs.ac.kr | 02) 2173-2264 |', ""네 분야 중 학생이 선택한 분야에 초점을 맞추어 강의를 듣게 됩니다.\n3학년  2학년에 수강한 분야들 중 하나 혹은 두 분야에 초점을 맞추어 수\n업을 들으면서 졸업논문 프로젝트를 위한 강의도 수강하게 됩니다.\n4학년  실습이나 연습 과목 위주로 수강하면서 졸업논문 계획서 제출, \n졸업논문 작성 및 완성본 제출을 하게 됩니다.\n졸업 후 진로 \n-  기업: 마케팅, 콘텐츠 비즈니스, 콘텐츠 기획, 해외전략기획 \n-  공기업: 관광, 민간외교, 문화교류, 전시, 기록관리 \n-  대학원: 국제대학원, 일반대학원의 한국어교육 및 한국학 관련 학과 \nQ&A \nQ1. 한국학과 학생들은 졸업 후 주로 어떤 분야로 진출하나요? \nA1.  한국학과 졸업생들은 학과에서 이수한 전공 교육에 기초하여 국내·외\n의 다양한 한국문화·한국학·한국어교육 관련 영역으로 진출하고 있습\n니다. 이를테면 학과 졸업과 동시에 '한국어교원 자격증'을 발급받아 세\n종학당과 같은 국내외 한국어 교육기관에서 한국어 선생님으로 일하고 \n있는 졸업생, 한국학 기록관리 영역으로 진출한 졸업생(기록관리사로 \n국가기관이나 공기업 취직), 한국학 관련 국내외 도서관이나 박물관에\n서 일하고 있는 졸업생, 한국 관광산업 관련 기업에 취업한 졸업생, 유\n엔과 같은 국제기구나 아리랑TV와 같은 언론 영역으로 진출한 졸업생 \n등이 있습니다. 이 모든 졸업생들은 한국의 우수한 문화를 세계에 널리 \n알리겠다는 어린 시절 자신의 꿈을 계속 현실화시켜 나가고 있습니다. \nQ2. 한국학과 입학을 위해서는 국어와 역사를 잘 알아야 하나요? \nA2.  한국학과는 한국학 관련 입문과목부터 단계적·체계적으로 커리큘럼\n을 운영하고 있습니다. 따라서 기존에 한국문화 관련 지식이 부족하더\n라도 충분히 흥미진진하게 전공과목을 수강할 수 있습니다. 게다가 한\n국학과에는 한국 문학이나 역사 관련 수업을 제외하고도 <한국미술사\n>, <한국문화와영화> 등 다양한 영역의 전공과목이 개설되어 있으므\n로 학생들은 본인의 개인적 목표와 흥미, 이중전공 제도의 활용 등을 \n통해 다채로운 한국문화 관련 세부 전공을 개척해 나갈 수 있습니다. \nQ3. 한국어 교원 자격증이 무엇인가요? \nA3.  한국어 교원 자격증은 국립국어원 주관하에 문화체육관광부에서 \n부여하는 자격증으로서 한국어가 모국어가 아닌 외국인이나 다문\n화가정을 대상으로 한국어를 가르칠 수 있는 자격증입니다. 한국학"", '이수구분 변경신청\xa0안내 ( 클릭 시 이동 )\n\n나 . 외국어인증 서류 제출 1 월 14 일 ( 화 ) 까지 단과대학 교학과로 제출 가능함\n\n( 단 , 외국어연수평가원 여름방학 특별과정 이수자는 과정 종료일 당일 수료증 제출자에 한하여 졸업사정에 반영함 )\n\n※ 특별한 사정이 있어 1 월 14 일 ( 화 ) 까지 제출이 어려운 학생은 학적 담당자 (031-330-4027) 에게 별도 문의 바람\n\n외국어 인증 안내 ( 클릭 시 이동 )\n\n다 . 글로벌 지역학사 / 지역전문가과정 신청자 중\n\n2 월 졸업 또는 졸업대기 ( 학점완료 후 졸업을 미룬 상태 ) 예정인 학생은\n\n첨부 된 서류 작성하여 학과 확인 받은 후 학사종합지원센터 학적 담당 (hufsmil@hufs.ac.kr) 에게\n\n1 월 14 일 ( 화 ) 까지 제출 하여야 학위증 및 졸업증명서에 지역학사 또는 지역전문가 반영됨 .\n\n( 단 , 미제출 하여도 졸업 또는 졸업대기가 가능함 .)', '## [caption] ##\n2) 유고결시(시험 결석) : 사유발생 시 담당교수에게 알리고, 유고사유가 끝난 날부터\n7일 이내에 증빙서류를 담당교수에게 제출해야 함.', '스템 개발/실습 등의 분야로 나눌 수 있습니다. 전공과목에 대한 자\n세한 내용은 학과 홈페이지나 인스타그램을 참조해 주세요.\nQ2.  산업경영공학을 공대 중에 문과 특성이 많은 학과라고 하던데 수학\n을 잘 못 해도 괜찮을까요?\nA2.  산업경영공학에서 해결하려는 문제들은 경영학에서도 다루는 것\n들이 많아서 그렇게 이야기 하곤 합니다. 산업경영공학의 문제 해\n결 방법은 기본적으로 모형을 바탕으로 하고, 이 모형은 대부분 수\n리 모형 또는 컴퓨터 모형입니다. 수학이나 컴퓨터공학 전공자만\n큼은 아니더라도 수학과 컴퓨터에 친숙하면 산업경영공학 공부에\n도 좋습니다. \nQ3. 산업경영공학을 전공하면 기업에서 주로 무슨 업무를 하게 되나요?\nA3.  전통적으로는 제조/물류 관련 기업에서 생산관리 직무를 담당하거\n나, 관련 솔루션/정보시스템을 서비스하는 IT/SI 업체에서 개발/컨\n설팅 직무를 수행합니다. 최근에 대다수 기업에서 비즈니스 문제 해\n결에 데이터를 활용하기 시작하면서 데이터 분석 관련 직무에도 산\n업경영공학 전공자들이 많이 종사하고 있습니다.', '[공통]2025년 1학기 교직 적성•인성검사 시간, 장소 확인 및 유의사항 안내\n\n7) 문제지와 OMR 답안지에 낙서나 필기를 하지 마시기 바랍니다 .\n\n8) OMR 답안지 교체는 검사 종료 10 분\xa0전까지만 가능합니다 .\n\n9) 한번 응답한 문항은 수정하거나 변경할 수 없으며 , 답안지를 고치거나 수정하면 그 문항은 무효가 됩니다 .\n\n10) 문제지와 OMR 답안지는 모두 제출해야 합니다 .\n\n11) 검사 중 인쇄의 잘못으로 인해 식별하기 어려운 경우 외에는 질문을 받지 않습니다 .\n\n12) \xa0기타 관련 문의는 02-2173-2338로 연락 하시기 바랍니다.\n\n사범대학장', '## [heading1] ##\n# 9. 성범죄 경력 조회 동의서 제출\n\n## [paragraph] ##\n무시험검정원서 제출 시(졸업\xa0직전)\xa0양식 하단에 <성범죄경력\xa0조회\xa0동의> 부분에 동의\n체크하여 제출하면 학사종합지원센터로\xa0일괄 조회(동의서\xa0미제출 시\xa0교원자격증 발급 불가)\n\n## [paragraph] ##\n10. 마약·대마·향정신성 의약품 중독자 여부 확인서 제출\n\n## [paragraph] ##\n무시험검정원서\xa0제출\xa0시(졸업\xa0직전)\xa0<마약ㆍ대마ㆍ향정신성 의약품\xa0중독에\xa0관한\xa0의사\xa0진단서>를\n제출해야\xa0함.\n\n## [paragraph] ##\n※ ‘교원자격무시험검정원서’, ‘성범죄 경력 조회 동의’, ‘ 마약·대마·향정신성 의약품 중독자\n여부 확인서’ 미제출 학생은 교원자격증을 발급받을 수 없음.\n\n## [footer] ##\n- 94 -', '## [paragraph] ##\n나. 처리절차\n\n## [paragraph] ##\n1) 유고결석·결시 공통 안내사항\n\n## [paragraph] ##\n* 질병 및 상해의 경우 의원에서 발급받은 서류는 해당되지 않음\n(병원급 의료 기관 확인 : 건강보험심사평가원(https://www.hira.or.kr)\n\n## [paragraph] ##\n⇒ 검색창에서 병원이름 기입 후 검색 ⇒ 검색결과에서 해당병원 클릭\n⇒ 병원 기본정보 중 병원구분에서 병원등급 확인\n\n## [paragraph] ##\n** 질병관리청의 법정감염병 확인(https://dportal.kdca.go.kr)\n(질병관리청 감염병 포털 -> 감염병정보 -> 법정감염병에서 병명 확인)\n\n## [paragraph] ##\n2) 유고결석(수업 결석) : 사유발생 시 담당교수에게 알리고, 유고사유가 끝난 날부터\n7일 이내 증빙서류를 제출해야 함.\n(해당학기 졸업가능한 조기취업자는 입사확정 후 즉시 제출)\n\n## [table] ##\n| 사유 | 기간 | 증빙서류 | 절차 | 비고 |\n| --- | --- | --- | --- | --- |\n| 직계존비속, 배우자 및 형제 자매의 사망 | 7일 이내 (중간 공휴일 포함) | 사망진단서, 가족관계증명서 등 | 담당교수에게 증빙서류 제출 |  |\n| 본인의 결혼 | 7일 이내 (중간 공휴일 포함) | 청첩장, 예식장계약서 등 | 담당교수에게 증빙서류 제출 |  |\n| 징병검사, 입대지원시험 및 예비군 훈련 | 해당기간 | 소집영장사본 또는 징병검사 통지서사본, 교육필증 등 | 담당교수에게 증빙서류 제출 |  |\n\n## [footer] ##\n- 68 -', '2025-1학기 학부 재학생 등록 안내문\n\n○ 감면 금액 고지서 반영 일자 :3월 11일(화) 09시(이전까지는 고지서에 등록금 전액으로 표시됨)\n\n○ 등록취소 기간 (3/24~3/28) 내 수강 신청 변경 사항에 관해서는 등록금 환불 불가\n\n6. 해외 송금자\n\n○ 仅限持有微信支付钱包的学生，可通过微信支付缴纳学费（参考附件）\n\n○ 使用微信支付时缴纳期间为2025.02.17日（周一）~ 19日（周三）\n\n○ 위챗페이 e-wallet을 보유한 중국 국적 학생에 한하여 위챗페이로 등록금 납부 가능 (첨부 파일 참조)\n\n○ 위챗페이 납부는 2/17~19일까지만 가능\n\n○ 부득이하게 외화송금으로 등록금을 납부하는 경우 등록마감일 2~3일 전에 송금하여야 하며 수수료 및 환율을 감안하여 납부금액을 입금하여야 함\n\n○ 등록금액보다 입금액이 부족할 경우 등록처리 되지 않음.\n\n○ 해외송금자는 원활한 등록 업무를 위한 해외송금 정보 입력 바로가기\n\n우리은행 SWIFT CODE : HVBKKRSEXXX ※ 일부 해외은행의 경우는 HVBKKRSE로 인식하는 경우도 있으니 유의하시기 바랍니다.우리은행 본점 영문주소 : 17, WORLD CUP BUK-RO 60-GIL, MAPO-GU, SEOUL, 03921, SOUTH KOREA영문 이름: Hankuk University of Foreign Studies영문주소: 107, Imun-ro, Dongdaemun-gu, Seoul, Republic of Korea전화번호: 02-2173-2184우리은행 영문명칭 : WOORI BANK\n\n7. 분할납부\n\n구분\n\n기간\n\n비고\n\n신청\n\n2025.02.17(월) ~ 2025.02.21(금)', '[공통] 2025학년도 1학기 학부 재학생 추가등록 안내\n\n○ 감면 금액 고지서 반영 일자 :3월 11일(화) 09시(이전까지는 고지서에 등록금 전액으로 표시됨)\n\n○ 등록취소 기간 (3/24~3/28) 내 수강 신청 변경 사항에 관해서는 등록금 환불 불가\n\n6. 해외 송금자\n\n○ 仅限持有微信支付钱包的学生，可通过微信支付缴纳学费（参考附件）\n\n○ 使用微信支付时缴纳期间为2025.03.11日（周二）~ 12日（周三）\n\n○ 위챗페이 e-wallet을 보유한 중국 국적 학생에 한하여 위챗페이로 등록금 납부 가능 (첨부 파일 참조)\n\n○위챗페이 납부는 3/11~12일까지만 가능\n\n○ 부득이하게 외화송금으로 등록금을 납부하는 경우 등록마감일 2~3일 전에 송금하여야 하며 수수료 및 환율을 감안하여 납부금액을 입금하여야 함\n\n○ 등록금액보다 입금액이 부족할 경우 등록처리 되지 않음.\n\n○ 해외송금자는 원활한 등록 업무를 위한 해외송금 정보 입력 바로가기\n\n우리은행 SWIFT CODE : HVBKKRSEXXX ※ 일부 해외은행의 경우는 HVBKKRSE로 인식하는 경우도 있으니 유의하시기 바랍니다.우리은행 본점 영문주소 : 17, WORLD CUP BUK-RO 60-GIL, MAPO-GU, SEOUL, 03921, SOUTH KOREA영문 이름: Hankuk University of Foreign Studies영문주소: 107, Imun-ro, Dongdaemun-gu, Seoul, Republic of Korea전화번호: 02-2173-2184우리은행 영문명칭 : WOORI BANK\n\n7. 분할납부\n\n구분\n\n기간\n\n비고\n\n신청\n\n2025.02.17(월) ~ 2025.02.21(금)', '2025-1학기 대학원 재학생 등록 안내문\n\n3. 복학생\n\n○종합정보시스템에서 복학 신청 후 고지서 출력 가능(신청 후 승인까지 완료되어야 함)\n\n4. 재입학생\n\n○ 종합정보시스템에서 재입학 신청 후 승인된 학생만 고지서 발급 가능\n\n5. 연구등록생\n\n○ 각 대학원 등록 공지 참고\n\n6. 해외 송금자\n\n○仅限持有微信支付钱包的学生，可通过微信支付缴纳学费（参考附件）\n\n○使用微信支付时缴纳期间为2025.02.17日（周一）~ 19日（周三）\n\n○위챗페이 e-wallet을 보유한 중국 국적 학생에 한하여 위챗페이로 등록금 납부 가능 (첨부 파일 참조)\n\n○위챗페이 납부는 2/17~19일까지만 가능\n\n○부득이하게 외화송금으로 등록금을 납부하는 경우 등록마감일 2~3일 전에 송금하여야 하며 수수료 및 환율을 감안하여 납부금액을 입금하여야 함 ○등록금액보다 입금액이 부족할 경우 등록처리 되지 않음. ○해외송금자는 원할한 등록 업무를 위한 해외송금 정보 입력 바로가기\n\n우리은행 SWIFT CODE : HVBKKRSEXXX ※ 일부 해외은행의 경우는 HVBKKRSE로 인식하는 경우도 있으니 유의하시기 바랍니다. 우리은행 본점 영문주소 : 17, WORLD CUP BUK-RO 60-GIL, MAPO-GU, SEOUL, 03921, SOUTH KOREA 영문 이름: Hankuk University of Foreign Studies 영문주소: 107, Imun-ro, Dongdaemun-gu, Seoul, Republic of Korea 전화번호: 02-2173-2184 우리은행 영문명칭 : WOORI BANK\n\n7. 분할납부\n\n구분\n\n기간\n\n비고\n\n신청\n\n2025.02.17(월) ~ 2025.02.21(금)', '[공통] 2025학년도 1학기 대학원 재학생 추가등록 안내\n\n3. 복학생\n\n○종합정보시스템에서 복학 신청 후 고지서 출력 가능(신청 후 승인까지 완료되어야 함)\n\n4. 재입학생\n\n○ 종합정보시스템에서 재입학 신청 후 승인된 학생만 고지서 발급 가능\n\n5. 연구등록생\n\n○ 각 대학원 등록 공지 참고\n\n6. 해외 송금자\n\n○仅限持有微信支付钱包的学生，可通过微信支付缴纳学费（参考附件）\n\n○使用微信支付时缴纳期间为2025.03.11日（周二）~ 12日（周三）\n\n○위챗페이 e-wallet을 보유한 중국 국적 학생에 한하여 위챗페이로 등록금 납부 가능 (첨부 파일 참조)\n\n○위챗페이 납부는 3/11~12일까지만 가능\n\n○부득이하게 외화송금으로 등록금을 납부하는 경우 등록마감일 2~3일 전에 송금하여야 하며 수수료 및 환율을 감안하여 납부금액을 입금하여야 함 ○등록금액보다 입금액이 부족할 경우 등록처리 되지 않음. ○해외송금자는 원활한 등록 업무를 위한 해외송금 정보 입력 바로가기\n\n우리은행 SWIFT CODE : HVBKKRSEXXX ※ 일부 해외은행의 경우는 HVBKKRSE로 인식하는 경우도 있으니 유의하시기 바랍니다. 우리은행 본점 영문주소 : 17, WORLD CUP BUK-RO 60-GIL, MAPO-GU, SEOUL, 03921, SOUTH KOREA 영문 이름: Hankuk University of Foreign Studies 영문주소: 107, Imun-ro, Dongdaemun-gu, Seoul, Republic of Korea 전화번호: 02-2173-2184 우리은행 영문명칭 : WOORI BANK\n\n7. 분할납부\n\n구분\n\n기간\n\n비고\n\n신청\n\n2025.02.17(월) ~ 2025.02.21(금)', '## [paragraph] ##\n※ 분류별 세부과목은 \uf000 학교 홈페이지 ▶ Hot Link 강의시간표를 통하여 확인 가능\n\n## [paragraph] ##\n※ 학기마다 영역별 개설되는 교과목이 상이하고 없는 경우도 있으니 강의시간표 통해 확인\n\n## [heading1] ##\n# 다. 기초과목 이수 일반지침\n\n## [list] ##\n- (1) 2025학번 이후 입학생은 본인이 소속된 1전공 학과(단과대학 혹은 모집단위 계열)에서\n- 인정하는 기초영역에서 6학점 이상 이수하여야함\n- (2) 기본적으로 본인이 소속된 학과별(전공언어)기초(외국어계열의 경우), 모집단위 공통기초,\n- 대분류 계열기초 과목 및 대학기초에 대해서 필수 이수 6학점에 포함\n- 예) 자연과학대학 입학생 : 자연과학대학 모집단위 공통기초, 이공계열 기초, 대학기초 인정\n- (3) 자유전공학부의 경우, 전공 배정 전에 이수한 6학점의 경우 영역을 불문하고 필수\n- 이수 학점으로 인정\n- (4) 2024학번 이전 입학생에 대해서는 기초 과목에 대한 수강 의무가 없으나, 일부 학과의\n- 경우 기초 교과목을 전공 혹은 이중전공 학점으로 인정할 수 있으니 개별 학과에 문의 바람\n- (5) 본인 소속이 아닌 타 전공의 기초 수업의 수강은 가능하나 필수 이수학점에는 미포함\n- (6) 기후변화융합학부는 자연과학대학에 개설된 기초 교과목 수강, 바이오메디컬공학부는\n- 공과대학(공과계열) 개설 기초 교과목 수강함.\n- (7) 우크라이나학과 및 한국학과는 각 학과에서 개설된 학과별(전공언어)기초를 수강함\n\n## [footer] ##\n- 38 -', '## [heading1] ##\n# 4) 이수 영역별 인정 교과목 현황\n\n## [paragraph] ##\n가) <상경트랙>\n\n## [paragraph] ##\n① 상경 학점 인정\n\n## [table] ##\n| 학번 구분 | 총 이수 학점 | 이수 내용 | 이수 내용 |\n| --- | --- | --- | --- |\n| 2014 학번까지 | 30학점 | 상경필수 (4과목, 12학점) | 경제학원론1, 경제학원론2, 거시경제학 (또는 중급거시경제학), 미시경제학 (또는 중급미시경제학) |\n| 2014 학번까지 | 30학점 | 상경선택 (18학점) | 상경 필수과목을 제외한 상경대학, 경상대학, 경영 대학의 모든 교과목과 비고란에 상경 표기가 된 BRICs전공 내 일부 교과목 |\n| 2015 학번부터 | 18학점 | 상경대학, 경상대학, 경영대학의 모든 교과목과 비고란에 상경 표기가 된 BRICs전공 내 일부 교과목(상경 필수, 선택 구분 없음) | 상경대학, 경상대학, 경영대학의 모든 교과목과 비고란에 상경 표기가 된 BRICs전공 내 일부 교과목(상경 필수, 선택 구분 없음) |\n\n## [list] ##\n- ② BRICs 통상법 과목은 BRICs전공 상경선택 점수로 인정함.\n- ③ BRICs전공 내 상경선택 표시 과목 : 브라질권역별경제특성연구(구:브라질기업과통상),\n- 경제로읽는러시아-유라시아(구:러시아.CIS지역투자환경), 극동-시베리아개발과국제협력\n- (구:시베리아극동지역경제의이해), 인도의IT산업연구, 인도의경제정책론, 중국권역별상\n- 문화연구(구:중국기업경영사례), 중국문화콘텐츠와문화산업(구:한중경제관계연구),\n- BRICs상거래문화, BRICs와세계경제\n- ※ 2016-2학기 교과목 개정 전에 수강한 학생은 수강 당시 학기에 명기된 이수영역으로 인정함\n\n## [paragraph] ##\n나) <언어트랙>', '[공통] 2025학년도 여름계절학기 국내대학 학점교류 안내\n\n4) 교류대학에서 이전에 수강한 과목은 우리대학 및 교류대학에서 재수강할 수 없음 .\n\n5) 우리대학 교양필수 에 해당하는 교류대학\xa0과목은 수강할 수 없음 .\n\n6) 교류대학의 교양영역에 개설된 교과목은 우리 대학의 전공학점으로 인정되지 않으므로 우리대학 전공에 해당하는 교류대학 교양과목은 수강할 수 없음.\n\n7) 우리대학 교과목과 < 동일교과목 > 및 < 유사교과목 > 은 중복 수강할 수 없음 .\n\n8) 전공 (1 전공 , 부전공 , 2 전공 , 이중전공 ) 교과목의 경우 학점교류신청원 접수 전에 우리대학 해당학과의 승인을 받아야 전공 (1 전공 , 부전공 , 2 전공 , 이중전공 ) 학점으로 인정받을 수 있음 .\n\n9) 계절학기 수강학점은 우리대학 및 교류대학 구분 없이 최대 6 학점까지 취득할 수 있음 .\n\n10) 학과에서 정한 전공필수 과목 및 교직 과목은 반드시 우리 대학에서만 수강하여야 함 .\n\n11) 성적인정은 교류대학 백분율 점수를 기준으로 우리대학 평점을 적용함 .\n\n12) 수강신청서의 교과목과 실제로 수강한 교과목이 상이할 경우 학점인정을 받을 수 없음 .\n\n13) 계절학기 F 학점은 성적에 포함됨 . ( 졸업후에도 삭제되지 않으며 우리대학 및 교류대학에서 재수강도 불가능함 )\n\n14)\xa0사이버한국외국어대학교\xa0과목은 ""교양""학점으로만 인정됨\n\n아. 문의처 : 소속캠퍼스 학사종합지원센터 ( 서울 02-2173-2111, 글로벌 031-330-4086)\n\n2025.\xa003.\xa020.\n\n서울.글로벌캠퍼스 교무처장\n\n| 0 |\n|:------------------------------------------------------|\n| [공통] 2025학년도 여름계절학기\xa0국내대학 학점교류 안내 |', '[공통] 2025학년도 여름계절학기 국내대학 학점교류 안내\n\n3) 제출서류를 모두 제출 ( 소속 캠퍼스 학사종합지원센터 )\n\n마. 수강신청 : 수강신청 , 변경 및 취소는 수학 대학에서 정한 절차에 따름\n\n바. 학점인정\n\n1) 교류대학에서 이수한 교과목은 우리대학의 교육과정 교과목을 취득한 것으로 인정함을 원칙으로 하며 , 장학생 선발 등에 관한 학점인정 및 평점 계산에는 삽입하지 아니함\n\n2) 교류대학에서 이수한 학점의 성적 ( 백분율 기준 ) 은 우리 대학의 성적산출 방식에 따라 환산함\n\n3) 학점교류신청원의 수강신청 교과목과 수강한 교과목이 상이할 경우 학점인정을 받을 수 없음\n\n※ 단, 부득이한 사유(교류대학의 수강신청 불가 및 폐강 등)\xa0로 변경할 경우, 수강신청 종료후 1주일 이내에 신청원을 다시 제출해야 함.\n\n(미제출시 교류대학에서 온 성적을 우리대학의 자선학점으로 입력)\n\n※ 타대학 성적이\xa0F학점이더라도 삭제할 수 없음.\n\n사. 수강 신청 시 유의사항\n\n1) 졸업예정자 , 졸업대기 ( 유예 ) 자는 수강할 수 없음 .\n\n2) 7 학기 재학생 으로서 금번 정규학기 (2025-1 학기 )를 포함하여 총 취득학점이 다음에 해당되는 학생은 수강할 수 없음 ( 다만, 졸업이나 진학 등 학업 계획을 위하여 수강신청이 필요할 경우(영역별 이수학점이 많이 남아 있는 경우)에는 예외로 할 수 있음)\n\n① 졸업학점이 140 학점인 학생의 경우 134 학점 이상을 취득한 학생\n\n② 졸업학점이 134 학점인 학생의 경우 128 학점 이상을 취득한 학생\n\n③ 졸업학점이 150 학점인 학생의 경우 144 학점 이상을 취득한 학생\n\n3) 우리대학 교과목에 대한 재수강 목적으로 교류대학의 과목을 수강할 수 없음 .\n\n4) 교류대학에서 이전에 수강한 과목은 우리대학 및 교류대학에서 재수강할 수 없음 .\n\n5) 우리대학 교양필수 에 해당하는 교류대학\xa0과목은 수강할 수 없음 .\n\n6) 교류대학의 교양영역에 개설된 교과목은 우리 대학의 전공학점으로 인정되지 않으므로 우리대학 전공에 해당하는 교류대학 교양과목은 수강할 수 없음.', '[공통] 2025-1학기 수강신청 안내\n\n1) 타캠퍼스 학과의 전공을 이중(부)전공으로 이수 허가받은 학생에 한하여 타캠퍼스 해당 이중(부)전공 과목 수강신청 가능(단, 교양, 자유선택 수강 불가)\n\n2) 단, 아래의 경우 수강 가능한 개설캠퍼스 유의\n\n1전공 캠퍼스\n\n이수중인 타캠퍼스 이중(부)전공\n\n전공구분\n\n수강신청\n\n서울캠퍼스\n\n철학, 사학, 언어인지과학\n\n부전공\n\n서울캠퍼스\n\n글로벌캠퍼스\n\n정치외교학, 행정학, 언론·정보,\n\n광고·PR·브랜딩, 방송·영상·뉴미디어\n\n부전공\n\n글로벌캠퍼스\n\n이중전공\n\n양캠퍼스\n\n다. 집중수업 강좌 는 수강취소기간에 수강취소 불가 하므로, 수강신청 전 수업진행과 관련하여 강의계획서\n\n사전 확인 (다만, 질병 및 군입대 등의 사유로 학업이 불가능하게 된 경우는 예외)\n\n1) 집중수업이란?(※ 강의시간표 및 수강신청 강좌 비고 에 “*집중수업(수업기간)”으로 안내)\n\n교육과정 운영상 필요한 경우 개별 교과목별로 학점당 이수시간(학점 15시간 이상)을 준수하는 범위에서 수업일수를 단축하여 운영하는 수업\n\n2) 집중수업 강좌가 학기 종강 전에 종료되더라도 강의평가 및 성적평가 기간은 원활한 학사운영을 위해 학사일정에 맞춰 진행함\n\n라. 교차수업 강좌 는 본인 소속 캠퍼스에서 대면수업으로 진행될 때에는 대면수업으로 참여하고, 타 캠퍼스에서 대면수업으로 진행될 때에는 실시간 비대면으로 수업에 참여함\n\n(※ 캠퍼스별 대면수업 일정은 강의계획서 참고)\n\n▶ 교차수업이란?(※ 강의시간표 및 수강신청 강좌 비고 에 “*교차수업”으로 안내)\n\n동일한 강의시간(요일, 시간)에 동일한 교과목(학점, 시간 일치)을 동일한 담당 교수의 수업으로 양 캠퍼스에 각각 개설한 수업으로 학생은 본인 소속 캠퍼스에 개설된 강좌를 수강신청함\n\n마. 글로벌캠퍼스 강의실 배정\n\n▶ 수강 신청 전 강의실 배정이 어려운 관계로 수강 신청 시 추후 건물 이동 동선 참고\n\n계열/학과\n\n건물\n\n인문·경상계열\n\n인문·경상관\n\n어문계열\n\n어문관 / 교양관\n\n자연계열\n\n자연관 / 백년관\n\n공학계열\n\n공학관\n\n교양', '## [list] ##\n- 15시간 이상)을 준수하는 범위에서 수업일수를 단축하여 운영하는 수업\n- ※ 확인방법 : 강의시간표 및 수강신청 강좌 비고에 “*집중수업(수업기간)”으로 안내\n- ※ 집중수업 강좌가 학기 종강 전에 종료되더라도 강의평가 및 성적평가 기간은\n- 원활한 학사운영을 위해 학사일정에 맞춰 진행함\n- 17) 교차수업 강좌는 본인 소속 캠퍼스에서 대면수업으로 진행될 때에는 대면수업으로\n- 참여하고, 타 캠퍼스에서 대면수업으로 진행될 때에는 실시간 비대면으로 수업에 참\n- 여함(※ 캠퍼스별 대면수업 일정은 강의계획서 참고)\n- - 교차수업 : 동일한 강의시간(요일, 시간)에 동일한 교과목(학점, 시간 일치)을 동일\n- 한 담당 교수의 수업으로 양 캠퍼스에 각각 개설한 수업으로 학생은 본인 소속\n- 캠퍼스에 개설된 강좌를 수강신청함\n- - 확인방법 : 강의시간표 및 수강신청 강좌 비고에 “*교차수업”으로 안내\n\n## [paragraph] ##\n※ 예비수강신청함 시스템 사용법\n모의 동영상 (QR코드스캔)\n\n## [paragraph] ##\n※ 수강신청 시스템 사용법\n모의 동영상(QR코드스캔)\n\n## [heading1] ##\n# 다. 수강신청 변경\n\n## [table] ##\n| 기간 | 3. 4.(화) ~ 3. 10.(월), 10시 ~ 17시 (토요일, 일요일 제외) (단, 취소는 1~4일차 매일 22시까지, 5일차 17시까지 가능) |\n| --- | --- |\n| 방법 | 학교 홈페이지 수강신청변경 임시화면(별도 기간) ‘바로가기’ / 팝업 ‘수강신청변경 바로가기’ / HOT LINK ‘수강신청변경 바로가기’ ※ 수강신청 변경 후 본인의 강의시간표 반드시 확인 |\n\n## [paragraph] ##\n☞ 정규 수강신청과 동일하게 신청하며, 교과목 별 여석 내에서 추가로 신청할 수 있음\n\n## [caption] ##\n라. 폐강강좌 수강생 수강신청 변경', '[공통]2025년 1학기 교직 적성•인성검사 시간, 장소 확인 및 유의사항 안내\n\n[공통]2025년 1학기 교직 적성•인성검사 시간, 장소 확인 및 유의사항 안내\n\n2025년\xa01 학기 교직 적성 • 인성검사 시간, 장소 확인 및\xa0유의사항 안내\n\n1. 검사대상 : 검사 신청 기간 중 신청한 학생 - 첨부 파일 참조\n\n2. 검사일시 : 2025 년\xa05 월\xa031일 ( 토 ) 10 시 ~\xa010시 20분(20분), 10시 40분 ~\xa011 시 (20분)\n\n- 첨부 파일에 있 는 개인별 응시 시간과 장소를 잘 확인하세요. (시간, 장소 변경\xa0불가)\n\n3. 검사장소 : 서울캠퍼스\xa0인문관 3 층 ( ※ 첨부파일 내 개인별 장소 확인)\n\n4. 검사방법 : 객관식 ,\xa0OMR 카드\xa0작성\n\n5. 준 비 물 : 컴퓨터용 싸인펜 ,\xa0볼 펜 , 신분증 ( 학생증 / 주민등록증 / 운전면허증 / 여권 )\n\n6. 결과발표 : 2025 년 6 월 말(예정) 개인별 종합정보시스템\n\n7. 유의사항\n\n1) 검사 시간은 20분입니다. 개인별 시간을 잘 확인하여 늦지 않게 입실하시기 바랍니다.\n\n2 ) 발열, 두통, 오한, 기침, 몸살 기운 등의 증상이 있는 학생은 마스크를 반드시 착용하고\xa0검사에 응시하시기 바랍니다.\n\n3) 부적격 판정 (Fail) 을 받을 경우 , 부적격자 대상 교육프로그램을 반드시 이수(방학중)해야 합니다.\n\n4) 검사지와 답안지의 모두 해당 칸에 학과 , 학번 , 성명을 기입하시기 바랍니다 .\n\n5) 한 문항도 빠짐없이 모두 기입하고 솔직하게 답해주시기 바랍니다 .\n\n6) 수정테이프 사용불가 , 문제지 - 검정펜 , OMR 답안지 - 컴퓨터용 싸인펜으로 작성 문제지와 OMR 답안지 모두 작성해야 합니다 .\n\n7) 문제지와 OMR 답안지에 낙서나 필기를 하지 마시기 바랍니다 .\n\n8) OMR 답안지 교체는 검사 종료 10 분\xa0전까지만 가능합니다 .\n\n9) 한번 응답한 문항은 수정하거나 변경할 수 없으며 , 답안지를 고치거나 수정하면 그 문항은 무효가 됩니다 .\n\n10) 문제지와 OMR 답안지는 모두 제출해야 합니다 .', '[공통] 2025학년도 여름계절학기 국내대학 학점교류 안내\n\n4) 성적증명서(사본가능)\n\n5) 재학증명서(사본가능)\n\n※ 상기 제출서류 외 교류신청자가 직접 제출하는 것은 해당 대학 안내문 참조\n\n나 . 접수장소\n\n1) 서울캠퍼스 소속학생 : 서울캠퍼스\xa0본관 1 층 118 호 학사종합지원센터 ( 02-2173-2111)\n\n2) 글로벌캠퍼스 소속학생 : 글로벌캠퍼스 학생회관 1층 109호 학사종합지원센터 (031-330-4086)\n\n※ 학사종합지원센터 접수하기 전에 전공 , 부전공 , 이중전공 , 교양 등으로 수강할 경우 ,\n\n학점교류신청원에 반드시 해당 학과장 ( 교양은 교양대학장 ) 의 승인을 받아야 접수되며 수학계획서는 1 전공 학과장님의 승인을 받아야 함\n\n3. 학점교류 안내\n\n가. 신청자격 : 3 학기생 ~7 학기생 (2025-1 학기 기준 )\n\n※ 1 학년 이상 (2 학년 부터 ) 의 과정을 수료하고 총성적 평점평균이 3.0 이상으로 학칙에 의거 , 징계 받은 사실이 없는 자\n\n( 편입생의 경우 편입 첫학기는 불가)\n\n나. 수강신청 허용학점 : 6학점 이내 ( 본교 및 타대학 포함 )\n\n※ 당해 방학기간에\xa0본교\xa0계절학기 및 국내 타대학 수학 , 기타 인정 학점 제도 등을 포함하여 총 6 학점을 초과할 수 없으며 ,\n\n재학중 국내 · 외 타대학 교류 , 인턴십 , 기타 인정 학점제도 등 정규 및 계절학기를 포함하여 취득할 수 있는 최대 인정 학점은 35 학점 ( 편입생은 18 학점 ) 임\n\n다. 교류 횟수 : 계절 학기 4 개 학기 ( 편입생은 2회 )\n\n라. 신청절차\n\n1) 제출서류 작성\n\n2) 소속대학 및 수강과목별 해당 학과 ( 부 ) 장 허가를 받은 후\n\n3) 제출서류를 모두 제출 ( 소속 캠퍼스 학사종합지원센터 )\n\n마. 수강신청 : 수강신청 , 변경 및 취소는 수학 대학에서 정한 절차에 따름\n\n바. 학점인정\n\n1) 교류대학에서 이수한 교과목은 우리대학의 교육과정 교과목을 취득한 것으로 인정함을 원칙으로 하며 , 장학생 선발 등에 관한 학점인정 및 평점 계산에는 삽입하지 아니함', '을 공부해 두는 것이 좋습니다. 졸업 후 취업 또는 진학에 관계없이 영어 \n구사 능력은 항시 요구되므로 대학 입학 이후부터 읽기, 듣기, 말하기, \n쓰기 모든 분야에서 영어 능력을 지속적으로 계발하는 것이 매우 중요\n합니다. 고학년 기간에는 이론적인 지식이 아니라 연구실 인턴을 통해 \n관심분야의 연구를 경험해보며 자신의 진로를 준비하는 것이 좋습니다.\n졸업 후 진로 \n-  기업체: 석유화학, 반도체/전자, 에너지, 신소재, 재료, 바이오, 의료 및 \n제약, 화장품 및 식품 분야\n-  정부 및 공공기관: 국가/지방 공무원 및 정부 산하 공기업\n-  학자 및 연구직: 대학 교수, 국공립연구소 및 정부 출연 연구소, 기\n업 연구소\n-  기타: 교사(교직이수), 창업\nQ&A \nQ1.  한국외대 화학과에 진학하려고 하는데 영어를 잘해야 하나요?\nA1.   한국외대 화학과에서는 원서 전공 교과목 수업과 영어 졸업논문 발\n표 등을 통해 화학 전문 영어를 습득하게 합니다. 또한, 외국어 대\n학의 장점으로 영어를 배울 수 있는 환경(교내 English Zone 운영 \n등)이 잘 갖춰져 있어 영어가 부족하더라도 잘 적응해 나갈 수 있\n습니다.\nQ2.  고등학교 때 화학 과목을 배우지 않았는데 화학과에 진학할 수 있\n을까요?\nA2.  진학은 가능합니다만 반드시 입학 전에 고등학교 과정의 화학을 \n공부해두기 바랍니다. 고등학교 화학의 심화과정인 일반화학 과목\n은 1학년 때 배우며, 2학년부터는 완전히 새로운 전공과목을 수강\n하게 됩니다.\nQ3.  화학과 졸업 후 취업은 잘 되나요? 자연대가 공대에 비해 취업이 \n불리하지 않나요?\nA3.  화학의 큰 장점이 많은 학문 및 기술들과 링크가 되어있다는 것입\n니다. 따라서, 취업할 회사가 매우 많습니다. 석유화학, 반도체/전\n자, 에너지, 바이오, 의료 및 제약, 화장품 및 식품 등의 진로가 가능\n하며 일반 회사원뿐 아니라 연구원, 교수, 공무원, 교사로 갈 수 있\n습니다. 또한, 취업 시장에서 일반적으로 화학 계열로 모집하기 때\n문에 대부분 화학과와 화학 공학과의 차이가 별로 없습니다. 자연\n대 화학과의 경우 화학에 대하여 더 깊이있게 배우기 때문에 R&D\n와 같이 연구를 요하는 전문분야에서는 자연대 화학과를 선호하는 \n경우가 많습니다.\nQ4. 최근 반도체와 에너지 및 AI 산업에도 취업이 잘 되나요?\nA4.  반도체산업에서는 화학물질을 사용하는 공정이 많으므로 소재 및', '## [heading1] ##\n# ④ 문화콘텐츠학전공\n\n## [list] ##\n- 1) 개요 및 교육목표 : 문화콘텐츠학 전공은 철학과와 사학과, 그리고 어문학 관련 학과가 연계하여\n- 2004년 9월 개설된 융합전공으로 여러 신흥 학문을 통섭하는 21세기의 실학이다.\n- 지난 13년 동안 인문학뿐만 아니라 상경 및 이공계 학생들이 수강하고 문화콘텐츠 관련\n- 기관/기업에 취업하고 또 창업해 왔는데, 문화적 다양성을 기반으로 한국문화의 글로벌화\n- 및 세계문화콘텐츠 네트워크 구축에 참여하는 인재 양성을 목표로 한다.\n- 2) 전공개요 : 문화콘텐츠학은 콘텐츠의 기획, 생산, 유통, 소비 등의 전 과정을 학문적으로\n- 접근한다. 특히 한류 4.0시대를 대비하여 문화연구와 문화기술의 이론과 방법론을 습득하고,\n- 문화플랫폼, 스토리텔링, 에스닉-코리아타운 등의 키워드를 중심으로 학습과 실천을 함께\n- 도모한다. 문화콘텐츠학은 융합전공 영역에서 이중(제2)전공 졸업학점을 이수해야한다.\n- 3) 학습분야 : 문화콘텐츠학입문, 문화콘텐츠와 트랜드탐사, 상상력과 문화콘텐츠, 다문화의 이해,\n- 구술사와 콘텐츠기획, 이미지와 상상력, 대중문화콘텐츠분석, 문화콘텐츠와 스토리텔링,\n- 공연예술의 이해, 문화공간과 문화콘텐츠, 문화와 투어리즘, 문화콘텐츠비평론, 지역과\n- 문화자원개발, 축제와 문화콘텐츠, 지역사회와 박물관, 코리아타운과 한류, 글로벌문화정책과\n- 산업, 문화콘텐츠창업전략, 영상콘텐츠제작입문, 영상콘텐츠산업론, 문화교육과 미디어,\n- 도시문화콘텐츠분석, 문화콘텐츠경영론, 테마파크콘텐츠기획 등\n\n## [heading1] ##\n# 4) 국제교류 학점 인정\n\n## [table] ##\n| 국제교류프로그램명 | 인정학점 |\n| --- | --- |\n| 국제교류팀 교환학생/7+1파견학생 프로그램 | 최대 9학점 인정 |\n| KOTRA/해외문화홍보원/재외공관/ 학교와MOU체결기관 인턴십프로그램 | 원칙적으로 학기당 최대 6학점 인정 |', '## [paragraph] ##\n(3) 트랙 선택 시기 : 3학년 진입 전 트랙 선택\n※ 이중전공 변경 신청(재학 중 1회만 가능)으로 트랙 변경 가능\n\n## [table] ##\n| 2학년 | 3학년 | 3학년 |\n| --- | --- | --- |\n| 2학년 | 서울캠퍼스 | 글로벌캠퍼스 |\n| AI융합전공 | Language & AI 트랙 (언어공학사) | - |\n| AI융합전공 | Software & AI 트랙 (공학사) | Software & AI 트랙 (공학사) |\n| AI융합전공 | - | Business & AI 트랙 (경영공학사) |\n\n## [heading1] ##\n# (4) 교과과정 및 전공교류 과목']","졸업하기 전에 제출해야 하는 영어 성적은 '외국어 인증'과 관련된 것입니다. 졸업을 위해서는 다음과 같은 서류를 제출해야 합니다:

1. **외국어인증 신청서**: 해당 서류를 작성하여 제출해야 합니다.
2. **인증 시험 성적**: 제출 시점 기준으로 유효기간(2년) 이내의 인증 시험 성적 또는 대체 과정 수료증이 필요합니다. 성적표 미리보기 캡쳐본은 성적 처리에 사용될 수 없습니다.

이 성적은 졸업하고자 하는 최종 학기 말까지 반드시 제출해야 하며, 학생의 1전공 소속 단과대학 담당에게 이메일로 제출해야 합니다. 정확한 기준이나 세부 사항은 담당 교수님께 문의하시기 바랍니다. 혹시 더 도와드릴까요?","졸업하기 전에 제출해야 하는 영어 성적은 외국어 인증을 위한 것으로, 다음과 같은 기준을 충족해야 합니다:

1.**인증 시험 성적**: 제출 시점 기준 유효기간(2년) 이내의 인증 시험 성적이 필요합니다. 인정되는 시험은 다음과 같습니다:
- TOEIC
   - TOEFL
   - IELTS
   - FLEX 외국어 능력 시험 등

2.**대체 과정 수료증**: 인증 시험 성적 대신 외국어 연수 평가원 또는 외국어 교육센터에서 제공하는 대체 과정을 이수한 경우,해당 수료증을 제출할 수 있습니다.

3. **제출 마감일**: 졸업하고자 하는 최종 학기 말까지 반드시 제출해야 하며,재학 기간 동안 1회 외국어 인증 신청서를 제출할 수 있습니다.

정확한 기준과 제출 방법은 학사종합지원센터에 문의하시거나, 해당 과목의 담당 교수님께 확인하시기 바랍니다.",0.6956200662019777,1.0,0.9090909090909091,0.0
후기 이중에 대해 설명해줘.,"['| 구분 | 기간 | 비고 |', '정하는 시간을 갖게 됩니다.\n2학년  한국문학, 한국역사, 한국문화로 나눠진 한국학 관련 전공 수업과 더\n불어 한국어교원 관련 과목을 본격적으로 수강하게 됩니다. 이상의 \n네 분야 중 학생이 선택한 분야에 초점을 맞추어 강의를 듣게 됩니다.\n3학년  2학년에 수강한 분야들 중 하나 혹은 두 분야에 초점을 맞추어 수\n업을 들으면서 졸업논문 프로젝트를 위한 강의도 수강하게 됩니다.\n4학년  실습이나 연습 과목 위주로 수강하면서 졸업논문 계획서 제출, \n졸업논문 작성 및 완성본 제출을 하게 됩니다.\n졸업 후 진로', '을까요?\nA3.  전쟁 이후 우크라이나어의 위상은 높아지고 사용 빈도는 증가할 것\n입니다. 그리고 우크라이나의 복구 사업에 우리 기업들이 많이 참\n여할 것으로 예상되며, 우리 학생들이 전공을 살려 통역, 무역, 비\n즈니스, 공공서비스, 연구 등 여러 분야에서 활발히 일할 수 있을 \n것입니다.', '람이 이해하기 쉽게 설명하는 연습을 해보세요. \n우리 학과(부)·전공 매력 \n-  인공지능, 4차 산업혁명을 위한 인재 양성\n-  최고 수준은 교수진이 제공하는 최고의 교육\n-  실용적/문제 해결 능력 중심 교육을 통한 졸업 후 취업의 질과 양에\n서 최고라 자부\n-  재학생들 관련 경진 대회 수상 다수(교수진의 전폭적인 지원을 통해 \n졸업 후 취업 가능성 최대화)\n주요 실적 \n-  대학생 산업공학프로젝트 경진대회 최근 5년간 대상 2회 등 다수 수상\n-  산업공학회 석사논문경진대회 최근 5년간 대상, 최우수상 포함 다\n수 수상', '[공통] 후기이중전공 신청 공고\n\n[공통] 후기이중전공 신청 공고\n\n(공통) 후기이중전공 신청 공고\n\n2025학년도 후기이중전공 신청 일정 및 방법 등을 공고합니다.\n\n1. 신청기간: 2025 4. 14.(월) 10:00 ~ 4. 18.(금) 16:00까지\n\n2. 신청대상: 현재 7~8학기 이수중인 자로, 후기이중전공을 희망하는 전공을 부전공으로 이수중인 자\n\n(7학기를 마치고 휴학한 학생도 이번 신청기간에 신청할 것)\n\n3. 신청방법: 인터넷 종합정보시스템에서 신청 (로그인 > 전공/교직관리 > 후기이중전공신청)\n\n4. 허가자 발표: 7월초 홈페이지 공고(예정)\n\n5. 기타사항\n\n가. 1년에 1회, 4월에만 신청하므로 반드시 희망자는 이번 신청 일정을 따를 것', '네 분야 중 학생이 선택한 분야에 초점을 맞추어 강의를 듣게 됩니다.\n3학년  2학년에 수강한 분야들 중 하나 혹은 두 분야에 초점을 맞추어 수\n업을 들으면서 졸업논문 프로젝트를 위한 강의도 수강하게 됩니다.\n4학년  실습이나 연습 과목 위주로 수강하면서 졸업논문 계획서 제출, \n졸업논문 작성 및 완성본 제출을 하게 됩니다.\n졸업 후 진로 \n-  기업: 마케팅, 콘텐츠 비즈니스, 콘텐츠 기획, 해외전략기획 \n-  공기업: 관광, 민간외교, 문화교류, 전시, 기록관리 \n-  대학원: 국제대학원, 일반대학원의 한국어교육 및 한국학 관련 학과 \nQ&A \nQ1. 한국학과 학생들은 졸업 후 주로 어떤 분야로 진출하나요? \nA1.  한국학과 졸업생들은 학과에서 이수한 전공 교육에 기초하여 국내·외', '[공통] 후기이중전공 신청 공고\n\n[공통] 후기이중전공 신청 공고\n\n(공통) 후기이중전공 신청 공고\n\n2025학년도 후기이중전공 신청 일정 및 방법 등을 공고합니다.\n\n1. 신청기간: 2025 4. 14.(월) 10:00 ~ 4. 18.(금) 16:00까지\n\n2. 신청대상: 현재 7~8학기 이수중인 자로, 후기이중전공을 희망하는 전공을 부전공으로 이수중인 자\n\n(7학기를 마치고 휴학한 학생도 이번 신청기간에 신청할 것)\n\n3. 신청방법: 인터넷 종합정보시스템에서 신청 (로그인 > 전공/교직관리 > 후기이중전공신청)\n\n4. 허가자 발표: 7월초 홈페이지 공고(예정)\n\n5. 기타사항\n\n가. 1년에 1회, 4월에만 신청하므로 반드시 희망자는 이번 신청 일정을 따를 것\n\n나. 지원학과 입학정원의 50 ~ 150% 이내에서 학과 자율 선발하되, 학과에서 요구하는 기본 자격요건 미충족 시 탈락될 수 있음\n\n(세부 배정기준은 지원학과 학과장실 문의 또는 학과 홈페이지 참조)', '6. 전 과 ····································································· 77', '프 모델, kernel 방법론, VC 차원과 같은 고전적인 내용부터 latent \nstable diffusion, transformer 그리고 CLIP과 같은 최근 모델까지 \n학생들이 전공 수학을 통해 꼼꼼하게 학습하고, 실습할 수 있도록 하\n고 있습니다. 또한 우리 학과는 1학년 과목인 논리 및 기초 프로그래\n밍을 통해 그들의 수학 눈높이에서 맞춘 deep learning 교육을 진행\n하고 있습니다.\n학과(부) 특별 프로그램 \n-  매 학기 성적우수자 장학금 지급\n-  졸업 후 진로선택을 위한 캡스톤디자인 프로그램 (예정)\n-  학부생 조교로 활동 가능\n-  교수님 과제 참여로 연구조원으로 활동 가능\n학과(부) 행사 및 동아리 활동 \n-  수학과 콜로키움과 특별강연: 최근에는 미국 아마 AWS의 software \nengineering manager님과 스톤브릿지벤쳐스에서 수석팀장님, 스탠\n다임의 AI tech leader님을 연사로 모셨습니다.\n-  과동아리 HABIT은 프로그래밍과 기계학습을 공부하는 학생들의 연\n구모임입니다.\nDept. of Mathematics\n수학과\n전화번호 031-330-4262\n홈페이지 math.hufs.ac.kr\n슬기로운 대학생활 \n수학과는 깊은 사고력과 추상적인 개념을 능숙하게 다룰 수 있는 논리\n력을 지닌 인재를 길러내고자 합니다. 문명과 기술이 첨단화되고 고도\n화되면서 많은 업무가 자동화되는 지금은 단순한 지식 습득의 수준을 \n넘어 수학과가 지향하는 인재가 요구되고 있습니다. 대학생활은 어떠한 \n분야에 본인이 어울리는지, 그리고 필요한 준비를 해야 하는 시기입니\n다. 관련하여 다음과 같이 몇 가지 조언을 제시합니다.\n1.  다양한 경험을 쌓으세요. 실패를 통해 남을 이해할 수 있는 아량을 얻\n고, 어려움을 극복하고 성공한 경험을 통해 미래의 힘든 시기를 이겨\n낼 수 있게 하는 자존감을 쌓으세요. \n2.  수학 전공 과목에서 다루는 정리와 문제를 가능한 스스로 고민하고, \n해결하세요. 처음에는 힘들고 오랜 시간이 걸리겠지만, 이러한 어려\n움 통과해야 성장하고 시대가 요구하는 인재가 되는 것입니다.\n3.  산책 등 스스로 생각하는 습관을 만들고 동시에 글쓰기 실력을 기르\n세요. 한편, ChatGPT에게 다양한 질문과 요구를 연습하는 것도 논리\n적으로 생각을 정리하여 표현하는 능력을 기르는 좋은 방법입니다.\n졸업 후 진로', '력이 잘 드러날 수 있는 비주얼콘텐츠/스토리콘텐츠/K-콘텐츠/\n콘텐츠비즈니스 중에서 2가지 이상 분야의 다양한 수업의 수강\n을 권장합니다.\n3학년  더욱 심화된 내용을 통해 진로 선택에 있어 도움이 되는 분야를 \n정해 집중적으로 수강하기를 권장합니다. 현장실습을 고려하고 \n있다면 1~3학년까지 배웠던 수업을 정리하는 일도 중요합니다. \n해외 대학과의 교류 프로그램에 참여하거나, 이중전공, 부전공, \n마이크로전공 등을 적절히 활용하여 연계할 필요가 있습니다.\n4학년  지금까지의 수업 내용을 바탕으로 실습을 진행하는 활동이 중심\n이 됩니다. 졸업을 앞둔 시기로서 이론을 실제 환경에 적용하려\n는 노력이 필요하기에 본인이 수강했던 수업 내용이나 활동 등을', '2. 유고결석·결시 처리 절차 ····································································· 68\n3. 이중전공 및 부전공(전공심화) ····································································· 70\n4. 후기이중전공 ····································································· 75\n5. 조기졸업 ····································································· 76', '3) 후기이중전공 선발자 가 이중전공 변경 배정된 경우 이중전공 변경으로 처리 됨\n\n( 단 , 후기이중전공 이수 희망자 제외 )\n\n나 . 이중전공 변경에 미배정 된 경우\n\n1) 기존에 이수 중인 이중 / 부전공 은 그대로 유지 됨\n\n3. 이수구분 변경 안내 : 이수구분 변경이 필요한 경우 학사종합지원센터 홈페이지 서식함의 “ 이수구분 변경 신청서 ” 작성 제출 ( ※ 상시 제출 가능 )\n\n▶ ( 서울 ) 이수구분 변경 신청서 바로가기 / ▶ ( 글로벌 ) 이수구분 변경 신청서 바로가기\n\n4. 기타 안내사항\n\n가 . 부전공 희망자 및 단일전공 희망자 의 경우 추후 종합정보시스템으로 별도 신청 예정\n\n1) 부전공 희망자 : 일반 부전공 또는 전공심화 + 부전공 신청\n\n2) 단일전공 희망자 : 기존 이중 / 부전공 취소\n\n※ 자세한 일정은 2025 년 1 월 중순 학사공지 예정인 “ 부전공 신청 및 이중전공 / 부전공 취소 일정 ” 확인', '| 영어 | 영어통번역학부 | 2009~2013학번 | 영국문학이해(영국소설), 미국문학이해(미국소설) |\n| 영어 | 영어통번역학부 | 2014학번 이후 | 영국소설, 미국소설 |', '사료를 분석하는 방법도 익히게 됩니다.\n3학년  한국사, 동양사, 서양사와 관련된 다양한 전공심화 과목과 응용\n역사학 강좌를 공부하게 됩니다. 스스로 연구논문을 작성할 수 \n있는 기초를 배양하게 됩니다.\n4학년  전공심화과목을 수강하고, 본인 진로와 관련된 강좌를 집중적으로 \n이수합니다. 학과 전임교수의 지도하에 졸업논문을 작성합니다. \n졸업 후 진로 \n-  정부 및 공공기관: 국공립 박물관의 학예직공무원, 국가기록원 및 지\n자체·대학역사관의 기록연구사, 공무원 등\n-  교육 및 연구: 대학교수, 역사교사, 역사문화 관련 연구소 및 박물관', '이은구 교수님은 인도학과 학과 소속입니다. 이메일은 shanti9@hufs.ac.kr입니다.', '다임의 AI tech leader님을 연사로 모셨습니다.\n-  과동아리 HABIT은 프로그래밍과 기계학습을 공부하는 학생들의 연\n구모임입니다.\nDept. of Mathematics\n수학과\n전화번호 031-330-4262\n홈페이지 math.hufs.ac.kr\n슬기로운 대학생활 \n수학과는 깊은 사고력과 추상적인 개념을 능숙하게 다룰 수 있는 논리\n력을 지닌 인재를 길러내고자 합니다. 문명과 기술이 첨단화되고 고도\n화되면서 많은 업무가 자동화되는 지금은 단순한 지식 습득의 수준을 \n넘어 수학과가 지향하는 인재가 요구되고 있습니다. 대학생활은 어떠한 \n분야에 본인이 어울리는지, 그리고 필요한 준비를 해야 하는 시기입니\n다. 관련하여 다음과 같이 몇 가지 조언을 제시합니다.\n1.  다양한 경험을 쌓으세요. 실패를 통해 남을 이해할 수 있는 아량을 얻\n고, 어려움을 극복하고 성공한 경험을 통해 미래의 힘든 시기를 이겨\n낼 수 있게 하는 자존감을 쌓으세요.', '| 7 | 13 | 14 | 15 | 16 | 17 | 18 | 19 | 6. 30(월) - 7. 4(금) 7. 11(금) 7. 30(수) | 제1학기 성적 열람 및 정정 계절학기 종강 2025년 후기 졸업 사정회의 |\n| 7 | 20 | 21 | 22 | 23 | 24 | 25 | 26 | 6. 30(월) - 7. 4(금) 7. 11(금) 7. 30(수) | 제1학기 성적 열람 및 정정 계절학기 종강 2025년 후기 졸업 사정회의 |\n| 7 | 27 | 28 | 29 | 30 | 31 |  |  | 6. 30(월) - 7. 4(금) 7. 11(금) 7. 30(수) | 제1학기 성적 열람 및 정정 계절학기 종강 2025년 후기 졸업 사정회의 |\n| 8 |  |  |  | 6 |  | 1 | 2 | 8. 4(월) - 8. 8(금) 8. 15(금) 8. 22(금) | 제2학기 휴․복학 신청 제2학기 수강신청 광복절 2025년 후기 학위수여식 |\n| 8 | 3 | 4 | 5 |  | 7 | 8 | 9 | 8. 4(월) - 8. 8(금) 8. 15(금) 8. 22(금) | 제2학기 휴․복학 신청 제2학기 수강신청 광복절 2025년 후기 학위수여식 |\n| 8 | 10 | 11 | 12 | 13 | 14 | 15 | 16 | 8. 4(월) - 8. 8(금) 8. 15(금) 8. 22(금) | 제2학기 휴․복학 신청 제2학기 수강신청 광복절 2025년 후기 학위수여식 |\n| 8 | 17 | 18 | 19 | 20 | 21 | 22 | 23 | 8. 4(월) - 8. 8(금) 8. 15(금) 8. 22(금) | 제2학기 휴․복학 신청 제2학기 수강신청 광복절 2025년 후기 학위수여식 |\n| 8 | 24 31 | 25 | 26 | 27 | 28 | 29 | 30 | 8. 4(월) - 8. 8(금) 8. 15(금) 8. 22(금) | 제2학기 휴․복학 신청 제2학기 수강신청 광복절 2025년 후기 학위수여식 |', '2025년 후기 학위수여식 일정:\n2025-08-22 (금요일)', '2025년 후기 졸업 사정회의 일정:\n2025-07-30 (수요일)', '| 6 | 15 | 16 | 17 | 18 | 19 | 20 | 21 | 6. 6(금) 6. 9(월) - 6. 13(금) 6. 13(금) 6. 16(월) - 6. 20(금) 6. 20(금) - 6. 27(금) 6. 23(월) | 현충일 제1학기 보강주간 졸업시험 성적보고서 및 졸업논문 심사보고서 제출 마감 제1학기 기말시험 제1학기 성적입력 하계방학 및 계절학기 개강 |\n| 6 | 22 | 23 | 24 | 25 | 26 | 27 | 28 | 6. 6(금) 6. 9(월) - 6. 13(금) 6. 13(금) 6. 16(월) - 6. 20(금) 6. 20(금) - 6. 27(금) 6. 23(월) | 현충일 제1학기 보강주간 졸업시험 성적보고서 및 졸업논문 심사보고서 제출 마감 제1학기 기말시험 제1학기 성적입력 하계방학 및 계절학기 개강 |\n| 6 | 29 | 30 |  |  |  |  |  | 6. 6(금) 6. 9(월) - 6. 13(금) 6. 13(금) 6. 16(월) - 6. 20(금) 6. 20(금) - 6. 27(금) 6. 23(월) | 현충일 제1학기 보강주간 졸업시험 성적보고서 및 졸업논문 심사보고서 제출 마감 제1학기 기말시험 제1학기 성적입력 하계방학 및 계절학기 개강 |\n| 7 |  |  | 1 | 2 | 3 | 4 | 5 | 6. 30(월) - 7. 4(금) 7. 11(금) 7. 30(수) | 제1학기 성적 열람 및 정정 계절학기 종강 2025년 후기 졸업 사정회의 |\n| 7 | 6 | 7 | 8 | 9 | 10 | 11 | 12 | 6. 30(월) - 7. 4(금) 7. 11(금) 7. 30(수) | 제1학기 성적 열람 및 정정 계절학기 종강 2025년 후기 졸업 사정회의 |\n| 7 | 13 | 14 | 15 | 16 | 17 | 18 | 19 | 6. 30(월) - 7. 4(금) 7. 11(금) 7. 30(수) | 제1학기 성적 열람 및 정정 계절학기 종강 2025년 후기 졸업 사정회의 |', '학자를 배출함으로써, 국제사회에서 탄소외교의 신뢰성을 확보할 수 \n있을 것으로 기대합니다. \n-  기후변화 관련 국제적 수준의 연구경험을 쌓을 수 있는 기회를 제공\n합니다.\n-  대기환경기사 또는 온실가스 관리기사 자격증을 취득할 수 있는 커리\n큘럼으로 구성되어 있습니다.\n주요 전공과목 \n기후변화융합학부는 온실가스 감시 및 예측, 기후변화경제, 에너지 관\n리 및 정책 총 세 개의 트랙으로 구성되어 있습니다. 각 트랙별로 짜임\n새 있는 강의 계획을 통해, 해당 트랙에 관심이 있는 학부생들에게 학습 \n방향을 제시해줄 것입니다.\n-  기후 빅데이터 프로그래밍 및 실습: 기후변화와 관련된 빅데이터를 \n처리하고 분석하는 방법을 학습하는 과목입니다. 이 과목에서는 데이\n터 수집, 데이터 저장, 데이터 처리, 데이터 분석, 데이터 시각화 등의 \n내용을 다룹니다. 학습에 사용할 프로그램은 주로 오픈소스인 R이나 \npython을 사용합니다. 기후변화연구에 특화된 분석법을 소개하고 다\n양한 형태의 입력자료들을 처리하는 방법에 대해 수업합니다.\n-  기후변화개론: 기후변화로 인해 발생한 현상들을 중점적으로 살펴보\n며, 학생들이 환경 이슈에 대한 자신의 생각을 정립하는 것을 목표로 \n합니다. 학생들은 수업을 통해 기후변화의 이론과 현상, 관련 정책, 그\n리고 지구적 차원의 대응 양상에 대해 학습하게 됩니다. 이 과목은 기\n후변화에 대한 전반적인 이해를 넘어 기후변화 적응의 필요성을 이론\n적으로 검토하고, 기후변화 적응 전략을 어떻게 구체적으로 수립할 것\n인지를 모색하기 위해 기존에 이루어진 적응전략들을 깊이 있게 검토 \n분석함으로써 기후변화 적응전략을 수립할 수 있는 인재를 양성하는 \n것을 목표로 합니다. \n-  기후계량경제학: 경제이론의 실증적인 분석을 위해 근대 통계학과 경\n제수학에 대해 학습합니다. (1) 경제이론형성에서는 경제이론에 대한 \n기본적인 내용을 배웁니다. (2) 모형구성은 형성된 경제이론의 수식화\n에 대해 학습합니다. (3) 통계분석법에서는 수식화에서 얻은 식에 통\n계방법을 이용하여 과거의 통계자료를 부합시키는 과정을 배웁니다(\n상관계수, 다중공선성, 식별, 자기상관등의 제반계량경제의 모형 등). \n이외에도 여러 가지 경제자료의 출처와 자료를 읽는 능력, 수집된 경\n제자료를 배열하고 처리하는 능력 등을 배웁니다. 이를 통해 경제현\n상에 대한 가설들을 실증적으로 검증할 수 있는 능력을 양성합니다.', '## [heading1] ##\n# 4. 융합전공\n\n## [heading1] ##\n# 가. 융합전공 개요\n\n## [list] ##\n- 1) 2개 이상의 학과(학부/전공)가 연계하여 개설한 전공으로, 융합전공은 이중(제2)전공\n- 으로만 이수 가능함(국가리더전공 및 데이터사이언스전공은 부전공도 가능)\n- 2) 이중전공으로 이수하므로, 학번대에 따라 42학점 또는 54학점을 이수하여야 함\n- 3) 2006학번 이전 학생은 문화콘텐츠학, EU, 동북아전공에 한해 이수 가능\n- 4) 융합전공 졸업논문/졸업시험 시행은 관련 학과 협의로 시행하되, 그 절차는\n- “졸업논문 및 졸업시험 시행규정”에 따름\n- 5) 융합전공은 후기 이중전공 불가\n- 6) 개설 전공\n\n## [table] ##\n| 일반융합전공 | 일반융합전공 |\n| --- | --- |\n| 나-① | BRICs(브릭스)전공 |\n| 나-② | EU(유럽연합)전공 (EU전공(글로벌)은 2023학년도부터 폐지, 서울에 개설된 EU전공만 신청 가능) |\n| 나-③ | 동북아외교통상전공[(구) 동북아전공] (동북아전공(글로벌)은 2018-2학기부터 폐지, 서울에 개설된 동북아외교통상전공만 신청 가능) |\n| 나-④ | 문화콘텐츠학전공 |\n| 나-⑤ | 국가리더전공 |\n| 나-⑥ | 세계문화예술경영전공 |\n| 나-⑦ | 디지털인문한국학전공(신규신청 불가) |\n| 나-⑧ | 데이터사이언스전공(신규신청 불가) |\n| 나-⑨ | 바이오데이터사이언스전공(신규신청 불가) |\n| 나-⑩ | AI융합전공(Software&AI, Language&AI, Business&AI 트랙)(신규신청 불가) |\n| 나-⑪ | Business & AI전공 |', '-  논리적사고 + 비판적 관찰력 + 도전적 정신 함양\n-  학부생의 다양한 연구 참여기회\n-  미래 생명과학 인재를 위한 소양과 역량 강화\n-  국제적 혁신 연구를 수행할 생명공학 전문가 양성\n주요 실적 \n-  과학기술정보통신부, 보건복지부 등 정부 주요 기관 지원을 받는 다\n양한 연구 과제 수행\n-  바이오융합센터 운영\n-  다수의 바이오벤처 창업\n주요 전공과목 \n-  유전학: 유전 현상에 대한 자세한 이해와 DNA에 대한 심도 깊은 내\n용을 배웁니다. \n-  바이러스학: 바이러스에 대한 기본적 이해를 바탕으로 바이러스 유래 질병\n의 발병원인과 치료방법에 대해 공부합니다. 현대 바이오산업에서 바이러\n스를 이용하는 분야 및 백신과 치료제로서의 바이러스의 특성을 배웁니다. \n-  줄기세포생물학: 줄기세포학에 대한 기본 개념, 줄기세포의 특성과 다\n양한 응용에 대해 배웁니다. \n-  감염미생물학: 세균에 의한 감염 및 관련 인자들에 대해 공부하고, 숙\n주와의 상호작용을 이해하여 감염기작을 심도 깊게 배웁니다. \n-  면역학: 면역에 대한 기본 개념 및 세균과 바이러스와 같은 다양한 감\n염체에 대한 방어기작에 대해 분자적, 세포적 수준에서 면밀하고 심\n도 깊게 공부합니다.  \n-  합성생물학개론: 생명공학의 최첨단 학문 분야인 합성생물학에 대한 \n기본 개념을 이해하고 연구 사례들을 통해 융합과학자로서의 창의적\n인 사고 발달을 기를 수 있는 방법을 공부합니다. 아울러 바이오벤처\n의 여러 사례를 바탕으로 향후 바이오사업의 방향 등에 대한 새로운 \n아이디어를 기르는 법을 배웁니다. \n학과(부) 특별 프로그램 \n-  수시, 정시 합격자 성적장학금 지급\n-  매 학기 성적우수자 장학금 지급\n-  로테이션 제도를 통한 연구과제 참여 기회 제공\n-  실험실습 (로테이션) 제도를 통한 대학원 진학 연계 기회 제공\n학과(부) 행사 및 동아리 활동 \n-  학술지: 편집부 활동과 다양한 생명공학 분야에 대한 내용을 주제로 \n매년 「In vivo」발간\n-  로테이션: 각 실험실에서 일정 기간 동안 실험에 참여하면서 연구 경\n험을 쌓는 활동\n슬기로운 대학생활 \n1학년  기초교양 위주로 수업을 듣고, 일반 생물학을 수강하게 됩니다. 일\n반 화학, 일반 물리, 대학 수학 등 과학과 수학 전반에 대한 책을 많\n이 읽고 영어 능력을 키우면 전공 공부에 크게 도움이 됩니다.', '1312\n전공소개 \n2007년 유럽연합 회원국이 된 루마니아(인구: 8위, 국토면적: 9위)는 ‘\n유럽의 보석’이라 불릴 정도로 아름다운 자연환경과 풍부한 천연자원으\n로 동유럽 국가 중에서 경제적 성장잠재력이 가장 높은 나라로 주목받\n고 있습니다. 1987년 설립된 루마니아학과는 루마니아(Romania)와 몰\n도바(Moldova)공화국의 어문학 및 지역학을 공부할 수 있는 국내 유일\n의 고등교육기관입니다. 라틴어에 뿌리를 둔 루마니아어의 실질적인 구\n사력 및 문헌 이해 능력의 배양과 더불어 루마니아 지역학 관련 지식의 \n습득으로 현지에 특화된 전문가를 양성하고 있습니다. 우리나라의 공기\n업을 비롯한 대기업과 중소기업들이 판매 및 제조법인 등 다양한 형태로 \n루마니아에 투자하거나 사업진출을 도모하고 있습니다.\n필요역량 및 소양 \n교과의 측면에서는 발칸반도, 나아가 동부 유럽에 대한 역사와 문화에 \n대해 관심을 갖고 특히 루마니아의 역사와 사회문화에 대해 흥미를 가\n지고 있으면 좋습니다. 또한 전공과 관련해서 문학, 지역학 등 다양한 분\n야의 서적을 읽는 것도 도움이 됩니다. 이는 단순히 언어만 배우는 게 아\n닌 루마니아의 문화, 정치, 역사 등 다양한 분야에 대해 입학 후 배우기 \n때문입니다. 아울러, 언어적인 측면에서는 루마니아어를 모르더라도 새\n로운 언어를 배우는 데에 두려움을 갖지 말고 호기심을 가지고 적극적\n인 자세를 함양하는 게 도움이 되리라 생각합니다.\n우리 학과(부)·전공 매력 \n-  루마니아어는 동유럽 유일의 라틴 로망스어로 이태리어, 프랑스어, \n스페인어와 유사\n-  루마니아를 포함한 중부유럽 전체를 조망하며 국내외 연구기관과 유\n기적 연계\n-  루마니아 진출 및 유관 한국기업과의 협업\n-  취득 가능한 자격증: 유럽 언어 공통 기준(Common European \nFramework of Reference for Languages, CEFR by CE) 평가등급, \nFLEX 루마니아어 졸업인증\n주요 전공과목 \n1학년  루마니아학입문, 기초루마니아어문법작문, 초급루마니아어번역\n연습, 초급루마니아어회화, 초급시청각루마니아어, 초급루마니\n아어문법작문\n2학년  루마니아사정, 중급루마니아어문법작문, 중급루마니아어번역연\n습, 중급루마니아어회화, 루마니아문화, 고급루마니아어문법작문\n3학년  고급루마니아어회화, 루마니아 문학사, 루마니아 현대문학, 루마', '| 질병 및 상해 로 인한 입원 또는 감염병 으로 인한 격 리(치료) | 법정감염병 (**질병관리청의 법정감염병에 한함) | 격리(치료) 기간 또는 감염우려 기간 | 해당 증빙서류 | 담당교수에게 증빙서류 제출 |  |\n| 졸업시험 | 졸업시험 | 졸업시험 당일 | 학과장 확인서 | 담당교수에게 증빙서류 제출 |  |\n| 수업일수 4분의 3선 후 징병에 의한 군입대 | 수업일수 4분의 3선 후 징병에 의한 군입대 | - | 입영통지서 | 담당교수에게 증빙서류 제출 |  |\n| 출산 | 출산 | 본인:20일 배우자:10일 | 본인 : 출생(출산예정)증 명서 등, 배우자 : 출생 (출산예정)증명서 및 가족관계증명서 등 | 담당교수에게 증빙서류 제출 |  |\n| 생리 | 생리 | 생리기간 (학기중 2회) | 유고결석신청서 (생리공결제) | 담당교수에게 증빙서류 제출 | ※ 자세한 사항은 학사공지사항 생리 유고 신청안내 참조 |\n| 교직과정이수자의 학교현장실습 | 교직과정이수자의 학교현장실습 | 교육실습 기간 | 교직담당자가 발급한 확인서 | 담당교수에게 증빙서류 제출 |  |\n| 졸업예정자(해당학기 졸업가능자) 로서 조기취업자 | 졸업예정자(해당학기 졸업가능자) 로서 조기취업자 | 취업기간 | 학과장 승인받은 유고결석 인정원, 재직(계약)증명서 및 4대보험가입내역 확인서 또는 이에 준하는 재직증명서류 | 입사확정 후 즉시 ￬ 유고결석인정원과 증빙서류에 대해 학과장 승인 ￬ 소속 단과대에 제출 ￬ 유고결석확인서를 발급받아 담당교수에게 제출 ￬ 수업종료 직전 취업사실에 대해 재확인 | ※ 자세한 사항은 학사공지사항 졸업예정자(해 당학기 졸업가능자)의 조기취업 유고결석 신청 안내 참조 |', '-  의생명정보학: 의생명정보학 분야의 대표적인 데이터들을 소개하고, \n각각의 데이터들에 대해 이해하고 이를 다운로드 받아 다뤄보는 것 이\n외에 실제 시퀀스데이터를 가지고 분석하는 여러 가지 툴들을 다뤄보\n고, 이를 통해 실제 분석하는 것으로 진행합니다.\n-  바이오메디컬공학특강: 바이오메디컬공학 분야와 연관된 산업체, 연\n구소, 병원 등에 소속되어 있는 다양한 외부전문가를 초청하여 세미나 \n및 질의응답시간을 가져 전공 및 전공분야에 대한 이해를 높여 학생들\n의 진로탐색 및 취업준비에 실질적인 도움을 주고자 합니다.\n-  BME캡스톤디자인실습: 전공과정에서 학습한 교과 내용을 종합적으\n로 연계하여 창의적인 연구개발 프로젝트를 수행하는 과목입니다. 2\n인이 팀을 구성하여 계획했던 프로젝트를 완성하고 학회 발표 또는 학\n술 논문 작성을 목표로 합니다.', '통해 유통되는 스토리텔링의 구조와 적용, 기술을 탐구합니다. K-콘\n텐츠 영역에서는 세계에서 가장 영향력 있는 한류와 K-콘텐츠의 역\n사와 현황에 대한 통찰력을 키움으로써, 이해와 분석의 역량을 키\n웁니다. 콘텐츠 비즈니스 영역에서는 콘텐츠 유통, 마케팅 및 브랜\n딩 전략을 포함한 디지털콘텐츠의 비즈니스 측면에 대해 포괄적인 \n이해도를 높입니다.\nQ2.  디지털콘텐츠학부가 학부생을 대상으로 이끌어내고자 하는 목표\n는 무엇인가요? \nA2.  디지털콘텐츠학부는 끊임없이 진화하는 글로벌 문화 환경 속에서 \n디지털콘텐츠 분야를 이해하고 융합할 수 있는 미래 인재 양성을 목\n표로 합니다. 전통적이면서도 혁신적인 교육 방법을 통해 학생의 호\n기심을 자극하고, 창의성을 발휘하고, 시민적 책임의 정신을 기르\n며, 더 나아가 학생이 디지털콘텐츠 분야에서 스스로의 미래를 개\n척할 수 있도록 돕습니다.', '발전해 왔으므로 대인관계역량이 필수적으로 요구됨. 학습자들은 투어리\n즘 & 웰니스 학부 교육과정을 통해 이 학문의 활용 대상이 될 사람들의 니\n즈를 이해하고 더 좋은 아이디어와 기획, 정책, 개발 및 경영에 대해 배우\n고 현장실습을 통해 창의적인 기획 아이디어와 실행능력을 펼칠 수 있음.\n주요 실적 \n-  (주)와이즈넛과 MOU 체결\n주요 전공과목 \n-  빅데이터분석: 투어리즘과 웰니스 분야에 필요한 서비스 산업에서의 \n빅데이터를 활용하여 효과적인 의사 결정을 내리고 혁신적인 서비스 \n전략을 개발하는 데 필요한 능력을 강화하는 수업입니다. \n-  GTH개론: 투어리즘과 호스피탤러티 산업의 기본 원리와 개념을 소개\n하는 입문 수업으로 이 분야에 대한 기초 지식을 제공합니다. \n-  GWH산업분석: Global Wellness & Healthcare 산업 동향을 분석하고 \n글로벌 시장에서의 기회와 도전에 대한 통찰력을 제공하여 산업의 전\n반적인 이해를 강화합니다. \n-  서비스이노베이션: 서비스 산업에서 기술을 활용하여 혁신적인 변화\n와 발전을 이끌기 위한 서비스이노베이션의 핵심 개념과 전략에 대해 \n학습합니다. \n슬기로운 대학생활 \n1학년  기초이론 위주로 수업을 듣고, 교양과목을 수강하게 됩니다. 여러 \n방법론과 이론을 많이 읽고 분석 능력을 키우면 전공 공부에 도움\n이 많이 됩니다. \n2학년  본격적으로 전공 수업을 듣게 됩니다. 이론과 실험 수업을 수강하여 \n실험 데이터를 직접 만들어내고 분석하는 과정도 익히게 됩니다.\n3학년  투어리즘 & 웰니스에 관련된 다양한 전공 심화 과목들을 수강하고 \n졸업논문을 위한 실습과 현장체험을 시작하게 됩니다.\n4학년  투어리즘 & 웰니스 캡스톤연구 및 기업  현장 실습을 통해 다양한 \n실무적 경험과 정책 과제 등에도 참여하게 됩니다. \n졸업 후 진로 \n-  정부 및 공공기관: UN 세계관광기구 등 국제기구, 한국관광공사, 문화\n체육관광부, 지자체 관광국, 해외 관관청 지사,국민건강보험공단, 건\n강보험심사평가원, 건강증진개발원 등\n-  연구소 및 연구: 문화관광 연구소, 보건산업진흥연구원 등 \n-  기업체: Tourism & Hospitality 관련 스타트업, 관관 관련 플랫폼 기\n업, 건강 및 예방의학 관련 스타트업, 웰니스 플랫폼 관련 기업, 병원 \n및 재활센터, 글로벌 제약회사, 실버타운 등 \nQ&A \nQ1. 트랙식 교육이 무엇인가요?', '-  HDL및디지털설계: 하드웨어기술언어를 이용하여 디지털 반도체회\n로를 설계하는 방법을 강의합니다. 하드웨어기술언어로는 산업계에\n서 가장 많이 사용하고 있는 Verilog HDL을 배웁니다. Verilog HDL의 \n문법 및 구문에 대한 이론적인 설명을 하고, 이를 바탕으로 여러 가지 \n디지털 반도체회로를 설계, 검증하는 기법을 실습을 통해 익힙니다.\n-  반도체공정: 반도체 제조에 활용되는 노광, 광 마스크, 식각, 세정, 화\n학-기계적 연마, 확산, 박막 등의 단위 공정기술과 트랜지스터, 소자분\n리, 커패시터, 배선 등의 모듈 공정기술의 이론적 배경 및 실제 응용 사\n례를 소개하여 반도체 공정 기술에 대한 이해도를 높입니다.\n-  인공지능반도체: 인공지능을 실현하기 위한 목적으로 개발된 시스템\n반도체에 대해서 배우며, 인공지능, 빅데이터, 사물인터넷, 자율주행\n자동차, 스마트팩토리 등의 다양한 응용 및 서비스에 사용되는 인공지\n능형 시스템반도체 설계에 대해 공부합니다.', '-  반도체, 디스플레이와 같은 첨단 산업 인재 대다수 배출\n-  공기업, 공공기관에도 수많은 인재 배출 \n-  동문 졸업 선배들과의 활발한 교류 및 동문 선배들의 교외 장학금 지원\n주요 실적 \n-  산하 기관으로 산화물 연구센터와 복잡계 연구센터 운영\n주요 전공과목 \n-  일반물리: 물리학과에서 배우는 개념들의 기본이 되는 과목으로, 이\n후에 배우는 심화 과목들을 이해하기 위한 기초적인 이론을 배웁니다.\n-  역학: 역학은 차원 분석과 벡터대수 소개, 뉴턴의 운동법칙, 비선형 진\n동자 문제의 수치적인 해법 등을 다루며, 최종적으로 라그랑주 역학을 \n공부합니다. 자세한 개념 설명을 바탕으로 물리학 원리에 대해 심도있\n게 이해하고 다양한 문제 풀이를 통해 배운 개념을 확립하고자 합니다.\n-  전자기학: 전자기학은 전하들의 상호작용을 다루는 전기장과 전류 도선\n들의 상호작용을 다루는 자기장으로 구성됩니다. 전자기학에서는 전기\n장, 자기장 그리고 전기장과 자기장의 상호작용인 전자기장과 전자기파\n의 전파특성을 결정하는 요소를 배움으로써 전자기학적 현상과 원리를 \n이해하고자 합니다. 또한 눈에 보이지 않는 전자기학적 현상을 일반화\n하고, 이를 구체화하는 과정을 통해 전자기학의 핵심 원리를 배웁니다. \n-  양자역학: 양자역학은 분자, 원자, 기본입자 미시적인 계의 현상을 이\n해하기 위한 과목입니다. 역학, 전자기학을 포함하는 고전 이론을 일\n반화하며, 역학으로 설명되지 않는 현상을 탐구합니다. 양자역학에서\n는 크게 파동함수, 헤밀토니안, 에너지의 관계를 통해 입자가 가지는 \n특성을 살펴봅니다.\n-  반도체물리: 반도체 물리에서는 반도체의 원리에 대해 물리적으로 분\n석합니다. N형, P형, PN 접합 반도체 전자의 거동을 통해 물리적으로 \n해석하고 실제 물리적 학습 내용을 바탕으로 반도체 등에 적용 가능한 \n기본 지식을 배우고 필요한 기술 및 연구 능력을 배양합니다.\n학과(부) 특별 프로그램 \n-  졸업생들의 정성으로 모은 동문장학금 지급(가계 곤란자와 성적우수자) \n-  매 학기 성적 우수자 장학금 지급\n-  교수-학생, 졸업생-3·4학생 멘토링 프로그램 운영\n-  본교 석·박사과정 진학 시 장학생 우선선발 등(본교 내규에 따름)\n학과(부) 행사 및 동아리 활동 \n-  홈커밍 데이: 재학생과 졸업생 선배님들과의 친목 활동\n-  학회: 관심 있는 분야를 연구, 공부', ""문입니다.\n-  언어학은 다양한 인문학을 탐구하는 기본적인 자세인 학문적 호기심\n을 필요로 합니다.\n-  언어기호의 형태/내용/용법에 대한 이해를 심화시키고, 인지 체계에 \n대한 통찰력을 얻고 언어를 처리하는 통계, 프로그래밍언어 등의 현대\n적 학문 도구들을 배울 수 있는 역량을 필요로 합니다.\n우리 학과(부)·전공 매력 \n-  정통 언어학을 통한 인간 자체에 대한 인문학적 탐구 가능\n-  빅데이터 분석을 통한 IT, NLP 전문가 양성\n-  다양한 융합전공 교육: 법언어학, 컴퓨터언어학, 외국어교육, 언어치\n료 등\n-  국내 최고 수준의 연구능력을 갖춘 학과 교수진\n-  성적장학금, 공로장학금 지급 및 7+1파견 등의 다양한 기회\n주요 실적 \n-  한국연구재단의 '2022 우수학자' 지원사업 선정\n-  사학과, 철학과, 한국학과와 함께 디지털인문한국학연구소 공동 운영\n-  디코라(DICORA) 연구센터, 응용언어 센터, 언어와 지식처리 연구센\n터 운영\n주요 전공과목 \n-  언어학 입문: 언어학적인 틀을 사용해서 설명력을 높이고, 흥미 및 관\n심을 지속적으로 유발시키며 언어학적인 전반적인 이해를 돕고, 언\n어에 나타나는 다양한 현상들을 설명하고, 분석력을 키우는 데 목적\n이 있다.\n-  의미론: 자연언어의 의미분석에 대해 개관해 본다. 의미의 기본 개념\n부터 출발하여, 단어의 의미, 문장의 의미 측면들을 살펴보고, 다양한 \n의미 이론들이 이를 어떻게 설명하는지 알아본다. 이로써 자연언어가 \n지니는 의미를 이해하고 기술하는 방법을 습득하고자 한다.\n-  형태분석: 형태론의 기본적인 개념들을 소개하고, 다양한 언어에서 관\n찰되는 여러 가지 유형의 형태론적 구조들을 살펴봄으로써 학생들이 \n이들을 체계적으로 분석하고 이해할 수 있도록 하고자 한다.\n-  심리언어학: 현대 언어학의 목표는 인간의 머릿속 언어 능력의 본질을 \n밝히는 것이다. 심리언어학에서는 다양한 실험 방법으로 언어 자료를 \n수집하고 분석함으로써 머릿속 언어 능력에 대해 연구한다.\n-  자연언어데이터: 현대의 빅데이터에서 중요한 역할을 하는 언어 데이\n터에 대한 이해와 이를 처리하기 위한 연구방법론을 공부하는 것을 목\n표로 한다. 기존 언어학/국어학 문법서에서 정의하는 문장의 개념, 단\n어 ~~의 개념, 수사 명사구, 고유명사, 외래어, 복합명사 등에 대한 언\n어학적 정의와 실제 온라인 언어데이터에서 나타나는 현실적 언어 단"", '1716\nDept. of Hungarian Studies\n헝가리학과\n전화번호 031-330-4222\n홈페이지 hungary.hufs.ac.kr\n전공소개 \n헝가리학과는 한국에서 유일하게 헝가리의 언어와 문화를 교육하는 기\n관으로 특수외국어교육진흥법의 지원을 받아 헝가리어에 대한 교육을 \n기본으로 헝가리 문화, 역사, 정치, 경제, 문학에 대해 배울 수 있는 기\n관입니다. 또한 학부과정 중에 헝가리어 연수, 헝가리 법인 한국 기업의 \n인턴, 방학중 헝가리어 무료집중 온오프 과정을 진행하여 헝가리어만이 \n아니라, 헝가리 전반에 관한 지식과 이해를 겸비한 우수한 인재를 배출\n하고 있습니다. 유럽연합 국가인 헝가리에 교두보를 마련한 SK ON, 삼\n성SDI, 삼성전자, 한국타이어, 두산, LG전자, Eco ProBM과 산하협력업\n체가 현지에 진출해 있어 헝가리 전공자에 대한 높은 수요가 있습니다. \n또한 우리 학교의 교환학생 제도와 헝가리 정부장학생(연 100명) 제도\n로 현지에서 공부할 수 있는 다양한 기회가 제공되고 있습니다.\n필요역량 및 소양 \n-  헝가리에 관한 책을 읽어보시면 좋습니다. 헝가리어 문법이나 회화 \n등의 언어 학습을 도와주는 서적도 많지만, 이보다는 헝가리의 정치, \n사회, 문화, 문학작품 등 다양한 각도에서 헝가리와 헝가리학을 접해\n본다면 폭넓은 관심과 방향성을 가지고 전공 공부를 시작할 수 있습\n니다. \n-  헝가리어 자체에 대해 관심이 있다면, 우리 학교의 <특수어교육진흥\n원>에서 일반인을 대상으로 진행하는 온라인 헝가리어 수업을 듣는 \n것을 추천합니다. 중학생부터 헝가리 파견 주재원까지 구성원의 특성\n에 따라 분반하여 연 2회 12주의 강좌를 진행하고 있습니다.\n우리 학과(부)·전공 매력 \n-  국내 대기업의 대규모 헝가리 투자로 인한 높은 취업률\n-  교육부의 특수외국어 제정 및 프로그램 지원 학과\n-  선후배 간의 튜터링 및 방중 헝가리어 무료 온오프라인집중과정 등 다\n양한 학습 프로그램\n-  자격증 취득 가능: 헝가리어 FLEX 공인 인증 시험, ECL 헝가리어 공\n인 인증 시험\n주요 실적 \n-  특수외국어 교육진흥법의 특수외국어 교육학과\n-  EcoProBM과 업무협약 MOU 체결 \n-  헝가리 법인 삼성 SDI, 헝가리 법인 삼성전자, 주헝 한국문화원 등과\n의 인턴 협약\n-  유럽공인인증시험 ECL 헝가리어 시험 센터 구축\n-  헝가리 국립 시청각 자료 이용 가능한 한국 센터 구축', '계방법을 이용하여 과거의 통계자료를 부합시키는 과정을 배웁니다(\n상관계수, 다중공선성, 식별, 자기상관등의 제반계량경제의 모형 등). \n이외에도 여러 가지 경제자료의 출처와 자료를 읽는 능력, 수집된 경\n제자료를 배열하고 처리하는 능력 등을 배웁니다. 이를 통해 경제현\n상에 대한 가설들을 실증적으로 검증할 수 있는 능력을 양성합니다.\n-  스마트그리드: 기계 학습과 회귀 분석을 활용한 에너지 사용량 예측, \n부하 예측, 분류, 클러스터링 및 딥러닝을 통한 스마트그리드 기술의 \n이해와 에너지 효율을 높이기 위한 방법을 다루는 데 초점을 둡니다. \n전력기술과 IT기술의 융합으로 더욱 안정적이고 효율적인 전력시스\n템 운영을 가능케하는 스마트그리드 기술에 대해 소개하고, 핵심 기\n술인 신재생에너지, 전기자동차, 전력저장장치 등의 기술에 대해 상\n세히 배우게 됩니다. 또한 효율적인 에너지 관리를 위한 최신 연구동\n향을 살펴봅니다.\n학과(부) 특별 프로그램 \n-  수시, 정시 합격자 성적장학금 지급\n-  매 학기 성적우수자 장학금 지급\n-  대학원 실험실을 방문할 수 있는 학년별 랩투어 프로그램 운영\n-  졸업 후 진로선택을 위한 캡스톤디자인 프로그램\n-  기후변화 관련 연구과제 참여 기회 제공\n-  교수-학생 멘토링 프로그램, 실무자-학생 멘토링 프로그램 등\nDivision of Climate Change\n기후변화융합학부\n전화번호 031-330-4256\n홈페이지 cc.hufs.ac.kr\n슬기로운 대학생활 \n1학년  기초교양 및 영어 위주로 수업을 듣고, 기후변화 관련 기초 과목\n을 수강하게 됩니다. 컴퓨터 프로그래밍 등 여러 분야를 많이 경\n험하고 영어 능력을 키우면 전공 공부에 도움이 많이 됩니다. \n2학년  본격적으로 전공 수업을 듣게 됩니다. 이론과 실험 수업을 수강\n하여 자연과학계열의 경우 온실가스 측정장비에 대산 이론 및 실\n습을 통해 장비의 기본 지식을 쌓습니다.\n3학년  기후변화에 관련된 다양한 전공심화 과목들을 수강하고 전공 공\n부와 졸업논문을 위한 연구도 병행하게 됩니다.\n4학년  기후변화에 대한 실무를 접하고 다양한 실험과 논문 작성에 참여\n하여 기후변화 전문가의 자질을 갖추게 됩니다.\n졸업 후 진로 \n-  정부 및 공공기관: 정부(중앙정부와 지방자치단체) 및 정부 산하 공\n기업 종사자 등\n-  학자 및 연구자: 대학교수, 국내 국·공립 기업 연구소 및 국외 관련 연\n구기관의 연구원', '0908\n학과(부) 특별 프로그램 \n-  외부 기업과 산업 협력 프로젝트를 통한 연구원으로 인턴십 기회 공부\n-  학회활동과 학과를 통한 국내, 해외 언어학과(버클리 등)와의 교류 \n기회 제공 \n-  학과 내 학술제, 답사를 통한 언어학 참여 기회 제공\n-  학과 선배 초청 동문 특강으로 진로 설계 로드맵\n-  매 학기 성적우수자 장학금 지급\n-  본교 대학원 진학 시 장학금 지급\n학과(부) 행사 및 동아리 활동 \n-  언어인의 밤: 학생들의 학술 세미나 및 홈커밍데이로 졸업생을 포함\n한 선후배 활동\n-  언어학 학술제: 논문 발표와 토론 세미나\n-  사이시옷: 언어학과 인지과학을 합하여 연구하는 학회\n-  자연어처리 스터디: 자연어처리에 대해 연구하는 스터디 모임\n-  Howls: 전산언어학, 딥러닝에 대해 연구하는 학회\n슬기로운 대학생활 \n1학년  언어와 인간, 언어학 입문, 세계의 언어와 문자를 통해 언어학의 \n기초 수업을 듣습니다.\n2학년  음성학, 형태론, 한국어 문법, 음운분석, 문장분석 등 언어학의 세\n부 분야 학습을 시작합니다.\n3학년  의미론, 인지과학입문, 자연언어 데이터, 언어유형론, 화용론, \nKFL 문법, 빅데이터 감성분석 등을 통해 응용언어학, 이론언어\n학을 결합하여 학습합니다.\n4학년  신경언어학, 언어학연구방법론, 법언어학, 인지심리학 등을 통해 \n인지과학과 언어학 응용의 다양한 분야를 연구합니다.\n졸업 후 진로 \n-  IT관련 기업: 언어 처리 회사, 검색 등의 포털 회사 등\n-  외국인을 대상으로 하는 한국어 강사\n-  언어를 통한 광고 제작자, 방송 PD, 아나운서, 언론 기자 분야 진출\n-  국내/해외 대학원 진학\n-  언어 처리 연구소, 언어치료 대학원 진학\nQ&A \nQ1. 언어학은 무엇이며 언어인지과학과에 들어가면 무엇을 배우나요?\nA1.  언어를 합리적으로 분석하고 그 지식을 활용할 수 있는 방법을 배웁\n니다. 순수 언어학 분야는 음성학, 음운론, 형태론, 통사론, 의미론, \n화용론 등이 있으며, 응용언어학 분야는 심리/신경언어학, 사회언어\n학, 전산언어학, 언어 교육 등이 있습니다.\nQ2.  언어인지과학과에 들어가려면 영어 이외의 제2외국어도 할 줄 알\n아야 하나요?\nA2.  아닙니다. 언어인지과학과의 교육은 세계의 언어학자들이 정리한 \n각 언어의 데이터를 통해 언어의 일반적인 특성을 배우는 과정이기 \n때문에 외국어 능력보다 이성적인 추론 능력을 더 필요로 합니다.', '-  자연언어데이터: 현대의 빅데이터에서 중요한 역할을 하는 언어 데이\n터에 대한 이해와 이를 처리하기 위한 연구방법론을 공부하는 것을 목\n표로 한다. 기존 언어학/국어학 문법서에서 정의하는 문장의 개념, 단\n어 ~~의 개념, 수사 명사구, 고유명사, 외래어, 복합명사 등에 대한 언\n어학적 정의와 실제 온라인 언어데이터에서 나타나는 현실적 언어 단\n위들 사이의 차이점을 비교 공부한다.\n-  한국어 문법: 언어학적 관점에서 한국어의 형태론적 특성과 통사론적 \n특성을 밝히고, 이 특성을 기술하는 데에 있는 문제점들과 이에 대한 \n해결 방안을 함께 살펴본다.\n-  통사론: 낱말이나 구와 같은 문법 단위가 형태적/기능적으로 어떤 속\n성을 가지고 있는지, 이들이 어떻게 결합되어 보다 큰 단위인 구나 문\n장을 만드는가에 대해 알아본다. 나아가 통사론에서 기본적으로 다루\n어야 할 언어 현상을 배우고, 이를 설명하기 위해 필요한 개념을 함\n께 학습한다.', '분야에서 컴퓨터 프로그래밍 및 기술을 활용하는 방법에 대해 다루\n는 수업입니다.\n-  스포츠재무관리: 스포츠 산업 내에서 재무적인 측면을 이해하는 데 필\n요한 기초적인 개념과 도구들을 다루는 과목입니다.\n-  스포츠이벤트기획 및 실습: 스포츠 이벤트를 기획하고 운영하는 데 필\n요한 전략적인 개념과 실무적인 능력을 학습하는 과목입니다.\n학과(부) 특별 프로그램 \n-  국내/국제 스포츠 이벤트 방문 및 관람\n-  해양스포츠 (스노쿨링 및 서핑 등) 참여\n-  동계스포츠 (스키 및 스노우보드) 참여\n-  교내 및 전국구 규모의 스포츠이벤트 대회 개최\n-  스포츠산업 내 다양한 분야 전문가들 특강 진행\n-  졸업생들과의 만남 \n-  본교 대학원 진학 시 장학금 지급\n학과(부) 행사 및 동아리 활동 \n-  IWAY 학회: 축구부 활동 및 축구 산업에 대한 토론 \n-  STEPPER 학회: 스포츠산업 관련 기사, 영상 및 팟캐스트 제작\n-  HIKERS 학회: 야구부 활동 및 야구구단 프런트 업무 수행\n-  FC HOLICS: 여자 축구부 활동\n-  MADDOGS: 다소 생소한 라크로스 운동부 활동\n-  라마제: 매년 개최되는 홈커밍데이']","'후기 이중전공'은 부전공을 이수 중인 학생이 정규 8학기 내에 제1전공 졸업학점(부전공 21학점 포함)을 모두 취득한 후, 추가 학기를 통해 해당 부전공의 이중전공화에 필요한 나머지 학점을 취득하여 제1전공과 이중전공 학위를 동시에 취득하는 제도입니다.

주요 사항은 다음과 같습니다:

1. **신청 자격**: 부전공을 이수 중인 7~8학기 학생이 신청할 수 있습니다. 조기졸업대상자 및 학·석사연계과정 이수자는 신청할 수 없습니다.
2. **신청 시기**: 매년 4월 중에 신청할 수 있으며, 1년에 1회만 신청 가능합니다.
3. **이수학점**: 후기 이중전공으로 선발되면 추가학기를 1학기 이상 등록해야 하며, 등록금은 후기 이중전공 학과의 등록금으로 납부해야 합니다.
4. **선발 인원**: 지원학과 입학정원의 50~150% 이내에서 학과 자율적으로 결정됩니다.

후기 이중전공을 통해 학생들은 두 개의 전공을 동시에 이수하여 더 넓은 진로 선택의 기회를 가질 수 있습니다. 더 궁금한 점이 있으신가요?","후기 이중전공은 부전공 이수자가 정규 8학기 내에 제1전공 졸업학점(부전공 21학점 포함)을 모두 취득한 후, 1~2학기 추가 수학하여 해당 부전공의 이중전공화에 필요한 나머지 학점을 취득함으로써, 제1전공과 이중전공 학위를 동시에 취득하는 제도입니다.
신청은 매년 4월에 한 번만 가능하며, 신청 자격은 현재 7~8학기 이수 중인 학생으로, 부전공을 이수 중인 경우에 해당합니다.
추가학기를 등록해야 하며, 등록금은 후기 이중전공 학과의 등록금으로 납부해야 합니다. 더 궁금하신 점이 있으시면 말씀해 주시기 바랍니다.",0.3172596311206451,0.75,1.0,0.8016606603008408
김정환 교수님 연구실 어디야?,"['김정환 교수님은 루마니아학과 학과 소속입니다. 교수 직위를 맡고 있습니다. 이메일은 bacovia@empas.com입니다. 연구실은 어문관 435호입니다.', '김정환 교수님은 브릭스 전공 전공 소속입니다.', '한희일 교수님 교수님은 정보통신공학과 학과 소속입니다. 이메일은 hihahn@hufs.ac.kr입니다. 연구실은 백년관 721호입니다.', '황 신 환 교수님 [Shin hwan Hwang] 교수님은 전자공학과 학과 소속입니다. 겸임교수 직위를 맡고 있습니다.', '김세화 교수님 교수님은 정보통신공학과 학과 소속입니다. 이메일은 ksaehwa@hufs.ac.kr입니다. 연구실은 공학관 408-3호입니다.', '정환승 교수님은 태국어통번역학과 학과 소속입니다. 교수 직위를 맡고 있습니다. 연구실은 연구동(글로벌) 308호입니다.', '정상철 교수 교수님은 일본어통번역학과 학과 소속입니다. 이메일은 jung1024@hufs.ac.kr입니다. 연구실은 백년관 1003호입니다.', '라영균 교수 교수님은 독일어통번역학과 학과 소속입니다. 연구분야는 문예학 및 미학입니다. 이메일은 rayoungk@hufs.ac.kr입니다. 연구실은 백년관 교수 연구실 705호입니다.', 'Jeong-Wook Oh 교수님은 화학과 학과 소속입니다. Ph.D. Chemistry, Seoul Nat’l University, Korea 학위를 가지고 있습니다. 이메일은 jeongwoh@hufs.ac.kr입니다. 연구실은 나노바이오광전기화학 연구실 (자연대 416호)입니다.', 'Yongae Kim 교수님은 화학과 학과 소속입니다. Ph.D. Chemistry, Univ. of Pennsylvania, USA 학위를 가지고 있습니다. 이메일은 yakim@hufs.ac.kr입니다. 연구실은 구조생물화학 연구실 (자연대 417호)입니다.', 'Hae-Jo Kim  (Chairperson) 교수님은 화학과 학과 소속입니다. Ph.D. Chemistry, Seoul Nat’l University, Korea 학위를 가지고 있습니다. 이메일은 haejkim@hufs.ac.kr입니다. 연구실은 형광유기합성 연구실 (자연대 404호)입니다.', 'Seong Huh 교수님은 화학과 학과 소속입니다. Ph.D. Chemistry, Iowa State Univ, Ames, USA 학위를 가지고 있습니다. 이메일은 shuh@hufs.ac.kr입니다. 연구실은 나노무기재료 연구실 (자연대 214-2호)입니다.', 'Jinkuen Park 교수님은 화학과 학과 소속입니다. Ph.D. Chemistry, Univ. of California at Santa Barbara, USA 학위를 가지고 있습니다. 이메일은 jinkpark@hufs.ac.kr입니다. 연구실은 융합신소재화학 연구실 (자연대 410호)입니다.', 'Doyun Kim 교수님은 화학과 학과 소속입니다. Ph.D. Materials Science and Engineering, Texas A&M University, USA 학위를 가지고 있습니다. 이메일은 doyunk@hufs.ac.kr입니다. 연구실은 나노 에너지 소재 연구실 (자연대 405호)입니다.', 'Changsun Eun 교수님은 화학과 학과 소속입니다. Ph.D. Chemistry, Univ. of North Carolina at Chapel Hill. USA 학위를 가지고 있습니다. 이메일은 ceun@hufs.ac.kr입니다. 연구실은 이론 및 계산화학 연구실 (자연대 507호)입니다.', '## [heading1] ##\n# 5) 졸업 요건\n\n## [paragraph] ##\n- 졸업 과제 및 논문(전공 홈페이지에 게시)\n\n## [heading1] ##\n# 6) 문의처\n\n## [list] ##\n- - 홈페이지 : ds.hufs.ac.kr / 이메일 : seokohj@hufs.ac.kr\n- - 전공주임 연구실 전화번호 : 031-330-4680\n\n## [footer] ##\n- 54 -', '전홍배 교수님 교수님은 정보통신공학과 학과 소속입니다. 이메일은 hongbae08@hufs.ac.kr입니다. 연구실은 공학관 510호입니다.', '손경락 교수님 교수님은 정보통신공학과 학과 소속입니다. 이메일은 krson@hufs.ac.kr입니다. 연구실은 공학관 414호입니다.', '박상원 교수님 교수님은 정보통신공학과 학과 소속입니다. 이메일은 swpark@hufs.ac.kr입니다. 연구실은 백년관 815호입니다.', '정성호 교수님 교수님은 정보통신공학과 학과 소속입니다. 이메일은 shjeong@hufs.ac.kr입니다. 연구실은 백년관 702호입니다.', '[(글로벌) - 루마니아학과] 영역에 개설된 강의 목록입니다.\n\n[루마니아학입문(1)] 1학년 대상 / 교수: 박정오 / nan / 학점: 3 / 전공필수 과목 아님 / 온라인강의 맞음 / P/F 평가 과목 아님 / 원어강의 아님\n\n[초급루마니아어번역연습(1)] 1학년 대상 / 교수: 백승남 / 화요일 1,2교시 / 강의실 1504호 / 학점: 2 / 전공필수 과목 맞음 / 온라인강의 아님 / P/F 평가 과목 아님 / 원어강의 맞음\n\n[초급루마니아어회화(1)] 1학년 대상 / 교수: Cristina Preutu / 월요일 1,2교시 / 강의실 1411호 / 학점: 2 / 전공필수 과목 맞음 / 온라인강의 아님 / P/F 평가 과목 아님 / 원어강의 맞음\n\n[초급루마니아어회화(1)] 1학년 대상 / 교수: 한성숙 / 화요일 3,4교시 / 강의실 1411호 / 학점: 2 / 전공필수 과목 맞음 / 온라인강의 아님 / P/F 평가 과목 아님 / 원어강의 맞음\n\n[초급시청각루마니아어(1)] 1학년 대상 / 교수: 김정환 / 목요일 1교시 / 강의실 1411호 / 학점: 1 / 전공필수 과목 맞음 / 온라인강의 아님 / P/F 평가 과목 아님 / 원어강의 아님\n\n[루마니아사정] 2학년 대상 / 교수: 박정오 / 수요일 9,10교시 / 강의실 1411호 / 학점: 2 / 전공필수 과목 아님 / 온라인강의 아님 / P/F 평가 과목 아님 / 원어강의 아님\n\n[중급루마니아어문법작문] 2학년 대상 / 교수: 김정환 / 목요일 2,금,1,2교시 / 강의실 1411호 / 학점: 3 / 전공필수 과목 맞음 / 온라인강의 아님 / P/F 평가 과목 아님 / 원어강의 아님\n\n[중급루마니아어번역연습(1)] 2학년 대상 / 교수: 한성숙 / 목요일 3,4교시 / 강의실 1314호 / 학점: 2 / 전공필수 과목 맞음 / 온라인강의 아님 / P/F 평가 과목 아님 / 원어강의 아님\n\n[중급루마니아어회화(1)] 2학년 대상 / 교수: 엄태현 / 수요일 1,2교시 / 강의실 1411호 / 학점: 2 / 전공필수 과목 맞음 / 온라인강의 아님 / P/F 평가 과목 아님 / 원어강의 맞음\n\n[중급루마니아어회화(1)] 2학년 대상 / 교수: Cristina Preutu / 수요일 7,8교시 / 강의실 1509-1호 / 학점: 2 / 전공필수 과목 맞음 / 온라인강의 아님 / P/F 평가 과목 아님 / 원어강의 맞음\n\n[FLEX루마니아어(1)] 3학년 대상 / 교수: 안겔레스쿠록사나커털리나 / 화요일 1,2교시 / 강의실 1411호 / 학점: 2 / 전공필수 과목 아님 / 온라인강의 아님 / P/F 평가 과목 아님 / 원어강의 맞음\n\n[고급루마니아어회화(1)] 3학년 대상 / 교수: 안겔레스쿠록사나커털리나 / 월요일 1,2교시 / 강의실 1502호 / 학점: 2 / 전공필수 과목 맞음 / 온라인강의 아님 / P/F 평가 과목 아님 / 원어강의 맞음\n\n[고급루마니아어회화(1)] 3학년 대상 / 교수: 이호창 / 월요일 1,2교시 / 강의실 1310호 / 학점: 2 / 전공필수 과목 맞음 / 온라인강의 아님 / P/F 평가 과목 아님 / 원어강의 맞음\n\n[루마니아문학사] 3학년 대상 / 교수: 김정환 / 목요일 3,4교시 / 강의실 1411호 / 학점: 2 / 전공필수 과목 아님 / 온라인강의 아님 / P/F 평가 과목 아님 / 원어강의 아님\n\n[루마니아역사의이해] 3학년 대상 / 교수: 박정오 / 화요일 7,8교시 / 강의실 1411호 / 학점: 2 / 전공필수 과목 아님 / 온라인강의 아님 / P/F 평가 과목 아님 / 원어강의 아님\n\n[루마니아정치경제의이해(1)] 3학년 대상 / 교수: Cristina Preutu / 월요일 7,8교시 / 강의실 1411호 / 학점: 2 / 전공필수 과목 아님 / 온라인강의 아님 / P/F 평가 과목 아님 / 원어강의 맞음\n\n[루마니아종교문화] 3학년 대상 / 교수: 이호창 / 목요일 3,4교시 / 강의실 1504-1호 / 학점: 2 / 전공필수 과목 아님 / 온라인강의 아님 / P/F 평가 과목 아님 / 원어강의 맞음\n\n[루마니아현대문학] 3학년 대상 / 교수: 박정오 / 수요일 7,8교시 / 강의실 1411호 / 학점: 2 / 전공필수 과목 아님 / 온라인강의 아님 / P/F 평가 과목 아님 / 원어강의 아님\n\n[루마니아문화와예술] 4학년 대상 / 교수: 백승남 / 수요일 1,2교시 / 강의실 1510-1호 / 학점: 2 / 전공필수 과목 아님 / 온라인강의 아님 / P/F 평가 과목 아님 / 원어강의 맞음\n\n[루마니아어학개론] 4학년 대상 / 교수: 엄태현 / 수요일 3,4교시 / 강의실 1411호 / 학점: 2 / 전공필수 과목 아님 / 온라인강의 아님 / P/F 평가 과목 아님 / 원어강의 아님\n\n[루마니아와유럽연합(EU)] 4학년 대상 / 교수: Cristina Preutu / 화요일 7,8교시 / 강의실 1409-2호 / 학점: 2 / 전공필수 과목 아님 / 온라인강의 아님 / P/F 평가 과목 아님 / 원어강의 맞음\n\n[루마니아인문학주제세미나] 4학년 대상 / 교수: 김정환 / 금요일 3,4교시 / 강의실 1411호 / 학점: 2 / 전공필수 과목 아님 / 온라인강의 아님 / P/F 평가 과목 아님 / 원어강의 아님', '신민웅 교수님 교수님은 통계학과 학과 소속입니다. 명예교수 직위를 맡고 있습니다. 서울대학교 학위를 가지고 있습니다. 연구분야는 표본조사론입니다.']",김정환 교수님은 루마니아학과 소속입니다. 연구실은 어문관 435호에 위치해 있습니다. 교수님과의 연락은 이메일(bacovia@empas.com)을 통해 하실 수 있습니다. 혹시 더 도와드릴까요?,김정환 교수님의 연구실은 어문관 435호에 위치해 있습니다. 추가로 궁금하신 점이 있으시면 언제든지 말씀해 주세요.,,0.5,0.75,0.9546824672664739
컴퓨팅사고를 AI융합전공 이중과목으로 변경해야되는데 이수구분변경 신청 어떻게 해?,"[""[서울] 이수구분 변경 신청 방법 안내\n\n[서울] 이수구분 변경 신청 방법 안내\n\n이수구분 변경 신청서\n\n○ 졸업학기 졸업사정일 전까지\n\n○ 교과목 이수영역 변경 신청서는 E-Mail로 제출(직접 방문제출도 가능)시 접수하여 처리하고 있습니다. 교과목 이수영역의 변경이 필요한 경우, 첨부한 '이수구분 변경 신청서'를\xa0작성하여 이수구분 변경이 필요한 전공 소속 단과대학 담당 선생님에게 E-M ail(또는 직접 방문제출) 로 제출 하여 주시기 바랍니다.\n\n* 융합전공의 이수구분 변경이 필요한 경우는 융합전공 담당 선생님에게 E-Mail(또는 직접 방문제출)로 제출하여 주시기 바랍니다.\n\n*** 유의사항\n\n단, 중국학대학 , 미 디어커뮤니케이션학부, 국제통상학과 ( 상경대학 ), EU전공, 동북아외교통상전공 , AI융합전공(Language&AI트랙/Business&AI트랙/Software&AI트랙) , Business & AI전공, 융복합소프트웨어전공, LD/LT 등 의 세부전공교류 ( 이수구분 ) 신청의 경우 또는 먼저 학과의 확인이 필요한 경우 , 각 전공 ( 학과 ) 사무실의 확인\xa0등 별도의 절차(양식)를 통해 처리되오니\xa0해당 전공 ( 학부 ) 사무실로 우선 문의 하여 주시기 바랍니다 .\n\n[제출시 참고]\n\n● 1전공으로 이수구분 변경이 필요할 경우 →\xa01전공 단과대학 담당 선생님에게 제출\n\n● 이중전공으로 이수구분 변경이 필요한 경우 → 이중전공 단과대학 담당 선생님에게 제출\n\n● 부 전 공으로 이수구분 변경이 필요한 경우 → 부전공 단과대학 담당 선생님에게 제출\n\n● 자 선 을 교양으로 이수구분 변경이 필요한 경우 → 1전공 단과대학 담당 선생님에게 제출\n\n● 교 양 을 1전공 또는 이중(부)전공으로 이수구분 변경이 필요한 경우\n\n→ 1전공으로 변경시 : 1전공 단과대학 담당 선생님에게 제출\n\n→ 이중(부)전공으로 변경시 : 이중(부)전공 단과대학 담당 선생님에게 제출\n\n● 융합전공의 이수구분 변경이 필요할 경우 → 융합전공 담당 선생님에게 제출"", '[글로벌] 이수구분변경 신청 방법 안내\n\n다. 이수구분 신청 전, 전공교류교과목을 수강편람에서 확인하고 문의 사항이 있을 경우 신청전 미리 상담 (수강편람 확인 클릭)\n\n라. 신청 후 3~4일 (평일 기준) 이후\xa0종합정보시스템에서 변경결과를 반드시 확인하고 변경이 안된 경우, 담당자에게 연락하여 반드시 확인', '[공통] 2025-1학기 이중전공 변경 신청 일정 공고(비즈니스 & AI 융합전공 관련 내\n\n| 글로벌캠퍼스 영어통번역학부 학생 | 글로벌캠퍼스 영어통번역학부내 세부전공 이중전공 이수 불가 |\n| 글로벌캠퍼스 아프리카학부 학생 | 글로벌캠퍼스 아프리카학부내 세부전공 이중전공 이수 불가 |\n| 글로벌캠퍼스 경상대학 학생 | 서울캠퍼스 경영대학 이중전공 이수 불가 |\n| 글로벌캠퍼스 경제학과 학생 | 서울캠퍼스 경제학전공 이중전공 이수 불가 |\n| 글로벌캠퍼스AI데이터융합학부/ AI데이터융합전공 학생 | 글로벌캠퍼스 컴퓨터공학전공 이수 불가, 서울캠퍼스 Language & AI융합학부 이수 불가 |\n| 글로벌캠퍼스Finance & AI융합학부 /Finance & AI융합전공 학생 | 서울캠퍼스 Language & AI융합학부 이수 불가 |\n| 글로벌캠퍼스 반도체전자공학부(반도체공학전공)학생 | 글로벌캠퍼스 반도체전자공학부(전자공학전공) |\n| 글로벌캠퍼스 반도체전자공학부(전자공학전공)학생 | 글로벌캠퍼스 반도체전자공학부(반도체공학전공) |\n| 글로벌캠퍼스 컴퓨터공학전공 학생 | 서울캠퍼스 Language & AI융합전공 이수 불가 |\n| 글로벌캠퍼스 디지털콘텐츠학부 | 글로벌캠퍼스 문화콘텐츠학전공(융합전공)이중전공 이수 불가 |', '[공통] 2025-1학기 이중전공 변경 신청 일정 공고(비즈니스 & AI 융합전공 관련 내\n\n| 0 | 1 |\n|:----------------------------------------------------------------|:----------------------------------------------------------------------------------|\n| 모든 학생 | 폐지된 학과(법학과,사회과학전공 등)및 본인 학번대에 존재하지 않는 학과 이수 불가 |\n| 비사범대 학생 | 사범대학 학과로 이중전공 이수 불가 |\n| 2016학번까지 | LD전공 및LT전공 이수 불가(※2017학번부터 가능) |\n| 서울캠퍼스 프랑스어학부 학생 | 프랑스어학부 내 세부전공을 이중전공으로 이수 불가 |\n| 서울캠퍼스 일본언어문화학부 학생 | 융합일본지역학부 이중전공 이수 불가 |\n| 서울캠퍼스 융합일본지역학부 학생 | 일본언어문화학부 이중전공 이수 불가 |\n| 서울캠퍼스 경제학부 학생(2007~2014학번) | 글로벌캠퍼스 경제학과 이중전공 이수 불가 |\n| 서울캠퍼스 경영대학 학생 | 글로벌캠퍼스 경상대학 학과/전공 이중전공 이수 불가 |\n| 서울캠퍼스Languae & AI융합학부, Social Sceince & AI융합학부학생 | 글로벌캠퍼스 컴퓨터공학전공 이중전공 이수 불가 |\n| 서울캠퍼스Social Sceince＆AI융합학부학생 | 서울캠퍼스Language & AI융합전공 이중전공 이수 불가 |\n| 서울캠퍼스Language & AI융합학부학생 | 서울캠퍼스Social Sceince＆AI융합전공 이중전공 이수 불가 |\n| 글로벌캠퍼스 융합인재학부학생 | 모든 이중전공이수 불가 |\n| 글로벌캠퍼스 영어통번역학부 학생 | 글로벌캠퍼스 영어통번역학부내 세부전공 이중전공 이수 불가 |\n| 글로벌캠퍼스 아프리카학부 학생 | 글로벌캠퍼스 아프리카학부내 세부전공 이중전공 이수 불가 |\n| 글로벌캠퍼스 경상대학 학생 | 서울캠퍼스 경영대학 이중전공 이수 불가 |\n| 글로벌캠퍼스 경제학과 학생 | 서울캠퍼스 경제학전공 이중전공 이수 불가 |', '[글로벌] 이수구분변경 신청 방법 안내\n\n[글로벌] 이수구분변경 신청 방법 안내\n\n이수구분변경 신청 방법\n\n1. 시기\n\n가. 졸업학기 졸업사정일 전까지\n\n나. 당해 학기 수강신청건에 대해서는 성적 취득후 신청 권장\n\n2 . 제출처\n\n본인의 1전공 단과대학\n\n이메일 제출\n\n문의 전화\n\n방문 제출\n\n인문대학, 통번역대학, 융합인재대학\n\nhaksa4077@hufs.ac.kr\n\n031-330-4077\n\n학생회관 109호\n\n국가전략언어대학, 국제지역대학, 자유전공학부(글로벌)\n\nlsh0613@hufs.ac.kr\n\n031-330-4457\n\n경상대 학, Culture& Technology융합대학,\n\nAI융합대학(글로벌), 기후변화융합학부,\n\nminsun@hufs.ac.kr\n\n031-330-4953\n\n자연과학대학, 공과대학, 바이오메디컬공학부\n\nyyj1730@hufs.ac.kr\n\n031-330-4073\n\n3.\xa0제출 서류 : 첨부파일(이수구분 변경신청서) 다운로드 후, 작성하여 제출\n\n4.\xa0유의사항\n\n가. 이중(부)전공이 글로벌캠퍼스일 경우, 본인의 1전공 단과대학 담당자에게 제출\n\n나 . 이중(부)전공이 서울캠퍼스일 경우, 본인의 서울캠퍼스\xa0담당자에게 제출 (담당자 확인 클릭)\n\n다. 이수구분 신청 전, 전공교류교과목을 수강편람에서 확인하고 문의 사항이 있을 경우 신청전 미리 상담 (수강편람 확인 클릭)\n\n라. 신청 후 3~4일 (평일 기준) 이후\xa0종합정보시스템에서 변경결과를 반드시 확인하고 변경이 안된 경우, 담당자에게 연락하여 반드시 확인', '[공통] 2025-1학기 이중전공 변경 신청 일정 공고(비즈니스 & AI 융합전공 관련 내\n\n[공통] 2025-1학기 이중전공 변경 신청 일정 공고(비즈니스 & AI 융합전공 관련 내\n\n2025 학년도 제 1 학기 이중전공 변경 신청 일정을 다음과 같이 공고합니다 .\n\n1. 신청 대상 : 2~4 학년 재학생 및 휴학생\n\n※ 확인사항\n\n가 . 현재 2~4 학년으로\n\n1) 기존에 이중전공을 신청한 적이 있는 경우도 , 변경 신청 가능 ( 변경횟수제한 해제 )\n\n2) 이중전공을 신청하여 배정되지 않은 경우 ( 혹은 한번도 신청한 적이 없는 경우 ) 도 , 이번 변경 신청 신청해야하며 , 최초 신청 (5 월 26 일 ( 월 ) ~ 5 월 30 일 ( 금 ) 예정 ) 으로 신청 불가능\n\n나 . 2025 학년도 전기 편입생 ( 순수외국인전형 편입생 포함 ) 은\n\n1) 이번 변경 신청 불가\n\n2) 이중전공 신청으로만 신청 가능\n\n※ 5 월 26 일 ( 월 ) ~ 5 월 30 일 ( 금 ) 예정\n\n단 , 해당 기간에 신청하지 않으면 다음 학기부터 이중전공 변경 신청으로만 가능함\n\n2. 신청 기간 : 2025 년 5 월 12 일 ( 월 ) 10 시 ~ 5 월 16 일 ( 금 ) 16 시\n\n※ 안내된 기간에만 신청 / 변경 / 삭제 가능하므로 일정 준수할 것 ( 이후 별도 운영 계획 없음 )\n\n3. 신청 방법 : 종합정보시스템 → 전공 / 교직관리 → 이중전공 변경신청\n\n※ 1 지망만 신청 가능 , 신청 완료후 다시 조회하여 신청 결과를 반드시 확인할 것\n\n※ 제한사항\n\n가 . 신청할 학과 ( 부 )/ 전공의 본인 학번대에 여석이 없는 경우 신청 불가\n\n나 . 캠퍼스 간 이중전공을 희망하는 경우 아래의 제한학과로는 신청 불가\n\n서울캠퍼스\n\n( 글로벌캠퍼스 학생 신청 불가 학과 )\n\n글로벌캠퍼스\n\n( 서울캠퍼스 학생 신청 불가 학과 )\n\n영어대학 각 학과 ( 전공 )\n\n※ 글로벌캠퍼스 2023 학번부터 가능\n\n영어통번역학부\n\n프랑스어학부 ( 기존 프랑스어과 포함 )\n\n※ 글로벌캠퍼스 2023 학번부터 가능\n\n프랑스학과\n\n독일어과\n\n※ 글로벌캠퍼스 2024 학번부터 가능', '[공통] 2025-1학기 이중전공 변경 신청 일정 공고(비즈니스 & AI 융합전공 관련 내\n\n테크노미디어디자인세부모듈\n\n패션관광문화산업세부모듈\n\n디지털콘텐츠학부제 1 전공자 이수불가\n\n투어리즘 & 웰니스학부제 1 전공자 이수불가\n\n게임한류문화산업세부모듈\n\n융합비즈니스세부모듈\n\n상경 ( 경상 ) 관련제 1 전공자 이수불가\n\nICT&AI 세부모듈\n\n공과대학제 1 전공자 이수불가\n\n글로벌캠퍼스 AI 융합대학제 1 전공자 이수불가\n\n바 . AI 융합전공의 경우 , 기존 AI 융합전공 및 세부트랙에 진입한 인원만 변경 신청이 가능하며 , 신규 진입은 불가능함 . 기존 신청 학생의 경우 붙임의 ‘( 이중 )AI 융합전공 세부전공 신청서 ’ 를 작성하여 캠퍼스별 담당자에게 메일 송부\n\n사 . 기후변화융합학부의 경우 22 학번부터 신청 가능\n\n4. 배정 확정 공지 : 2025 년 6 월 말 ~ 2025 년 7 월 초 [ 학사공지 ] 게시판 공지예정\n\n※ 신청자를 대상으로 별도 전형을 진행하는 학과 ( 부 ) 일정에 따라 공지 일정이 유동적임\n\n※ 후기이중전공 선발자가 이중전공 변경 배정된 경우 둘 중 하나는 반드시 취소해야 함\n\n5. 배정기준\n\n가 . 현 시점 기준 학과 ( 부 ) 별 / 학번대별 이중전공 여석 내에서 배정\n\n( ※ 첨부파일 참조 )\n\n나 . 서울캠퍼스 이중전공의 경우 학과 ( 부 ) 별 배정기준에 따름\n\n( ※ 첨부파일 참조 )\n\n다 . 34 학점 이상 이수자 우선 배정\n\n라 . 배정 시 성적 기준 : 신청 마감일인 5 월 16 일 ( 금 ) 16 시 기준 성적\n\n( ※ 이후 변동된 성적은 반영되지 않으며 , 성적인정 처리가 늦어지는 것도 반영하지 않으므로 반드시 본인이 확인할 것 )\n\n마 . 동점자 배정기준\n\n1) 평점평균 동점자 : 이수학점이 높은 학생 우선 배정\n\n2) 평점평균 , 이수학점 동점자 : 동점자 전원 배정\n\n6. 유의사항\n\n가 . 양 캠퍼스에 동일하게 개설되는 융합전공은 본인 소속 캠퍼스에서 이수해야 함\n\n나 . 학과 ( 부 ) 별 전형이 있는 경우 반드시 학과 사무실에 관련 일정 및 자격 확인', '[공통] 2025-1학기 이중전공 변경 신청 일정 공고(비즈니스 & AI 융합전공 관련 내\n\n마 . 동점자 배정기준\n\n1) 평점평균 동점자 : 이수학점이 높은 학생 우선 배정\n\n2) 평점평균 , 이수학점 동점자 : 동점자 전원 배정\n\n6. 유의사항\n\n가 . 양 캠퍼스에 동일하게 개설되는 융합전공은 본인 소속 캠퍼스에서 이수해야 함\n\n나 . 학과 ( 부 ) 별 전형이 있는 경우 반드시 학과 사무실에 관련 일정 및 자격 확인\n\n※ 관련 일정 및 자격 미확인으로 인한 불이익은 본인 과실임을 유의할 것\n\n학과 사무실\n\n연락처\n\n이메일\n\n노어과\n\n02-2173-2284\n\nhufsrussia@hufs.ac.kr\n\n베트남어과\n\n02-2173-2300\n\nvietnam.hufs@gmail.com\n\n정치외교학과\n\n02-2173-2312\n\nhufspsd@gmail.com\n\n경영학부\n\n02-2173-2334\n\ncob@hufs.ac.kr\n\nLanguage & Diplomacy 학부\n\n02-2173-2478\n\nlangdiplo@hufs.ac.kr\n\nLanguage & Trade 학부\n\n02-2173-3350\n\nhufsdltta@hufs.ac.kr\n\nKFL 학부\n\n02-2173-2477\n\nhufs_kfl@naver.com\n\nSocial Science & AI 융합학부\n\n02-2173-2769\n\nssai@hufs.ac.kr\n\nLanguage & AI 융합학부\n\n02-2173-2278\n\nhufs_langai@hufs.ac.kr\n\n다 . 타캠퍼스에서 이수한 이중전공 과목의 재수강 은 타캠퍼스 이중전공 이수 기간중에 재수강을 완료해야 함\n\n※ 타캠퍼스 이중전공에서 본인 소속 캠퍼스 이중전공으로 변경한 후에는 재수강 불가\n\n라 . 부전공 희망자 및 전공심화 ( 단일전공 ) 희망자 의 경우 추후 종합정보시스템으로 별도 신청 예정\n\n1) 부전공 희망자 : 일반 부전공 또는 전공심화 ＋ 부전공 신청\n\n2) 단일전공 희망자 : 기존 이중 / 부전공 취소\n\n※ 자세한 일정은 2025 년 7 월 중순 학사공지 예정인 “ 부전공 신청 및 이중전공 / 부전공 취소 일정 ” 확인', '[공통] 2025-1학기 이중전공 변경 신청 일정 공고(비즈니스 & AI 융합전공 관련 내\n\n서울캠퍼스 Language & AI 융합학부 이수 불가\n\n글로벌캠퍼스 반도체전자공학부 ( 반도체공학전공 ) 학생\n\n글로벌캠퍼스 반도체전자공학부 ( 전자공학전공 )\n\n글로벌캠퍼스 반도체전자공학부 ( 전자공학전공 ) 학생\n\n글로벌캠퍼스 반도체전자공학부 ( 반도체공학전공 )\n\n글로벌캠퍼스 컴퓨터공학전공 학생\n\n서울캠퍼스 Language & AI 융합전공 이수 불가\n\n글로벌캠퍼스 디지털콘텐츠학부\n\n글로벌캠퍼스 문화콘텐츠학전공 ( 융합전공 ) 이중전공 이수 불가\n\n라 . “ 외국어로서의한국어교육전공 ” 및 “ 외국어로서의한국어통번역전공 ” 은 입학전형 기준 순수 외국인전형 입학생만 신청 가능\n\n( 단 , “ 외국어로서의한국어통번역전공 ” 은 2018 학번부터만 신청 가능 )\n\n마 . 융합인재학부 내 이중전공 세부모듈 선택 제한\n\n1) 융합인재대학 융합인재학부는 이중전공만 지원 이수 가능 ( 부전공 이수 불가 )\n\n2) 아래의 12 개 세부모듈 중 2 개의 세부모듈을 자율적으로 선택하여 이수 함\n\n모듈명\n\n이수대상 제한\n\n영어통번역세부모듈\n\n영어관련제 1 전공자 이수불가\n\n아랍어통번역세부모듈\n\n아랍어관련제 1 전공자 이수불가\n\n중국어통번역세부모듈\n\n중국어관련제 1 전공자 이수불가\n\n미국 . 영연방전략세부모듈\n\n영어관련제 1 전공자 이수불가\n\n이탈리아 .EU 전략세부모듈\n\n이탈리아어관련제 1 전공자 이수불가\n\n중동 . 이슬람전략세부모듈\n\n아랍어관련제 1 전공자 이수불가\n\n중화권전략세부모듈\n\n중국어관련제 1 전공자 이수불가\n\n테크노미디어디자인세부모듈\n\n패션관광문화산업세부모듈\n\n디지털콘텐츠학부제 1 전공자 이수불가\n\n투어리즘 & 웰니스학부제 1 전공자 이수불가\n\n게임한류문화산업세부모듈\n\n융합비즈니스세부모듈\n\n상경 ( 경상 ) 관련제 1 전공자 이수불가\n\nICT&AI 세부모듈\n\n공과대학제 1 전공자 이수불가\n\n글로벌캠퍼스 AI 융합대학제 1 전공자 이수불가', '[공통] 2025-1학기 이중전공 변경 신청 일정 공고 새글\n\n테크노미디어디자인세부모듈\n\n패션관광문화산업세부모듈\n\n디지털콘텐츠학부제 1 전공자 이수불가\n\n투어리즘 & 웰니스학부제 1 전공자 이수불가\n\n게임한류문화산업세부모듈\n\n융합비즈니스세부모듈\n\n상경 ( 경상 ) 관련제 1 전공자 이수불가\n\nICT&AI 세부모듈\n\n공과대학제 1 전공자 이수불가\n\n글로벌캠퍼스 AI 융합대학제 1 전공자 이수불가\n\n바 . AI 융합전공의 경우 , 기존 AI 융합전공 및 세부트랙에 진입한 인원만 변경 신청이 가능하며 , 신규 진입은 불가능함 . 기존 신청 학생의 경우 붙임의 ‘( 이중 )AI 융합전공 세부전공 신청서 ’ 를 작성하여 캠퍼스별 담당자에게 메일 송부\n\n사 . 기후변화융합학부의 경우 22 학번부터 신청 가능\n\n4. 배정 확정 공지 : 2025 년 6 월 말 ~ 2025 년 7 월 초 [ 학사공지 ] 게시판 공지예정\n\n※ 신청자를 대상으로 별도 전형을 진행하는 학과 ( 부 ) 일정에 따라 공지 일정이 유동적임\n\n※ 후기이중전공 선발자가 이중전공 변경 배정된 경우 둘 중 하나는 반드시 취소해야 함\n\n5. 배정기준\n\n가 . 현 시점 기준 학과 ( 부 ) 별 / 학번대별 이중전공 여석 내에서 배정\n\n( ※ 첨부파일 참조 )\n\n나 . 서울캠퍼스 이중전공의 경우 학과 ( 부 ) 별 배정기준에 따름\n\n( ※ 첨부파일 참조 )\n\n다 . 34 학점 이상 이수자 우선 배정\n\n라 . 배정 시 성적 기준 : 신청 마감일인 5 월 16 일 ( 금 ) 16 시 기준 성적\n\n( ※ 이후 변동된 성적은 반영되지 않으며 , 성적인정 처리가 늦어지는 것도 반영하지 않으므로 반드시 본인이 확인할 것 )\n\n마 . 동점자 배정기준\n\n1) 평점평균 동점자 : 이수학점이 높은 학생 우선 배정\n\n2) 평점평균 , 이수학점 동점자 : 동점자 전원 배정\n\n6. 유의사항\n\n가 . 양 캠퍼스에 동일하게 개설되는 융합전공은 본인 소속 캠퍼스에서 이수해야 함\n\n나 . 학과 ( 부 ) 별 전형이 있는 경우 반드시 학과 사무실에 관련 일정 및 자격 확인', '*** 유의사항\n\n단, 중국학대학 , 미 디어커뮤니케이션학부, 국제통상학과 ( 상경대학 ), EU전공, 동북아외교통상전공 , AI융합전공(Language&AI트랙/Business&AI트랙/Software&AI트랙) , Business & AI전공, 융복합소프트웨어전공, LD/LT 등 의 세부전공교류 ( 이수구분 ) 신청의 경우 또는 먼저 학과의 확인이 필요한 경우 , 각 전공 ( 학과 ) 사무실의 확인\xa0등 별도의 절차(양식)를 통해 처리되오니\xa0해당 전공 ( 학부 ) 사무실로 우선 문의 하여 주시기 바랍니다 .\n\n[제출시 참고]\n\n● 1전공으로 이수구분 변경이 필요할 경우 →\xa01전공 단과대학 담당 선생님에게 제출\n\n● 이중전공으로 이수구분 변경이 필요한 경우 → 이중전공 단과대학 담당 선생님에게 제출\n\n● 부 전 공으로 이수구분 변경이 필요한 경우 → 부전공 단과대학 담당 선생님에게 제출\n\n● 자 선 을 교양으로 이수구분 변경이 필요한 경우 → 1전공 단과대학 담당 선생님에게 제출', '[공통] 2025-1학기 이중전공 변경 신청 일정 공고(비즈니스 & AI 융합전공 관련 내\n\n라 . 부전공 희망자 및 전공심화 ( 단일전공 ) 희망자 의 경우 추후 종합정보시스템으로 별도 신청 예정\n\n1) 부전공 희망자 : 일반 부전공 또는 전공심화 ＋ 부전공 신청\n\n2) 단일전공 희망자 : 기존 이중 / 부전공 취소\n\n※ 자세한 일정은 2025 년 7 월 중순 학사공지 예정인 “ 부전공 신청 및 이중전공 / 부전공 취소 일정 ” 확인\n\n마 . 편입생도 희망 시 이중전공 , 부전공 , 전공심화 ( 부전공 ) 로 이수할 수 있음\n\n※ 이수 시 졸업이수학점 및 외국어인증기준이 변경될 수 있음\n\n바 . ( 이중전공 변경에 따라 ) 이수구분 수정이 필요한 경우 학사종합지원센터 홈페이지 서식함의 “ 이수구분 변경 신청서 ” 를 작성하여 제출 바람\n\n※ 상시 제출 가능\n\n사. 신설 융합전공 비즈니스 & AI 융합전공의 신청이\xa0추후 관련 위원회 의결을 통해\xa02025학년도 2학기부터\xa02024학번 이전 학생들 역시 신청\xa0가능해질\xa0예정이오니, 해당 전공에\xa0관심이 있는 학생 분들은 참조하여 주시기 바랍니다.\n\n▶ ( 서울 ) 이수구분 변경 신청서 바로가기\n\n▶ ( 글로벌 ) 이수구분 변경 신청서 바로가기\n\n2025. 4.\n\n교무처장', 'AI융합대학\n\n4차 산업혁명이 촉발한 변화의 물결 속에서 고등교육 패러다임의 근본적 변화와 대학의 획기적인 혁신이 요구되는 시대적·사회적 변화에 발맞춰 신설 되었습니다.\n\nAI데이터융합학부 031-330-4207 / Finance & AI융합학부 031-330-4209', '[공통] 2025-1학기 이중전공 변경 신청 일정 공고(비즈니스 & AI 융합전공 관련 내\n\n| 0 | 1 |\n|:---------------------------|:-------------------------------------------------------------------------|\n| 모듈명 | 이수대상 제한 |\n| 영어통번역세부모듈 | 영어관련제1전공자 이수불가 |\n| 아랍어통번역세부모듈 | 아랍어관련제1전공자 이수불가 |\n| 중국어통번역세부모듈 | 중국어관련제1전공자 이수불가 |\n| 미국.영연방전략세부모듈 | 영어관련제1전공자 이수불가 |\n| 이탈리아.EU전략세부모듈 | 이탈리아어관련제1전공자 이수불가 |\n| 중동.이슬람전략세부모듈 | 아랍어관련제1전공자 이수불가 |\n| 중화권전략세부모듈 | 중국어관련제1전공자 이수불가 |\n| 테크노미디어디자인세부모듈 | 정보없음 |\n| 패션관광문화산업세부모듈 | 디지털콘텐츠학부제1전공자 이수불가 투어리즘&웰니스학부제1전공자 이수불가 |\n| 게임한류문화산업세부모듈 | 정보없음 |\n| 융합비즈니스세부모듈 | 상경(경상)관련제1전공자 이수불가 |\n| ICT&AI세부모듈 | 공과대학제1전공자 이수불가 글로벌캠퍼스AI융합대학제1전공자 이수불가 |', '● 교 양 을 1전공 또는 이중(부)전공으로 이수구분 변경이 필요한 경우\n\n→ 1전공으로 변경시 : 1전공 단과대학 담당 선생님에게 제출\n\n→ 이중(부)전공으로 변경시 : 이중(부)전공 단과대학 담당 선생님에게 제출\n\n● 융합전공의 이수구분 변경이 필요할 경우 → 융합전공 담당 선생님에게 제출', '[공통] 2025-1학기 이중전공 변경 신청 일정 공고(비즈니스 & AI 융합전공 관련 내\n\n▶ ( 서울 ) 이수구분 변경 신청서 바로가기\n\n▶ ( 글로벌 ) 이수구분 변경 신청서 바로가기\n\n2025. 4.\n\n교무처장\n\n| 0 | 1 |\n|:--------------------------------------------------------------------|:----------------------------------------------|\n| 서울캠퍼스 (글로벌캠퍼스 학생 신청 불가 학과) | 글로벌캠퍼스 (서울캠퍼스 학생 신청 불가 학과) |\n| 영어대학 각 학과(전공) ※ 글로벌캠퍼스 2023학번부터 가능 | 영어통번역학부 |\n| 프랑스어학부(기존 프랑스어과 포함) ※ 글로벌캠퍼스 2023학번부터 가능 | 프랑스학과 |\n| 독일어과 ※ 글로벌캠퍼스 2024학번부터 가능 | 독일어통번역학과 |\n| 노어과 ※ 글로벌캠퍼스 2023학번부터 가능 | 러시아학과 |\n| 스페인어과 ※ 글로벌캠퍼스 2024학번부터 가능 | 스페인어통번역학과 |\n| 이탈리아어과 ※ 글로벌캠퍼스 2024학번부터 가능 | 이탈리아어통번역학과 |\n| 포르투갈어과 ※ 글로벌캠퍼스 2023학번부터 가능 | 브라질학과 |\n| 말레이·인도네시아어과 ※ 글로벌캠퍼스 2024학번부터 가능 | 말레이·인도네시아어통번역학과 |\n| 아랍어과 ※ 글로벌캠퍼스 2021학번부터 가능 | 아랍어통번역학과 |\n| 태국어과 ※ 글로벌캠퍼스 2023학번부터 가능 | 태국어통번역학과 |\n| 인도어과 ※ 글로벌캠퍼스 2023학번부터 가능 | 인도학과 |\n| 중국학대학 각 전공 ※ 글로벌캠퍼스 2023학번부터 가능 | 중국어통번역학과 |\n| 일본학대학 각 전공 ※ 글로벌캠퍼스 2023학번부터 가능 | 일본어통번역학과 |', '[공통] 2025-1학기 이중전공 변경 신청 일정 공고(비즈니스 & AI 융합전공 관련 내\n\n서울캠퍼스 프랑스어학부 학생\n\n프랑스어학부 내 세부전공을 이중전공으로 이수 불가\n\n서울캠퍼스 일본언어문화학부 학생\n\n융합일본지역학부 이중전공 이수 불가\n\n서울캠퍼스 융합일본지역학부 학생\n\n일본언어문화학부 이중전공 이수 불가\n\n서울캠퍼스 경제학부 학생 (2007~2014 학번 )\n\n글로벌캠퍼스 경제학과 이중전공 이수 불가\n\n서울캠퍼스 경영대학 학생\n\n글로벌캠퍼스 경상대학 학과 / 전공 이중전공 이수 불가\n\n서울캠퍼스 Languae & AI 융합학부 , Social Sceince & AI 융합학부학생\n\n글로벌캠퍼스 컴퓨터공학전공 이중전공 이수 불가\n\n서울캠퍼스 Social Sceince ＆ AI 융합학부학생\n\n서울캠퍼스 Language & AI 융합전공 이중전공 이수 불가\n\n서울캠퍼스 Language & AI 융합학부학생\n\n서울캠퍼스 Social Sceince ＆ AI 융합전공 이중전공 이수 불가\n\n글로벌캠퍼스 융합인재학부학생\n\n모든 이중전공이수 불가\n\n글로벌캠퍼스 영어통번역학부 학생\n\n글로벌캠퍼스 영어통번역학부내 세부전공 이중전공 이수 불가\n\n글로벌캠퍼스 아프리카학부 학생\n\n글로벌캠퍼스 아프리카학부내 세부전공 이중전공 이수 불가\n\n글로벌캠퍼스 경상대학 학생\n\n서울캠퍼스 경영대학 이중전공 이수 불가\n\n글로벌캠퍼스 경제학과 학생\n\n서울캠퍼스 경제학전공 이중전공 이수 불가\n\n글로벌캠퍼스 AI 데이터융합학부 / AI 데이터융합전공 학생\n\n글로벌캠퍼스 컴퓨터공학전공 이수 불가 , 서울캠퍼스 Language & AI 융합학부 이수 불가\n\n글로벌캠퍼스 Finance & AI 융합학부 /Finance & AI 융합전공 학생\n\n서울캠퍼스 Language & AI 융합학부 이수 불가\n\n글로벌캠퍼스 반도체전자공학부 ( 반도체공학전공 ) 학생\n\n글로벌캠퍼스 반도체전자공학부 ( 전자공학전공 )\n\n글로벌캠퍼스 반도체전자공학부 ( 전자공학전공 ) 학생\n\n글로벌캠퍼스 반도체전자공학부 ( 반도체공학전공 )\n\n글로벌캠퍼스 컴퓨터공학전공 학생', 'ICT&AI 세부모듈\n\n공과대학제 1 전공자 이수불가\n\n글로벌캠퍼스 AI 융합대학제 1 전공자 이수불가', '## [paragraph] ##\n※ 각 교과목은 3학점/3시간으로 구성\n\n## [list] ##\n- - 공통기초과목은 교양과목으로서 학생들은 컴퓨팅사고를 수강해야 함\n- - 전공 교과목은 AI융합전공 공통 및 Software&AI트랙(A), BME학부(B), 컴퓨터공학부\n- (C), 융합형 교과목(I, II) 영역으로 구성됨\n- - 자료구조는 1학기는 컴퓨터공학부, 2학기는 AI융합전공에서 선택(중복불가)\n- - 캡스톤설계 I은 AI융합전공 Software&AI 트랙 1학기에 개설하는 종합설계, BME전공\n- 1학기에 개설하는 BME캡스톤디자인실습, 컴퓨터공학전공에 매학기 개설하는 캡스톤\n- 설계 중에서 선택\n\n## [footer] ##\n- 55 -', '[글로벌] 이수구분변경 신청 방법 안내\n\n다. 이수구분 신청 전, 전공교류교과목을 수강편람에서 확인하고 문의 사항이 있을 경우 신청전 미리 상담 (수강편람 확인 클릭)\n\n라. 신청 후 3~4일 (평일 기준) 이후\xa0종합정보시스템에서 변경결과를 반드시 확인하고 변경이 안된 경우, 담당자에게 연락하여 반드시 확인\n\n| 0 | 1 | 2 | 3 |\n|:-----------------------------------------------------------------------------|:---------------------|:-------------|:---------------|\n| 본인의 1전공 단과대학 | 이메일 제출 | 문의 전화 | 방문 제출 |\n| 인문대학, 통번역대학, 융합인재대학 | haksa4077@hufs.ac.kr | 031-330-4077 | 학생회관\xa0109호 |\n| 국가전략언어대학, 국제지역대학, 자유전공학부(글로벌) | lsh0613@hufs.ac.kr | 031-330-4457 | 학생회관\xa0109호 |\n| 경상대학,\xa0Culture& Technology융합대학, AI융합대학(글로벌),\xa0기후변화융합학부, | minsun@hufs.ac.kr | 031-330-4953 | 학생회관\xa0109호 |\n| 자연과학대학,\xa0공과대학, 바이오메디컬공학부 | yyj1730@hufs.ac.kr | 031-330-4073 | 학생회관\xa0109호 |', '## [heading1] ##\n# 다. Business & AI 트랙\n\n## [paragraph] ##\nBusiness & AI 트랙은 4차 산업혁명을 대표하는 인공지능(AI)기술의 활용이 다양한 비즈니스\n영역에서 어떻게 기업과 소비자를 변화시키고 있는지 이해하는 것을 목표로 한다. 이를 위해\n경영학 관련 과목과 AI 관련 과목의 단순한 동시 학습이 아닌, 한 개의 과목 안에서 AI\n기술에 대한 이해와 이에 대한 경영학적 접근이 같은 흐름으로 완성될 수 있도록 교과목을\n운영한다. 또한 인턴십, 산학협력 프로젝트 등 다양한 비교과활동을 통해 산업 현장에서\n실제 필요로 하는 지식/기술 기반 교육을 실천한다.\n\n## [paragraph] ##\n(2) 이수자격\n\n## [paragraph] ##\nAI융합전공 진입 시에는 자격 제한이 없음.\n단, 컴퓨터공학부, 정보통신공학과, 산업경영공학과 학생은 Software & AI 트랙을 선택할\n수 없음\n\n## [footer] ##\n- 57 -', '(공통)2025-1학기 이중전공 신청 일정 공고\n\n| 글로벌캠퍼스\xa0학생 | 서울캠퍼스\xa0융복합소프트웨어\xa0융합전공 이수 불가 |\n| 글로벌캠퍼스 융합인재학부학생 | 모든 이중전공이수 불가 |\n| 글로벌캠퍼스 영어통번역학부 학생 | 글로벌캠퍼스 영어통번역학부내 세부전공 이중전공 이수 불가 |\n| 글로벌캠퍼스 아프리카학부 학생 | 글로벌캠퍼스 아프리카학부내 세부전공 이중전공 이수 불가 |\n| 글로벌캠퍼스 경상대학 학생 | 서울캠퍼스 경영대학 이중전공 이수 불가 |\n| 글로벌캠퍼스 경제학과 학생 | 서울캠퍼스 경제학전공 이중전공 이수 불가 |\n| 글로벌캠퍼스AI데이터융합학부/ AI데이터융합전공 학생 | 글로벌캠퍼스 컴퓨터공학전공 이수 불가, 서울캠퍼스 Language & AI융합학부 이수 불가 |\n| 글로벌캠퍼스Finance & AI융합학부/Finance & AI융합전공 학생 | 서울캠퍼스 Language & AI융합학부 이수 불가 |\n| 글로벌캠퍼스 반도체전자공학부(반도체공학전공)학생 | 글로벌캠퍼스 반도체전자공학부(전자공학전공) |\n| 글로벌캠퍼스 반도체전자공학부(전자공학전공)학생 | 글로벌캠퍼스 반도체전자공학부(반도체공학전공) |\n| 글로벌캠퍼스 컴퓨터공학전공 학생 | 서울캠퍼스 Language & AI융합전공 이수 불가 |\n| 글로벌캠퍼스 디지털콘텐츠학부 | 글로벌캠퍼스 문화콘텐츠학전공(융합전공)이중전공 이수 불가 |', '## [paragraph] ##\n(3) 트랙 선택 시기 : 3학년 진입 전 트랙 선택\n※ 이중전공 변경 신청(재학 중 1회만 가능)으로 트랙 변경 가능\n\n## [table] ##\n| 2학년 | 3학년 | 3학년 |\n| --- | --- | --- |\n| 2학년 | 서울캠퍼스 | 글로벌캠퍼스 |\n| AI융합전공 | Language & AI 트랙 (언어공학사) | - |\n| AI융합전공 | Software & AI 트랙 (공학사) | Software & AI 트랙 (공학사) |\n| AI융합전공 | - | Business & AI 트랙 (경영공학사) |\n\n## [heading1] ##\n# (4) 교과과정 및 전공교류 과목', '## [paragraph] ##\n- 전공 교과목은 AI융합전공 공통 및 Software&AI트랙 개설교과목이나, BME학부 개설\n교과목이나, 컴퓨터공학부의 개설 교과목을 이수함으로써 <바이오데이터사이언스>\n전공 학점을 충족시킬 수 있음.\n\n## [list] ##\n- ‧ AI융합전공 공통 및 Software&AI에서 개설되는 교과목(A)은 위에서 지정된 과목\n- 이외의 교과목은 지도교수의 승인에 의해 (A) 영역 교과목으로 인정받을 수 있음.\n- ‧ 바이오메디컬공학전공에서 개설되는 교과목(B)은 위에서 지정된 과목 교과목은 지도\n- 교수의 승인에 의해 (B) 영역 교과목으로 인정받을 수 있음.\n- ‧ 컴퓨터공학전공에서 개설되는 교과목(C)은 위에서 지정된 과목 이외의 교과목은\n- 지도교수의 승인에 의해 (C) 영역 교과목으로 인정받을 수 있음.\n\n## [paragraph] ##\n- ‘전공’ 인정과목\n\n## [list] ##\n- ‧ 운영학과(BME학부, 컴퓨터공학부, AI융합전공 공통 및 Software&AI)에 개설된 유사\n- 과목(주임교수 사전 승인)\n- ‧ 2학점의 관련 과목이 3학점인 ‘언어와공학’의 선택과목으로 인정될 때는 2학점만\n- 이수한 것으로 인정. 단, 2학점인 과목은 ‘언어와 공학’의 필수과목으로 인정될 수는 없음\n\n## [paragraph] ##\n4) 학생 선발\n\n## [paragraph] ##\n- 바이오데이터사이언스 융합전공은 모든 전공의 학생들이 선택할 수 있음. 각 전공의\n학생들이 이 융합전공을 이수하는 방식은 다음과 같음\n\n## [paragraph] ##\n<바이오데이터사이언스> 전공이수 방식', '| 유의사항 | 학과명(세부모듈) 영어통번역세부모듈 | 이수대상 제한 |\n| 유의사항 |  | 영어관련 제1전공자 이수불가 |\n| 유의사항 |  | 아랍어관련 제1전공자 이수불가 |\n| 유의사항 |  | 영어관련 |\n|  |  |  |\n|  |  |  |\n|  | 이탈리아.EU전략세부모듈 중동.이슬람전략세부모듈 중화권전략세부모듈 | 이탈리아어관련 제1전공자 이수불가 아랍어관련 제1전공자 |\n|  | 테크노미디어디자인세부모듈 | 중국어관련 제1전공자 이수불가 |\n|  | 패션관광문화산업세부모듈 |  |\n|  |  | 디지털콘텐츠학부 |\n|  |  | 제1전공자 이수불가 투어리즘 & 웰니스학부 제1전공자 이수불가 |\n|  |  |  |\n|  |  |  |\n|  |  |  |\n|  |  |  |\n|  | ⑤ 각 융합전공은 이중전공만 이수 가능[다만, 국가리더는 부전공 가능] ⑥ AI융합전공 중 Software&AI트랙(구,\xa0융복합소프트웨어전공)은\xa02021학번부터는 \xa0컴퓨터공학부,정보통신공학과,산업경영공학과\xa0소속\xa0학생은\xa03학년\xa0진급 시\xa0\xa0신청\xa0 할 수 없음(2020학번까지는 공과대 및 자연과학대 전체학생 신청 제한) |  |\n|  |  | 상경(경상)관련 제1전공자 이수불가 글로벌캠퍼스 AI융합대학 제1전공자 이수불가 |\n|  | 게임한류문화산업세부모듈 융합비즈니스세부모듈 ICT&AI세부모듈 | 제1전공자 이수불가 공과대학 |\n|  |  |  |\n|  |  |  |\n|  |  |  |\n|  |  |  |\n|  |  |  |\n|  |  |  |\n|  |  |  |\n|  |  |  |\n|  |  |  |\n|  |  |  |\n|  |  |  |', '## [paragraph] ##\n(6) 이수요건 : 총 42학점 이수 및 트랙별 이수요건 충족 필수\n\n## [table] ##\n| 트랙 | 졸업요건 |\n| --- | --- |\n| Software & AI | ① 트랙 필수과목 수강 ②  트랙(공통과목 포함)에서 트랙 필수 과목을 포함한 30학점 이상 이수 ③ 졸업논문 통과 - 졸업논문은 <종합설계> 과목(필수)을 이수한 후 다음 학기에 작성 제출함 - 단, 8학기 이상 등록생으로서 부득이한 사유가 인정된 경우, 주임교수의 승인을 얻어 종합설계 수강과 졸업논문 작성을 병행할 수 있음. |\n| Language & AI | ① 트랙 필수과목 수강 ②  트랙(공통과목 포함)에서 트랙 필수 과목을 포함한 33학점 이상 이수, 언어학기초과목(*) 2학점 또는 3학점 이수 ③ 졸업시험 통과 * 언어학기초 과목은 언어 계열 학과에 개설된 언어학 개론 성격의 교과목임 (예 : 영어학개론, 불어학개론, 독어학개론, 언어학입문 등) - 상세 내용은 수강편람 또는 전공 홈페이지 참조 |\n| Business & AI | ① 트랙 필수과목 수강 ②  트랙에서 공통과목, 필수과목을 제외하고 18학점 이상 이수 |\n\n## [heading1] ##\n# (7) 문의처 : AI융합전공(\uf000 http://ai.hufs.ac.kr)\n\n## [table] ##\n| 트랙 | 문의처 |\n| --- | --- |\n| AI융합전공 공통과정 | AI융합전공 사무실 (☎ 02-2173-2643 / Email: aic@hufs.ac.kr) |\n| Software & AI | 컴퓨터공학부 (☎ 031-330-4268 / Email: ces@hufs.ac.kr) |\n| Language & AI | 언어공학연구소 (☎ 02-2173-2872 / Email: langai@hufs.ac.kr) |\n| Business & AI | AI융합전공 사무실 (☎ 02-2173-2643 / Email: bizai@hufs.ac.kr) |\n\n## [footer] ##\n- 59 -', '## [heading1] ##\n# 나. 주요 공지 사항\n\n## [list] ##\n- - 2학년 교과목중에서 ⸢고급파이썬프로그래밍⸥, ⸢자료구조⸥, ⸢확률과 통계⸥는 소속 캠퍼스\n- AI융합전공에서 개설되는 전공교류과목(아래 전공교류과목 참고)을 수강\n- - 2025학년도 1학기부터 개설되는 교과목은 양캠퍼스 교차수업 형태로 개설 우선\n\n## [paragraph] ##\n(5) 전공교류과목\n가. 서울캠퍼스\n\n## [table] ##\n| 개설학과(전공) | 교과목명 |\n| --- | --- |\n| AI융합전공 | 고급파이썬프로그래밍 컴퓨터수학 자료구조 확률과 통계 |\n| 융복합소프트웨어전공 | 고급파이썬프로그래밍 인공지능 |\n\n## [heading1] ##\n# 나. 글로벌캠퍼스\n\n## [table] ##\n| 개설학과(전공) | 교과목명 |\n| --- | --- |\n| AI융합전공 | 고급파이썬프로그래밍 컴퓨터수학 자료구조 확률과 통계 |\n| 국제금융학과 | 파이낸스어낼리틱스 파생금융상품론 금융프로그래밍 고급비즈니스어낼리틱스실습 경영학원론 마케팅관리 재무관리 회계원리 |\n| GBT전공 | 경영학원론 마케팅관리 회계원리 컴퓨터프로그래밍 객체지향프로그래밍 빅데이터분석 |\n| 미네르바교양대학 | 컴퓨터프로그래밍 |\n| AI데이터융합전공 | 객체지향프로그래밍 |\n\n## [heading1] ##\n# 다. 주요 공지 사항\n\n## [list] ##\n- - 소속 캠퍼스에 개설된 전공교류과목을 선택하여 수강해야 하며 캠퍼스 교차 수강 불가\n- - Business AI 전공에서는 타학과(전공)에서 개설되는 전공교류과목의 수강을 보장하지 않\n\n## [footer] ##\n- 61 -', '(공통)2025-1학기 이중전공 신청 일정 공고\n\n| 0 | 1 |\n|:-----------------------------------------------------------------|:------------------------------------------------------------------------------------|\n| 모든 학생 | 폐지된 학과(법학과,사회과학전공 등)및 본인 입학 학번에 존재하지 않는 학과 이수 불가 |\n| 비사범대 학생 | 사범대학 학과로 이중전공 이수 불가 |\n| 2016학번까지 | LD전공 및LT전공 이수 불가(※2017학번부터 가능) |\n| 서울캠퍼스 프랑스어학부 학생 | 프랑스어학부 내 세부전공을 이중전공으로 이수 불가 |\n| 서울캠퍼스 일본언어문화학부 학생 | 융합일본지역학부 이중전공 이수 불가 |\n| 서울캠퍼스 융합일본지역학부 학생 | 일본언어문화학부 이중전공 이수 불가 |\n| 서울캠퍼스 경제학부 학생(2007~2014학번) | 글로벌캠퍼스 경제학과 이중전공 이수 불가 |\n| 서울캠퍼스 경영대학 학생 | 글로벌캠퍼스 경상대학 학과/전공 이중전공 이수 불가 |\n| 서울캠퍼스Languae & AI융합학부, Social Sceince & AI융합학부 학생 | 글로벌캠퍼스 컴퓨터공학전공 이중전공 이수 불가 |\n| 서울캠퍼스Social Sceince＆AI융합학부 학생 | 서울캠퍼스Language & AI융합전공 이중전공 이수 불가 |\n| 서울캠퍼스Language & AI융합학부 학생 | 서울캠퍼스Social Sceince ＆AI융합전공 이중전공 이수 불가 |\n| 글로벌캠퍼스\xa0학생 | 서울캠퍼스\xa0융복합소프트웨어\xa0융합전공 이수 불가 |\n| 글로벌캠퍼스 융합인재학부학생 | 모든 이중전공이수 불가 |\n| 글로벌캠퍼스 영어통번역학부 학생 | 글로벌캠퍼스 영어통번역학부내 세부전공 이중전공 이수 불가 |\n| 글로벌캠퍼스 아프리카학부 학생 | 글로벌캠퍼스 아프리카학부내 세부전공 이중전공 이수 불가 |', '4140\n글로벌캠퍼스 GLOBAL CAMPUS\n공과대학\n컴퓨터공학부 41\n정보통신공학과 43\n반도체전자공학부(반도체공학전공) 45\n반도체전자공학부(전자공학전공) 47\n산업경영공학과 48\nCOLLEGE OF\nENGINEERING\nDivision of Computer Engineering\n컴퓨터공학부\n전화번호 031-330-4268\n홈페이지 computer.hufs.ac.kr\n전공소개 \n-  컴퓨터공학은 4차 산업혁명을 이끄는 핵심 전공으로서 스마트폰부\n터 인공지능까지, 컴퓨터공학이 어떻게 세상을 변화시키고 있는지 누\n구보다 빨리 이해하고 그 변화를 이끄는 인재를 양성합니다. 인공지\n능(AI), 웹(Web), 앱(App), 빅데이터, 클라우드 컴퓨팅, 사물인터넷\n(IoT), 게임 개발처럼 여러분이 매일 같이 사용하는 것이 어떻게 작동\n하는지 또 어떻게 만드는지 배웁니다.\n-  한국외대 컴퓨터공학부는 과학기술정보통신부에서 선정한 소프트웨\n어(SW) 중심대학으로, 정부의 전폭적인 지원에 힘입어 4차 산업혁명\n시대를 견인할 창의적 SW융합인재 양성을 위한 최신 커리큘럼을 제\n공합니다. 2021년부터는 컴퓨터공학부로 새롭게 명명되었으며, 소프\n트웨어와 AI 교육이 강화되었습니다. \n-  SW중심대학 주체 학과로서 우리 학생들에게는 다음과 같은 특별한 \n기회가 주어집니다: 단기/장기 국내외 인턴십 및 견학 프로그램, 해외 \n70여개 우수 대학 (미국, 영국, 아일랜드, 호주 등)에 7+1 파견 유학, \n산학연계 캡스톤 프로젝트, 학과 내 다양한 학회와 동아리 활동, 학생\n별 지도교수 매칭, 프로그래밍 경진대회, 코딩 테스트 준비 캠프, 자체 \n해커톤, 기업 실무자 초청 특강 등. \n-  이곳에서 배우게 될 최첨단 기술과 지식은 여러분이 세계 곳곳에서 혁\n신적인 프로젝트와 연구에 참여할 수 있는 기반을 마련해 줄 것입니\n다. 컴퓨터공학부 학생이 되어 여러분의 꿈을 현실로 만들어 보세요!\n필요역량 및 소양 \n-  고등학교까지의 수학, 과학 등의 기본 과목들과 컴퓨터 프로그래밍에 \n도움이 되는 논리적인 사고력이 가장 기본입니다. 실제 프로그램 개발 \n경험이 있는 경우가 아니더라도 논리적인 사고 능력과 수학과 과학 과\n목으로 대표되는 고등학교 과목의 내용을 나름의 원리로 스스로 체계\n화하는 연습을 한 번 더 한다면, 전공 공부에 큰 도움이 될 것입니다.\n-  진학 직전 방학 기간에는 파이썬과 같은 프로그래밍 언어를 미리 학', '4948\nDept. of Industrial and Management Engineering\n산업경영공학과\n전화번호 031-330-4093\n홈페이지 ime.hufs.ac.kr\n전공소개 \n산업경영공학은 산업공학과 경영학을 접목한 학문입니다. 공학적인 지\n식을 토대로 합리적이고 과학적으로 조직과 시스템을 관리·경영하는 방\n법을 다룹니다. 생산공정, 공급망을 비롯하여 경영전략, 회계, 인사 등 \n경영 전반에 걸친 문제를 분석하고 공학적인 해법을 제시합니다. 문제 \n상황을 분석해 의사결정을 최적화하는 일도 산업경영공학의 중요한 목\n표 중의 하나입니다. 산업경영공학에서는 빅데이터/인공지능으로 대표\n되는 공학적 지식과 경영학으로 대표되는 인문·사회학적 지식을 모두 \n요구하므로 통시적이고 전체적인 통찰력을 배양합니다. 한국외국어대\n학교 산업경영공학과에서는 특히 현실 문제에 전공지식을 응용함으로\n써 실무 능력을 키우고자 노력하고 있습니다. 아울러 전 세계 각국의 다\n양한 언어를 교육하고 있는 본교만의 장점을 살려, 전공에 대한 심층적 \n지식과 함께 외국어 능력 및 각국의 문화에 대한 이해를 겸비한 인재 양\n성을 지향합니다.\n필요역량 및 소양 \n-  산업경영공학은 종합적인 학문입니다. 공학적인 소양과 인문학적 소\n양 모두 필요합니다. \n-  공학적인 소양은 문제를 공학적인 관점에서 분석하고 최선의 해결책\n을 찾아내는 문제해결 능력을 키우기 위해 필요합니다. 평소에 일상적\n인 활동에서 불편하고 비효율적인 면을 찾고 어떻게 개선할 수 있을지 \n고민하는 습관이 큰 도움이 됩니다.\n-  또한 모든 일은 “인간”이 수행하기 때문에 사람들 간의 관계를 어떻게 \n관리하고 이해할지가 중요합니다. 논리적으로 말하는 능력과 듣는 사\n람이 이해하기 쉽게 설명하는 연습을 해보세요. \n우리 학과(부)·전공 매력 \n-  인공지능, 4차 산업혁명을 위한 인재 양성\n-  최고 수준은 교수진이 제공하는 최고의 교육\n-  실용적/문제 해결 능력 중심 교육을 통한 졸업 후 취업의 질과 양에\n서 최고라 자부\n-  재학생들 관련 경진 대회 수상 다수(교수진의 전폭적인 지원을 통해 \n졸업 후 취업 가능성 최대화)\n주요 실적 \n-  대학생 산업공학프로젝트 경진대회 최근 5년간 대상 2회 등 다수 수상\n-  산업공학회 석사논문경진대회 최근 5년간 대상, 최우수상 포함 다\n수 수상', '(공통)2025-1학기 이중전공 신청 일정 공고\n\n(공통)2025-1학기 이중전공 신청 일정 공고\n\n고)고2025 학년도 제 1 학기 이중전공 신청 일정을 아래와 같이 공고합니다 .\n\n- 아 래 -\n\n1. 신청 대상\n\n가 . 2 학년 진급 예정인 재학생\n\n(2007 학번 이후 학생으로 2025-1 학기를 두 번째 학기로 재학 중인 자 )\n\n나 . 2025 년도 전기 편입생 ( 순수외국인전형 편입생 포함 ) 중 이중전공 희망자\n\n※ 유의사항\n\n신청 대상자가 기간 내에 신청하지 않은 경우 또는 신청한 이중전공에서 탈락한 경우\n\n1) 다음 학기부터 이중전공 신청으로는 신청 불가\n\n2) 다음 학기부터 이중전공 변경 신청 기간에 이중전공 변경으로만 신청 가능\n\n[ 참고 ] 이중전공 변경 신청\n\n1) 매 학기 별도 신청 기간 (5 월 초 , 11 월 초 ) 을 공지하고 이중전공 변경 신청을 진행함\n\n2) 본인 학번대에 여석이 있는 경우에만 신청 가능하며 , 여석이 없으면 신청 불가\n\n( 신청 기간 공지 시 학번별 / 학과 ( 부 ) 별 여석 별도 안내 )\n\n2. 신청 기간 : 2025 년 5 월 26 일 ( 월 ) 10 시 ~ 5 월 30 일 ( 금 ) 16 시\n\n※ 안내된 기간에만 신청 / 변경 / 삭제 가능하므로 일정 준수할 것 ( 이후 별도 운영 계획 없음 )\n\n3.\xa0신청 방법 : 종합정보시스템 → 전공 / 교직관리 → 이중전공 신청\n\n가 . 2 지망 신청 가능 ( 선택사항 )\n\n1) 1 지망 배정 후 여석이 있는 경우에만 2 지망 배정\n\n2) 학과 ( 부 ) 선발인원보다 1 지망 신청자가 많으면\n\n- 2 지망 배정이 없으니 신청 시 참고할 것 ( 단 , 학과 ( 부 ) 별 전형이 있는 경우 제외 )\n\n- 학과 ( 부 ) 별 전형이 있는 경우 2 지망 지원자에 대해 전형 응시를 제한할 수 있음\n\n나 . 프랑스어학부를 이중전공으로할 경우 3 학년 진급 시 세부전공 / 트랙 신청 배정\n\n4. 제한사항\n\n가 . 캠퍼스 간 이중전공을 희망하는 경우 아래의 제한학과로는 신청 불가\n\n서울캠퍼스', '-  자연언어데이터: 현대의 빅데이터에서 중요한 역할을 하는 언어 데이\n터에 대한 이해와 이를 처리하기 위한 연구방법론을 공부하는 것을 목\n표로 한다. 기존 언어학/국어학 문법서에서 정의하는 문장의 개념, 단\n어 ~~의 개념, 수사 명사구, 고유명사, 외래어, 복합명사 등에 대한 언\n어학적 정의와 실제 온라인 언어데이터에서 나타나는 현실적 언어 단\n위들 사이의 차이점을 비교 공부한다.\n-  한국어 문법: 언어학적 관점에서 한국어의 형태론적 특성과 통사론적 \n특성을 밝히고, 이 특성을 기술하는 데에 있는 문제점들과 이에 대한 \n해결 방안을 함께 살펴본다.\n-  통사론: 낱말이나 구와 같은 문법 단위가 형태적/기능적으로 어떤 속\n성을 가지고 있는지, 이들이 어떻게 결합되어 보다 큰 단위인 구나 문\n장을 만드는가에 대해 알아본다. 나아가 통사론에서 기본적으로 다루\n어야 할 언어 현상을 배우고, 이를 설명하기 위해 필요한 개념을 함\n께 학습한다.', '[글로벌] 학부/계열 입학생 학과·세부전공·모듈 신청 공고-글로벌자유전공학부/인문과학계열(\n\n[글로벌] 학부/계열 입학생 학과·세부전공·모듈 신청 공고-글로벌자유전공학부/인문과학계열(\n\n[ 글로벌 ] 학부 / 계열 입학생 학과 · 세부전공 · 모듈 신청 공고\n\n학부 / 계열 입학생 학과 · 세부전공 · 모듈 신청 일정을 아래와 같이 공고함 .\n\n1. 대상\n\n가 . 인문과학계열 광역모집 학생 중 1 학 년 2 학기 진급 예정자\n\n나 . 영어통번역학부 2018 학번 ( 포함 ) 이후 학생 중 3 학년 진급 예정자\n\n다 . 아프리카학부 학생 중 1 학년 2 학기 진급 예정자\n\n라 . 글로벌스포츠산업학부 학생 중 2 학년 진급 예정자 (2024 학번부터 )\n\n마 . 융합인재학부 학생\n\n① 필수세부모듈 : 2 학년 진급 예정자\n\n② 선택세부모듈 : 2 학년 진급 예정자\n\n바 . 글로벌자유전공학부 학생 중 2 학년 진급 예정자\n\n2. 신청기간 : 2025. 5. 26.( 월 ) 10:00 ～ 5. 30.( 금 ) 16:00\n\n※ 신청기간 이후 추가 신청 및 변경 절대 불가\n\n3. 신청방법 : 종합정보시스템 → 전공 / 교직관리 → 1 전공 신청\n\n4. 배정원칙 : 학부 / 계열 배정 기준에 따름\n\n5. 유의사항\n\n가 . 인문과학계열 광역모집 및 아프리카학부 학생은 반드시 3 지망까지 신청\n\n나 . 영어통번역학부 : 2020 학번 이전 학생 3 지망까지 신청 / 2021 학번 이후 학생 2 지망까지 신청\n\n※ 세부전공 개편에 따라 2021 학번부터는 영미문학 · 번역전공 / TESOL 영어학전공만 신청 가능\n\n다 . 융합인재학부 : 필수모듈 4 지망까지 , 선택모듈 8 지망까지 모두 신청\n\n라 . 글로벌자유전공학부 : 1 지망 신청\n\n※ 신청기간 내 미신청 시 학부에서 임의 배정 함 .( 배정 내역 추후 변경 불가 )\n\n6. 배정확정 : 2025 년 7 월 중 (1 학기 성적 반영 완료 후 )\n\n2025. 5.\n\n글로벌캠퍼스 교무처장', '(공통)2025-1학기 부전공 신청 및 이중/부전공 취소 일정 공고\n\n(공통)2025-1학기 부전공 신청 및 이중/부전공 취소 일정 공고\n\n2025 학년도 제 1 학기 부전공 신청 및 이중 / 부전공 취소 일정을 아래와 같이 공고합니다 .\n\n- 아 래 -\n\n1. 신청 대상 : (2025-1 학기 기준 ) 2 학기 ~ 7 학기 재학생 및 휴학생 중\n\n가 . 부전공 희망자 : 일반 부전공 또는 전공심화 + 부전공 신청\n\n( 전공심화 + 부전공 신청자는 1 전공의 졸업이수학점 늘어남 . 반드시 확인할 것 )\n\n나 . 이중 / 부전공 취소 희망자 ( 단일전공 희망자 ) : 이중 / 부전공을 취소하고 전공심화 이수\n\n※ 단 , 8 학기 이상인 학생 은 이중 ( 부 ) 전공 변경 신청서 ( 첨부파일 ) 를 작성하여\n\n학사종합지원센터 단과대학 교학과 이메일 또는 방문 신청\n\n▶ ( 서울 ) 제출처 안내 바로가기\n\n▶ ( 글로벌 ) hufsdbl@hufs.ac.kr 로 이메일 제출\n\n2. 일 정\n\n가 . 신청 기간 : 2025 년 1 월 22 일 ( 수 ) 10 시 ~ 1 월 23 일 ( 목 ) 14 시\n\n※ 안내된 기간에만 운영하므로 일정 준수할 것 ( 이후 별도 운영 계획 없음 )\n\n나 . 결과 확인 : 2025 년 1 월 24 일 ( 금 ) 14 시 , 종합정보시스템\n\n3. 신청 방법 : 종합정보시스템 → 전공 / 교직관리 ( ※ 가 . / 나 . 중 하나의 방법으로 신청 )\n\n가 . 부전공 신청 : 전공심화 + 부전공 또는 부전공 신청\n\n1) 신청 시 기존에 이수 중인 이중 / 부전공 은 자동 취소 됨 ( ※ 별도 취소 절차 없음 )\n\n2) “4. 유의 사항 ” 의 다 . 참고 하여 부전공 신청으로 인한 이수구분 변경 신청\n\n※ 이번 학기 졸업예정자 (4 학년 수료 , 졸업대기 포함 ) 는 1 월 초 까지\n\n이수구분 변경을 신청하여 졸업 학점이 누락되는 일이 없도록 해야 함\n\n나 . 이중 / 부전공 취소 ( 단일전공 희망자 ) : 이중전공 / 부전공 취소 신청\n\n1) 이중 / 부전공을 취소하는 경우 1 전공을 심화로 필수 이수 해야 함']","'컴퓨팅사고' 과목을 AI융합전공 이중과목으로 변경하기 위해서는 이수구분 변경 신청서를 작성하여 제출해야 합니다. 다음은 신청 방법입니다:

1. **신청서 작성**: 이수구분 변경 신청서를 작성합니다. 해당 서식은 학사종합지원센터 홈페이지에서 다운로드할 수 있습니다.

2. **제출처**: AI융합전공 담당 선생님에게 이메일로 제출하거나 직접 방문하여 제출합니다.

3. **제출 기한**: 졸업학기 졸업사정일 전까지 제출해야 하며, 당해 학기 수강신청 건에 대해서는 성적 취득 후 신청하는 것이 권장됩니다.

4. **확인**: 신청 후 3~4일(평일 기준) 이후에 종합정보시스템에서 변경 결과를 확인하고, 변경이 되지 않은 경우 즉시 담당자에게 연락하여 확인해야 합니다.

정확한 절차나 추가적인 문의는 AI융합전공 담당 교수님께 확인하시기 바랍니다. 혹시 더 도와드릴까요?","컴퓨팅사고를 AI융합전공 이중과목으로 변경하시려면, 이수구분 변경 신청서를 작성하신 후,해당 전공 소속 단과대학의 담당 선생님에게 이메일로 제출하시거나 직접 방문하여 제출하셔야 합니다.
신청은 졸업학기 졸업사정일 전까지 가능하며, 제출 후 3~4일 이내에 종합정보시스템에서 변경 결과를 확인하실 수 있습니다.
만약 변경이 되지 않았거나 문제가 발생한 경우, 즉시 담당 선생님에게 연락하여 확인하셔야 합니다.자세한 사항은 학사종합지원센터의 공지사항을 참고하시기 바랍니다. 도움이 필요하시면 언제든지 문의해 주세요.",0.9157151624111463,0.8,0.875,0.9068404026039549
감기로 병원다녀왔는데 진료확인서로 유고결석 가능해?,"['이병도 교수님은 태국어통번역학과 학과 소속입니다. 교수 직위를 맡고 있습니다. 연구실은 연구동(글로벌) 202호입니다.', '| 출산 | 출산 | 본인 : 출산 전후 20일 이내시험 기간이 중복될 경우, 배우자 : 출 산(예정)일 | 본인 : 출생(출산예정) 증명서 등, 배우자 : 출생(출산예정) 증명서 및 가족관계증명서 등 | 성적입력 및 정정기간 전까지 담당교수의 지침에 따른 별도의 평가절차를 거침 |  |\n| 징병에 의한 입대 | 징병에 의한 입대 | 입대 3일전 이후의 시험과목 | 소집영장 사본 | 입대 전 ￬ 입영통지서 또는 소집영장을 담당교수에게 제출 ￬ 담당교수의 지침에 따른 평가 절차를 거침 |  |', '## [paragraph] ##\n나. 처리절차\n\n## [paragraph] ##\n1) 유고결석·결시 공통 안내사항\n\n## [paragraph] ##\n* 질병 및 상해의 경우 의원에서 발급받은 서류는 해당되지 않음\n(병원급 의료 기관 확인 : 건강보험심사평가원(https://www.hira.or.kr)', '| 질병 및 상해 로 인한 입원 또는 감염병 으로 인한 격 리(치료) | 법정감염병 (**질병관리청의 법정감염병에 한함) | 격리(치료) 기간 또는 감염우려 기간 | 해당 증빙서류 | 담당교수에게 증빙서류 제출 |  |\n| 졸업시험 | 졸업시험 | 졸업시험 당일 | 학과장 확인서 | 담당교수에게 증빙서류 제출 |  |\n| 수업일수 4분의 3선 후 징병에 의한 군입대 | 수업일수 4분의 3선 후 징병에 의한 군입대 | - | 입영통지서 | 담당교수에게 증빙서류 제출 |  |\n| 출산 | 출산 | 본인:20일 배우자:10일 | 본인 : 출생(출산예정)증 명서 등, 배우자 : 출생 (출산예정)증명서 및 가족관계증명서 등 | 담당교수에게 증빙서류 제출 |  |\n| 생리 | 생리 | 생리기간 (학기중 2회) | 유고결석신청서 (생리공결제) | 담당교수에게 증빙서류 제출 | ※ 자세한 사항은 학사공지사항 생리 유고 신청안내 참조 |\n| 교직과정이수자의 학교현장실습 | 교직과정이수자의 학교현장실습 | 교육실습 기간 | 교직담당자가 발급한 확인서 | 담당교수에게 증빙서류 제출 |  |\n| 졸업예정자(해당학기 졸업가능자) 로서 조기취업자 | 졸업예정자(해당학기 졸업가능자) 로서 조기취업자 | 취업기간 | 학과장 승인받은 유고결석 인정원, 재직(계약)증명서 및 4대보험가입내역 확인서 또는 이에 준하는 재직증명서류 | 입사확정 후 즉시 ￬ 유고결석인정원과 증빙서류에 대해 학과장 승인 ￬ 소속 단과대에 제출 ￬ 유고결석확인서를 발급받아 담당교수에게 제출 ￬ 수업종료 직전 취업사실에 대해 재확인 | ※ 자세한 사항은 학사공지사항 졸업예정자(해 당학기 졸업가능자)의 조기취업 유고결석 신청 안내 참조 |', '## [paragraph] ##\n나. 처리절차\n\n## [paragraph] ##\n1) 유고결석·결시 공통 안내사항\n\n## [paragraph] ##\n* 질병 및 상해의 경우 의원에서 발급받은 서류는 해당되지 않음\n(병원급 의료 기관 확인 : 건강보험심사평가원(https://www.hira.or.kr)\n\n## [paragraph] ##\n⇒ 검색창에서 병원이름 기입 후 검색 ⇒ 검색결과에서 해당병원 클릭\n⇒ 병원 기본정보 중 병원구분에서 병원등급 확인\n\n## [paragraph] ##\n** 질병관리청의 법정감염병 확인(https://dportal.kdca.go.kr)\n(질병관리청 감염병 포털 -> 감염병정보 -> 법정감염병에서 병명 확인)\n\n## [paragraph] ##\n2) 유고결석(수업 결석) : 사유발생 시 담당교수에게 알리고, 유고사유가 끝난 날부터\n7일 이내 증빙서류를 제출해야 함.\n(해당학기 졸업가능한 조기취업자는 입사확정 후 즉시 제출)', '| 질병 및 상해 로 인한 입원 또는 감염병 으로 인한 격 리(치료) | 법정감염병 (**질병관리청의 법정감염병에 한함) | 격리(치료) 기간 또는 감염우려 기간 | 해당 증빙서류 | 담당교수에게 증빙서류 제출 |  |\n| 졸업시험 | 졸업시험 | 졸업시험 당일 | 학과장 확인서 | 담당교수에게 증빙서류 제출 |  |\n| 수업일수 4분의 3선 후 징병에 의한 군입대 | 수업일수 4분의 3선 후 징병에 의한 군입대 | - | 입영통지서 | 담당교수에게 증빙서류 제출 |  |\n| 출산 | 출산 | 본인:20일 배우자:10일 | 본인 : 출생(출산예정)증 명서 등, 배우자 : 출생 (출산예정)증명서 및 가족관계증명서 등 | 담당교수에게 증빙서류 제출 |  |', '| 질병 및 상해 로 인한 입원 또는 감염병 으로 인한 격 리(치료) | 법정감염병 (**질병관리청의 법정감염병에 한함) | 격리(치료) 기간 또는 감염우려 기간 | 해당 증빙서류 | 담당교수에게 증빙서류 제출 |  |\n| 졸업시험 | 졸업시험 | 졸업시험 당일 | 학과장 확인서 | 담당교수에게 증빙서류 제출 |  |\n| 수업일수 4분의 3선 후 징병에 의한 군입대 | 수업일수 4분의 3선 후 징병에 의한 군입대 | - | 입영통지서 | 담당교수에게 증빙서류 제출 |  |\n| 출산 | 출산 | 본인:20일 배우자:10일 | 본인 : 출생(출산예정)증 명서 등, 배우자 : 출생 (출산예정)증명서 및 가족관계증명서 등 | 담당교수에게 증빙서류 제출 |  |\n| 생리 | 생리 | 생리기간 (학기중 2회) | 유고결석신청서 (생리공결제) | 담당교수에게 증빙서류 제출 | ※ 자세한 사항은 학사공지사항 생리 유고 신청안내 참조 |', '| 질병 및 상해 로 인한 입원 또는 감염병 으로 인한 격 리(치료) | 질병 및 상해 | 입원기간 | 해당 증빙서류 (*병원급 이상의 의료기관) | 담당교수에게 증빙서류 제출 |  |\n| 질병 및 상해 로 인한 입원 또는 감염병 으로 인한 격 리(치료) | 법정감염병 (**질병관리청의 법정감염병에 한함) | 격리(치료) 기간 또는 감염우려 기간 | 해당 증빙서류 | 담당교수에게 증빙서류 제출 |  |', '## [paragraph] ##\n나. 처리절차\n\n## [paragraph] ##\n1) 유고결석·결시 공통 안내사항\n\n## [paragraph] ##\n* 질병 및 상해의 경우 의원에서 발급받은 서류는 해당되지 않음\n(병원급 의료 기관 확인 : 건강보험심사평가원(https://www.hira.or.kr)\n\n## [paragraph] ##\n⇒ 검색창에서 병원이름 기입 후 검색 ⇒ 검색결과에서 해당병원 클릭\n⇒ 병원 기본정보 중 병원구분에서 병원등급 확인\n\n## [paragraph] ##\n** 질병관리청의 법정감염병 확인(https://dportal.kdca.go.kr)\n(질병관리청 감염병 포털 -> 감염병정보 -> 법정감염병에서 병명 확인)', '| 질병 및 상해 로 인한 입원 또는 감염병 으로 인한 격 리(치료) | 질병 및 상해 | 입원기간 | 해당 증빙서류 (*병원급 이상의 의료기관) | 성적입력 및 정정기간 전까지 담당교수의 지침에 따른 별도의 평가절차를 거침 |  |\n| 질병 및 상해 로 인한 입원 또는 감염병 으로 인한 격 리(치료) | 법정감염병 (* *질 병관리 청의 법정감염 병에 한함) | 격리(치료) 기간 또는 감염우려기간 | 해당 증빙서류 | 성적입력 및 정정기간 전까지 담당교수의 지침에 따른 별도의 평가절차를 거침 |  |', '## [paragraph] ##\n나. 처리절차\n\n## [paragraph] ##\n1) 유고결석·결시 공통 안내사항\n\n## [paragraph] ##\n* 질병 및 상해의 경우 의원에서 발급받은 서류는 해당되지 않음\n(병원급 의료 기관 확인 : 건강보험심사평가원(https://www.hira.or.kr)\n\n## [paragraph] ##\n⇒ 검색창에서 병원이름 기입 후 검색 ⇒ 검색결과에서 해당병원 클릭\n⇒ 병원 기본정보 중 병원구분에서 병원등급 확인\n\n## [paragraph] ##\n** 질병관리청의 법정감염병 확인(https://dportal.kdca.go.kr)\n(질병관리청 감염병 포털 -> 감염병정보 -> 법정감염병에서 병명 확인)\n\n## [paragraph] ##\n2) 유고결석(수업 결석) : 사유발생 시 담당교수에게 알리고, 유고사유가 끝난 날부터\n7일 이내 증빙서류를 제출해야 함.\n(해당학기 졸업가능한 조기취업자는 입사확정 후 즉시 제출)\n\n## [table] ##\n| 사유 | 기간 | 증빙서류 | 절차 | 비고 |\n| --- | --- | --- | --- | --- |\n| 직계존비속, 배우자 및 형제 자매의 사망 | 7일 이내 (중간 공휴일 포함) | 사망진단서, 가족관계증명서 등 | 담당교수에게 증빙서류 제출 |  |\n| 본인의 결혼 | 7일 이내 (중간 공휴일 포함) | 청첩장, 예식장계약서 등 | 담당교수에게 증빙서류 제출 |  |\n| 징병검사, 입대지원시험 및 예비군 훈련 | 해당기간 | 소집영장사본 또는 징병검사 통지서사본, 교육필증 등 | 담당교수에게 증빙서류 제출 |  |\n\n## [footer] ##\n- 68 -', '| 질병 및 상해 로 인한 입원 또는 감염병 으로 인한 격 리(치료) | 법정감염병 (* *질 병관리 청의 법정감염 병에 한함) | 격리(치료) 기간 또는 감염우려기간 | 해당 증빙서류 | 성적입력 및 정정기간 전까지 담당교수의 지침에 따른 별도의 평가절차를 거침 |  |\n| 졸업예정자로서 취업 및 진학 시험이 중복될 경우 | 졸업예정자로서 취업 및 진학 시험이 중복될 경우 | 해당 시험일 | 수험표사본 | 성적입력 및 정정기간 전까지 담당교수의 지침에 따른 별도의 평가절차를 거침 |  |\n| 출산 | 출산 | 본인 : 출산 전후 20일 이내시험 기간이 중복될 경우, 배우자 : 출 산(예정)일 | 본인 : 출생(출산예정) 증명서 등, 배우자 : 출생(출산예정) 증명서 및 가족관계증명서 등 | 성적입력 및 정정기간 전까지 담당교수의 지침에 따른 별도의 평가절차를 거침 |  |', '| 본 대학교 및 소속 단과대학을 대표하는 공무, 행사 또는 운동경기참가 | 학교 주관 행사 및 업무 지원 | 해당기간 | 담당부서에서 발급한 확인서 | 담당교수에게 증빙서류 제출 |  |\n| 질병 및 상해 로 인한 입원 또는 감염병 으로 인한 격 리(치료) | 질병 및 상해 | 입원기간 | 해당 증빙서류 (*병원급 이상의 의료기관) | 담당교수에게 증빙서류 제출 |  |\n| 질병 및 상해 로 인한 입원 또는 감염병 으로 인한 격 리(치료) | 법정감염병 (**질병관리청의 법정감염병에 한함) | 격리(치료) 기간 또는 감염우려 기간 | 해당 증빙서류 | 담당교수에게 증빙서류 제출 |  |', '* 양성반응의 경우 2차 정밀 검사\xa0/ 기존 치료용 약물 복용자는 별도의 중독자 아님을 증명하 는 진단서(또는 확인서) 제출\n\n* 검사는 12월\xa016일\xa0부터\xa0 개인별 검사 진행하고\xa0\xa0해당 결과를 제출하여야 함(해당 기간 이전 검사는 인정하지 않음).\n\n4. 기타 : 검사 결과지는 반드시 원본으로 제출 하여야 하며 방문 제출이 어려운 경우, 무시험검정원서와 함께\xa0등기 우편 발송 가능\n\n5. 등기 발송 주소\xa0:\xa0서울시 동대문구 이문로 107 한국외국어대학교 본관\xa01층\xa0118호\xa0학사종합지원센터 사범대학 및 교직 담당자 앞\n\n경기도 용인시 처인구 모현읍 외대로 81 한국외국어대학교\xa0학사종합지원센터\xa0 교직 담당자 앞', '있습니다. 이에 한국외국어대학교 바이오메디컬공학부는 빠르게 발전하는 의료 현장의 요구에 부응하기 위해, 개인 맞춤형 정밀 의료 서비스 제공을 위한 유전체 분석, 의료 영상 기반의 객관적인 진단, 치료 효과의 검증을 위한 시스템개발, 의료 빅데이터 처리 및 의료 인공지능 처리 기술 개발에 중점을 두고 있습니다. 또한 광범위한 바이오메디컬공학 분야의 개괄적 교육이 아닌 세 가지 유망 분야에 보다 특화된 교육을 수행합니다. 미래 사회 트렌드인 유전자 데이터를 이용한 정밀 의료, 의료 빅데이터를 이용한 인공지능 의료 데이터 처리, 미래 신수종 사업 분야인 정밀 의료 영상 및 비영상 진단기기 분야의 교육을 기반으로 교내외에서의 다양한 경험을 통한 미래사회에 최적의 적응력을 가진 융복합 인재 양성을 목표로 하고', '[공통] 졸업예정자(해당학기 졸업가능자)의 조기취업 유고결석 신청 안내\n\n[공통] 졸업예정자(해당학기 졸업가능자)의 조기취업 유고결석 신청 안내\n\n졸업예정자 ( 해당학기 졸업가능자 ) 의 조기취업 유고결석 신청 안내\n\n졸업예정자 ( 해당학기 졸업가능자 ) 의 조기취업 관련 유고결석 신청 방법을 아래와 같이 안내합니다 .\n\n- 아 래 -\n\n1. 졸업예정자 ( 해당학기 졸업가능자 ) 의 조기취업 유고결석 신청 방법\n\n가 . 신청대상 : 졸업예정자 ( 해당학기 졸업가능자 ) 로서 조기취업자\n\n※ 직계존속자가 대표로 있는 사업장의 취업자 ( 가족회사 ), 프리랜서 , 창업자 , 인턴 , 아르바이트성 취업은 인정 불가 ( 단 , 정규직 전환형 , 채용 전환형 인턴은 가능 )\n\n나 . 인정기간 : 취업기간\n\n다 . 증빙서류\n\n구분\n\n신청서류\n\n서류 발급\n\n공통\n\n유고결석 인정원\n\n첨부파일\n\n재직기간이 명시된 재직 ( 계약 ( 고용 )) 증명서\n\n재직회사 ( 기관 )\n\n성적증명서\n\n종합정보시스템 로그인 → 인터넷증명발급\n\n해당학기 시간표\n\n종합정보시스템 로그인 → 수업 / 수강관리 → 개인시간표에서 출력\n\n국내\n\n4 대보험가입내역확인서\n\n(특수직역연금 가입자의 경우, 특수직역연금 가입서류 추가 제출 요망)\n\n4 대사회보험 정보연계센터 https://www.4insure.or.kr 에서 발급\n\n해외\n\n취업비자사본\n\n해당국가 고용보험 납입증명서 혹은 보험카드 등\n\n우리나라 4 대보험에 준하는 보험가입서류\n\n* 채용 전환형 인턴의 경우 재직 ( 계약 ( 고용 )) 증명서에 해당 내용 명시\n\n** 공무원의 경우 재직증명서 발급 전에는 공무원합격증으로 제출\n\n*** 특수직역연금: 공무원연금, 군인연금, 사립학교교직원연금 등\n\n라 . 신청시기 및 절차\n\n1) 신청시기 : 입사확정 후 즉시\n\n2) 절차 : ① 수강과목 담당교수에게 취업사실을 알리고 허락을 득한 후\n\n② 유고결석인정원과 증빙서류를 첨부하여 학과 ( 부 ) 사무실 제시\n\n③ 본인 소속 학과 ( 부 ) 장 승인\n\n④ 유고결석인정원과 증빙서류를 학사종합지원센터 소속 단과대에 제출', '서울캠퍼스 학생예비군 동미참(이월) / 기본(이월) 훈련 관련 유고결석 처리 및 학습권 보\n\n|:-----------------------------------------------------------------------------------------------------------------------------------------------------------------------------------------------------------------------------------------------------------------------------------------------------------------------------------------------------------------------------------------------------------------------------------------------------------------------------------------------------------------------------------------------------------------------------------------------------------------------------------------------------------------------------------------------------------------------------------------------------------------------------------------------------------------------------------------------------------------------------------------------------------------------------------------------------------------------------------------------------------------------------------------------------------------------------------------------------------------------------------------------------------------------------------------------------------------------------------------------------------------------------------------------------------------------------------------------------------------------------------------------------------------------------------------------------------------------------------------------------------------------------------------------------------------------------------------------------------------------|', '서울캠퍼스 학생예비군 기본 1차훈련 관련 유고결석 처리 및 학습권 보장 조치 안내\n\n|:-----------------------------------------------------------------------------------------------------------------------------------------------------------------------------------------------------------------------------------------------------------------------------------------------------------------------------------------------------------------------------------------------------------------------------------------------------------------------------------------------------------------------------------------------------------------------------------------------------------------------------------------------------------------------------------------------------------------------------------------------------------------------------------------------------------------------------------------------------------------------------------------------------------------------------------------------------------------------------------------------------------------------------------------------------------------------------------------------------------------------------------------------------------------------------------------------------------------------------------------------------------------------------------------------------------------------------------------------------------------------------------------------------------------------------------------------------------------------------------------------------------------------------------------------------------------------------------------------------------------------|', '서울캠퍼스 학생예비군 동미참(이월) / 기본(이월) 훈련 관련 유고결석 처리 및 학습권 보\n\n| 0 |', '서울캠퍼스 학생예비군 기본 1차훈련 관련 유고결석 처리 및 학습권 보장 조치 안내\n\n| 0 |', '서울캠퍼스 학생예비군 기본 1차훈련 관련 유고결석 처리 및 학습권 보장 조치 안내\n\n서울캠퍼스 학생예비군 기본 1차훈련 관련 유고결석 처리 및 학습권 보장 조치 안내\n\n서울캠퍼스 학생예비군 기본훈련(1차) 관련 유고결석 처리 및 학습권 보장 조치 안내\n\n서울캠퍼스 학생예비군 기본 1 차 훈련 이 아래와 같이 진행되므로 교 · 강사께서는 관련 법령에 따라 훈련에 참가하는 학생의 학습권 보장을 해 주시기 바랍니다.\n\n1. 훈련일정 : 2025. 5. 7.(수) ~ 5. 9.(금), 3일간\n\n일 자\n\n대 학\n\n5.\xa07.( 수 )\n\n경영대학, 상경대학, 사회과학대학, AI융합대학\n\n5.\xa08.( 목 )\n\n서양어대학, 아시아언어문화대학, 사범대학\n\n5.\xa09.(금 )\n\n영어대학, 일본학대학, 중국학대학, 국제학부, LD & LT, 대학원, 교직원\n\n2. 주요 조치사항\n\n가 . 유고결석 처리 : 참석자는 일괄적으로 전자출결관리시스템 자동입력 ( 교강사 임의 수정 불가 )\n\n나 . 학습권 보장조치 : 훈련기간 동안 수업 관련 자료 제공 또는 수업보충 실시\n\n※ 교 · 강사께서는 상기 내용을 참고하시어 예비군 훈련 참가 학생의 학습권을 보장해 주시기 바랍니다 .\n\n3.\xa0참고\n\n「 병역법 」 제 74 조의 3 ( 병력동원 및 훈련 관련 학업 보장 ) 고등학교 이상의 학교의 장은 다음 각 호에 따른 소집 등에 응하여 의무를 이행하는 학생에 대해서는 그 소집된 기간을 결석으로 처리하거나 그 소집을 이유로 불리하게 처우하지 못한다 .\n\n1. 제 44 조부터 제 54 조까지의 규정에 따른 병력동원소집 , 병력동원훈련소집 , 전시근로소집 또는 전시근로소집점검\n\n2. 「 대체역의 편입 및 복무 등에 관한 법률 」 제 26 조제 1 항에 따른 예비군대체복무 ( 이하 "" 예비군대체복무 "" 라 한다 ) 소집', '[공통] 졸업예정자(해당학기 졸업가능자)의 조기취업 유고결석 신청 안내\n\n이행하지 않을 경우 유고결석은 인정되지 않음\n\n마 . 출석인정의 권한은 담당교수에게 있음 . 따라서 무조건 출석이 인정되는 것은 아니므로 사전에 담당교수의 허락을 득해야 함\n\n바 . 조기취업 유고결석을 수업을 듣지 않기 위한 목적 또는 결석의 대체 수단으로 사용되지 않도록 각별히 유념하시기 바람\n\n2025. 3. 12.\n\n서울 · 글로벌캠퍼스 교무처장\n\n| 0 |\n|:--------------------------------------------------------------|\n| 졸업예정자(해당학기 졸업가능자)의 조기취업\xa0유고결석 신청 안내 |\n\n| 0 | 1 | 2 |\n|:-----|:-----------------------------------------------------------------------------------------|:--------------------------------------------------------------|\n| 구분 | 신청서류 | 서류 발급 |\n| 공통 | 유고결석 인정원 | 첨부파일 |\n| 공통 | 재직기간이 명시된 재직(계약(고용))증명서 | 재직회사(기관) |\n| 공통 | 성적증명서 | 종합정보시스템 로그인\xa0→\xa0인터넷증명발급 |\n| 공통 | 해당학기 시간표 | 종합정보시스템 로그인\xa0→\xa0수업\xa0/\xa0수강관리\xa0→\xa0개인시간표에서 출력 |\n| 국내 | 4대보험가입내역확인서 (특수직역연금 가입자의 경우, 특수직역연금 가입서류 추가 제출 요망) | 4대사회보험 정보연계센터\xa0https://www.4insure.or.kr에서 발급 |\n| 해외 | 취업비자사본 | 정보없음 |\n| 해외 | 해당국가 고용보험 납입증명서 혹은 보험카드 등 우리나라\xa04대보험에 준하는 보험가입서류 | 정보없음 |', '서울캠퍼스 학생예비군 동미참(이월) / 기본(이월) 훈련 관련 유고결석 처리 및 학습권 보\n\n서울캠퍼스 학생예비군 동미참(이월) / 기본(이월) 훈련 관련 유고결석 처리 및 학습권 보\n\n서울캠퍼스 학생예비군 동미참(이월) /\xa0기본(이월) 훈련 관련 유고결석 처리 및 학습권 보장 조치 안내\n\n서울캠퍼스 학생예비군 동미참(이월) / 기본(이월) 훈련이 아래와 같이 진행되므로 교 · 강사께서는 관련 법령에 따라 훈련에 참가하는 학생의 학습권 보장을 해 주시기 바랍니다 .\n\n1. 훈련일정\n\n- 동미참(이월) 훈련 : 2025.\xa03. 17.(월) ~ 3. 20.(목), 4일간\n\n- 기본(이월) 훈련 :\xa02025.\xa03.\xa024.( 월 ), 1 일\n\n2. 주요 조치사항\n\n가 . 유고결석 처리 : 참석자는 일괄적으로 전자출결관리시스템 자동입력 ( 교강사 임의 수정 불가 )\n\n나 . 학습권 보장조치 : 훈련기간 동안 수업 관련 자료 제공 또는 수업보충 실시\n\n※ 교 · 강사께서는 아래 내용을 참고하시어 예비군 훈련 참가 학생의 학습권을 보장해 주시기 바랍니다 .\n\n3. 참고\n\n「 병역법 」 제 74 조의 3 ( 병력동원 및 훈련 관련 학업 보장 ) 고등학교 이상의 학교의 장은 다음 각 호에 따른 소집 등에 응하여 의무를 이행하는 학생에 대해서는 그 소집된 기간을 결석으로 처리하거나 그 소집을 이유로 불리하게 처우하지 못한다 .\n\n1. 제 44 조부터 제 54 조까지의 규정에 따른 병력동원소집 , 병력동원훈련소집 , 전시근로소집 또는 전시근로소집점검\n\n2. 「 대체역의 편입 및 복무 등에 관한 법률 」 제 26 조제 1 항에 따른 예비군대체복무 ( 이하 "" 예비군대체복무 "" 라 한다 ) 소집\n\n「 병역법 」 제 93 조의 2 ( 병력동원 및 훈련 관련 학업 및 직장 보장의 위반 ) 학교의 장 또는 고용주 등이 정당한 사유 없이 제 74 조의 3 또는 제 74 조의 4 를 위반하여 불리한 처우를 한 경우에는 2 년 이하의 징역 또는 2 천만원 이하의 벌금에 처한다 .', '[공통] 졸업예정자(해당학기 졸업가능자)의 조기취업 유고결석 신청 안내\n\n라 . 신청시기 및 절차\n\n1) 신청시기 : 입사확정 후 즉시\n\n2) 절차 : ① 수강과목 담당교수에게 취업사실을 알리고 허락을 득한 후\n\n② 유고결석인정원과 증빙서류를 첨부하여 학과 ( 부 ) 사무실 제시\n\n③ 본인 소속 학과 ( 부 ) 장 승인\n\n④ 유고결석인정원과 증빙서류를 학사종합지원센터 소속 단과대에 제출\n\n⑤ 유고결석 확인서를 발급받아 담당교수에게 제출\n\n⑥ 기말고사 전일까지 재직증명서 , 4 대보험가입내역확인서를 담당교수에게 한 번 더 제출 ( 취업사실이 계속되고 있음을 최종확인 )\n\n2. 유의사항\n\n가 . 출석인정은 학기 중 연수기간 및 재직기간 동안만 가능 ( 연수기간이 입사일 이전일 경우 연수확인서 반드시 제출 )\n\n나 . 조기취업자의 유고결석 인정은 출석인정만을 위한 것으로 조기취업자에 대해 교과목 학습목표 및 학업성취도 달성을 위한 별도의 평가 ( 리포트 , 기타 과제물 ,\n\n동영상 수업 등 ) 를 진행해야 하며 , 중간시험 및 기말시험은 응시를 원칙으로 하되 , 부득이한 경우 리포트 및 기타 과제물 등으로 대체할 수 있음 .\n\n단 , 시험을 대체하는 과제물 ( 보고서 등 ) 작성 시 과다한 표절 ( 전체 25% 이상 ) 은 성적 불인정 사유가 될 수 있음 .\n\n다 . 불가피한 사유로 학기 종료 전 퇴사자는 퇴사 즉시 학교로 복귀하여야하며 복귀하지 않을 경우 해당기간은 무단결석으로 처리함\n\n라 . 조기취업자는 기말고사 전일까지 재직증명서 , 4 대보험 가입내역 확인서를 담당교수에게 한 번 더 제출하여 취업사실이 계속되고 있음을 최종확인 받아야 하며 최종 확인을\n\n이행하지 않을 경우 유고결석은 인정되지 않음\n\n마 . 출석인정의 권한은 담당교수에게 있음 . 따라서 무조건 출석이 인정되는 것은 아니므로 사전에 담당교수의 허락을 득해야 함\n\n바 . 조기취업 유고결석을 수업을 듣지 않기 위한 목적 또는 결석의 대체 수단으로 사용되지 않도록 각별히 유념하시기 바람\n\n2025. 3. 12.\n\n서울 · 글로벌캠퍼스 교무처장', '[공통] 2025학년도 신/편입생 군휴학 신청 안내\n\n[공통] 2025학년도 신/편입생 군휴학 신청 안내\n\n2025학년도 신/편입생 군휴학 신청 안내\n\n2025 학년도 신 / 편입생 군휴학 신청 일정을 공고합니다.\n\n1. 대상 : 2025 학년도 신입생 / 편입생 중 현재 군복무자 및 2025. 5. 23. 이전 입대자\n\n2. 일정 : 현재 군복무자 - 2025. 3. 4.( 화 ) ~ 3. 11.( 화 )\n\n입영 예정자 (5. 23. 이전 ) - 2025. 3. 4.( 화 ) ~ 입대 3 일 전\n\n3. 방법 : [ 종합정보시스템 ] 로그인 → 좌측 메뉴 중 [ 휴 / 복학 신청 ] → 군휴학 선택 및 파일 업로드\n\n* 종합정보시스템의 아이디는 학번이며 , 비밀번호는 주민번호 앞 6 자리 ( 로그인 이후 본인이 비밀번호 변경 )\n\n* 파일 업로드 유의사항\n\n- 입대를 증빙할 수 있는 서류 ( 입영통지서 사본 , 병적증명서 , 복무확인서 등 ) 중 1 개의 파일 업로드\n\n- JPG 파일만 업로드 가능 ( 최대 10MB)\n\n4. 유의사항 : 3/4 선 후 입대자 (5.23. 후 입대 ) 는 반드시 2025 학년도 제 1 학기 성적을 인정받아야 하므로 ( 입대일 이후는 유고결석 처리 ) 반드시 수강신청을 하고\n\n입대 전까지 수업에 참여하여야 함 . 2 학기부터 군휴학 처리됨 . 관련사항 소속캠퍼스 수강편람의 유고결석 . 결시 처리절차 참고 바람.\n\n2025. 2.\n\n서울 . 글로벌 학사종합지원센터\n\n| 0 |\n|:--------------------------------------------------------------------------------------------------------------------------------|\n| - 입대를 증빙할 수 있는 서류(입영통지서 사본, 병적증명서, 복무확인서 등) 중 1개의\xa0파일 업로드 - JPG파일만 업로드 가능(최대10MB) |', '서울캠퍼스 학생예비군 기본 1차훈련 관련 유고결석 처리 및 학습권 보장 조치 안내\n\n1. 해당 동원 또는 훈련 기간 동안의 수업에 있어서 결석으로 처리하지 않을 것\n\n2. 해당 동원 또는 훈련 기간 동안의 수업과 관련된 자료 제공 또는 수업 보충을 실시할 것\n\n3. 그 밖에 해당 동원 또는 훈련을 이유로 성적 처리 등 학업에 불리한 처우를 하지 않을 것\n\n2025.\xa04. 21.\n\n| 0 | 1 |\n|:----------|:--------------------------------------------------------------------|\n| 일 자 | 대 학 |\n| 5.\xa07.(수) | 경영대학, 상경대학, 사회과학대학, AI융합대학 |\n| 5.\xa08.(목) | 서양어대학, 아시아언어문화대학, 사범대학 |\n| 5.\xa09.(금) | 영어대학, 일본학대학, 중국학대학, 국제학부, LD & LT, 대학원, 교직원 |', '## [heading1] ##\n# 2. 유고결석·결시 처리 절차\n\n## [paragraph] ##\n<학칙>\n제35조 (결석) 매학기 수업시간의 4분의 1을 초과하여 결석한 자는 그 과목의 수험\n자격을 상실한다. 다만, 유고결석에 관하여는 총장이 따로 정하는 바에 의하여\n이를 출석으로 인정할 수 있다. (개정 1999.3.12)\n\n## [paragraph] ##\n가. 유고결석 인정 범위 및 성적처리\n\n## [list] ##\n- 1) 인정범위 : 유고결석은 유고결석·결시 규정에 명시된 사유에 대해서 매학기 총 수업시\n- 간의 4분의 1까지 인정할 수 있고 인정된 기간 동안은 출석한 것으로 봄.\n- 다만, 예비군 훈련기간은 예외로 인정하며, 졸업예정자(해당학기 졸업가능\n- 자)로서 조기취업자 및 생리에 따른 사항은 예외로 인정할 수 있음.\n- 2) 성적처리 : 정기시험에 유고결시로 인정된 사유에 대해서는 별도로 시험을 실시하는 것을\n- 원칙으로 하되, 부득이한 경우 담당교수 재량 하에 과제물 또는 기타 객관적인\n- 평가가 가능한 방법으로 대체하여 평가할 수 있음. 단, 1개 학기에 정규시험을\n- 2회 실시하는 수업에서 1회 유고결시로 인정되는 경우 다른 1회에 응시한\n- 정규시험 성적으로 결시시험 성적을 대신할 수 있음.\n- 3) 계절학기는 유고결석ž결시를 적용하지 않는 것을 원칙으로 함. 다만, 예비군 훈련기간은\n- 예외로 인정하며, 졸업예정자(해당학기 졸업가능자)로서 조기취업자에 따른 사항은 예\n- 외로 인정할 수 있음.\n\n## [paragraph] ##\n나. 처리절차\n\n## [paragraph] ##\n1) 유고결석·결시 공통 안내사항\n\n## [paragraph] ##\n* 질병 및 상해의 경우 의원에서 발급받은 서류는 해당되지 않음\n(병원급 의료 기관 확인 : 건강보험심사평가원(https://www.hira.or.kr)', '서울캠퍼스 학생예비군 기본 1차훈련 관련 유고결석 처리 및 학습권 보장 조치 안내\n\n| 「병역법」제74조의3(병력동원 및 훈련 관련 학업 보장)\xa0고등학교 이상의 학교의 장은 다음 각 호에 따른 소집 등에 응하여 의무를 이행하는 학생에 대해서는 그 소집된 기간을 결석으로 처리하거나 그 소집을 이유로 불리하게 처우하지 못한다. \xa01.\xa0제44조부터 제54조까지의 규정에 따른 병력동원소집,\xa0병력동원훈련소집,\xa0전시근로소집 또는 전시근로소집점검 \xa02.\xa0「대체역의 편입 및 복무 등에 관한 법률」\xa0제26조제1항에 따른 예비군대체복무\xa0(이하\xa0""예비군대체복무""라 한다)\xa0소집 「병역법」제93조의2(병력동원 및 훈련 관련 학업 및 직장 보장의 위반)\xa0학교의 장 또는 고용주 등이 정당한 사유 없이 제74조의3\xa0또는 제74조의4를 위반하여 불리한 처우를 한 경우에는\xa02년 이하의 징역 또는\xa02천만원 이하의 벌금에 처한다. 「예비군법」제10조의2(예비군 동원 또는 훈련 관련 학업 보장)\xa0고등학교 이상의 학교의 장은 예비군대원으로 동원되거나 훈련을 받는 학생에 대하여 그 기간을 결석으로 처리하거나 그 동원이나 훈련을 이유로 불리하게 처우하지 못한다. 「예비군법」제15조(벌칙)\xa0⑧\xa0제10조 및 제10조의2를 위반하여 예비군대원으로 동원되거나 훈련을\xa0받는 사람에 대하여 정당한 사유 없이 불리한 처우를 한 사람은\xa02년 이하의 징역 또는\xa02천만원 이하의 벌금에 처한다. 「고등교육법 시행령」제17조의3(예비군 동원 또는 훈련 관련 학업 보장 조치) 학교의 장은\xa0「예비군법」제10조의2에 따라 예비군대원으로 동원되거나 훈련을 받는 학생의 학업이\xa0보장되도록 다음 각 호의 조치를 해야 한다. \xa01.\xa0해당 동원 또는 훈련 기간 동안의 수업에 있어서 결석으로 처리하지 않을 것 \xa02.\xa0해당 동원 또는 훈련 기간 동안의 수업과 관련된 자료 제공 또는 수업 보충을 실시할 것 \xa03.\xa0그 밖에 해당 동원 또는 훈련을 이유로 성적 처리 등 학업에 불리한 처우를 하지 않을 것 |', '서울캠퍼스 학생예비군 동미참(이월) / 기본(이월) 훈련 관련 유고결석 처리 및 학습권 보\n\n| 「병역법」제74조의3(병력동원 및 훈련 관련 학업 보장)\xa0고등학교 이상의 학교의 장은 다음 각 호에 따른 소집 등에 응하여 의무를 이행하는 학생에 대해서는 그 소집된 기간을 결석으로 처리하거나 그 소집을 이유로 불리하게 처우하지 못한다. \xa01.\xa0제44조부터 제54조까지의 규정에 따른 병력동원소집,\xa0병력동원훈련소집,\xa0전시근로소집 또는 전시근로소집점검 \xa02.\xa0「대체역의 편입 및 복무 등에 관한 법률」\xa0제26조제1항에 따른 예비군대체복무\xa0(이하\xa0""예비군대체복무""라 한다)\xa0소집 「병역법」제93조의2(병력동원 및 훈련 관련 학업 및 직장 보장의 위반)\xa0학교의 장 또는 고용주 등이 정당한 사유 없이 제74조의3\xa0또는 제74조의4를 위반하여 불리한 처우를 한 경우에는\xa02년 이하의 징역 또는\xa02천만원 이하의 벌금에 처한다. 「예비군법」제10조의2(예비군 동원 또는 훈련 관련 학업 보장)\xa0고등학교 이상의 학교의 장은 예비군대원으로 동원되거나 훈련을 받는 학생에 대하여 그 기간을 결석으로 처리하거나 그 동원이나 훈련을 이유로 불리하게 처우하지 못한다. 「예비군법」제15조(벌칙)\xa0⑧\xa0제10조 및 제10조의2를 위반하여 예비군대원으로 동원되거나 훈련을\xa0받는 사람에 대하여 정당한 사유 없이 불리한 처우를 한 사람은\xa02년 이하의 징역 또는\xa02천만원 이하의 벌금에 처한다. 「고등교육법 시행령」제17조의3(예비군 동원 또는 훈련 관련 학업 보장 조치) 학교의 장은\xa0「예비군법」제10조의2에 따라 예비군대원으로 동원되거나 훈련을 받는 학생의 학업이\xa0보장되도록 다음 각 호의 조치를 해야 한다. \xa01.\xa0해당 동원 또는 훈련 기간 동안의 수업에 있어서 결석으로 처리하지 않을 것 \xa02.\xa0해당 동원 또는 훈련 기간 동안의 수업과 관련된 자료 제공 또는 수업 보충을 실시할 것 \xa03.\xa0그 밖에 해당 동원 또는 훈련을 이유로 성적 처리 등 학업에 불리한 처우를 하지 않을 것 |', '서울캠퍼스 학생예비군 동미참(이월) / 기본(이월) 훈련 관련 유고결석 처리 및 학습권 보\n\n「 병역법 」 제 93 조의 2 ( 병력동원 및 훈련 관련 학업 및 직장 보장의 위반 ) 학교의 장 또는 고용주 등이 정당한 사유 없이 제 74 조의 3 또는 제 74 조의 4 를 위반하여 불리한 처우를 한 경우에는 2 년 이하의 징역 또는 2 천만원 이하의 벌금에 처한다 .\n\n「 예비군법 」 제 10 조의 2 ( 예비군 동원 또는 훈련 관련 학업 보장 ) 고등학교 이상의 학교의 장은 예비군대원으로 동원되거나 훈련을 받는 학생에 대하여 그 기간을 결석으로 처리하거나 그 동원이나 훈련을 이유로 불리하게 처우하지 못한다 .\n\n「 예비군법 」 제 15 조 ( 벌칙 ) ⑧ 제 10 조 및 제 10 조의 2 를 위반하여 예비군대원으로 동원되거나 훈련을 받는 사람에 대하여 정당한 사유 없이 불리한 처우를 한 사람은 2 년 이하의 징역 또는 2 천만원 이하의 벌금에 처한다 .\n\n「 고등교육법 시행령 」 제 17 조의 3 ( 예비군 동원 또는 훈련 관련 학업 보장 조치 )\n\n학교의 장은 「 예비군법 」 제 10 조의 2 에 따라 예비군대원으로 동원되거나 훈련을 받는 학생의 학업이 보장 되도록 다음 각 호의 조치를 해야 한다 .\n\n1. 해당 동원 또는 훈련 기간 동안의 수업에 있어서 결석으로 처리하지 않을 것\n\n2. 해당 동원 또는 훈련 기간 동안의 수업과 관련된 자료 제공 또는 수업 보충을 실시할 것\n\n3. 그 밖에 해당 동원 또는 훈련을 이유로 성적 처리 등 학업에 불리한 처우를 하지 않을 것\n\n2025.\xa002.\xa017.\n\n서울캠퍼스 교무처장', '## [table] ##\n| 본 대학교 및 소속 단과대학을 대표하는 공무, 행사 또는 운동경기참가 | 단과대학 규모 이상의 행사 및 체육대회임원, 간부 및 선수로서 참가 | 행사시간 | 기간과 참여인이 명시된 대학장의 행사 허가원 또는 협조공문 등 | 소속단과대학에서 유고결석 확인서를 발급받아 담당교수에게 제출 |  |\n| --- | --- | --- | --- | --- | --- |\n| 본 대학교 및 소속 단과대학을 대표하는 공무, 행사 또는 운동경기참가 | 정부 또는 지방자 치단체의 공식적 인 행사에 참가 | 행사기간 | 기간과 참여인이 명시된 부서·기관의 협조공문 등 | 담당교수에게 증빙서류 제출 |  |\n| 본 대학교 및 소속 단과대학을 대표하는 공무, 행사 또는 운동경기참가 | 총학생회의 회의 (대의원회의, 상 임위원회 및 운 영위원회 포함) 졸 업 준 비 위 원 의 업무수행 | 해당기간 매학기 7일 이내 | 기간과 참여인이 명시된 부서·기관의 협조공문 등 | 담당교수에게 증빙서류 제출 |  |\n| 본 대학교 및 소속 단과대학을 대표하는 공무, 행사 또는 운동경기참가 | 학보, 디 아거스 및 방송국의 기사작성 및 편집 | 편집부 당일 | 기간과 참여인이 명시된 부서·기관의 협조공문 등 | 담당교수에게 증빙서류 제출 |  |\n| 본 대학교 및 소속 단과대학을 대표하는 공무, 행사 또는 운동경기참가 | 학교 주관 행사 및 업무 지원 | 해당기간 | 담당부서에서 발급한 확인서 | 담당교수에게 증빙서류 제출 |  |\n| 질병 및 상해 로 인한 입원 또는 감염병 으로 인한 격 리(치료) | 질병 및 상해 | 입원기간 | 해당 증빙서류 (*병원급 이상의 의료기관) | 담당교수에게 증빙서류 제출 |  |\n| 질병 및 상해 로 인한 입원 또는 감염병 으로 인한 격 리(치료) | 법정감염병 (**질병관리청의 법정감염병에 한함) | 격리(치료) 기간 또는 감염우려 기간 | 해당 증빙서류 | 담당교수에게 증빙서류 제출 |  |', '서울캠퍼스 학생예비군 기본 1차훈련 관련 유고결석 처리 및 학습권 보장 조치 안내\n\n1. 제 44 조부터 제 54 조까지의 규정에 따른 병력동원소집 , 병력동원훈련소집 , 전시근로소집 또는 전시근로소집점검\n\n2. 「 대체역의 편입 및 복무 등에 관한 법률 」 제 26 조제 1 항에 따른 예비군대체복무 ( 이하 "" 예비군대체복무 "" 라 한다 ) 소집\n\n「 병역법 」 제 93 조의 2 ( 병력동원 및 훈련 관련 학업 및 직장 보장의 위반 ) 학교의 장 또는 고용주 등이 정당한 사유 없이 제 74 조의 3 또는 제 74 조의 4 를 위반하여 불리한 처우를 한 경우에는 2 년 이하의 징역 또는 2 천만원 이하의 벌금에 처한다 .\n\n「 예비군법 」 제 10 조의 2 ( 예비군 동원 또는 훈련 관련 학업 보장 ) 고등학교 이상의 학교의 장은 예비군대원으로 동원되거나 훈련을 받는 학생에 대하여 그 기간을 결석으로 처리하거나 그 동원이나 훈련을 이유로 불리하게 처우하지 못한다 .\n\n「 예비군법 」 제 15 조 ( 벌칙 ) ⑧ 제 10 조 및 제 10 조의 2 를 위반하여 예비군대원으로 동원되거나 훈련을 받는 사람에 대하여 정당한 사유 없이 불리한 처우를 한 사람은 2 년 이하의 징역 또는 2 천만원 이하의 벌금에 처한다 .\n\n「 고등교육법 시행령 」 제 17 조의 3 ( 예비군 동원 또는 훈련 관련 학업 보장 조치 )\n\n학교의 장은 「 예비군법 」 제 10 조의 2 에 따라 예비군대원으로 동원되거나 훈련을 받는 학생의 학업이 보장 되도록 다음 각 호의 조치를 해야 한다 .\n\n1. 해당 동원 또는 훈련 기간 동안의 수업에 있어서 결석으로 처리하지 않을 것\n\n2. 해당 동원 또는 훈련 기간 동안의 수업과 관련된 자료 제공 또는 수업 보충을 실시할 것\n\n3. 그 밖에 해당 동원 또는 훈련을 이유로 성적 처리 등 학업에 불리한 처우를 하지 않을 것\n\n2025.\xa04. 21.', '| 통계학과 | 통계적기계학습및실습 | 소프트웨어 및 데이터 분석 : 기계학습군(택1) |\n| 컴퓨터.전자시스템공학전공/컴퓨터공학전공 | 데이터베이스 | 소프트웨어 및 데이터 분석 |\n| 컴퓨터.전자시스템공학전공/컴퓨터공학전공 | 운영체제 | 소프트웨어 및 데이터 분석 |\n| 컴퓨터공학전공 | 자연어처리 | 소프트웨어 및 데이터 분석 |\n| 컴퓨터공학전공 | 컴퓨터비전 | 소프트웨어 및 데이터 분석 |\n| 컴퓨터공학전공 | 소셜네트워크분석 | 소프트웨어 및 데이터 분석 |\n| 컴퓨터공학전공 | 딥러닝 | 소프트웨어 및 데이터 분석 |\n| 컴퓨터공학전공 | 컴퓨터보안 | 소프트웨어 및 데이터 분석 |', '## [footer] ##\n- 53 -']","감기로 병원에 다녀오신 경우, 일반 의원에서 발급한 진료확인서는 유고결석으로 인정되지 않을 수 있습니다. 유고결석을 인정받기 위해서는 병원급 이상의 의료기관에서 발급한 진료확인서가 필요합니다. 

따라서, 감기로 병원에 다녀오신 경우, 병원급 이상의 의료기관에서 받은 진료확인서를 제출하셔야 유고결석 처리가 가능할 수 있습니다. 정확한 기준은 과목 담당 교수님께 확인해 주세요. 혹시 더 도와드릴까요?","감기로 병원에 다녀오신 경우, 진료확인서로 유고결석을 인정받기 위해서는 몇 가지 조건이 있습니다.일반적으로 의원에서 발급받은 서류는 유고결석 인정에 해당되지 않으며, 병원급 이상의 의료기관에서 발급된 증빙서류가 필요합니다.따라서, 감기로 병원급 의료기관에서 진료를 받으셨다면 해당 증빙서류를 제출하시면 유고결석이 가능할 수 있습니다.
정확한 사항은 담당 교수님께 문의하시고, 필요한 서류를 제출하시는 것이 좋습니다. 추가적인 질문이 있으시면 언제든지 말씀해 주시기 바랍니다.",0.6782842605383351,0.8,0.8,0.0
나 정보통신공학과인데 혹시 졸업시험 대신 졸업논문을 선택해도 될까? 논문을 쓰게 되면 머신러닝 관련해서 작성하고 싶은데 이와 관련해서 상담할 수 있는 교수님이 계시면 이메일 좀 알려줘.,"['김명진 명예교수님 교수님은 정보통신공학과 학과 소속입니다. 이메일은 mjkim@hufs.ac.kr입니다.', '정일영 명예교수님 교수님은 정보통신공학과 학과 소속입니다. 이메일은 iychong@hufs.ac.kr입니다.', '한희일 교수님 교수님은 정보통신공학과 학과 소속입니다. 이메일은 hihahn@hufs.ac.kr입니다. 연구실은 백년관 721호입니다.', '손경락 교수님 교수님은 정보통신공학과 학과 소속입니다. 이메일은 krson@hufs.ac.kr입니다. 연구실은 공학관 414호입니다.', '선지웅 교수 교수님은 Software-AI전공 전공 소속입니다. 공학박사(KAIST) 학위를 가지고 있습니다. 연구분야는 SCM, 메타휴리스틱 응용, 정보시스템 응용입니다.', '교내해커톤 등 다양한 공모전에 팀을 이루어서 프로젝트를 수행하고 \n발표하는 경험을 쌓는 것도 좋습니다. 전공심화 학생은 정보통신종합\n설계및실습 과목을 통해 프로젝트를 수행하고 졸업논문을 작성하고 \n발표하는 경험을 쌓는 것이 필요하며, 이를 통해 다양한 정보통신 분\n야로의 사회 진출을 준비할 수 있습니다.\n졸업 후 진로 \n-  정부 및 공공기관: 기술직 공무원 / 정보통신 표준화 관련 기관 등\n-  연구소: 국책연구소 / 통신 사업자 연구소 / 정보통신 산업체 연구소\n-  기업체: 삼성전자, LG전자 등 정보통신기기 제조업체 / KT, SKT, LG \nU+등 주요 통신사업자 / 네이버, 카카오 등 정보통신 서비스 업체 / 삼\n성 SDS, LG CNS 등 SI 사업체 / 부가통신서비스 사업자 / 은행, 증권\n회사 등 금융기관 / 게임회사 / 정보보안 회사 등\n-  기타: 국내/해외 대학 석·박사 진학\nQ&A \nQ1.  인공지능 전문가가 되고 싶습니다. 정보통신공학과에서 이 목표를 \n달성할 수 있을까요?\nA1.  정보통신공학과는 최신 AI 기술과 실전 경험을 갖춘 혁신적 인공지\n능 전문가를 양성하는 것을 목표로 하고 있습니다. 학과에서 제공하\n는 커리큘럼을 통해 하드웨어와 소프트웨어 기술을 망라하여 정보\n와 통신이 결합된 융복합 인공지능 전문가가 될 수 있습니다.\nQ2.  요즘은 융복합 시대입니다. 정보통신공학과는 다가오는 시대에 적\n합한 분야인가요?\nA2.  정보통신공학과는 정보와 통신이 결합된 융복합을 지향하는 학과\n입니다. 세상에서 만들어지거나 처리해야 하는 다양한 정보를 기계\n와 인간 간 소통을 통하여 더 나은 시대를 여는 것을 연구하는 분\n야입니다.\nQ3.  인문계 학생의 경우 고등학교 때 수학을 많이 배우지 않습니다. 그\n래도 정보통신공학과 커리큘럼을 따라갈 수 있는지요?\nA3.  고등학교 때 기본적으로 배우는 수학으로 준비가 충분합니다. 부족\n한 부분을 학부 1학년과 2학년 때 다양한 기본 및 심화 수학 과목이 \n있으므로 이를 학습하는 것으로 충분합니다. \nQ4.  졸업 후 통신과 관련한 곳으로 진로가 한정되나요?\nA4.  정보통신공학은 정보와 통신의 융합 학문으로서 IT 모든 분야로 진\n출이 가능합니다. 통신 분야뿐만 아니라 전자 기기, 자동차, 조선, 금\n융, 엔터테인먼트, 유통, 교육, 행정과 같이 정보통신 서비스가 결합\n되어 새로운 시너지가 창출되는 산업 전 분야로 진출이 가능합니다.', '교내해커톤 등 다양한 공모전에 팀을 이루어서 프로젝트를 수행하고 \n발표하는 경험을 쌓는 것도 좋습니다. 전공심화 학생은 정보통신종합\n설계및실습 과목을 통해 프로젝트를 수행하고 졸업논문을 작성하고 \n발표하는 경험을 쌓는 것이 필요하며, 이를 통해 다양한 정보통신 분\n야로의 사회 진출을 준비할 수 있습니다.\n졸업 후 진로 \n-  정부 및 공공기관: 기술직 공무원 / 정보통신 표준화 관련 기관 등\n-  연구소: 국책연구소 / 통신 사업자 연구소 / 정보통신 산업체 연구소\n-  기업체: 삼성전자, LG전자 등 정보통신기기 제조업체 / KT, SKT, LG \nU+등 주요 통신사업자 / 네이버, 카카오 등 정보통신 서비스 업체 / 삼\n성 SDS, LG CNS 등 SI 사업체 / 부가통신서비스 사업자 / 은행, 증권\n회사 등 금융기관 / 게임회사 / 정보보안 회사 등\n-  기타: 국내/해외 대학 석·박사 진학\nQ&A \nQ1.  인공지능 전문가가 되고 싶습니다. 정보통신공학과에서 이 목표를', 'U+등 주요 통신사업자 / 네이버, 카카오 등 정보통신 서비스 업체 / 삼\n성 SDS, LG CNS 등 SI 사업체 / 부가통신서비스 사업자 / 은행, 증권\n회사 등 금융기관 / 게임회사 / 정보보안 회사 등\n-  기타: 국내/해외 대학 석·박사 진학\nQ&A \nQ1.  인공지능 전문가가 되고 싶습니다. 정보통신공학과에서 이 목표를 \n달성할 수 있을까요?\nA1.  정보통신공학과는 최신 AI 기술과 실전 경험을 갖춘 혁신적 인공지\n능 전문가를 양성하는 것을 목표로 하고 있습니다. 학과에서 제공하\n는 커리큘럼을 통해 하드웨어와 소프트웨어 기술을 망라하여 정보\n와 통신이 결합된 융복합 인공지능 전문가가 될 수 있습니다.\nQ2.  요즘은 융복합 시대입니다. 정보통신공학과는 다가오는 시대에 적\n합한 분야인가요?', 'Q&A \nQ1.  인공지능 전문가가 되고 싶습니다. 정보통신공학과에서 이 목표를 \n달성할 수 있을까요?\nA1.  정보통신공학과는 최신 AI 기술과 실전 경험을 갖춘 혁신적 인공지\n능 전문가를 양성하는 것을 목표로 하고 있습니다. 학과에서 제공하\n는 커리큘럼을 통해 하드웨어와 소프트웨어 기술을 망라하여 정보\n와 통신이 결합된 융복합 인공지능 전문가가 될 수 있습니다.\nQ2.  요즘은 융복합 시대입니다. 정보통신공학과는 다가오는 시대에 적\n합한 분야인가요?\nA2.  정보통신공학과는 정보와 통신이 결합된 융복합을 지향하는 학과\n입니다. 세상에서 만들어지거나 처리해야 하는 다양한 정보를 기계\n와 인간 간 소통을 통하여 더 나은 시대를 여는 것을 연구하는 분\n야입니다.\nQ3.  인문계 학생의 경우 고등학교 때 수학을 많이 배우지 않습니다. 그\n래도 정보통신공학과 커리큘럼을 따라갈 수 있는지요?\nA3.  고등학교 때 기본적으로 배우는 수학으로 준비가 충분합니다. 부족', '교내해커톤 등 다양한 공모전에 팀을 이루어서 프로젝트를 수행하고 \n발표하는 경험을 쌓는 것도 좋습니다. 전공심화 학생은 정보통신종합\n설계및실습 과목을 통해 프로젝트를 수행하고 졸업논문을 작성하고 \n발표하는 경험을 쌓는 것이 필요하며, 이를 통해 다양한 정보통신 분\n야로의 사회 진출을 준비할 수 있습니다.\n졸업 후 진로 \n-  정부 및 공공기관: 기술직 공무원 / 정보통신 표준화 관련 기관 등\n-  연구소: 국책연구소 / 통신 사업자 연구소 / 정보통신 산업체 연구소\n-  기업체: 삼성전자, LG전자 등 정보통신기기 제조업체 / KT, SKT, LG \nU+등 주요 통신사업자 / 네이버, 카카오 등 정보통신 서비스 업체 / 삼\n성 SDS, LG CNS 등 SI 사업체 / 부가통신서비스 사업자 / 은행, 증권', '[글로벌] 2025학년도 1학기 졸업논문 제출 및 졸업시험 일정 공고\n\n양식 2\n\n7. 다 .\n\nFLEX 대체 ( 교내 )\n\n2025. 4. 25.( 금 )\n\n졸업시험\n\n졸업시험 시간표 발표\n\n5. 마 . ※\n\n2025. 5. 12.( 월 ) ∼ 5. 13.( 화 )\n\n졸업시험\n\n1 전공 졸업시험\n\n5. 나 .\n\n2025. 5. 19.( 월 ) ∼ 5. 20.( 화 )\n\n졸업시험\n\n제 2 전공 , 이중전공 졸업시험\n\n5. 나 .\n\n2025. 5. 24.( 토 ) 오전 10:00\n\n졸업시험 ( 대체 )\n\nFLEX 대체 ( 교내 )\n\n7. 나 .\n\n서울캠퍼스 시행예정\n\n4. 졸업논문\n\n가 . 졸업논문 작성계획서 제출 마감일 : 2025. 4. 23.( 수 )\n\n※ 졸업논문 제출 마감일은 학과에 문의\n\n나 . 제 1 전공 , 제 2 전공 , 이중전공 : 해당학과에서 배정한 졸업논문 지도교수로부터 졸업논문 작성에 관한 지도를 받아 기일 내에 소속 학과장실에 제출함\n\n다 . 졸업논문의 분량은 200 자 원고지 100 매 이상 분량을 원칙으로 함\n\n라 . 졸업논문을 기한 내에 제출하지 않는 학생은 졸업사정 대상에서 제외됨\n\n※ 졸업논문을 제출하고자 하는 학생은 3 학년 2 학기 초 또는 졸업학기의 직전 학기 초에 졸업논문 작성계획서를 작성하여 소속 학과장실에 제출하여야함\n\n※ 세부일정은 해당학과에 따라 다를 수 있으니 반드시 해당학과에 문의 후 작성 제출\n\n5. 졸업시험\n\n가 . 졸업시험 기간\n\n1) 1 전공 : 2025. 5. 12.( 월 ) ∼ 5. 13.( 화 )\n\n2) 제 2 전공 , 이중전공 : 2025. 5. 19.( 월 ) ∼ 5. 20.( 화 )\n\n나 . 졸업시험 과목 : 자세한 사항은 첨부파일 참조 , 학과 사정에 따라 변경될 수 있음 ( 자세한 사항은 학과에 문의 )\n\n다 . 졸업시험 응시원서 접수 마감일 : 2025. 4. 23.( 수 )\n\n라 . 졸업시험 응시원서 교부 및 제출처 : 해당 학과 학과장실\n\n마 . 졸업시험 시간표 발표 : 2025. 4. 25.( 금 ) 소속학과 게시판 참조 ( 학과 자체 발표 )', '4학년  전공심화과목을 수강하고, 본인 진로와 관련된 강좌를 집중적으로 \n이수합니다. 학과 전임교수의 지도하에 졸업논문을 작성합니다. \n졸업 후 진로 \n-  정부 및 공공기관: 국공립 박물관의 학예직공무원, 국가기록원 및 지\n자체·대학역사관의 기록연구사, 공무원 등\n-  교육 및 연구: 대학교수, 역사교사, 역사문화 관련 연구소 및 박물관\n의 큐레이터 등\n-  기업체: 일반기업체 및 벤처기업 회사원\n-  기타: 문화예술종사자, 프로그래머 등\nQ&A \nQ1.  역사학을 공부하려면 암기력이 중요한가요?\nA1.  꼭 그렇지만은 않습니다. 역사학은 사료를 검증, 분석하고, 추론하\n면서 역사의 지속과 변화를 탐구하는 학문입니다. 우리 사학과에서 \n공부하면서 이러한 학술적 능력과 함께 창의력을 체계적으로 함양\n할 수 있습니다.\nQ2.  사학을 공부하고 졸업하면 순수한 학술연구 외에 전공 관련해서 \n어떤 일을 할 수 있나요?\nA2.  적지 않은 졸업생들이 기록연구사, 역사교사, 학예연구원 등으로 \n활발하게 활동하고 있습니다. 최근에는 역사콘텐츠의 중요성이 제\n고되면서, 문화예술, 게임분야에서 활약하는 졸업생들도 늘어나\n고 있습니다. \n학과(부) 행사 및 동아리 활동 \n-  동사무소(동양철학): 공자, 맹자 등 특정 철학자의 사상에만 국한되지 \n않고, 전반적인 동양 철학사의 흐름과 이에 따른 사상적 차이들을 학\n습하며 이에 대한 의견을 학회원들끼리 토의합니다.\n-  엑스페르고(서양철학): 혼자 읽고 이해하기엔 버거운 여러 철학 고전 \n서적들을 함께 읽어나가며 자유롭게 토론합니다. 이를 통해 철학자들\n의 사유를 이해하고 비판적 시각을 통해 스스로의 철학적 사유를 기르\n는 훈련을 할 수 있습니다.\n-  앤솔로지(예술철학): 아름다움과 예술 이전의 논의들을 학습한 후 현\n대 문화를 파악하는 여러 방법들을 공부합니다.\n-  LOPES(서양철학사&데이터분석): 영어 원문 번역방식의 서양철학사 \n스터디와 데이터 분석을 통해 통계분석용 프로그램 및 다양한 데이터 \n분석기법과 머신러닝 같은 기술 등을 학습합니다.\n-  철학인의 밤: 학생들의 학술 세미나 및 친목 활동 \n-  철학과 한마당 행사: 연말 중 시행되는 철학과 선배, 교수님들이 함\n께하는 행사로 다양한 이벤트 등과 함께 선배, 교수님과 담소를 나누\n는 친목 활동 \n-  한국외대 총장배 토론대회: 2008년도부터 시작된 토론대회로 인문', '[글로벌] 2025학년도 1학기 졸업논문 제출 및 졸업시험 일정 공고\n\n○\n\n031)330-4268\n\n컴퓨터공학과\n\n○\n\n031)330-4268\n\n디지털정보공학과\n\n○\n\n031)330-4268\n\n정보통신공학과\n\n○\n\n○\n\n031)330-4255\n\n전자공학과\n\n○\n\n○\n\n031)330-4094\n\n산업경영공학과\n\n○\n\n○\n\n031)330-4093\n\n바이오메디컬공학부\n\n바이오메디컬공학전공\n\n○\n\n031)330-4723\n\n융합전공\n\n정보 · 기록학전공\n\n○\n\n문화콘텐츠학전공\n\n○\n\n02)2173-2936\n\nAI 융합전공 (Software&AI)\n\n○\n\n031-330-4509\n\nAI 융합전공 (Business & AI 트랙 )\n\n○\n\n02)2173-2643\n\nEU 전공\n\n○\n\n○\n\n02)2173-3284\n\n광역특화전공\n\n○\n\n세계문화예술경영전공\n\n○\n\n○\n\n02)2173-2286\n\n국가리더전공 ( 글로벌 )\n\n○\n\n○\n\n02)2173-2321\n\n데이터사이언스전공\n\n○\n\n031)330-4680\n\n바이오데이터사이언스전공\n\n○\n\n031)330-4723\n\n※ 학과사정에 따라 변경될 수 있음 ( 자세한 사항은 학과에 문의 )\n\n3. 일정별 계획\n\n마감일 / 일정\n\n구분\n\n제출서류\n\n서식 / 양식\n\n제출처\n\n유의사항\n\n( 아래 공지번호 )\n\n비고\n\n2025. 4. 23.( 수 )\n\n졸업논문\n\n졸업논문\n\n서식 1, 양식 4, 양식 5\n\n해당학과\n\n4. 나 ., 다 ., 라 .\n\n마감일정 학과 문의\n\n졸업논문\n\n졸업논문 작성계획서\n\n양식 1\n\n4. 라 . ※\n\n졸업시험\n\n졸업시험 응시원서\n\n양식 2\n\n5. 가 ., 마 .\n\n2025. 4. 23.( 수 )\n\n졸업시험 ( 대체 )\n\n졸업시험 응시원서\n\n양식 2\n\n7. 다 .\n\nFLEX 대체 ( 교내 )\n\n2025. 4. 25.( 금 )\n\n졸업시험\n\n졸업시험 시간표 발표\n\n5. 마 . ※\n\n2025. 5. 12.( 월 ) ∼ 5. 13.( 화 )\n\n졸업시험\n\n1 전공 졸업시험\n\n5. 나 .\n\n2025. 5. 19.( 월 ) ∼ 5. 20.( 화 )\n\n졸업시험\n\n제 2 전공 , 이중전공 졸업시험', '## [heading1] ##\n# 2. 졸업시험 / 논문\n\n## [list] ##\n- 가. 1전공, 이중전공, 제2전공(2006학번 이전)은 반드시 졸업시험이나 논문을 통과하여야\n- 졸업이 가능함\n- 나. 매 학기 중반(4~5월, 10~11월)에 졸업시험 및 논문작성/심사 등을 진행하며, 학과별,\n- 전공별 조건 및 일정은 각 학과사무실에 확인하여 기간 내 조치토록 함\n- 다. 졸업시험/논문에 합격 후 졸업 시까지 그 자격이 유효하나, 합격 후 제적처리가 되는\n- 경우에는 합격이 취소됨\n- 라. 졸업시험FLEX와 외국어인증은 별도이므로 각각 요건을 확인하고 응시 / 처리하여야 함\n\n## [paragraph] ##\n3. 외국어인증(졸업인증) : 입학과 동시에 제출 가능\n\n## [paragraph] ##\n가. 외국어인증 : 2007학번 이후 모든 학생은 졸업 필수요건으로 외국어인증을 완료해야 함\n(편입생, 군위탁생, 새터민은 인증 면제 / 2004~2006학번은 아래 졸업인증 기준을 따름.\n단, 편입생 및 군위탁생으로 면제대상이거나 2006학번 이전 학생이더라도 이중전공이\n나 전공심화+부전공을 이수한 경우 외국어인증을 완료해야 함)\n※ 외국어인증은 입학과 동시에 가능하며 졸업 전 미리 인증하는 것을 권고함\n(단 제출시점 당시 증명서의 유효기간(기준 2년 이내 취득)이 남아 있어야 함)\n\n## [paragraph] ##\n※ 외국어인증 기준', '[공통] 2025-1학기(상반기) 교내 FLEX 졸업시험 시행 안내\n\n가 . FLEX 듣기 · 읽기 A 형 ( 듣기 50 문항 , 읽기 90 문항 / 총 120 분 )\n\n나 . FLEX 듣기 · 읽기 B 형 ( 듣기 55 문항 , 읽기 95 문항 / 총 120 분 )\n\n다 . 언어별로 각각 개발되어 있는 유형에 따라 시행\n\n10. 기타사항\n\n가 . 별도 성적인증서 또는 성적표는 발급되지 않음 .\n\n나 . 성적 확인은 해당 학과 사무실에서 확인 ( 시험일로부터 약 15~20 일 후 확인 가능 )\n\n붙임 : FLEX_2025 년 상반기 졸업시험 시행 계획\n\n2025. 5. 19.\n\n학사종합지원센터 ( 서울 / 글로벌 )', '[글로벌] 2025학년도 1학기 졸업논문 제출 및 졸업시험 일정 공고\n\n다 . 졸업시험 응시원서 접수 마감일 : 2025. 4. 23.( 수 )\n\n라 . 졸업시험 응시원서 교부 및 제출처 : 해당 학과 학과장실\n\n마 . 졸업시험 시간표 발표 : 2025. 4. 25.( 금 ) 소속학과 게시판 참조 ( 학과 자체 발표 )\n\n※ 해당학과 ( 부 ) 에 따라 시험일정이 다를 수 있으니 반드시 해당학과에 문의 후 응시\n\n6. FLEX 대체 ( 정기시험 : 영어 , 중국어 , 일본어 , 프랑스어 , 독일어 , 러시아어 , 스페인어 )\n\n가 . 해당학과 : 자세한 사항은 첨부파일 참조\n\n나 . 일정 : 시험 일정 ( 클릭 ) 에 따라 학생 개별 응시하고 성적표 학과 제출\n\n다 . 제출기간 : 해당학과 사무실 문의\n\n7. FLEX 대체 ( 이탈리아어 , 태국어 , 폴란드어 , 루마니아어 , 체코어 , 헝가리어 , 세르비아어 , 그리스어 , 불가리아어 , 힌디어 )\n\n가 . 해당학과 : 자세한 사항은 첨부파일 참조\n\n나 . 시험일자 : 2025. 5. 24( 토 ) 오전 10:00 서울캠퍼스 시행예정\n\n※ 정확한 시간 / 장소는 추후 통지\n\n다 . 접수기간 : 2025. 4. 16.( 수 ) ~ 4. 23.( 수 ) 해당학과 사무실에 신청 ( 기한 이후 추가 신청 불가 )\n\n* 7 학기 이상 재적생만 신청가능\n\n8. 유의 사항\n\n가 . 졸업시험 및 졸업논문 심사에 통과한 자는 졸업 시까지 그 자격이 유효함 ( 단 , 학적을 상실한 때에는 그 자격을 인정하지 아니함 )\n\n나 . 제 2 전공 , 이중전공자도 해당학과 문의 / 학과에 따른 졸업시험 응시 , 논문 제출 등 pass 하기 바람\n\n다 . 졸업시험 응시원서 제출 시 학생 본인의 연락처를 정확히 기재할 것\n\n라 . 졸업시험은 과목별 40 점이상 , 전과목 평균 60 점 이상 취득하여야 합격임\n\n마 . 졸업논문은 D° 이상 판정 받아야 합격임\n\n※ 졸업시험 및 졸업논문 관련서식은 첨부파일 참조\n\n2025. 4.\n\n글로벌캠퍼스 교무처장', '기후변화융합학부\n\n기후변화융합학부는 기후변화 대응 패러다임 변화에 대응할 수 있는 교육과정을 마련하고 국내외 유관기관과의 협력강화를 통해 기후변화 관련 전문지식을 갖춘 인재양성을 도모하고자 신설되었습니다. 이를 위해 에너지와 기후변화 정책 및 관련 국제협력 분야에서 기후변화 대응산업과 연구를 선도할 융합인력 양성이 목표이며 기후감시 및 예측, 기후변화 정책, 온실가스 및 에너지 관리 3개 트랙으로 교육과정을 운영할 예정입니다. 이와 같은 교육과정에 따라 사회과학적 소양과 자연과학/공학과의 융복합적인 교육을 통해 과학 및 정책을 포함한 미래의 기후변화 관련 업무를 국제사회에서 선도할 수 있는 거시적 안목을 갖춘 글로벌 융합인재를 배출하고자 합니다.\n\n031-330-4114', '1312\n전공소개 \n2007년 유럽연합 회원국이 된 루마니아(인구: 8위, 국토면적: 9위)는 ‘\n유럽의 보석’이라 불릴 정도로 아름다운 자연환경과 풍부한 천연자원으\n로 동유럽 국가 중에서 경제적 성장잠재력이 가장 높은 나라로 주목받\n고 있습니다. 1987년 설립된 루마니아학과는 루마니아(Romania)와 몰\n도바(Moldova)공화국의 어문학 및 지역학을 공부할 수 있는 국내 유일\n의 고등교육기관입니다. 라틴어에 뿌리를 둔 루마니아어의 실질적인 구\n사력 및 문헌 이해 능력의 배양과 더불어 루마니아 지역학 관련 지식의 \n습득으로 현지에 특화된 전문가를 양성하고 있습니다. 우리나라의 공기\n업을 비롯한 대기업과 중소기업들이 판매 및 제조법인 등 다양한 형태로 \n루마니아에 투자하거나 사업진출을 도모하고 있습니다.\n필요역량 및 소양 \n교과의 측면에서는 발칸반도, 나아가 동부 유럽에 대한 역사와 문화에 \n대해 관심을 갖고 특히 루마니아의 역사와 사회문화에 대해 흥미를 가\n지고 있으면 좋습니다. 또한 전공과 관련해서 문학, 지역학 등 다양한 분\n야의 서적을 읽는 것도 도움이 됩니다. 이는 단순히 언어만 배우는 게 아\n닌 루마니아의 문화, 정치, 역사 등 다양한 분야에 대해 입학 후 배우기 \n때문입니다. 아울러, 언어적인 측면에서는 루마니아어를 모르더라도 새\n로운 언어를 배우는 데에 두려움을 갖지 말고 호기심을 가지고 적극적\n인 자세를 함양하는 게 도움이 되리라 생각합니다.\n우리 학과(부)·전공 매력 \n-  루마니아어는 동유럽 유일의 라틴 로망스어로 이태리어, 프랑스어, \n스페인어와 유사\n-  루마니아를 포함한 중부유럽 전체를 조망하며 국내외 연구기관과 유\n기적 연계\n-  루마니아 진출 및 유관 한국기업과의 협업\n-  취득 가능한 자격증: 유럽 언어 공통 기준(Common European \nFramework of Reference for Languages, CEFR by CE) 평가등급, \nFLEX 루마니아어 졸업인증\n주요 전공과목 \n1학년  루마니아학입문, 기초루마니아어문법작문, 초급루마니아어번역\n연습, 초급루마니아어회화, 초급시청각루마니아어, 초급루마니\n아어문법작문\n2학년  루마니아사정, 중급루마니아어문법작문, 중급루마니아어번역연\n습, 중급루마니아어회화, 루마니아문화, 고급루마니아어문법작문\n3학년  고급루마니아어회화, 루마니아 문학사, 루마니아 현대문학, 루마', '4544\n슬기로운 대학생활 \n학과 커리큘럼(교과과정)을 충실히 따라 기초 교양 과목을 통해 전공에 \n필요한 기초를 다지고, 이를 기반으로 전공 심화 수업을 잘 따라가는 것\n이 중요합니다.\n<1, 2학년 저학년 생활 안내> \n-  코딩 능력 함양: 정보통신공학에서는 기본적으로 프로그래밍 능력이 \n필수적이기 때문에, 1학년 교과목을 통해 C, Python, Java 등 다양한 \n기초 프로그래밍 언어를 습득하고, 이를 기반으로 2학년 교과목을 통\n해 자료구조와 알고리즘 이론을 익혀 코딩에 관한 기본 실력을 갖추는 \n것이 필요합니다. 학과에서는 고학년 학과 재학생이 조교이자 멘토로 \n활동하는 학과 코딩존을 운영하고 있으며, 이를 잘 활용해 본인의 기\n본 코딩 실력을 잘 배양하는 것이 필요합니다.\n-  기초 수학 능력 배양: AI 정보 이론과 신호 및 시스템 등의 과목을 통해 \n정보통신을 위한 기초적인 수학 능력을 배양하여야 합니다. \n-  기초 컴퓨터 시스템 능력 배양: 논리회로, 회로이론, 컴퓨터구조 등의 \n과목을 통해 실제 임베디드 보드를 활용한 시스템 경험을 쌓는 것이 \n필요합니다. 아울러 오픈소스소프트웨어 등의 과목을 통해 최신 소프\n트웨어 개발 동향을 파악하는 습관을 기르고, 컴퓨터 시스템을 활용하\n는 기본 실력을 배양하는 것이 필요합니다. \n<3, 4학년 고학년 생활 안내> \n-  전공 심화 능력 배양: 3, 4학년 과목들은 인공지능, 통신 네트워크, 정\n보 보안, 임베디드 시스템, 클라우드 컴퓨팅, IoT 시스템의 다양한 분\n야로 진출할 수 있는 정보통신 기술을 습득하기 위해 필수적인 과목\n들입니다. 이들 과목을 통해 다양한 하드웨어와 소프트웨어를 활용한 \n실습과 프로젝트를 수행하여 실전적인 경험을 쌓는 것이 중요합니다.\n-  캡스톤 프로젝트 능력 배양: 인턴 프로그램, 정보통신기초종합설계 과\n목 등을 통해 기업체 인턴쉽을 수행할 수 있으며, 이를 통해 다양한 기\n업체 현장 실습 경험을 쌓는 것이 좋습니다. 임베디드SW경진대회나 \n교내해커톤 등 다양한 공모전에 팀을 이루어서 프로젝트를 수행하고 \n발표하는 경험을 쌓는 것도 좋습니다. 전공심화 학생은 정보통신종합\n설계및실습 과목을 통해 프로젝트를 수행하고 졸업논문을 작성하고 \n발표하는 경험을 쌓는 것이 필요하며, 이를 통해 다양한 정보통신 분\n야로의 사회 진출을 준비할 수 있습니다.\n졸업 후 진로', '-  아프리카학부 동문회 장학금\n-  학부 장학금\n-  아프리카 관련 학회 활동\n-  케냐 현지 스와힐리어 연수\n-  동문 초청 Job담회 개최\n-  ‘아프리카의 날’ 행사 진행\n-  한-아프리카재단, 아프리카 인사이트 등 정부 출연기관과 시민단체 \n인턴 기회 제공\n학과(부) 행사 및 동아리 활동 \n-  트윔보: 아프리카 춤패로 각종 행사와 축제에 참여\n-  Asaz: 아프리카 시사 관련 공부 모임\n-  잠보리카: 아프리카 관련 카드 뉴스제작 홍보\n-  아사필(24년 학회 등록 예정): 아프리카 인식 제고를 위한 각종 프로\n그램과 행사 기획, 운영\n-  아봉: 아프리카 봉사 학회로 국내 아프리카 이주민을 대상으로 한 행사 진행\n슬기로운 대학생활 \n1학년  전공기초과목으로 5개의 ‘아프리카 00개론’ 과목을 수강합니다. \n이를 바탕으로 2학기에 적성에 따라 전공계열(동부, 서부, 남부)\n을 선택하게 됩니다.\n2학년  본격적으로 언어와 지역학에 대한 수업을 듣게 됩니다. \n3학년  아프리카에 대한 전공심화와 함께 향후 진로에 도움이 되는 아프\n리카 연관 이중전공을 심화학습 합니다.(예, 글로벌비즈니스, 정\n치외교, 생명공학 등 이공계)\n4학년  졸업논문을 작성하고 졸업시험을 치르며 향후 진로에 대한 탐구\n를 합니다. \n졸업 후 진로 \n-  정부 및 공공기관 : 외교부, 한-아프리카재단, KOTRA, KOICA, KIEP 등\n-  연구소 및 연구 : 국내외 정부출연 연구소 / 해외 아프리카 관련 연구소\n-  기업체 : 아프리카에 진출해 있거나 진출을 노리는 기업 / 아프리카 현지 기업\n-  기타 : 대학교수, 교사(교직이수), 개발협력 NGOs, 시민단체\nQ&A \nQ1. 아프리카라는 지역이 너무 광대한데 무엇을 어떻게 배우나요? \nA1.  아프리카학부는 1학년 1학기에 기초 공통과목을 듣고 2학기부터 계\n열(동부, 서부, 남부)을 선택해 4학년까지 교육받게 됩니다. 각 계열은 \n언어와 지역학 프로그램으로 구성되어 있습니다. 동부는 스와힐리어\n와 암하라(에티오피아)어, 서부는 하우사어를 중심으로 수업이 진행되\n며, 남부는 국제정치, 경제와 사회문화를 중심으로 수업이 진행됩니다. \nQ2.  아프리카를 전공하면 어떤 일을 할 수 있나요? \nA2.  아프리카를 전공한 뒤 할 수 있는 일은 학생의 의지와 관심에 달려 \n있습니다. 아프리카학부 졸업생들은 일반기업뿐 아니라 자신의 꿈', '2928\nDivision of Global Business & Technology\nGlobal Business & \nTechnology학부\n전화번호 031-330-4509\n홈페이지 gbt.hufs.ac.kr\n전공소개 \nGBT학부에서는 “정보기술을 잘 활용할 수 있는 경영인”을 양성합니다. \n미래에는 인공지능과 빅데이터 등 첨단 정보기술이 모든 비즈니스에 활\n용될 것이므로 이러한 정보기술에 대한 이해와 활용 능력이 점점 더 중\n요해질 것입니다. GBT학부는 이러한 시대적 요구에 부응하여 소셜 미\n디어, 빅데이터, 인공지능과 같은 신기술들을 비즈니스 모델과 융합하\n여 경제와 산업, 문화에 걸쳐 새로운 상품과 비즈니스를 창출할 수 있는 \n‘융합형 인재’를 육성하고 있습니다. 이를 위해 영어 커뮤니케이션 능력\n과 경영학 지식, IT 역량을 갖출 수 있는 커리큘럼을 구성하였고 각 분야\n의 전문가들이 체계적이고 전문화된 교육을 진행하고 있습니다.\nGBT 학부에서는 산학 협력 프로그램 및 인턴쉽 프로그램을 운영하\n며 실무 중심의 현장 체험형 교육 기회를 제공하고 있습니다. 또한 \nResidential College, 세계 유명 대학과의 협력을 통한 복수학위제, 학\n과 전용 교환학생 제도 등을 운영하여 국제적 감각을 지닌 리더로 성장\n할 기회를 제공하고 있습니다. GBT학부는 구글, 아마존 같은 글로벌 빅\n테크 기업에서 주도적으로 일할 수 있는 인재를 양성하는 것을 목표로 \n하고 있으며 이미 성공적인 사례가 나오고 있습니다.\n필요역량 및 소양 \n-  GBT학부는 경영학과 IT기술의 융합학부이므로 인공지능, 컴퓨터프로\n그래밍 언어 등 새로운 기술에 대한 호기심과 관심이 있으면 좋고, 이\n러한 IT기술을 활용한 비즈니스에 대한 관심이 필요합니다.\n-  한국어, 영어를 사용한 커뮤니케이션 역량, 데이터 수집 및 분석 역량, \n팀을 이끌 수 있는 리더십 역량, 서로 다른 문화를 이해하고 차이를 수\n용할 수 있는 역량 등이 핵심역량이라고 할 수 있습니다. \n-  GBT학부의 수업에서도 이러한 역량을 집중적으로 가르치고 있으며 \n스스로 상당한 역량을 갖춘 학생들은 수업에 더욱 흥미를 느낄 수 있\n으며 더욱 크게 성장할 것입니다. \n우리 학과(부)·전공 매력 \n-  모든 교수님이 참여하여 전공을 소개하는 GBT Special Lecture 과\n목 운영\n-  학생들이 중심이 되는 마케팅학회, 데이터분석학회 등 전공 관련 학\n회 운영', '## [heading1] ##\n# 다. 교직과목 : 수강편람 교직과정 항목 참조\n\n## [paragraph] ##\n라. 논술교육자격인증제(2007학년도 제1학기부터 시행)\n\n## [list] ##\n- 1) 철학과 전공 및 철학 부전공 과정에서 실시하며, 논술교육자격 인증과목을 수강하여\n- 총 24학점 이상을 이수하고, 과목별 성적이 ‘B0 이상’이어야 하며, 졸업논문 심사를\n- 통과하여야 함\n- 2) 철학과 학생은 졸업논문으로 대체하고, 철학 부전공 및 타 전공 학생은 철학과 졸업\n- 논문에 준하는 논문을 철학과 사무실에 제출하여 반드시 심사를 받아야 함\n- 3) 논술교육자격인증 과정은 철학 부전공(21학점 이수)과 별개 과정으로, 논술교육자격인증을\n- 위해서는 반드시 해당 인증과목을 추가로 이수하여 총 24학점 이상을 이수하여야 함\n- 4) 인증 교과목은 강의시간표 비고란에 ‘논술교육자격인증 과목’으로 표시됨\n- 5) 소정의 인증학점과 졸업논문을 통과한 학생들에게는 총장 명의 ‘논술교육자격 인증서’\n- (졸업논문 명칭 병기)를 발급함\n- 6) 인증과목은 아래와 같으며, 총 4개 영역에서 빠짐없이 수강하여 총 24학점 이상을\n- 이수하여야 함\n\n## [paragraph] ##\n※ 논술교육자격인증 교과목', '[공통] 2025-1학기(상반기) 교내 FLEX 졸업시험 시행 안내\n\n[공통] 2025-1학기(상반기) 교내 FLEX 졸업시험 시행 안내\n\n[ 공통 ] 2025-1 학기 ( 상반기 ) 교내 FLEX 졸업시험 시행 안내\n\n2025 학년도 1 학기 ( 상반기 ) 교내 FLEX 졸업시험의 세부 시행 계획을 아래와 같이 안내합니다 .\n\n1. 시 험 명 : 2025 학년도 1 학기 (2025 년 상반기 ) 교내 FLEX 졸업시험\n\n2. 시행주관 : FLEX 센터\n\n3. 대상언어 : 총 15 개 언어\n\n※ 포르투갈어 , 네덜란드어 , 스웨덴어 , 마 ・ 인어 , 태국어 , 튀르키예어 ( 터키어 ), 이탈리아어 , 체코어 , 헝가리어 , 세르비아어 , 루마니아어 , 폴란드어 , 그리스어 , 불가리아어 , 힌디어\n\n4. 응시자격 : 교내 각 학과에 사전 신청한 학생만 응시 가능\n\n5. 시험일시 : 2025. 5. 24( 토 ) 10:00~12:00(120 분 )\n\n6. 입실시간 : 09:40 분까지 해당 고사실 내 입실완료 , 마스크 착용 권고\n\n※ 응시자는 정해진 입실시간을 반드시 준수하여야 합니다 .\n\n※ 듣기시험이 시작되면 고사실 내 입실을 할 수 없습니다 .\n\n7. 시험장소 : 본교 서울캠퍼스 교수학습개발원\n\n※ 시험 당일 건물 앞에 설치되는 배치표 , 유도표시 및 붙임의 시행계획 참고\n\n8. 응시자 준비물 ( 반드시 지참 )\n\n※ 신분증 ( 학생증 , 주민등록증 , 운전면허증 , 여권 등 ), 컴퓨터용 수성싸인펜 , 수정테이프\n\n※ OMR 답안 수정은 응시자가 수정테이프로 자유롭게 수정이 가능함 .\n\n9. 시험 및 평가유형 ( 붙임의 시행계획서 참고 )\n\n가 . FLEX 듣기 · 읽기 A 형 ( 듣기 50 문항 , 읽기 90 문항 / 총 120 분 )\n\n나 . FLEX 듣기 · 읽기 B 형 ( 듣기 55 문항 , 읽기 95 문항 / 총 120 분 )\n\n다 . 언어별로 각각 개발되어 있는 유형에 따라 시행\n\n10. 기타사항\n\n가 . 별도 성적인증서 또는 성적표는 발급되지 않음 .', '매년 「In vivo」발간\n-  로테이션: 각 실험실에서 일정 기간 동안 실험에 참여하면서 연구 경\n험을 쌓는 활동\n슬기로운 대학생활 \n1학년  기초교양 위주로 수업을 듣고, 일반 생물학을 수강하게 됩니다. 일\n반 화학, 일반 물리, 대학 수학 등 과학과 수학 전반에 대한 책을 많\n이 읽고 영어 능력을 키우면 전공 공부에 크게 도움이 됩니다. \n2학년  본격적으로 전공 수업을 듣게 됩니다. 이론과 실험 수업을 수강하여 \n실험 데이터를 직접 만들어내고 분석하는 과정도 익히게 됩니다.\n3학년  생명공학에 관련된 다양한 전공심화 과목들을 수강하며 깊이 있\n는 탐구를 수행합니다. 실험실 로테이션을 통해 심도 깊은 연구\n를 수행하기도 합니다. \n4학년  생명공학 실험 및 리뷰 연구를 통해 논문을 작성하고 발표함으로\n써 생명공학 연구를 경험하게 됩니다. \n졸업 후 진로 \n1.취업: 학사급 연구원: 기업 및 국가 기관 연구소\n2.진학/연구\n- 대학원 석, 박사 및 석.박 통합과정 진학 또는 해외 대학원 진학\n-  석사 및 박사 학위 취득 후 각각 석사급, 박사급 연구원: 기업, 학교 및 \n국가 기관 연구소\n3.바이오벤처 창업\nQ&A \nQ1. 생명공학과에 입학하려면 영어를 잘해야 하나요?\nA1.  생명공학과 대부분의 수업은 원서로 진행되며, 관련 전문 용어는 영\n어로 배워야 하므로 수업 내용을 잘 이해하기 위해서는 영어 실력이 \n뒷받침되어야 합니다.\nQ2. 생명공학과 졸업 후 취업은 잘 되나요?\nA2.  최근 코로나19 이후 바이오 연구 인력의 중요성은 점점 증가하고 있\n습니다. 생명공학과 졸업 후 제약, 바이오산업과 관련된 다양한 기\n업들에서 일할 수 있습니다.', '6968\n전공소개 \n기후변화융합학부는 기후변화 대응 패러다임 변화에 대응할 수 있는 교\n육과정을 마련하고 국내외 유관기관과의 협력강화를 통해 기후변화 관\n련 전문지식을 갖춘 인재양성을 도모하고자 신설되었습니다. 이를 위해 \n에너지와 기후변화 정책 및 관련 국제협력 분야에서 기후변화 대응산업\n과 연구를 선도할 융합인력 양성이 목표이며 기후감시 및 예측, 기후변\n화 정책, 온실가스 및 에너지 관리 3개 트랙으로 교육과정을 운영할 예\n정입니다. 이와 같은 교육과정에 따라 사회과학적 소양과 자연과학/공\n학과의 융복합적인 교육을 통해 과학 및 정책을 포함한 미래의 기후변\n화 관련 업무를 국제사회에서 선도할 수 있는 거시적 안목을 갖춘 글로\n벌 융합 인재를 배출하고자 합니다.\n필요역량 및 소양 \n-  과학적 기후변화 및 에너지시스템 관리 분야의 기초 및 심화 교육을 통\n한 자연과학/공학형 인재를 양성합니다.\n-  배출권거래제도, 탄소배출 정책 및 기후변화 대응에 대한 실무 능력을 \n갖춘 사회과학적 인재를 양성합니다.\n-  자연과학/공학형 능력과 사회과학적 능력을 갖춰 기후 변화 문제를 \n적극적으로 해결할 수 있는 창의성과 응용력을 갖춘 융합 인재를 양\n성합니다.\n-  기후변화에 대한 지역학 및 국제 정세에 대한 높은 이해도를 가짐으\n로써 탄소중립 시대를 선도하는 아래와 같은 능력을 가진 융합 인재 \n를 양성합니다.\n-  1) 기후변화 이해 역량\n-  2) 환경정책 기획 역량 \n-  3) 온실가스 및 환경 기기분석 분석 역량 \n-  4) 에너지 시장 분석 역량 \n-  5) 기후경제학 이해 역량 \n-  6) ESG 경영 기획 역량\n우리 학과(부)·전공 매력 \n-  우리학교의 강점인 국제 지역학 및 어학을 특화시킨 전문가를 양성하\n여 국제기구와 같은 글로벌 무대에서 활약할 수 있도록 양성합니다. \n자연과학에 대한 이해도와 기후변화 정책 및 시장 동향에 대한 지식과 \n경험을 갖춘 행정가를 배출하여 국내 정책 및 해외 외교 대응에 중추\n적인 역할을 기대할 수 있습니다.\n-  정확하고 정밀한 온실가스 측정 및 배출량 산정에 대한 능력을 갖춘 과\n학자를 배출함으로써, 국제사회에서 탄소외교의 신뢰성을 확보할 수 \n있을 것으로 기대합니다. \n-  기후변화 관련 국제적 수준의 연구경험을 쌓을 수 있는 기회를 제공\n합니다.\n-  대기환경기사 또는 온실가스 관리기사 자격증을 취득할 수 있는 커리\n큘럼으로 구성되어 있습니다.\n주요 전공과목', '[글로벌]2025-1학기 폐강(2차) 공고(글로벌캠퍼스)\n\n[글로벌]2025-1학기 폐강(2차) 공고(글로벌캠퍼스)\n\n2025-1 학기 폐강 (2 차 ) 공고 ( 글로벌캠퍼스 )\n\n2025-1 학기 글로벌캠퍼스 폐강 (2 차 ) 강좌를 아래와 같이 공고 합니다 .\n\n폐강 강좌를 수강신청한 학생은 아래와 같이 해당 기한 내에 수강신청을 변경 하기 바랍니다 .\n\n- 아 래 -\n\n■ 폐강강좌 수강생 수강신청 변경\n\n1. 변경 기간 : 2025. 3. 14.( 금 ) ~ 3. 18.( 화 ) 오후 4:00 까지 ( 이메일 발송 기한엄수 )\n\n( ※ 3.\xa018.( 화 ) 오후 4 시까지 수신된 이메일에 한하여 접수하오니 기한 내 이메일 발송 )\n\n2. 작성양식 : 이 공지의 첨부 파일 (‘ 폐강과목 대체 수강 신청서 ’) 작성\n\n3. 제 출 처 : 본인 1 전공 소속 단과대학 교학파트 ( 학사종합지원센터 ) 이메일 제출\n\n단과대학 구분\n\n전화번호\n\n(031-330- 내선 )\n\n담당자 이메일\n\n사무실 위치\n\n인문대학, 통번역대학, 융합인재대학\n\n내선 4077\n\nhaksa4077@hufs.ac.kr\n\n학생회관 109 호\n\n국가전략언어대학, 국제지역대학, 자유전공학부\n\n내선 4457\n\nlsh0613@hufs.ac.kr\n\n공과대학, 자연과학대학, 바이오메디컬공학부\n\n내선 4073\n\nyyj1730@hufs.ac.kr\n\n교직, 경상대학, Culture&Technology융합대학, 기후변화융합학부, AI융합대학\n\n내선 4953\n\nminsun@hufs.ac.kr\n\n※ 수강과목 이수구분 ( 전공 , 교양 등 ) 상관 없이 본인 1 전공 소속 단과대학 교학 파트 이메일 제출\n\n4. 유의 사항\n\n가 . 폐강된 과목수와 동일한 과목수 만큼 수강신청 변경 가능 ( 단 , 최대수강신청 학점 초과 불가 )\n\n나 . 수강신청 변경 시점 기준으로 제한인원을 초과하지 않는 과목으로 변경 가능 수강 가능 강좌 확인 ☞ 강의시간표 조회 ( 클릭 )\n\n다 . 폐강 강좌를 수강하지 않은 학생은 이 기간에 수강신청 변경을 할 수 없음', '해결하세요. 처음에는 힘들고 오랜 시간이 걸리겠지만, 이러한 어려\n움 통과해야 성장하고 시대가 요구하는 인재가 되는 것입니다.\n3.  산책 등 스스로 생각하는 습관을 만들고 동시에 글쓰기 실력을 기르\n세요. 한편, ChatGPT에게 다양한 질문과 요구를 연습하는 것도 논리\n적으로 생각을 정리하여 표현하는 능력을 기르는 좋은 방법입니다.\n졸업 후 진로 \n수학과 졸업생의 진로를 아래와 같이 크게 세 분야로 나눌 수 있습니다. \n우리 수학과는 항상 시대의 요구를 살펴 학생들이 사회에서 제 몫을 다 \n할 수 있도록 최선을 다해 노력하고 있습니다.\n-   IT 분야: 프로그램 개발자, data engineer, MLOps, data analysis \n수학과 졸업생들은 논리를 전개할 수 있는 능력과 사고력으로 높은 \n수준의 프로그래밍에 강합니다. 우리 과에는 수치해석을 전공하신 교\n수님뿐만 아니라 컴퓨터공학에 전문성을 가지신 교수님도 계셔서 IT \n분야에 진출을 원하는 학생들에게 수준 높은 교육이 가능합니다.\n-  금융 분야: 은행, 증권사, 보험계리사 \n우리 학과에는 금융 수학을 전공하신 두 분의 교수님이 계십니다. 관\n련 학회의 회장을 하시는 등 학계에서 중추적인 역할을 하실 뿐만 아\n니라 다양한 활동을 활발히 하고 계십니다. 그래서 졸업생들이 은행, \n증권사에서 혹은 보험계리사 등으로 왕성하게 활동 중입니다.\n-  교육과 연구 분야: 중-고등학교 교사, 교수 \n평균으로 볼 때 우리 학과는 최근 10년간 임용시험 합격자를 꾸준하\n게 배출하고 있습니다. 또한 미국 명문대학교에서 교수로 활동하고 \n있는 졸업생도 있는 등 교육 분야에서 졸업생들의 활동이 괄목할 만\n합니다. 수학이라는 전공 특성으로 출판 등 다양한 교육계에서 활동\n하는 졸업생들도 많습니다.\nQ&A \nQ1.  수학과를 졸업하면, 진로 선택이 교육과 연구 분야로 제한되나요?\nA1.   수학과 졸업생의 장점은 엄밀한 논리 전개와 사고의 자유로움입니\n다. 기술의 발달로 다양한 분야의 많은 직무가 자동화되어 수준 높\n은 사고를 할 수 있는 인재가 시대의 요구입니다. 이러한 면에서 수\n학과 졸업생은 IT분야뿐 아니라 금융권 등 다양한 분야에 진출하고 \n있습니다. 또한 우리 학과는 졸업생들이 많이 진출하는 금융과 IT \n분야에 맞춤형 커리쿨럼을 제공하고 있습니다.\nQ2. 수학과의 전공 수학은 고등학교 수학과 다른가요?', '3332\n전공소개 \n문명과 기술이 첨단화되고 고도화되면서 많은 업무가 자동화되는 지\n금은 단순한 지식 습득의 수준을 넘어 깊은 사고력과 추상적인 개념을 \n능숙하게 다룰 수 있는 논리력을 지닌 인재를 요구하고 있습니다. 이제 \n수학은 자연과학 및 기계학습과 같은 공학의 많은 분야에서 필수불가\n결한 역할뿐만 아니라 거의 모든 분야에서 광범위하게 사용되어 역할\n을 다하고 있습니다. 이에 한국외국어대학교 수학과는 수학 이론에 대\n한 깊이 있는 이해와 탁월한 응용 능력과 사고력을 함께 갖춘 인재를 양\n성하여 연구, 교육 및 사회 전반적인 발전에 기여하고자 합니다. 수학과\n는 논리적 사고력과 창의적 응용력을 갖춘 수학인재 양성을 목표로 미\n적분학, 선형대수학, 해석학, 대수학 등의 기본이론부터 금융 및 기계\n학습과 같은 IT관련 응용과목까지 포괄적인 교과과정을 운영하고 있습\n니다. 그 결과 금융 분야와 IT 분야 등의 응용 분야로 진출하는 인재들\n을 꾸준히 배출하고 있습니다. 또한 교직이수 혹은 교육대학원 진학 등\n의 과정을 거쳐서 중, 고교 수학교사가 되거나, 수학 교육 및 출판 업계\n등으로 진출하는 학생들을 포함하여 많은 졸업생들이 수학 교육에 기\n여하고 있습니다.\n필요역량 및 소양 \n수학과에서 지향하는 학생의 모습은 엄밀한 논리 전개를 할 수 있는 능\n력 외에도 자유로운 사고의 능력을 갖추는 것입니다. 이러한 능력을 통\n해 어떤 직무를 하더라도 주어진 문제를 이해하고 합리적으로 해결할 \n수 있습니다. 이것은 많은 직무가 자동화되고 고도화되는 지금의 사회\n에 필요한 새로운 창의적인 인재에게 꼭 필요한 능력이라고 생각합니\n다. 그래서 이러한 사고의 능력을 기르는 데 도움이 되는 두 가지를 제\n안합니다.\n-  어려운 수학 문제를 해답의 도움 없이 긴 시간이라도 스스로 해결해 \n보기를 권장합니다. \n-  남들과 다른 관점에서 문제를 이해해 보고 새로운 해법을 모색하는 \n것입니다.\n우리 학과(부)·전공 매력 \n-  머신러닝 등 IT 분야로서 수학전공자의 장점을 발휘할 수 있도록 심\n도 있는 커리큘럼 제공\n-  금융 수학에 대한 전문성 높은 커리큘럼 제공\n-  꾸준한 임용시험 합격자를 배출\n주요 실적 \n-  한국산업응용수학회와 국가수리과학연구소 공동 주최 2023년 KSIAM \n-NIMS Math Challege에서 한국외대 수학과 학생 3명과 수학이중전\n공 1명으로 구성된 익숙한첫만남팀 우수상 수상', '[공통] 2025-1학기 군 복무 중 원격수업 학점인정 안내문\n\n나 . 수강기간 중에는 반드시 나라사랑포털의 군 e- 러닝 공지사항과 메일 수시 확인\n\n10. 상담 및 문의사항\n\n가 . 나라사랑포털 군 -e 러닝 문의 : www.narasarang.or.kr 군인공제회 C&C 군 e- 러닝 담당\n\n나 . 군 복무 중 학점인정 제도 관련 문의 : 소속캠퍼스 학사종합지원센터 이메일 문의\n\n( 서울 )haksa-seoul@hufs.ac.kr / ( 글로벌 )andy@hufs.ac.kr\n\n붙임 : ( 군인공제회 C&C) 군 복무 중 학점취득 수강신청 안내 (PC, 모바일 ) 각 1 부\n\n2025. 2.\n\n교무처장\n\n| 0 |\n|:-----------------------------------------------|\n| 2025-1학기\xa0⌜군 복무 중 원격수업 학점인정⌟\xa0안내 |', '(공통)2025-1학기 부전공 신청 및 이중/부전공 취소 일정 공고\n\n(공통)2025-1학기 부전공 신청 및 이중/부전공 취소 일정 공고\n\n2025 학년도 제 1 학기 부전공 신청 및 이중 / 부전공 취소 일정을 아래와 같이 공고합니다 .\n\n- 아 래 -\n\n1. 신청 대상 : (2025-1 학기 기준 ) 2 학기 ~ 7 학기 재학생 및 휴학생 중\n\n가 . 부전공 희망자 : 일반 부전공 또는 전공심화 + 부전공 신청\n\n( 전공심화 + 부전공 신청자는 1 전공의 졸업이수학점 늘어남 . 반드시 확인할 것 )\n\n나 . 이중 / 부전공 취소 희망자 ( 단일전공 희망자 ) : 이중 / 부전공을 취소하고 전공심화 이수\n\n※ 단 , 8 학기 이상인 학생 은 이중 ( 부 ) 전공 변경 신청서 ( 첨부파일 ) 를 작성하여\n\n학사종합지원센터 단과대학 교학과 이메일 또는 방문 신청\n\n▶ ( 서울 ) 제출처 안내 바로가기\n\n▶ ( 글로벌 ) hufsdbl@hufs.ac.kr 로 이메일 제출\n\n2. 일 정\n\n가 . 신청 기간 : 2025 년 1 월 22 일 ( 수 ) 10 시 ~ 1 월 23 일 ( 목 ) 14 시\n\n※ 안내된 기간에만 운영하므로 일정 준수할 것 ( 이후 별도 운영 계획 없음 )\n\n나 . 결과 확인 : 2025 년 1 월 24 일 ( 금 ) 14 시 , 종합정보시스템\n\n3. 신청 방법 : 종합정보시스템 → 전공 / 교직관리 ( ※ 가 . / 나 . 중 하나의 방법으로 신청 )\n\n가 . 부전공 신청 : 전공심화 + 부전공 또는 부전공 신청\n\n1) 신청 시 기존에 이수 중인 이중 / 부전공 은 자동 취소 됨 ( ※ 별도 취소 절차 없음 )\n\n2) “4. 유의 사항 ” 의 다 . 참고 하여 부전공 신청으로 인한 이수구분 변경 신청\n\n※ 이번 학기 졸업예정자 (4 학년 수료 , 졸업대기 포함 ) 는 1 월 초 까지\n\n이수구분 변경을 신청하여 졸업 학점이 누락되는 일이 없도록 해야 함\n\n나 . 이중 / 부전공 취소 ( 단일전공 희망자 ) : 이중전공 / 부전공 취소 신청\n\n1) 이중 / 부전공을 취소하는 경우 1 전공을 심화로 필수 이수 해야 함']","정보통신공학과에서는 졸업시험 대신 졸업논문을 선택할 수 있습니다. 졸업논문을 작성할 경우, 머신러닝 관련 주제로 연구를 진행할 수 있습니다.

머신러닝 관련 상담을 원하신다면, 다음 교수님께 문의하시면 좋습니다:

- **최재영 교수님 (Choi, Jae Young)**
  - 이메일: jychoi@hufs.ac.kr
  - 연구실: 공학관 413호

최재영 교수님은 머신러닝과 패턴인식 분야의 전문가이므로, 관련 상담에 적합하실 것입니다. 혹시 더 도와드릴까요?","졸업시험 대신 졸업논문을 선택하실 수 있습니다.졸업논문을 작성하실 경우, 머신러닝 관련 주제로 진행하고 싶으시다면, 관련 상담을 위해 한희일 교수님께 연락하실 수 있습니다
한희일 교수님의 이메일은 hihahn@hufs.ac.kr 입니다.",0.45311778864061886,0.6666666666666666,0.0,0.855576995519605
일통 FLEX 시험 점수 제출 기간 알고 싶어.,"['[공통] 2025-1학기(상반기) 교내 FLEX 졸업시험 시행 안내\n\n[공통] 2025-1학기(상반기) 교내 FLEX 졸업시험 시행 안내\n\n[ 공통 ] 2025-1 학기 ( 상반기 ) 교내 FLEX 졸업시험 시행 안내\n\n2025 학년도 1 학기 ( 상반기 ) 교내 FLEX 졸업시험의 세부 시행 계획을 아래와 같이 안내합니다 .\n\n1. 시 험 명 : 2025 학년도 1 학기 (2025 년 상반기 ) 교내 FLEX 졸업시험\n\n2. 시행주관 : FLEX 센터\n\n3. 대상언어 : 총 15 개 언어\n\n※ 포르투갈어 , 네덜란드어 , 스웨덴어 , 마 ・ 인어 , 태국어 , 튀르키예어 ( 터키어 ), 이탈리아어 , 체코어 , 헝가리어 , 세르비아어 , 루마니아어 , 폴란드어 , 그리스어 , 불가리아어 , 힌디어\n\n4. 응시자격 : 교내 각 학과에 사전 신청한 학생만 응시 가능\n\n5. 시험일시 : 2025. 5. 24( 토 ) 10:00~12:00(120 분 )\n\n6. 입실시간 : 09:40 분까지 해당 고사실 내 입실완료 , 마스크 착용 권고\n\n※ 응시자는 정해진 입실시간을 반드시 준수하여야 합니다 .\n\n※ 듣기시험이 시작되면 고사실 내 입실을 할 수 없습니다 .\n\n7. 시험장소 : 본교 서울캠퍼스 교수학습개발원\n\n※ 시험 당일 건물 앞에 설치되는 배치표 , 유도표시 및 붙임의 시행계획 참고\n\n8. 응시자 준비물 ( 반드시 지참 )\n\n※ 신분증 ( 학생증 , 주민등록증 , 운전면허증 , 여권 등 ), 컴퓨터용 수성싸인펜 , 수정테이프\n\n※ OMR 답안 수정은 응시자가 수정테이프로 자유롭게 수정이 가능함 .\n\n9. 시험 및 평가유형 ( 붙임의 시행계획서 참고 )\n\n가 . FLEX 듣기 · 읽기 A 형 ( 듣기 50 문항 , 읽기 90 문항 / 총 120 분 )\n\n나 . FLEX 듣기 · 읽기 B 형 ( 듣기 55 문항 , 읽기 95 문항 / 총 120 분 )\n\n다 . 언어별로 각각 개발되어 있는 유형에 따라 시행\n\n10. 기타사항\n\n가 . 별도 성적인증서 또는 성적표는 발급되지 않음 .', '[글로벌] 2025학년도 1학기 졸업논문 제출 및 졸업시험 일정 공고\n\n양식 2\n\n7. 다 .\n\nFLEX 대체 ( 교내 )\n\n2025. 4. 25.( 금 )\n\n졸업시험\n\n졸업시험 시간표 발표\n\n5. 마 . ※\n\n2025. 5. 12.( 월 ) ∼ 5. 13.( 화 )\n\n졸업시험\n\n1 전공 졸업시험\n\n5. 나 .\n\n2025. 5. 19.( 월 ) ∼ 5. 20.( 화 )\n\n졸업시험\n\n제 2 전공 , 이중전공 졸업시험\n\n5. 나 .\n\n2025. 5. 24.( 토 ) 오전 10:00\n\n졸업시험 ( 대체 )\n\nFLEX 대체 ( 교내 )\n\n7. 나 .\n\n서울캠퍼스 시행예정\n\n4. 졸업논문\n\n가 . 졸업논문 작성계획서 제출 마감일 : 2025. 4. 23.( 수 )\n\n※ 졸업논문 제출 마감일은 학과에 문의\n\n나 . 제 1 전공 , 제 2 전공 , 이중전공 : 해당학과에서 배정한 졸업논문 지도교수로부터 졸업논문 작성에 관한 지도를 받아 기일 내에 소속 학과장실에 제출함\n\n다 . 졸업논문의 분량은 200 자 원고지 100 매 이상 분량을 원칙으로 함\n\n라 . 졸업논문을 기한 내에 제출하지 않는 학생은 졸업사정 대상에서 제외됨\n\n※ 졸업논문을 제출하고자 하는 학생은 3 학년 2 학기 초 또는 졸업학기의 직전 학기 초에 졸업논문 작성계획서를 작성하여 소속 학과장실에 제출하여야함\n\n※ 세부일정은 해당학과에 따라 다를 수 있으니 반드시 해당학과에 문의 후 작성 제출\n\n5. 졸업시험\n\n가 . 졸업시험 기간\n\n1) 1 전공 : 2025. 5. 12.( 월 ) ∼ 5. 13.( 화 )\n\n2) 제 2 전공 , 이중전공 : 2025. 5. 19.( 월 ) ∼ 5. 20.( 화 )\n\n나 . 졸업시험 과목 : 자세한 사항은 첨부파일 참조 , 학과 사정에 따라 변경될 수 있음 ( 자세한 사항은 학과에 문의 )\n\n다 . 졸업시험 응시원서 접수 마감일 : 2025. 4. 23.( 수 )\n\n라 . 졸업시험 응시원서 교부 및 제출처 : 해당 학과 학과장실\n\n마 . 졸업시험 시간표 발표 : 2025. 4. 25.( 금 ) 소속학과 게시판 참조 ( 학과 자체 발표 )', '[공통] 2025-1학기(상반기) 교내 FLEX 졸업시험 시행 안내\n\n가 . FLEX 듣기 · 읽기 A 형 ( 듣기 50 문항 , 읽기 90 문항 / 총 120 분 )\n\n나 . FLEX 듣기 · 읽기 B 형 ( 듣기 55 문항 , 읽기 95 문항 / 총 120 분 )\n\n다 . 언어별로 각각 개발되어 있는 유형에 따라 시행\n\n10. 기타사항\n\n가 . 별도 성적인증서 또는 성적표는 발급되지 않음 .\n\n나 . 성적 확인은 해당 학과 사무실에서 확인 ( 시험일로부터 약 15~20 일 후 확인 가능 )\n\n붙임 : FLEX_2025 년 상반기 졸업시험 시행 계획\n\n2025. 5. 19.\n\n학사종합지원센터 ( 서울 / 글로벌 )', '[글로벌] 2025학년도 1학기 졸업논문 제출 및 졸업시험 일정 공고\n\n다 . 졸업시험 응시원서 접수 마감일 : 2025. 4. 23.( 수 )\n\n라 . 졸업시험 응시원서 교부 및 제출처 : 해당 학과 학과장실\n\n마 . 졸업시험 시간표 발표 : 2025. 4. 25.( 금 ) 소속학과 게시판 참조 ( 학과 자체 발표 )\n\n※ 해당학과 ( 부 ) 에 따라 시험일정이 다를 수 있으니 반드시 해당학과에 문의 후 응시\n\n6. FLEX 대체 ( 정기시험 : 영어 , 중국어 , 일본어 , 프랑스어 , 독일어 , 러시아어 , 스페인어 )\n\n가 . 해당학과 : 자세한 사항은 첨부파일 참조\n\n나 . 일정 : 시험 일정 ( 클릭 ) 에 따라 학생 개별 응시하고 성적표 학과 제출\n\n다 . 제출기간 : 해당학과 사무실 문의\n\n7. FLEX 대체 ( 이탈리아어 , 태국어 , 폴란드어 , 루마니아어 , 체코어 , 헝가리어 , 세르비아어 , 그리스어 , 불가리아어 , 힌디어 )\n\n가 . 해당학과 : 자세한 사항은 첨부파일 참조\n\n나 . 시험일자 : 2025. 5. 24( 토 ) 오전 10:00 서울캠퍼스 시행예정\n\n※ 정확한 시간 / 장소는 추후 통지\n\n다 . 접수기간 : 2025. 4. 16.( 수 ) ~ 4. 23.( 수 ) 해당학과 사무실에 신청 ( 기한 이후 추가 신청 불가 )\n\n* 7 학기 이상 재적생만 신청가능\n\n8. 유의 사항\n\n가 . 졸업시험 및 졸업논문 심사에 통과한 자는 졸업 시까지 그 자격이 유효함 ( 단 , 학적을 상실한 때에는 그 자격을 인정하지 아니함 )\n\n나 . 제 2 전공 , 이중전공자도 해당학과 문의 / 학과에 따른 졸업시험 응시 , 논문 제출 등 pass 하기 바람\n\n다 . 졸업시험 응시원서 제출 시 학생 본인의 연락처를 정확히 기재할 것\n\n라 . 졸업시험은 과목별 40 점이상 , 전과목 평균 60 점 이상 취득하여야 합격임\n\n마 . 졸업논문은 D° 이상 판정 받아야 합격임\n\n※ 졸업시험 및 졸업논문 관련서식은 첨부파일 참조\n\n2025. 4.\n\n글로벌캠퍼스 교무처장', '[글로벌] 2025학년도 1학기 졸업논문 제출 및 졸업시험 일정 공고\n\n| 0 | 1 | 2 | 3 | 4 | 5 | 6 |\n|:------------------------------|:---------------|:---------------------------|:---------------------------|:---------------------------|:-------------------------|:--------------------|\n| 마감일 / 일정 | 구분 | 제출서류 | 서식/양식 | 제출처 | 유의사항 (아래 공지번호) | 비고 |\n| 2025. 4. 23.(수) | 졸업논문 | 졸업논문 | 서식1, 양식4, 양식5 | 해당학과 | 4. 나., 다., 라. | 마감일정 학과 문의 |\n| 2025. 4. 23.(수) | 졸업논문 | 졸업논문 작성계획서 | 양식1 | 해당학과 | 4. 라. ※ | 정보없음 |\n| 2025. 4. 23.(수) | 졸업시험 | 졸업시험 응시원서 | 양식2 | 해당학과 | 5. 가., 마. | 정보없음 |\n| 2025. 4. 23.(수) | 졸업시험(대체) | 졸업시험 응시원서 | 양식2 | 해당학과 | 7. 다. | FLEX 대체(교내) |\n| 2025. 4. 25.(금) | 졸업시험 | 졸업시험 시간표 발표 | 졸업시험 시간표 발표 | 졸업시험 시간표 발표 | 5. 마. ※ | 정보없음 |\n| 2025. 5. 12.(월) ∼ 5. 13.(화) | 졸업시험 | 1전공 졸업시험 | 1전공 졸업시험 | 1전공 졸업시험 | 5. 나. | 정보없음 |\n| 2025. 5. 19.(월) ∼ 5. 20.(화) | 졸업시험 | 제2전공, 이중전공 졸업시험 | 제2전공, 이중전공 졸업시험 | 제2전공, 이중전공 졸업시험 | 5. 나. | 정보없음 |\n| 2025. 5. 24.(토) 오전 10:00 | 졸업시험(대체) | FLEX 대체(교내) | FLEX 대체(교내) | FLEX 대체(교내) | 7. 나. | 서울캠퍼스 시행예정 |', '[글로벌] 2025학년도 1학기 졸업논문 제출 및 졸업시험 일정 공고\n\n| 0 | 1 | 2 | 3 | 4 | 5 | 6 | 7 |\n|:-----------------|:------------------------------|:-------------------|:-------------------|:-------------------|:-------------------|:-------------------|:-------------------|\n| 단과대학명 | 학과(전공) | 졸업논문/시험 방식 | 졸업논문/시험 방식 | 졸업논문/시험 방식 | 졸업논문/시험 방식 | 졸업논문/시험 방식 | 학과사무실 |\n| 단과대학명 | 학과(전공) | 졸업논문 | 졸업시험 | FLEX 대체 | FLEX 대체 | 기타 | 학과사무실 |\n| 단과대학명 | 학과(전공) | 졸업논문 | 졸업시험 | 정기시험 | 교내 | 기타 | 학과사무실 |\n| 인문대학 | 철학과 | ○ | 정보없음 | 정보없음 | 정보없음 | 정보없음 | 031)330-4282 |\n| 인문대학 | 사학과 | ○ | 정보없음 | 정보없음 | 정보없음 | 정보없음 | 031)330-4288 |\n| 인문대학 | 언어인지과학과 | ○ | 정보없음 | 정보없음 | 정보없음 | 정보없음 | 031)330-4286 |\n| 인문대학 | 지식콘텐츠전공 | ○ | 정보없음 | 정보없음 | 정보없음 | 정보없음 | 031)330-4980 |\n| 융합인재대학 | 융합인재학부 | 정보없음 | ○ | ○ | 정보없음 | ○ | 031)330-4707 |\n| 통번역대학 | 영어통번역학부 | 정보없음 | 정보없음 | ○ | 정보없음 | ○ | 031)330-4202, 4559 |\n| 통번역대학 | 독일어통번역학과 | 정보없음 | 정보없음 | ○ | 정보없음 | 정보없음 | 031)330-4206 |\n| 통번역대학 | 스페인어통번역학과 | 정보없음 | ○ | ○ | 정보없음 | 정보없음 | 031)330-4210 |', '| --- | --- | --- | --- | --- | --- | --- | --- | --- |\n| 1 | 영어관련 전공 | 기타언어 | • 제2외국어(영어 제외) : FLEX 인증 원칙(해당언어 전공학과 기준) • 국가공인한자능력시험 : 3급 이상 • KBS한국어능력시험 : 3-급 이상 • 해당언어 전공 기초어학강좌 : 6학점 이상 이수(이중/부전공 언어 제외) | • 제2외국어(영어 제외) : FLEX 인증 원칙(해당언어 전공학과 기준) • 국가공인한자능력시험 : 3급 이상 • KBS한국어능력시험 : 3-급 이상 • 해당언어 전공 기초어학강좌 : 6학점 이상 이수(이중/부전공 언어 제외) | • 제2외국어(영어 제외) : FLEX 인증 원칙(해당언어 전공학과 기준) • 국가공인한자능력시험 : 3급 이상 • KBS한국어능력시험 : 3-급 이상 • 해당언어 전공 기초어학강좌 : 6학점 이상 이수(이중/부전공 언어 제외) | • 제2외국어(영어 제외) : FLEX 인증 원칙(해당언어 전공학과 기준) • 국가공인한자능력시험 : 3급 이상 • KBS한국어능력시험 : 3-급 이상 • 해당언어 전공 기초어학강좌 : 6학점 이상 이수(이중/부전공 언어 제외) | • 제2외국어(영어 제외) : FLEX 인증 원칙(해당언어 전공학과 기준) • 국가공인한자능력시험 : 3급 이상 • KBS한국어능력시험 : 3-급 이상 • 해당언어 전공 기초어학강좌 : 6학점 이상 이수(이중/부전공 언어 제외) | • 제2외국어(영어 제외) : FLEX 인증 원칙(해당언어 전공학과 기준) • 국가공인한자능력시험 : 3급 이상 • KBS한국어능력시험 : 3-급 이상 • 해당언어 전공 기초어학강좌 : 6학점 이상 이수(이중/부전공 언어 제외) |\n| 2 | 비영어 전공 | 영어 | 구분 | FLEX | FLEX 스피킹 | TOEIC | TOEIC 스피킹 | OPIc |', '6. FLEX 대체 ( 정기시험 : 영어 , 중국어 , 일본어 , 프랑스어 , 독일어 , 러시아어 , 스페인어 )\n\n가 . 해당학과 : 자세한 사항은 첨부파일 참조\n\n나 . 일정 : 시험 일정 ( 클릭 ) 에 따라 학생 개별 응시하고 성적표 학과 제출\n\n다 . 제출기간 : 해당학과 사무실 문의\n\n7. FLEX 대체 ( 이탈리아어 , 태국어 , 폴란드어 , 루마니아어 , 체코어 , 헝가리어 , 세르비아어 , 그리스어 , 불가리아어 , 힌디어 )\n\n가 . 해당학과 : 자세한 사항은 첨부파일 참조\n\n나 . 시험일자 : 2025. 5. 24( 토 ) 오전 10:00 서울캠퍼스 시행예정\n\n※ 정확한 시간 / 장소는 추후 통지', '다 . 제출기간 : 해당학과 사무실 문의\n\n7. FLEX 대체 ( 이탈리아어 , 태국어 , 폴란드어 , 루마니아어 , 체코어 , 헝가리어 , 세르비아어 , 그리스어 , 불가리아어 , 힌디어 )\n\n가 . 해당학과 : 자세한 사항은 첨부파일 참조\n\n나 . 시험일자 : 2025. 5. 24( 토 ) 오전 10:00 서울캠퍼스 시행예정\n\n※ 정확한 시간 / 장소는 추후 통지\n\n다 . 접수기간 : 2025. 4. 16.( 수 ) ~ 4. 23.( 수 ) 해당학과 사무실에 신청 ( 기한 이후 추가 신청 불가 )\n\n* 7 학기 이상 재적생만 신청가능\n\n8. 유의 사항\n\n가 . 졸업시험 및 졸업논문 심사에 통과한 자는 졸업 시까지 그 자격이 유효함 ( 단 , 학적을 상실한 때에는 그 자격을 인정하지 아니함 )\n\n나 . 제 2 전공 , 이중전공자도 해당학과 문의 / 학과에 따른 졸업시험 응시 , 논문 제출 등 pass 하기 바람', '3. 평 가 방 법\n\n가 . 필답고사 , 과제물 , 출석률 등을 참작하여 평가함 .\n\n나 . 시험시간표는 별도로 발표하지 않으며 정해진 시험기간에 실시함 .\n\n4. 성적입력 알림 서비스 실시 : 성적입력 시스템에서 ‘ 최종제출 ’ 을 클릭하여 성적입력이 완료되면 해당 학생들에게 ‘ 성적이 입력되어 확인할 수 있다 ’ 는 문자가 (HUFS 앱 설치자에 한함 ) 발송됨 .\n\n2025. 4.\n\n서울 · 글로벌캠퍼스 교무처장\n\n| 0 |\n|:-------------------------|\n| 2025-1학기 중간시험 공고 |', '이수한 것으로 처리 7) FLEX외국어능력시험 교양선택 학점 인정(2015학번 이후) (대학외국어필수 대체 아님) - 인정성적 : FLEX외국어능력시험(대한상공회의소 주관, 듣기․읽기) 성적 701점 이상 - 인정학점 : ‘FLEX~어(교양)’ 2학점(701~800점 A0, 801점 이상 A+), 1회에 한함 - 1전공과 동일언어 학점 불인정 - FLEX 학점인정 문의 : 학사종합지원센터 학점인정담당(Tel : 031-330-4026) ※ 외국어연수평가원의 외국어과정 수료는 학점인정 대상이 아님 8) ‘사회봉사’(정규), ‘사회봉사(농활)’, ‘사회봉사(해외)’는 재학 중 최대 2과목(4학점)까지 이수 가능 9) 외대 정규 개설과목 외 교양학점으로 인정 가능한 국내외 교류학점, 현장실습 교양학점 등은 교양 선택으로 인정함 10) 글로벌캠퍼스 소속 학생이 서울캠퍼스 계절학기 등으로 아래 교과목 이수 시 - Communicative English 교과목 : 대학영어 교과목으로 인정', 'FLEX 대체 ( 교내 )\n\n7. 나 .\n\n서울캠퍼스 시행예정\n\n4. 졸업논문\n\n가 . 졸업논문 작성계획서 제출 마감일 : 2025. 4. 23.( 수 )\n\n※ 졸업논문 제출 마감일은 학과에 문의\n\n나 . 제 1 전공 , 제 2 전공 , 이중전공 : 해당학과에서 배정한 졸업논문 지도교수로부터 졸업논문 작성에 관한 지도를 받아 기일 내에 소속 학과장실에 제출함\n\n다 . 졸업논문의 분량은 200 자 원고지 100 매 이상 분량을 원칙으로 함\n\n라 . 졸업논문을 기한 내에 제출하지 않는 학생은 졸업사정 대상에서 제외됨\n\n※ 졸업논문을 제출하고자 하는 학생은 3 학년 2 학기 초 또는 졸업학기의 직전 학기 초에 졸업논문 작성계획서를 작성하여 소속 학과장실에 제출하여야함', '- 3) 외국인전형 입학자가 전공 또는 이중전공을 언어관련 전공으로 하는 경우, 전공 또는\n- 이중전공 졸업시험 통과 시 외국어인증으로 자동 처리됨(수료 희망자는 별도 문의)\n- 4) FLEX 시험 안내는 대한상공회의소 홈페이지, 학교 홈페이지 <FLEX센터>를 통하여 확\n- 인할 수 있으며, 시험 횟수가 제한적이므로 미리 준비하여 졸업에 차질이 없도록 할 것', '제외) : FLEX 인증 원칙(해당언어 전공학과 기준) • 국가공인한자능력시험 : 3급 이상 • KBS한국어능력시험 : 3-급 이상 • 해당언어 전공 기초어학강좌 : 6학점 이상 이수(이중/부전공 언어 제외) | • 제2외국어(영어 제외) : FLEX 인증 원칙(해당언어 전공학과 기준) • 국가공인한자능력시험 : 3급 이상 • KBS한국어능력시험 : 3-급 이상 • 해당언어 전공 기초어학강좌 : 6학점 이상 이수(이중/부전공 언어 제외) | • 제2외국어(영어 제외) : FLEX 인증 원칙(해당언어 전공학과 기준) • 국가공인한자능력시험 : 3급 이상 • KBS한국어능력시험 : 3-급 이상 • 해당언어 전공 기초어학강좌 : 6학점 이상 이수(이중/부전공 언어 제외) | • 제2외국어(영어 제외) :', '| 1 | 영어관련 전공 | 기타언어 | • 제2외국어(영어 제외) : FLEX 인증 원칙(해당언어 전공학과 기준) • 국가공인한자능력시험 : 3급 이상 • KBS한국어능력시험 : 3-급 이상 • 해당언어 전공 기초어학강좌 : 6학점 이상 이수(이중/부전공 언어 제외) | • 제2외국어(영어 제외) : FLEX 인증 원칙(해당언어 전공학과 기준) • 국가공인한자능력시험 : 3급 이상 • KBS한국어능력시험 : 3-급 이상 • 해당언어 전공 기초어학강좌 : 6학점 이상 이수(이중/부전공 언어 제외) | • 제2외국어(영어 제외) : FLEX 인증 원칙(해당언어 전공학과 기준) • 국가공인한자능력시험 : 3급 이상 • KBS한국어능력시험 : 3-급 이상 • 해당언어 전공 기초어학강좌 : 6학점 이상', '| 1 | 영어관련 전공 | 기타언어 | • 제2외국어(영어 제외) : FLEX 인증 원칙(해당언어 전공학과 기준) • 국가공인한자능력시험 : 3급 이상 • KBS한국어능력시험 : 3-급 이상 • 해당언어 전공 기초어학강좌 : 6학점 이상 이수(이중/부전공 언어 제외) | • 제2외국어(영어 제외) : FLEX 인증 원칙(해당언어 전공학과 기준) • 국가공인한자능력시험 : 3급 이상 • KBS한국어능력시험 : 3-급 이상 • 해당언어 전공 기초어학강좌 : 6학점 이상 이수(이중/부전공 언어 제외) | • 제2외국어(영어 제외) : FLEX 인증 원칙(해당언어 전공학과 기준) • 국가공인한자능력시험 : 3급 이상 • KBS한국어능력시험 : 3-급 이상 • 해당언어 전공 기초어학강좌 : 6학점 이상 이수(이중/부전공 언어 제외) | • 제2외국어(영어 제외) : FLEX 인증 원칙(해당언어 전공학과 기준) • 국가공인한자능력시험 : 3급 이상 • KBS한국어능력시험 : 3-급 이상 •', '가 . 해당학과 : 자세한 사항은 첨부파일 참조\n\n나 . 시험일자 : 2025. 5. 24( 토 ) 오전 10:00 서울캠퍼스 시행예정\n\n※ 정확한 시간 / 장소는 추후 통지\n\n다 . 접수기간 : 2025. 4. 16.( 수 ) ~ 4. 23.( 수 ) 해당학과 사무실에 신청 ( 기한 이후 추가 신청 불가 )\n\n* 7 학기 이상 재적생만 신청가능\n\n8. 유의 사항\n\n가 . 졸업시험 및 졸업논문 심사에 통과한 자는 졸업 시까지 그 자격이 유효함 ( 단 , 학적을 상실한 때에는 그 자격을 인정하지 아니함 )\n\n나 . 제 2 전공 , 이중전공자도 해당학과 문의 / 학과에 따른 졸업시험 응시 , 논문 제출 등 pass 하기 바람\n\n다 . 졸업시험 응시원서 제출 시 학생 본인의 연락처를 정확히 기재할 것', '한국외대생 대상 사이버한국외대 2025학년도 여름 계절학기 학점교류 안내\n\n| 0 |\n|:-----------------------------------------------------------------------------------------------------------------------------------------------------------------------------------------------------------------------------------------------------------------------------------------------------------------------------------------------------|\n| ※ 집중학기 마이플렉스(My-Flex) 수업이란? • 나만의 플랜으로 자유롭게 수강하는 3주 집중학기! • 개강일(6/23)에 전체 주차(1~14주) 강의가 오픈되고, 수업기간 3주 이내 수강 시 ‘출석’으로 인정 • 학생 스스로 출석 및 학습 일정을 관리하도록 하여 자기주도학습 역량 강화하고 학생 개별 상황에 맞춘 수업 설계 가능 • 계절학기 한정 운영 (정규학기 해당 없음) |', '[글로벌] 2025학년도 1학기 졸업논문 제출 및 졸업시험 일정 공고\n\n다 . 졸업시험 응시원서 제출 시 학생 본인의 연락처를 정확히 기재할 것\n\n라 . 졸업시험은 과목별 40 점이상 , 전과목 평균 60 점 이상 취득하여야 합격임\n\n마 . 졸업논문은 D° 이상 판정 받아야 합격임\n\n※ 졸업시험 및 졸업논문 관련서식은 첨부파일 참조\n\n2025. 4.\n\n글로벌캠퍼스 교무처장\n\n| 0 |\n|:------------------------------------|\n| 졸업논문 제출 및 졸업시험 일정 공고 |', '[글로벌] 2025학년도 1학기 졸업논문 제출 및 졸업시험 일정 공고 새글\n\n| 0 | 1 | 2 | 3 | 4 | 5 | 6 | 7 |\n|:-----------------|:------------------------------|:-------------------|:-------------------|:-------------------|:-------------------|:-------------------|:-------------------|\n| 단과대학명 | 학과(전공) | 졸업논문/시험 방식 | 졸업논문/시험 방식 | 졸업논문/시험 방식 | 졸업논문/시험 방식 | 졸업논문/시험 방식 | 학과사무실 |\n| 단과대학명 | 학과(전공) | 졸업논문 | 졸업시험 | FLEX 대체 | FLEX 대체 | 기타 | 학과사무실 |\n| 단과대학명 | 학과(전공) | 졸업논문 | 졸업시험 | 정기시험 | 교내 | 기타 | 학과사무실 |\n| 인문대학 | 철학과 | ○ | 정보없음 | 정보없음 | 정보없음 | 정보없음 | 031)330-4282 |\n| 인문대학 | 사학과 | ○ | 정보없음 | 정보없음 | 정보없음 | 정보없음 | 031)330-4288 |\n| 인문대학 | 언어인지과학과 | ○ | 정보없음 | 정보없음 | 정보없음 | 정보없음 | 031)330-4286 |\n| 인문대학 | 지식콘텐츠전공 | ○ | 정보없음 | 정보없음 | 정보없음 | 정보없음 | 031)330-4980 |\n| 융합인재대학 | 융합인재학부 | 정보없음 | ○ | ○ | 정보없음 | ○ | 031)330-4707 |\n| 통번역대학 | 영어통번역학부 | 정보없음 | 정보없음 | ○ | 정보없음 | ○ | 031)330-4202, 4559 |\n| 통번역대학 | 독일어통번역학과 | 정보없음 | 정보없음 | ○ | 정보없음 | 정보없음 | 031)330-4206 |\n| 통번역대학 | 스페인어통번역학과 | 정보없음 | ○ | ○ | 정보없음 | 정보없음 | 031)330-4210 |', '[글로벌] 2025학년도 1학기 졸업논문 제출 및 졸업시험 일정 공고\n\n[글로벌] 2025학년도 1학기 졸업논문 제출 및 졸업시험 일정 공고\n\n졸업논문 제출 및 졸업시험 일정 공고\n\n2025 학년도 제 1 학기 졸업시험 및 졸업논문 제출 일정을 아래와 같이 공고함\n\n1. 자격 : 현재 3 학년 과정을 이수 완료한 7 학기 이상 재적생 (7 학기 미만 재적생은 불가 )\n\n2. 학과별 1 전공 졸업논문 / 시험 목록 : 자세한 사항은 첨부파일 참조 ( 이중전공은 해당학과에 문의 )\n\n단과대학명\n\n학과 ( 전공 )\n\n졸업논문 / 시험 방식\n\n학과사무실\n\n졸업논문\n\n졸업시험\n\nFLEX 대체\n\n기타\n\n정기시험\n\n교내\n\n인문대학\n\n철학과\n\n○\n\n031)330-4282\n\n사학과\n\n○\n\n031)330-4288\n\n언어인지과학과\n\n○\n\n031)330-4286\n\n지식콘텐츠전공\n\n○\n\n031)330-4980\n\n융합인재대학\n\n융합인재학부\n\n○\n\n○\n\n○\n\n031)330-4707\n\n통번역대학\n\n영어통번역학부\n\n○\n\n○\n\n031)330-4202, 4559\n\n독일어통번역학과\n\n○\n\n031)330-4206\n\n스페인어통번역학과\n\n○\n\n○\n\n031)330-4210\n\n이탈리아어통번역학과\n\n○\n\n○\n\n○\n\n○\n\n031)330-4214\n\n중국어통번역학과\n\n○\n\n031)330-4232\n\n일본어통번역학과\n\n○\n\n031)330-4234\n\n아랍어통번역학과\n\n○\n\n031)330-4236\n\n말레이 ･ 인도네시아어통번역학과\n\n○\n\n031)330-4238\n\n태국어통번역학과\n\n○\n\n031)330-4240\n\n국가전략언어대학\n\n폴란드학과\n\n○\n\n031)330-4216\n\n루마니아학과\n\n○\n\n○\n\n031)330-4218\n\n체코ㆍ슬로바키아학과\n\n○\n\n○\n\n031)330-4220\n\n헝가리학과\n\n○\n\n○\n\n031)330-4222\n\n세르비아ㆍ크로아티아학과\n\n○\n\n○\n\n031)330-4224\n\n그리스ㆍ불가리아학과\n\n○\n\n031)330-4715\n\n중앙아시아학과\n\n○\n\n○\n\n○\n\n031)330-4716\n\n아프리카학부 동아프리카 전공\n\n○\n\n○\n\n○\n\n031)330-4242\n\n아프리카학부 서아프리카 전공', '[공통] 외국어인증 신청서 제출 안내\n\n| 제출서류 | 1. 외국어인증 신청서(첨부파일 참조) 2. 제출시점 기준 유효기간(2년) 이내의 인증 시험 성적(또는 대체 과정 수료증) ※성적표 미리보기 캡쳐본\xa0성적 처리 불가 | 1. 외국어인증 신청서(첨부파일 참조) 2. 제출시점 기준 유효기간(2년) 이내의 인증 시험 성적(또는 대체 과정 수료증) ※성적표 미리보기 캡쳐본\xa0성적 처리 불가 | 1. 외국어인증 신청서(첨부파일 참조) 2. 제출시점 기준 유효기간(2년) 이내의 인증 시험 성적(또는 대체 과정 수료증) ※성적표 미리보기 캡쳐본\xa0성적 처리 불가 | 1. 외국어인증 신청서(첨부파일 참조) 2. 제출시점 기준 유효기간(2년) 이내의 인증 시험 성적(또는 대체 과정 수료증) ※성적표 미리보기 캡쳐본\xa0성적 처리 불가 |\n| 제출마감일 | 재학기간 동안\xa01회,\xa0외국어 인증 신청서를 제출하고자 하는 학기 말까지 ※\xa0졸업예정자는 졸업하고자 하는 최종 학기 말까지 반드시 제출해야함. | 재학기간 동안\xa01회,\xa0외국어 인증 신청서를 제출하고자 하는 학기 말까지 ※\xa0졸업예정자는 졸업하고자 하는 최종 학기 말까지 반드시 제출해야함. | 재학기간 동안\xa01회,\xa0외국어 인증 신청서를 제출하고자 하는 학기 말까지 ※\xa0졸업예정자는 졸업하고자 하는 최종 학기 말까지 반드시 제출해야함. | 재학기간 동안\xa01회,\xa0외국어 인증 신청서를 제출하고자 하는 학기 말까지 ※\xa0졸업예정자는 졸업하고자 하는 최종 학기 말까지 반드시 제출해야함. |\n| 제출처 | 학생의\xa01전공 소속 단과대학 담당에게\xa0E-mail\xa0제출 | 학생의\xa01전공 소속 단과대학 담당에게\xa0E-mail\xa0제출 | 학생의\xa01전공 소속 단과대학 담당에게\xa0E-mail\xa0제출 | 학생의\xa01전공 소속 단과대학 담당에게\xa0E-mail\xa0제출 |\n| 제출처 | 서울캠퍼스 | 영어대학 /\xa0아시어언어문화대학 / AI융합대학 | haksa7@hufs.ac.kr | 02) 2173-2264 |', ""## [heading1] ##\n# 라. 기타사항\n\n## [list] ##\n- 1) 위 인증기준을 충족하는 인증시험 성적, 대체과정 수료증 등의 '인증서 사본'(제출시점\n- 기준 2년 이내 취득)을 최종 학기 말까지 학사종합지원센터에 제출(기타언어 FLEX의\n- 경우 해당 언어학과에 일정 확인 후 학과 사무실에 제출)\n- 2) 기타언어 제출 대상자(영어통번역학부 소속 학생)가 언어관련 이중전공을 하는 경우,\n- 이중전공 졸업시험 통과 시 외국어인증으로 자동 처리됨(수료 희망자는 별도 문의)\n- 3) 외국인전형 입학자가 전공 또는 이중전공을 언어관련 전공으로 하는 경우, 전공 또는\n- 이중전공 졸업시험 통과 시 외국어인증으로 자동 처리됨(수료 희망자는 별도 문의)\n- 4) FLEX 시험 안내는 대한상공회의소 홈페이지, 학교 홈페이지 <FLEX센터>를 통하여 확\n- 인할 수 있으며, 시험 횟수가 제한적이므로 미리 준비하여 졸업에 차질이 없도록 할 것\n\n## [heading1] ##\n# 4. 기타 졸업관련 사항\n\n## [paragraph] ##\n가. 졸업예정자 졸업요건 충족여부 필수 확인사항 정리\n\n## [list] ##\n- 1) 졸업에 필요한 이수학점 수 / 총평점(F포함) 2.0이상 여부\n- 2) 교양필수 및 전공(이중전공) 필수 교과목 이수여부\n\n## [paragraph] ##\n※ 전공필수 : 각 학과 문의\n교양필수 : 수강편람 교양 안내문 참조\n\n## [list] ##\n- 3) 전공 및 이중전공 졸업시험(논문/또는 대체시험 등) 합격여부\n- 4) 외국어인증(졸업인증) 완료여부\n\n## [paragraph] ##\n나. 졸업요건 충족여부에 따른 학적사항 안내"", '| 질병 및 상해 로 인한 입원 또는 감염병 으로 인한 격 리(치료) | 법정감염병 (**질병관리청의 법정감염병에 한함) | 격리(치료) 기간 또는 감염우려 기간 | 해당 증빙서류 | 담당교수에게 증빙서류 제출 |  |\n| 졸업시험 | 졸업시험 | 졸업시험 당일 | 학과장 확인서 | 담당교수에게 증빙서류 제출 |  |\n| 수업일수 4분의 3선 후 징병에 의한 군입대 | 수업일수 4분의 3선 후 징병에 의한 군입대 | - | 입영통지서 | 담당교수에게 증빙서류 제출 |  |\n| 출산 | 출산 | 본인:20일 배우자:10일 | 본인 : 출생(출산예정)증 명서 등, 배우자 : 출생 (출산예정)증명서 및 가족관계증명서 등 | 담당교수에게 증빙서류 제출 |  |\n| 생리 | 생리 | 생리기간 (학기중 2회) | 유고결석신청서 (생리공결제) | 담당교수에게 증빙서류 제출 | ※ 자세한 사항은 학사공지사항 생리 유고 신청안내 참조 |\n| 교직과정이수자의 학교현장실습 | 교직과정이수자의 학교현장실습 | 교육실습 기간 | 교직담당자가 발급한 확인서 | 담당교수에게 증빙서류 제출 |  |\n| 졸업예정자(해당학기 졸업가능자) 로서 조기취업자 | 졸업예정자(해당학기 졸업가능자) 로서 조기취업자 | 취업기간 | 학과장 승인받은 유고결석 인정원, 재직(계약)증명서 및 4대보험가입내역 확인서 또는 이에 준하는 재직증명서류 | 입사확정 후 즉시 ￬ 유고결석인정원과 증빙서류에 대해 학과장 승인 ￬ 소속 단과대에 제출 ￬ 유고결석확인서를 발급받아 담당교수에게 제출 ￬ 수업종료 직전 취업사실에 대해 재확인 | ※ 자세한 사항은 학사공지사항 졸업예정자(해 당학기 졸업가능자)의 조기취업 유고결석 신청 안내 참조 |', '인 인증 시험\n주요 실적 \n-  특수외국어 교육진흥법의 특수외국어 교육학과\n-  EcoProBM과 업무협약 MOU 체결 \n-  헝가리 법인 삼성 SDI, 헝가리 법인 삼성전자, 주헝 한국문화원 등과\n의 인턴 협약\n-  유럽공인인증시험 ECL 헝가리어 시험 센터 구축\n-  헝가리 국립 시청각 자료 이용 가능한 한국 센터 구축\n-  한국 인증 헝가리어 자격시험 FLEX 시험 운영\n-  헝가리 파견 주재원 헝가리어 위탁 교육 기관\n주요 전공과목 \n-  헝가리어 관련 교과목: 헝가리어를 회화, 시청각, 번역연습, 문법·작문\n으로 나누어서 하나의 교재로 반복, 심화 학습합니다. 1학년 주 9시간, \n2학년 주 7시간 헝가리어 수업이 진행됩니다. 3학년에는 실무에서 사\n용하는 전문용어를 학습하는 <비지니스 헝가리어>를 학습하고, 번역\n에 관심이 있는 경우 <헝가리 시 번역> 과목에서 번역의 기본 이론과 \n실제적 경험을 쌓을 수 있습니다. \n-  헝가리의 외교와 정치: 1학년에서는 헝가리를 유럽과 연결해서 고찰\n하는 <유럽과 헝가리> 강의가 마련되어 있으며. 2학년에서는 <헝가\n리의 외교 정책> 강의에서 헝가리 외교의 기본방향과 목표를 배우실 \n수 있습니다. 3학년에서는 <헝가리 정치의 이해>를 통해 현실적인 정\n치의 흐름을 학습하며 4학년 때에는 <헝가리 지역연구 1,2> 과목으로 \n헝가리의 현재 정치적 현황과 방향을 배우게 됩니다. \n-  헝가리 사회·문화 교과목: 1학년에서는 헝가리 전반에 대한 <헝가리 \n개관>이라는 강의가 마련되며, 2학년에서는 <헝가리 역사와 문화>, \n<헝가리의 외교 정책>이라는 강의로 헝가리와 주변의 유럽 국가들에 \n대한 전체적인 이해를 위한 학습을 합니다. 3학년에서는 <헝가리 사\n회 연구>, <유럽 속의 헝가리 문화>를 통해 헝가리의 사회 문화적 고\n유성과 특징을 학습합니다. 4학년에서는 <헝가리 영화 1,2> 강의에서 \n헝가리 문화의 흐름과 맥락을 배우게 됩니다. \n-  헝가리어 공인인증 시험 관련 교과목: 헝가리어 자격증 취득을 준비하\n는 <FLEX 헝가리어>가 3학년 2학기에 걸쳐 강의되며, 4학년에서는 \nECL 자격증 취득을 위한 <고급 헝가리어 번역연습>으로 헝가리어의 \n단계적 학습을 하실 수 있습니다. \n-  헝가리 문학 교과목: 헝가리 문학은 3학년 전공 수업에서 접하실 수 있\n으며 3학년의 <헝가리 전래동화와 콘텐츠>에서 배우는 구비문학과', '[공통] 외국어인증 신청서 제출 안내\n\n[공통] 외국어인증 신청서 제출 안내\n\n외국어인증 신청서 제출 안내\n\n외국어인증 신청서 제출에 대해 아래와 같이 안내합니다 .\n\n1. 외국어인증이란\n\n서울캠퍼스 수강편람 바로가기\n\n(수강편람목록- 수강편람 중 해당 페이지 참조)\n\n글로벌캠퍼스 수강편람 바로가기\n\n(수강편람목록- 수강편람 중 해당 페이지 참조 )\n\n2. 외국어인증 신청서 제출 안내\n\n제출서류\n\n1. 외국어인증 신청서(첨부파일 참조)\n\n2. 제출시점 기준 유효기간(2년) 이내의 인증 시험 성적 ( 또는 대체 과정 수료증 )\n\n※성적표 미리보기 캡쳐본\xa0성적 처리 불가\n\n제출마감일\n\n재학기간 동안 1 회 , 외국어 인증 신청서를 제출하고자 하는 학기 말 까지\n\n※ 졸업예정자는 졸업하고자 하는 최종 학기 말까지 반드시 제출해야함 .\n\n제출처\n\n학생의 1 전공 소속 단과대학 담당에게 E-mail 제출\n\n서울캠퍼스\n\n영어대학 / 아시어언어문화대학 / AI융합대학\n\nhaksa7@hufs.ac.kr\n\n02) 2173-2264\n\n서양어대학 / 중국학대학 / 일본학대학\n\nhana@hufs.ac.kr\n\n02) 2173-2121\n\n사회과학대학 / 상경대학 / 경영대학 / 국제학부 / LD 학부 / LT 학부 / KFL 학부\n\nhaksa6@hufs.ac.kr\n\n02) 2173-2308\n\n사범대학\n\npoisson@hufs.ac.kr\n\n02) 2173-2338\n\n글로벌캠퍼스\n\n인문대학 /\xa0통번역대학 / 융합인재대학\n\nhaksa4077@hufs.ac.kr\n\n031) 330-4077\n\n국가전략언어대학 / 국제지역대학 / 자유전공학부(글로벌)\n\n031) 330-4457\n\n자연과학대학 / 공과대학 / 바이오메디컬공학부\n\nyyj1730@hufs.ac.kr\n\n031) 330-4073\n\n경상대학 /\xa0AI융합대학(글로벌) / Culture& Technology융합대학 / 기후변화융합학부\n\nminsun@hufs.ac.kr\n\n031) 330-4953\n\n교무처 학사종합지원센터', '## [table] ##\n| 본 대학교 및 소속 단과대학을 대표하는 공무, 행사 또는 운동경기참가 | 단과대학 규모 이상의 행사 및 체육대회임원, 간부 및 선수로서 참가 | 행사시간 | 기간과 참여인이 명시된 대학장의 행사 허가원 또는 협조공문 등 | 소속단과대학에서 유고결석 확인서를 발급받아 담당교수에게 제출 |  |\n| --- | --- | --- | --- | --- | --- |\n| 본 대학교 및 소속 단과대학을 대표하는 공무, 행사 또는 운동경기참가 | 정부 또는 지방자 치단체의 공식적 인 행사에 참가 | 행사기간 | 기간과 참여인이 명시된 부서·기관의 협조공문 등 | 담당교수에게 증빙서류 제출 |  |\n| 본 대학교 및 소속 단과대학을 대표하는 공무, 행사 또는 운동경기참가 | 총학생회의 회의 (대의원회의, 상 임위원회 및 운 영위원회 포함) 졸 업 준 비 위 원 의 업무수행 | 해당기간 매학기 7일 이내 | 기간과 참여인이 명시된 부서·기관의 협조공문 등 | 담당교수에게 증빙서류 제출 |  |\n| 본 대학교 및 소속 단과대학을 대표하는 공무, 행사 또는 운동경기참가 | 학보, 디 아거스 및 방송국의 기사작성 및 편집 | 편집부 당일 | 기간과 참여인이 명시된 부서·기관의 협조공문 등 | 담당교수에게 증빙서류 제출 |  |\n| 본 대학교 및 소속 단과대학을 대표하는 공무, 행사 또는 운동경기참가 | 학교 주관 행사 및 업무 지원 | 해당기간 | 담당부서에서 발급한 확인서 | 담당교수에게 증빙서류 제출 |  |\n| 질병 및 상해 로 인한 입원 또는 감염병 으로 인한 격 리(치료) | 질병 및 상해 | 입원기간 | 해당 증빙서류 (*병원급 이상의 의료기관) | 담당교수에게 증빙서류 제출 |  |\n| 질병 및 상해 로 인한 입원 또는 감염병 으로 인한 격 리(치료) | 법정감염병 (**질병관리청의 법정감염병에 한함) | 격리(치료) 기간 또는 감염우려 기간 | 해당 증빙서류 | 담당교수에게 증빙서류 제출 |  |', '[서울] 2025학년도 1학기 ‘한국외대-한예종’ 공동운영 교양교과목 수강 안내\n\n수강신청 방법\n\n우리대학 홈페이지 수강신청시스템 => 실용외국어 / 교양과목 => 공동교양 ( 한예종 )\n\n※ 기존 수강신청 방식과 동일하게 우리대학 수강신청 기간에 수강신청시스템에 접속하여 교양영역에서 한예종 과목을 선택하여 수강 신청함 .\n\n※ 단 , 전체학년 수강신청 기간 (2025.\xa02.\xa07( 금 )) 에만 수강신청이 가능함 .\n\n수강학점\n\n학년도별 학기당 최대 수강신청 20 학점 내에서 수강신청 가능\n\n수강변경 및 취소\n\n우리대학 홈페이지 종합정보시스템 접속\n\n※ 한예종 교양과목을 수강취소하는 경우 , 다른 한예종 교양과목을 수강신청 할 수 없으며 , 우리 대학에서 개설되는 과목으로만 수강변경이 가능함 ( 단 , 여석 내 )\n\n※ 교류과목 중 폐강이 발생할 경우 , 폐강된 교류과목을 신청했던 학생은 우리대학에서 개설되는 과목으로 수강 변경할 수 있음 .\n\n성적처리\n\n① 한예종에서 성적 정정 ( 기간 ) 완료 후 , 한예종 공동 교양과목을 수강한 한국외대 학생들의 성적 ( 백분율 점수 ) 을 우리 대학으로 전달함 .\n\n② 한예종에서 부여하는 백분율 점수를 우리 대학 평점평균 환산기준표에 따라 성적등급으로 환산하여 최종 성적등급을 결정함 .\n\n※ 평점평균 : 우리대학 4.5 만점 / 한예종 4.3 만점\n\n재 수 강\n\n① 한예종에서 기존에 수강한 교과목에 대한 재수강은 우리 대학에서 개설되는 교양선택 과목 중 택 1 하여 재수강 해야함 .\n\n② 우리대학 교과목에 대한 재수강을 목적으로 한예종 공동교양 교과목을 수강할 수 없음 .\n\n기 타\n\n① 공동 교양학부에서 운영하는 한예종 교양 과목은 , 국내대학 학점 교류와는 달리 재학 중 학점제한 없이 수강할 수 있음 .\n\n단 , 국내 학점교류 방식을 통해 한예종 과목을 수강하는 경우에는 , 국내 · 외 학점교류규정에 따라 취득 허용 학점 제한이 있음 .\n\n※ 국내대학 학점교류 : 학기당 17 학점 이내 / 재학중 수강가능학점 35 학점 이내', '(비교과) 전공탐색 연계한 자기탐색, 진로탐색 프로그램 지원\n1학년(여름방학) 학과 설명회\n2학기 희망 전공의 학문기초 교과목을 선택할 수 있도록 정보제공 \n1학년 2학기 전공 진입 전 기초교육 \n(교과) 교양 교과목 이수 및 희망 전공의 학문기초 교과목 이수 \n(비교과) 다양한 프로그램 연계 전공탐색학기제 운영 \n슬기로운 대학생활 \n자유전공학부(글로벌)는 전공이 정해지지 않아 학생들에게 보다 많은 \n경험을 제공할 수 있는 발판을 마련합니다. 다른 학생들과 다르게 자유\n전공학부(글로벌) 학생들은 전공을 미리 선택하지 않은 상태로 학교에 \n입학하게 됩니다. 이런 기회를 토대로 다양한 수업들을 통해서 자신과 \n잘 맞는 전공을 탐색하여 자신이 원하는 진로를 스스로 개척해 나가는 \n미래를 가져가시길 바랍니다.\nQ&A \nQ1. 2학년 진급시 주전공으로 선택할 수 있는 학과를 알고 싶습니다.\nA1.  입학 시 글로벌캠퍼스의 모든 학과(부)를 주전공으로 선택할 수 있\n는 기회가 부여됩니다. 단, 우크라이나학과와 한국학과는 2학년 배\n정이 불가하여 선택할 수 없습니다.\nQ2.  2학년 진급시 이중(부)전공으로 선택할 수 있는 학과를 알고 싶\n습니다.\nA2.  서울, 글로벌캠퍼스 구분 없이 모든 학과를 선택할 수 있습니다. 단, \n글로벌캠퍼스의 융합인재학부와 서울캠퍼스 사범대학의 학과는 해\n당 모집단위의 커리큘럼 특성 상 선택할 수 없습니다.\nQ3.  2학년 진급 시 학과 선택을 할 때, 선발기준에 대해서 알고 싶습\n니다.\nA3.  2학년 진급 시 이루어지는 학과 선택과정에서의 선발기준은 따로 \n존재하지 않습니다. 자유전공학부(글로벌)에 입학한 모든 신입생들\n에게 원하는 전공을 자유롭게 선택할 수 있는 기회를 제공하고 있\n으니 참고 바랍니다.\nOpen Major Division(Global Campus)\n자유전공학부(글로벌)\n전화번호 031-330-4797\n홈페이지 gomd.hufs.ac.kr\n글로벌캠퍼스 GLOBAL CAMPUS\nDIVISION OF \nCLIMATE CHANGE\n기후변화융합학부\n기후변화융합학부 68', '1716\nDept. of Hungarian Studies\n헝가리학과\n전화번호 031-330-4222\n홈페이지 hungary.hufs.ac.kr\n전공소개 \n헝가리학과는 한국에서 유일하게 헝가리의 언어와 문화를 교육하는 기\n관으로 특수외국어교육진흥법의 지원을 받아 헝가리어에 대한 교육을 \n기본으로 헝가리 문화, 역사, 정치, 경제, 문학에 대해 배울 수 있는 기\n관입니다. 또한 학부과정 중에 헝가리어 연수, 헝가리 법인 한국 기업의 \n인턴, 방학중 헝가리어 무료집중 온오프 과정을 진행하여 헝가리어만이 \n아니라, 헝가리 전반에 관한 지식과 이해를 겸비한 우수한 인재를 배출\n하고 있습니다. 유럽연합 국가인 헝가리에 교두보를 마련한 SK ON, 삼\n성SDI, 삼성전자, 한국타이어, 두산, LG전자, Eco ProBM과 산하협력업\n체가 현지에 진출해 있어 헝가리 전공자에 대한 높은 수요가 있습니다. \n또한 우리 학교의 교환학생 제도와 헝가리 정부장학생(연 100명) 제도\n로 현지에서 공부할 수 있는 다양한 기회가 제공되고 있습니다.\n필요역량 및 소양 \n-  헝가리에 관한 책을 읽어보시면 좋습니다. 헝가리어 문법이나 회화 \n등의 언어 학습을 도와주는 서적도 많지만, 이보다는 헝가리의 정치, \n사회, 문화, 문학작품 등 다양한 각도에서 헝가리와 헝가리학을 접해\n본다면 폭넓은 관심과 방향성을 가지고 전공 공부를 시작할 수 있습\n니다. \n-  헝가리어 자체에 대해 관심이 있다면, 우리 학교의 <특수어교육진흥\n원>에서 일반인을 대상으로 진행하는 온라인 헝가리어 수업을 듣는 \n것을 추천합니다. 중학생부터 헝가리 파견 주재원까지 구성원의 특성\n에 따라 분반하여 연 2회 12주의 강좌를 진행하고 있습니다.\n우리 학과(부)·전공 매력 \n-  국내 대기업의 대규모 헝가리 투자로 인한 높은 취업률\n-  교육부의 특수외국어 제정 및 프로그램 지원 학과\n-  선후배 간의 튜터링 및 방중 헝가리어 무료 온오프라인집중과정 등 다\n양한 학습 프로그램\n-  자격증 취득 가능: 헝가리어 FLEX 공인 인증 시험, ECL 헝가리어 공\n인 인증 시험\n주요 실적 \n-  특수외국어 교육진흥법의 특수외국어 교육학과\n-  EcoProBM과 업무협약 MOU 체결 \n-  헝가리 법인 삼성 SDI, 헝가리 법인 삼성전자, 주헝 한국문화원 등과\n의 인턴 협약\n-  유럽공인인증시험 ECL 헝가리어 시험 센터 구축\n-  헝가리 국립 시청각 자료 이용 가능한 한국 센터 구축', '[서울]2025-1학기 폐강(2차) 공고(서울캠퍼스)\n\n[서울]2025-1학기 폐강(2차) 공고(서울캠퍼스)\n\n2025-1학기 폐강(2차) 공고(서울캠퍼스)\n\n2025학년도 제1학기 서울캠퍼스 폐강(2차) 강좌를 아래와 같이 공고하오니\n\n해당 강좌 수강생은 기간 내에 수강신청을 변경하시기 바랍니다.\n\n- 아\xa0\xa0 래 -\n\n■ 폐강(2차) 강좌 수강생 수강신청 변경 안내\n\n1. 변경 기간 : 2025. 3. 14.(금) ~ 3. 18.(화), 오후 4시까지\n\n※ 3. 18.(화) 오후 4시까지 수신된 이메일에 한하여 접수하오니 기한 내 이메일 발송\n\n2. 신청 방법 : 신청서 작성 후 이메일 제출\n\n가. 신청서 : 붙임의 “폐강과목 대체 수강 신청서” 다운로드\n\n나. 제출처 : 본인 1전공 소속 단과대학 교학파트 제출 (※ 전공/교양 모두 작성 제출)\n\n단과대학\n\n이메일\n\n전화문의\n\n창구\n\n서양어대학, 중국학대학, 일본학대학\n\nhana@hufs.ac.kr\n\n02) 2173 - 2121\n\n5번\n\n사회과학대학, 상경대학, 경영대학,\n\n국제학부, LD학부, LT학부, KFL학부\n\nhaksa6@hufs.ac.kr\n\n02) 2173 - 2308\n\n6번\n\n영어대학, 아시아언어문화대학,\n\nAI융합대학\n\nhaksa7@hufs.ac.kr\n\n02) 2173 - 2264\n\n7번\n\n사범대학\n\npoisson@hufs.ac.kr\n\n02) 2173 - 2338\n\n4번\n\n자유전공학부(서울)\n\nhaksaseoul@hufs.ac.kr\n\n02) 2173 - 2109\n\n9번\n\n3. 유의 사항\n\n가. 폐강된 과목의 수강은 자동 취소됨\n\n나. 폐강된 과목 수와 동일한 과목 수 만큼 신청 가능 (단, 최대 수강신청 학점 초과 불가)\n\n다. 수강신청 변경 시점 기준으로 제한 인원을 초과하지 않는 과목으로 변경 가능\n\n※ 수강 가능 강좌(신청/제한인원) 확인 방법 : ▶ “강의시간표 조회” 바로가기\n\n■ 2025학년도 제1학기 폐강(2차) 강좌 현황\n\n개설학과\n\n이수\n\n영역\n\n학년\n\n학수번호\n\n교과목명\n\n학점\n\n시간\n\n교강사명\n\n강의시간\n\n독일어과\n\n전공\n\n2', '(공통)2025-1학기 이중전공 신청 일정 공고\n\nssai@hufs.ac.kr\n\nLanguage & AI 융합학부\n\n02-2173-2278\n\nhufs_langai@hufs.ac.kr\n\n라 . 부전공 희망자 및 단일전공 희망자 의 경우 추후 종합정보시스템으로 별도 신청 예정\n\n※ 자세한 일정은 2025 년 7 월 중순 학사공지 예정인 “ 부전공 신청 및 이중전공 / 부전공 취소 일정 ” 확인\n\n마 . ( 이중전공 신청에 따라 ) 이수구분 수정이 필요한 경우 학사종합지원센터 홈페이지 서식 함의 “ 이수구분 변경 신청서 ” 를 작성하여 제출 바람 ( ※ 상시 제출 가능 )\n\n▶ ( 서울 ) 이수구분 변경 신청서 바로가기\n\n▶ ( 글로벌 ) 이수구분 변경 신청서 바로가기\n\n2025. 5.\n\n교무처장\n\n| 0 |\n|:----------------------------------------------------------------------------------------------------------------------------------------------------------------------------------------------------------------------------------------------|\n| [참고] 이중전공 변경 신청 1) 매 학기 별도 신청 기간(5월 초, 11월 초)을 공지하고 이중전공 변경 신청을 진행함 2) 본인 학번대에 여석이 있는 경우에만 신청 가능하며, 여석이 없으면 신청 불가 (신청 기간 공지 시 학번별/학과(부)별 여석 별도 안내) |', '## [paragraph] ##\n나. 처리절차\n\n## [paragraph] ##\n1) 유고결석·결시 공통 안내사항\n\n## [paragraph] ##\n* 질병 및 상해의 경우 의원에서 발급받은 서류는 해당되지 않음\n(병원급 의료 기관 확인 : 건강보험심사평가원(https://www.hira.or.kr)\n\n## [paragraph] ##\n⇒ 검색창에서 병원이름 기입 후 검색 ⇒ 검색결과에서 해당병원 클릭\n⇒ 병원 기본정보 중 병원구분에서 병원등급 확인\n\n## [paragraph] ##\n** 질병관리청의 법정감염병 확인(https://dportal.kdca.go.kr)\n(질병관리청 감염병 포털 -> 감염병정보 -> 법정감염병에서 병명 확인)\n\n## [paragraph] ##\n2) 유고결석(수업 결석) : 사유발생 시 담당교수에게 알리고, 유고사유가 끝난 날부터\n7일 이내 증빙서류를 제출해야 함.\n(해당학기 졸업가능한 조기취업자는 입사확정 후 즉시 제출)\n\n## [table] ##\n| 사유 | 기간 | 증빙서류 | 절차 | 비고 |\n| --- | --- | --- | --- | --- |\n| 직계존비속, 배우자 및 형제 자매의 사망 | 7일 이내 (중간 공휴일 포함) | 사망진단서, 가족관계증명서 등 | 담당교수에게 증빙서류 제출 |  |\n| 본인의 결혼 | 7일 이내 (중간 공휴일 포함) | 청첩장, 예식장계약서 등 | 담당교수에게 증빙서류 제출 |  |\n| 징병검사, 입대지원시험 및 예비군 훈련 | 해당기간 | 소집영장사본 또는 징병검사 통지서사본, 교육필증 등 | 담당교수에게 증빙서류 제출 |  |\n\n## [footer] ##\n- 68 -']","일본어통번역학과(일통)의 FLEX 시험 점수 제출 기간은 해당학과 사무실에 문의하셔야 합니다. 일반적으로 FLEX 시험 성적은 졸업시험 응시원서 제출 마감일인 2025년 4월 23일(수)까지 제출해야 할 수 있습니다. 

정확한 제출 기간과 세부 사항은 일본어통번역학과 사무실에 직접 문의하시기 바랍니다. 혹시 더 도와드릴까요?",졸업시험 점수 제출 기간은 공지사항에 따라 각 학과 사무실로 문의해야 합니다. 추가적인 질문이 있으시면 말씀해주세요.,0.7695053383595359,0.5,,0.0
"글스산 세부전공 신청해야되는데, 신청기간이랑 방법 알 수 있어? 그리고 결과는 언제나와?","['[글로벌] 이수구분변경 신청 방법 안내\n\n다. 이수구분 신청 전, 전공교류교과목을 수강편람에서 확인하고 문의 사항이 있을 경우 신청전 미리 상담 (수강편람 확인 클릭)\n\n라. 신청 후 3~4일 (평일 기준) 이후\xa0종합정보시스템에서 변경결과를 반드시 확인하고 변경이 안된 경우, 담당자에게 연락하여 반드시 확인', '[글로벌] 이수구분변경 신청 방법 안내\n\n[글로벌] 이수구분변경 신청 방법 안내\n\n이수구분변경 신청 방법\n\n1. 시기\n\n가. 졸업학기 졸업사정일 전까지\n\n나. 당해 학기 수강신청건에 대해서는 성적 취득후 신청 권장\n\n2 . 제출처\n\n본인의 1전공 단과대학\n\n이메일 제출\n\n문의 전화\n\n방문 제출\n\n인문대학, 통번역대학, 융합인재대학\n\nhaksa4077@hufs.ac.kr\n\n031-330-4077\n\n학생회관 109호\n\n국가전략언어대학, 국제지역대학, 자유전공학부(글로벌)\n\nlsh0613@hufs.ac.kr\n\n031-330-4457\n\n경상대 학, Culture& Technology융합대학,\n\nAI융합대학(글로벌), 기후변화융합학부,\n\nminsun@hufs.ac.kr\n\n031-330-4953\n\n자연과학대학, 공과대학, 바이오메디컬공학부\n\nyyj1730@hufs.ac.kr\n\n031-330-4073\n\n3.\xa0제출 서류 : 첨부파일(이수구분 변경신청서) 다운로드 후, 작성하여 제출\n\n4.\xa0유의사항\n\n가. 이중(부)전공이 글로벌캠퍼스일 경우, 본인의 1전공 단과대학 담당자에게 제출\n\n나 . 이중(부)전공이 서울캠퍼스일 경우, 본인의 서울캠퍼스\xa0담당자에게 제출 (담당자 확인 클릭)\n\n다. 이수구분 신청 전, 전공교류교과목을 수강편람에서 확인하고 문의 사항이 있을 경우 신청전 미리 상담 (수강편람 확인 클릭)\n\n라. 신청 후 3~4일 (평일 기준) 이후\xa0종합정보시스템에서 변경결과를 반드시 확인하고 변경이 안된 경우, 담당자에게 연락하여 반드시 확인', '[공통] 후기이중전공 신청 공고\n\n[공통] 후기이중전공 신청 공고\n\n(공통) 후기이중전공 신청 공고\n\n2025학년도 후기이중전공 신청 일정 및 방법 등을 공고합니다.\n\n1. 신청기간: 2025 4. 14.(월) 10:00 ~ 4. 18.(금) 16:00까지\n\n2. 신청대상: 현재 7~8학기 이수중인 자로, 후기이중전공을 희망하는 전공을 부전공으로 이수중인 자\n\n(7학기를 마치고 휴학한 학생도 이번 신청기간에 신청할 것)\n\n3. 신청방법: 인터넷 종합정보시스템에서 신청 (로그인 > 전공/교직관리 > 후기이중전공신청)\n\n4. 허가자 발표: 7월초 홈페이지 공고(예정)\n\n5. 기타사항\n\n가. 1년에 1회, 4월에만 신청하므로 반드시 희망자는 이번 신청 일정을 따를 것\n\n나. 지원학과 입학정원의 50 ~ 150% 이내에서 학과 자율 선발하되, 학과에서 요구하는 기본 자격요건 미충족 시 탈락될 수 있음\n\n(세부 배정기준은 지원학과 학과장실 문의 또는 학과 홈페이지 참조)\n\n다. 이수자 선발 이후 8학기까지 전공심화(+부전공) 또는 일반 부전공에 맞는 졸업에 필요한 졸업학점 요건을 모두 완료하여야 최종적으로 허가\n\n라. 조기졸업대상자, 학석사연계과정/석사예약제 이수자는 신청 불가(신청 희망 시 내방하여 해당 자격 취소처리 후 신청)\n\n마. 후기이중전공으로 선발되면 추가학기를 1학기 이상 무조건 등록, 수강해야 하며 등록금은 후기이중전공 학과의 등록금으로 납부해야 함\n\n바. 기타 자세한 사항은 전자규정집 ""이중전공시행규정"" 참조\n\n2025. 4.\n\n교무처장\n\n| 0 |\n|:------------------------------|\n| (공통) 후기이중전공 신청 공고 |', '[글로벌] 학부/계열 입학생 학과·세부전공·모듈 신청 공고-글로벌자유전공학부/인문과학계열(\n\n[글로벌] 학부/계열 입학생 학과·세부전공·모듈 신청 공고-글로벌자유전공학부/인문과학계열(\n\n[ 글로벌 ] 학부 / 계열 입학생 학과 · 세부전공 · 모듈 신청 공고\n\n학부 / 계열 입학생 학과 · 세부전공 · 모듈 신청 일정을 아래와 같이 공고함 .\n\n1. 대상\n\n가 . 인문과학계열 광역모집 학생 중 1 학 년 2 학기 진급 예정자\n\n나 . 영어통번역학부 2018 학번 ( 포함 ) 이후 학생 중 3 학년 진급 예정자\n\n다 . 아프리카학부 학생 중 1 학년 2 학기 진급 예정자\n\n라 . 글로벌스포츠산업학부 학생 중 2 학년 진급 예정자 (2024 학번부터 )\n\n마 . 융합인재학부 학생\n\n① 필수세부모듈 : 2 학년 진급 예정자\n\n② 선택세부모듈 : 2 학년 진급 예정자\n\n바 . 글로벌자유전공학부 학생 중 2 학년 진급 예정자\n\n2. 신청기간 : 2025. 5. 26.( 월 ) 10:00 ～ 5. 30.( 금 ) 16:00\n\n※ 신청기간 이후 추가 신청 및 변경 절대 불가\n\n3. 신청방법 : 종합정보시스템 → 전공 / 교직관리 → 1 전공 신청\n\n4. 배정원칙 : 학부 / 계열 배정 기준에 따름\n\n5. 유의사항\n\n가 . 인문과학계열 광역모집 및 아프리카학부 학생은 반드시 3 지망까지 신청\n\n나 . 영어통번역학부 : 2020 학번 이전 학생 3 지망까지 신청 / 2021 학번 이후 학생 2 지망까지 신청\n\n※ 세부전공 개편에 따라 2021 학번부터는 영미문학 · 번역전공 / TESOL 영어학전공만 신청 가능\n\n다 . 융합인재학부 : 필수모듈 4 지망까지 , 선택모듈 8 지망까지 모두 신청\n\n라 . 글로벌자유전공학부 : 1 지망 신청\n\n※ 신청기간 내 미신청 시 학부에서 임의 배정 함 .( 배정 내역 추후 변경 불가 )\n\n6. 배정확정 : 2025 년 7 월 중 (1 학기 성적 반영 완료 후 )\n\n2025. 5.\n\n글로벌캠퍼스 교무처장', '다. 이수구분 신청 전, 전공교류교과목을 수강편람에서 확인하고 문의 사항이 있을 경우 신청전 미리 상담 (수강편람 확인 클릭)\n\n라. 신청 후 3~4일 (평일 기준) 이후\xa0종합정보시스템에서 변경결과를 반드시 확인하고 변경이 안된 경우, 담당자에게 연락하여 반드시 확인', '▶ ( 글로벌 ) hufsdbl@hufs.ac.kr 로 이메일 제출\n\n2. 일 정\n\n가 . 신청 기간 : 2025 년 1 월 22 일 ( 수 ) 10 시 ~ 1 월 23 일 ( 목 ) 14 시\n\n※ 안내된 기간에만 운영하므로 일정 준수할 것 ( 이후 별도 운영 계획 없음 )\n\n나 . 결과 확인 : 2025 년 1 월 24 일 ( 금 ) 14 시 , 종합정보시스템\n\n3. 신청 방법 : 종합정보시스템 → 전공 / 교직관리 ( ※ 가 . / 나 . 중 하나의 방법으로 신청 )\n\n가 . 부전공 신청 : 전공심화 + 부전공 또는 부전공 신청\n\n1) 신청 시 기존에 이수 중인 이중 / 부전공 은 자동 취소 됨 ( ※ 별도 취소 절차 없음 )\n\n2) “4. 유의 사항 ” 의 다 . 참고 하여 부전공 신청으로 인한 이수구분 변경 신청\n\n※ 이번 학기 졸업예정자 (4 학년 수료 , 졸업대기 포함 ) 는 1 월 초 까지\n\n이수구분 변경을 신청하여 졸업 학점이 누락되는 일이 없도록 해야 함', '가 . 해당학과 : 자세한 사항은 첨부파일 참조\n\n나 . 시험일자 : 2025. 5. 24( 토 ) 오전 10:00 서울캠퍼스 시행예정\n\n※ 정확한 시간 / 장소는 추후 통지\n\n다 . 접수기간 : 2025. 4. 16.( 수 ) ~ 4. 23.( 수 ) 해당학과 사무실에 신청 ( 기한 이후 추가 신청 불가 )\n\n* 7 학기 이상 재적생만 신청가능\n\n8. 유의 사항\n\n가 . 졸업시험 및 졸업논문 심사에 통과한 자는 졸업 시까지 그 자격이 유효함 ( 단 , 학적을 상실한 때에는 그 자격을 인정하지 아니함 )\n\n나 . 제 2 전공 , 이중전공자도 해당학과 문의 / 학과에 따른 졸업시험 응시 , 논문 제출 등 pass 하기 바람\n\n다 . 졸업시험 응시원서 제출 시 학생 본인의 연락처를 정확히 기재할 것', '[글로벌] 학부/계열 입학생 학과·세부전공·모듈 신청 공고-글로벌자유전공학부/인문과학계열(\n\n다 . 융합인재학부 : 필수모듈 4 지망까지 , 선택모듈 8 지망까지 모두 신청\n\n라 . 글로벌자유전공학부 : 1 지망 신청\n\n※ 신청기간 내 미신청 시 학부에서 임의 배정 함 .( 배정 내역 추후 변경 불가 )\n\n6. 배정확정 : 2025 년 7 월 중 (1 학기 성적 반영 완료 후 )\n\n2025. 5.\n\n글로벌캠퍼스 교무처장\n\n| 0 |\n|:-------------------------------------------------------|\n| [글로벌] 학부/계열 입학생 학과·세부전공·모듈 신청 공고 |', '2) 자세한 내용은 학사공지 게시글 제목을 “시간차”로 검색 : 게시글 바로가기 Click▶\n\n3. 관련 사이트 안내\n\n구 분\n\n서울캠퍼스\n\n글로벌캠퍼스\n\n★ 신입생 및 편입생 일반교육\n\n동영상\n\n동영상 보기 Click▶\n\n교육자료\n\n교육자료(서울) Click▶\n\n교육자료(글로벌) Click▶\n\n★ 신입생 및 편입생 학번확인\n\n신입생 - 2월 21일(금) 이후부터 확인 가능\n\n편입생 – 2월 22일(토) 이후부터 확인 가능\n\n바로가기 Click▶\n\n강의시간표·강의계획서\n\n핫링크\n\n강의시간표 Click▶\n\n수강편람\n\n핫링크\n\n수강편람(서울) Click▶\n\n수강편람(글로벌) Click▶\n\n전공 교육과정 안내\n\n종합정보\n\n시스템\n\n종합정보시스템 로그인 → 학과(부) 교육과정 안내도 메뉴\n\n※ 각 전공의 전체교과목 및 최근 개설된 강좌 정보 확인 가능\n\n예비수강신청함 바로가기\n\n핫링크\n\n바로가기 Click▶\n\n수강신청 바로가기\n\n핫링크', '[공통] 2025-1학기 수강신청 안내\n\n마. 글로벌캠퍼스 강의실 배정\n\n▶ 수강 신청 전 강의실 배정이 어려운 관계로 수강 신청 시 추후 건물 이동 동선 참고\n\n계열/학과\n\n건물\n\n인문·경상계열\n\n인문·경상관\n\n어문계열\n\n어문관 / 교양관\n\n자연계열\n\n자연관 / 백년관\n\n공학계열\n\n공학관\n\n교양\n\n교양관(대학영어, RC는 백년관)\n\n융합인재대학 / 융합전공 / 서울캠퍼스 학과 개설 / 신설학부\n\n교양관 / 백년관\n\n※ 참고용이며, 사정에 따라 변동될 수 있음\n\n5. 수강신청 관련 FAQ\n\n질문\n\n답변\n\n제한인원 증원 여부\n\n전공/이중(부)\n\n개설학과 문의 ☎바로가기 Click▶\n\n(각 학과에서 증원 여부 결정 및 증원 처리)\n\n교양\n\n증원 불가\n\n온라인으로 수강신청하지 못한 과목을 교수님께 허락(사인)받아 수강할 수 있는지 여부\n\n불가\n\n① 모든 과목은 수강신청(변경)기간에 학생 본인이 온라인으로 수강신청 해야 함', '4.\xa0유의사항\n\n가. 이중(부)전공이 글로벌캠퍼스일 경우, 본인의 1전공 단과대학 담당자에게 제출\n\n나 . 이중(부)전공이 서울캠퍼스일 경우, 본인의 서울캠퍼스\xa0담당자에게 제출 (담당자 확인 클릭)\n\n다. 이수구분 신청 전, 전공교류교과목을 수강편람에서 확인하고 문의 사항이 있을 경우 신청전 미리 상담 (수강편람 확인 클릭)\n\n라. 신청 후 3~4일 (평일 기준) 이후\xa0종합정보시스템에서 변경결과를 반드시 확인하고 변경이 안된 경우, 담당자에게 연락하여 반드시 확인', '[공통] 후기이중전공 신청 공고\n\n[공통] 후기이중전공 신청 공고\n\n(공통) 후기이중전공 신청 공고\n\n2025학년도 후기이중전공 신청 일정 및 방법 등을 공고합니다.\n\n1. 신청기간: 2025 4. 14.(월) 10:00 ~ 4. 18.(금) 16:00까지\n\n2. 신청대상: 현재 7~8학기 이수중인 자로, 후기이중전공을 희망하는 전공을 부전공으로 이수중인 자\n\n(7학기를 마치고 휴학한 학생도 이번 신청기간에 신청할 것)\n\n3. 신청방법: 인터넷 종합정보시스템에서 신청 (로그인 > 전공/교직관리 > 후기이중전공신청)\n\n4. 허가자 발표: 7월초 홈페이지 공고(예정)\n\n5. 기타사항\n\n가. 1년에 1회, 4월에만 신청하므로 반드시 희망자는 이번 신청 일정을 따를 것\n\n나. 지원학과 입학정원의 50 ~ 150% 이내에서 학과 자율 선발하되, 학과에서 요구하는 기본 자격요건 미충족 시 탈락될 수 있음\n\n(세부 배정기준은 지원학과 학과장실 문의 또는 학과 홈페이지 참조)', '※ 5 월 26 일 ( 월 ) ~ 5 월 30 일 ( 금 ) 예정\n\n단 , 해당 기간에 신청하지 않으면 다음 학기부터 이중전공 변경 신청으로만 가능함\n\n2. 신청 기간 : 2025 년 5 월 12 일 ( 월 ) 10 시 ~ 5 월 16 일 ( 금 ) 16 시\n\n※ 안내된 기간에만 신청 / 변경 / 삭제 가능하므로 일정 준수할 것 ( 이후 별도 운영 계획 없음 )\n\n3. 신청 방법 : 종합정보시스템 → 전공 / 교직관리 → 이중전공 변경신청\n\n※ 1 지망만 신청 가능 , 신청 완료후 다시 조회하여 신청 결과를 반드시 확인할 것\n\n※ 제한사항\n\n가 . 신청할 학과 ( 부 )/ 전공의 본인 학번대에 여석이 없는 경우 신청 불가\n\n나 . 캠퍼스 간 이중전공을 희망하는 경우 아래의 제한학과로는 신청 불가\n\n서울캠퍼스\n\n( 글로벌캠퍼스 학생 신청 불가 학과 )\n\n글로벌캠퍼스\n\n( 서울캠퍼스 학생 신청 불가 학과 )\n\n영어대학 각 학과 ( 전공 )\n\n※ 글로벌캠퍼스 2023 학번부터 가능', '[공통] 후기이중전공 신청 공고\n\n[공통] 후기이중전공 신청 공고\n\n(공통) 후기이중전공 신청 공고\n\n2025학년도 후기이중전공 신청 일정 및 방법 등을 공고합니다.\n\n1. 신청기간: 2025 4. 14.(월) 10:00 ~ 4. 18.(금) 16:00까지\n\n2. 신청대상: 현재 7~8학기 이수중인 자로, 후기이중전공을 희망하는 전공을 부전공으로 이수중인 자\n\n(7학기를 마치고 휴학한 학생도 이번 신청기간에 신청할 것)\n\n3. 신청방법: 인터넷 종합정보시스템에서 신청 (로그인 > 전공/교직관리 > 후기이중전공신청)\n\n4. 허가자 발표: 7월초 홈페이지 공고(예정)\n\n5. 기타사항\n\n가. 1년에 1회, 4월에만 신청하므로 반드시 희망자는 이번 신청 일정을 따를 것', '[글로벌] 이수구분변경 신청 방법 안내\n\n[글로벌] 이수구분변경 신청 방법 안내\n\n이수구분변경 신청 방법\n\n1. 시기\n\n가. 졸업학기 졸업사정일 전까지\n\n나. 당해 학기 수강신청건에 대해서는 성적 취득후 신청 권장\n\n2 . 제출처\n\n본인의 1전공 단과대학\n\n이메일 제출\n\n문의 전화\n\n방문 제출\n\n인문대학, 통번역대학, 융합인재대학\n\nhaksa4077@hufs.ac.kr\n\n031-330-4077\n\n학생회관 109호\n\n국가전략언어대학, 국제지역대학, 자유전공학부(글로벌)\n\nlsh0613@hufs.ac.kr\n\n031-330-4457\n\n경상대 학, Culture& Technology융합대학,\n\nAI융합대학(글로벌), 기후변화융합학부,\n\nminsun@hufs.ac.kr\n\n031-330-4953', '| 제출마감일 | 재학기간 동안\xa01회,\xa0외국어 인증 신청서를 제출하고자 하는 학기 말까지 ※\xa0졸업예정자는 졸업하고자 하는 최종 학기 말까지 반드시 제출해야함. | 재학기간 동안\xa01회,\xa0외국어 인증 신청서를 제출하고자 하는 학기 말까지 ※\xa0졸업예정자는 졸업하고자 하는 최종 학기 말까지 반드시 제출해야함. | 재학기간 동안\xa01회,\xa0외국어 인증 신청서를 제출하고자 하는 학기 말까지 ※\xa0졸업예정자는 졸업하고자 하는 최종 학기 말까지 반드시 제출해야함. | 재학기간 동안\xa01회,\xa0외국어 인증 신청서를 제출하고자 하는 학기 말까지 ※\xa0졸업예정자는 졸업하고자 하는 최종 학기 말까지 반드시 제출해야함. |\n| 제출처 | 학생의\xa01전공 소속 단과대학 담당에게\xa0E-mail\xa0제출 | 학생의\xa01전공 소속 단과대학 담당에게\xa0E-mail\xa0제출 | 학생의\xa01전공 소속 단과대학 담당에게\xa0E-mail\xa0제출 | 학생의\xa01전공 소속 단과대학 담당에게\xa0E-mail\xa0제출 |', '[공통] 2025-1학기 수강신청 안내\n\n마. 글로벌캠퍼스 강의실 배정\n\n▶ 수강 신청 전 강의실 배정이 어려운 관계로 수강 신청 시 추후 건물 이동 동선 참고\n\n계열/학과\n\n건물\n\n인문·경상계열\n\n인문·경상관\n\n어문계열\n\n어문관 / 교양관\n\n자연계열\n\n자연관 / 백년관\n\n공학계열\n\n공학관\n\n교양\n\n교양관(대학영어, RC는 백년관)\n\n융합인재대학 / 융합전공 / 서울캠퍼스 학과 개설 / 신설학부\n\n교양관 / 백년관\n\n※ 참고용이며, 사정에 따라 변동될 수 있음\n\n5. 수강신청 관련 FAQ\n\n질문\n\n답변\n\n제한인원 증원 여부\n\n전공/이중(부)\n\n개설학과 문의 ☎바로가기 Click▶\n\n(각 학과에서 증원 여부 결정 및 증원 처리)\n\n교양\n\n증원 불가\n\n온라인으로 수강신청하지 못한 과목을 교수님께 허락(사인)받아 수강할 수 있는지 여부\n\n불가\n\n① 모든 과목은 수강신청(변경)기간에 학생 본인이 온라인으로 수강신청 해야 함\n\n② 전공/이중(부)전공 담당 교수님이 제한인원을 초과하여 수강을 허용하는 경우 반드시 개설학과의 수업담당 조교가 제한인원 증원 후 학생 본인이 온라인으로 수강신청 해야 함\n\n③ 교양은 증원 불가\n\n강의시간표 비고 내용 및\n\n수강신청 허용/제한 문의\n\n개설학과 문의 ☎바로가기 Click▶\n\n기타 학사 문의\n\n(본인 1전공 단과대학 교학과 문의)\n\n서양어대학, 중국학대학, 일본학대학\n\n02 – 2173 - 2121\n\n사회과학대학, 상경대학,\n\n경영대학, 국제학부, LD/LT학부, KFL학부\n\n02 – 2173 – 2308\n\n영어대학, 아시아언어문화대학, AI융합대학\n\n02 – 2173 - 2264\n\n자유전공학부(서울)\n\n02 – 2173 - 2109\n\n사범대학\n\n02 – 2173 - 2338\n\n공과대학, 자연과학대학, 바이오메디컬공학부\n\n031 – 330 - 4073\n\n자유전공학부(글로벌), 기후변화융합학부, AI융합대학\n\n031 – 330 - 4953\n\n국가전략언어대학, 동유럽학대학, 국제지역대학, C&T융합대학\n\n031 – 330 - 4457\n\n경상대학', '[서울] 학부 세부전공 배정 확정(프랑스어/미디어커뮤니케이션/ KFL/중국언어문화학부)\n\n[서울] 학부 세부전공 배정 확정(프랑스어/미디어커뮤니케이션/ KFL/중국언어문화학부)\n\n(서울) 학부 세부전공 배정 확정\n\n서울캠퍼스 학부 세부전공 배정 결과를 아래와 같이 공고함\n\n- 아\xa0\xa0\xa0\xa0\xa0 래 -\n\n1. 대\xa0\xa0\xa0 상 : 미디어커뮤니케이션학부 학생 중 3학년 진급예정자\n\n프랑스어학부\xa0학생 중\xa03학년 진급예정자(프랑스어학부\xa0이중전공자\xa0포함)\n\nKFL 학부/중국언어문화학부 학생 중 2학년 진급예정자\n\n2. 확 인 : 종합정보시스템 → 전공/교직관리 → 전공신청 → 안내사항\n\n3. 배정원칙\n\n-\xa0학부 배정 기준에 따름\n\n- 추후 변경 절대 불가\n\n- 미신청자는 학부에서 학부기준에 따라\xa0임의 배정 하였음(추후 변경\xa0절대\xa0불가)\n\n2025.\xa01. 21.\n\n서울캠퍼스 교무처장', '[서울] 학부 세부전공 신청 일정 공고(프랑스어/미디어커뮤니케이션/중국언어문화/KFL학부\n\n[서울] 학부 세부전공 신청 일정 공고(프랑스어/미디어커뮤니케이션/중국언어문화/KFL학부\n\n[서울] 학부 입학생 세부전공 신청 일정 공고\n\n학부 입학생 세부전공 신청 일정을 아래와 같이 공고함.\n\n- 아\xa0\xa0\xa0\xa0\xa0 래 -\n\n1. 대\xa0\xa0\xa0 상 : 미디어커뮤니케이션학부 학생 중 3학년 진급예정자(현 4학기 재학생)\n\n프랑스어학부 1전공생 및 이중전공생 중 3학년 진급예정자(현 4학기 재학생)\n\n중국언어문화학부 및 KFL학부 학생 중 2학년 진급예정자(현 2학기 재학생)\n\n2. 기\xa0\xa0\xa0 간 : 2025.\xa05. 26.(월) 10:00 ～\xa05.\xa030.(금) 16:00\n\n※ 신청기간 이후 추가 신청 및 변경 절대 불가\n\n3. 신청방법 : 종합정보시스템 → 전공/교직관리 → 1전공 신청\n\n단. 프랑스어학부 이중전공생(3학년 진급예정자)은 신청 시작일 오전에\xa0개별 이메일(세부전공 신청서) 발송 (종합정보시스템에 입력된 이메일 주소로 발송됨)\n\n4. 배정원칙 : 학부 배정 기준에 따름\n\n5. 유의사항 : 미디어커뮤니케이션학부, 프랑스어학부 학생은 반드시 3지망까지 신청해야함\n\n중국언어문화학부, KFL학부 학생은 반드시 2지망까지 신청해야함\n\n* 신청기간 내 미신청 시 학부에서 임의 배정 함(배정 내역 추후 변경 불가)\n\n6. 배정확정 : 2025년 7월 중(2025-1학기 성적반영 완료 후)\n\n2025.\xa0\xa05.\xa0\xa021.\n\n서울캠퍼스 교무처장', '도 있는 커리큘럼 제공\n-  금융 수학에 대한 전문성 높은 커리큘럼 제공\n-  꾸준한 임용시험 합격자를 배출\n주요 실적 \n-  한국산업응용수학회와 국가수리과학연구소 공동 주최 2023년 KSIAM \n-NIMS Math Challege에서 한국외대 수학과 학생 3명과 수학이중전\n공 1명으로 구성된 익숙한첫만남팀 우수상 수상\n-  중등임용시험 2022년 2명, 2018년 4명, 2016년 2명 합격\n-  2022년 보험계리사 시험에서 졸업생 1명 합격\n-  한국외대 수학과 최영수 교수: 전 한국파생상품학회 회장, 현 한국거\n래소 파생상품발전위원회 위원장 \n주요 전공과목 \n-  해석학 개론 1과 2: 함수, 수열, 극한, 미분과 적분과 같은 수학의 개\n념을 정확하게 정의하고, 관련한 결과를 엄밀하게 증명하는 과목입니\n다. 본 과목은 비단 수학뿐만 아니라 고도화되어 다양한 수학적 개념\n과 결과가 적용되는 다양한 분야를 이해하고, 공부하기 위한 단단한 \n기반을 제공합니다. \n-  선형대수 및 연습 1 과 2: 행렬과 백터공간 그리고 선형함수를 주로 다\n루는 수학의 분야이며, 다양한 분야에서 널리 사용되고 있습니다. 특\n히 기계학습을 공부하기 위해서 다변수해석학과 더불어 반드시 공부\n해야 하는 분야입니다.\n-  수리금융학: 선도/선물계약과 옵션계약에서 상품평가와 헤징의 방법\n을 배우는 등 재무에 관련된 구체적이고 다양한 예시를 통해 파생 금\n융 상품의 전반적인 내용을 다루는 과목입니다. 우리 과는 그 외에도 \n보험수학과 채권수학 등 금융 분야를 희망하는 학생을 위한 과목들\n이 있습니다.\n-  컴퓨팅 사고 입문: 컴퓨터 과학 및 알고리즘의 기본 개념과 문제해결\n하는 방법에 중점을 둔 과목으로 동적계획법, 다양한 알고리즘, 자료\n구조에 관련한 내용을 다룹니다. 관련하여 더 심화된 내용을 다루는 \n알고리즘 및 계산이론이라는 과목도 있습니다.\n-  수학으로 이해하는 계산학습1 과 2: 단단한 수학 전공지식을 바탕으\n로 깊이 있는 기계학습의 내용을 두 학기를 걸쳐 다룹니다. 확률 그래\n프 모델, kernel 방법론, VC 차원과 같은 고전적인 내용부터 latent \nstable diffusion, transformer 그리고 CLIP과 같은 최근 모델까지 \n학생들이 전공 수학을 통해 꼼꼼하게 학습하고, 실습할 수 있도록 하\n고 있습니다. 또한 우리 학과는 1학년 과목인 논리 및 기초 프로그래', '2025-1학기 중간 강의평가 실시 안내\n\n2025-1학기 중간 강의평가 실시 안내\n\n2025-1학기 중간\xa0강의평가 실시 안내\n\n2025 학년도 1 학기\xa0중간\xa0강의평가를 다음과 같이 실시합니다 .\n\n우리 대학 강의의 질 개선을 위해 중간 강의평가를 실시하오니, 학생 여러분은 아래의 안내에 따라 참여해주시기 바랍니다. 중간 강의평가 제도는 강의가 실제로 이루어지는 학기 중에 강의평가를 실시함으로써, 강의에 대한 학생들의 의견을 파악하고, 남은 학기 중 수업의 질적 개선을 도모할 수 있습니다.\n\n1. 평가기간 : 2025.\xa04. 7.( 월 ) 10:00 ~ 2025.\xa04.\xa025.( 금 ) 17:00\n\n2. 평가대상 : 2025 학년도 1 학기 개설 강좌\n\n3. 평가방법 : 홈페이지 핫링크 “2025-1 학기\xa0중간\xa0강의평가 바로가기 ”\n\n4. 유의사항\n\n- 중간 강의평가에 대한 학생의 수행 여부는 선택 사항입니다.\n\n-\xa0강의평가를 완료하고 저장하면 어따한 경우에도\xa0수정이 불가능합니다 .\n\n- 강의평가 결과는 익명 ( 출석부 순서가 아님 ) 으로 처리되어 담당 교원에게 공개합니다 .\n\n- 서술형 평가의 답변도 담당 교강사에게 익명으로 공개되니 좋았던 점과 개선할 점에 대해 구체적으로 기재해주시기 바랍니다 .\n\n- 건전한 소통을 위해 상대방을 존중하는 표현을 사용해주시고 , 비속어 , 비하적 표현은 삼가해 주시기 바랍니다 .\n\n교육혁신원', '[글로벌]학과(세부전공·모듈) 배정 확정공고 - 글로벌자유전공학부/영어통번역학부/융합인재학\n\n[글로벌]학과(세부전공·모듈) 배정 확정공고 - 글로벌자유전공학부/영어통번역학부/융합인재학\n\n[글로벌] 학과·세부전공·필수/선택세부모듈 배정 확정 공고\n\n[ 글로벌 ] 학과 · 세부전공 · 선택세부모듈 배정 확정 공고\n\n글로벌자유전공학부 / 영어통번역학부 / 융합인재학부\n\n입학생의 학과 · 세부전공 · 선택세부모듈 배정 결과를 아래와 같이 공고함 .\n\n- 아 래 -\n\n□ 배정내역 확인 : 종합정보시스템 개별 확인\n\n( 홈페이지 → 종합정보시스템 → 전공 / 교직관리 → 전공신청 → 안내사항 )\n\n2025. 1. 20.\n\n교무처장', '그리고 토론 등의 방법으로 수업을 합니다. 철학은 크게 동양철학\n과 서양철학으로 나뉩니다. 동양철학은 분야에 따라 유가철학, 도\n가철학, 불교철학으로 구분되고, 지역에 따라 한국철학, 중국철학, \n인도철학으로 구분됩니다. 동양철학 공부를 위해서는 한문과 중국\n어, 일본어 그리고 영어를 익히는 것이 좋습니다. 서양철학은 주제\n에 따라 논리학, 인식론, 형이상학, 존재론, 윤리학, 현상학, 해석학, \n언어철학, 과학철학, 심리철학, 미학, 수사학, 논술 등으로 구분됩니\n다. 시대적으로 서양고/중세철학, 서양근/현대철학으로 구분되고 \n지역에 따라 독일철학, 프랑스철학, 영미철학 등으로 구분됩니다. \n이외에 영화와 철학, 문학과 철학, 문화와 철학 등의 응용분야를 공\n부합니다. 서양철학 공부를 위해서는 영어, 프랑스어, 독일어, 희랍\n어, 라틴어 등을 익히는 것이 좋습니다.\nQ2.  한국외국어대학교 철학과만의 특징이 있나요?\nA2.  우리 한국외국어대학교 철학과의 특성을 다른 대학교와 비교해 볼 \n때, 철학을 제1전공으로 하면서 세계 모든 나라의 언어를 제2전공\n으로 하는 것이 가능하기 때문에 세계 어떤 문화권 철학도 공부할 \n수 있는 장점이 있습니다. 그래서 유학을 희망하는 학생들에게 유\n리합니다. 또한, 어학 이외에도 언론, 상경, 사회, 이공계열을 자유\n롭게 부전공, 제2전공 및 복수 전공으로 하여 철학적 사고력을 바\n탕으로 다른 전공에서 실력을 발휘하여 다양한 분야에 진출할 수 \n있습니다. 1988년 교직 과정 인가 이후 많은 동문이 교사 자격증\n을 취득하고 학교 선생님을 하고 있으며, 또 2007년 논술 교육인\n증 프로그램 실시 이후 많은 학생들이 이 자격을 동시에 취득하고 \n졸업하고 있습니다. 특히 논술 교육인증 프로그램은 국내 최초로 \n실시하여 앞으로 MEET, LEET 및 각종 공무원 시험에서 실시되는 \n논술 및 추리논증 시험을 대비하는 데에도 유리합니다.\nQ3.  철학과를 졸업하면 무엇을 하나요?\nA3.  철학과 졸업생들은 전공 공부를 통해 사물을 종합적으로 바라보면\n서도 예리하게 분석하는 안목 그리고 창의적 사유력을 기르게 되\n기 때문에 교직을 비롯하여 언론계, PD, 작가 등으로 많이 진출하\n였으며, 기타 일반 기업체, 금융기관, 국가기관, 영화계, 컴퓨터프\n로그래밍 등 매우 다양한 분야에 진출하고 있습니다.', '들이 담당할 핵심분야는 의료영상시스템/바이오시스템 개발, 의료영상 \n분석을 위한 알고리즘 개발, 디지털헬스케어 시스템 구축, 의료용 로봇 \n등의 기기 개발과 관련한 설계 및 제조에 이릅니다.\nQ&A \nQ1.   바이오메디컬공학부에서는 하드웨어와 소프트웨어 중에 어떤 분야\n를 주로 배우게 되나요?\nA1.   바이오메디컬공학분야에서의 하드웨어는 진단, 치료, 웰니스기기 \n등을 포함하고, 소프트웨어는 의생명데이터, 생체(영상 또는 비영\n상)신호데이터의 분석 및 활용 등을 포함합니다. 바이오메디컬공학\n부에서는 하드웨어와 소프트웨어 분야를 함께 교육합니다. 앞으로\n는 하드웨어와 소프트웨어 분야의 융합을 통해 더 큰 가치를 창출\n할 수 있을 것으로 기대되고 있습니다. 물론, 본인의 적성에 맞추어 \n하드웨어 또는 소프트웨어 분야의 트랙으로 전공과목을 집중하여 \n들을 수도 있습니다.\nQ2.  생명정보학이라는 분야는 무엇이며 실제로 어떤 일을 하게 되나요?\nA2.  생명정보학이라는 분야는 이름에서 알 수 있듯이 의생명 데이터라\n는 정보를 분석하여 새로운 정보를 찾아내는 학문이라고 생각할 수 \n있습니다. 의생명 데이터라는 것이 단순히 DNA와 같은 유전체 데\n이터를 넘어서, DNA, RNA, Protein, microbiome (장내 미생물) \n등에 대한 연구를 포괄한다고 할 수 있습니다. 예를 들면, DNA를 분\n석하여, 유전 질환 관련 변이를 찾아내어 질병의 정확한 진단에 이\n용한다던지, 맞춤형 의료 혹은 정밀 의료라고 일컫는, 즉, 각 개인의 \ngenotype에 따른 치료법을 제시해주는 연구들이 요즘 중요시되고 \n있고, 생명정보학이 이러한 분야를 포괄한다고 말할 수 있습니다. \nQ3.  인공지능은 의료영상처리 분야에서 어떻게 활용될 수 있나요?\nA3.  MRI, CT, x-ray, ultrasound, pathology 등 다양한 종류의 의료영\n상데이터를 생성하는 과정에서도 인공지능이 적용이 될 수 있습니\n다. 인공지능기법을 적용하여 영상의 획득시간을 단축시킬 수도 있\n고, 의료영상의 품질을 관리 및 평가하거나 향상시킬 수도 있습니\n다. 또한, 기존 의료영상데이터로부터 진단에 도움이 되는 정보를 \n추출하는 데에 적용이 될 수 있습니다. 다른 측면으로는 사람의 이\n해하기 어려운 고차원 데이터에 대한 분석을 통해 새로운 정보를 효\n과적으로 추출하는 데에 활용이 될 수도 있습니다.\n글로벌캠퍼스 GLOBAL CAMPUS', '프 모델, kernel 방법론, VC 차원과 같은 고전적인 내용부터 latent \nstable diffusion, transformer 그리고 CLIP과 같은 최근 모델까지 \n학생들이 전공 수학을 통해 꼼꼼하게 학습하고, 실습할 수 있도록 하\n고 있습니다. 또한 우리 학과는 1학년 과목인 논리 및 기초 프로그래\n밍을 통해 그들의 수학 눈높이에서 맞춘 deep learning 교육을 진행\n하고 있습니다.\n학과(부) 특별 프로그램 \n-  매 학기 성적우수자 장학금 지급\n-  졸업 후 진로선택을 위한 캡스톤디자인 프로그램 (예정)\n-  학부생 조교로 활동 가능\n-  교수님 과제 참여로 연구조원으로 활동 가능\n학과(부) 행사 및 동아리 활동 \n-  수학과 콜로키움과 특별강연: 최근에는 미국 아마 AWS의 software \nengineering manager님과 스톤브릿지벤쳐스에서 수석팀장님, 스탠\n다임의 AI tech leader님을 연사로 모셨습니다.\n-  과동아리 HABIT은 프로그래밍과 기계학습을 공부하는 학생들의 연\n구모임입니다.\nDept. of Mathematics\n수학과\n전화번호 031-330-4262\n홈페이지 math.hufs.ac.kr\n슬기로운 대학생활 \n수학과는 깊은 사고력과 추상적인 개념을 능숙하게 다룰 수 있는 논리\n력을 지닌 인재를 길러내고자 합니다. 문명과 기술이 첨단화되고 고도\n화되면서 많은 업무가 자동화되는 지금은 단순한 지식 습득의 수준을 \n넘어 수학과가 지향하는 인재가 요구되고 있습니다. 대학생활은 어떠한 \n분야에 본인이 어울리는지, 그리고 필요한 준비를 해야 하는 시기입니\n다. 관련하여 다음과 같이 몇 가지 조언을 제시합니다.\n1.  다양한 경험을 쌓으세요. 실패를 통해 남을 이해할 수 있는 아량을 얻\n고, 어려움을 극복하고 성공한 경험을 통해 미래의 힘든 시기를 이겨\n낼 수 있게 하는 자존감을 쌓으세요. \n2.  수학 전공 과목에서 다루는 정리와 문제를 가능한 스스로 고민하고, \n해결하세요. 처음에는 힘들고 오랜 시간이 걸리겠지만, 이러한 어려\n움 통과해야 성장하고 시대가 요구하는 인재가 되는 것입니다.\n3.  산책 등 스스로 생각하는 습관을 만들고 동시에 글쓰기 실력을 기르\n세요. 한편, ChatGPT에게 다양한 질문과 요구를 연습하는 것도 논리\n적으로 생각을 정리하여 표현하는 능력을 기르는 좋은 방법입니다.\n졸업 후 진로', '문화, 역사 등)을 쌓을 수 있는 지역학 교과목이 많이 개설되어 있습니\n다. 지역학 전공자로서 가능한 다양한 과목을 통해 진정한 중앙아시아\n를 학습하고자 하는 마음가짐이 무엇보다도 중요합니다. \n-  중앙아시아 국가들은 1991년 독립한 신생국가입니다. 중앙아시아와 \n관련된 정치·경제·역사·문학 등 다양한 분야의 서적을 읽고 기본 배경\n지식을 쌓으면 좋습니다. 특히 중앙아시아는 주변 러시아, 중국 등 주\n변 국가들과의 연관성도 높기 때문에 국제 문제에 대한 관심과 기본적\n인 시사 상식을 갖추면 학습하는 데 도움이 됩니다. \n-  입학 전 입문서로는 ‘변화하는 중앙아시아 사회와 문화’(이지은, \n2022)를 읽어보길 권합니다. 독립 이후 중앙아시아 사회가 어떤 부분\n은 유지하고 어떤 부분은 변화해가며 무엇이 오늘날 중앙아시아 사회\n를 이해하는 데 핵심이 되는지 알 수 있습니다. \n-  현지 언어를 배워보고 싶으면, 국가평생교육원의 K-MOOC에서 ‘우즈\n베크어 기초생활회화 (A1 상/하)’ 또는 사이버한국외대 평생교육원의 \n특수외국어 강좌에서 ‘우즈베크어 첫걸음(A1)’을 통해서 기본적인 우\n즈베크어 체계를 학습해볼 수 있습니다. (카자흐어는 개발 중에 있습\n니다) 언어교재로는 우즈베크어 표준교재 A1(2018), 카자흐어 표준\n교재 A1(발간 예정) 등을 추천합니다.\n우리 학과(부)·전공 매력 \n-  국내 유일 중앙아시아 전문 교수들이 중앙아시아 지역학 전문가(언어\n와 지역학 통합)를 양성하는 학과입니다. \n-  최고 수준의 다중언어(우즈베크어, 카자흐어, 러시아어) 커리큘럼 및 \n국제교류프로그램을 제공합니다. \n-  우즈베크, 카자흐 현지 교수의 전문화된 언어 교육 프로그램을 구비\n하고 있습니다. \n-  ‘특수외국어능력평가시험 우즈베크어’에 응시하면 공인된 우즈베크어 \n평가 인증서를 취득할 수 있습니다. \n-  지역학 전공자로서의 전문성을 더 강화하고자 한다면, 일반대학원 터\n키/중앙아시아/몽골학과에 진학 가능합니다.\n-  학과 관련 카카오톡 채널을 운영(한국외대 중앙아시아학과)하고 있어 \n학생뿐만 아니라 일반인들 누구도 중앙아시아에 관심이 있으면 본 채\n널을 통해 문의할 수 있습니다. \n주요 실적 \n-  특수외국어교육사업: 멘토링, 탄뎀, 대사관 인턴십, 온라인 인턴십(우\n즈베키스탄, 카자흐스탄), 다문화가정 번역 봉사 등 \n-  중앙아시아연구소 연계 운영: 시사 지역 정보 뉴스 제공, 신흥지역연', '[공통] 2025-1학기 이중전공 변경 신청 일정 공고(비즈니스 & AI 융합전공 관련 내\n\n| 글로벌캠퍼스 영어통번역학부 학생 | 글로벌캠퍼스 영어통번역학부내 세부전공 이중전공 이수 불가 |\n| 글로벌캠퍼스 아프리카학부 학생 | 글로벌캠퍼스 아프리카학부내 세부전공 이중전공 이수 불가 |\n| 글로벌캠퍼스 경상대학 학생 | 서울캠퍼스 경영대학 이중전공 이수 불가 |\n| 글로벌캠퍼스 경제학과 학생 | 서울캠퍼스 경제학전공 이중전공 이수 불가 |\n| 글로벌캠퍼스AI데이터융합학부/ AI데이터융합전공 학생 | 글로벌캠퍼스 컴퓨터공학전공 이수 불가, 서울캠퍼스 Language & AI융합학부 이수 불가 |\n| 글로벌캠퍼스Finance & AI융합학부 /Finance & AI융합전공 학생 | 서울캠퍼스 Language & AI융합학부 이수 불가 |\n| 글로벌캠퍼스 반도체전자공학부(반도체공학전공)학생 | 글로벌캠퍼스 반도체전자공학부(전자공학전공) |\n| 글로벌캠퍼스 반도체전자공학부(전자공학전공)학생 | 글로벌캠퍼스 반도체전자공학부(반도체공학전공) |\n| 글로벌캠퍼스 컴퓨터공학전공 학생 | 서울캠퍼스 Language & AI융합전공 이수 불가 |\n| 글로벌캠퍼스 디지털콘텐츠학부 | 글로벌캠퍼스 문화콘텐츠학전공(융합전공)이중전공 이수 불가 |', '학, 전산언어학, 언어 교육 등이 있습니다.\nQ2.  언어인지과학과에 들어가려면 영어 이외의 제2외국어도 할 줄 알\n아야 하나요?\nA2.  아닙니다. 언어인지과학과의 교육은 세계의 언어학자들이 정리한 \n각 언어의 데이터를 통해 언어의 일반적인 특성을 배우는 과정이기 \n때문에 외국어 능력보다 이성적인 추론 능력을 더 필요로 합니다.\nQ3.  고등학교에서 한국어와 영어 문법을 잘 하지 못했습니다. 그런데도 \n언어인지과학과에 진학해서 공부를 잘 할 수 있을까요?\nA3.  문제 없습니다. 언어인지과학과에 진학하면 고등학교에서의 학습 \n방법과는 달리 과학적인 관점에서 언어를 분석하기 때문에 기존의 \n문법지식이 부족하더라도 잘 할 수 있습니다.\nDept. of Linguistics and Cognitive Science\n언어인지과학과\n전화번호 031-330-4286\n홈페이지 linguistics.hufs.ac.kr\n전공소개 \n언어를 통해 인간을 이해하려는 인문과학의 하나로서 언어학은 자연과\n학적 방법론을 사용하는 ‘자연과학적’ 인문학이라고 할 수 있습니다. 현\n대 언어학의 태동 이래로 언어학은 철학을 포함한 정신과학적 방법론뿐\n만 아니라 논리학, 전산학 등의 방법론을 도입하여 인간 언어에 대한 탐\n구를 진행해 왔습니다. 이러한 언어학 연구방법론은 인공지능, 빅데이\n터 등의 키워드로 특정 지어지는 현대사회에서 다시금 강조되고, 언어(\n학)이 중요한 분야로 떠오르고 있습니다. 1987년 언어학과로 시작한 언\n어인지과학과는 어느덧 불혹의 나이에 가까워지고 있습니다. 언어가 중\n요한 역할을 하는 4차 산업혁명 시대에 우리 언어인지과학과는 이에 필\n요한 지식뿐 아니라 여러 학문들을 융합하여 활용할 수 있는 분석 능력\n을 갖춘 융합적 인재를 양성하고자 노력하고 있습니다. 시대가 요구하\n는 교육을 행하고 있는 언어인지과학과에서 쌓은 지식과 경험이 여러분\n의 인생에 도움이 되길 바랍니다.\n필요역량 및 소양 \n-  언어학은 사람의 머릿속에 들어있는 언어 능력을 명료하게 밝히는 학\n문입니다.\n-  언어학은 다양한 인문학을 탐구하는 기본적인 자세인 학문적 호기심\n을 필요로 합니다.\n-  언어기호의 형태/내용/용법에 대한 이해를 심화시키고, 인지 체계에 \n대한 통찰력을 얻고 언어를 처리하는 통계, 프로그래밍언어 등의 현대\n적 학문 도구들을 배울 수 있는 역량을 필요로 합니다.\n우리 학과(부)·전공 매력', '위하여 본 대학의 특징인 외국어 능력 및 영어 커뮤니케이션 능력과 전\n략, 다양한 외국어 및 외국학에 대한 관심, 그리고 다문화 감수성 및 기\n초 소양을 갖추고 있다면 투어리즘 & 웰니스학부에서의 교육을 통해 \n국제 감각을 기르고 다양한 외국어 능력을 활용해 투어리즘과 웰니스 \n산업을 선도할 수 있는 인재로 성장하는 데 도움이 될 것입니다. \n-  IT 기술, 빅데이터 분석 및 활용 기술, 스마트 헬스케어 기술 등 다양한 \n산업 분야와의 융복합을 통해 나날이 발전해가고 있는 투어리즘과 웰\n니스 산업에서 활약할 수 있도록 글로벌 투어리즘과 글로벌 웰니스 시\n장에 활용될 첨단 기술에과 빅데이터에 대한 기본 지식을 갖추고, 이를 \n위한 논리력, 분석적 사고능력을 갖춘다면 투어리즘 & 웰니스 분야의 \n전문가로 성장하면서 필요한 전략을 적재적소에 활용할 수 있는 능력\n을 기르는 데 도움이 될 것입니다. \n-  투어리즘 & 웰니스 학문은 기본적으로 투어리즘과 웰니스 산업을 이\n용할 소비자를 위한 학문이므로 서비스 사이언스에 대한 기초 소양과 \n의사소통 능력, 외국어 능력을 갖춘다면 이를 기반으로 실무 현장에서 \n모국어 및 외국어로서 유연한 의사소통으로 문제를 해결해 나가는 데 \n도움이 될 것입니다. \n우리 학과(부)·전공 매력 \n-  기존의 학과에서 다루었던 투어리즘과 웰니스 영역 이외에 경영 측면\n에서의 서비스 사이언스 학문 그리고 빅데이터 분석과 같은 테크놀로\n지 분야를 융합하여 교육함으로써 다양한 분야의 진출을 지원 커리큘\n럼을 제공합니다.\n-  지역학적 지식을 바탕으로 국제 시장 변화에 민첩하게 대응하고 글로\n벌 관광 및 웰니스 건강 관련 국제적 수준의 경험을 쌓을 수 있는 현장\n실습을 제공합니다.\n-  산업 분석, 정보 기술 활용, 마케팅 전략 등 서비스 산업의 융합으로 웰\n니스 및 투어리즘 비즈니스 분야를 선도하는 자기주도적 전문가를 양\n성합니다.\n-  투어리즘과 웰니스 학문은 기본적으로 사람의 신체와 심리를 분석하고 \n이를 삶 속에 확장하여 더 나은 삶으로의 건강 증진과 행복 추구를 위해 \n발전해 왔으므로 대인관계역량이 필수적으로 요구됨. 학습자들은 투어리\n즘 & 웰니스 학부 교육과정을 통해 이 학문의 활용 대상이 될 사람들의 니\n즈를 이해하고 더 좋은 아이디어와 기획, 정책, 개발 및 경영에 대해 배우\n고 현장실습을 통해 창의적인 기획 아이디어와 실행능력을 펼칠 수 있음.\n주요 실적', '(공통)2025-1학기 이중전공 신청 일정 공고\n\n| 글로벌캠퍼스\xa0학생 | 서울캠퍼스\xa0융복합소프트웨어\xa0융합전공 이수 불가 |\n| 글로벌캠퍼스 융합인재학부학생 | 모든 이중전공이수 불가 |\n| 글로벌캠퍼스 영어통번역학부 학생 | 글로벌캠퍼스 영어통번역학부내 세부전공 이중전공 이수 불가 |\n| 글로벌캠퍼스 아프리카학부 학생 | 글로벌캠퍼스 아프리카학부내 세부전공 이중전공 이수 불가 |\n| 글로벌캠퍼스 경상대학 학생 | 서울캠퍼스 경영대학 이중전공 이수 불가 |\n| 글로벌캠퍼스 경제학과 학생 | 서울캠퍼스 경제학전공 이중전공 이수 불가 |\n| 글로벌캠퍼스AI데이터융합학부/ AI데이터융합전공 학생 | 글로벌캠퍼스 컴퓨터공학전공 이수 불가, 서울캠퍼스 Language & AI융합학부 이수 불가 |\n| 글로벌캠퍼스Finance & AI융합학부/Finance & AI융합전공 학생 | 서울캠퍼스 Language & AI융합학부 이수 불가 |\n| 글로벌캠퍼스 반도체전자공학부(반도체공학전공)학생 | 글로벌캠퍼스 반도체전자공학부(전자공학전공) |\n| 글로벌캠퍼스 반도체전자공학부(전자공학전공)학생 | 글로벌캠퍼스 반도체전자공학부(반도체공학전공) |\n| 글로벌캠퍼스 컴퓨터공학전공 학생 | 서울캠퍼스 Language & AI융합전공 이수 불가 |\n| 글로벌캠퍼스 디지털콘텐츠학부 | 글로벌캠퍼스 문화콘텐츠학전공(융합전공)이중전공 이수 불가 |', '는 언어를 배우고자 하는 탐구 자세, 배움에 대한 열정을 가진 학생\n이라면 충분히 가능합니다! \nQ2.  체코·슬로바키아어에 입학하면 두 언어를 모두 배우게 되나요?\nA2.  1학년 때부터는 체코어를 기본적인 언어로 배우지만 2학년 때부터 \n슬로바키아어를 배우기 때문에 두 언어를 모두 접할 수 있습니다. \n본인의 선택에 따라 두 언어 중 하나를 집중적으로 학습할 수도 있\n습니다. 또한 해외연수와 현장실습의 기회를 통해서 두 언어를 심\n화시킬 기회가 각각 열려있습니다. \nQ3.  체코·슬로바키아학과의 졸업 후 취업 진로는 어떻게 되나요?\nA3.  체코·슬로바키아학과의 졸업생들은 주로 체코와 슬로바키아를 포\n함해 중부유럽에 진출한 기업이나 혹은 현지 진출을 준비 중인 대\n기업과 중소기업에 취업해 역동적으로 활동하고 있습니다. 특히 국\n내 유수 대기업뿐만 아니라 내실 있는 중소기업에서 졸업생들의 활\n동이 더욱 두드러지고 있습니다. 최근에는 문화예술 분야에서의 교\n류도 활발히 진행되고 있어 체코·슬로바키아학과 동문이 전문 통역\n사나 혹은 문화행사의 기획을 주관하는 활동도 진행하고 있습니다. \n또한, 주체코 한국대사관, KOTRA, 주한 체코대사관 그리고 슬로바\n키아대사관에서 주도적인 역할을 담당하고 있습니다. 마지막으로, \n국내의 대학원에 진학하거나 유학을 통해 체코·슬로바키아 어문학\n이나 지역학을 연구하는 졸업생들도 있습니다. 프라하의 카렐 대학\n교, 브르노의 마사리크 대학교 그리고 슬로바키아의 코멘스키 대학\n교에서 유학하기도 합니다. 한편 졸업생 중에는 사회과학이나 상경 \n계열의 학문을 복수 전공하여, 향후 기업체에서 지역전문가로 활동\n하기 위한 복합학문적인 기초를 쌓고 있는 예도 있습니다.', '(공통)2025-1학기 이중전공 신청 일정 공고\n\n(공통)2025-1학기 이중전공 신청 일정 공고\n\n고)고2025 학년도 제 1 학기 이중전공 신청 일정을 아래와 같이 공고합니다 .\n\n- 아 래 -\n\n1. 신청 대상\n\n가 . 2 학년 진급 예정인 재학생\n\n(2007 학번 이후 학생으로 2025-1 학기를 두 번째 학기로 재학 중인 자 )\n\n나 . 2025 년도 전기 편입생 ( 순수외국인전형 편입생 포함 ) 중 이중전공 희망자\n\n※ 유의사항\n\n신청 대상자가 기간 내에 신청하지 않은 경우 또는 신청한 이중전공에서 탈락한 경우\n\n1) 다음 학기부터 이중전공 신청으로는 신청 불가\n\n2) 다음 학기부터 이중전공 변경 신청 기간에 이중전공 변경으로만 신청 가능\n\n[ 참고 ] 이중전공 변경 신청\n\n1) 매 학기 별도 신청 기간 (5 월 초 , 11 월 초 ) 을 공지하고 이중전공 변경 신청을 진행함\n\n2) 본인 학번대에 여석이 있는 경우에만 신청 가능하며 , 여석이 없으면 신청 불가\n\n( 신청 기간 공지 시 학번별 / 학과 ( 부 ) 별 여석 별도 안내 )\n\n2. 신청 기간 : 2025 년 5 월 26 일 ( 월 ) 10 시 ~ 5 월 30 일 ( 금 ) 16 시\n\n※ 안내된 기간에만 신청 / 변경 / 삭제 가능하므로 일정 준수할 것 ( 이후 별도 운영 계획 없음 )\n\n3.\xa0신청 방법 : 종합정보시스템 → 전공 / 교직관리 → 이중전공 신청\n\n가 . 2 지망 신청 가능 ( 선택사항 )\n\n1) 1 지망 배정 후 여석이 있는 경우에만 2 지망 배정\n\n2) 학과 ( 부 ) 선발인원보다 1 지망 신청자가 많으면\n\n- 2 지망 배정이 없으니 신청 시 참고할 것 ( 단 , 학과 ( 부 ) 별 전형이 있는 경우 제외 )\n\n- 학과 ( 부 ) 별 전형이 있는 경우 2 지망 지원자에 대해 전형 응시를 제한할 수 있음\n\n나 . 프랑스어학부를 이중전공으로할 경우 3 학년 진급 시 세부전공 / 트랙 신청 배정\n\n4. 제한사항\n\n가 . 캠퍼스 간 이중전공을 희망하는 경우 아래의 제한학과로는 신청 불가\n\n서울캠퍼스', '## [heading1] ##\n# 4) 안내사항\n\n## [table] ##\n| 구분 | 내용 |\n| --- | --- |\n| 글로벌캠퍼스 경상대학 학생 | 서울캠퍼스 경영대학 이중전공 이수 불가(부전공 가능) |\n| 2015년 1학기 이후 서울캠퍼스 경영학전공을 이중(부)전공하는 글로벌캠퍼스 소속 학생 | 서울캠퍼스 경영대학 경영학부에서 개설되는 경영학 강좌를 수강하여야 경영대학 경영학부 이중(부)전공 이수학점으로 인정함.(글로벌캠퍼스 국제경영학과 또는 국제금융학부에서 개설되는 유사 경영학 과목들을 수강하는 경우 이수학점으 로 인정하지 않음) 단, 2015학년도 1학기까지 경영대학 부전공을 이수한 글로 벌캠퍼스 학생들은 종전대로 경상대학에서 개설한 대체과목 을 수강하면 부전공으로 인정함. |\n| 미디어커뮤니케이션학부 (이중전공/부전공) | 글로벌캠퍼스 소속 이중전공 학생은 서울캠퍼스에서는 미디 어커뮤니케이션학부 공통과목과 자신의 세부전공 과목만 수 강가능함(부전공은 소속 캠퍼스에서 이수함/이중전공은 양캠 퍼스에서 이수가능) |\n\n## [heading1] ##\n# 사. 이중(부)전공 교과목 수강\n\n## [list] ##\n- 1) 이중(부)전공 영역 개설 학과 : 이중(부)전공 영역에서 수강\n- 2) 제1전공 영역만 개설 학과 : 제1전공 영역에서 수강(학과에 따라 일부 강좌의 수강을 제\n- 한할 수 있음. 강의시간표 비고란 참조)\n- ※ 제1전공 학생은 소속 학과(부)에서 이중(부)전공 영역에 개설한 과목을 수강할 수 없음.\n\n## [list] ##\n- 아. 기타사항 : 부전공의 경우에도 졸업시험/논문을 부과할 수 있음\n- 자. 문의\n\n## [list] ##\n- - 신청 및 배정 관련 : 학사종합지원센터(Tel : 031-330-4026)\n- - 수업 관련 : 학사종합지원센터(Tel : 031-330-4028)\n\n## [footer] ##\n- 74 -', '학과(부) 특별 프로그램 \n-  소프트웨어중심대학 사업의 주체 학과로 다양한 SW 관련 프로그램 \n운영 (프로그래밍 경진대회, 코딩 테스트 준비 캠프, 자체 해커톤, SW \n기업 현직 실무자 초청 기술 특강 등)\n-  단기, 장기 국내외 (학점 인정) 인턴십 및 견학 프로그램 지원\n-  해외 대학에 한 학기 이수를 지원하는 7+1 프로그램 운영\n-  기업-학생-교수의 일대일 맞춤형 산학연계 캡스톤 프로젝트 운영\n-  다양한 학회와 동아리 운영 및 지원\n-  지도교수-학생, 선배-후배 (멘토-멘티) 프로그램 운영\n학과(부) 행사 및 동아리 활동 \n-  R-Cube: 컴퓨터공학부 창업 동아리이며,  웹 프로그래밍을 위주로 다\n양한 공모전, 프로젝트, 창업 행사에 적극적으로 참여함으로써 실전 \n경험을 쌓을 수 있음.\n-  TAB: 1985년에 설립된 컴퓨터공학부 소속 학회로, 프로그래밍 스터\n디와 다양한 프로젝트를 수행하면서 최신 SW 기술을 익힐 수 있음. \n-  PnP: 학부생이 SW 기획자, 개발자로 성장하기 위해 필요한 자질을 다\n양한 형태의 학습 및 프로젝트를 통해 함께 만들어 갈 수 있음.\n-  HUFS-GDSC: Google Developer Student Club 활동을 통해 여러 \nIT 기술 스택 스터디, 교내 해커톤 대회 운영, 프로젝트 운영, 그리고 \n관심 있는 기술 분야에 대한 연사 초청 세미나 운영을 통해 학생 개발\n자로 성장할 수 있는 기회를 제공함.', '2025학년도 신·편입생 수강신청 일정 및 일반교육 안내\n\n2025학년도 신·편입생 수강신청 일정 및 일반교육 안내\n\n2025학년도 신·편입생 수강신청 일정 및 일반교육 안내\n\n2025학년도 신·편입생 수강신청과 일반교육을 아래와 같이 실시합니다.\n\n- 아\xa0\xa0 래 -\n\n■ 수강신청 및 교육 일정\n\n구 분\n\n일정 및 비고\n\n신입생 및 편입생 수강신청\n\n2025. 2. 24.(월), 10시 ∼16시\n\n※ 수강신청 당일 학교 홈페이지에 바로가기 안내 됨\n\n신입생 및 편입생 일반교육\n\n교육자료 공지로 진행\n\n(※ 아래 안내사항 중 “ 3. 관련 사이트 안내 ” 참조)\n\n개강일\n\n2025. 3. 3.(월), 대체휴일 / 실 제 수 업 은 3 . 4 . ( 화 ) 부터 진 행\n\n■ 안내사항\n\n0. 주요안내\n\n가. 수강신청/변경 및 취소는 기간 내 에 반드시 본인 이 해야 함\n\n나. 수강신청한 과목을 매매 또는 거래 하였을 경우, 학생징계규정에 의해 징계의 사유 가 될 수 있음\n\n다 . 학사운영의 투명성 및 공정성을 제고하기 위해 교수-자녀 간 강의 수강을 지양 하기 바람\n\n라. 수강신청 대기 순번 시스템 도입 (※ 자세한 사항은 붙임 파일 참조)\n\n1) 접속자가 많은 경우 로그인 및 수강신청 모든 요청에 대기 순번을 발급하고 순차적으로 서비스 함.\n\n2) 유의사항 : 대기 순번을 부여받은 후 ‘새로고침(F5)’을 하거나 메뉴를 반복 클릭하면 최후 번호로\n\n재발급되어 대기시간이 늘어남.\n\n마. 종합정보시스템에서 “ 전공 교육과정 안내 ”를 운영 하오니 참고 바람\n\n1. 학번(ID) 확인 및 교내 시스템 (수강신청, 예비수강신청함, 종합정보시스템) 접속 방법\n\n가. 학번(ID) 확인 방법 : 학교 홈페이지 “ 입학안내 ”에서 확인(※학번 확인 후 예비수강신청함 이용)\n\n나. (학번 확인 후)교내 시스템 최초 접속 방법 : ID(학번), 비밀번호(주민번호 앞 6자리)\n\n※ 최초 접속 후 개인정보 보호 및 비밀번호 유출로 인한 사고 예방 을 위해 수강신청 전 본인의\n\n비밀번호 변경 권장', '5756\nDivision of Tourism & Wellness\n투어리즘 & 웰니스학부\n전화번호 02-2173-2131\n홈페이지 tw.hufs.ac.kr\n전공소개 \n투어리즘 & 웰니스학부는 국제 감각을 갖춘 외국어 능력과 창의적 서비\n스 사이언티스트 소양, 그리고 첨단 테크놀로지 역량을 겸비하여 글로벌 \n투어리즘과 글로벌 웰니스 산업을 이끌어갈 전문 인재를 양성하는 것을 \n목표로 하고 있습니다. 본 학부에서는 학부생들이 투어리즘과 웰니스 각 \n분야의 전문가로 성장할 수 있도록 스스로 원하는 교과목을 선택하고 진\n로를 설계하는 트랙식 교육을 실시하고 있습니다. \n첫 번째 트랙으로는 세계를 무대로 하는 글로벌 투어리즘과 호스피탤러\n티 산업의 핵심 원리, 경영 전략, 문화 감수성, 고객 서비스, 국제 비즈니\n스 동향 등에 대한 폭넓은 지식을 이해하고, 국제적인 시각에서의 다양\n한 투어리즘 및 호스피탤러티 도전 과제를 해결하며, 글로벌 비즈니스 환\n경에서의 성공적인 협업과 소통을 위한 능력을 개발하여 문화 다양성에 \n대한 이해와 그에 따른 서비스 디자인 및 서비스 전략 수립에 중점을 두\n어 글로벌 시장에서 전문성을 발휘할 글로벌 투어리즘 앤 호스피탤러티 \n(Global Tourism & Hospitality, GTH) 트랙이 있으며, 두 번째로는 국제\n적인 웰니스 및 헬스케어 산업을 이해하고, 글로벌 헬스케어 동향, 웰니\n스 산업의 성장과정, 건강과 관련된 다양한 분야에 대한 이해와 학생들\n이 글로벌 웰니스와 헬스케어 산업에서 혁신적이고 지속가능한 솔루션\n을 창출하는 데 필요한 지식을 제공하여 글로벌 헬스케어 시스템, 환자 \n중심의 접근, 디지털 헬스케어 기술 등과 관련된 주제에 대한 이해력을 \n갖춘 웰니스와 헬스케어 분야의 인재로 성장할 글로벌 웰니스 앤 헬스케\n어(Global Wellness & Healthcare, GWH) 트랙으로 구성되어 있습니다. \n필요역량 및 소양 \n-  글로벌 투어리즘과 글로벌 웰니스 산업 분야의 전문가로 발돋움하기 \n위하여 본 대학의 특징인 외국어 능력 및 영어 커뮤니케이션 능력과 전\n략, 다양한 외국어 및 외국학에 대한 관심, 그리고 다문화 감수성 및 기\n초 소양을 갖추고 있다면 투어리즘 & 웰니스학부에서의 교육을 통해 \n국제 감각을 기르고 다양한 외국어 능력을 활용해 투어리즘과 웰니스 \n산업을 선도할 수 있는 인재로 성장하는 데 도움이 될 것입니다.']","글로벌스포츠산업학부(글스산)의 세부전공 신청은 다음과 같이 진행됩니다:

1. **신청 기간**: 2025년 5월 26일(월) 10:00 ~ 5월 30일(금) 16:00입니다. 이 기간 내에 신청해야 하며, 이후에는 추가 신청이나 변경이 불가능합니다.

2. **신청 방법**: 종합정보시스템에 로그인한 후, 전공/교직관리 메뉴에서 세부전공 신청을 진행하시면 됩니다.

3. **결과 확인**: 신청 결과는 2025년 7월 중에 발표될 예정입니다. 구체적인 날짜는 학사공지 게시판을 통해 확인하실 수 있습니다.

신청 시 유의사항을 잘 확인하시고, 필요한 서류를 준비하여 신청하시기 바랍니다. 혹시 더 도와드릴까요?","글로벌스포츠산업학부의 세부전공 신청에 대한 정보는 다음과 같습니다.
신청기간: 2025년 5월 26일(월) 10:00부터 5월 30일(금) 16:00까지입니다. 신청기간 이후에는 추가 신청이나 변경이 절대 불가하니 유의하시기 바랍니다.
신청방법: 종합정보시스템에 접속하셔서 전공/교직관리 메뉴에서 1전공 신청을 하시면 됩니다.
배정결과: 배정 확정은 2025년 7월 중에 이루어질 예정입니다. 성적 반영이 완료된 후에 결과를 확인하실 수 있습니다.
추가적인 문의사항이 있으시면 학사종합지원센터에 연락하시기 바랍니다.",0.3425188161576268,1.0,0.6666666666666666,0.7806003629400454
