user_input,retrieved_contexts,response,reference,context_precision,context_recall,faithfulness,answer_relevancy
"월요일 7, 8교시에 들을 수 있는 교양 있으면 알려줘.","['통해 다채로운 한국문화 관련 세부 전공을 개척해 나갈 수 있습니다. \nQ3. 한국어 교원 자격증이 무엇인가요? \nA3.  한국어 교원 자격증은 국립국어원 주관하에 문화체육관광부에서 \n부여하는 자격증으로서 한국어가 모국어가 아닌 외국인이나 다문\n화가정을 대상으로 한국어를 가르칠 수 있는 자격증입니다. 한국학\n과 내의 일정 영역별 학점을 이수하면 국내외에서 한국어 교사로 활\n동할 수 있는 한국어교원 자격증을 취득할 수 있습니다. \n글로벌캠퍼스 GLOBAL CAMPUS\n경상대학\nGlobal Business & Technology학부 28\n국제금융학과 30\nCOLLEGE OF ECONOMICS\nAND BUSINESS', '게 수집하고 활용이 되고 있는지에 대한 관심이 있고, 공학기술의 실\n생활적용에 흥미를 가지고 있으면 좋습니다.\n-  생물, 물리, 수학, 컴퓨터 등에 대한 기초가 첨단의료기기 및 의료데이\n터의 활용과 관련된 전공과목을 이수하는 데에 도움이 될 것입니다. \n우리 학과(부)·전공 매력 \n-  의학과 공학의 만남이라는 첨단 융복합 학문의 전문가를 양성\n-  빅데이터, 인공지능, 첨단의료기기 등 IT 중심의 바이오메디컬 분야 \n핵심 인재 양성\n-  긴밀한 산학연병 협력으로 현장형 인재 중심 교육 실현 및 현장실\n습 지원 \n-  평생 지도 교수 제도를 통한 지속적인 학생 상담 및 경력 관리 \n주요 실적 \n-  한국연구재단, 범부처전주기의료기기연구개발사업단, 한국지능정보\n사회진흥원 등의 지원으로 바이오메디컬공학 분야의 산학연병 협동\n연구를 수행 중입니다.\n-  학부학생들이 보건복지부, 한국보건산업진흥원, 산업통상자원부, \nMICCAI 주관의 다수의 공모전에서 최우수상, 우수상 등을 수상했습\n니다.\n-  학부학생들이 매년 국내외 바이오메디컬공학 관련 분야의 주요학술\n대회(ISMRM, MICCAI, MIDL, RSNA, ICMRI 등)에서 연구성과를 발\n표했습니다.\n주요 전공과목 \n-  생체신호계측기기설계및실습: 생체 신호 계측 시스템의 이해를 위\n한 기초 과목으로 전자 회로 및 반도체 시스템에 대한 개념을 이해하\n고, 인체 내에서 정보 전달을 위해 발생 되는 전기적인 신호를 측정하\n고 해석하는 데에 필수적인 전자회로의 내용을 공부하고 실습합니다.\n-  바이오메디컬인공지능: 바이오메디컬 데이터에 대한 인공지능 적용\n을 위한 딥러닝의 기초를 배우고, 컴퓨터를 이용해 실제 데이터에 적\n용할 수 있는 능력을 배양합니다.\n-  의료영상처리및실습: 디지털 영상 처리의 기초가 되는 다양한 이론과 \n방법을 배우고, 컴퓨터를 이용하여 실제 의료영상에 적용할 수 있는 \n능력을 배양합니다. 실습을 통해 의료영상의 분류, 영역 검출 및 분할, \n정합 등의 과정을 진행하는 방법을 익힙니다.\n-  의생명정보학: 의생명정보학 분야의 대표적인 데이터들을 소개하고, \n각각의 데이터들에 대해 이해하고 이를 다운로드 받아 다뤄보는 것 이\n외에 실제 시퀀스데이터를 가지고 분석하는 여러 가지 툴들을 다뤄보\n고, 이를 통해 실제 분석하는 것으로 진행합니다.\n-  바이오메디컬공학특강: 바이오메디컬공학 분야와 연관된 산업체, 연', '[공공브랜딩] 4학년 대상 / 교수: 이효복 / 화요일 7,8,9교시 / 강의실 0512호 / 학점: 3 / 전공필수 과목 아님 / 온라인강의 아님 / P/F 평가 과목 아님 / 원어강의 아님', '[심리언어학] 4학년 대상 / 교수: 전종섭 / 수요일 7,8,9교시 / 강의실 4210호 / 학점: 3 / 전공필수 과목 아님 / 온라인강의 아님 / P/F 평가 과목 아님 / 원어강의 아님\n\n[언어학연구방법론] 4학년 대상 / 교수: 이해윤 / 월요일 7,8교시 / 강의실 4210호 / 학점: 2 / 전공필수 과목 아님 / 온라인강의 아님 / P/F 평가 과목 아님 / 원어강의 아님', '[한국불교철학] 4학년 대상 / 교수: 김원명 / 수요일 7,8,9교시 / 강의실 4213호 / 학점: 3 / 전공필수 과목 아님 / 온라인강의 아님 / P/F 평가 과목 아님 / 원어강의 아님\n\n[현상학] 4학년 대상 / 교수: 한우섭 / 금요일 4,5,6교시 / 강의실 4213호 / 학점: 3 / 전공필수 과목 아님 / 온라인강의 아님 / P/F 평가 과목 아님 / 원어강의 아님', '는 <FLEX 헝가리어>가 3학년 2학기에 걸쳐 강의되며, 4학년에서는 \nECL 자격증 취득을 위한 <고급 헝가리어 번역연습>으로 헝가리어의 \n단계적 학습을 하실 수 있습니다. \n-  헝가리 문학 교과목: 헝가리 문학은 3학년 전공 수업에서 접하실 수 있\n으며 3학년의 <헝가리 전래동화와 콘텐츠>에서 배우는 구비문학과 \n더불어 <헝가리 문학사>로 문학의 흐름 전체를 개괄할 수 있습니다. \n학과(부) 특별 프로그램 \n-  매년 7+1 3인(1학기 어학과정), Honors Program 1인(1학기 어학과정 \n+ 1학기 현지 인턴과정) 교내 장학금 지급\n-  헝가리 정부 장학생 연 100명 선발: 1년/1학기/1달/2주 헝가리 체류 \n및 어학 과정/대학 과정/석박사 과정 장학금 지급\n-  특수어교육진흥원에서 매년 1학기 현지 어학 과정 장학금 지급\n-  주한 헝가리 대사관 및 주한 헝가리 문화원과의 행사 교류\n학과(부) 행사 및 동아리 활동 \n-  1학기 헝가리학과 <학술제>\n-  2학기 <헝가리어 말하기 대회>\n-  1학기 부활절 공예품 만들기\n-  2학기 크리스마스 장식품 만들기 \n-  방과후 프로그램과 방학중 프로그램: 학기 중 방과후에 외국인 선생님\n과 <헝가리어 테라피>를 통해 발음교정, 핵심 표현 연습 등을 하실 수 \n있으며 <탄뎀> 과정에서 헝가리 연수 경험이 있는 선배의 지도로 1-2\n학년 헝가리어 과목의 예습과 복습을 할 수 있습니다. 여름 방학 중 헝\n가리어 문법 집중 과정을, 겨울 방학 중에는 <에게르 대학교의 헝가리\n어> 수업을 온라인으로  받을 수 있습니다.\n슬기로운 대학생활 \n1학년  기초 헝가리어와 헝가리에 대한 다양한 내용을 배우며, 이와 더\n불어 다양한 교양 과목을 듣게 됩니다. \n2학년  중급 헝가리어를 배우게 되며, 헝가리의 역사와 문화, 외교정책\n에 대한 전공 수업을 듣게 됩니다. \n3학년  헝가리어 공인인증 시험 준비를 하면서 문학, 사회와 문화 정치\n에 대한 전공 수업에 참여하게 됩니다. \n4학년  헝가리의 지역과 문화에서의 고유성을 배우는 전공 수업에 참여\n하고 졸업에 필요한 헝가리어 공인인증 시험을 마무리합니다. \n졸업 후 진로 \n-  정부 및 공공기관: 정부 기관의 특수어 전문가\n-  통번역 기관: 한-헝 경제협력으로 기업인들의 방문, 현지 조사를 위\n한 회의가 많아지고 있으며, 여기에 필요한 통번역 업무가 확대되고 \n있음.', '[종합설계] 4학년 대상 / 교수: 고석훈 / 월요일 7,8,9교시 / 강의실 0515호 / 학점: 3 / 전공필수 과목 아님 / 온라인강의 아님 / P/F 평가 과목 아님 / 원어강의 아님', '[프랑스어권문화의이해] 전체 학년 대상 / 교수: 박은영 / 화요일 7,8교시 / 강의실 2416호 / 학점: 2 / 전공필수 과목 아님 / 온라인강의 아님 / P/F 평가 과목 아님 / 원어강의 아님\n\n[한국미술의이해] 전체 학년 대상 / 교수: 이정은 / 수요일 7,8교시 / 강의실 2506호 / 학점: 2 / 전공필수 과목 아님 / 온라인강의 아님 / P/F 평가 과목 아님 / 원어강의 아님\n\n[한국의세계문화유산] 전체 학년 대상 / 교수: 안현정 / 목요일 5,6교시 / 강의실 2503호 / 학점: 2 / 전공필수 과목 아님 / 온라인강의 아님 / P/F 평가 과목 아님 / 원어강의 아님', '덕션의 과정을 실습하는 프로그램에 참여합니다. (스튜디오/편집실)\n-  스토리콘텐츠 창작 프로그램: 영화 시나리오, 드라마 대본, 웹소설 등 \n스토리콘텐츠 기획과 창작을 위한 프로그램에 참여합니다. (창작실)\nDivision of Digital Contents\n디지털콘텐츠학부\n전화번호 031-330-4067\n홈페이지 dicon.hufs.ac.kr\n학과(부) 행사 및 동아리 활동 \n-  콘텐츠 제작 대회 및 마켓: 특정 주제와 장르로 콘텐츠를 제작하고 이\n를 전시할 수 있는 마켓을 제공합니다. 게임, 애니메이션, 웹디자인 등 \n다양한 분야에 참가하여 본인의 역량을 강화하고 발휘할 수 있는 열\n린 소통의 장입니다.\n-  비즈니스 강연 및 워크숍: 디지털콘텐츠와 관련한 주요 비즈니스 전\n문가를 초청하여 강연 및 워크숍을 개최합니다. 현업에서의 경험과 통\n찰력을 얻을 수 있는 기회를 넘어서, 실무 인맥을 형성할 수 있는 기\n회를 제공합니다.\n-  콘텐츠 기반 창업 프로젝트: 창업에 흥미를 느끼는 학생을 위해 콘텐\n츠를 중심으로 한 창업 아이디어 구상부터 비즈니스 모델 개발까지 창\n업 프로세스 전반을 경험할 수 있도록 합니다. 실제 사업가로 나아가\n는데 필요한 역량을 갖출 수 있는 기회입니다.\n-  다양한 동아리: 디자인 커뮤니티 동아리, 콘텐츠 제작 동아리, AR/\nVR 체험 동아리, 스토리 창작 동아리, 창업 및 비즈니스 동아리 등 전\n공 분야에서의 역량을 함께 키울 수 있는 다양한 커뮤니티에 참여할 \n수 있습니다.\n슬기로운 대학생활 \n1학년  디지털 문화콘텐츠/디지털 테크놀로지/빅데이터 등의 기본 개념\n을 배우고 디지털콘텐츠 분야에 대한 이해도를 높이는 시기입니\n다. 1학년의 학습 내용이 2~4학년으로 연계되므로, 디지털콘텐\n츠에 대한 기초 내용을 잘 학습하고 기억하는 것이 중요합니다.\n2학년  수업의 종류가 많아지므로, 학생이 원하는 분야를 선택해서 들을 \n수 있습니다. 한 가지 분야에 초점을 맞춰도 되지만 자신의 잠재\n력이 잘 드러날 수 있는 비주얼콘텐츠/스토리콘텐츠/K-콘텐츠/\n콘텐츠비즈니스 중에서 2가지 이상 분야의 다양한 수업의 수강\n을 권장합니다.\n3학년  더욱 심화된 내용을 통해 진로 선택에 있어 도움이 되는 분야를 \n정해 집중적으로 수강하기를 권장합니다. 현장실습을 고려하고 \n있다면 1~3학년까지 배웠던 수업을 정리하는 일도 중요합니다.', '[언어학연구방법론] 4학년 대상 / 교수: 이해윤 / 월요일 7,8교시 / 강의실 4210호 / 학점: 2 / 전공필수 과목 아님 / 온라인강의 아님 / P/F 평가 과목 아님 / 원어강의 아님', '[미네르바인성교육] 전체 학년 대상 / 교수: 박남용 / 목요일 5,6교시 / 강의실 2408호 / 학점: 2 / 전공필수 과목 아님 / 온라인강의 아님 / P/F 평가 과목 아님 / 원어강의 아님\n\n[분노와용서] 전체 학년 대상 / 교수: 조준래 / 수요일 7,8교시 / 강의실 2309호 / 학점: 2 / 전공필수 과목 아님 / 온라인강의 아님 / P/F 평가 과목 아님 / 원어강의 아님\n\n[사람다운삶을위한관계] 전체 학년 대상 / 교수: 박성준 / 금요일 7,8교시 / 강의실 2412호 / 학점: 2 / 전공필수 과목 아님 / 온라인강의 아님 / P/F 평가 과목 아님 / 원어강의 아님', '[인문적사유와글쓰기] 전체 학년 대상 / 교수: 한상효 / 월요일 7,8교시 / 강의실 2303-2호 / 학점: 2 / 전공필수 과목 아님 / 온라인강의 아님 / P/F 평가 과목 아님 / 원어강의 아님\n\n[인문학명저산책] 전체 학년 대상 / 교수: 조준래 / 목요일 7,8교시 / 강의실 2501호 / 학점: 2 / 전공필수 과목 아님 / 온라인강의 아님 / P/F 평가 과목 아님 / 원어강의 아님\n\n[인문학의이해-문학,역사,철학] 전체 학년 대상 / 교수: 소병선 / 목요일 7,8교시 / 강의실 4411호 / 학점: 2 / 전공필수 과목 아님 / 온라인강의 아님 / P/F 평가 과목 아님 / 원어강의 아님', '[종교철학입문] 전체 학년 대상 / 교수: 조명동 / 월요일 7,8교시 / 강의실 2503호 / 학점: 2 / 전공필수 과목 아님 / 온라인강의 아님 / P/F 평가 과목 아님 / 원어강의 아님\n\n[철학으로의초대] 전체 학년 대상 / 교수: 김영걸 / 화요일 5,6교시 / 강의실 2504호 / 학점: 2 / 전공필수 과목 아님 / 온라인강의 아님 / P/F 평가 과목 아님 / 원어강의 아님\n\n[한국사의이해] 전체 학년 대상 / 교수: 정동민 / 목요일 7,8교시 / 강의실 2503호 / 학점: 2 / 전공필수 과목 아님 / 온라인강의 아님 / P/F 평가 과목 아님 / 원어강의 아님', '[인문학명저산책] 전체 학년 대상 / 교수: 조준래 / 목요일 7,8교시 / 강의실 2309호 / 학점: 2 / 전공필수 과목 아님 / 온라인강의 아님 / P/F 평가 과목 아님 / 원어강의 아님\n\n[젠더와문학] 전체 학년 대상 / 교수: 홍구슬 / 금요일 5,6교시 / 강의실 1507호 / 학점: 2 / 전공필수 과목 아님 / 온라인강의 아님 / P/F 평가 과목 아님 / 원어강의 아님\n\n[졸업하기전에읽어야할러시아고전명작] 전체 학년 대상 / 교수: 전미라 / 화요일 7,8교시 / 강의실 2412호 / 학점: 2 / 전공필수 과목 아님 / 온라인강의 아님 / P/F 평가 과목 아님 / 원어강의 아님', '[중국근.현대철학사] 2학년 대상 / 교수: 홍성민 / 화요일 7,8,9교시 / 강의실 4216호 / 학점: 3 / 전공필수 과목 아님 / 온라인강의 아님 / P/F 평가 과목 아님 / 원어강의 아님\n\n[형이상학] 2학년 대상 / 교수: 이승일 / 금요일 4,5,6교시 / 강의실 4216호 / 학점: 3 / 전공필수 과목 아님 / 온라인강의 아님 / P/F 평가 과목 아님 / 원어강의 아님\n\n[동양우주론] 3학년 대상 / 교수: 이병욱 / 화요일 1,2,3교시 / 강의실 4216호 / 학점: 3 / 전공필수 과목 아님 / 온라인강의 아님 / P/F 평가 과목 아님 / 원어강의 아님']","월요일 7, 8교시에 들을 수 있는 교양 과목은 다음과 같습니다:

1. **종교철학입문**
   - 교수: 조명동
   - 강의실: 2503호
   - 학점: 2
   - 전공필수 과목 아님
   - 온라인강의 아님
   - P/F 평가 과목 아님
   - 원어강의 아님

2. **인문적사유와글쓰기**
   - 교수: 한상효
   - 강의실: 2303-2호
   - 학점: 2
   - 전공필수 과목 아님
   - 온라인강의 아님
   - P/F 평가 과목 아님
   - 원어강의 아님

이 과목들을 고려해 보시기 바랍니다. 혹시 더 도와드릴까요?","월요일 7,8교시에 들을 수 있는 교양 과목에는 '인간과 사회', '대중문화 예술의 이해', '비즈니스협상' 등이 있습니다.",0.0,0.0,0.8947368421052632,0.792193015081712
글스산 졸업하면 뭐해?,"['3학년  통번역을 중점적으로 다루며 졸업시험을 위한 FLEX 준비도 시\n작하게 됩니다. \n4학년  인터뷰하기, 이력서 쓰기, 계약 서류 작성하기와 같은 실용 그\n리스어·불가리아어를 가르칩니다. 그리스·불가리아에 대한 다면\n적, 다각도적인 심화 교육을 위해 그리스·불가리아 데이터를 활\n용한 빅데이터 분석, 메타버스 활용 수업, 무역 실습 등을 동시\n에 운영합니다. \n졸업 후 진로 \n-  정부 및 공공기관: 대사관, 정부 산하 공기업 및 준정부기관\n-  기업: 국내, 아테네 및 소피아 소재 대기업, 방송사, 항공사, 언론사, \n광고·PR사, IT 등\n-  학계: 대학교수, 국내외 연구기관 연구원, 국내외 석·박사 진학\n-  창업: 한국-그리스, 한국-불가리아 수출입 및 이커머스 기업 창업', '전공 공부에 도움이 됩니다. \n2학년  자연스럽고 유창한 그리스어·불가리아어 구사 능력을 기르기 위\n해 회화, 강독 심화 과목을 수강하게 됩니다. 언어와 더불어 기본\n적인 문화에서 더 나아가 역사, 지중해 유산, 지리연구 등 지역학 \n과목을 함께 수강합니다.\n3학년  통번역을 중점적으로 다루며 졸업시험을 위한 FLEX 준비도 시\n작하게 됩니다. \n4학년  인터뷰하기, 이력서 쓰기, 계약 서류 작성하기와 같은 실용 그\n리스어·불가리아어를 가르칩니다. 그리스·불가리아에 대한 다면\n적, 다각도적인 심화 교육을 위해 그리스·불가리아 데이터를 활\n용한 빅데이터 분석, 메타버스 활용 수업, 무역 실습 등을 동시\n에 운영합니다. \n졸업 후 진로 \n-  정부 및 공공기관: 대사관, 정부 산하 공기업 및 준정부기관\n-  기업: 국내, 아테네 및 소피아 소재 대기업, 방송사, 항공사, 언론사, \n광고·PR사, IT 등\n-  학계: 대학교수, 국내외 연구기관 연구원, 국내외 석·박사 진학', '금을 지급합니다.\n슬기로운 대학생활 \n1학년 과정에서는 자연과학의 필수적인 기초지식과 환경문제와 관련된 \n교양과정을 학습한 후, 2, 3, 4학년 과정에서는 개인의 적성과 관심에 따\n라 환경공학 분야, 청정에너지 분야, 생명공학 응용분야에 대한 깊이 있\n는 학습을 하게 됩니다. 더불어 교과 시간에 학습한 내용을 토대로 석/\n박사과정의 대학원생들과 함께 구체적인 연구 및 실습을 할 수 있도록 \n교과과정이 편성되어 있으며, 6개의 실험실에서 대학원생과 교수님의 \n지도 아래 연구실험을 할 수 있는 기회가 주어집니다.\n졸업 후 진로', '을 공부해 두는 것이 좋습니다. 졸업 후 취업 또는 진학에 관계없이 영어 \n구사 능력은 항시 요구되므로 대학 입학 이후부터 읽기, 듣기, 말하기, \n쓰기 모든 분야에서 영어 능력을 지속적으로 계발하는 것이 매우 중요\n합니다. 고학년 기간에는 이론적인 지식이 아니라 연구실 인턴을 통해 \n관심분야의 연구를 경험해보며 자신의 진로를 준비하는 것이 좋습니다.\n졸업 후 진로 \n-  기업체: 석유화학, 반도체/전자, 에너지, 신소재, 재료, 바이오, 의료 및 \n제약, 화장품 및 식품 분야\n-  정부 및 공공기관: 국가/지방 공무원 및 정부 산하 공기업\n-  학자 및 연구직: 대학 교수, 국공립연구소 및 정부 출연 연구소, 기\n업 연구소\n-  기타: 교사(교직이수), 창업\nQ&A', '-  학계: 대학교수, 국내외 연구기관 연구원, 국내외 석·박사 진학\n-  창업: 한국-그리스, 한국-불가리아 수출입 및 이커머스 기업 창업\n-  금융: 금융권 공기업, 은행, 증권, 투자회사\nQ&A \nQ1.  그리스어, 불가리아어를 전혀 몰라도 입학할 수 있나요?\nA1.  모든 신입생은 알파벳부터 공부하기 시작합니다. 알파벳부터 시작\n해서 외국인과 내국인 교수님이 작문, 문법, 회화, 독해, 통·번역, 실\n무 언어 등으로 나누어 수업을 진행합니다. 학년이 올라감에 따라', '정하는 시간을 갖게 됩니다.\n2학년  한국문학, 한국역사, 한국문화로 나눠진 한국학 관련 전공 수업과 더\n불어 한국어교원 관련 과목을 본격적으로 수강하게 됩니다. 이상의 \n네 분야 중 학생이 선택한 분야에 초점을 맞추어 강의를 듣게 됩니다.\n3학년  2학년에 수강한 분야들 중 하나 혹은 두 분야에 초점을 맞추어 수\n업을 들으면서 졸업논문 프로젝트를 위한 강의도 수강하게 됩니다.\n4학년  실습이나 연습 과목 위주로 수강하면서 졸업논문 계획서 제출, \n졸업논문 작성 및 완성본 제출을 하게 됩니다.\n졸업 후 진로', '을 공부해 두는 것이 좋습니다. 졸업 후 취업 또는 진학에 관계없이 영어 \n구사 능력은 항시 요구되므로 대학 입학 이후부터 읽기, 듣기, 말하기, \n쓰기 모든 분야에서 영어 능력을 지속적으로 계발하는 것이 매우 중요\n합니다. 고학년 기간에는 이론적인 지식이 아니라 연구실 인턴을 통해 \n관심분야의 연구를 경험해보며 자신의 진로를 준비하는 것이 좋습니다.\n졸업 후 진로 \n-  기업체: 석유화학, 반도체/전자, 에너지, 신소재, 재료, 바이오, 의료 및 \n제약, 화장품 및 식품 분야\n-  정부 및 공공기관: 국가/지방 공무원 및 정부 산하 공기업\n-  학자 및 연구직: 대학 교수, 국공립연구소 및 정부 출연 연구소, 기\n업 연구소\n-  기타: 교사(교직이수), 창업\nQ&A \nQ1.  한국외대 화학과에 진학하려고 하는데 영어를 잘해야 하나요?\nA1.   한국외대 화학과에서는 원서 전공 교과목 수업과 영어 졸업논문 발\n표 등을 통해 화학 전문 영어를 습득하게 합니다. 또한, 외국어 대', '## [table] ##\n| 개설학과(전공) | 교과목명 | 이수영역 |\n| --- | --- | --- |\n| 컴퓨터공학전공 | 컴퓨터보안 | 소프트웨어 및 데이터 분석 |\n| 산업경영공학과 | 텍스트어낼리틱스 | 소프트웨어 및 데이터 분석 |\n| 산업경영공학과 | 경영과학 | 소프트웨어 및 데이터 분석 |\n| 산업경영공학과 | 딥러닝응용 | 소프트웨어 및 데이터 분석 |\n| 산업경영공학과 | 데이터사이언스개론 | 소프트웨어 및 데이터 분석 |\n| 산업경영공학과 | 데이터사이언스응용 | 소프트웨어 및 데이터 분석 |\n| AI융합전공 | 자료구조 | 소프트웨어 및 데이터 분석 |\n| AI융합전공(SW&AI) | 알고리즘 | 소프트웨어 및 데이터 분석 |\n| AI융합전공(SW&AI) | 운영체제 | 소프트웨어 및 데이터 분석 |\n| AI융합전공(SW&AI) | 웹프로그래밍 | 소프트웨어 및 데이터 분석 |\n| AI융합전공(SW&AI) | 데이터베이스 | 소프트웨어 및 데이터 분석 |\n| AI융합전공(SW&AI) | 기계학습 | 소프트웨어 및 데이터 분석 |\n| 통계학과 | 데이터시각화 | 소프트웨어 및 데이터 분석 |\n| 통계학과 | 시계열분석및연습 | 소프트웨어 및 데이터 분석 |\n| 통계학과 | 베이지안통계학 | 소프트웨어 및 데이터 분석 |\n| 통계학과 | 데이터사이언스세미나 | 소프트웨어 및 데이터 분석 |\n| 통계학과 | 통계행렬론연습 | 통계행렬론을 수강해야 인정함 |\n| 통계학과 | 회귀분석연습 | 회귀분석을 수강해야 인정함 |\n| 통계학과 | 확률분포론연습 | 확률분포론을 수강해야 인정함 |\n| 통계학과 | 수리통계학연습 | 수리통계학을 수강해야 인정함 |\n\n## [heading1] ##\n# 5) 졸업 요건\n\n## [paragraph] ##\n- 졸업 과제 및 논문(전공 홈페이지에 게시)\n\n## [heading1] ##\n# 6) 문의처', '네 분야 중 학생이 선택한 분야에 초점을 맞추어 강의를 듣게 됩니다.\n3학년  2학년에 수강한 분야들 중 하나 혹은 두 분야에 초점을 맞추어 수\n업을 들으면서 졸업논문 프로젝트를 위한 강의도 수강하게 됩니다.\n4학년  실습이나 연습 과목 위주로 수강하면서 졸업논문 계획서 제출, \n졸업논문 작성 및 완성본 제출을 하게 됩니다.\n졸업 후 진로 \n-  기업: 마케팅, 콘텐츠 비즈니스, 콘텐츠 기획, 해외전략기획 \n-  공기업: 관광, 민간외교, 문화교류, 전시, 기록관리 \n-  대학원: 국제대학원, 일반대학원의 한국어교육 및 한국학 관련 학과 \nQ&A \nQ1. 한국학과 학생들은 졸업 후 주로 어떤 분야로 진출하나요? \nA1.  한국학과 졸업생들은 학과에서 이수한 전공 교육에 기초하여 국내·외', '서 최고라 자부\n-  재학생들 관련 경진 대회 수상 다수(교수진의 전폭적인 지원을 통해 \n졸업 후 취업 가능성 최대화)\n주요 실적 \n-  대학생 산업공학프로젝트 경진대회 최근 5년간 대상 2회 등 다수 수상\n-  산업공학회 석사논문경진대회 최근 5년간 대상, 최우수상 포함 다\n수 수상\n-  INFORMS Analytics & OR Student Team Competition Third \nPrize 2년 연속 수상\n-  국내 대학 산업공학과 중에 각종 학회, 경진대회 압도적인 수상 실\n적 보유\n주요 전공과목 \n-  경영과학 (Operations Research): 선형계획법 및 네트워크 이론을 \n중심으로 결정론적 최적화 이론 및 알고리즘을 학습하고 실제 문제의 \n모형화 방법 및 해법을 배웁니다. \n-  생산계획 및 통제 (Production Planning & Control): 제품 및 서비\n스의 생산 활동을 전반적으로 계획하고 통제하는 데 사용되는 수요예', '기본 지식을 배우고 필요한 기술 및 연구 능력을 배양합니다.\n학과(부) 특별 프로그램 \n-  졸업생들의 정성으로 모은 동문장학금 지급(가계 곤란자와 성적우수자) \n-  매 학기 성적 우수자 장학금 지급\n-  교수-학생, 졸업생-3·4학생 멘토링 프로그램 운영\n-  본교 석·박사과정 진학 시 장학생 우선선발 등(본교 내규에 따름)\n학과(부) 행사 및 동아리 활동 \n-  홈커밍 데이: 재학생과 졸업생 선배님들과의 친목 활동\n-  학회: 관심 있는 분야를 연구, 공부', '서 최고라 자부\n-  재학생들 관련 경진 대회 수상 다수(교수진의 전폭적인 지원을 통해 \n졸업 후 취업 가능성 최대화)\n주요 실적 \n-  대학생 산업공학프로젝트 경진대회 최근 5년간 대상 2회 등 다수 수상\n-  산업공학회 석사논문경진대회 최근 5년간 대상, 최우수상 포함 다\n수 수상\n-  INFORMS Analytics & OR Student Team Competition Third \nPrize 2년 연속 수상\n-  국내 대학 산업공학과 중에 각종 학회, 경진대회 압도적인 수상 실\n적 보유\n주요 전공과목 \n-  경영과학 (Operations Research): 선형계획법 및 네트워크 이론을 \n중심으로 결정론적 최적화 이론 및 알고리즘을 학습하고 실제 문제의 \n모형화 방법 및 해법을 배웁니다.', '## [heading1] ##\n# ⑦ 디지털인문한국학전공(서울캠퍼스에서 수강)\n\n## [heading1] ##\n# ※ 신규신청 불가\n\n## [paragraph] ##\n1) 한국의 인문학적 전통과 문화에 대한 심층적 지식을 바탕으로 디지털 매체를 활용한 해외\n송출과 쌍방향 소통이 가능한 지식통합형 인재를 길러내기 위한 융합전공으로 한국의 언어/\n문학, 사상, 역사에 대한 인문지식을 균형 있게 학습하고 이를 디지털 테크놀로지를 활용하\n여 콘텐츠화 하는 방법론을 습득함\n\n## [heading1] ##\n# 2) 이수학점 및 이수영역\n\n## [table] ##\n| 구분 | 이수학점 | 이수영역 |\n| --- | --- | --- |\n| 2014 학번까지 | 54학점 | 공통기초 6학점 + 연계기초 6학점 + 전공교과 42학점 |\n| 2015 학번부터 | 42학점 | 공통기초 6학점 + 연계기초 6학점 + 전공교과 30학점 |', '2026년 전기 학위수여식 일정:\n2026-02-20 (금요일)', '어떤 일을 할 수 있나요?\nA2.  적지 않은 졸업생들이 기록연구사, 역사교사, 학예연구원 등으로 \n활발하게 활동하고 있습니다. 최근에는 역사콘텐츠의 중요성이 제\n고되면서, 문화예술, 게임분야에서 활약하는 졸업생들도 늘어나\n고 있습니다. \n학과(부) 행사 및 동아리 활동 \n-  동사무소(동양철학): 공자, 맹자 등 특정 철학자의 사상에만 국한되지 \n않고, 전반적인 동양 철학사의 흐름과 이에 따른 사상적 차이들을 학\n습하며 이에 대한 의견을 학회원들끼리 토의합니다.\n-  엑스페르고(서양철학): 혼자 읽고 이해하기엔 버거운 여러 철학 고전 \n서적들을 함께 읽어나가며 자유롭게 토론합니다. 이를 통해 철학자들\n의 사유를 이해하고 비판적 시각을 통해 스스로의 철학적 사유를 기르\n는 훈련을 할 수 있습니다.\n-  앤솔로지(예술철학): 아름다움과 예술 이전의 논의들을 학습한 후 현\n대 문화를 파악하는 여러 방법들을 공부합니다.']","'글스산'은 '글로벌스포츠산업학부'를 의미합니다. 졸업 후 글로벌스포츠산업학부의 졸업생들은 다양한 진로를 선택할 수 있습니다. 

졸업 후 진로는 다음과 같습니다:

1. **스포츠 매니지먼트 및 이벤트 기획**: 스포츠 클럽, 리그, 대회, 이벤트 등을 기획하고 운영하는 직무에 진출할 수 있습니다.
2. **스포츠 마케팅 및 홍보**: 스포츠 산업에서 제품, 서비스, 이벤트 등을 마케팅하고 홍보하는 업무를 수행할 수 있습니다.
3. **스포츠 데이터 분석가**: 스포츠 경기에서 발생하는 다양한 데이터를 수집하고 분석하여 팀이나 선수의 성과를 향상시키는 데 필요한 정보를 제공하는 역할을 할 수 있습니다.

이 외에도 관련 분야에서 다양한 직무를 수행할 수 있으며, 대학원 진학이나 창업의 기회도 있습니다. 졸업 후 진로에 대한 더 구체적인 정보는 담당 교수님께 문의하시기 바랍니다. 혹시 더 도와드릴까요?","글로벌스포츠산업학부를 졸업하면 주로 다음과 같은 분야에서 활동하게 됩니다:
1. 스포츠매니지먼트 및 이벤트 기획
2. 스포츠 마케팅 및 홍보
3. 스포츠 데이터 분석가
4. 스포츠 미디어
이 외에도 졸업 후에는 대학원 진학이나 관련 분야의 연구를 진행할 수 있는 기회도 있습니다.",0.28333333332388894,1.0,0.9166666666666666,0.7635269701512093
졸업하기 전에 무슨 영어성적 제출해야 된다고 했던거 같은데 그건 뭐야?,"['## [heading1] ##\n# 2. 졸업시험 / 논문\n\n## [list] ##\n- 가. 1전공, 이중전공, 제2전공(2006학번 이전)은 반드시 졸업시험이나 논문을 통과하여야\n- 졸업이 가능함\n- 나. 매 학기 중반(4~5월, 10~11월)에 졸업시험 및 논문작성/심사 등을 진행하며, 학과별,\n- 전공별 조건 및 일정은 각 학과사무실에 확인하여 기간 내 조치토록 함\n- 다. 졸업시험/논문에 합격 후 졸업 시까지 그 자격이 유효하나, 합격 후 제적처리가 되는\n- 경우에는 합격이 취소됨\n- 라. 졸업시험FLEX와 외국어인증은 별도이므로 각각 요건을 확인하고 응시 / 처리하여야 함\n\n## [paragraph] ##\n3. 외국어인증(졸업인증) : 입학과 동시에 제출 가능', '을 공부해 두는 것이 좋습니다. 졸업 후 취업 또는 진학에 관계없이 영어 \n구사 능력은 항시 요구되므로 대학 입학 이후부터 읽기, 듣기, 말하기, \n쓰기 모든 분야에서 영어 능력을 지속적으로 계발하는 것이 매우 중요\n합니다. 고학년 기간에는 이론적인 지식이 아니라 연구실 인턴을 통해 \n관심분야의 연구를 경험해보며 자신의 진로를 준비하는 것이 좋습니다.\n졸업 후 진로 \n-  기업체: 석유화학, 반도체/전자, 에너지, 신소재, 재료, 바이오, 의료 및 \n제약, 화장품 및 식품 분야\n-  정부 및 공공기관: 국가/지방 공무원 및 정부 산하 공기업\n-  학자 및 연구직: 대학 교수, 국공립연구소 및 정부 출연 연구소, 기\n업 연구소\n-  기타: 교사(교직이수), 창업\nQ&A', '2. 졸업시험 / 논문 ······································································ 17\n3. 외국어인증(졸업인증) ······································································ 17\n4. 기타 졸업관련 사항 ······································································ 20\n(졸업요건별 학적사항)\nⅢ. 교과영역 및 교과목 안내\n1. 전 공(이중/ 부전공) ····································································· 21\n2. 교 양(실외포함) ····································································· 21', '[공통] 외국어인증 신청서 제출 안내\n\n| 제출서류 | 1. 외국어인증 신청서(첨부파일 참조) 2. 제출시점 기준 유효기간(2년) 이내의 인증 시험 성적(또는 대체 과정 수료증) ※성적표 미리보기 캡쳐본\xa0성적 처리 불가 | 1. 외국어인증 신청서(첨부파일 참조) 2. 제출시점 기준 유효기간(2년) 이내의 인증 시험 성적(또는 대체 과정 수료증) ※성적표 미리보기 캡쳐본\xa0성적 처리 불가 | 1. 외국어인증 신청서(첨부파일 참조) 2. 제출시점 기준 유효기간(2년) 이내의 인증 시험 성적(또는 대체 과정 수료증) ※성적표 미리보기 캡쳐본\xa0성적 처리 불가 | 1. 외국어인증 신청서(첨부파일 참조) 2. 제출시점 기준 유효기간(2년) 이내의 인증 시험 성적(또는 대체 과정 수료증) ※성적표 미리보기 캡쳐본\xa0성적 처리 불가 |\n| 제출마감일 | 재학기간 동안\xa01회,\xa0외국어 인증 신청서를 제출하고자 하는 학기 말까지 ※\xa0졸업예정자는 졸업하고자 하는 최종 학기 말까지 반드시 제출해야함. | 재학기간 동안\xa01회,\xa0외국어 인증 신청서를 제출하고자 하는 학기 말까지 ※\xa0졸업예정자는 졸업하고자 하는 최종 학기 말까지 반드시 제출해야함. | 재학기간 동안\xa01회,\xa0외국어 인증 신청서를 제출하고자 하는 학기 말까지 ※\xa0졸업예정자는 졸업하고자 하는 최종 학기 말까지 반드시 제출해야함. | 재학기간 동안\xa01회,\xa0외국어 인증 신청서를 제출하고자 하는 학기 말까지 ※\xa0졸업예정자는 졸업하고자 하는 최종 학기 말까지 반드시 제출해야함. |\n| 제출처 | 학생의\xa01전공 소속 단과대학 담당에게\xa0E-mail\xa0제출 | 학생의\xa01전공 소속 단과대학 담당에게\xa0E-mail\xa0제출 | 학생의\xa01전공 소속 단과대학 담당에게\xa0E-mail\xa0제출 | 학생의\xa01전공 소속 단과대학 담당에게\xa0E-mail\xa0제출 |\n| 제출처 | 서울캠퍼스 | 영어대학 /\xa0아시어언어문화대학 / AI융합대학 | haksa7@hufs.ac.kr | 02) 2173-2264 |', '을 공부해 두는 것이 좋습니다. 졸업 후 취업 또는 진학에 관계없이 영어 \n구사 능력은 항시 요구되므로 대학 입학 이후부터 읽기, 듣기, 말하기, \n쓰기 모든 분야에서 영어 능력을 지속적으로 계발하는 것이 매우 중요\n합니다. 고학년 기간에는 이론적인 지식이 아니라 연구실 인턴을 통해 \n관심분야의 연구를 경험해보며 자신의 진로를 준비하는 것이 좋습니다.\n졸업 후 진로 \n-  기업체: 석유화학, 반도체/전자, 에너지, 신소재, 재료, 바이오, 의료 및 \n제약, 화장품 및 식품 분야\n-  정부 및 공공기관: 국가/지방 공무원 및 정부 산하 공기업\n-  학자 및 연구직: 대학 교수, 국공립연구소 및 정부 출연 연구소, 기\n업 연구소\n-  기타: 교사(교직이수), 창업\nQ&A \nQ1.  한국외대 화학과에 진학하려고 하는데 영어를 잘해야 하나요?\nA1.   한국외대 화학과에서는 원서 전공 교과목 수업과 영어 졸업논문 발\n표 등을 통해 화학 전문 영어를 습득하게 합니다. 또한, 외국어 대', '[공통] 외국어인증 신청서 제출 안내\n\n[공통] 외국어인증 신청서 제출 안내\n\n외국어인증 신청서 제출 안내\n\n외국어인증 신청서 제출에 대해 아래와 같이 안내합니다 .\n\n1. 외국어인증이란\n\n서울캠퍼스 수강편람 바로가기\n\n(수강편람목록- 수강편람 중 해당 페이지 참조)\n\n글로벌캠퍼스 수강편람 바로가기\n\n(수강편람목록- 수강편람 중 해당 페이지 참조 )\n\n2. 외국어인증 신청서 제출 안내\n\n제출서류\n\n1. 외국어인증 신청서(첨부파일 참조)\n\n2. 제출시점 기준 유효기간(2년) 이내의 인증 시험 성적 ( 또는 대체 과정 수료증 )\n\n※성적표 미리보기 캡쳐본\xa0성적 처리 불가\n\n제출마감일\n\n재학기간 동안 1 회 , 외국어 인증 신청서를 제출하고자 하는 학기 말 까지\n\n※ 졸업예정자는 졸업하고자 하는 최종 학기 말까지 반드시 제출해야함 .\n\n제출처\n\n학생의 1 전공 소속 단과대학 담당에게 E-mail 제출\n\n서울캠퍼스\n\n영어대학 / 아시어언어문화대학 / AI융합대학', '- 3) 외국인전형 입학자가 전공 또는 이중전공을 언어관련 전공으로 하는 경우, 전공 또는\n- 이중전공 졸업시험 통과 시 외국어인증으로 자동 처리됨(수료 희망자는 별도 문의)\n- 4) FLEX 시험 안내는 대한상공회의소 홈페이지, 학교 홈페이지 <FLEX센터>를 통하여 확\n- 인할 수 있으며, 시험 횟수가 제한적이므로 미리 준비하여 졸업에 차질이 없도록 할 것', '3학년  통번역을 중점적으로 다루며 졸업시험을 위한 FLEX 준비도 시\n작하게 됩니다. \n4학년  인터뷰하기, 이력서 쓰기, 계약 서류 작성하기와 같은 실용 그\n리스어·불가리아어를 가르칩니다. 그리스·불가리아에 대한 다면\n적, 다각도적인 심화 교육을 위해 그리스·불가리아 데이터를 활\n용한 빅데이터 분석, 메타버스 활용 수업, 무역 실습 등을 동시\n에 운영합니다. \n졸업 후 진로 \n-  정부 및 공공기관: 대사관, 정부 산하 공기업 및 준정부기관\n-  기업: 국내, 아테네 및 소피아 소재 대기업, 방송사, 항공사, 언론사, \n광고·PR사, IT 등\n-  학계: 대학교수, 국내외 연구기관 연구원, 국내외 석·박사 진학\n-  창업: 한국-그리스, 한국-불가리아 수출입 및 이커머스 기업 창업', '다 . 제출기간 : 해당학과 사무실 문의\n\n7. FLEX 대체 ( 이탈리아어 , 태국어 , 폴란드어 , 루마니아어 , 체코어 , 헝가리어 , 세르비아어 , 그리스어 , 불가리아어 , 힌디어 )\n\n가 . 해당학과 : 자세한 사항은 첨부파일 참조\n\n나 . 시험일자 : 2025. 5. 24( 토 ) 오전 10:00 서울캠퍼스 시행예정\n\n※ 정확한 시간 / 장소는 추후 통지\n\n다 . 접수기간 : 2025. 4. 16.( 수 ) ~ 4. 23.( 수 ) 해당학과 사무실에 신청 ( 기한 이후 추가 신청 불가 )\n\n* 7 학기 이상 재적생만 신청가능\n\n8. 유의 사항\n\n가 . 졸업시험 및 졸업논문 심사에 통과한 자는 졸업 시까지 그 자격이 유효함 ( 단 , 학적을 상실한 때에는 그 자격을 인정하지 아니함 )\n\n나 . 제 2 전공 , 이중전공자도 해당학과 문의 / 학과에 따른 졸업시험 응시 , 논문 제출 등 pass 하기 바람', '## [paragraph] ##\n4) 졸업 요건 : 졸업 시험 및 논문 중 택일(지도교수가 배정 졸업 논문 지도)\n\n## [list] ##\n- 5) 문의처 : wacihufs@hufs.ac.kr(홈페이지 : wacimajor.hufs.ac.kr)\n\n## [footer] ##\n- 50 -', '인정함 10) 글로벌캠퍼스 소속 학생이 서울캠퍼스 계절학기 등으로 아래 교과목 이수 시 - Communicative English 교과목 : 대학영어 교과목으로 인정 11) 제 15쪽의 ‘자선’ 교과목(학점)은 본인이 원할 경우 ‘교양’으로 인정받을 수 있음. 다만, 외국인 학생은 본인 국적언어 어학학습 관련 과목 수강은 인정하지 않음', '| 제출마감일 | 재학기간 동안\xa01회,\xa0외국어 인증 신청서를 제출하고자 하는 학기 말까지 ※\xa0졸업예정자는 졸업하고자 하는 최종 학기 말까지 반드시 제출해야함. | 재학기간 동안\xa01회,\xa0외국어 인증 신청서를 제출하고자 하는 학기 말까지 ※\xa0졸업예정자는 졸업하고자 하는 최종 학기 말까지 반드시 제출해야함. | 재학기간 동안\xa01회,\xa0외국어 인증 신청서를 제출하고자 하는 학기 말까지 ※\xa0졸업예정자는 졸업하고자 하는 최종 학기 말까지 반드시 제출해야함. | 재학기간 동안\xa01회,\xa0외국어 인증 신청서를 제출하고자 하는 학기 말까지 ※\xa0졸업예정자는 졸업하고자 하는 최종 학기 말까지 반드시 제출해야함. |\n| 제출처 | 학생의\xa01전공 소속 단과대학 담당에게\xa0E-mail\xa0제출 | 학생의\xa01전공 소속 단과대학 담당에게\xa0E-mail\xa0제출 | 학생의\xa01전공 소속 단과대학 담당에게\xa0E-mail\xa0제출 | 학생의\xa01전공 소속 단과대학 담당에게\xa0E-mail\xa0제출 |', '[글로벌] 2025년 전기(2월 졸업) 졸업예비사정 결과 조회 안내\n\n(* 교원자격증 취득 관련 : 교직 담당자 (031-330-4953) 에게 문의 )\n\n다 . 학과에서 제출한 졸업시험 및 논문 , 단과대학 교학과에 제출한 외국어인증은 기준 시점 까지 반영되었으므로 이상이 있을 경우 반드시 학과 및 단과대학 교학과 문의\n\n학과사무실 연락처 검색 ( 클릭 시 이동 )\n\n라 . 졸업 또는 졸업대기 ( 수료 ) 를 원하는 학생은 1 월 14 일 ( 화 ) 오전 까지 미비된 요건을 완료 바람 .\n\n마 . 외국어연수평가원/외국어교육센터\xa0이수자는\xa0프로그램\xa0종강에 따라 기관에서 명단\xa0반영 예정\n\n4. 추가 확인 필요 사항\n\n가 . 이수구분 수정 ( 교류과목 자선 -> 전공 , 전공인정 교양과목 -> 전공 자선 -> 교양 등 ) 을 하지 않아 학점이 미비 된 학생은 반드시 단과대학 교학과에 7 월 18 일 ( 목 ) 까지 이수구분 변경 ( 첨부 ) 을 하여야 졸업 또는 수료가 가능함 .\n\n이수구분 변경신청\xa0안내 ( 클릭 시 이동 )\n\n나 . 외국어인증 서류 제출 1 월 14 일 ( 화 ) 까지 단과대학 교학과로 제출 가능함\n\n( 단 , 외국어연수평가원 여름방학 특별과정 이수자는 과정 종료일 당일 수료증 제출자에 한하여 졸업사정에 반영함 )\n\n※ 특별한 사정이 있어 1 월 14 일 ( 화 ) 까지 제출이 어려운 학생은 학적 담당자 (031-330-4027) 에게 별도 문의 바람\n\n외국어 인증 안내 ( 클릭 시 이동 )\n\n다 . 글로벌 지역학사 / 지역전문가과정 신청자 중\n\n2 월 졸업 또는 졸업대기 ( 학점완료 후 졸업을 미룬 상태 ) 예정인 학생은\n\n첨부 된 서류 작성하여 학과 확인 받은 후 학사종합지원센터 학적 담당 (hufsmil@hufs.ac.kr) 에게\n\n1 월 14 일 ( 화 ) 까지 제출 하여야 학위증 및 졸업증명서에 지역학사 또는 지역전문가 반영됨 .\n\n( 단 , 미제출 하여도 졸업 또는 졸업대기가 가능함 .)\n\n( 방문제출 또는 이메일제출 가능하며 기제출자는 제출 불필요 . 졸업 / 졸업대기 이후 학위명 변경 불가 함 .)', '## [heading1] ##\n# 9. 성범죄 경력 조회 동의서 제출\n\n## [paragraph] ##\n무시험검정원서 제출 시(졸업\xa0직전)\xa0양식 하단에 <성범죄경력\xa0조회\xa0동의> 부분에 동의\n체크하여 제출하면 학사종합지원센터로\xa0일괄 조회(동의서\xa0미제출 시\xa0교원자격증 발급 불가)\n\n## [paragraph] ##\n10. 마약·대마·향정신성 의약품 중독자 여부 확인서 제출\n\n## [paragraph] ##\n무시험검정원서\xa0제출\xa0시(졸업\xa0직전)\xa0<마약ㆍ대마ㆍ향정신성 의약품\xa0중독에\xa0관한\xa0의사\xa0진단서>를\n제출해야\xa0함.\n\n## [paragraph] ##\n※ ‘교원자격무시험검정원서’, ‘성범죄 경력 조회 동의’, ‘ 마약·대마·향정신성 의약품 중독자\n여부 확인서’ 미제출 학생은 교원자격증을 발급받을 수 없음.\n\n## [footer] ##\n- 94 -', '을 공부해 두는 것이 좋습니다. 졸업 후 취업 또는 진학에 관계없이 영어 \n구사 능력은 항시 요구되므로 대학 입학 이후부터 읽기, 듣기, 말하기, \n쓰기 모든 분야에서 영어 능력을 지속적으로 계발하는 것이 매우 중요\n합니다. 고학년 기간에는 이론적인 지식이 아니라 연구실 인턴을 통해 \n관심분야의 연구를 경험해보며 자신의 진로를 준비하는 것이 좋습니다.\n졸업 후 진로 \n-  기업체: 석유화학, 반도체/전자, 에너지, 신소재, 재료, 바이오, 의료 및 \n제약, 화장품 및 식품 분야\n-  정부 및 공공기관: 국가/지방 공무원 및 정부 산하 공기업\n-  학자 및 연구직: 대학 교수, 국공립연구소 및 정부 출연 연구소, 기\n업 연구소\n-  기타: 교사(교직이수), 창업\nQ&A \nQ1.  한국외대 화학과에 진학하려고 하는데 영어를 잘해야 하나요?\nA1.   한국외대 화학과에서는 원서 전공 교과목 수업과 영어 졸업논문 발\n표 등을 통해 화학 전문 영어를 습득하게 합니다. 또한, 외국어 대\n학의 장점으로 영어를 배울 수 있는 환경(교내 English Zone 운영 \n등)이 잘 갖춰져 있어 영어가 부족하더라도 잘 적응해 나갈 수 있\n습니다.\nQ2.  고등학교 때 화학 과목을 배우지 않았는데 화학과에 진학할 수 있\n을까요?\nA2.  진학은 가능합니다만 반드시 입학 전에 고등학교 과정의 화학을 \n공부해두기 바랍니다. 고등학교 화학의 심화과정인 일반화학 과목\n은 1학년 때 배우며, 2학년부터는 완전히 새로운 전공과목을 수강\n하게 됩니다.\nQ3.  화학과 졸업 후 취업은 잘 되나요? 자연대가 공대에 비해 취업이 \n불리하지 않나요?\nA3.  화학의 큰 장점이 많은 학문 및 기술들과 링크가 되어있다는 것입\n니다. 따라서, 취업할 회사가 매우 많습니다. 석유화학, 반도체/전\n자, 에너지, 바이오, 의료 및 제약, 화장품 및 식품 등의 진로가 가능\n하며 일반 회사원뿐 아니라 연구원, 교수, 공무원, 교사로 갈 수 있\n습니다. 또한, 취업 시장에서 일반적으로 화학 계열로 모집하기 때\n문에 대부분 화학과와 화학 공학과의 차이가 별로 없습니다. 자연\n대 화학과의 경우 화학에 대하여 더 깊이있게 배우기 때문에 R&D\n와 같이 연구를 요하는 전문분야에서는 자연대 화학과를 선호하는 \n경우가 많습니다.\nQ4. 최근 반도체와 에너지 및 AI 산업에도 취업이 잘 되나요?\nA4.  반도체산업에서는 화학물질을 사용하는 공정이 많으므로 소재 및']","졸업하기 전에 제출해야 하는 영어 성적은 외국어 인증과 관련된 사항입니다. 영어 통번역학부 소속 학생들은 졸업하기 위해 영어 관련 인증시험 성적을 제출해야 합니다. 

제출해야 하는 성적은 다음과 같습니다:

1. **TOEIC, TOEFL, IELTS 등**: 공인된 영어 능력 시험의 성적이 필요합니다.
2. **FLEX 외국어 능력 시험**: FLEX 시험에서 일정 점수 이상을 취득하면 외국어 인증으로 인정받을 수 있습니다.

정확한 제출 기준과 성적은 학과에 따라 다를 수 있으므로, 졸업 예정 학기 말까지 반드시 해당 학과 사무실에 문의하여 확인하시기 바랍니다. 혹시 더 도와드릴까요?","졸업하기 전에 제출해야 하는 영어 성적은 외국어 인증을 위한 것으로, 다음과 같은 기준을 충족해야 합니다:

1.**인증 시험 성적**: 제출 시점 기준 유효기간(2년) 이내의 인증 시험 성적이 필요합니다. 인정되는 시험은 다음과 같습니다:
- TOEIC
   - TOEFL
   - IELTS
   - FLEX 외국어 능력 시험 등

2.**대체 과정 수료증**: 인증 시험 성적 대신 외국어 연수 평가원 또는 외국어 교육센터에서 제공하는 대체 과정을 이수한 경우,해당 수료증을 제출할 수 있습니다.

3. **제출 마감일**: 졸업하고자 하는 최종 학기 말까지 반드시 제출해야 하며,재학 기간 동안 1회 외국어 인증 신청서를 제출할 수 있습니다.

정확한 기준과 제출 방법은 학사종합지원센터에 문의하시거나, 해당 과목의 담당 교수님께 확인하시기 바랍니다.",0.7126290376219114,0.6666666666666666,0.7142857142857143,0.0
후기 이중에 대해 설명해줘.,"['정하는 시간을 갖게 됩니다.\n2학년  한국문학, 한국역사, 한국문화로 나눠진 한국학 관련 전공 수업과 더\n불어 한국어교원 관련 과목을 본격적으로 수강하게 됩니다. 이상의 \n네 분야 중 학생이 선택한 분야에 초점을 맞추어 강의를 듣게 됩니다.\n3학년  2학년에 수강한 분야들 중 하나 혹은 두 분야에 초점을 맞추어 수\n업을 들으면서 졸업논문 프로젝트를 위한 강의도 수강하게 됩니다.\n4학년  실습이나 연습 과목 위주로 수강하면서 졸업논문 계획서 제출, \n졸업논문 작성 및 완성본 제출을 하게 됩니다.\n졸업 후 진로', '2. 유고결석·결시 처리 절차 ····································································· 68\n3. 이중전공 및 부전공(전공심화) ····································································· 70\n4. 후기이중전공 ····································································· 75\n5. 조기졸업 ····································································· 76', '네 분야 중 학생이 선택한 분야에 초점을 맞추어 강의를 듣게 됩니다.\n3학년  2학년에 수강한 분야들 중 하나 혹은 두 분야에 초점을 맞추어 수\n업을 들으면서 졸업논문 프로젝트를 위한 강의도 수강하게 됩니다.\n4학년  실습이나 연습 과목 위주로 수강하면서 졸업논문 계획서 제출, \n졸업논문 작성 및 완성본 제출을 하게 됩니다.\n졸업 후 진로 \n-  기업: 마케팅, 콘텐츠 비즈니스, 콘텐츠 기획, 해외전략기획 \n-  공기업: 관광, 민간외교, 문화교류, 전시, 기록관리 \n-  대학원: 국제대학원, 일반대학원의 한국어교육 및 한국학 관련 학과 \nQ&A \nQ1. 한국학과 학생들은 졸업 후 주로 어떤 분야로 진출하나요? \nA1.  한국학과 졸업생들은 학과에서 이수한 전공 교육에 기초하여 국내·외', '을 공부해 두는 것이 좋습니다. 졸업 후 취업 또는 진학에 관계없이 영어 \n구사 능력은 항시 요구되므로 대학 입학 이후부터 읽기, 듣기, 말하기, \n쓰기 모든 분야에서 영어 능력을 지속적으로 계발하는 것이 매우 중요\n합니다. 고학년 기간에는 이론적인 지식이 아니라 연구실 인턴을 통해 \n관심분야의 연구를 경험해보며 자신의 진로를 준비하는 것이 좋습니다.\n졸업 후 진로 \n-  기업체: 석유화학, 반도체/전자, 에너지, 신소재, 재료, 바이오, 의료 및 \n제약, 화장품 및 식품 분야\n-  정부 및 공공기관: 국가/지방 공무원 및 정부 산하 공기업\n-  학자 및 연구직: 대학 교수, 국공립연구소 및 정부 출연 연구소, 기\n업 연구소\n-  기타: 교사(교직이수), 창업\nQ&A', '## [heading1] ##\n# 4. 융합전공\n\n## [heading1] ##\n# 가. 융합전공 개요\n\n## [list] ##\n- 1) 2개 이상의 학과(학부/전공)가 연계하여 개설한 전공으로, 융합전공은 이중(제2)전공\n- 으로만 이수 가능함(국가리더전공 및 데이터사이언스전공은 부전공도 가능)\n- 2) 이중전공으로 이수하므로, 학번대에 따라 42학점 또는 54학점을 이수하여야 함\n- 3) 2006학번 이전 학생은 문화콘텐츠학, EU, 동북아전공에 한해 이수 가능\n- 4) 융합전공 졸업논문/졸업시험 시행은 관련 학과 협의로 시행하되, 그 절차는\n- “졸업논문 및 졸업시험 시행규정”에 따름\n- 5) 융합전공은 후기 이중전공 불가\n- 6) 개설 전공\n\n## [table] ##\n| 일반융합전공 | 일반융합전공 |\n| --- | --- |\n| 나-① | BRICs(브릭스)전공 |\n| 나-② | EU(유럽연합)전공 (EU전공(글로벌)은 2023학년도부터 폐지, 서울에 개설된 EU전공만 신청 가능) |\n| 나-③ | 동북아외교통상전공[(구) 동북아전공] (동북아전공(글로벌)은 2018-2학기부터 폐지, 서울에 개설된 동북아외교통상전공만 신청 가능) |\n| 나-④ | 문화콘텐츠학전공 |\n| 나-⑤ | 국가리더전공 |\n| 나-⑥ | 세계문화예술경영전공 |\n| 나-⑦ | 디지털인문한국학전공(신규신청 불가) |\n| 나-⑧ | 데이터사이언스전공(신규신청 불가) |\n| 나-⑨ | 바이오데이터사이언스전공(신규신청 불가) |\n| 나-⑩ | AI융합전공(Software&AI, Language&AI, Business&AI 트랙)(신규신청 불가) |\n| 나-⑪ | Business & AI전공 |', '| 6 | 15 | 16 | 17 | 18 | 19 | 20 | 21 | 6. 6(금) 6. 9(월) - 6. 13(금) 6. 13(금) 6. 16(월) - 6. 20(금) 6. 20(금) - 6. 27(금) 6. 23(월) | 현충일 제1학기 보강주간 졸업시험 성적보고서 및 졸업논문 심사보고서 제출 마감 제1학기 기말시험 제1학기 성적입력 하계방학 및 계절학기 개강 |\n| 6 | 22 | 23 | 24 | 25 | 26 | 27 | 28 | 6. 6(금) 6. 9(월) - 6. 13(금) 6. 13(금) 6. 16(월) - 6. 20(금) 6. 20(금) - 6. 27(금) 6. 23(월) | 현충일 제1학기 보강주간 졸업시험 성적보고서 및 졸업논문 심사보고서 제출 마감 제1학기 기말시험 제1학기 성적입력 하계방학 및 계절학기 개강 |\n| 6 | 29 | 30 |  |  |  |  |  | 6. 6(금) 6. 9(월) - 6. 13(금) 6. 13(금) 6. 16(월) - 6. 20(금) 6. 20(금) - 6. 27(금) 6. 23(월) | 현충일 제1학기 보강주간 졸업시험 성적보고서 및 졸업논문 심사보고서 제출 마감 제1학기 기말시험 제1학기 성적입력 하계방학 및 계절학기 개강 |\n| 7 |  |  | 1 | 2 | 3 | 4 | 5 | 6. 30(월) - 7. 4(금) 7. 11(금) 7. 30(수) | 제1학기 성적 열람 및 정정 계절학기 종강 2025년 후기 졸업 사정회의 |\n| 7 | 6 | 7 | 8 | 9 | 10 | 11 | 12 | 6. 30(월) - 7. 4(금) 7. 11(금) 7. 30(수) | 제1학기 성적 열람 및 정정 계절학기 종강 2025년 후기 졸업 사정회의 |\n| 7 | 13 | 14 | 15 | 16 | 17 | 18 | 19 | 6. 30(월) - 7. 4(금) 7. 11(금) 7. 30(수) | 제1학기 성적 열람 및 정정 계절학기 종강 2025년 후기 졸업 사정회의 |', '사료를 분석하는 방법도 익히게 됩니다.\n3학년  한국사, 동양사, 서양사와 관련된 다양한 전공심화 과목과 응용\n역사학 강좌를 공부하게 됩니다. 스스로 연구논문을 작성할 수 \n있는 기초를 배양하게 됩니다.\n4학년  전공심화과목을 수강하고, 본인 진로와 관련된 강좌를 집중적으로 \n이수합니다. 학과 전임교수의 지도하에 졸업논문을 작성합니다. \n졸업 후 진로 \n-  정부 및 공공기관: 국공립 박물관의 학예직공무원, 국가기록원 및 지\n자체·대학역사관의 기록연구사, 공무원 등\n-  교육 및 연구: 대학교수, 역사교사, 역사문화 관련 연구소 및 박물관', '분야에서 컴퓨터 프로그래밍 및 기술을 활용하는 방법에 대해 다루\n는 수업입니다.\n-  스포츠재무관리: 스포츠 산업 내에서 재무적인 측면을 이해하는 데 필\n요한 기초적인 개념과 도구들을 다루는 과목입니다.\n-  스포츠이벤트기획 및 실습: 스포츠 이벤트를 기획하고 운영하는 데 필\n요한 전략적인 개념과 실무적인 능력을 학습하는 과목입니다.\n학과(부) 특별 프로그램 \n-  국내/국제 스포츠 이벤트 방문 및 관람\n-  해양스포츠 (스노쿨링 및 서핑 등) 참여\n-  동계스포츠 (스키 및 스노우보드) 참여\n-  교내 및 전국구 규모의 스포츠이벤트 대회 개최\n-  스포츠산업 내 다양한 분야 전문가들 특강 진행\n-  졸업생들과의 만남 \n-  본교 대학원 진학 시 장학금 지급\n학과(부) 행사 및 동아리 활동 \n-  IWAY 학회: 축구부 활동 및 축구 산업에 대한 토론 \n-  STEPPER 학회: 스포츠산업 관련 기사, 영상 및 팟캐스트 제작\n-  HIKERS 학회: 야구부 활동 및 야구구단 프런트 업무 수행\n-  FC HOLICS: 여자 축구부 활동\n-  MADDOGS: 다소 생소한 라크로스 운동부 활동\n-  라마제: 매년 개최되는 홈커밍데이', '다임의 AI tech leader님을 연사로 모셨습니다.\n-  과동아리 HABIT은 프로그래밍과 기계학습을 공부하는 학생들의 연\n구모임입니다.\nDept. of Mathematics\n수학과\n전화번호 031-330-4262\n홈페이지 math.hufs.ac.kr\n슬기로운 대학생활 \n수학과는 깊은 사고력과 추상적인 개념을 능숙하게 다룰 수 있는 논리\n력을 지닌 인재를 길러내고자 합니다. 문명과 기술이 첨단화되고 고도\n화되면서 많은 업무가 자동화되는 지금은 단순한 지식 습득의 수준을 \n넘어 수학과가 지향하는 인재가 요구되고 있습니다. 대학생활은 어떠한 \n분야에 본인이 어울리는지, 그리고 필요한 준비를 해야 하는 시기입니\n다. 관련하여 다음과 같이 몇 가지 조언을 제시합니다.\n1.  다양한 경험을 쌓으세요. 실패를 통해 남을 이해할 수 있는 아량을 얻\n고, 어려움을 극복하고 성공한 경험을 통해 미래의 힘든 시기를 이겨\n낼 수 있게 하는 자존감을 쌓으세요.', '람이 이해하기 쉽게 설명하는 연습을 해보세요. \n우리 학과(부)·전공 매력 \n-  인공지능, 4차 산업혁명을 위한 인재 양성\n-  최고 수준은 교수진이 제공하는 최고의 교육\n-  실용적/문제 해결 능력 중심 교육을 통한 졸업 후 취업의 질과 양에\n서 최고라 자부\n-  재학생들 관련 경진 대회 수상 다수(교수진의 전폭적인 지원을 통해 \n졸업 후 취업 가능성 최대화)\n주요 실적 \n-  대학생 산업공학프로젝트 경진대회 최근 5년간 대상 2회 등 다수 수상\n-  산업공학회 석사논문경진대회 최근 5년간 대상, 최우수상 포함 다\n수 수상', '| 7 | 13 | 14 | 15 | 16 | 17 | 18 | 19 | 6. 30(월) - 7. 4(금) 7. 11(금) 7. 30(수) | 제1학기 성적 열람 및 정정 계절학기 종강 2025년 후기 졸업 사정회의 |\n| 7 | 20 | 21 | 22 | 23 | 24 | 25 | 26 | 6. 30(월) - 7. 4(금) 7. 11(금) 7. 30(수) | 제1학기 성적 열람 및 정정 계절학기 종강 2025년 후기 졸업 사정회의 |\n| 7 | 27 | 28 | 29 | 30 | 31 |  |  | 6. 30(월) - 7. 4(금) 7. 11(금) 7. 30(수) | 제1학기 성적 열람 및 정정 계절학기 종강 2025년 후기 졸업 사정회의 |\n| 8 |  |  |  | 6 |  | 1 | 2 | 8. 4(월) - 8. 8(금) 8. 15(금) 8. 22(금) | 제2학기 휴․복학 신청 제2학기 수강신청 광복절 2025년 후기 학위수여식 |\n| 8 | 3 | 4 | 5 |  | 7 | 8 | 9 | 8. 4(월) - 8. 8(금) 8. 15(금) 8. 22(금) | 제2학기 휴․복학 신청 제2학기 수강신청 광복절 2025년 후기 학위수여식 |\n| 8 | 10 | 11 | 12 | 13 | 14 | 15 | 16 | 8. 4(월) - 8. 8(금) 8. 15(금) 8. 22(금) | 제2학기 휴․복학 신청 제2학기 수강신청 광복절 2025년 후기 학위수여식 |\n| 8 | 17 | 18 | 19 | 20 | 21 | 22 | 23 | 8. 4(월) - 8. 8(금) 8. 15(금) 8. 22(금) | 제2학기 휴․복학 신청 제2학기 수강신청 광복절 2025년 후기 학위수여식 |\n| 8 | 24 31 | 25 | 26 | 27 | 28 | 29 | 30 | 8. 4(월) - 8. 8(금) 8. 15(금) 8. 22(금) | 제2학기 휴․복학 신청 제2학기 수강신청 광복절 2025년 후기 학위수여식 |', '[공통] 후기이중전공 신청 공고\n\n[공통] 후기이중전공 신청 공고\n\n(공통) 후기이중전공 신청 공고\n\n2025학년도 후기이중전공 신청 일정 및 방법 등을 공고합니다.\n\n1. 신청기간: 2025 4. 14.(월) 10:00 ~ 4. 18.(금) 16:00까지\n\n2. 신청대상: 현재 7~8학기 이수중인 자로, 후기이중전공을 희망하는 전공을 부전공으로 이수중인 자\n\n(7학기를 마치고 휴학한 학생도 이번 신청기간에 신청할 것)\n\n3. 신청방법: 인터넷 종합정보시스템에서 신청 (로그인 > 전공/교직관리 > 후기이중전공신청)\n\n4. 허가자 발표: 7월초 홈페이지 공고(예정)\n\n5. 기타사항\n\n가. 1년에 1회, 4월에만 신청하므로 반드시 희망자는 이번 신청 일정을 따를 것\n\n나. 지원학과 입학정원의 50 ~ 150% 이내에서 학과 자율 선발하되, 학과에서 요구하는 기본 자격요건 미충족 시 탈락될 수 있음\n\n(세부 배정기준은 지원학과 학과장실 문의 또는 학과 홈페이지 참조)\n\n다. 이수자 선발 이후 8학기까지 전공심화(+부전공) 또는 일반 부전공에 맞는 졸업에 필요한 졸업학점 요건을 모두 완료하여야 최종적으로 허가\n\n라. 조기졸업대상자, 학석사연계과정/석사예약제 이수자는 신청 불가(신청 희망 시 내방하여 해당 자격 취소처리 후 신청)\n\n마. 후기이중전공으로 선발되면 추가학기를 1학기 이상 무조건 등록, 수강해야 하며 등록금은 후기이중전공 학과의 등록금으로 납부해야 함\n\n바. 기타 자세한 사항은 전자규정집 ""이중전공시행규정"" 참조\n\n2025. 4.\n\n교무처장\n\n| 0 |\n|:------------------------------|\n| (공통) 후기이중전공 신청 공고 |', '[(글로벌) - 영어통번역학전공] 영역에 개설된 강의 목록입니다.\n\n[영.한시역] 2학년 대상 / 교수: 박소운 / 금요일 5,6교시 / 강의실 1409-2호 / 학점: 2 / 전공필수 과목 맞음 / 온라인강의 아님 / P/F 평가 과목 아님 / 원어강의 아님', '[공통] 후기이중전공 신청 공고\n\n[공통] 후기이중전공 신청 공고\n\n(공통) 후기이중전공 신청 공고\n\n2025학년도 후기이중전공 신청 일정 및 방법 등을 공고합니다.\n\n1. 신청기간: 2025 4. 14.(월) 10:00 ~ 4. 18.(금) 16:00까지\n\n2. 신청대상: 현재 7~8학기 이수중인 자로, 후기이중전공을 희망하는 전공을 부전공으로 이수중인 자\n\n(7학기를 마치고 휴학한 학생도 이번 신청기간에 신청할 것)\n\n3. 신청방법: 인터넷 종합정보시스템에서 신청 (로그인 > 전공/교직관리 > 후기이중전공신청)\n\n4. 허가자 발표: 7월초 홈페이지 공고(예정)\n\n5. 기타사항\n\n가. 1년에 1회, 4월에만 신청하므로 반드시 희망자는 이번 신청 일정을 따를 것', '2025년 후기 졸업 사정회의 일정:\n2025-07-30 (수요일)']","'후기 이중전공'은 부전공 이수자가 정규 8학기 내에 제1전공 졸업학점(부전공 21학점 포함)을 모두 취득한 후, 1~2학기를 추가로 수학하여 해당 부전공의 이중전공화에 필요한 나머지 학점을 취득함으로써 제1전공과 이중전공 학위를 동시에 취득하는 제도입니다.

주요 내용은 다음과 같습니다:

1. **이수학점**: 2015학번 이후는 42학점, 2007~2014학번은 54학점, 2006학번 이전은 42학점이 필요합니다.
2. **신청자격**: 부전공을 이수 중인 7~8학기 학생이 신청할 수 있으며, 조기졸업대상자 및 학·석사연계과정 이수자는 신청할 수 없습니다.
3. **신청시기**: 매년 4월 중에 신청이 이루어집니다.
4. **등록금**: 후기이중전공으로 선발되면 추가학기를 1학기 이상 등록해야 하며, 해당 학과의 등록금을 납부해야 합니다.

정확한 세부 사항은 학사종합지원센터나 담당 교수님께 문의하시기 바랍니다. 혹시 더 도와드릴까요?","후기 이중전공은 부전공 이수자가 정규 8학기 내에 제1전공 졸업학점(부전공 21학점 포함)을 모두 취득한 후, 1~2학기 추가 수학하여 해당 부전공의 이중전공화에 필요한 나머지 학점을 취득함으로써, 제1전공과 이중전공 학위를 동시에 취득하는 제도입니다.
신청은 매년 4월에 한 번만 가능하며, 신청 자격은 현재 7~8학기 이수 중인 학생으로, 부전공을 이수 중인 경우에 해당합니다.
추가학기를 등록해야 하며, 등록금은 후기 이중전공 학과의 등록금으로 납부해야 합니다. 더 궁금하신 점이 있으시면 말씀해 주시기 바랍니다.",0.4914285714187429,0.75,0.8,0.0
김정환 교수님 연구실 어디야?,"['김정환 교수님은 루마니아학과 학과 소속입니다. 교수 직위를 맡고 있습니다. 이메일은 bacovia@empas.com입니다. 연구실은 어문관 435호입니다.', '김정환 교수님은 브릭스 전공 전공 소속입니다.', '[(글로벌) - 루마니아학과] 영역에 개설된 강의 목록입니다.\n\n[루마니아학입문(2)] 1학년 대상 / 교수: 박정오 / nan / 학점: 2 / 전공필수 과목 아님 / 온라인강의 맞음 / P/F 평가 과목 아님 / 원어강의 아님\n\n[초급루마니아어문법작문] 1학년 대상 / 교수: 이호창 / 화요일 1,2,목,1교시 / 강의실 1411호 / 학점: 3 / 전공필수 과목 아님 / 온라인강의 아님 / P/F 평가 과목 아님 / 원어강의 맞음\n\n[초급루마니아어번역연습(2)] 1학년 대상 / 교수: 백승남 / 화요일 1,2교시 / 강의실 2311호 / 학점: 2 / 전공필수 과목 맞음 / 온라인강의 아님 / P/F 평가 과목 아님 / 원어강의 맞음\n\n[초급루마니아어회화(2)] 1학년 대상 / 교수: 한성숙 / 화요일 3,4교시 / 강의실 1411호 / 학점: 2 / 전공필수 과목 맞음 / 온라인강의 아님 / P/F 평가 과목 아님 / 원어강의 맞음\n\n[초급루마니아어회화(2)] 1학년 대상 / 교수: Cristina Preutu / 월요일 5,6교시 / 강의실 1411호 / 학점: 2 / 전공필수 과목 맞음 / 온라인강의 아님 / P/F 평가 과목 아님 / 원어강의 맞음\n\n[초급시청각루마니아어(2)] 1학년 대상 / 교수: 김정환 / 월요일 3교시 / 강의실 1411호 / 학점: 1 / 전공필수 과목 맞음 / 온라인강의 아님 / P/F 평가 과목 아님 / 원어강의 아님\n\n[고급루마니아어문법작문] 2학년 대상 / 교수: 김정환 / 월요일 1,2,목,2교시 / 강의실 1411호 / 학점: 3 / 전공필수 과목 맞음 / 온라인강의 아님 / P/F 평가 과목 아님 / 원어강의 아님\n\n[루마니아문화] 2학년 대상 / 교수: 박정오 / 수요일 7,8교시 / 강의실 1411호 / 학점: 2 / 전공필수 과목 아님 / 온라인강의 아님 / P/F 평가 과목 아님 / 원어강의 아님\n\n[중급루마니아어번역연습(2)] 2학년 대상 / 교수: 한성숙 / 목요일 3,4교시 / 강의실 2410호 / 학점: 2 / 전공필수 과목 맞음 / 온라인강의 아님 / P/F 평가 과목 아님 / 원어강의 아님\n\n[중급루마니아어회화(2)] 2학년 대상 / 교수: Cristina Preutu / 수요일 1,2교시 / 강의실 1411호 / 학점: 2 / 전공필수 과목 맞음 / 온라인강의 아님 / P/F 평가 과목 아님 / 원어강의 맞음\n\n[중급루마니아어회화(2)] 2학년 대상 / 교수: Cristina Preutu / 수요일 5,6교시 / 강의실 2402-1호 / 학점: 2 / 전공필수 과목 맞음 / 온라인강의 아님 / P/F 평가 과목 아님 / 원어강의 맞음\n\n[FLEX루마니아어(2)] 3학년 대상 / 교수: 안겔레스쿠록사나커털리나 / 화요일 1,2교시 / 강의실 1312호 / 학점: 2 / 전공필수 과목 아님 / 온라인강의 아님 / P/F 평가 과목 아님 / 원어강의 맞음\n\n[고급루마니아어회화(2)] 3학년 대상 / 교수: 안겔레스쿠록사나커털리나 / 화요일 3,4교시 / 강의실 1312호 / 학점: 2 / 전공필수 과목 맞음 / 온라인강의 아님 / P/F 평가 과목 아님 / 원어강의 맞음\n\n[루마니아문학개론] 3학년 대상 / 교수: 백승남 / 수요일 1,2교시 / 강의실 2310호 / 학점: 2 / 전공필수 과목 아님 / 온라인강의 아님 / P/F 평가 과목 아님 / 원어강의 맞음\n\n[루마니아민속연구] 3학년 대상 / 교수: 김정환 / 수요일 3,4교시 / 강의실 1411호 / 학점: 2 / 전공필수 과목 아님 / 온라인강의 아님 / P/F 평가 과목 아님 / 원어강의 아님\n\n[루마니아사회문화세미나] 3학년 대상 / 교수: Cristina Preutu / 화요일 7,8교시 / 강의실 2311-1호 / 학점: 2 / 전공필수 과목 아님 / 온라인강의 아님 / P/F 평가 과목 아님 / 원어강의 아님\n\n[루마니아어사] 3학년 대상 / 교수: 엄태현 / 목요일 5,6교시 / 강의실 1411호 / 학점: 2 / 전공필수 과목 아님 / 온라인강의 아님 / P/F 평가 과목 아님 / 원어강의 아님\n\n[루마니아인문과지리] 3학년 대상 / 교수: 박정오 / 화요일 7,8교시 / 강의실 1411호 / 학점: 2 / 전공필수 과목 아님 / 온라인강의 아님 / P/F 평가 과목 아님 / 원어강의 아님\n\n[루마니아정치경제의이해(2)] 3학년 대상 / 교수: Cristina Preutu / 월요일 1,2교시 / 강의실 2311-1호 / 학점: 2 / 전공필수 과목 아님 / 온라인강의 아님 / P/F 평가 과목 아님 / 원어강의 맞음\n\n[루마니아지성과현대철학] 4학년 대상 / 교수: 박정오 / 수요일 5,6교시 / 강의실 1411호 / 학점: 2 / 전공필수 과목 아님 / 온라인강의 아님 / P/F 평가 과목 아님 / 원어강의 아님\n\n[루마니아지역연구(2)] 4학년 대상 / 교수: 이호창 / 목요일 3,4교시 / 강의실 2411호 / 학점: 2 / 전공필수 과목 아님 / 온라인강의 아님 / P/F 평가 과목 아님 / 원어강의 맞음\n\n[몰도바공화국연구(2)] 4학년 대상 / 교수: 엄태현 / 수요일 5,6교시 / 강의실 2509-1호 / 학점: 2 / 전공필수 과목 아님 / 온라인강의 아님 / P/F 평가 과목 아님 / 원어강의 아님\n\n[영화를통해본루마니아사회와문화] 4학년 대상 / 교수: 김정환 / 목요일 3,4교시 / 강의실 1411호 / 학점: 2 / 전공필수 과목 아님 / 온라인강의 아님 / P/F 평가 과목 아님 / 원어강의 아님', '김광섭 교수님은 영어통번역학과 학과 소속입니다. 교수 직위를 맡고 있습니다. 이메일은 kwangsup@hufs.ac.kr입니다. 연구실은 신연구동 401 호입니다.', 'Jinkuen Park 교수님은 화학과 학과 소속입니다. Ph.D. Chemistry, Univ. of California at Santa Barbara, USA 학위를 가지고 있습니다. 이메일은 jinkpark@hufs.ac.kr입니다. 연구실은 융합신소재화학 연구실 (자연대 410호)입니다.', '[(글로벌) - 루마니아학과] 영역에 개설된 강의 목록입니다.\n\n[루마니아학입문(1)] 1학년 대상 / 교수: 박정오 / nan / 학점: 3 / 전공필수 과목 아님 / 온라인강의 맞음 / P/F 평가 과목 아님 / 원어강의 아님\n\n[초급루마니아어번역연습(1)] 1학년 대상 / 교수: 백승남 / 화요일 1,2교시 / 강의실 1504호 / 학점: 2 / 전공필수 과목 맞음 / 온라인강의 아님 / P/F 평가 과목 아님 / 원어강의 맞음\n\n[초급루마니아어회화(1)] 1학년 대상 / 교수: Cristina Preutu / 월요일 1,2교시 / 강의실 1411호 / 학점: 2 / 전공필수 과목 맞음 / 온라인강의 아님 / P/F 평가 과목 아님 / 원어강의 맞음\n\n[초급루마니아어회화(1)] 1학년 대상 / 교수: 한성숙 / 화요일 3,4교시 / 강의실 1411호 / 학점: 2 / 전공필수 과목 맞음 / 온라인강의 아님 / P/F 평가 과목 아님 / 원어강의 맞음\n\n[초급시청각루마니아어(1)] 1학년 대상 / 교수: 김정환 / 목요일 1교시 / 강의실 1411호 / 학점: 1 / 전공필수 과목 맞음 / 온라인강의 아님 / P/F 평가 과목 아님 / 원어강의 아님\n\n[루마니아사정] 2학년 대상 / 교수: 박정오 / 수요일 9,10교시 / 강의실 1411호 / 학점: 2 / 전공필수 과목 아님 / 온라인강의 아님 / P/F 평가 과목 아님 / 원어강의 아님\n\n[중급루마니아어문법작문] 2학년 대상 / 교수: 김정환 / 목요일 2,금,1,2교시 / 강의실 1411호 / 학점: 3 / 전공필수 과목 맞음 / 온라인강의 아님 / P/F 평가 과목 아님 / 원어강의 아님\n\n[중급루마니아어번역연습(1)] 2학년 대상 / 교수: 한성숙 / 목요일 3,4교시 / 강의실 1314호 / 학점: 2 / 전공필수 과목 맞음 / 온라인강의 아님 / P/F 평가 과목 아님 / 원어강의 아님\n\n[중급루마니아어회화(1)] 2학년 대상 / 교수: 엄태현 / 수요일 1,2교시 / 강의실 1411호 / 학점: 2 / 전공필수 과목 맞음 / 온라인강의 아님 / P/F 평가 과목 아님 / 원어강의 맞음\n\n[중급루마니아어회화(1)] 2학년 대상 / 교수: Cristina Preutu / 수요일 7,8교시 / 강의실 1509-1호 / 학점: 2 / 전공필수 과목 맞음 / 온라인강의 아님 / P/F 평가 과목 아님 / 원어강의 맞음\n\n[FLEX루마니아어(1)] 3학년 대상 / 교수: 안겔레스쿠록사나커털리나 / 화요일 1,2교시 / 강의실 1411호 / 학점: 2 / 전공필수 과목 아님 / 온라인강의 아님 / P/F 평가 과목 아님 / 원어강의 맞음\n\n[고급루마니아어회화(1)] 3학년 대상 / 교수: 안겔레스쿠록사나커털리나 / 월요일 1,2교시 / 강의실 1502호 / 학점: 2 / 전공필수 과목 맞음 / 온라인강의 아님 / P/F 평가 과목 아님 / 원어강의 맞음\n\n[고급루마니아어회화(1)] 3학년 대상 / 교수: 이호창 / 월요일 1,2교시 / 강의실 1310호 / 학점: 2 / 전공필수 과목 맞음 / 온라인강의 아님 / P/F 평가 과목 아님 / 원어강의 맞음\n\n[루마니아문학사] 3학년 대상 / 교수: 김정환 / 목요일 3,4교시 / 강의실 1411호 / 학점: 2 / 전공필수 과목 아님 / 온라인강의 아님 / P/F 평가 과목 아님 / 원어강의 아님\n\n[루마니아역사의이해] 3학년 대상 / 교수: 박정오 / 화요일 7,8교시 / 강의실 1411호 / 학점: 2 / 전공필수 과목 아님 / 온라인강의 아님 / P/F 평가 과목 아님 / 원어강의 아님\n\n[루마니아정치경제의이해(1)] 3학년 대상 / 교수: Cristina Preutu / 월요일 7,8교시 / 강의실 1411호 / 학점: 2 / 전공필수 과목 아님 / 온라인강의 아님 / P/F 평가 과목 아님 / 원어강의 맞음\n\n[루마니아종교문화] 3학년 대상 / 교수: 이호창 / 목요일 3,4교시 / 강의실 1504-1호 / 학점: 2 / 전공필수 과목 아님 / 온라인강의 아님 / P/F 평가 과목 아님 / 원어강의 맞음\n\n[루마니아현대문학] 3학년 대상 / 교수: 박정오 / 수요일 7,8교시 / 강의실 1411호 / 학점: 2 / 전공필수 과목 아님 / 온라인강의 아님 / P/F 평가 과목 아님 / 원어강의 아님\n\n[루마니아문화와예술] 4학년 대상 / 교수: 백승남 / 수요일 1,2교시 / 강의실 1510-1호 / 학점: 2 / 전공필수 과목 아님 / 온라인강의 아님 / P/F 평가 과목 아님 / 원어강의 맞음\n\n[루마니아어학개론] 4학년 대상 / 교수: 엄태현 / 수요일 3,4교시 / 강의실 1411호 / 학점: 2 / 전공필수 과목 아님 / 온라인강의 아님 / P/F 평가 과목 아님 / 원어강의 아님\n\n[루마니아와유럽연합(EU)] 4학년 대상 / 교수: Cristina Preutu / 화요일 7,8교시 / 강의실 1409-2호 / 학점: 2 / 전공필수 과목 아님 / 온라인강의 아님 / P/F 평가 과목 아님 / 원어강의 맞음\n\n[루마니아인문학주제세미나] 4학년 대상 / 교수: 김정환 / 금요일 3,4교시 / 강의실 1411호 / 학점: 2 / 전공필수 과목 아님 / 온라인강의 아님 / P/F 평가 과목 아님 / 원어강의 아님', '강준영 교수님 교수님은 중국어통번역학과 학과 소속입니다. 전임교수 직위를 맡고 있습니다. 대만 국립정치대학 동아연구소 학위를 가지고 있습니다. 연구분야는 중국정치경제학입니다. 이메일은 junka009@hanmail.net입니다.', '## [heading1] ##\n# 5) 졸업 요건\n\n## [paragraph] ##\n- 졸업 과제 및 논문(전공 홈페이지에 게시)\n\n## [heading1] ##\n# 6) 문의처\n\n## [list] ##\n- - 홈페이지 : ds.hufs.ac.kr / 이메일 : seokohj@hufs.ac.kr\n- - 전공주임 연구실 전화번호 : 031-330-4680\n\n## [footer] ##\n- 54 -', '주 정 석 교수님 [Jung Suk Joo] 교수님은 반도체전자공학부 학과 소속입니다. 교수 (정교수) 직위를 맡고 있습니다. 연구분야는 통신신호처리입니다. 이메일은 jjs@hufs.ac.kr입니다.', 'Doyun Kim 교수님은 화학과 학과 소속입니다. Ph.D. Materials Science and Engineering, Texas A&M University, USA 학위를 가지고 있습니다. 이메일은 doyunk@hufs.ac.kr입니다. 연구실은 나노 에너지 소재 연구실 (자연대 405호)입니다.', 'Yongae Kim 교수님은 화학과 학과 소속입니다. Ph.D. Chemistry, Univ. of Pennsylvania, USA 학위를 가지고 있습니다. 이메일은 yakim@hufs.ac.kr입니다. 연구실은 구조생물화학 연구실 (자연대 417호)입니다.', 'Hae-Jo Kim  (Chairperson) 교수님은 화학과 학과 소속입니다. Ph.D. Chemistry, Seoul Nat’l University, Korea 학위를 가지고 있습니다. 이메일은 haejkim@hufs.ac.kr입니다. 연구실은 형광유기합성 연구실 (자연대 404호)입니다.', 'Jeong-Wook Oh 교수님은 화학과 학과 소속입니다. Ph.D. Chemistry, Seoul Nat’l University, Korea 학위를 가지고 있습니다. 이메일은 jeongwoh@hufs.ac.kr입니다. 연구실은 나노바이오광전기화학 연구실 (자연대 416호)입니다.', '정 동 근 교수님 [Dong Geun Jeong] 교수님은 반도체전자공학부 학과 소속입니다. 명예교수 직위를 맡고 있습니다. 연구분야는 이동/무선통신, 무선응용입니다. 이메일은 dgjeong@hufs.ac.kr입니다.', 'Changsun Eun 교수님은 화학과 학과 소속입니다. Ph.D. Chemistry, Univ. of North Carolina at Chapel Hill. USA 학위를 가지고 있습니다. 이메일은 ceun@hufs.ac.kr입니다. 연구실은 이론 및 계산화학 연구실 (자연대 507호)입니다.']","김정환 교수님은 루마니아학과 소속이며, 연구실은 어문관 435호에 위치해 있습니다. 추가적인 문의 사항이 있으시면 교수님께 직접 연락하시거나 이메일(bacovia@empas.com)로 문의하시는 것도 좋습니다. 혹시 더 도와드릴까요?",김정환 교수님의 연구실은 어문관 435호에 위치해 있습니다. 추가로 궁금하신 점이 있으시면 언제든지 말씀해 주세요.,0.9999999999,0.5,0.6666666666666666,0.0
컴퓨팅사고를 AI융합전공 이중과목으로 변경해야되는데 이수구분변경 신청 어떻게 해?,"[""[서울] 이수구분 변경 신청 방법 안내\n\n[서울] 이수구분 변경 신청 방법 안내\n\n이수구분 변경 신청서\n\n○ 졸업학기 졸업사정일 전까지\n\n○ 교과목 이수영역 변경 신청서는 E-Mail로 제출(직접 방문제출도 가능)시 접수하여 처리하고 있습니다. 교과목 이수영역의 변경이 필요한 경우, 첨부한 '이수구분 변경 신청서'를\xa0작성하여 이수구분 변경이 필요한 전공 소속 단과대학 담당 선생님에게 E-M ail(또는 직접 방문제출) 로 제출 하여 주시기 바랍니다.\n\n* 융합전공의 이수구분 변경이 필요한 경우는 융합전공 담당 선생님에게 E-Mail(또는 직접 방문제출)로 제출하여 주시기 바랍니다.\n\n*** 유의사항\n\n단, 중국학대학 , 미 디어커뮤니케이션학부, 국제통상학과 ( 상경대학 ), EU전공, 동북아외교통상전공 , AI융합전공(Language&AI트랙/Business&AI트랙/Software&AI트랙) , Business & AI전공, 융복합소프트웨어전공, LD/LT 등 의 세부전공교류 ( 이수구분 ) 신청의 경우 또는 먼저 학과의 확인이 필요한 경우 , 각 전공 ( 학과 ) 사무실의 확인\xa0등 별도의 절차(양식)를 통해 처리되오니\xa0해당 전공 ( 학부 ) 사무실로 우선 문의 하여 주시기 바랍니다 .\n\n[제출시 참고]\n\n● 1전공으로 이수구분 변경이 필요할 경우 →\xa01전공 단과대학 담당 선생님에게 제출\n\n● 이중전공으로 이수구분 변경이 필요한 경우 → 이중전공 단과대학 담당 선생님에게 제출\n\n● 부 전 공으로 이수구분 변경이 필요한 경우 → 부전공 단과대학 담당 선생님에게 제출\n\n● 자 선 을 교양으로 이수구분 변경이 필요한 경우 → 1전공 단과대학 담당 선생님에게 제출\n\n● 교 양 을 1전공 또는 이중(부)전공으로 이수구분 변경이 필요한 경우\n\n→ 1전공으로 변경시 : 1전공 단과대학 담당 선생님에게 제출\n\n→ 이중(부)전공으로 변경시 : 이중(부)전공 단과대학 담당 선생님에게 제출\n\n● 융합전공의 이수구분 변경이 필요할 경우 → 융합전공 담당 선생님에게 제출"", '[서울] 이수구분 변경 신청 방법 안내\n\n● 교 양 을 1전공 또는 이중(부)전공으로 이수구분 변경이 필요한 경우\n\n→ 1전공으로 변경시 : 1전공 단과대학 담당 선생님에게 제출\n\n→ 이중(부)전공으로 변경시 : 이중(부)전공 단과대학 담당 선생님에게 제출\n\n● 융합전공의 이수구분 변경이 필요할 경우 → 융합전공 담당 선생님에게 제출\n\n○ 신청서가 접수된 이후 통상적으로 3~4일(평일기준)\xa0이내에 처리되며 이후 신 청한 학생은\xa0종합정보 교과목 정보를 조회하여 변경사항을 정확히 확인하시기 바랍니다. 또한, 변경이 되지 않은 경우나 이상이 있는 경우는 즉시 담당 선생님에게 연락하여 확인하시기 바랍니다.\n\n○ 제출하기 전\xa0신청내역 중 이수구분 변경이 규정상 불가능한 교과목이 있는지 확인해 주시기 바랍니다.(수강편람 참조/전공교류(인정)교과목 참조/학과 문의/단과대학 담당 선생님 문의 등을 통해 확인, 변경이 불가능한 경우는 처리 불가 )\n\n○ 처리된 이후\xa0이수구분/이수학점/이수영역/졸업요건 등에 이상이 있거나\xa0문제가 없는지를 정확히 확인해 주시기 바랍니다.\n\n○ 상시 제출( 졸업예정자는 졸업학기 졸업사정일 전까지) 이 가능하며 당해 학기 수강신청 건에\xa0대해서는 성적 취득 후 신청을 권장합니다. 단, 당해 학기 수강신청 건과 관련하여\xa0졸업예정자 및 필요한 경우에는\xa0별도 문의해 주시기 바랍니다.\n\n○ 이중(부)전공이 서울캠퍼스일 경우 본인의 서울캠퍼스 담당 선생님에게, 글로벌캠퍼스일 경우 글로벌캠퍼스 담당 선생님에게 제출해 주십시오.\n\n- 아\xa0 래 -\n\n단과대학\n\ne-mail 주소\n\n전화\n\n영어대학 / 아시어언어문화대학\n\n/AI융합대학\n\nhaksa7@hufs.ac.kr\n\n02-2173-2264\n\n서양어대학/중국학대학/일본학대학\n\nhana@hufs.ac.kr\n\n02-2173-2121\n\n사회과학대학 / 상경대학 / 경영대학 / 국제학부 /LD 학부 /LT 학부 /KFL 학부\n\nhaksa6@hufs.ac.kr\n\n02-2173-2308\n\n사범대학\n\npoisson@hufs.ac.kr\n\n02-2173-2338', '● 교 양 을 1전공 또는 이중(부)전공으로 이수구분 변경이 필요한 경우\n\n→ 1전공으로 변경시 : 1전공 단과대학 담당 선생님에게 제출\n\n→ 이중(부)전공으로 변경시 : 이중(부)전공 단과대학 담당 선생님에게 제출\n\n● 융합전공의 이수구분 변경이 필요할 경우 → 융합전공 담당 선생님에게 제출', '[글로벌] 이수구분변경 신청 방법 안내\n\n다. 이수구분 신청 전, 전공교류교과목을 수강편람에서 확인하고 문의 사항이 있을 경우 신청전 미리 상담 (수강편람 확인 클릭)\n\n라. 신청 후 3~4일 (평일 기준) 이후\xa0종합정보시스템에서 변경결과를 반드시 확인하고 변경이 안된 경우, 담당자에게 연락하여 반드시 확인\n\n| 0 | 1 | 2 | 3 |\n|:-----------------------------------------------------------------------------|:---------------------|:-------------|:---------------|\n| 본인의 1전공 단과대학 | 이메일 제출 | 문의 전화 | 방문 제출 |\n| 인문대학, 통번역대학, 융합인재대학 | haksa4077@hufs.ac.kr | 031-330-4077 | 학생회관\xa0109호 |\n| 국가전략언어대학, 국제지역대학, 자유전공학부(글로벌) | lsh0613@hufs.ac.kr | 031-330-4457 | 학생회관\xa0109호 |\n| 경상대학,\xa0Culture& Technology융합대학, AI융합대학(글로벌),\xa0기후변화융합학부, | minsun@hufs.ac.kr | 031-330-4953 | 학생회관\xa0109호 |\n| 자연과학대학,\xa0공과대학, 바이오메디컬공학부 | yyj1730@hufs.ac.kr | 031-330-4073 | 학생회관\xa0109호 |', '*** 유의사항\n\n단, 중국학대학 , 미 디어커뮤니케이션학부, 국제통상학과 ( 상경대학 ), EU전공, 동북아외교통상전공 , AI융합전공(Language&AI트랙/Business&AI트랙/Software&AI트랙) , Business & AI전공, 융복합소프트웨어전공, LD/LT 등 의 세부전공교류 ( 이수구분 ) 신청의 경우 또는 먼저 학과의 확인이 필요한 경우 , 각 전공 ( 학과 ) 사무실의 확인\xa0등 별도의 절차(양식)를 통해 처리되오니\xa0해당 전공 ( 학부 ) 사무실로 우선 문의 하여 주시기 바랍니다 .\n\n[제출시 참고]\n\n● 1전공으로 이수구분 변경이 필요할 경우 →\xa01전공 단과대학 담당 선생님에게 제출\n\n● 이중전공으로 이수구분 변경이 필요한 경우 → 이중전공 단과대학 담당 선생님에게 제출\n\n● 부 전 공으로 이수구분 변경이 필요한 경우 → 부전공 단과대학 담당 선생님에게 제출\n\n● 자 선 을 교양으로 이수구분 변경이 필요한 경우 → 1전공 단과대학 담당 선생님에게 제출', '[공통] 2025-1학기 이중전공 변경 신청 일정 공고(비즈니스 & AI 융합전공 관련 내\n\n라 . 부전공 희망자 및 전공심화 ( 단일전공 ) 희망자 의 경우 추후 종합정보시스템으로 별도 신청 예정\n\n1) 부전공 희망자 : 일반 부전공 또는 전공심화 ＋ 부전공 신청\n\n2) 단일전공 희망자 : 기존 이중 / 부전공 취소\n\n※ 자세한 일정은 2025 년 7 월 중순 학사공지 예정인 “ 부전공 신청 및 이중전공 / 부전공 취소 일정 ” 확인\n\n마 . 편입생도 희망 시 이중전공 , 부전공 , 전공심화 ( 부전공 ) 로 이수할 수 있음\n\n※ 이수 시 졸업이수학점 및 외국어인증기준이 변경될 수 있음\n\n바 . ( 이중전공 변경에 따라 ) 이수구분 수정이 필요한 경우 학사종합지원센터 홈페이지 서식함의 “ 이수구분 변경 신청서 ” 를 작성하여 제출 바람\n\n※ 상시 제출 가능\n\n사. 신설 융합전공 비즈니스 & AI 융합전공의 신청이\xa0추후 관련 위원회 의결을 통해\xa02025학년도 2학기부터\xa02024학번 이전 학생들 역시 신청\xa0가능해질\xa0예정이오니, 해당 전공에\xa0관심이 있는 학생 분들은 참조하여 주시기 바랍니다.\n\n▶ ( 서울 ) 이수구분 변경 신청서 바로가기\n\n▶ ( 글로벌 ) 이수구분 변경 신청서 바로가기\n\n2025. 4.\n\n교무처장', '[글로벌] 이수구분변경 신청 방법 안내\n\n[글로벌] 이수구분변경 신청 방법 안내\n\n이수구분변경 신청 방법\n\n1. 시기\n\n가. 졸업학기 졸업사정일 전까지\n\n나. 당해 학기 수강신청건에 대해서는 성적 취득후 신청 권장\n\n2 . 제출처\n\n본인의 1전공 단과대학\n\n이메일 제출\n\n문의 전화\n\n방문 제출\n\n인문대학, 통번역대학, 융합인재대학\n\nhaksa4077@hufs.ac.kr\n\n031-330-4077\n\n학생회관 109호\n\n국가전략언어대학, 국제지역대학, 자유전공학부(글로벌)\n\nlsh0613@hufs.ac.kr\n\n031-330-4457\n\n경상대 학, Culture& Technology융합대학,\n\nAI융합대학(글로벌), 기후변화융합학부,\n\nminsun@hufs.ac.kr\n\n031-330-4953\n\n자연과학대학, 공과대학, 바이오메디컬공학부\n\nyyj1730@hufs.ac.kr\n\n031-330-4073\n\n3.\xa0제출 서류 : 첨부파일(이수구분 변경신청서) 다운로드 후, 작성하여 제출\n\n4.\xa0유의사항\n\n가. 이중(부)전공이 글로벌캠퍼스일 경우, 본인의 1전공 단과대학 담당자에게 제출\n\n나 . 이중(부)전공이 서울캠퍼스일 경우, 본인의 서울캠퍼스\xa0담당자에게 제출 (담당자 확인 클릭)\n\n다. 이수구분 신청 전, 전공교류교과목을 수강편람에서 확인하고 문의 사항이 있을 경우 신청전 미리 상담 (수강편람 확인 클릭)\n\n라. 신청 후 3~4일 (평일 기준) 이후\xa0종합정보시스템에서 변경결과를 반드시 확인하고 변경이 안된 경우, 담당자에게 연락하여 반드시 확인', '[공통] 2025-1학기 이중전공 변경 신청 일정 공고 새글\n\n| 0 | 1 |\n|:----------------------------------------------------------------|:----------------------------------------------------------------------------------|\n| 모든 학생 | 폐지된 학과(법학과,사회과학전공 등)및 본인 학번대에 존재하지 않는 학과 이수 불가 |\n| 비사범대 학생 | 사범대학 학과로 이중전공 이수 불가 |\n| 2016학번까지 | LD전공 및LT전공 이수 불가(※2017학번부터 가능) |\n| 서울캠퍼스 프랑스어학부 학생 | 프랑스어학부 내 세부전공을 이중전공으로 이수 불가 |\n| 서울캠퍼스 일본언어문화학부 학생 | 융합일본지역학부 이중전공 이수 불가 |\n| 서울캠퍼스 융합일본지역학부 학생 | 일본언어문화학부 이중전공 이수 불가 |\n| 서울캠퍼스 경제학부 학생(2007~2014학번) | 글로벌캠퍼스 경제학과 이중전공 이수 불가 |\n| 서울캠퍼스 경영대학 학생 | 글로벌캠퍼스 경상대학 학과/전공 이중전공 이수 불가 |\n| 서울캠퍼스Languae & AI융합학부, Social Sceince & AI융합학부학생 | 글로벌캠퍼스 컴퓨터공학전공 이중전공 이수 불가 |\n| 서울캠퍼스Social Sceince＆AI융합학부학생 | 서울캠퍼스Language & AI융합전공 이중전공 이수 불가 |\n| 서울캠퍼스Language & AI융합학부학생 | 서울캠퍼스Social Sceince＆AI융합전공 이중전공 이수 불가 |\n| 글로벌캠퍼스 융합인재학부학생 | 모든 이중전공이수 불가 |\n| 글로벌캠퍼스 영어통번역학부 학생 | 글로벌캠퍼스 영어통번역학부내 세부전공 이중전공 이수 불가 |\n| 글로벌캠퍼스 아프리카학부 학생 | 글로벌캠퍼스 아프리카학부내 세부전공 이중전공 이수 불가 |\n| 글로벌캠퍼스 경상대학 학생 | 서울캠퍼스 경영대학 이중전공 이수 불가 |\n| 글로벌캠퍼스 경제학과 학생 | 서울캠퍼스 경제학전공 이중전공 이수 불가 |', '[공통] 2025-1학기 이중전공 변경 신청 일정 공고(비즈니스 & AI 융합전공 관련 내\n\n서울캠퍼스 프랑스어학부 학생\n\n프랑스어학부 내 세부전공을 이중전공으로 이수 불가\n\n서울캠퍼스 일본언어문화학부 학생\n\n융합일본지역학부 이중전공 이수 불가\n\n서울캠퍼스 융합일본지역학부 학생\n\n일본언어문화학부 이중전공 이수 불가\n\n서울캠퍼스 경제학부 학생 (2007~2014 학번 )\n\n글로벌캠퍼스 경제학과 이중전공 이수 불가\n\n서울캠퍼스 경영대학 학생\n\n글로벌캠퍼스 경상대학 학과 / 전공 이중전공 이수 불가\n\n서울캠퍼스 Languae & AI 융합학부 , Social Sceince & AI 융합학부학생\n\n글로벌캠퍼스 컴퓨터공학전공 이중전공 이수 불가\n\n서울캠퍼스 Social Sceince ＆ AI 융합학부학생\n\n서울캠퍼스 Language & AI 융합전공 이중전공 이수 불가\n\n서울캠퍼스 Language & AI 융합학부학생\n\n서울캠퍼스 Social Sceince ＆ AI 융합전공 이중전공 이수 불가\n\n글로벌캠퍼스 융합인재학부학생\n\n모든 이중전공이수 불가\n\n글로벌캠퍼스 영어통번역학부 학생\n\n글로벌캠퍼스 영어통번역학부내 세부전공 이중전공 이수 불가\n\n글로벌캠퍼스 아프리카학부 학생\n\n글로벌캠퍼스 아프리카학부내 세부전공 이중전공 이수 불가\n\n글로벌캠퍼스 경상대학 학생\n\n서울캠퍼스 경영대학 이중전공 이수 불가\n\n글로벌캠퍼스 경제학과 학생\n\n서울캠퍼스 경제학전공 이중전공 이수 불가\n\n글로벌캠퍼스 AI 데이터융합학부 / AI 데이터융합전공 학생\n\n글로벌캠퍼스 컴퓨터공학전공 이수 불가 , 서울캠퍼스 Language & AI 융합학부 이수 불가\n\n글로벌캠퍼스 Finance & AI 융합학부 /Finance & AI 융합전공 학생\n\n서울캠퍼스 Language & AI 융합학부 이수 불가\n\n글로벌캠퍼스 반도체전자공학부 ( 반도체공학전공 ) 학생\n\n글로벌캠퍼스 반도체전자공학부 ( 전자공학전공 )\n\n글로벌캠퍼스 반도체전자공학부 ( 전자공학전공 ) 학생\n\n글로벌캠퍼스 반도체전자공학부 ( 반도체공학전공 )\n\n글로벌캠퍼스 컴퓨터공학전공 학생', '[공통] 2025-1학기 이중전공 변경 신청 일정 공고(비즈니스 & AI 융합전공 관련 내\n\n▶ ( 서울 ) 이수구분 변경 신청서 바로가기\n\n▶ ( 글로벌 ) 이수구분 변경 신청서 바로가기\n\n2025. 4.\n\n교무처장\n\n| 0 | 1 |\n|:--------------------------------------------------------------------|:----------------------------------------------|\n| 서울캠퍼스 (글로벌캠퍼스 학생 신청 불가 학과) | 글로벌캠퍼스 (서울캠퍼스 학생 신청 불가 학과) |\n| 영어대학 각 학과(전공) ※ 글로벌캠퍼스 2023학번부터 가능 | 영어통번역학부 |\n| 프랑스어학부(기존 프랑스어과 포함) ※ 글로벌캠퍼스 2023학번부터 가능 | 프랑스학과 |\n| 독일어과 ※ 글로벌캠퍼스 2024학번부터 가능 | 독일어통번역학과 |\n| 노어과 ※ 글로벌캠퍼스 2023학번부터 가능 | 러시아학과 |\n| 스페인어과 ※ 글로벌캠퍼스 2024학번부터 가능 | 스페인어통번역학과 |\n| 이탈리아어과 ※ 글로벌캠퍼스 2024학번부터 가능 | 이탈리아어통번역학과 |\n| 포르투갈어과 ※ 글로벌캠퍼스 2023학번부터 가능 | 브라질학과 |\n| 말레이·인도네시아어과 ※ 글로벌캠퍼스 2024학번부터 가능 | 말레이·인도네시아어통번역학과 |\n| 아랍어과 ※ 글로벌캠퍼스 2021학번부터 가능 | 아랍어통번역학과 |\n| 태국어과 ※ 글로벌캠퍼스 2023학번부터 가능 | 태국어통번역학과 |\n| 인도어과 ※ 글로벌캠퍼스 2023학번부터 가능 | 인도학과 |\n| 중국학대학 각 전공 ※ 글로벌캠퍼스 2023학번부터 가능 | 중국어통번역학과 |\n| 일본학대학 각 전공 ※ 글로벌캠퍼스 2023학번부터 가능 | 일본어통번역학과 |', '[공통] 2025-1학기 이중전공 변경 신청 일정 공고(비즈니스 & AI 융합전공 관련 내\n\n| 0 | 1 |\n|:----------------------------------------------------------------|:----------------------------------------------------------------------------------|\n| 모든 학생 | 폐지된 학과(법학과,사회과학전공 등)및 본인 학번대에 존재하지 않는 학과 이수 불가 |\n| 비사범대 학생 | 사범대학 학과로 이중전공 이수 불가 |\n| 2016학번까지 | LD전공 및LT전공 이수 불가(※2017학번부터 가능) |\n| 서울캠퍼스 프랑스어학부 학생 | 프랑스어학부 내 세부전공을 이중전공으로 이수 불가 |\n| 서울캠퍼스 일본언어문화학부 학생 | 융합일본지역학부 이중전공 이수 불가 |\n| 서울캠퍼스 융합일본지역학부 학생 | 일본언어문화학부 이중전공 이수 불가 |\n| 서울캠퍼스 경제학부 학생(2007~2014학번) | 글로벌캠퍼스 경제학과 이중전공 이수 불가 |\n| 서울캠퍼스 경영대학 학생 | 글로벌캠퍼스 경상대학 학과/전공 이중전공 이수 불가 |\n| 서울캠퍼스Languae & AI융합학부, Social Sceince & AI융합학부학생 | 글로벌캠퍼스 컴퓨터공학전공 이중전공 이수 불가 |\n| 서울캠퍼스Social Sceince＆AI융합학부학생 | 서울캠퍼스Language & AI융합전공 이중전공 이수 불가 |\n| 서울캠퍼스Language & AI융합학부학생 | 서울캠퍼스Social Sceince＆AI융합전공 이중전공 이수 불가 |\n| 글로벌캠퍼스 융합인재학부학생 | 모든 이중전공이수 불가 |\n| 글로벌캠퍼스 영어통번역학부 학생 | 글로벌캠퍼스 영어통번역학부내 세부전공 이중전공 이수 불가 |\n| 글로벌캠퍼스 아프리카학부 학생 | 글로벌캠퍼스 아프리카학부내 세부전공 이중전공 이수 불가 |\n| 글로벌캠퍼스 경상대학 학생 | 서울캠퍼스 경영대학 이중전공 이수 불가 |\n| 글로벌캠퍼스 경제학과 학생 | 서울캠퍼스 경제학전공 이중전공 이수 불가 |', '[글로벌] 이수구분변경 신청 방법 안내\n\n다. 이수구분 신청 전, 전공교류교과목을 수강편람에서 확인하고 문의 사항이 있을 경우 신청전 미리 상담 (수강편람 확인 클릭)\n\n라. 신청 후 3~4일 (평일 기준) 이후\xa0종합정보시스템에서 변경결과를 반드시 확인하고 변경이 안된 경우, 담당자에게 연락하여 반드시 확인', '[공통] 2025-1학기 이중전공 변경 신청 일정 공고(비즈니스 & AI 융합전공 관련 내\n\n마 . 동점자 배정기준\n\n1) 평점평균 동점자 : 이수학점이 높은 학생 우선 배정\n\n2) 평점평균 , 이수학점 동점자 : 동점자 전원 배정\n\n6. 유의사항\n\n가 . 양 캠퍼스에 동일하게 개설되는 융합전공은 본인 소속 캠퍼스에서 이수해야 함\n\n나 . 학과 ( 부 ) 별 전형이 있는 경우 반드시 학과 사무실에 관련 일정 및 자격 확인\n\n※ 관련 일정 및 자격 미확인으로 인한 불이익은 본인 과실임을 유의할 것\n\n학과 사무실\n\n연락처\n\n이메일\n\n노어과\n\n02-2173-2284\n\nhufsrussia@hufs.ac.kr\n\n베트남어과\n\n02-2173-2300\n\nvietnam.hufs@gmail.com\n\n정치외교학과\n\n02-2173-2312\n\nhufspsd@gmail.com\n\n경영학부\n\n02-2173-2334\n\ncob@hufs.ac.kr\n\nLanguage & Diplomacy 학부\n\n02-2173-2478\n\nlangdiplo@hufs.ac.kr\n\nLanguage & Trade 학부\n\n02-2173-3350\n\nhufsdltta@hufs.ac.kr\n\nKFL 학부\n\n02-2173-2477\n\nhufs_kfl@naver.com\n\nSocial Science & AI 융합학부\n\n02-2173-2769\n\nssai@hufs.ac.kr\n\nLanguage & AI 융합학부\n\n02-2173-2278\n\nhufs_langai@hufs.ac.kr\n\n다 . 타캠퍼스에서 이수한 이중전공 과목의 재수강 은 타캠퍼스 이중전공 이수 기간중에 재수강을 완료해야 함\n\n※ 타캠퍼스 이중전공에서 본인 소속 캠퍼스 이중전공으로 변경한 후에는 재수강 불가\n\n라 . 부전공 희망자 및 전공심화 ( 단일전공 ) 희망자 의 경우 추후 종합정보시스템으로 별도 신청 예정\n\n1) 부전공 희망자 : 일반 부전공 또는 전공심화 ＋ 부전공 신청\n\n2) 단일전공 희망자 : 기존 이중 / 부전공 취소\n\n※ 자세한 일정은 2025 년 7 월 중순 학사공지 예정인 “ 부전공 신청 및 이중전공 / 부전공 취소 일정 ” 확인', '- 지원센터 단과대학 교학파트(본인 1전공 소속 기준)에 방문하여 ‘이수구분변경신청서’를\n- 작성하여야 이중전공 학점으로 처리됨', '[공통] 2025-1학기 이중전공 변경 신청 일정 공고(비즈니스 & AI 융합전공 관련 내\n\n| 글로벌캠퍼스 영어통번역학부 학생 | 글로벌캠퍼스 영어통번역학부내 세부전공 이중전공 이수 불가 |\n| 글로벌캠퍼스 아프리카학부 학생 | 글로벌캠퍼스 아프리카학부내 세부전공 이중전공 이수 불가 |\n| 글로벌캠퍼스 경상대학 학생 | 서울캠퍼스 경영대학 이중전공 이수 불가 |\n| 글로벌캠퍼스 경제학과 학생 | 서울캠퍼스 경제학전공 이중전공 이수 불가 |\n| 글로벌캠퍼스AI데이터융합학부/ AI데이터융합전공 학생 | 글로벌캠퍼스 컴퓨터공학전공 이수 불가, 서울캠퍼스 Language & AI융합학부 이수 불가 |\n| 글로벌캠퍼스Finance & AI융합학부 /Finance & AI융합전공 학생 | 서울캠퍼스 Language & AI융합학부 이수 불가 |\n| 글로벌캠퍼스 반도체전자공학부(반도체공학전공)학생 | 글로벌캠퍼스 반도체전자공학부(전자공학전공) |\n| 글로벌캠퍼스 반도체전자공학부(전자공학전공)학생 | 글로벌캠퍼스 반도체전자공학부(반도체공학전공) |\n| 글로벌캠퍼스 컴퓨터공학전공 학생 | 서울캠퍼스 Language & AI융합전공 이수 불가 |\n| 글로벌캠퍼스 디지털콘텐츠학부 | 글로벌캠퍼스 문화콘텐츠학전공(융합전공)이중전공 이수 불가 |']","'컴퓨팅사고' 과목을 AI융합전공 이중과목으로 변경하기 위해서는 이수구분 변경 신청서를 작성하여 제출해야 합니다. 

신청 방법은 다음과 같습니다:

1. **신청서 작성**: 학사종합지원센터 홈페이지에서 '이수구분 변경 신청서'를 다운로드하여 작성합니다.
2. **제출처**: 해당 과목의 이중전공 단과대학 담당 선생님에게 제출합니다.
3. **제출 시기**: 이수구분 변경 신청은 상시 제출이 가능하므로, 필요할 때 언제든지 제출하시면 됩니다.

정확한 절차와 필요 서류는 학사종합지원센터에 문의하시거나 관련 공지를 확인하시기 바랍니다. 혹시 더 도와드릴까요?","컴퓨팅사고를 AI융합전공 이중과목으로 변경하시려면, 이수구분 변경 신청서를 작성하신 후,해당 전공 소속 단과대학의 담당 선생님에게 이메일로 제출하시거나 직접 방문하여 제출하셔야 합니다.
신청은 졸업학기 졸업사정일 전까지 가능하며, 제출 후 3~4일 이내에 종합정보시스템에서 변경 결과를 확인하실 수 있습니다.
만약 변경이 되지 않았거나 문제가 발생한 경우, 즉시 담당 선생님에게 연락하여 확인하셔야 합니다.자세한 사항은 학사종합지원센터의 공지사항을 참고하시기 바랍니다. 도움이 필요하시면 언제든지 문의해 주세요.",0.9999999999933333,0.6,0.6666666666666666,0.0
감기로 병원다녀왔는데 진료확인서로 유고결석 가능해?,"['## [paragraph] ##\n나. 처리절차\n\n## [paragraph] ##\n1) 유고결석·결시 공통 안내사항\n\n## [paragraph] ##\n* 질병 및 상해의 경우 의원에서 발급받은 서류는 해당되지 않음\n(병원급 의료 기관 확인 : 건강보험심사평가원(https://www.hira.or.kr)', '( 공식적인 서류로 사유를 증명할 수 있어야 함 . 증빙서류 미비 또는 요건 미충족 시 허가하지 않음 .)\n\n6) 일반 휴학 중 입대할 경우, 군입대 휴학으로 재신청하여야 함 ( 입 영 관련 증빙 서류 업로드 )', '## [heading1] ##\n# 2. 유고결석·결시 처리 절차\n\n## [paragraph] ##\n<학칙>\n제35조 (결석) 매학기 수업시간의 4분의 1을 초과하여 결석한 자는 그 과목의 수험\n자격을 상실한다. 다만, 유고결석에 관하여는 총장이 따로 정하는 바에 의하여\n이를 출석으로 인정할 수 있다. (개정 1999.3.12)\n\n## [paragraph] ##\n가. 유고결석 인정 범위 및 성적처리\n\n## [list] ##\n- 1) 인정범위 : 유고결석은 유고결석·결시 규정에 명시된 사유에 대해서 매학기 총 수업시\n- 간의 4분의 1까지 인정할 수 있고 인정된 기간 동안은 출석한 것으로 봄.\n- 다만, 예비군 훈련기간은 예외로 인정하며, 졸업예정자(해당학기 졸업가능\n- 자)로서 조기취업자 및 생리에 따른 사항은 예외로 인정할 수 있음.\n- 2) 성적처리 : 정기시험에 유고결시로 인정된 사유에 대해서는 별도로 시험을 실시하는 것을\n- 원칙으로 하되, 부득이한 경우 담당교수 재량 하에 과제물 또는 기타 객관적인\n- 평가가 가능한 방법으로 대체하여 평가할 수 있음. 단, 1개 학기에 정규시험을\n- 2회 실시하는 수업에서 1회 유고결시로 인정되는 경우 다른 1회에 응시한\n- 정규시험 성적으로 결시시험 성적을 대신할 수 있음.\n- 3) 계절학기는 유고결석ž결시를 적용하지 않는 것을 원칙으로 함. 다만, 예비군 훈련기간은\n- 예외로 인정하며, 졸업예정자(해당학기 졸업가능자)로서 조기취업자에 따른 사항은 예\n- 외로 인정할 수 있음.\n\n## [paragraph] ##\n나. 처리절차\n\n## [paragraph] ##\n1) 유고결석·결시 공통 안내사항\n\n## [paragraph] ##\n* 질병 및 상해의 경우 의원에서 발급받은 서류는 해당되지 않음\n(병원급 의료 기관 확인 : 건강보험심사평가원(https://www.hira.or.kr)', '## [paragraph] ##\n나. 처리절차\n\n## [paragraph] ##\n1) 유고결석·결시 공통 안내사항\n\n## [paragraph] ##\n* 질병 및 상해의 경우 의원에서 발급받은 서류는 해당되지 않음\n(병원급 의료 기관 확인 : 건강보험심사평가원(https://www.hira.or.kr)\n\n## [paragraph] ##\n⇒ 검색창에서 병원이름 기입 후 검색 ⇒ 검색결과에서 해당병원 클릭\n⇒ 병원 기본정보 중 병원구분에서 병원등급 확인\n\n## [paragraph] ##\n** 질병관리청의 법정감염병 확인(https://dportal.kdca.go.kr)\n(질병관리청 감염병 포털 -> 감염병정보 -> 법정감염병에서 병명 확인)', '| 질병 및 상해 로 인한 입원 또는 감염병 으로 인한 격 리(치료) | 법정감염병 (**질병관리청의 법정감염병에 한함) | 격리(치료) 기간 또는 감염우려 기간 | 해당 증빙서류 | 담당교수에게 증빙서류 제출 |  |\n| 졸업시험 | 졸업시험 | 졸업시험 당일 | 학과장 확인서 | 담당교수에게 증빙서류 제출 |  |\n| 수업일수 4분의 3선 후 징병에 의한 군입대 | 수업일수 4분의 3선 후 징병에 의한 군입대 | - | 입영통지서 | 담당교수에게 증빙서류 제출 |  |\n| 출산 | 출산 | 본인:20일 배우자:10일 | 본인 : 출생(출산예정)증 명서 등, 배우자 : 출생 (출산예정)증명서 및 가족관계증명서 등 | 담당교수에게 증빙서류 제출 |  |\n| 생리 | 생리 | 생리기간 (학기중 2회) | 유고결석신청서 (생리공결제) | 담당교수에게 증빙서류 제출 | ※ 자세한 사항은 학사공지사항 생리 유고 신청안내 참조 |\n| 교직과정이수자의 학교현장실습 | 교직과정이수자의 학교현장실습 | 교육실습 기간 | 교직담당자가 발급한 확인서 | 담당교수에게 증빙서류 제출 |  |\n| 졸업예정자(해당학기 졸업가능자) 로서 조기취업자 | 졸업예정자(해당학기 졸업가능자) 로서 조기취업자 | 취업기간 | 학과장 승인받은 유고결석 인정원, 재직(계약)증명서 및 4대보험가입내역 확인서 또는 이에 준하는 재직증명서류 | 입사확정 후 즉시 ￬ 유고결석인정원과 증빙서류에 대해 학과장 승인 ￬ 소속 단과대에 제출 ￬ 유고결석확인서를 발급받아 담당교수에게 제출 ￬ 수업종료 직전 취업사실에 대해 재확인 | ※ 자세한 사항은 학사공지사항 졸업예정자(해 당학기 졸업가능자)의 조기취업 유고결석 신청 안내 참조 |', '## [paragraph] ##\n나. 처리절차\n\n## [paragraph] ##\n1) 유고결석·결시 공통 안내사항\n\n## [paragraph] ##\n* 질병 및 상해의 경우 의원에서 발급받은 서류는 해당되지 않음\n(병원급 의료 기관 확인 : 건강보험심사평가원(https://www.hira.or.kr)\n\n## [paragraph] ##\n⇒ 검색창에서 병원이름 기입 후 검색 ⇒ 검색결과에서 해당병원 클릭\n⇒ 병원 기본정보 중 병원구분에서 병원등급 확인\n\n## [paragraph] ##\n** 질병관리청의 법정감염병 확인(https://dportal.kdca.go.kr)\n(질병관리청 감염병 포털 -> 감염병정보 -> 법정감염병에서 병명 확인)\n\n## [paragraph] ##\n2) 유고결석(수업 결석) : 사유발생 시 담당교수에게 알리고, 유고사유가 끝난 날부터\n7일 이내 증빙서류를 제출해야 함.\n(해당학기 졸업가능한 조기취업자는 입사확정 후 즉시 제출)', '## [paragraph] ##\n나. 처리절차\n\n## [paragraph] ##\n1) 유고결석·결시 공통 안내사항\n\n## [paragraph] ##\n* 질병 및 상해의 경우 의원에서 발급받은 서류는 해당되지 않음\n(병원급 의료 기관 확인 : 건강보험심사평가원(https://www.hira.or.kr)\n\n## [paragraph] ##\n⇒ 검색창에서 병원이름 기입 후 검색 ⇒ 검색결과에서 해당병원 클릭\n⇒ 병원 기본정보 중 병원구분에서 병원등급 확인\n\n## [paragraph] ##\n** 질병관리청의 법정감염병 확인(https://dportal.kdca.go.kr)\n(질병관리청 감염병 포털 -> 감염병정보 -> 법정감염병에서 병명 확인)\n\n## [paragraph] ##\n2) 유고결석(수업 결석) : 사유발생 시 담당교수에게 알리고, 유고사유가 끝난 날부터\n7일 이내 증빙서류를 제출해야 함.\n(해당학기 졸업가능한 조기취업자는 입사확정 후 즉시 제출)\n\n## [table] ##\n| 사유 | 기간 | 증빙서류 | 절차 | 비고 |\n| --- | --- | --- | --- | --- |\n| 직계존비속, 배우자 및 형제 자매의 사망 | 7일 이내 (중간 공휴일 포함) | 사망진단서, 가족관계증명서 등 | 담당교수에게 증빙서류 제출 |  |\n| 본인의 결혼 | 7일 이내 (중간 공휴일 포함) | 청첩장, 예식장계약서 등 | 담당교수에게 증빙서류 제출 |  |\n| 징병검사, 입대지원시험 및 예비군 훈련 | 해당기간 | 소집영장사본 또는 징병검사 통지서사본, 교육필증 등 | 담당교수에게 증빙서류 제출 |  |\n\n## [footer] ##\n- 68 -', '## [table] ##\n| 본 대학교 및 소속 단과대학을 대표하는 공무, 행사 또는 운동경기참가 | 단과대학 규모 이상의 행사 및 체육대회임원, 간부 및 선수로서 참가 | 행사시간 | 기간과 참여인이 명시된 대학장의 행사 허가원 또는 협조공문 등 | 소속단과대학에서 유고결석 확인서를 발급받아 담당교수에게 제출 |  |\n| --- | --- | --- | --- | --- | --- |\n| 본 대학교 및 소속 단과대학을 대표하는 공무, 행사 또는 운동경기참가 | 정부 또는 지방자 치단체의 공식적 인 행사에 참가 | 행사기간 | 기간과 참여인이 명시된 부서·기관의 협조공문 등 | 담당교수에게 증빙서류 제출 |  |\n| 본 대학교 및 소속 단과대학을 대표하는 공무, 행사 또는 운동경기참가 | 총학생회의 회의 (대의원회의, 상 임위원회 및 운 영위원회 포함) 졸 업 준 비 위 원 의 업무수행 | 해당기간 매학기 7일 이내 | 기간과 참여인이 명시된 부서·기관의 협조공문 등 | 담당교수에게 증빙서류 제출 |  |\n| 본 대학교 및 소속 단과대학을 대표하는 공무, 행사 또는 운동경기참가 | 학보, 디 아거스 및 방송국의 기사작성 및 편집 | 편집부 당일 | 기간과 참여인이 명시된 부서·기관의 협조공문 등 | 담당교수에게 증빙서류 제출 |  |\n| 본 대학교 및 소속 단과대학을 대표하는 공무, 행사 또는 운동경기참가 | 학교 주관 행사 및 업무 지원 | 해당기간 | 담당부서에서 발급한 확인서 | 담당교수에게 증빙서류 제출 |  |\n| 질병 및 상해 로 인한 입원 또는 감염병 으로 인한 격 리(치료) | 질병 및 상해 | 입원기간 | 해당 증빙서류 (*병원급 이상의 의료기관) | 담당교수에게 증빙서류 제출 |  |\n| 질병 및 상해 로 인한 입원 또는 감염병 으로 인한 격 리(치료) | 법정감염병 (**질병관리청의 법정감염병에 한함) | 격리(치료) 기간 또는 감염우려 기간 | 해당 증빙서류 | 담당교수에게 증빙서류 제출 |  |', '| 질병 및 상해 로 인한 입원 또는 감염병 으로 인한 격 리(치료) | 법정감염병 (**질병관리청의 법정감염병에 한함) | 격리(치료) 기간 또는 감염우려 기간 | 해당 증빙서류 | 담당교수에게 증빙서류 제출 |  |\n| 졸업시험 | 졸업시험 | 졸업시험 당일 | 학과장 확인서 | 담당교수에게 증빙서류 제출 |  |\n| 수업일수 4분의 3선 후 징병에 의한 군입대 | 수업일수 4분의 3선 후 징병에 의한 군입대 | - | 입영통지서 | 담당교수에게 증빙서류 제출 |  |\n| 출산 | 출산 | 본인:20일 배우자:10일 | 본인 : 출생(출산예정)증 명서 등, 배우자 : 출생 (출산예정)증명서 및 가족관계증명서 등 | 담당교수에게 증빙서류 제출 |  |\n| 생리 | 생리 | 생리기간 (학기중 2회) | 유고결석신청서 (생리공결제) | 담당교수에게 증빙서류 제출 | ※ 자세한 사항은 학사공지사항 생리 유고 신청안내 참조 |', '## [table] ##\n| 사유 | 사유 | 기간 | 증빙서류 | 절차 | 비고 |\n| --- | --- | --- | --- | --- | --- |\n| 직계존․비속, 배우자 및 형제자 매의 사망 | 직계존․비속, 배우자 및 형제자 매의 사망 | 7일 이내 (중간 공휴일 포함) | 사망진단서, 가족관계증명서 | 성적입력 및 정정기간 전까지 담당교수의 지침에 따른 별도의 평가절차를 거침 |  |\n| 징병검사, 입대지원시험 및 예 비군 훈련 | 징병검사, 입대지원시험 및 예 비군 훈련 | 해당기간 | 소집영장사본 또는 징병검사 통지서사본, 교육필증 등 | 성적입력 및 정정기간 전까지 담당교수의 지침에 따른 별도의 평가절차를 거침 |  |\n| 질병 및 상해 로 인한 입원 또는 감염병 으로 인한 격 리(치료) | 질병 및 상해 | 입원기간 | 해당 증빙서류 (*병원급 이상의 의료기관) | 성적입력 및 정정기간 전까지 담당교수의 지침에 따른 별도의 평가절차를 거침 |  |', '| 질병 및 상해 로 인한 입원 또는 감염병 으로 인한 격 리(치료) | 질병 및 상해 | 입원기간 | 해당 증빙서류 (*병원급 이상의 의료기관) | 성적입력 및 정정기간 전까지 담당교수의 지침에 따른 별도의 평가절차를 거침 |  |\n| 질병 및 상해 로 인한 입원 또는 감염병 으로 인한 격 리(치료) | 법정감염병 (* *질 병관리 청의 법정감염 병에 한함) | 격리(치료) 기간 또는 감염우려기간 | 해당 증빙서류 | 성적입력 및 정정기간 전까지 담당교수의 지침에 따른 별도의 평가절차를 거침 |  |', '* 양성반응의 경우 2차 정밀 검사\xa0/ 기존 치료용 약물 복용자는 별도의 중독자 아님을 증명하 는 진단서(또는 확인서) 제출\n\n* 검사는 12월\xa016일\xa0부터\xa0 개인별 검사 진행하고\xa0\xa0해당 결과를 제출하여야 함(해당 기간 이전 검사는 인정하지 않음).\n\n4. 기타 : 검사 결과지는 반드시 원본으로 제출 하여야 하며 방문 제출이 어려운 경우, 무시험검정원서와 함께\xa0등기 우편 발송 가능\n\n5. 등기 발송 주소\xa0:\xa0서울시 동대문구 이문로 107 한국외국어대학교 본관\xa01층\xa0118호\xa0학사종합지원센터 사범대학 및 교직 담당자 앞\n\n경기도 용인시 처인구 모현읍 외대로 81 한국외국어대학교\xa0학사종합지원센터\xa0 교직 담당자 앞', '[공통] 졸업예정자(해당학기 졸업가능자)의 조기취업 유고결석 신청 안내\n\n라 . 신청시기 및 절차\n\n1) 신청시기 : 입사확정 후 즉시\n\n2) 절차 : ① 수강과목 담당교수에게 취업사실을 알리고 허락을 득한 후\n\n② 유고결석인정원과 증빙서류를 첨부하여 학과 ( 부 ) 사무실 제시\n\n③ 본인 소속 학과 ( 부 ) 장 승인\n\n④ 유고결석인정원과 증빙서류를 학사종합지원센터 소속 단과대에 제출\n\n⑤ 유고결석 확인서를 발급받아 담당교수에게 제출\n\n⑥ 기말고사 전일까지 재직증명서 , 4 대보험가입내역확인서를 담당교수에게 한 번 더 제출 ( 취업사실이 계속되고 있음을 최종확인 )\n\n2. 유의사항\n\n가 . 출석인정은 학기 중 연수기간 및 재직기간 동안만 가능 ( 연수기간이 입사일 이전일 경우 연수확인서 반드시 제출 )\n\n나 . 조기취업자의 유고결석 인정은 출석인정만을 위한 것으로 조기취업자에 대해 교과목 학습목표 및 학업성취도 달성을 위한 별도의 평가 ( 리포트 , 기타 과제물 ,\n\n동영상 수업 등 ) 를 진행해야 하며 , 중간시험 및 기말시험은 응시를 원칙으로 하되 , 부득이한 경우 리포트 및 기타 과제물 등으로 대체할 수 있음 .\n\n단 , 시험을 대체하는 과제물 ( 보고서 등 ) 작성 시 과다한 표절 ( 전체 25% 이상 ) 은 성적 불인정 사유가 될 수 있음 .\n\n다 . 불가피한 사유로 학기 종료 전 퇴사자는 퇴사 즉시 학교로 복귀하여야하며 복귀하지 않을 경우 해당기간은 무단결석으로 처리함\n\n라 . 조기취업자는 기말고사 전일까지 재직증명서 , 4 대보험 가입내역 확인서를 담당교수에게 한 번 더 제출하여 취업사실이 계속되고 있음을 최종확인 받아야 하며 최종 확인을\n\n이행하지 않을 경우 유고결석은 인정되지 않음\n\n마 . 출석인정의 권한은 담당교수에게 있음 . 따라서 무조건 출석이 인정되는 것은 아니므로 사전에 담당교수의 허락을 득해야 함\n\n바 . 조기취업 유고결석을 수업을 듣지 않기 위한 목적 또는 결석의 대체 수단으로 사용되지 않도록 각별히 유념하시기 바람\n\n2025. 3. 12.\n\n서울 · 글로벌캠퍼스 교무처장', '서울캠퍼스 학생예비군 동미참(이월) / 기본(이월) 훈련 관련 유고결석 처리 및 학습권 보\n\n|:-----------------------------------------------------------------------------------------------------------------------------------------------------------------------------------------------------------------------------------------------------------------------------------------------------------------------------------------------------------------------------------------------------------------------------------------------------------------------------------------------------------------------------------------------------------------------------------------------------------------------------------------------------------------------------------------------------------------------------------------------------------------------------------------------------------------------------------------------------------------------------------------------------------------------------------------------------------------------------------------------------------------------------------------------------------------------------------------------------------------------------------------------------------------------------------------------------------------------------------------------------------------------------------------------------------------------------------------------------------------------------------------------------------------------------------------------------------------------------------------------------------------------------------------------------------------------------------------------------------------------|', '슬기로운 대학생활 \n의료 및 건강과 관련된 측정기기나 데이터들은 내 주변의 일상에서 매\n우 가까이 있습니다. 우리의 건강과 관련하여 어떠한 생체신호들이 의\n료기관 및 일상을 통해 어떻게 수집하고 활용이 되는지에 대한 관심을 \n가지고 학교생활에 임한다면 전공공부에 대한 동기 부여가 될 수 있을 \n것입니다. 바이오메디컬공학 분야와 관련하여 공모전, 스터디, 연구실 \n인턴, 현장실습 등에 대한 적극적인 참여를 권장합니다. 이러한 비교과\n활동은 전공에 대한 이해를 높이고 진로탐색 및 취업준비에 큰 도움이 \n될 것입니다.\n졸업 후 진로 \n졸업 후 학생들은 다양한 의생명공학 분야를 다루는 국내외 일반기업\n체, 병원, 국가연구소 및 일반연구소, 교육기관으로 진출하게 되며, 의료']","감기로 병원에 다녀오신 경우, 일반 의원에서 발급한 진료확인서는 유고결석으로 인정되지 않을 수 있습니다. 유고결석 처리를 위해서는 병원급 이상의 의료기관에서 발급한 진료확인서를 제출해야 합니다. 

정확한 기준은 과목 담당 교수님께 확인하시기 바랍니다. 혹시 더 도와드릴까요?","감기로 병원에 다녀오신 경우, 진료확인서로 유고결석을 인정받기 위해서는 몇 가지 조건이 있습니다.일반적으로 의원에서 발급받은 서류는 유고결석 인정에 해당되지 않으며, 병원급 이상의 의료기관에서 발급된 증빙서류가 필요합니다.따라서, 감기로 병원급 의료기관에서 진료를 받으셨다면 해당 증빙서류를 제출하시면 유고결석이 가능할 수 있습니다.
정확한 사항은 담당 교수님께 문의하시고, 필요한 서류를 제출하시는 것이 좋습니다. 추가적인 질문이 있으시면 언제든지 말씀해 주시기 바랍니다.",0.9999999999916667,0.8,0.75,0.0
나 정보통신공학과인데 혹시 졸업시험 대신 졸업논문을 선택해도 될까? 논문을 쓰게 되면 머신러닝 관련해서 작성하고 싶은데 이와 관련해서 상담할 수 있는 교수님이 계시면 이메일 좀 알려줘.,"['## [heading1] ##\n# 2. 졸업시험 / 논문\n\n## [list] ##\n- 가. 1전공, 이중전공, 제2전공(2006학번 이전)은 반드시 졸업시험이나 논문을 통과하여야\n- 졸업이 가능함\n- 나. 매 학기 중반(4~5월, 10~11월)에 졸업시험 및 논문작성/심사 등을 진행하며, 학과별,\n- 전공별 조건 및 일정은 각 학과사무실에 확인하여 기간 내 조치토록 함\n- 다. 졸업시험/논문에 합격 후 졸업 시까지 그 자격이 유효하나, 합격 후 제적처리가 되는\n- 경우에는 합격이 취소됨\n- 라. 졸업시험FLEX와 외국어인증은 별도이므로 각각 요건을 확인하고 응시 / 처리하여야 함\n\n## [paragraph] ##\n3. 외국어인증(졸업인증) : 입학과 동시에 제출 가능\n\n## [paragraph] ##\n가. 외국어인증 : 2007학번 이후 모든 학생은 졸업 필수요건으로 외국어인증을 완료해야 함\n(편입생, 군위탁생, 새터민은 인증 면제 / 2004~2006학번은 아래 졸업인증 기준을 따름.\n단, 편입생 및 군위탁생으로 면제대상이거나 2006학번 이전 학생이더라도 이중전공이\n나 전공심화+부전공을 이수한 경우 외국어인증을 완료해야 함)\n※ 외국어인증은 입학과 동시에 가능하며 졸업 전 미리 인증하는 것을 권고함\n(단 제출시점 당시 증명서의 유효기간(기준 2년 이내 취득)이 남아 있어야 함)\n\n## [paragraph] ##\n※ 외국어인증 기준', '최재영 교수 Choi, Jae Young 교수님은 컴퓨터공학부 학과 소속입니다. 공학박사 학위를 가지고 있습니다. 연구분야는 머신러닝, 패턴인식입니다. 이메일은 jychoi@hufs.ac.kr입니다. 연구실은 공학관 413호입니다.', '교내해커톤 등 다양한 공모전에 팀을 이루어서 프로젝트를 수행하고 \n발표하는 경험을 쌓는 것도 좋습니다. 전공심화 학생은 정보통신종합\n설계및실습 과목을 통해 프로젝트를 수행하고 졸업논문을 작성하고 \n발표하는 경험을 쌓는 것이 필요하며, 이를 통해 다양한 정보통신 분\n야로의 사회 진출을 준비할 수 있습니다.\n졸업 후 진로 \n-  정부 및 공공기관: 기술직 공무원 / 정보통신 표준화 관련 기관 등\n-  연구소: 국책연구소 / 통신 사업자 연구소 / 정보통신 산업체 연구소\n-  기업체: 삼성전자, LG전자 등 정보통신기기 제조업체 / KT, SKT, LG \nU+등 주요 통신사업자 / 네이버, 카카오 등 정보통신 서비스 업체 / 삼\n성 SDS, LG CNS 등 SI 사업체 / 부가통신서비스 사업자 / 은행, 증권\n회사 등 금융기관 / 게임회사 / 정보보안 회사 등\n-  기타: 국내/해외 대학 석·박사 진학\nQ&A \nQ1.  인공지능 전문가가 되고 싶습니다. 정보통신공학과에서 이 목표를', '업체 현장 실습 경험을 쌓는 것이 좋습니다. 임베디드SW경진대회나 \n교내해커톤 등 다양한 공모전에 팀을 이루어서 프로젝트를 수행하고 \n발표하는 경험을 쌓는 것도 좋습니다. 전공심화 학생은 정보통신종합\n설계및실습 과목을 통해 프로젝트를 수행하고 졸업논문을 작성하고 \n발표하는 경험을 쌓는 것이 필요하며, 이를 통해 다양한 정보통신 분\n야로의 사회 진출을 준비할 수 있습니다.\n졸업 후 진로', '한희일 교수님 교수님은 정보통신공학과 학과 소속입니다. 이메일은 hihahn@hufs.ac.kr입니다. 연구실은 백년관 721호입니다.', '교내해커톤 등 다양한 공모전에 팀을 이루어서 프로젝트를 수행하고 \n발표하는 경험을 쌓는 것도 좋습니다. 전공심화 학생은 정보통신종합\n설계및실습 과목을 통해 프로젝트를 수행하고 졸업논문을 작성하고 \n발표하는 경험을 쌓는 것이 필요하며, 이를 통해 다양한 정보통신 분\n야로의 사회 진출을 준비할 수 있습니다.\n졸업 후 진로 \n-  정부 및 공공기관: 기술직 공무원 / 정보통신 표준화 관련 기관 등\n-  연구소: 국책연구소 / 통신 사업자 연구소 / 정보통신 산업체 연구소\n-  기업체: 삼성전자, LG전자 등 정보통신기기 제조업체 / KT, SKT, LG \nU+등 주요 통신사업자 / 네이버, 카카오 등 정보통신 서비스 업체 / 삼\n성 SDS, LG CNS 등 SI 사업체 / 부가통신서비스 사업자 / 은행, 증권', '김명진 명예교수님 교수님은 정보통신공학과 학과 소속입니다. 이메일은 mjkim@hufs.ac.kr입니다.', '정일영 명예교수님 교수님은 정보통신공학과 학과 소속입니다. 이메일은 iychong@hufs.ac.kr입니다.', '4544\n슬기로운 대학생활 \n학과 커리큘럼(교과과정)을 충실히 따라 기초 교양 과목을 통해 전공에 \n필요한 기초를 다지고, 이를 기반으로 전공 심화 수업을 잘 따라가는 것\n이 중요합니다.\n<1, 2학년 저학년 생활 안내> \n-  코딩 능력 함양: 정보통신공학에서는 기본적으로 프로그래밍 능력이 \n필수적이기 때문에, 1학년 교과목을 통해 C, Python, Java 등 다양한 \n기초 프로그래밍 언어를 습득하고, 이를 기반으로 2학년 교과목을 통\n해 자료구조와 알고리즘 이론을 익혀 코딩에 관한 기본 실력을 갖추는 \n것이 필요합니다. 학과에서는 고학년 학과 재학생이 조교이자 멘토로 \n활동하는 학과 코딩존을 운영하고 있으며, 이를 잘 활용해 본인의 기\n본 코딩 실력을 잘 배양하는 것이 필요합니다.\n-  기초 수학 능력 배양: AI 정보 이론과 신호 및 시스템 등의 과목을 통해 \n정보통신을 위한 기초적인 수학 능력을 배양하여야 합니다. \n-  기초 컴퓨터 시스템 능력 배양: 논리회로, 회로이론, 컴퓨터구조 등의 \n과목을 통해 실제 임베디드 보드를 활용한 시스템 경험을 쌓는 것이 \n필요합니다. 아울러 오픈소스소프트웨어 등의 과목을 통해 최신 소프\n트웨어 개발 동향을 파악하는 습관을 기르고, 컴퓨터 시스템을 활용하\n는 기본 실력을 배양하는 것이 필요합니다. \n<3, 4학년 고학년 생활 안내> \n-  전공 심화 능력 배양: 3, 4학년 과목들은 인공지능, 통신 네트워크, 정\n보 보안, 임베디드 시스템, 클라우드 컴퓨팅, IoT 시스템의 다양한 분\n야로 진출할 수 있는 정보통신 기술을 습득하기 위해 필수적인 과목\n들입니다. 이들 과목을 통해 다양한 하드웨어와 소프트웨어를 활용한 \n실습과 프로젝트를 수행하여 실전적인 경험을 쌓는 것이 중요합니다.\n-  캡스톤 프로젝트 능력 배양: 인턴 프로그램, 정보통신기초종합설계 과\n목 등을 통해 기업체 인턴쉽을 수행할 수 있으며, 이를 통해 다양한 기\n업체 현장 실습 경험을 쌓는 것이 좋습니다. 임베디드SW경진대회나 \n교내해커톤 등 다양한 공모전에 팀을 이루어서 프로젝트를 수행하고 \n발표하는 경험을 쌓는 것도 좋습니다. 전공심화 학생은 정보통신종합\n설계및실습 과목을 통해 프로젝트를 수행하고 졸업논문을 작성하고 \n발표하는 경험을 쌓는 것이 필요하며, 이를 통해 다양한 정보통신 분\n야로의 사회 진출을 준비할 수 있습니다.\n졸업 후 진로', '손경락 교수님 교수님은 정보통신공학과 학과 소속입니다. 이메일은 krson@hufs.ac.kr입니다. 연구실은 공학관 414호입니다.', '[글로벌] 2025학년도 1학기 졸업논문 제출 및 졸업시험 일정 공고 새글\n\n졸업시험 ( 대체 )\n\n졸업시험 응시원서\n\n양식 2\n\n7. 다 .\n\nFLEX 대체 ( 교내 )\n\n2025. 4. 25.( 금 )\n\n졸업시험\n\n졸업시험 시간표 발표\n\n5. 마 . ※\n\n2025. 5. 12.( 월 ) ∼ 5. 13.( 화 )\n\n졸업시험\n\n1 전공 졸업시험\n\n5. 나 .\n\n2025. 5. 19.( 월 ) ∼ 5. 20.( 화 )\n\n졸업시험\n\n제 2 전공 , 이중전공 졸업시험\n\n5. 나 .\n\n2025. 5. 24.( 토 ) 오전 10:00\n\n졸업시험 ( 대체 )\n\nFLEX 대체 ( 교내 )\n\n7. 나 .\n\n서울캠퍼스 시행예정\n\n4. 졸업논문\n\n가 . 졸업논문 작성계획서 제출 마감일 : 2025. 4. 23.( 수 )\n\n※ 졸업논문 제출 마감일은 학과에 문의\n\n나 . 제 1 전공 , 제 2 전공 , 이중전공 : 해당학과에서 배정한 졸업논문 지도교수로부터 졸업논문 작성에 관한 지도를 받아 기일 내에 소속 학과장실에 제출함\n\n다 . 졸업논문의 분량은 200 자 원고지 100 매 이상 분량을 원칙으로 함\n\n라 . 졸업논문을 기한 내에 제출하지 않는 학생은 졸업사정 대상에서 제외됨\n\n※ 졸업논문을 제출하고자 하는 학생은 3 학년 2 학기 초 또는 졸업학기의 직전 학기 초에 졸업논문 작성계획서를 작성하여 소속 학과장실에 제출하여야함\n\n※ 세부일정은 해당학과에 따라 다를 수 있으니 반드시 해당학과에 문의 후 작성 제출\n\n5. 졸업시험\n\n가 . 졸업시험 기간\n\n1) 1 전공 : 2025. 5. 12.( 월 ) ∼ 5. 13.( 화 )\n\n2) 제 2 전공 , 이중전공 : 2025. 5. 19.( 월 ) ∼ 5. 20.( 화 )\n\n나 . 졸업시험 과목 : 자세한 사항은 첨부파일 참조 , 학과 사정에 따라 변경될 수 있음 ( 자세한 사항은 학과에 문의 )\n\n다 . 졸업시험 응시원서 접수 마감일 : 2025. 4. 23.( 수 )\n\n라 . 졸업시험 응시원서 교부 및 제출처 : 해당 학과 학과장실', '## [paragraph] ##\n(3) 학생선발\n\n## [paragraph] ##\n모든 전공의 학생들이 선택할 수 있음.\n\n## [paragraph] ##\n(4) 교과과정\n\n## [heading1] ##\n# 가. 교과 목록\n\n## [table] ##\n| 학년 | 교과목명 |\n| --- | --- |\n| 2 | Business AI 개론* 비즈니스인공지능수학 비즈니스 애널리틱스 |\n| 3 | 고급 비즈니스 어낼리틱스 실습 금융공학 이론 및 실습 비즈니스데이터베이스 소셜콘텐츠분석 AI마케팅 Business AI 사례연구 빅데이터분석 |\n| 4 | 텍스트마이닝 비즈니스 머신러닝 이론 및 실습 비즈니스 딥러닝 비즈니스 시계열 분석 Business AI 프로젝트 실습 (캡스톤디자인) |\n\n## [paragraph] ##\n* 전공필수 교과목\n\n## [footer] ##\n- 60 -', ""[글로벌] 2025년 전기(2월 졸업) 졸업예비사정 결과 조회 안내\n\n졸업대기 처리 이후 , 졸업 이후 학위명 변경 불가\n\n재학년한\n\n초과제적\n\n“ 미졸업시 재학년한초과제적 예정 ” 이라고 표시되었더라도\xa02 월 졸업 가능 시 제적되지 않음\n\n가 . 졸업가능자 예시 : (1) 학점 : 완료 (2) 제 1 전공졸시논문 : 완료 (3) 이중전공졸시논문 : 비대상 (4) 외국어졸업인증 : 비대상 ▶ 졸업가능여부 : 가능\n\n나 . 졸업대기자 예시 : (1) 학점 : 완료 (2) 제 1 전공졸시논문 : 완료 (3) 이중전공졸시논문 : 비대상 (4) 외국어졸업인증 : 미완료 ▶ 졸업가능여부 : 불가\n\n다 . 졸업불가자(=추가학기 이수 필요) 예시 : (1) 학점 : 미완료 ( 이중 ( 부 ) 전공학점미충족 ) (2) 제 1 전공졸시논문 : 완료 (3) 이중전공졸시논문 : 완료 (4) 외국어졸업인증 : 완료 ▶ 졸업가능여부 : 불가\n\n2. 기준 시점 : 2025.\xa01.\xa06. ( 월 ) 오후 3 시 조회 기준\n\n가 . 계절학기 수강 내역은 반영되지 않음 (* 계절학기 성적반영 (1/17) 이후 재확인 바람 )\n\n나 . 2025.\xa01.\xa024.( 금 ) 까지 매주 월 , 수 , 금 오전 10 시 변경 내역 업데이트 예정\n\n※\xa0영역별 이수학점, 졸업시험/논문, 외국어인증이 입력되더라도,\xa0맨 아래 '졸업예비사정결과'는\xa0월/수/금에 따라서\xa0업데이트\n\n3. 유의사항\n\n가 . 사정 결과가 “ 졸업 : 가능 ” 인 학생도 계절학기 재수강 과목 F 로 졸업이 불가할 수 있으므로 , 계절학기 수강자는 1 /17 이후 반드시 재확인 바람\n\n나 . 교직이수자 : 최종 판정이 “ 졸업 : 가능 ” 이여도 교원자격증 취득이 가능하다는 의미는 아님\n\n(* 교원자격증 취득 관련 : 교직 담당자 (031-330-4953) 에게 문의 )\n\n다 . 학과에서 제출한 졸업시험 및 논문 , 단과대학 교학과에 제출한 외국어인증은 기준 시점 까지 반영되었으므로 이상이 있을 경우 반드시 학과 및 단과대학 교학과 문의\n\n학과사무실 연락처 검색 ( 클릭 시 이동 )"", '교내해커톤 등 다양한 공모전에 팀을 이루어서 프로젝트를 수행하고 \n발표하는 경험을 쌓는 것도 좋습니다. 전공심화 학생은 정보통신종합\n설계및실습 과목을 통해 프로젝트를 수행하고 졸업논문을 작성하고 \n발표하는 경험을 쌓는 것이 필요하며, 이를 통해 다양한 정보통신 분\n야로의 사회 진출을 준비할 수 있습니다.\n졸업 후 진로 \n-  정부 및 공공기관: 기술직 공무원 / 정보통신 표준화 관련 기관 등\n-  연구소: 국책연구소 / 통신 사업자 연구소 / 정보통신 산업체 연구소\n-  기업체: 삼성전자, LG전자 등 정보통신기기 제조업체 / KT, SKT, LG \nU+등 주요 통신사업자 / 네이버, 카카오 등 정보통신 서비스 업체 / 삼\n성 SDS, LG CNS 등 SI 사업체 / 부가통신서비스 사업자 / 은행, 증권\n회사 등 금융기관 / 게임회사 / 정보보안 회사 등\n-  기타: 국내/해외 대학 석·박사 진학\nQ&A \nQ1.  인공지능 전문가가 되고 싶습니다. 정보통신공학과에서 이 목표를 \n달성할 수 있을까요?\nA1.  정보통신공학과는 최신 AI 기술과 실전 경험을 갖춘 혁신적 인공지\n능 전문가를 양성하는 것을 목표로 하고 있습니다. 학과에서 제공하\n는 커리큘럼을 통해 하드웨어와 소프트웨어 기술을 망라하여 정보\n와 통신이 결합된 융복합 인공지능 전문가가 될 수 있습니다.\nQ2.  요즘은 융복합 시대입니다. 정보통신공학과는 다가오는 시대에 적\n합한 분야인가요?\nA2.  정보통신공학과는 정보와 통신이 결합된 융복합을 지향하는 학과\n입니다. 세상에서 만들어지거나 처리해야 하는 다양한 정보를 기계\n와 인간 간 소통을 통하여 더 나은 시대를 여는 것을 연구하는 분\n야입니다.\nQ3.  인문계 학생의 경우 고등학교 때 수학을 많이 배우지 않습니다. 그\n래도 정보통신공학과 커리큘럼을 따라갈 수 있는지요?\nA3.  고등학교 때 기본적으로 배우는 수학으로 준비가 충분합니다. 부족\n한 부분을 학부 1학년과 2학년 때 다양한 기본 및 심화 수학 과목이 \n있으므로 이를 학습하는 것으로 충분합니다. \nQ4.  졸업 후 통신과 관련한 곳으로 진로가 한정되나요?\nA4.  정보통신공학은 정보와 통신의 융합 학문으로서 IT 모든 분야로 진\n출이 가능합니다. 통신 분야뿐만 아니라 전자 기기, 자동차, 조선, 금\n융, 엔터테인먼트, 유통, 교육, 행정과 같이 정보통신 서비스가 결합\n되어 새로운 시너지가 창출되는 산업 전 분야로 진출이 가능합니다.', '[글로벌] 2025학년도 1학기 졸업논문 제출 및 졸업시험 일정 공고 새글\n\n컴퓨터 · 전자시스템공학전공\n\n○\n\n031)330-4268\n\n컴퓨터공학과\n\n○\n\n031)330-4268\n\n디지털정보공학과\n\n○\n\n031)330-4268\n\n정보통신공학과\n\n○\n\n○\n\n031)330-4255\n\n전자공학과\n\n○\n\n○\n\n031)330-4094\n\n산업경영공학과\n\n○\n\n○\n\n031)330-4093\n\n바이오메디컬공학부\n\n바이오메디컬공학전공\n\n○\n\n031)330-4723\n\n융합전공\n\n정보 · 기록학전공\n\n○\n\n문화콘텐츠학전공\n\n○\n\n02)2173-2936\n\nAI 융합전공 (Software&AI)\n\n○\n\n031-330-4509\n\nAI 융합전공 (Business & AI 트랙 )\n\n○\n\n02)2173-2643\n\nEU 전공\n\n○\n\n○\n\n02)2173-3284\n\n광역특화전공\n\n○\n\n세계문화예술경영전공\n\n○\n\n○\n\n02)2173-2286\n\n국가리더전공 ( 글로벌 )\n\n○\n\n○\n\n02)2173-2321\n\n데이터사이언스전공\n\n○\n\n031)330-4680\n\n바이오데이터사이언스전공\n\n○\n\n031)330-4723\n\n※ 학과사정에 따라 변경될 수 있음 ( 자세한 사항은 학과에 문의 )\n\n3. 일정별 계획\n\n마감일 / 일정\n\n구분\n\n제출서류\n\n서식 / 양식\n\n제출처\n\n유의사항\n\n( 아래 공지번호 )\n\n비고\n\n2025. 4. 23.( 수 )\n\n졸업논문\n\n졸업논문\n\n서식 1, 양식 4, 양식 5\n\n해당학과\n\n4. 나 ., 다 ., 라 .\n\n마감일정 학과 문의\n\n졸업논문\n\n졸업논문 작성계획서\n\n양식 1\n\n4. 라 . ※\n\n졸업시험\n\n졸업시험 응시원서\n\n양식 2\n\n5. 가 ., 마 .\n\n2025. 4. 23.( 수 )\n\n졸업시험 ( 대체 )\n\n졸업시험 응시원서\n\n양식 2\n\n7. 다 .\n\nFLEX 대체 ( 교내 )\n\n2025. 4. 25.( 금 )\n\n졸업시험\n\n졸업시험 시간표 발표\n\n5. 마 . ※\n\n2025. 5. 12.( 월 ) ∼ 5. 13.( 화 )\n\n졸업시험\n\n1 전공 졸업시험\n\n5. 나 .\n\n2025. 5. 19.( 월 ) ∼ 5. 20.( 화 )\n\n졸업시험']","정보통신공학과에서는 졸업시험 대신 졸업논문을 선택할 수 있습니다. 졸업논문을 작성하고자 하는 경우, 졸업논문 작성계획서를 제출해야 하며, 머신러닝 관련 주제로 논문을 작성하는 것도 가능합니다.

머신러닝 관련 상담을 원하신다면, 손경락 교수님께 문의하시면 됩니다. 교수님의 이메일은 **krson@hufs.ac.kr**입니다. 

정확한 세부사항은 교수님께 직접 문의하시기 바랍니다. 혹시 더 도와드릴까요?","졸업시험 대신 졸업논문을 선택하실 수 있습니다.졸업논문을 작성하실 경우, 머신러닝 관련 주제로 진행하고 싶으시다면, 관련 상담을 위해 한희일 교수님께 연락하실 수 있습니다
한희일 교수님의 이메일은 hihahn@hufs.ac.kr 입니다.",0.4533993783937109,1.0,0.5714285714285714,0.0
일통 FLEX 시험 점수 제출 기간 알고 싶어.,"['A0, 801점 이상 A+), 1회에 한함 - 1전공과 동일언어 학점 불인정 - FLEX 학점인정 문의 : 학사종합지원센터 학점인정담당(Tel : 031-330-4026) ※ 외국어연수평가원의 외국어과정 수료는 학점인정 대상이 아님 8) ‘사회봉사’(정규), ‘사회봉사(농활)’, ‘사회봉사(해외)’는 재학 중 최대 2과목(4학점)까지 이수 가능 9) 외대 정규 개설과목 외 교양학점으로 인정 가능한 국내외 교류학점, 현장실습 교양학점 등은 교양 선택으로 인정함 10) 글로벌캠퍼스 소속 학생이 서울캠퍼스 계절학기 등으로 아래 교과목 이수 시 - Communicative English 교과목 : 대학영어 교과목으로 인정 11) 제 15쪽의 ‘자선’ 교과목(학점)은 본인이 원할 경우 ‘교양’으로 인정받을 수 있음', ""## [heading1] ##\n# 라. 기타사항\n\n## [list] ##\n- 1) 위 인증기준을 충족하는 인증시험 성적, 대체과정 수료증 등의 '인증서 사본'(제출시점\n- 기준 2년 이내 취득)을 최종 학기 말까지 학사종합지원센터에 제출(기타언어 FLEX의\n- 경우 해당 언어학과에 일정 확인 후 학과 사무실에 제출)\n- 2) 기타언어 제출 대상자(영어통번역학부 소속 학생)가 언어관련 이중전공을 하는 경우,\n- 이중전공 졸업시험 통과 시 외국어인증으로 자동 처리됨(수료 희망자는 별도 문의)\n- 3) 외국인전형 입학자가 전공 또는 이중전공을 언어관련 전공으로 하는 경우, 전공 또는\n- 이중전공 졸업시험 통과 시 외국어인증으로 자동 처리됨(수료 희망자는 별도 문의)\n- 4) FLEX 시험 안내는 대한상공회의소 홈페이지, 학교 홈페이지 <FLEX센터>를 통하여 확\n- 인할 수 있으며, 시험 횟수가 제한적이므로 미리 준비하여 졸업에 차질이 없도록 할 것\n\n## [heading1] ##\n# 4. 기타 졸업관련 사항\n\n## [paragraph] ##\n가. 졸업예정자 졸업요건 충족여부 필수 확인사항 정리\n\n## [list] ##\n- 1) 졸업에 필요한 이수학점 수 / 총평점(F포함) 2.0이상 여부\n- 2) 교양필수 및 전공(이중전공) 필수 교과목 이수여부\n\n## [paragraph] ##\n※ 전공필수 : 각 학과 문의\n교양필수 : 수강편람 교양 안내문 참조\n\n## [list] ##\n- 3) 전공 및 이중전공 졸업시험(논문/또는 대체시험 등) 합격여부\n- 4) 외국어인증(졸업인증) 완료여부\n\n## [paragraph] ##\n나. 졸업요건 충족여부에 따른 학적사항 안내"", '성적 701점 이상 - 인정학점 : ‘FLEX~어(교양)’ 2학점(701~800점 A0, 801점 이상 A+), 1회에 한함 - 1전공과 동일언어 학점 불인정 - FLEX 학점인정 문의 : 학사종합지원센터 학점인정담당(Tel : 031-330-4026) ※ 외국어연수평가원의 외국어과정 수료는 학점인정 대상이 아님 8) ‘사회봉사’(정규), ‘사회봉사(농활)’, ‘사회봉사(해외)’는 재학 중 최대 2과목(4학점)까지 이수 가능 9) 외대 정규 개설과목 외 교양학점으로 인정 가능한 국내외 교류학점, 현장실습 교양학점 등은 교양 선택으로 인정함 10) 글로벌캠퍼스 소속 학생이 서울캠퍼스 계절학기 등으로 아래 교과목 이수 시 - Communicative English 교과목 : 대학영어 교과목으로 인정 11) 제', '다 . 제출기간 : 해당학과 사무실 문의\n\n7. FLEX 대체 ( 이탈리아어 , 태국어 , 폴란드어 , 루마니아어 , 체코어 , 헝가리어 , 세르비아어 , 그리스어 , 불가리아어 , 힌디어 )\n\n가 . 해당학과 : 자세한 사항은 첨부파일 참조\n\n나 . 시험일자 : 2025. 5. 24( 토 ) 오전 10:00 서울캠퍼스 시행예정\n\n※ 정확한 시간 / 장소는 추후 통지\n\n다 . 접수기간 : 2025. 4. 16.( 수 ) ~ 4. 23.( 수 ) 해당학과 사무실에 신청 ( 기한 이후 추가 신청 불가 )\n\n* 7 학기 이상 재적생만 신청가능\n\n8. 유의 사항\n\n가 . 졸업시험 및 졸업논문 심사에 통과한 자는 졸업 시까지 그 자격이 유효함 ( 단 , 학적을 상실한 때에는 그 자격을 인정하지 아니함 )\n\n나 . 제 2 전공 , 이중전공자도 해당학과 문의 / 학과에 따른 졸업시험 응시 , 논문 제출 등 pass 하기 바람', '[글로벌] 2025학년도 1학기 졸업논문 제출 및 졸업시험 일정 공고\n\n다 . 졸업시험 응시원서 접수 마감일 : 2025. 4. 23.( 수 )\n\n라 . 졸업시험 응시원서 교부 및 제출처 : 해당 학과 학과장실\n\n마 . 졸업시험 시간표 발표 : 2025. 4. 25.( 금 ) 소속학과 게시판 참조 ( 학과 자체 발표 )\n\n※ 해당학과 ( 부 ) 에 따라 시험일정이 다를 수 있으니 반드시 해당학과에 문의 후 응시\n\n6. FLEX 대체 ( 정기시험 : 영어 , 중국어 , 일본어 , 프랑스어 , 독일어 , 러시아어 , 스페인어 )\n\n가 . 해당학과 : 자세한 사항은 첨부파일 참조\n\n나 . 일정 : 시험 일정 ( 클릭 ) 에 따라 학생 개별 응시하고 성적표 학과 제출\n\n다 . 제출기간 : 해당학과 사무실 문의\n\n7. FLEX 대체 ( 이탈리아어 , 태국어 , 폴란드어 , 루마니아어 , 체코어 , 헝가리어 , 세르비아어 , 그리스어 , 불가리아어 , 힌디어 )\n\n가 . 해당학과 : 자세한 사항은 첨부파일 참조\n\n나 . 시험일자 : 2025. 5. 24( 토 ) 오전 10:00 서울캠퍼스 시행예정\n\n※ 정확한 시간 / 장소는 추후 통지\n\n다 . 접수기간 : 2025. 4. 16.( 수 ) ~ 4. 23.( 수 ) 해당학과 사무실에 신청 ( 기한 이후 추가 신청 불가 )\n\n* 7 학기 이상 재적생만 신청가능\n\n8. 유의 사항\n\n가 . 졸업시험 및 졸업논문 심사에 통과한 자는 졸업 시까지 그 자격이 유효함 ( 단 , 학적을 상실한 때에는 그 자격을 인정하지 아니함 )\n\n나 . 제 2 전공 , 이중전공자도 해당학과 문의 / 학과에 따른 졸업시험 응시 , 논문 제출 등 pass 하기 바람\n\n다 . 졸업시험 응시원서 제출 시 학생 본인의 연락처를 정확히 기재할 것\n\n라 . 졸업시험은 과목별 40 점이상 , 전과목 평균 60 점 이상 취득하여야 합격임\n\n마 . 졸업논문은 D° 이상 판정 받아야 합격임\n\n※ 졸업시험 및 졸업논문 관련서식은 첨부파일 참조\n\n2025. 4.\n\n글로벌캠퍼스 교무처장', '## [paragraph] ##\n<BRICs 지역전문가 인증 조건>\n\n## [table] ##\n| 영역 | 인증 조건 | 인증 조건 |\n| --- | --- | --- |\n| 영어 | 다음 중 택 1 ․ FLEX 701(듣기, 읽기)+200(쓰기, 말하기) ․ TOEIC 850 ․ IBT TOEFL 94 | 다음 중 택 1 ․ FLEX 701(듣기, 읽기)+200(쓰기, 말하기) ․ TOEIC 850 ․ IBT TOEFL 94 |\n| 현지어 | 브라질 | 학과 졸업시험 |\n| 현지어 | 러시아 | 다음 중 택 1 ․ FLEX 701(듣기, 읽기)+200(쓰기, 말하기) ․ TORFL 2등급 이상 |\n| 현지어 | 인도 | 학과 졸업시험 |\n| 현지어 | 중국 | 다음 중 택 1 ․ FLEX 701(듣기, 읽기)+200(쓰기, 말하기) ․ HSK 5급 이상 ․ 新HSK 5급 이상 |\n| 정보화인증 | MOS 자격증 2개(Core 등급 이상) 또는 컴퓨터활용능력 2급 이상+MOS 자격증 1개 또는 ICDL(start 등급 이상) 자격증 취득 | MOS 자격증 2개(Core 등급 이상) 또는 컴퓨터활용능력 2급 이상+MOS 자격증 1개 또는 ICDL(start 등급 이상) 자격증 취득 |\n| 펠로우십 과정 | 필수 | 필수 |\n| 졸업프로젝트 | 졸업논문 제출(분량: 200자 원고지 100매 이상) | 졸업논문 제출(분량: 200자 원고지 100매 이상) |\n\n## [list] ##\n- ※ 지도교수의 지도하에 작성되는 논문이어야 함\n- ※ 영어 및 현지어 성적표는 제출일 기준 2년 이내의 것이어야 함\n\n## [heading1] ##\n# (6) 문의처\n\n## [list] ##\n- - 선발 및 펠로우십 파견 : 국제교류팀 02-2173-2070\n- - 학점 이수 및 졸업 관련 : brics@hufs.ac.kr\n\n## [footer] ##\n- 42 -', '[글로벌] 2025학년도 1학기 졸업논문 제출 및 졸업시험 일정 공고\n\n양식 2\n\n7. 다 .\n\nFLEX 대체 ( 교내 )\n\n2025. 4. 25.( 금 )\n\n졸업시험\n\n졸업시험 시간표 발표\n\n5. 마 . ※\n\n2025. 5. 12.( 월 ) ∼ 5. 13.( 화 )\n\n졸업시험\n\n1 전공 졸업시험\n\n5. 나 .\n\n2025. 5. 19.( 월 ) ∼ 5. 20.( 화 )\n\n졸업시험\n\n제 2 전공 , 이중전공 졸업시험\n\n5. 나 .\n\n2025. 5. 24.( 토 ) 오전 10:00\n\n졸업시험 ( 대체 )\n\nFLEX 대체 ( 교내 )\n\n7. 나 .\n\n서울캠퍼스 시행예정\n\n4. 졸업논문\n\n가 . 졸업논문 작성계획서 제출 마감일 : 2025. 4. 23.( 수 )\n\n※ 졸업논문 제출 마감일은 학과에 문의\n\n나 . 제 1 전공 , 제 2 전공 , 이중전공 : 해당학과에서 배정한 졸업논문 지도교수로부터 졸업논문 작성에 관한 지도를 받아 기일 내에 소속 학과장실에 제출함\n\n다 . 졸업논문의 분량은 200 자 원고지 100 매 이상 분량을 원칙으로 함\n\n라 . 졸업논문을 기한 내에 제출하지 않는 학생은 졸업사정 대상에서 제외됨\n\n※ 졸업논문을 제출하고자 하는 학생은 3 학년 2 학기 초 또는 졸업학기의 직전 학기 초에 졸업논문 작성계획서를 작성하여 소속 학과장실에 제출하여야함\n\n※ 세부일정은 해당학과에 따라 다를 수 있으니 반드시 해당학과에 문의 후 작성 제출\n\n5. 졸업시험\n\n가 . 졸업시험 기간\n\n1) 1 전공 : 2025. 5. 12.( 월 ) ∼ 5. 13.( 화 )\n\n2) 제 2 전공 , 이중전공 : 2025. 5. 19.( 월 ) ∼ 5. 20.( 화 )\n\n나 . 졸업시험 과목 : 자세한 사항은 첨부파일 참조 , 학과 사정에 따라 변경될 수 있음 ( 자세한 사항은 학과에 문의 )\n\n다 . 졸업시험 응시원서 접수 마감일 : 2025. 4. 23.( 수 )\n\n라 . 졸업시험 응시원서 교부 및 제출처 : 해당 학과 학과장실\n\n마 . 졸업시험 시간표 발표 : 2025. 4. 25.( 금 ) 소속학과 게시판 참조 ( 학과 자체 발표 )', '[글로벌] 2025학년도 1학기 졸업논문 제출 및 졸업시험 일정 공고 새글\n\n나 . 졸업시험 과목 : 자세한 사항은 첨부파일 참조 , 학과 사정에 따라 변경될 수 있음 ( 자세한 사항은 학과에 문의 )\n\n다 . 졸업시험 응시원서 접수 마감일 : 2025. 4. 23.( 수 )\n\n라 . 졸업시험 응시원서 교부 및 제출처 : 해당 학과 학과장실\n\n마 . 졸업시험 시간표 발표 : 2025. 4. 25.( 금 ) 소속학과 게시판 참조 ( 학과 자체 발표 )\n\n※ 해당학과 ( 부 ) 에 따라 시험일정이 다를 수 있으니 반드시 해당학과에 문의 후 응시\n\n6. FLEX 대체 ( 정기시험 : 영어 , 중국어 , 일본어 , 프랑스어 , 독일어 , 러시아어 , 스페인어 )\n\n가 . 해당학과 : 자세한 사항은 첨부파일 참조\n\n나 . 일정 : 시험 일정 ( 클릭 ) 에 따라 학생 개별 응시하고 성적표 학과 제출\n\n다 . 제출기간 : 해당학과 사무실 문의\n\n7. FLEX 대체 ( 이탈리아어 , 태국어 , 폴란드어 , 루마니아어 , 체코어 , 헝가리어 , 세르비아어 , 그리스어 , 불가리아어 , 힌디어 )\n\n가 . 해당학과 : 자세한 사항은 첨부파일 참조\n\n나 . 시험일자 : 2025. 5. 24( 토 ) 오전 10:00 서울캠퍼스 시행예정\n\n※ 정확한 시간 / 장소는 추후 통지\n\n다 . 접수기간 : 2025. 4. 16.( 수 ) ~ 4. 23.( 수 ) 해당학과 사무실에 신청 ( 기한 이후 추가 신청 불가 )\n\n* 7 학기 이상 재적생만 신청가능\n\n8. 유의 사항\n\n가 . 졸업시험 및 졸업논문 심사에 통과한 자는 졸업 시까지 그 자격이 유효함 ( 단 , 학적을 상실한 때에는 그 자격을 인정하지 아니함 )\n\n나 . 제 2 전공 , 이중전공자도 해당학과 문의 / 학과에 따른 졸업시험 응시 , 논문 제출 등 pass 하기 바람\n\n다 . 졸업시험 응시원서 제출 시 학생 본인의 연락처를 정확히 기재할 것\n\n라 . 졸업시험은 과목별 40 점이상 , 전과목 평균 60 점 이상 취득하여야 합격임\n\n마 . 졸업논문은 D° 이상 판정 받아야 합격임', '[공통] 2025-1학기(상반기) 교내 FLEX 졸업시험 시행 안내\n\n[공통] 2025-1학기(상반기) 교내 FLEX 졸업시험 시행 안내\n\n[ 공통 ] 2025-1 학기 ( 상반기 ) 교내 FLEX 졸업시험 시행 안내\n\n2025 학년도 1 학기 ( 상반기 ) 교내 FLEX 졸업시험의 세부 시행 계획을 아래와 같이 안내합니다 .\n\n1. 시 험 명 : 2025 학년도 1 학기 (2025 년 상반기 ) 교내 FLEX 졸업시험\n\n2. 시행주관 : FLEX 센터\n\n3. 대상언어 : 총 15 개 언어\n\n※ 포르투갈어 , 네덜란드어 , 스웨덴어 , 마 ・ 인어 , 태국어 , 튀르키예어 ( 터키어 ), 이탈리아어 , 체코어 , 헝가리어 , 세르비아어 , 루마니아어 , 폴란드어 , 그리스어 , 불가리아어 , 힌디어\n\n4. 응시자격 : 교내 각 학과에 사전 신청한 학생만 응시 가능\n\n5. 시험일시 : 2025. 5. 24( 토 ) 10:00~12:00(120 분 )\n\n6. 입실시간 : 09:40 분까지 해당 고사실 내 입실완료 , 마스크 착용 권고\n\n※ 응시자는 정해진 입실시간을 반드시 준수하여야 합니다 .\n\n※ 듣기시험이 시작되면 고사실 내 입실을 할 수 없습니다 .\n\n7. 시험장소 : 본교 서울캠퍼스 교수학습개발원\n\n※ 시험 당일 건물 앞에 설치되는 배치표 , 유도표시 및 붙임의 시행계획 참고\n\n8. 응시자 준비물 ( 반드시 지참 )\n\n※ 신분증 ( 학생증 , 주민등록증 , 운전면허증 , 여권 등 ), 컴퓨터용 수성싸인펜 , 수정테이프\n\n※ OMR 답안 수정은 응시자가 수정테이프로 자유롭게 수정이 가능함 .\n\n9. 시험 및 평가유형 ( 붙임의 시행계획서 참고 )\n\n가 . FLEX 듣기 · 읽기 A 형 ( 듣기 50 문항 , 읽기 90 문항 / 총 120 분 )\n\n나 . FLEX 듣기 · 읽기 B 형 ( 듣기 55 문항 , 읽기 95 문항 / 총 120 분 )\n\n다 . 언어별로 각각 개발되어 있는 유형에 따라 시행\n\n10. 기타사항\n\n가 . 별도 성적인증서 또는 성적표는 발급되지 않음 .', '| 2 | 비영어 전공 | 영어 | 구분 | FLEX | FLEX 스피킹 | TOEIC | TOEIC 스피킹 | OPIc |\n| 2 | 비영어 전공 | 영어 | 인문대학 경상대학 통번역대학(영어제외) 동유럽학대학 국제지역대학 융합인재대학 Culture&Technology 융합대학 Finance&AI융합학부 기후변화융합학부 | 611점 이상 | 170점 이상 | 700점 이상 | 120점 이상 | IM1 이상 |\n| 2 | 비영어 전공 | 영어 | 자연과학대학 공과대학 바이오메디컬공학부 AI데이터융합학부 | 551점 이상 | 160점 이상 | 645점 이상 | 110점 이상 | IM1 이상 |\n| 외국인전형 입학자 |  | 한국어/영어/ 기타언어 중 택1 | • TOPIK 또는 유형 1, 2의 인증 중 택1 | • TOPIK 또는 유형 1, 2의 인증 중 택1 | • TOPIK 또는 유형 1, 2의 인증 중 택1 | • TOPIK 또는 유형 1, 2의 인증 중 택1 | • TOPIK 또는 유형 1, 2의 인증 중 택1 | • TOPIK 또는 유형 1, 2의 인증 중 택1 |', '[글로벌] 2025학년도 1학기 졸업논문 제출 및 졸업시험 일정 공고 새글\n\n졸업시험 ( 대체 )\n\n졸업시험 응시원서\n\n양식 2\n\n7. 다 .\n\nFLEX 대체 ( 교내 )\n\n2025. 4. 25.( 금 )\n\n졸업시험\n\n졸업시험 시간표 발표\n\n5. 마 . ※\n\n2025. 5. 12.( 월 ) ∼ 5. 13.( 화 )\n\n졸업시험\n\n1 전공 졸업시험\n\n5. 나 .\n\n2025. 5. 19.( 월 ) ∼ 5. 20.( 화 )\n\n졸업시험\n\n제 2 전공 , 이중전공 졸업시험\n\n5. 나 .\n\n2025. 5. 24.( 토 ) 오전 10:00\n\n졸업시험 ( 대체 )\n\nFLEX 대체 ( 교내 )\n\n7. 나 .\n\n서울캠퍼스 시행예정\n\n4. 졸업논문\n\n가 . 졸업논문 작성계획서 제출 마감일 : 2025. 4. 23.( 수 )\n\n※ 졸업논문 제출 마감일은 학과에 문의\n\n나 . 제 1 전공 , 제 2 전공 , 이중전공 : 해당학과에서 배정한 졸업논문 지도교수로부터 졸업논문 작성에 관한 지도를 받아 기일 내에 소속 학과장실에 제출함\n\n다 . 졸업논문의 분량은 200 자 원고지 100 매 이상 분량을 원칙으로 함\n\n라 . 졸업논문을 기한 내에 제출하지 않는 학생은 졸업사정 대상에서 제외됨\n\n※ 졸업논문을 제출하고자 하는 학생은 3 학년 2 학기 초 또는 졸업학기의 직전 학기 초에 졸업논문 작성계획서를 작성하여 소속 학과장실에 제출하여야함\n\n※ 세부일정은 해당학과에 따라 다를 수 있으니 반드시 해당학과에 문의 후 작성 제출\n\n5. 졸업시험\n\n가 . 졸업시험 기간\n\n1) 1 전공 : 2025. 5. 12.( 월 ) ∼ 5. 13.( 화 )\n\n2) 제 2 전공 , 이중전공 : 2025. 5. 19.( 월 ) ∼ 5. 20.( 화 )\n\n나 . 졸업시험 과목 : 자세한 사항은 첨부파일 참조 , 학과 사정에 따라 변경될 수 있음 ( 자세한 사항은 학과에 문의 )\n\n다 . 졸업시험 응시원서 접수 마감일 : 2025. 4. 23.( 수 )\n\n라 . 졸업시험 응시원서 교부 및 제출처 : 해당 학과 학과장실', '| 1 | 영어관련 전공 | 기타언어 | • 제2외국어(영어 제외) : FLEX 인증 원칙(해당언어 전공학과 기준) • 국가공인한자능력시험 : 3급 이상 • KBS한국어능력시험 : 3-급 이상 • 해당언어 전공 기초어학강좌 : 6학점 이상 이수(이중/부전공 언어 제외) | • 제2외국어(영어 제외) : FLEX 인증 원칙(해당언어 전공학과 기준) • 국가공인한자능력시험 : 3급 이상 • KBS한국어능력시험 : 3-급 이상 • 해당언어 전공 기초어학강좌 : 6학점 이상 이수(이중/부전공 언어 제외) | • 제2외국어(영어 제외) : FLEX 인증 원칙(해당언어 전공학과 기준) • 국가공인한자능력시험 : 3급 이상 • KBS한국어능력시험 : 3-급 이상 • 해당언어 전공 기초어학강좌 : 6학점 이상 이수(이중/부전공 언어 제외) | • 제2외국어(영어 제외) : FLEX 인증 원칙(해당언어 전공학과 기준) • 국가공인한자능력시험 : 3급 이상 • KBS한국어능력시험 : 3-급 이상 •', '| --- | --- | --- | --- | --- | --- | --- | --- | --- |\n| 1 | 영어관련 전공 | 기타언어 | • 제2외국어(영어 제외) : FLEX 인증 원칙(해당언어 전공학과 기준) • 국가공인한자능력시험 : 3급 이상 • KBS한국어능력시험 : 3-급 이상 • 해당언어 전공 기초어학강좌 : 6학점 이상 이수(이중/부전공 언어 제외) | • 제2외국어(영어 제외) : FLEX 인증 원칙(해당언어 전공학과 기준) • 국가공인한자능력시험 : 3급 이상 • KBS한국어능력시험 : 3-급 이상 • 해당언어 전공 기초어학강좌 : 6학점 이상 이수(이중/부전공 언어 제외) | • 제2외국어(영어 제외) : FLEX 인증 원칙(해당언어 전공학과 기준) • 국가공인한자능력시험 : 3급 이상 • KBS한국어능력시험 : 3-급 이상 • 해당언어 전공 기초어학강좌 : 6학점 이상 이수(이중/부전공 언어 제외) | • 제2외국어(영어 제외) : FLEX 인증 원칙(해당언어 전공학과 기준) • 국가공인한자능력시험 : 3급 이상 • KBS한국어능력시험 : 3-급 이상 • 해당언어 전공 기초어학강좌 : 6학점 이상 이수(이중/부전공 언어 제외) | • 제2외국어(영어 제외) : FLEX 인증 원칙(해당언어 전공학과 기준) • 국가공인한자능력시험 : 3급 이상 • KBS한국어능력시험 : 3-급 이상 • 해당언어 전공 기초어학강좌 : 6학점 이상 이수(이중/부전공 언어 제외) | • 제2외국어(영어 제외) : FLEX 인증 원칙(해당언어 전공학과 기준) • 국가공인한자능력시험 : 3급 이상 • KBS한국어능력시험 : 3-급 이상 • 해당언어 전공 기초어학강좌 : 6학점 이상 이수(이중/부전공 언어 제외) |\n| 2 | 비영어 전공 | 영어 | 구분 | FLEX | FLEX 스피킹 | TOEIC | TOEIC 스피킹 | OPIc |', '이수한 것으로 처리 7) FLEX외국어능력시험 교양선택 학점 인정(2015학번 이후) (대학외국어필수 대체 아님) - 인정성적 : FLEX외국어능력시험(대한상공회의소 주관, 듣기․읽기) 성적 701점 이상 - 인정학점 : ‘FLEX~어(교양)’ 2학점(701~800점 A0, 801점 이상 A+), 1회에 한함 - 1전공과 동일언어 학점 불인정 - FLEX 학점인정 문의 : 학사종합지원센터 학점인정담당(Tel : 031-330-4026) ※ 외국어연수평가원의 외국어과정 수료는 학점인정 대상이 아님 8) ‘사회봉사’(정규), ‘사회봉사(농활)’, ‘사회봉사(해외)’는 재학 중 최대 2과목(4학점)까지 이수 가능 9) 외대 정규 개설과목 외 교양학점으로 인정 가능한 국내외 교류학점, 현장실습 교양학점 등은 교양 선택으로 인정함 10) 글로벌캠퍼스 소속 학생이 서울캠퍼스 계절학기 등으로 아래 교과목 이수 시 - Communicative English 교과목 : 대학영어 교과목으로 인정', '[글로벌] 2025학년도 1학기 졸업논문 제출 및 졸업시험 일정 공고 새글\n\n컴퓨터 · 전자시스템공학전공\n\n○\n\n031)330-4268\n\n컴퓨터공학과\n\n○\n\n031)330-4268\n\n디지털정보공학과\n\n○\n\n031)330-4268\n\n정보통신공학과\n\n○\n\n○\n\n031)330-4255\n\n전자공학과\n\n○\n\n○\n\n031)330-4094\n\n산업경영공학과\n\n○\n\n○\n\n031)330-4093\n\n바이오메디컬공학부\n\n바이오메디컬공학전공\n\n○\n\n031)330-4723\n\n융합전공\n\n정보 · 기록학전공\n\n○\n\n문화콘텐츠학전공\n\n○\n\n02)2173-2936\n\nAI 융합전공 (Software&AI)\n\n○\n\n031-330-4509\n\nAI 융합전공 (Business & AI 트랙 )\n\n○\n\n02)2173-2643\n\nEU 전공\n\n○\n\n○\n\n02)2173-3284\n\n광역특화전공\n\n○\n\n세계문화예술경영전공\n\n○\n\n○\n\n02)2173-2286\n\n국가리더전공 ( 글로벌 )\n\n○\n\n○\n\n02)2173-2321\n\n데이터사이언스전공\n\n○\n\n031)330-4680\n\n바이오데이터사이언스전공\n\n○\n\n031)330-4723\n\n※ 학과사정에 따라 변경될 수 있음 ( 자세한 사항은 학과에 문의 )\n\n3. 일정별 계획\n\n마감일 / 일정\n\n구분\n\n제출서류\n\n서식 / 양식\n\n제출처\n\n유의사항\n\n( 아래 공지번호 )\n\n비고\n\n2025. 4. 23.( 수 )\n\n졸업논문\n\n졸업논문\n\n서식 1, 양식 4, 양식 5\n\n해당학과\n\n4. 나 ., 다 ., 라 .\n\n마감일정 학과 문의\n\n졸업논문\n\n졸업논문 작성계획서\n\n양식 1\n\n4. 라 . ※\n\n졸업시험\n\n졸업시험 응시원서\n\n양식 2\n\n5. 가 ., 마 .\n\n2025. 4. 23.( 수 )\n\n졸업시험 ( 대체 )\n\n졸업시험 응시원서\n\n양식 2\n\n7. 다 .\n\nFLEX 대체 ( 교내 )\n\n2025. 4. 25.( 금 )\n\n졸업시험\n\n졸업시험 시간표 발표\n\n5. 마 . ※\n\n2025. 5. 12.( 월 ) ∼ 5. 13.( 화 )\n\n졸업시험\n\n1 전공 졸업시험\n\n5. 나 .\n\n2025. 5. 19.( 월 ) ∼ 5. 20.( 화 )\n\n졸업시험']","일본어통번역학과(일통)의 FLEX 시험 점수 제출 기간은 해당학과 사무실에 문의하셔야 합니다. 문서에서는 구체적인 제출 기간에 대한 정보가 제공되지 않았습니다. 

정확한 정보를 위해 일본어통번역학과 사무실에 직접 문의하시기 바랍니다. 혹시 더 도와드릴까요?",졸업시험 점수 제출 기간은 공지사항에 따라 각 학과 사무실로 문의해야 합니다. 추가적인 질문이 있으시면 말씀해주세요.,0.6545003607421795,0.5,0.75,0.0
"글스산 세부전공 신청해야되는데, 신청기간이랑 방법 알 수 있어? 그리고 결과는 언제나와?","['불가\n\n① 모든 과목은 수강신청(변경)기간에 학생 본인이 온라인으로 수강신청 해야 함\n\n② 전공/이중(부)전공 담당 교수님이 제한인원을 초과하여 수강을 허용하는 경우 반드시 개설학과의 수업담당 조교가 제한인원 증원 후 학생 본인이 온라인으로 수강신청 해야 함\n\n③ 교양은 증원 불가\n\n강의시간표 비고 내용 및\n\n수강신청 허용/제한 문의\n\n개설학과 문의 ☎바로가기 Click▶\n\n기타 학사 문의\n\n(본인 1전공 단과대학 교학과 문의)\n\n서양어대학, 중국학대학, 일본학대학\n\n02 – 2173 - 2121\n\n사회과학대학, 상경대학,\n\n경영대학, 국제학부, LD/LT학부, KFL학부\n\n02 – 2173 – 2308\n\n영어대학, 아시아언어문화대학, AI융합대학\n\n02 – 2173 - 2264\n\n자유전공학부(서울)\n\n02 – 2173 - 2109\n\n사범대학\n\n02 – 2173 - 2338\n\n공과대학, 자연과학대학, 바이오메디컬공학부\n\n031 – 330 - 4073', '다. 이수구분 신청 전, 전공교류교과목을 수강편람에서 확인하고 문의 사항이 있을 경우 신청전 미리 상담 (수강편람 확인 클릭)\n\n라. 신청 후 3~4일 (평일 기준) 이후\xa0종합정보시스템에서 변경결과를 반드시 확인하고 변경이 안된 경우, 담당자에게 연락하여 반드시 확인', '▶ ( 글로벌 ) hufsdbl@hufs.ac.kr 로 이메일 제출\n\n2. 일 정\n\n가 . 신청 기간 : 2025 년 1 월 22 일 ( 수 ) 10 시 ~ 1 월 23 일 ( 목 ) 14 시\n\n※ 안내된 기간에만 운영하므로 일정 준수할 것 ( 이후 별도 운영 계획 없음 )\n\n나 . 결과 확인 : 2025 년 1 월 24 일 ( 금 ) 14 시 , 종합정보시스템\n\n3. 신청 방법 : 종합정보시스템 → 전공 / 교직관리 ( ※ 가 . / 나 . 중 하나의 방법으로 신청 )\n\n가 . 부전공 신청 : 전공심화 + 부전공 또는 부전공 신청\n\n1) 신청 시 기존에 이수 중인 이중 / 부전공 은 자동 취소 됨 ( ※ 별도 취소 절차 없음 )\n\n2) “4. 유의 사항 ” 의 다 . 참고 하여 부전공 신청으로 인한 이수구분 변경 신청\n\n※ 이번 학기 졸업예정자 (4 학년 수료 , 졸업대기 포함 ) 는 1 월 초 까지\n\n이수구분 변경을 신청하여 졸업 학점이 누락되는 일이 없도록 해야 함', '[글로벌] 학부/계열 입학생 학과·세부전공·모듈 신청 공고-글로벌자유전공학부/인문과학계열(\n\n다 . 융합인재학부 : 필수모듈 4 지망까지 , 선택모듈 8 지망까지 모두 신청\n\n라 . 글로벌자유전공학부 : 1 지망 신청\n\n※ 신청기간 내 미신청 시 학부에서 임의 배정 함 .( 배정 내역 추후 변경 불가 )\n\n6. 배정확정 : 2025 년 7 월 중 (1 학기 성적 반영 완료 후 )\n\n2025. 5.\n\n글로벌캠퍼스 교무처장\n\n| 0 |\n|:-------------------------------------------------------|\n| [글로벌] 학부/계열 입학생 학과·세부전공·모듈 신청 공고 |', '※ 5 월 26 일 ( 월 ) ~ 5 월 30 일 ( 금 ) 예정\n\n단 , 해당 기간에 신청하지 않으면 다음 학기부터 이중전공 변경 신청으로만 가능함\n\n2. 신청 기간 : 2025 년 5 월 12 일 ( 월 ) 10 시 ~ 5 월 16 일 ( 금 ) 16 시\n\n※ 안내된 기간에만 신청 / 변경 / 삭제 가능하므로 일정 준수할 것 ( 이후 별도 운영 계획 없음 )\n\n3. 신청 방법 : 종합정보시스템 → 전공 / 교직관리 → 이중전공 변경신청\n\n※ 1 지망만 신청 가능 , 신청 완료후 다시 조회하여 신청 결과를 반드시 확인할 것\n\n※ 제한사항\n\n가 . 신청할 학과 ( 부 )/ 전공의 본인 학번대에 여석이 없는 경우 신청 불가\n\n나 . 캠퍼스 간 이중전공을 희망하는 경우 아래의 제한학과로는 신청 불가\n\n서울캠퍼스\n\n( 글로벌캠퍼스 학생 신청 불가 학과 )\n\n글로벌캠퍼스\n\n( 서울캠퍼스 학생 신청 불가 학과 )\n\n영어대학 각 학과 ( 전공 )\n\n※ 글로벌캠퍼스 2023 학번부터 가능', '. 수강생 유의사항(※자세한 내용은 수강편람 참조) 가.\xa0수강신청/변경 및 취소 후\xa0종합정보시스템에서 본인의 수강신청 내역 및 개인시간표 최종 확인 나.\xa0입학한 첫 학기 재수강 신청 불가 (수강신청 변경 기간 종료 후 재수강 신청 과목은\xa0재수강 아닌 과목으로 일괄 처리됨) 다.\xa0수강신청 변경기간\xa0중\xa0“취소-시간차 수강신청제” 운영(※ 2021-2학기부터 시행) 1) 강의 매매 방지를 위하여 취소로 발생한 여석의 수강신청 가능 시간에 시차를 두는 방식 2) 자세한 내용은\xa0학사공지 게시글 제목을 “시간차”로 검색 :\xa0게시글 바로가기 Click▶ 3. 관련 사이트 안내 구 분 서울캠퍼스 글로벌캠퍼스 ★ 신입생 및 편입생 일반교육 동영상 동영상 보기 Click▶ 교육자료 교육자료(서울) Click▶ 교육자료(글로벌) Click▶ ★ 신입생 및 편입생 학번확인 신입생 - 2월 21일(금) 이후부터 확인 가능 편입생 – 2월 22일(토) 이후부터 확인 가능 바로가기 Click▶', '가 . 해당학과 : 자세한 사항은 첨부파일 참조\n\n나 . 시험일자 : 2025. 5. 24( 토 ) 오전 10:00 서울캠퍼스 시행예정\n\n※ 정확한 시간 / 장소는 추후 통지\n\n다 . 접수기간 : 2025. 4. 16.( 수 ) ~ 4. 23.( 수 ) 해당학과 사무실에 신청 ( 기한 이후 추가 신청 불가 )\n\n* 7 학기 이상 재적생만 신청가능\n\n8. 유의 사항\n\n가 . 졸업시험 및 졸업논문 심사에 통과한 자는 졸업 시까지 그 자격이 유효함 ( 단 , 학적을 상실한 때에는 그 자격을 인정하지 아니함 )\n\n나 . 제 2 전공 , 이중전공자도 해당학과 문의 / 학과에 따른 졸업시험 응시 , 논문 제출 등 pass 하기 바람\n\n다 . 졸업시험 응시원서 제출 시 학생 본인의 연락처를 정확히 기재할 것', '※ 1 지망만 신청 가능 , 신청 완료후 다시 조회하여 신청 결과를 반드시 확인할 것\n\n※ 제한사항\n\n가 . 신청할 학과 ( 부 )/ 전공의 본인 학번대에 여석이 없는 경우 신청 불가\n\n나 . 캠퍼스 간 이중전공을 희망하는 경우 아래의 제한학과로는 신청 불가\n\n서울캠퍼스\n\n( 글로벌캠퍼스 학생 신청 불가 학과 )\n\n글로벌캠퍼스\n\n( 서울캠퍼스 학생 신청 불가 학과 )\n\n영어대학 각 학과 ( 전공 )\n\n※ 글로벌캠퍼스 2023 학번부터 가능\n\n영어통번역학부\n\n프랑스어학부 ( 기존 프랑스어과 포함 )\n\n※ 글로벌캠퍼스 2023 학번부터 가능\n\n프랑스학과\n\n독일어과\n\n※ 글로벌캠퍼스 2024 학번부터 가능\n\n독일어통번역학과\n\n노어과', '[글로벌] 학부/계열 입학생 학과·세부전공·모듈 신청 공고-글로벌자유전공학부/인문과학계열(\n\n[글로벌] 학부/계열 입학생 학과·세부전공·모듈 신청 공고-글로벌자유전공학부/인문과학계열(\n\n[ 글로벌 ] 학부 / 계열 입학생 학과 · 세부전공 · 모듈 신청 공고\n\n학부 / 계열 입학생 학과 · 세부전공 · 모듈 신청 일정을 아래와 같이 공고함 .\n\n1. 대상\n\n가 . 인문과학계열 광역모집 학생 중 1 학 년 2 학기 진급 예정자\n\n나 . 영어통번역학부 2018 학번 ( 포함 ) 이후 학생 중 3 학년 진급 예정자\n\n다 . 아프리카학부 학생 중 1 학년 2 학기 진급 예정자\n\n라 . 글로벌스포츠산업학부 학생 중 2 학년 진급 예정자 (2024 학번부터 )\n\n마 . 융합인재학부 학생\n\n① 필수세부모듈 : 2 학년 진급 예정자\n\n② 선택세부모듈 : 2 학년 진급 예정자\n\n바 . 글로벌자유전공학부 학생 중 2 학년 진급 예정자\n\n2. 신청기간 : 2025. 5. 26.( 월 ) 10:00 ～ 5. 30.( 금 ) 16:00\n\n※ 신청기간 이후 추가 신청 및 변경 절대 불가\n\n3. 신청방법 : 종합정보시스템 → 전공 / 교직관리 → 1 전공 신청\n\n4. 배정원칙 : 학부 / 계열 배정 기준에 따름\n\n5. 유의사항\n\n가 . 인문과학계열 광역모집 및 아프리카학부 학생은 반드시 3 지망까지 신청\n\n나 . 영어통번역학부 : 2020 학번 이전 학생 3 지망까지 신청 / 2021 학번 이후 학생 2 지망까지 신청\n\n※ 세부전공 개편에 따라 2021 학번부터는 영미문학 · 번역전공 / TESOL 영어학전공만 신청 가능\n\n다 . 융합인재학부 : 필수모듈 4 지망까지 , 선택모듈 8 지망까지 모두 신청\n\n라 . 글로벌자유전공학부 : 1 지망 신청\n\n※ 신청기간 내 미신청 시 학부에서 임의 배정 함 .( 배정 내역 추후 변경 불가 )\n\n6. 배정확정 : 2025 년 7 월 중 (1 학기 성적 반영 완료 후 )\n\n2025. 5.\n\n글로벌캠퍼스 교무처장', '[글로벌] 이수구분변경 신청 방법 안내\n\n다. 이수구분 신청 전, 전공교류교과목을 수강편람에서 확인하고 문의 사항이 있을 경우 신청전 미리 상담 (수강편람 확인 클릭)\n\n라. 신청 후 3~4일 (평일 기준) 이후\xa0종합정보시스템에서 변경결과를 반드시 확인하고 변경이 안된 경우, 담당자에게 연락하여 반드시 확인', '## [heading1] ##\n# 4) 안내사항\n\n## [table] ##\n| 구분 | 내용 |\n| --- | --- |\n| 글로벌캠퍼스 경상대학 학생 | 서울캠퍼스 경영대학 이중전공 이수 불가(부전공 가능) |\n| 2015년 1학기 이후 서울캠퍼스 경영학전공을 이중(부)전공하는 글로벌캠퍼스 소속 학생 | 서울캠퍼스 경영대학 경영학부에서 개설되는 경영학 강좌를 수강하여야 경영대학 경영학부 이중(부)전공 이수학점으로 인정함.(글로벌캠퍼스 국제경영학과 또는 국제금융학부에서 개설되는 유사 경영학 과목들을 수강하는 경우 이수학점으 로 인정하지 않음) 단, 2015학년도 1학기까지 경영대학 부전공을 이수한 글로 벌캠퍼스 학생들은 종전대로 경상대학에서 개설한 대체과목 을 수강하면 부전공으로 인정함. |\n| 미디어커뮤니케이션학부 (이중전공/부전공) | 글로벌캠퍼스 소속 이중전공 학생은 서울캠퍼스에서는 미디 어커뮤니케이션학부 공통과목과 자신의 세부전공 과목만 수 강가능함(부전공은 소속 캠퍼스에서 이수함/이중전공은 양캠 퍼스에서 이수가능) |\n\n## [heading1] ##\n# 사. 이중(부)전공 교과목 수강\n\n## [list] ##\n- 1) 이중(부)전공 영역 개설 학과 : 이중(부)전공 영역에서 수강\n- 2) 제1전공 영역만 개설 학과 : 제1전공 영역에서 수강(학과에 따라 일부 강좌의 수강을 제\n- 한할 수 있음. 강의시간표 비고란 참조)\n- ※ 제1전공 학생은 소속 학과(부)에서 이중(부)전공 영역에 개설한 과목을 수강할 수 없음.\n\n## [list] ##\n- 아. 기타사항 : 부전공의 경우에도 졸업시험/논문을 부과할 수 있음\n- 자. 문의\n\n## [list] ##\n- - 신청 및 배정 관련 : 학사종합지원센터(Tel : 031-330-4026)\n- - 수업 관련 : 학사종합지원센터(Tel : 031-330-4028)\n\n## [footer] ##\n- 74 -', '2) 자세한 내용은 학사공지 게시글 제목을 “시간차”로 검색 : 게시글 바로가기 Click▶\n\n3. 관련 사이트 안내\n\n구 분\n\n서울캠퍼스\n\n글로벌캠퍼스\n\n★ 신입생 및 편입생 일반교육\n\n동영상\n\n동영상 보기 Click▶\n\n교육자료\n\n교육자료(서울) Click▶\n\n교육자료(글로벌) Click▶\n\n★ 신입생 및 편입생 학번확인\n\n신입생 - 2월 21일(금) 이후부터 확인 가능\n\n편입생 – 2월 22일(토) 이후부터 확인 가능\n\n바로가기 Click▶\n\n강의시간표·강의계획서\n\n핫링크\n\n강의시간표 Click▶\n\n수강편람\n\n핫링크\n\n수강편람(서울) Click▶\n\n수강편람(글로벌) Click▶\n\n전공 교육과정 안내\n\n종합정보\n\n시스템\n\n종합정보시스템 로그인 → 학과(부) 교육과정 안내도 메뉴\n\n※ 각 전공의 전체교과목 및 최근 개설된 강좌 정보 확인 가능\n\n예비수강신청함 바로가기\n\n핫링크\n\n바로가기 Click▶\n\n수강신청 바로가기\n\n핫링크', '4.\xa0유의사항\n\n가. 이중(부)전공이 글로벌캠퍼스일 경우, 본인의 1전공 단과대학 담당자에게 제출\n\n나 . 이중(부)전공이 서울캠퍼스일 경우, 본인의 서울캠퍼스\xa0담당자에게 제출 (담당자 확인 클릭)\n\n다. 이수구분 신청 전, 전공교류교과목을 수강편람에서 확인하고 문의 사항이 있을 경우 신청전 미리 상담 (수강편람 확인 클릭)\n\n라. 신청 후 3~4일 (평일 기준) 이후\xa0종합정보시스템에서 변경결과를 반드시 확인하고 변경이 안된 경우, 담당자에게 연락하여 반드시 확인', '2025학년도 신·편입생 수강신청 일정 및 일반교육 안내\n\n2025학년도 신·편입생 수강신청 일정 및 일반교육 안내\n\n2025학년도 신·편입생 수강신청 일정 및 일반교육 안내\n\n2025학년도 신·편입생 수강신청과 일반교육을 아래와 같이 실시합니다.\n\n- 아\xa0\xa0 래 -\n\n■ 수강신청 및 교육 일정\n\n구 분\n\n일정 및 비고\n\n신입생 및 편입생 수강신청\n\n2025. 2. 24.(월), 10시 ∼16시\n\n※ 수강신청 당일 학교 홈페이지에 바로가기 안내 됨\n\n신입생 및 편입생 일반교육\n\n교육자료 공지로 진행\n\n(※ 아래 안내사항 중 “ 3. 관련 사이트 안내 ” 참조)\n\n개강일\n\n2025. 3. 3.(월), 대체휴일 / 실 제 수 업 은 3 . 4 . ( 화 ) 부터 진 행\n\n■ 안내사항\n\n0. 주요안내\n\n가. 수강신청/변경 및 취소는 기간 내 에 반드시 본인 이 해야 함\n\n나. 수강신청한 과목을 매매 또는 거래 하였을 경우, 학생징계규정에 의해 징계의 사유 가 될 수 있음\n\n다 . 학사운영의 투명성 및 공정성을 제고하기 위해 교수-자녀 간 강의 수강을 지양 하기 바람\n\n라. 수강신청 대기 순번 시스템 도입 (※ 자세한 사항은 붙임 파일 참조)\n\n1) 접속자가 많은 경우 로그인 및 수강신청 모든 요청에 대기 순번을 발급하고 순차적으로 서비스 함.\n\n2) 유의사항 : 대기 순번을 부여받은 후 ‘새로고침(F5)’을 하거나 메뉴를 반복 클릭하면 최후 번호로\n\n재발급되어 대기시간이 늘어남.\n\n마. 종합정보시스템에서 “ 전공 교육과정 안내 ”를 운영 하오니 참고 바람\n\n1. 학번(ID) 확인 및 교내 시스템 (수강신청, 예비수강신청함, 종합정보시스템) 접속 방법\n\n가. 학번(ID) 확인 방법 : 학교 홈페이지 “ 입학안내 ”에서 확인(※학번 확인 후 예비수강신청함 이용)\n\n나. (학번 확인 후)교내 시스템 최초 접속 방법 : ID(학번), 비밀번호(주민번호 앞 6자리)\n\n※ 최초 접속 후 개인정보 보호 및 비밀번호 유출로 인한 사고 예방 을 위해 수강신청 전 본인의\n\n비밀번호 변경 권장', '[공통] 2025-1학기 이중전공 변경 신청 일정 공고 새글\n\n| 0 | 1 |\n|:----------------------------------------------------------------|:----------------------------------------------------------------------------------|\n| 모든 학생 | 폐지된 학과(법학과,사회과학전공 등)및 본인 학번대에 존재하지 않는 학과 이수 불가 |\n| 비사범대 학생 | 사범대학 학과로 이중전공 이수 불가 |\n| 2016학번까지 | LD전공 및LT전공 이수 불가(※2017학번부터 가능) |\n| 서울캠퍼스 프랑스어학부 학생 | 프랑스어학부 내 세부전공을 이중전공으로 이수 불가 |\n| 서울캠퍼스 일본언어문화학부 학생 | 융합일본지역학부 이중전공 이수 불가 |\n| 서울캠퍼스 융합일본지역학부 학생 | 일본언어문화학부 이중전공 이수 불가 |\n| 서울캠퍼스 경제학부 학생(2007~2014학번) | 글로벌캠퍼스 경제학과 이중전공 이수 불가 |\n| 서울캠퍼스 경영대학 학생 | 글로벌캠퍼스 경상대학 학과/전공 이중전공 이수 불가 |\n| 서울캠퍼스Languae & AI융합학부, Social Sceince & AI융합학부학생 | 글로벌캠퍼스 컴퓨터공학전공 이중전공 이수 불가 |\n| 서울캠퍼스Social Sceince＆AI융합학부학생 | 서울캠퍼스Language & AI융합전공 이중전공 이수 불가 |\n| 서울캠퍼스Language & AI융합학부학생 | 서울캠퍼스Social Sceince＆AI융합전공 이중전공 이수 불가 |\n| 글로벌캠퍼스 융합인재학부학생 | 모든 이중전공이수 불가 |\n| 글로벌캠퍼스 영어통번역학부 학생 | 글로벌캠퍼스 영어통번역학부내 세부전공 이중전공 이수 불가 |\n| 글로벌캠퍼스 아프리카학부 학생 | 글로벌캠퍼스 아프리카학부내 세부전공 이중전공 이수 불가 |\n| 글로벌캠퍼스 경상대학 학생 | 서울캠퍼스 경영대학 이중전공 이수 불가 |\n| 글로벌캠퍼스 경제학과 학생 | 서울캠퍼스 경제학전공 이중전공 이수 불가 |']","글로벌스포츠산업학부(글스산)의 세부전공 신청 기간과 방법은 다음과 같습니다:

1. **신청 기간**: 구체적인 신청 기간은 학기마다 다를 수 있으므로, 학부 공지사항을 확인하시거나 학부 사무실에 문의하시는 것이 좋습니다.
2. **신청 방법**: 일반적으로는 온라인 신청 시스템을 통해 신청할 수 있으며, 필요한 서류를 제출해야 할 수 있습니다. 자세한 방법은 학부의 공식 홈페이지나 공지사항을 통해 확인하시기 바랍니다.
3. **결과 발표**: 신청 결과는 보통 신청 마감 후 일정 기간 내에 발표됩니다. 이 역시 학부의 공지사항을 통해 확인하실 수 있습니다.

정확한 정보는 글로벌스포츠산업학부 사무실에 문의하시거나 홈페이지를 참고하시기 바랍니다. 혹시 더 도와드릴까요?","글로벌스포츠산업학부의 세부전공 신청에 대한 정보는 다음과 같습니다.
신청기간: 2025년 5월 26일(월) 10:00부터 5월 30일(금) 16:00까지입니다. 신청기간 이후에는 추가 신청이나 변경이 절대 불가하니 유의하시기 바랍니다.
신청방법: 종합정보시스템에 접속하셔서 전공/교직관리 메뉴에서 1전공 신청을 하시면 됩니다.
배정결과: 배정 확정은 2025년 7월 중에 이루어질 예정입니다. 성적 반영이 완료된 후에 결과를 확인하실 수 있습니다.
추가적인 문의사항이 있으시면 학사종합지원센터에 연락하시기 바랍니다.",0.5454064453973553,1.0,0.625,0.0
