user_input,retrieved_contexts,response,reference,context_precision,context_recall,faithfulness,answer_relevancy
"월요일 7, 8교시에 들을 수 있는 교양 있으면 알려줘.","['[언어학연구방법론] 4학년 대상 / 교수: 이해윤 / 월요일 7,8교시 / 강의실 4210호 / 학점: 2 / 전공필수 과목 아님 / 온라인강의 아님 / P/F 평가 과목 아님 / 원어강의 아님', '[세계사와한국] 전체 학년 대상 / 교수: 이수기 / 수요일 7,8교시 / 강의실 2311호 / 학점: 2 / 전공필수 과목 아님 / 온라인강의 아님 / P/F 평가 과목 아님 / 원어강의 아님\n\n[신화와종교] 전체 학년 대상 / 교수: 강미라 / 월요일 7,8교시 / 강의실 2303-3호 / 학점: 2 / 전공필수 과목 아님 / 온라인강의 아님 / P/F 평가 과목 아님 / 원어강의 아님\n\n[역사란무엇인가] 전체 학년 대상 / 교수: 서상현 / 월요일 3,4교시 / 강의실 2502호 / 학점: 2 / 전공필수 과목 아님 / 온라인강의 아님 / P/F 평가 과목 아님 / 원어강의 아님\n\n[요가경전강독] 전체 학년 대상 / 교수: 최원호 / 금요일 7,8교시 / 강의실 2313호 / 학점: 2 / 전공필수 과목 아님 / 온라인강의 아님 / P/F 평가 과목 아님 / 원어강의 아님', '[역사란무엇인가] 전체 학년 대상 / 교수: 서상현 / 화요일 7,8교시 / 강의실 2502호 / 학점: 2 / 전공필수 과목 아님 / 온라인강의 아님 / P/F 평가 과목 아님 / 원어강의 아님\n\n[윤리적사고와문제해결] 전체 학년 대상 / 교수: 김신 / 목요일 3,4교시 / 강의실 5208호 / 학점: 2 / 전공필수 과목 아님 / 온라인강의 아님 / P/F 평가 과목 아님 / 원어강의 아님\n\n[종교철학입문] 전체 학년 대상 / 교수: 조명동 / 월요일 7,8교시 / 강의실 2503호 / 학점: 2 / 전공필수 과목 아님 / 온라인강의 아님 / P/F 평가 과목 아님 / 원어강의 아님\n\n[철학으로의초대] 전체 학년 대상 / 교수: 김영걸 / 화요일 5,6교시 / 강의실 2504호 / 학점: 2 / 전공필수 과목 아님 / 온라인강의 아님 / P/F 평가 과목 아님 / 원어강의 아님', '[시사토론중국어] 3학년 대상 / 교수: 남종호 / 화요일 7,8교시 / 강의실 1309호 / 학점: 2 / 전공필수 과목 아님 / 온라인강의 아님 / P/F 평가 과목 아님 / 원어강의 아님\n\n[제자백가다시읽기] 3학년 대상 / 교수: 이은주 / 수요일 7,8교시 / 강의실 2315호 / 학점: 2 / 전공필수 과목 아님 / 온라인강의 아님 / P/F 평가 과목 아님 / 원어강의 아님\n\n[제자백가다시읽기] 3학년 대상 / 교수: 이은주 / 월요일 7,8교시 / 강의실 2315호 / 학점: 2 / 전공필수 과목 아님 / 온라인강의 아님 / P/F 평가 과목 아님 / 원어강의 아님', '[미네르바인성교육] 전체 학년 대상 / 교수: 박남용 / 목요일 5,6교시 / 강의실 2408호 / 학점: 2 / 전공필수 과목 아님 / 온라인강의 아님 / P/F 평가 과목 아님 / 원어강의 아님\n\n[분노와용서] 전체 학년 대상 / 교수: 조준래 / 수요일 7,8교시 / 강의실 2309호 / 학점: 2 / 전공필수 과목 아님 / 온라인강의 아님 / P/F 평가 과목 아님 / 원어강의 아님\n\n[사람다운삶을위한관계] 전체 학년 대상 / 교수: 박성준 / 금요일 7,8교시 / 강의실 2412호 / 학점: 2 / 전공필수 과목 아님 / 온라인강의 아님 / P/F 평가 과목 아님 / 원어강의 아님']","죄송하지만 월요일 7, 8교시에 들을 수 있는 교양 과목은 [신화와종교] 밖에 없습니다.","월요일 7,8교시에 들을 수 있는 교양 과목에는 '인간과 사회', '대중문화 예술의 이해', '비즈니스협상' 등이 있습니다.",0.0,0.0,0.0,0.796661735435321
글스산 졸업하면 뭐해?,"['3학년  통번역을 중점적으로 다루며 졸업시험을 위한 FLEX 준비도 시\n작하게 됩니다. \n4학년  인터뷰하기, 이력서 쓰기, 계약 서류 작성하기와 같은 실용 그\n리스어·불가리아어를 가르칩니다. 그리스·불가리아에 대한 다면\n적, 다각도적인 심화 교육을 위해 그리스·불가리아 데이터를 활\n용한 빅데이터 분석, 메타버스 활용 수업, 무역 실습 등을 동시\n에 운영합니다. \n졸업 후 진로 \n-  정부 및 공공기관: 대사관, 정부 산하 공기업 및 준정부기관\n-  기업: 국내, 아테네 및 소피아 소재 대기업, 방송사, 항공사, 언론사, \n광고·PR사, IT 등\n-  학계: 대학교수, 국내외 연구기관 연구원, 국내외 석·박사 진학\n-  창업: 한국-그리스, 한국-불가리아 수출입 및 이커머스 기업 창업', '을 공부해 두는 것이 좋습니다. 졸업 후 취업 또는 진학에 관계없이 영어 \n구사 능력은 항시 요구되므로 대학 입학 이후부터 읽기, 듣기, 말하기, \n쓰기 모든 분야에서 영어 능력을 지속적으로 계발하는 것이 매우 중요\n합니다. 고학년 기간에는 이론적인 지식이 아니라 연구실 인턴을 통해 \n관심분야의 연구를 경험해보며 자신의 진로를 준비하는 것이 좋습니다.\n졸업 후 진로 \n-  기업체: 석유화학, 반도체/전자, 에너지, 신소재, 재료, 바이오, 의료 및 \n제약, 화장품 및 식품 분야\n-  정부 및 공공기관: 국가/지방 공무원 및 정부 산하 공기업\n-  학자 및 연구직: 대학 교수, 국공립연구소 및 정부 출연 연구소, 기\n업 연구소\n-  기타: 교사(교직이수), 창업\nQ&A', '네 분야 중 학생이 선택한 분야에 초점을 맞추어 강의를 듣게 됩니다.\n3학년  2학년에 수강한 분야들 중 하나 혹은 두 분야에 초점을 맞추어 수\n업을 들으면서 졸업논문 프로젝트를 위한 강의도 수강하게 됩니다.\n4학년  실습이나 연습 과목 위주로 수강하면서 졸업논문 계획서 제출, \n졸업논문 작성 및 완성본 제출을 하게 됩니다.\n졸업 후 진로 \n-  기업: 마케팅, 콘텐츠 비즈니스, 콘텐츠 기획, 해외전략기획 \n-  공기업: 관광, 민간외교, 문화교류, 전시, 기록관리 \n-  대학원: 국제대학원, 일반대학원의 한국어교육 및 한국학 관련 학과 \nQ&A \nQ1. 한국학과 학생들은 졸업 후 주로 어떤 분야로 진출하나요? \nA1.  한국학과 졸업생들은 학과에서 이수한 전공 교육에 기초하여 국내·외', '전공 공부에 도움이 됩니다. \n2학년  자연스럽고 유창한 그리스어·불가리아어 구사 능력을 기르기 위\n해 회화, 강독 심화 과목을 수강하게 됩니다. 언어와 더불어 기본\n적인 문화에서 더 나아가 역사, 지중해 유산, 지리연구 등 지역학 \n과목을 함께 수강합니다.\n3학년  통번역을 중점적으로 다루며 졸업시험을 위한 FLEX 준비도 시\n작하게 됩니다. \n4학년  인터뷰하기, 이력서 쓰기, 계약 서류 작성하기와 같은 실용 그\n리스어·불가리아어를 가르칩니다. 그리스·불가리아에 대한 다면\n적, 다각도적인 심화 교육을 위해 그리스·불가리아 데이터를 활\n용한 빅데이터 분석, 메타버스 활용 수업, 무역 실습 등을 동시\n에 운영합니다. \n졸업 후 진로 \n-  정부 및 공공기관: 대사관, 정부 산하 공기업 및 준정부기관\n-  기업: 국내, 아테네 및 소피아 소재 대기업, 방송사, 항공사, 언론사, \n광고·PR사, IT 등\n-  학계: 대학교수, 국내외 연구기관 연구원, 국내외 석·박사 진학', '본인의 관심과 희망에 따라 그리스학 또는 불가리아학을 직접 선택\n합니다. 그리스학 전공생과 불가리아학 전공생 모두 원하는 수업을 \n수강할 수 있도록 언제나 강의실의 문은 열려있습니다.\nQ3.  졸업 후 어떤 분야로 진출할 수 있나요?\nA3.  졸업 후에는 그리스나 불가리아에 소재한 국내 대기업의 현지법\n인, 무역 통상 관련 기관이나 기업으로 취업이 용이합니다. 또한 양\n국 주재 대사관 또는 국가공무원, KOTRA, 상공회의소 등으로 진로\n를 정할 수 있습니다. 각 기업에서는 한국에 유일하게 존재하는 그\n리스·불가리아학과를 졸업한 것에 좋은 인상을 가지고, 도전정신을 \n높이 삽니다. 교육이나 연구 분야에서는 국내외 대학교 교수, 유럽 \n지역 문화, 외교 안보 분야 및 에너지 분야에 연구원으로 진출할 수 \n있습니다. 이외에도 국내 유수의 금융기관, IT기업, 항공해운기업, \n언론 방송 분야에서 활동할 수 있습니다. \nQ4.  그리스·불가리아학과에 대한 자세한 정보를 얻을 수 있나요?']","졸업 후에는 정부 및 공공기관, 기업, 학계, 창업 등 다양한 분야로 진출할 수 있어요. 한국외대 그리스·불가리아학과 졸업생은 대사관, 대기업, 방송사, 항공사, 언론사, 광고·PR사, IT 기업 등에서 활동할 수 있습니다. 또한 국내외 연구기관 연구원이나 대학교수로 진로를 선택할 수도 있어요. 자세한 정보는 학과 전공가이드북을 참고해주세요.","글로벌스포츠산업학부를 졸업하면 주로 다음과 같은 분야에서 활동하게 됩니다:
1. 스포츠매니지먼트 및 이벤트 기획
2. 스포츠 마케팅 및 홍보
3. 스포츠 데이터 분석가
4. 스포츠 미디어
이 외에도 졸업 후에는 대학원 진학이나 관련 분야의 연구를 진행할 수 있는 기회도 있습니다.",0.49999999995,0.0,0.75,0.0
졸업하기 전에 무슨 영어성적 제출해야 된다고 했던거 같은데 그건 뭐야?,"['| 제출마감일 | 재학기간 동안\xa01회,\xa0외국어 인증 신청서를 제출하고자 하는 학기 말까지 ※\xa0졸업예정자는 졸업하고자 하는 최종 학기 말까지 반드시 제출해야함. | 재학기간 동안\xa01회,\xa0외국어 인증 신청서를 제출하고자 하는 학기 말까지 ※\xa0졸업예정자는 졸업하고자 하는 최종 학기 말까지 반드시 제출해야함. | 재학기간 동안\xa01회,\xa0외국어 인증 신청서를 제출하고자 하는 학기 말까지 ※\xa0졸업예정자는 졸업하고자 하는 최종 학기 말까지 반드시 제출해야함. | 재학기간 동안\xa01회,\xa0외국어 인증 신청서를 제출하고자 하는 학기 말까지 ※\xa0졸업예정자는 졸업하고자 하는 최종 학기 말까지 반드시 제출해야함. |\n| 제출처 | 학생의\xa01전공 소속 단과대학 담당에게\xa0E-mail\xa0제출 | 학생의\xa01전공 소속 단과대학 담당에게\xa0E-mail\xa0제출 | 학생의\xa01전공 소속 단과대학 담당에게\xa0E-mail\xa0제출 | 학생의\xa01전공 소속 단과대학 담당에게\xa0E-mail\xa0제출 |', '| 제출마감일 | 재학기간 동안\xa01회,\xa0외국어 인증 신청서를 제출하고자 하는 학기 말까지 ※\xa0졸업예정자는 졸업하고자 하는 최종 학기 말까지 반드시 제출해야함. | 재학기간 동안\xa01회,\xa0외국어 인증 신청서를 제출하고자 하는 학기 말까지 ※\xa0졸업예정자는 졸업하고자 하는 최종 학기 말까지 반드시 제출해야함. | 재학기간 동안\xa01회,\xa0외국어 인증 신청서를 제출하고자 하는 학기 말까지 ※\xa0졸업예정자는 졸업하고자 하는 최종 학기 말까지 반드시 제출해야함. | 재학기간 동안\xa01회,\xa0외국어 인증 신청서를 제출하고자 하는 학기 말까지 ※\xa0졸업예정자는 졸업하고자 하는 최종 학기 말까지 반드시 제출해야함. |', '을 공부해 두는 것이 좋습니다. 졸업 후 취업 또는 진학에 관계없이 영어 \n구사 능력은 항시 요구되므로 대학 입학 이후부터 읽기, 듣기, 말하기, \n쓰기 모든 분야에서 영어 능력을 지속적으로 계발하는 것이 매우 중요\n합니다. 고학년 기간에는 이론적인 지식이 아니라 연구실 인턴을 통해 \n관심분야의 연구를 경험해보며 자신의 진로를 준비하는 것이 좋습니다.\n졸업 후 진로 \n-  기업체: 석유화학, 반도체/전자, 에너지, 신소재, 재료, 바이오, 의료 및 \n제약, 화장품 및 식품 분야\n-  정부 및 공공기관: 국가/지방 공무원 및 정부 산하 공기업\n-  학자 및 연구직: 대학 교수, 국공립연구소 및 정부 출연 연구소, 기\n업 연구소\n-  기타: 교사(교직이수), 창업\nQ&A', '을 공부해 두는 것이 좋습니다. 졸업 후 취업 또는 진학에 관계없이 영어 \n구사 능력은 항시 요구되므로 대학 입학 이후부터 읽기, 듣기, 말하기, \n쓰기 모든 분야에서 영어 능력을 지속적으로 계발하는 것이 매우 중요\n합니다. 고학년 기간에는 이론적인 지식이 아니라 연구실 인턴을 통해 \n관심분야의 연구를 경험해보며 자신의 진로를 준비하는 것이 좋습니다.\n졸업 후 진로 \n-  기업체: 석유화학, 반도체/전자, 에너지, 신소재, 재료, 바이오, 의료 및 \n제약, 화장품 및 식품 분야\n-  정부 및 공공기관: 국가/지방 공무원 및 정부 산하 공기업\n-  학자 및 연구직: 대학 교수, 국공립연구소 및 정부 출연 연구소, 기\n업 연구소\n-  기타: 교사(교직이수), 창업\nQ&A \nQ1.  한국외대 화학과에 진학하려고 하는데 영어를 잘해야 하나요?\nA1.   한국외대 화학과에서는 원서 전공 교과목 수업과 영어 졸업논문 발\n표 등을 통해 화학 전문 영어를 습득하게 합니다. 또한, 외국어 대', '[공통] 외국어인증 신청서 제출 안내\n\n[공통] 외국어인증 신청서 제출 안내\n\n외국어인증 신청서 제출 안내\n\n외국어인증 신청서 제출에 대해 아래와 같이 안내합니다 .\n\n1. 외국어인증이란\n\n서울캠퍼스 수강편람 바로가기\n\n(수강편람목록- 수강편람 중 해당 페이지 참조)\n\n글로벌캠퍼스 수강편람 바로가기\n\n(수강편람목록- 수강편람 중 해당 페이지 참조 )\n\n2. 외국어인증 신청서 제출 안내\n\n제출서류\n\n1. 외국어인증 신청서(첨부파일 참조)\n\n2. 제출시점 기준 유효기간(2년) 이내의 인증 시험 성적 ( 또는 대체 과정 수료증 )\n\n※성적표 미리보기 캡쳐본\xa0성적 처리 불가\n\n제출마감일\n\n재학기간 동안 1 회 , 외국어 인증 신청서를 제출하고자 하는 학기 말 까지\n\n※ 졸업예정자는 졸업하고자 하는 최종 학기 말까지 반드시 제출해야함 .\n\n제출처\n\n학생의 1 전공 소속 단과대학 담당에게 E-mail 제출\n\n서울캠퍼스\n\n영어대학 / 아시어언어문화대학 / AI융합대학']","졸업 전에 제출해야 하는 영어 성적은 외국어 인증 신청서와 해당 시험의 성적이며, 졸업 예정자는 졸업하고자 하는 최종 학기 말까지 반드시 제출해야 합니다.","졸업하기 전에 제출해야 하는 영어 성적은 외국어 인증을 위한 것으로, 다음과 같은 기준을 충족해야 합니다:

1.**인증 시험 성적**: 제출 시점 기준 유효기간(2년) 이내의 인증 시험 성적이 필요합니다. 인정되는 시험은 다음과 같습니다:
- TOEIC
   - TOEFL
   - IELTS
   - FLEX 외국어 능력 시험 등

2.**대체 과정 수료증**: 인증 시험 성적 대신 외국어 연수 평가원 또는 외국어 교육센터에서 제공하는 대체 과정을 이수한 경우,해당 수료증을 제출할 수 있습니다.

3. **제출 마감일**: 졸업하고자 하는 최종 학기 말까지 반드시 제출해야 하며,재학 기간 동안 1회 외국어 인증 신청서를 제출할 수 있습니다.

정확한 기준과 제출 방법은 학사종합지원센터에 문의하시거나, 해당 과목의 담당 교수님께 확인하시기 바랍니다.",0.8666666666377778,0.5,0.5,0.8531679687698596
후기 이중에 대해 설명해줘.,"['을까요?\nA3.  전쟁 이후 우크라이나어의 위상은 높아지고 사용 빈도는 증가할 것\n입니다. 그리고 우크라이나의 복구 사업에 우리 기업들이 많이 참\n여할 것으로 예상되며, 우리 학생들이 전공을 살려 통역, 무역, 비\n즈니스, 공공서비스, 연구 등 여러 분야에서 활발히 일할 수 있을 \n것입니다.', '| 구분 | 기간 | 비고 |', '| 구분 | 기간 | 비고 |', '| 구분 | 기간 | 비고 |', '| 구분 | 기간 | 비고 |']",후기 이중에 대해 설명하겠습니다. 해당 문서에는 후기 이중에 대한 내용이 없습니다.더 자세한 정보가 필요하시면 다른 문서나 관련 부서에 문의해보시는 것을 추천드립니다.,"후기 이중전공은 부전공 이수자가 정규 8학기 내에 제1전공 졸업학점(부전공 21학점 포함)을 모두 취득한 후, 1~2학기 추가 수학하여 해당 부전공의 이중전공화에 필요한 나머지 학점을 취득함으로써, 제1전공과 이중전공 학위를 동시에 취득하는 제도입니다.
신청은 매년 4월에 한 번만 가능하며, 신청 자격은 현재 7~8학기 이수 중인 학생으로, 부전공을 이수 중인 경우에 해당합니다.
추가학기를 등록해야 하며, 등록금은 후기 이중전공 학과의 등록금으로 납부해야 합니다. 더 궁금하신 점이 있으시면 말씀해 주시기 바랍니다.",0.0,0.75,0.3333333333333333,0.0
김정환 교수님 연구실 어디야?,"['김정환 교수님은 루마니아학과 학과 소속입니다. 교수 직위를 맡고 있습니다. 이메일은 bacovia@empas.com입니다. 연구실은 어문관 435호입니다.', '김정환 교수님은 루마니아학과 학과 소속입니다. 교수 직위를 맡고 있습니다. 이메일은 bacovia@empas.com입니다. 연구실은 어문관 435호입니다.', '김정환 교수님은 루마니아학과 학과 소속입니다. 교수 직위를 맡고 있습니다. 이메일은 bacovia@empas.com입니다. 연구실은 어문관 435호입니다.', '김정환 교수님은 브릭스 전공 전공 소속입니다.', '김정환 교수님은 브릭스 전공 전공 소속입니다.']",김정환 교수님의 연구실은 어문관 435호에 위치해 있습니다.,김정환 교수님의 연구실은 어문관 435호에 위치해 있습니다. 추가로 궁금하신 점이 있으시면 언제든지 말씀해 주세요.,0.9999999999666667,0.5,1.0,0.9063768738766868
컴퓨팅사고를 AI융합전공 이중과목으로 변경해야되는데 이수구분변경 신청 어떻게 해?,"['[공통] 2025-1학기 이중전공 변경 신청 일정 공고(비즈니스 & AI 융합전공 관련 내\n\n테크노미디어디자인세부모듈\n\n패션관광문화산업세부모듈\n\n디지털콘텐츠학부제 1 전공자 이수불가\n\n투어리즘 & 웰니스학부제 1 전공자 이수불가\n\n게임한류문화산업세부모듈\n\n융합비즈니스세부모듈\n\n상경 ( 경상 ) 관련제 1 전공자 이수불가\n\nICT&AI 세부모듈\n\n공과대학제 1 전공자 이수불가\n\n글로벌캠퍼스 AI 융합대학제 1 전공자 이수불가\n\n바 . AI 융합전공의 경우 , 기존 AI 융합전공 및 세부트랙에 진입한 인원만 변경 신청이 가능하며 , 신규 진입은 불가능함 . 기존 신청 학생의 경우 붙임의 ‘( 이중 )AI 융합전공 세부전공 신청서 ’ 를 작성하여 캠퍼스별 담당자에게 메일 송부\n\n사 . 기후변화융합학부의 경우 22 학번부터 신청 가능\n\n4. 배정 확정 공지 : 2025 년 6 월 말 ~ 2025 년 7 월 초 [ 학사공지 ] 게시판 공지예정\n\n※ 신청자를 대상으로 별도 전형을 진행하는 학과 ( 부 ) 일정에 따라 공지 일정이 유동적임\n\n※ 후기이중전공 선발자가 이중전공 변경 배정된 경우 둘 중 하나는 반드시 취소해야 함\n\n5. 배정기준\n\n가 . 현 시점 기준 학과 ( 부 ) 별 / 학번대별 이중전공 여석 내에서 배정\n\n( ※ 첨부파일 참조 )\n\n나 . 서울캠퍼스 이중전공의 경우 학과 ( 부 ) 별 배정기준에 따름\n\n( ※ 첨부파일 참조 )\n\n다 . 34 학점 이상 이수자 우선 배정\n\n라 . 배정 시 성적 기준 : 신청 마감일인 5 월 16 일 ( 금 ) 16 시 기준 성적\n\n( ※ 이후 변동된 성적은 반영되지 않으며 , 성적인정 처리가 늦어지는 것도 반영하지 않으므로 반드시 본인이 확인할 것 )\n\n마 . 동점자 배정기준\n\n1) 평점평균 동점자 : 이수학점이 높은 학생 우선 배정\n\n2) 평점평균 , 이수학점 동점자 : 동점자 전원 배정\n\n6. 유의사항\n\n가 . 양 캠퍼스에 동일하게 개설되는 융합전공은 본인 소속 캠퍼스에서 이수해야 함\n\n나 . 학과 ( 부 ) 별 전형이 있는 경우 반드시 학과 사무실에 관련 일정 및 자격 확인', '[공통] 2025-1학기 이중전공 변경 신청 일정 공고(비즈니스 & AI 융합전공 관련 내\n\n마 . 동점자 배정기준\n\n1) 평점평균 동점자 : 이수학점이 높은 학생 우선 배정\n\n2) 평점평균 , 이수학점 동점자 : 동점자 전원 배정\n\n6. 유의사항\n\n가 . 양 캠퍼스에 동일하게 개설되는 융합전공은 본인 소속 캠퍼스에서 이수해야 함\n\n나 . 학과 ( 부 ) 별 전형이 있는 경우 반드시 학과 사무실에 관련 일정 및 자격 확인\n\n※ 관련 일정 및 자격 미확인으로 인한 불이익은 본인 과실임을 유의할 것\n\n학과 사무실\n\n연락처\n\n이메일\n\n노어과\n\n02-2173-2284\n\nhufsrussia@hufs.ac.kr\n\n베트남어과\n\n02-2173-2300\n\nvietnam.hufs@gmail.com\n\n정치외교학과\n\n02-2173-2312\n\nhufspsd@gmail.com\n\n경영학부\n\n02-2173-2334\n\ncob@hufs.ac.kr\n\nLanguage & Diplomacy 학부\n\n02-2173-2478\n\nlangdiplo@hufs.ac.kr\n\nLanguage & Trade 학부\n\n02-2173-3350\n\nhufsdltta@hufs.ac.kr\n\nKFL 학부\n\n02-2173-2477\n\nhufs_kfl@naver.com\n\nSocial Science & AI 융합학부\n\n02-2173-2769\n\nssai@hufs.ac.kr\n\nLanguage & AI 융합학부\n\n02-2173-2278\n\nhufs_langai@hufs.ac.kr\n\n다 . 타캠퍼스에서 이수한 이중전공 과목의 재수강 은 타캠퍼스 이중전공 이수 기간중에 재수강을 완료해야 함\n\n※ 타캠퍼스 이중전공에서 본인 소속 캠퍼스 이중전공으로 변경한 후에는 재수강 불가\n\n라 . 부전공 희망자 및 전공심화 ( 단일전공 ) 희망자 의 경우 추후 종합정보시스템으로 별도 신청 예정\n\n1) 부전공 희망자 : 일반 부전공 또는 전공심화 ＋ 부전공 신청\n\n2) 단일전공 희망자 : 기존 이중 / 부전공 취소\n\n※ 자세한 일정은 2025 년 7 월 중순 학사공지 예정인 “ 부전공 신청 및 이중전공 / 부전공 취소 일정 ” 확인', '[공통] 2025-1학기 이중전공 변경 신청 일정 공고(비즈니스 & AI 융합전공 관련 내\n\n서울캠퍼스 Language & AI 융합학부 이수 불가\n\n글로벌캠퍼스 반도체전자공학부 ( 반도체공학전공 ) 학생\n\n글로벌캠퍼스 반도체전자공학부 ( 전자공학전공 )\n\n글로벌캠퍼스 반도체전자공학부 ( 전자공학전공 ) 학생\n\n글로벌캠퍼스 반도체전자공학부 ( 반도체공학전공 )\n\n글로벌캠퍼스 컴퓨터공학전공 학생\n\n서울캠퍼스 Language & AI 융합전공 이수 불가\n\n글로벌캠퍼스 디지털콘텐츠학부\n\n글로벌캠퍼스 문화콘텐츠학전공 ( 융합전공 ) 이중전공 이수 불가\n\n라 . “ 외국어로서의한국어교육전공 ” 및 “ 외국어로서의한국어통번역전공 ” 은 입학전형 기준 순수 외국인전형 입학생만 신청 가능\n\n( 단 , “ 외국어로서의한국어통번역전공 ” 은 2018 학번부터만 신청 가능 )\n\n마 . 융합인재학부 내 이중전공 세부모듈 선택 제한\n\n1) 융합인재대학 융합인재학부는 이중전공만 지원 이수 가능 ( 부전공 이수 불가 )\n\n2) 아래의 12 개 세부모듈 중 2 개의 세부모듈을 자율적으로 선택하여 이수 함\n\n모듈명\n\n이수대상 제한\n\n영어통번역세부모듈\n\n영어관련제 1 전공자 이수불가\n\n아랍어통번역세부모듈\n\n아랍어관련제 1 전공자 이수불가\n\n중국어통번역세부모듈\n\n중국어관련제 1 전공자 이수불가\n\n미국 . 영연방전략세부모듈\n\n영어관련제 1 전공자 이수불가\n\n이탈리아 .EU 전략세부모듈\n\n이탈리아어관련제 1 전공자 이수불가\n\n중동 . 이슬람전략세부모듈\n\n아랍어관련제 1 전공자 이수불가\n\n중화권전략세부모듈\n\n중국어관련제 1 전공자 이수불가\n\n테크노미디어디자인세부모듈\n\n패션관광문화산업세부모듈\n\n디지털콘텐츠학부제 1 전공자 이수불가\n\n투어리즘 & 웰니스학부제 1 전공자 이수불가\n\n게임한류문화산업세부모듈\n\n융합비즈니스세부모듈\n\n상경 ( 경상 ) 관련제 1 전공자 이수불가\n\nICT&AI 세부모듈\n\n공과대학제 1 전공자 이수불가\n\n글로벌캠퍼스 AI 융합대학제 1 전공자 이수불가', '[공통] 2025-1학기 이중전공 변경 신청 일정 공고 새글\n\n테크노미디어디자인세부모듈\n\n패션관광문화산업세부모듈\n\n디지털콘텐츠학부제 1 전공자 이수불가\n\n투어리즘 & 웰니스학부제 1 전공자 이수불가\n\n게임한류문화산업세부모듈\n\n융합비즈니스세부모듈\n\n상경 ( 경상 ) 관련제 1 전공자 이수불가\n\nICT&AI 세부모듈\n\n공과대학제 1 전공자 이수불가\n\n글로벌캠퍼스 AI 융합대학제 1 전공자 이수불가\n\n바 . AI 융합전공의 경우 , 기존 AI 융합전공 및 세부트랙에 진입한 인원만 변경 신청이 가능하며 , 신규 진입은 불가능함 . 기존 신청 학생의 경우 붙임의 ‘( 이중 )AI 융합전공 세부전공 신청서 ’ 를 작성하여 캠퍼스별 담당자에게 메일 송부\n\n사 . 기후변화융합학부의 경우 22 학번부터 신청 가능\n\n4. 배정 확정 공지 : 2025 년 6 월 말 ~ 2025 년 7 월 초 [ 학사공지 ] 게시판 공지예정\n\n※ 신청자를 대상으로 별도 전형을 진행하는 학과 ( 부 ) 일정에 따라 공지 일정이 유동적임\n\n※ 후기이중전공 선발자가 이중전공 변경 배정된 경우 둘 중 하나는 반드시 취소해야 함\n\n5. 배정기준\n\n가 . 현 시점 기준 학과 ( 부 ) 별 / 학번대별 이중전공 여석 내에서 배정\n\n( ※ 첨부파일 참조 )\n\n나 . 서울캠퍼스 이중전공의 경우 학과 ( 부 ) 별 배정기준에 따름\n\n( ※ 첨부파일 참조 )\n\n다 . 34 학점 이상 이수자 우선 배정\n\n라 . 배정 시 성적 기준 : 신청 마감일인 5 월 16 일 ( 금 ) 16 시 기준 성적\n\n( ※ 이후 변동된 성적은 반영되지 않으며 , 성적인정 처리가 늦어지는 것도 반영하지 않으므로 반드시 본인이 확인할 것 )\n\n마 . 동점자 배정기준\n\n1) 평점평균 동점자 : 이수학점이 높은 학생 우선 배정\n\n2) 평점평균 , 이수학점 동점자 : 동점자 전원 배정\n\n6. 유의사항\n\n가 . 양 캠퍼스에 동일하게 개설되는 융합전공은 본인 소속 캠퍼스에서 이수해야 함\n\n나 . 학과 ( 부 ) 별 전형이 있는 경우 반드시 학과 사무실에 관련 일정 및 자격 확인', ""[서울] 이수구분 변경 신청 방법 안내\n\n[서울] 이수구분 변경 신청 방법 안내\n\n이수구분 변경 신청서\n\n○ 졸업학기 졸업사정일 전까지\n\n○ 교과목 이수영역 변경 신청서는 E-Mail로 제출(직접 방문제출도 가능)시 접수하여 처리하고 있습니다. 교과목 이수영역의 변경이 필요한 경우, 첨부한 '이수구분 변경 신청서'를\xa0작성하여 이수구분 변경이 필요한 전공 소속 단과대학 담당 선생님에게 E-M ail(또는 직접 방문제출) 로 제출 하여 주시기 바랍니다.\n\n* 융합전공의 이수구분 변경이 필요한 경우는 융합전공 담당 선생님에게 E-Mail(또는 직접 방문제출)로 제출하여 주시기 바랍니다.\n\n*** 유의사항\n\n단, 중국학대학 , 미 디어커뮤니케이션학부, 국제통상학과 ( 상경대학 ), EU전공, 동북아외교통상전공 , AI융합전공(Language&AI트랙/Business&AI트랙/Software&AI트랙) , Business & AI전공, 융복합소프트웨어전공, LD/LT 등 의 세부전공교류 ( 이수구분 ) 신청의 경우 또는 먼저 학과의 확인이 필요한 경우 , 각 전공 ( 학과 ) 사무실의 확인\xa0등 별도의 절차(양식)를 통해 처리되오니\xa0해당 전공 ( 학부 ) 사무실로 우선 문의 하여 주시기 바랍니다 .\n\n[제출시 참고]\n\n● 1전공으로 이수구분 변경이 필요할 경우 →\xa01전공 단과대학 담당 선생님에게 제출\n\n● 이중전공으로 이수구분 변경이 필요한 경우 → 이중전공 단과대학 담당 선생님에게 제출\n\n● 부 전 공으로 이수구분 변경이 필요한 경우 → 부전공 단과대학 담당 선생님에게 제출\n\n● 자 선 을 교양으로 이수구분 변경이 필요한 경우 → 1전공 단과대학 담당 선생님에게 제출\n\n● 교 양 을 1전공 또는 이중(부)전공으로 이수구분 변경이 필요한 경우\n\n→ 1전공으로 변경시 : 1전공 단과대학 담당 선생님에게 제출\n\n→ 이중(부)전공으로 변경시 : 이중(부)전공 단과대학 담당 선생님에게 제출\n\n● 융합전공의 이수구분 변경이 필요할 경우 → 융합전공 담당 선생님에게 제출""]","이중전공 변경 신청은 기존 AI 융합전공 및 세부트랙에 진입한 인원만 변경 신청이 가능하며, 신규 진입은 불가능합니다. 변경을 원하는 경우, '(이중) AI 융합전공 세부전공 신청서'를 작성하여 캠퍼스별 담당자에게 메일 송부하셔야 합니다.신청 기간은 2025년 6월 말부터 2025년 7월 초까지이며, 배정 확정 공지는 학사공지 게시판에서 확인하실 수 있습니다. 유의사항으로는 양 캠퍼스에 동일하게 개설되는 융합전공은 본인 소속 캠퍼스에서 이수해야 하며, 학과(부) 별 전형이 있는 경우 학과 사무실에 관련 일정 및 자격을 확인하셔야 합니다.","컴퓨팅사고를 AI융합전공 이중과목으로 변경하시려면, 이수구분 변경 신청서를 작성하신 후,해당 전공 소속 단과대학의 담당 선생님에게 이메일로 제출하시거나 직접 방문하여 제출하셔야 합니다.
신청은 졸업학기 졸업사정일 전까지 가능하며, 제출 후 3~4일 이내에 종합정보시스템에서 변경 결과를 확인하실 수 있습니다.
만약 변경이 되지 않았거나 문제가 발생한 경우, 즉시 담당 선생님에게 연락하여 확인하셔야 합니다.자세한 사항은 학사종합지원센터의 공지사항을 참고하시기 바랍니다. 도움이 필요하시면 언제든지 문의해 주세요.",0.99999999998,0.5,0.875,0.8308129693608471
감기로 병원다녀왔는데 진료확인서로 유고결석 가능해?,"['## [paragraph] ##\n나. 처리절차\n\n## [paragraph] ##\n1) 유고결석·결시 공통 안내사항\n\n## [paragraph] ##\n* 질병 및 상해의 경우 의원에서 발급받은 서류는 해당되지 않음\n(병원급 의료 기관 확인 : 건강보험심사평가원(https://www.hira.or.kr)\n\n## [paragraph] ##\n⇒ 검색창에서 병원이름 기입 후 검색 ⇒ 검색결과에서 해당병원 클릭\n⇒ 병원 기본정보 중 병원구분에서 병원등급 확인\n\n## [paragraph] ##\n** 질병관리청의 법정감염병 확인(https://dportal.kdca.go.kr)\n(질병관리청 감염병 포털 -> 감염병정보 -> 법정감염병에서 병명 확인)\n\n## [paragraph] ##\n2) 유고결석(수업 결석) : 사유발생 시 담당교수에게 알리고, 유고사유가 끝난 날부터\n7일 이내 증빙서류를 제출해야 함.\n(해당학기 졸업가능한 조기취업자는 입사확정 후 즉시 제출)', '| 질병 및 상해 로 인한 입원 또는 감염병 으로 인한 격 리(치료) | 법정감염병 (**질병관리청의 법정감염병에 한함) | 격리(치료) 기간 또는 감염우려 기간 | 해당 증빙서류 | 담당교수에게 증빙서류 제출 |  |\n| 졸업시험 | 졸업시험 | 졸업시험 당일 | 학과장 확인서 | 담당교수에게 증빙서류 제출 |  |\n| 수업일수 4분의 3선 후 징병에 의한 군입대 | 수업일수 4분의 3선 후 징병에 의한 군입대 | - | 입영통지서 | 담당교수에게 증빙서류 제출 |  |\n| 출산 | 출산 | 본인:20일 배우자:10일 | 본인 : 출생(출산예정)증 명서 등, 배우자 : 출생 (출산예정)증명서 및 가족관계증명서 등 | 담당교수에게 증빙서류 제출 |  |', '| 질병 및 상해 로 인한 입원 또는 감염병 으로 인한 격 리(치료) | 법정감염병 (**질병관리청의 법정감염병에 한함) | 격리(치료) 기간 또는 감염우려 기간 | 해당 증빙서류 | 담당교수에게 증빙서류 제출 |  |\n| 졸업시험 | 졸업시험 | 졸업시험 당일 | 학과장 확인서 | 담당교수에게 증빙서류 제출 |  |\n| 수업일수 4분의 3선 후 징병에 의한 군입대 | 수업일수 4분의 3선 후 징병에 의한 군입대 | - | 입영통지서 | 담당교수에게 증빙서류 제출 |  |\n| 출산 | 출산 | 본인:20일 배우자:10일 | 본인 : 출생(출산예정)증 명서 등, 배우자 : 출생 (출산예정)증명서 및 가족관계증명서 등 | 담당교수에게 증빙서류 제출 |  |\n| 생리 | 생리 | 생리기간 (학기중 2회) | 유고결석신청서 (생리공결제) | 담당교수에게 증빙서류 제출 | ※ 자세한 사항은 학사공지사항 생리 유고 신청안내 참조 |', '| 질병 및 상해 로 인한 입원 또는 감염병 으로 인한 격 리(치료) | 법정감염병 (**질병관리청의 법정감염병에 한함) | 격리(치료) 기간 또는 감염우려 기간 | 해당 증빙서류 | 담당교수에게 증빙서류 제출 |  |\n| 졸업시험 | 졸업시험 | 졸업시험 당일 | 학과장 확인서 | 담당교수에게 증빙서류 제출 |  |\n| 수업일수 4분의 3선 후 징병에 의한 군입대 | 수업일수 4분의 3선 후 징병에 의한 군입대 | - | 입영통지서 | 담당교수에게 증빙서류 제출 |  |\n| 출산 | 출산 | 본인:20일 배우자:10일 | 본인 : 출생(출산예정)증 명서 등, 배우자 : 출생 (출산예정)증명서 및 가족관계증명서 등 | 담당교수에게 증빙서류 제출 |  |\n| 생리 | 생리 | 생리기간 (학기중 2회) | 유고결석신청서 (생리공결제) | 담당교수에게 증빙서류 제출 | ※ 자세한 사항은 학사공지사항 생리 유고 신청안내 참조 |\n| 교직과정이수자의 학교현장실습 | 교직과정이수자의 학교현장실습 | 교육실습 기간 | 교직담당자가 발급한 확인서 | 담당교수에게 증빙서류 제출 |  |\n| 졸업예정자(해당학기 졸업가능자) 로서 조기취업자 | 졸업예정자(해당학기 졸업가능자) 로서 조기취업자 | 취업기간 | 학과장 승인받은 유고결석 인정원, 재직(계약)증명서 및 4대보험가입내역 확인서 또는 이에 준하는 재직증명서류 | 입사확정 후 즉시 ￬ 유고결석인정원과 증빙서류에 대해 학과장 승인 ￬ 소속 단과대에 제출 ￬ 유고결석확인서를 발급받아 담당교수에게 제출 ￬ 수업종료 직전 취업사실에 대해 재확인 | ※ 자세한 사항은 학사공지사항 졸업예정자(해 당학기 졸업가능자)의 조기취업 유고결석 신청 안내 참조 |', '| 질병 및 상해 로 인한 입원 또는 감염병 으로 인한 격 리(치료) | 질병 및 상해 | 입원기간 | 해당 증빙서류 (*병원급 이상의 의료기관) | 담당교수에게 증빙서류 제출 |  |\n| 질병 및 상해 로 인한 입원 또는 감염병 으로 인한 격 리(치료) | 법정감염병 (**질병관리청의 법정감염병에 한함) | 격리(치료) 기간 또는 감염우려 기간 | 해당 증빙서류 | 담당교수에게 증빙서류 제출 |  |']","네, 감기로 병원 다녀온 경우 진료확인서로 유고결석이 가능하지 않아요. 질병 및 상해의 경우 의원에서 발급받은 서류는 해당되지 않습니다. 해당 증빙서류를 제출해야 해요.","감기로 병원에 다녀오신 경우, 진료확인서로 유고결석을 인정받기 위해서는 몇 가지 조건이 있습니다.일반적으로 의원에서 발급받은 서류는 유고결석 인정에 해당되지 않으며, 병원급 이상의 의료기관에서 발급된 증빙서류가 필요합니다.따라서, 감기로 병원급 의료기관에서 진료를 받으셨다면 해당 증빙서류를 제출하시면 유고결석이 가능할 수 있습니다.
정확한 사항은 담당 교수님께 문의하시고, 필요한 서류를 제출하시는 것이 좋습니다. 추가적인 질문이 있으시면 언제든지 말씀해 주시기 바랍니다.",0.99999999998,0.8,0.6666666666666666,0.0
나 정보통신공학과인데 혹시 졸업시험 대신 졸업논문을 선택해도 될까? 논문을 쓰게 되면 머신러닝 관련해서 작성하고 싶은데 이와 관련해서 상담할 수 있는 교수님이 계시면 이메일 좀 알려줘.,"['교내해커톤 등 다양한 공모전에 팀을 이루어서 프로젝트를 수행하고 \n발표하는 경험을 쌓는 것도 좋습니다. 전공심화 학생은 정보통신종합\n설계및실습 과목을 통해 프로젝트를 수행하고 졸업논문을 작성하고 \n발표하는 경험을 쌓는 것이 필요하며, 이를 통해 다양한 정보통신 분\n야로의 사회 진출을 준비할 수 있습니다.\n졸업 후 진로 \n-  정부 및 공공기관: 기술직 공무원 / 정보통신 표준화 관련 기관 등\n-  연구소: 국책연구소 / 통신 사업자 연구소 / 정보통신 산업체 연구소\n-  기업체: 삼성전자, LG전자 등 정보통신기기 제조업체 / KT, SKT, LG \nU+등 주요 통신사업자 / 네이버, 카카오 등 정보통신 서비스 업체 / 삼\n성 SDS, LG CNS 등 SI 사업체 / 부가통신서비스 사업자 / 은행, 증권\n회사 등 금융기관 / 게임회사 / 정보보안 회사 등\n-  기타: 국내/해외 대학 석·박사 진학\nQ&A \nQ1.  인공지능 전문가가 되고 싶습니다. 정보통신공학과에서 이 목표를 \n달성할 수 있을까요?\nA1.  정보통신공학과는 최신 AI 기술과 실전 경험을 갖춘 혁신적 인공지\n능 전문가를 양성하는 것을 목표로 하고 있습니다. 학과에서 제공하\n는 커리큘럼을 통해 하드웨어와 소프트웨어 기술을 망라하여 정보\n와 통신이 결합된 융복합 인공지능 전문가가 될 수 있습니다.\nQ2.  요즘은 융복합 시대입니다. 정보통신공학과는 다가오는 시대에 적\n합한 분야인가요?\nA2.  정보통신공학과는 정보와 통신이 결합된 융복합을 지향하는 학과\n입니다. 세상에서 만들어지거나 처리해야 하는 다양한 정보를 기계\n와 인간 간 소통을 통하여 더 나은 시대를 여는 것을 연구하는 분\n야입니다.\nQ3.  인문계 학생의 경우 고등학교 때 수학을 많이 배우지 않습니다. 그\n래도 정보통신공학과 커리큘럼을 따라갈 수 있는지요?\nA3.  고등학교 때 기본적으로 배우는 수학으로 준비가 충분합니다. 부족\n한 부분을 학부 1학년과 2학년 때 다양한 기본 및 심화 수학 과목이 \n있으므로 이를 학습하는 것으로 충분합니다. \nQ4.  졸업 후 통신과 관련한 곳으로 진로가 한정되나요?\nA4.  정보통신공학은 정보와 통신의 융합 학문으로서 IT 모든 분야로 진\n출이 가능합니다. 통신 분야뿐만 아니라 전자 기기, 자동차, 조선, 금\n융, 엔터테인먼트, 유통, 교육, 행정과 같이 정보통신 서비스가 결합\n되어 새로운 시너지가 창출되는 산업 전 분야로 진출이 가능합니다.', '교내해커톤 등 다양한 공모전에 팀을 이루어서 프로젝트를 수행하고 \n발표하는 경험을 쌓는 것도 좋습니다. 전공심화 학생은 정보통신종합\n설계및실습 과목을 통해 프로젝트를 수행하고 졸업논문을 작성하고 \n발표하는 경험을 쌓는 것이 필요하며, 이를 통해 다양한 정보통신 분\n야로의 사회 진출을 준비할 수 있습니다.\n졸업 후 진로 \n-  정부 및 공공기관: 기술직 공무원 / 정보통신 표준화 관련 기관 등\n-  연구소: 국책연구소 / 통신 사업자 연구소 / 정보통신 산업체 연구소\n-  기업체: 삼성전자, LG전자 등 정보통신기기 제조업체 / KT, SKT, LG \nU+등 주요 통신사업자 / 네이버, 카카오 등 정보통신 서비스 업체 / 삼\n성 SDS, LG CNS 등 SI 사업체 / 부가통신서비스 사업자 / 은행, 증권\n회사 등 금융기관 / 게임회사 / 정보보안 회사 등\n-  기타: 국내/해외 대학 석·박사 진학\nQ&A \nQ1.  인공지능 전문가가 되고 싶습니다. 정보통신공학과에서 이 목표를', '김명진 명예교수님 교수님은 정보통신공학과 학과 소속입니다. 이메일은 mjkim@hufs.ac.kr입니다.', 'U+등 주요 통신사업자 / 네이버, 카카오 등 정보통신 서비스 업체 / 삼\n성 SDS, LG CNS 등 SI 사업체 / 부가통신서비스 사업자 / 은행, 증권\n회사 등 금융기관 / 게임회사 / 정보보안 회사 등\n-  기타: 국내/해외 대학 석·박사 진학\nQ&A \nQ1.  인공지능 전문가가 되고 싶습니다. 정보통신공학과에서 이 목표를 \n달성할 수 있을까요?\nA1.  정보통신공학과는 최신 AI 기술과 실전 경험을 갖춘 혁신적 인공지\n능 전문가를 양성하는 것을 목표로 하고 있습니다. 학과에서 제공하\n는 커리큘럼을 통해 하드웨어와 소프트웨어 기술을 망라하여 정보\n와 통신이 결합된 융복합 인공지능 전문가가 될 수 있습니다.\nQ2.  요즘은 융복합 시대입니다. 정보통신공학과는 다가오는 시대에 적\n합한 분야인가요?', '김명진 명예교수님 교수님은 정보통신공학과 학과 소속입니다. 이메일은 mjkim@hufs.ac.kr입니다.']","네, 정보통신공학과에서는 졸업 논문을 선택할 수 있습니다. 논문을 쓰고자 하는데 상담이 필요하시다면 김명진 명예교수님의 이메일인 mjkim@hufs.ac.kr로 연락해보시는 것을 추천드립니다. 교수님께서 상담을 도와주실 것입니다.","졸업시험 대신 졸업논문을 선택하실 수 있습니다.졸업논문을 작성하실 경우, 머신러닝 관련 주제로 진행하고 싶으시다면, 관련 상담을 위해 한희일 교수님께 연락하실 수 있습니다
한희일 교수님의 이메일은 hihahn@hufs.ac.kr 입니다.",0.9166666666361111,0.3333333333333333,0.5,0.834684791418352
일통 FLEX 시험 점수 제출 기간 알고 싶어.,"['6. FLEX 대체 ( 정기시험 : 영어 , 중국어 , 일본어 , 프랑스어 , 독일어 , 러시아어 , 스페인어 )\n\n가 . 해당학과 : 자세한 사항은 첨부파일 참조\n\n나 . 일정 : 시험 일정 ( 클릭 ) 에 따라 학생 개별 응시하고 성적표 학과 제출\n\n다 . 제출기간 : 해당학과 사무실 문의\n\n7. FLEX 대체 ( 이탈리아어 , 태국어 , 폴란드어 , 루마니아어 , 체코어 , 헝가리어 , 세르비아어 , 그리스어 , 불가리아어 , 힌디어 )\n\n가 . 해당학과 : 자세한 사항은 첨부파일 참조\n\n나 . 시험일자 : 2025. 5. 24( 토 ) 오전 10:00 서울캠퍼스 시행예정\n\n※ 정확한 시간 / 장소는 추후 통지', '[공통] 2025-1학기(상반기) 교내 FLEX 졸업시험 시행 안내\n\n가 . FLEX 듣기 · 읽기 A 형 ( 듣기 50 문항 , 읽기 90 문항 / 총 120 분 )\n\n나 . FLEX 듣기 · 읽기 B 형 ( 듣기 55 문항 , 읽기 95 문항 / 총 120 분 )\n\n다 . 언어별로 각각 개발되어 있는 유형에 따라 시행\n\n10. 기타사항\n\n가 . 별도 성적인증서 또는 성적표는 발급되지 않음 .\n\n나 . 성적 확인은 해당 학과 사무실에서 확인 ( 시험일로부터 약 15~20 일 후 확인 가능 )\n\n붙임 : FLEX_2025 년 상반기 졸업시험 시행 계획\n\n2025. 5. 19.\n\n학사종합지원센터 ( 서울 / 글로벌 )', '다 . 제출기간 : 해당학과 사무실 문의\n\n7. FLEX 대체 ( 이탈리아어 , 태국어 , 폴란드어 , 루마니아어 , 체코어 , 헝가리어 , 세르비아어 , 그리스어 , 불가리아어 , 힌디어 )\n\n가 . 해당학과 : 자세한 사항은 첨부파일 참조\n\n나 . 시험일자 : 2025. 5. 24( 토 ) 오전 10:00 서울캠퍼스 시행예정\n\n※ 정확한 시간 / 장소는 추후 통지\n\n다 . 접수기간 : 2025. 4. 16.( 수 ) ~ 4. 23.( 수 ) 해당학과 사무실에 신청 ( 기한 이후 추가 신청 불가 )\n\n* 7 학기 이상 재적생만 신청가능\n\n8. 유의 사항\n\n가 . 졸업시험 및 졸업논문 심사에 통과한 자는 졸업 시까지 그 자격이 유효함 ( 단 , 학적을 상실한 때에는 그 자격을 인정하지 아니함 )\n\n나 . 제 2 전공 , 이중전공자도 해당학과 문의 / 학과에 따른 졸업시험 응시 , 논문 제출 등 pass 하기 바람', '[공통] 2025-1학기(상반기) 교내 FLEX 졸업시험 시행 안내\n\n[공통] 2025-1학기(상반기) 교내 FLEX 졸업시험 시행 안내\n\n[ 공통 ] 2025-1 학기 ( 상반기 ) 교내 FLEX 졸업시험 시행 안내\n\n2025 학년도 1 학기 ( 상반기 ) 교내 FLEX 졸업시험의 세부 시행 계획을 아래와 같이 안내합니다 .\n\n1. 시 험 명 : 2025 학년도 1 학기 (2025 년 상반기 ) 교내 FLEX 졸업시험\n\n2. 시행주관 : FLEX 센터\n\n3. 대상언어 : 총 15 개 언어\n\n※ 포르투갈어 , 네덜란드어 , 스웨덴어 , 마 ・ 인어 , 태국어 , 튀르키예어 ( 터키어 ), 이탈리아어 , 체코어 , 헝가리어 , 세르비아어 , 루마니아어 , 폴란드어 , 그리스어 , 불가리아어 , 힌디어\n\n4. 응시자격 : 교내 각 학과에 사전 신청한 학생만 응시 가능\n\n5. 시험일시 : 2025. 5. 24( 토 ) 10:00~12:00(120 분 )\n\n6. 입실시간 : 09:40 분까지 해당 고사실 내 입실완료 , 마스크 착용 권고\n\n※ 응시자는 정해진 입실시간을 반드시 준수하여야 합니다 .\n\n※ 듣기시험이 시작되면 고사실 내 입실을 할 수 없습니다 .\n\n7. 시험장소 : 본교 서울캠퍼스 교수학습개발원\n\n※ 시험 당일 건물 앞에 설치되는 배치표 , 유도표시 및 붙임의 시행계획 참고\n\n8. 응시자 준비물 ( 반드시 지참 )\n\n※ 신분증 ( 학생증 , 주민등록증 , 운전면허증 , 여권 등 ), 컴퓨터용 수성싸인펜 , 수정테이프\n\n※ OMR 답안 수정은 응시자가 수정테이프로 자유롭게 수정이 가능함 .\n\n9. 시험 및 평가유형 ( 붙임의 시행계획서 참고 )\n\n가 . FLEX 듣기 · 읽기 A 형 ( 듣기 50 문항 , 읽기 90 문항 / 총 120 분 )\n\n나 . FLEX 듣기 · 읽기 B 형 ( 듣기 55 문항 , 읽기 95 문항 / 총 120 분 )\n\n다 . 언어별로 각각 개발되어 있는 유형에 따라 시행\n\n10. 기타사항\n\n가 . 별도 성적인증서 또는 성적표는 발급되지 않음 .', '3. 평 가 방 법\n\n가 . 필답고사 , 과제물 , 출석률 등을 참작하여 평가함 .\n\n나 . 시험시간표는 별도로 발표하지 않으며 정해진 시험기간에 실시함 .\n\n4. 성적입력 알림 서비스 실시 : 성적입력 시스템에서 ‘ 최종제출 ’ 을 클릭하여 성적입력이 완료되면 해당 학생들에게 ‘ 성적이 입력되어 확인할 수 있다 ’ 는 문자가 (HUFS 앱 설치자에 한함 ) 발송됨 .\n\n2025. 4.\n\n서울 · 글로벌캠퍼스 교무처장\n\n| 0 |\n|:-------------------------|\n| 2025-1학기 중간시험 공고 |']",일통 FLEX 시험의 제출기간은 해당학과 사무실에 문의하셔야 합니다. 해당 기간은 문서에 명시되어 있지 않습니다.,졸업시험 점수 제출 기간은 공지사항에 따라 각 학과 사무실로 문의해야 합니다. 추가적인 질문이 있으시면 말씀해주세요.,0.999999999975,0.5,1.0,0.0
"글스산 세부전공 신청해야되는데, 신청기간이랑 방법 알 수 있어? 그리고 결과는 언제나와?","['[글로벌] 이수구분변경 신청 방법 안내\n\n다. 이수구분 신청 전, 전공교류교과목을 수강편람에서 확인하고 문의 사항이 있을 경우 신청전 미리 상담 (수강편람 확인 클릭)\n\n라. 신청 후 3~4일 (평일 기준) 이후\xa0종합정보시스템에서 변경결과를 반드시 확인하고 변경이 안된 경우, 담당자에게 연락하여 반드시 확인', '[글로벌] 이수구분변경 신청 방법 안내\n\n다. 이수구분 신청 전, 전공교류교과목을 수강편람에서 확인하고 문의 사항이 있을 경우 신청전 미리 상담 (수강편람 확인 클릭)\n\n라. 신청 후 3~4일 (평일 기준) 이후\xa0종합정보시스템에서 변경결과를 반드시 확인하고 변경이 안된 경우, 담당자에게 연락하여 반드시 확인', '다. 이수구분 신청 전, 전공교류교과목을 수강편람에서 확인하고 문의 사항이 있을 경우 신청전 미리 상담 (수강편람 확인 클릭)\n\n라. 신청 후 3~4일 (평일 기준) 이후\xa0종합정보시스템에서 변경결과를 반드시 확인하고 변경이 안된 경우, 담당자에게 연락하여 반드시 확인', '▶ ( 글로벌 ) hufsdbl@hufs.ac.kr 로 이메일 제출\n\n2. 일 정\n\n가 . 신청 기간 : 2025 년 1 월 22 일 ( 수 ) 10 시 ~ 1 월 23 일 ( 목 ) 14 시\n\n※ 안내된 기간에만 운영하므로 일정 준수할 것 ( 이후 별도 운영 계획 없음 )\n\n나 . 결과 확인 : 2025 년 1 월 24 일 ( 금 ) 14 시 , 종합정보시스템\n\n3. 신청 방법 : 종합정보시스템 → 전공 / 교직관리 ( ※ 가 . / 나 . 중 하나의 방법으로 신청 )\n\n가 . 부전공 신청 : 전공심화 + 부전공 또는 부전공 신청\n\n1) 신청 시 기존에 이수 중인 이중 / 부전공 은 자동 취소 됨 ( ※ 별도 취소 절차 없음 )\n\n2) “4. 유의 사항 ” 의 다 . 참고 하여 부전공 신청으로 인한 이수구분 변경 신청\n\n※ 이번 학기 졸업예정자 (4 학년 수료 , 졸업대기 포함 ) 는 1 월 초 까지\n\n이수구분 변경을 신청하여 졸업 학점이 누락되는 일이 없도록 해야 함', '가 . 해당학과 : 자세한 사항은 첨부파일 참조\n\n나 . 시험일자 : 2025. 5. 24( 토 ) 오전 10:00 서울캠퍼스 시행예정\n\n※ 정확한 시간 / 장소는 추후 통지\n\n다 . 접수기간 : 2025. 4. 16.( 수 ) ~ 4. 23.( 수 ) 해당학과 사무실에 신청 ( 기한 이후 추가 신청 불가 )\n\n* 7 학기 이상 재적생만 신청가능\n\n8. 유의 사항\n\n가 . 졸업시험 및 졸업논문 심사에 통과한 자는 졸업 시까지 그 자격이 유효함 ( 단 , 학적을 상실한 때에는 그 자격을 인정하지 아니함 )\n\n나 . 제 2 전공 , 이중전공자도 해당학과 문의 / 학과에 따른 졸업시험 응시 , 논문 제출 등 pass 하기 바람\n\n다 . 졸업시험 응시원서 제출 시 학생 본인의 연락처를 정확히 기재할 것']","신청기간은 2025년 1월 22일(수) 10시부터 1월 23일(목) 14시까지이며, 결과 확인은 2025년 1월 24일(금) 14시에 종합정보시스템에서 가능합니다. 이수구분 변경 결과는 신청 후 3~4일(평일 기준) 이후에 확인할 수 있습니다. 결과가 나오지 않을 경우 담당자에게 연락하여 확인해야 합니다.","글로벌스포츠산업학부의 세부전공 신청에 대한 정보는 다음과 같습니다.
신청기간: 2025년 5월 26일(월) 10:00부터 5월 30일(금) 16:00까지입니다. 신청기간 이후에는 추가 신청이나 변경이 절대 불가하니 유의하시기 바랍니다.
신청방법: 종합정보시스템에 접속하셔서 전공/교직관리 메뉴에서 1전공 신청을 하시면 됩니다.
배정결과: 배정 확정은 2025년 7월 중에 이루어질 예정입니다. 성적 반영이 완료된 후에 결과를 확인하실 수 있습니다.
추가적인 문의사항이 있으시면 학사종합지원센터에 연락하시기 바랍니다.",0.36666666664833336,0.0,1.0,0.8233453198751408
