user_input,retrieved_contexts,response,reference,context_precision,context_recall,faithfulness,answer_relevancy
글캠에서 운영하는 마이크로전공은 뭐가 있어?,"['[공통] 2025-1학기 마이크로전공 신청 안내\n\n| 0 | 1 | 2 |\n|:-------------|:---------------------|:-------------|\n| 캠퍼스 | 이메일 | 전화번호 |\n| 서울캠퍼스 | haksahelp@hufs.ac.kr | 02-2173-2111 |\n| 글로벌캠퍼스 | andy@hufs.ac.kr | 031-330-4028 |', '[공통] 2025-1학기 마이크로전공 신청 안내\n\n[공통] 2025-1학기 마이크로전공 신청 안내\n\n2025-1학기 마이크로전공 신청 안내\n\n마이크로전공의 2025-1학기 신청자를 모집하오니 아래 내용을 참고하여 관심있는 학생은 신청 바랍니다.\n\n- 아 래 -\n\n1. 마이크로전공이란 ?\n\n학위과정과는 별도로 학과 ( 부 )/ 전공 ( 이하 학과 ), 미네르바 교양대학 , 부서 또는 학제간 지정된 최소 학점을 이수하는 모듈형 교육과정을 말함\n\n2. 신청 자격 : 1 개 학기 이상 유효한 성적이 있는 재학생\n\n※ 아래의 경우 신청 불가 함\n\n- 1 개 학과 ( 교양 제외 ) 가 운영하는 마이크로전공 : 해당 학과를 1 전공 혹은 이중 ( 부 ) 전공으로 이수하는 학생\n\n- 참여학과가 2 개인 마이크로전공 : 학생의 1 전공과 이중 ( 부 ) 전공이 모두 참여학과인 학생\n\n- 마이크로전공 신청 후 전과 / 이중 ( 부 ) 전공 변경 등으로 위 신청 불가 사유에 추후 해당될 경우 신청했던 마이크로전공은\xa0취소됨\n\n○ 2025-1학기 운영 마이크로전공\n\n번호\n\n마이크로전공명\n\n운영 캠퍼스\n\n1\n\nK 문화콘텐츠통번역\n\n서울\n\n2\n\n러시아외교통상\n\n3\n\nMENA ‧ 이슬람비즈니스\n\n4\n\n태국학\n\n5\n\n인도아세안지역학\n\n6\n\n국제기구와글로벌거버넌스\n\n7\n\n디지털브랜딩\n\n8\n\n영어권영상문화\n\n9\n\n페르시아문화학\n\n10\n\n독일어자연어처리\n\n11\n\n중동외교안보학\n\n12\n\n공공빅데이터분석\n\n13\n\n상담심리전문가\n\n14\n\nUX 심리학\n\n15\n\n불가리아와중동부유럽지역학\n\n글로벌\n\n16\n\n비즈니스 AI 컴퓨팅\n\n17\n\n금융기관및무역경영\n\n18\n\n응용및계산수학\n\n19\n\n환경독성학\n\n20\n\n서양고전학\n\n21\n\n통계데이터사이언스\n\n22\n\n자연어이해와언어데이터\n\n23\n\n자연어처리인공지능\n\n24\n\n비지니스영어\n\n25\n\n사회과학영어\n\n26\n\n공학영어\n\n27\n\n자연과학영어\n\n28\n\n스페인어커뮤니케이션전문가과정 ( 초급 )\n\n29\n\n중국어커뮤니케이션전문가과정 ( 초급 )\n\n30\n\n일본어커뮤니케이션전문가과정 ( 초급 )\n\n31\n\n국제무역경영\n\n32', '[공통] 2025-1학기 마이크로전공 신청 안내\n\n서양고전학\n\n21\n\n통계데이터사이언스\n\n22\n\n자연어이해와언어데이터\n\n23\n\n자연어처리인공지능\n\n24\n\n비지니스영어\n\n25\n\n사회과학영어\n\n26\n\n공학영어\n\n27\n\n자연과학영어\n\n28\n\n스페인어커뮤니케이션전문가과정 ( 초급 )\n\n29\n\n중국어커뮤니케이션전문가과정 ( 초급 )\n\n30\n\n일본어커뮤니케이션전문가과정 ( 초급 )\n\n31\n\n국제무역경영\n\n32\n\n유럽고전미술사\n\n양캠퍼스\n\n33\n\n유라시아 ( 중앙아시아 ‧ 러시아 ‧ CIS) 통합지역학\n\n3. 신청 기간 : 2025.\xa01. 20.( 월 ), 10시 ~\xa01.\xa022.(수 ), 14 시까지\n\n※ 안내된 기간에만 운영하므로 신청 기간을 준수할 것\n\n4. 신청 방법 : 종합정보시스템 → 전공/교직관리 → 마이크로전공신청\n\n- 최대 3개까지 신청 가능\n\n- 신청기간 완료 후 담당자 확인 및 승인예정 (※ 승인결과는 마이크로전공 신청화면에서 확인 가능)\n\n5. 기타\n\n- 마이크로전공은 이중 / 부전공과는 별도로 운영되는 비 학위과정이며 졸업요건과 무관 함\n\n( 단 , 졸업이수학점 충족 전까지 마이크로전공을 이수 완료해야 하며 , 이수 완료하지 못하면 신청했던 마이크로전공은 자동 취소됨 )\n\n- 최대 3 개까지 신청 및 이수할 수 있으며 , 각 마이크로전공에서 제시하는 교과목 이수 조건만 완료하면\xa0이수 완료 가능 ( 이수 완료 확인은 추후 안내 예정임 )\n\n- 각 마이크로전공의 해당 교과목을 이전에 이수한 경우에도 인정 하며 , 이번에 마이크로전공을 신청하지 않더라도 해당 교과목을 먼저 수강하고 추후에 신청 할 수 있음\n\n- 각 마이크로전공의 해당 교과목은 교과목의 폐지 / 변경 등에 따라 수정될 수 있음 ( 별 도 안내 예정 )\n\n- 그 외 내용은 관련 규정 참고 바람\n\n6. 문의\n\n캠퍼스\n\n이메일\n\n전화번호\n\n서울캠퍼스\n\nhaksahelp@hufs.ac.kr\n\n02-2173-2111\n\n글로벌캠퍼스\n\nandy@hufs.ac.kr\n\n031-330-4028\n\n2025.\xa01.\n\n교무처장', '## [heading1] ##\n# 5. 마이크로전공\n\n## [heading1] ##\n# 가. 마이크로전공이란?\n\n## [paragraph] ##\n학위과정과는 별도로 학과(부)/전공(이하 학과), 미네르바 교양대학, 부서 또는 학제간\n지정된 최소 학점을 이수하는 모듈형 교육과정\n\n## [heading1] ##\n# 나. 신청자격 : 1개 학기 이상 유효한 성적이 있는 재학생\n\n## [paragraph] ##\n※ 아래의 경우 신청 불가함\n\n## [list] ##\n- - 1개 학과(교양 제외)가 운영하는 마이크로전공 : 해당 학과를 1전공 혹은 이중(부)\n- 전공으로 이수하는 학생\n- - 참여학과가 2개 이상인 마이크로전공 : 학생의 1전공과 이중(부)전공이 모두 참여\n- 학과인 학생\n- - 마이크로전공 신청 후 전과 / 이중(부)전공 변경 등으로 위 신청 불가 사유에 추후\n- 해당될 경우 신청했던 마이크로전공은 자동 취소됨\n\n## [paragraph] ##\n다. 기타\n\n## [paragraph] ##\n- 마이크로전공은 이중/부전공과는 별도로 운영되는 비 학위과정이며 졸업요건과 무관함\n(단, 졸업이수학점 충족 전까지 마이크로전공을 이수 완료해야 하며, 이수 완료하지\n\n## [list] ##\n- 못하면 신청했던 마이크로전공은 자동 취소됨)\n- - 최대 3개까지 신청 및 이수할 수 있으며, 각 마이크로전공에서 제시하는 교과목 이수\n- 조건만 완료하면 자동 이수 완료됨\n- - 그 외 내용은 관련 규정 및 홈페이지 공고 참고\n\n## [heading1] ##\n# 6. 기타 교과목 이수 안내\n\n## [paragraph] ##\n가. 이러닝 강좌(온라인 강좌 / 블렌디드 강좌)\n\n## [paragraph] ##\n1) 수강신청 : 일반 교과목과 동일한 방법으로 수강신청\n\n## [list] ##\n- * 온라인강좌 : 온라인 수업 수강\n- * 블렌디드강좌 : 온라인+오프라인 수업 수강', '## [paragraph] ##\n다. 기타\n\n## [paragraph] ##\n- 마이크로전공은 이중/부전공과는 별도로 운영되는 비 학위과정이며 졸업요건과 무관함\n(단, 졸업이수학점 충족 전까지 마이크로전공을 이수 완료해야 하며, 이수 완료하지\n\n## [list] ##\n- 못하면 신청했던 마이크로전공은 자동 취소됨)\n- - 최대 3개까지 신청 및 이수할 수 있으며, 각 마이크로전공에서 제시하는 교과목 이수\n- 조건만 완료하면 자동 이수 완료됨\n- - 그 외 내용은 관련 규정 및 홈페이지 공고 참고\n\n## [heading1] ##\n# 6. 기타 교과목 이수 안내\n\n## [paragraph] ##\n가. 이러닝 강좌(온라인 강좌 / 블렌디드 강좌)', '5. 기타\n\n- 마이크로전공은 이중 / 부전공과는 별도로 운영되는 비 학위과정이며 졸업요건과 무관 함\n\n( 단 , 졸업이수학점 충족 전까지 마이크로전공을 이수 완료해야 하며 , 이수 완료하지 못하면 신청했던 마이크로전공은 자동 취소됨 )\n\n- 최대 3 개까지 신청 및 이수할 수 있으며 , 각 마이크로전공에서 제시하는 교과목 이수 조건만 완료하면\xa0이수 완료 가능 ( 이수 완료 확인은 추후 안내 예정임 )\n\n- 각 마이크로전공의 해당 교과목을 이전에 이수한 경우에도 인정 하며 , 이번에 마이크로전공을 신청하지 않더라도 해당 교과목을 먼저 수강하고 추후에 신청 할 수 있음\n\n- 각 마이크로전공의 해당 교과목은 교과목의 폐지 / 변경 등에 따라 수정될 수 있음 ( 별 도 안내 예정 )\n\n- 그 외 내용은 관련 규정 참고 바람\n\n6. 문의\n\n캠퍼스\n\n이메일\n\n전화번호\n\n서울캠퍼스\n\nhaksahelp@hufs.ac.kr\n\n02-2173-2111\n\n글로벌캠퍼스\n\nandy@hufs.ac.kr', '- 마이크로전공 신청 후 전과 / 이중 ( 부 ) 전공 변경 등으로 위 신청 불가 사유에 추후 해당될 경우 신청했던 마이크로전공은\xa0취소됨\n\n○ 2025-1학기 운영 마이크로전공\n\n번호\n\n마이크로전공명\n\n운영 캠퍼스\n\n1\n\nK 문화콘텐츠통번역\n\n서울\n\n2\n\n러시아외교통상\n\n3\n\nMENA ‧ 이슬람비즈니스\n\n4\n\n태국학\n\n5\n\n인도아세안지역학\n\n6\n\n국제기구와글로벌거버넌스\n\n7\n\n디지털브랜딩\n\n8\n\n영어권영상문화\n\n9\n\n페르시아문화학\n\n10\n\n독일어자연어처리\n\n11\n\n중동외교안보학\n\n12\n\n공공빅데이터분석\n\n13\n\n상담심리전문가\n\n14\n\nUX 심리학\n\n15\n\n불가리아와중동부유럽지역학\n\n글로벌\n\n16\n\n비즈니스 AI 컴퓨팅\n\n17\n\n금융기관및무역경영\n\n18\n\n응용및계산수학\n\n19\n\n환경독성학\n\n20\n\n서양고전학\n\n21\n\n통계데이터사이언스\n\n22\n\n자연어이해와언어데이터\n\n23\n\n자연어처리인공지능\n\n24\n\n비지니스영어\n\n25\n\n사회과학영어\n\n26\n\n공학영어\n\n27\n\n자연과학영어\n\n28', '5. 마이크로전공 ····································································· 65\n6. 기타 교과목 이수 안내 ····································································· 65\n(이러닝강좌/군사학/논술인증/공학인증)\nⅣ. 수업관련 학사제도 안내\n1. 성적평가 기준 ····································································· 67\n2. 유고결석·결시 처리 절차 ····································································· 68', '## [paragraph] ##\n다. 기타\n\n## [paragraph] ##\n- 마이크로전공은 이중/부전공과는 별도로 운영되는 비 학위과정이며 졸업요건과 무관함\n(단, 졸업이수학점 충족 전까지 마이크로전공을 이수 완료해야 하며, 이수 완료하지\n\n## [list] ##\n- 못하면 신청했던 마이크로전공은 자동 취소됨)\n- - 최대 3개까지 신청 및 이수할 수 있으며, 각 마이크로전공에서 제시하는 교과목 이수\n- 조건만 완료하면 자동 이수 완료됨\n- - 그 외 내용은 관련 규정 및 홈페이지 공고 참고\n\n## [heading1] ##\n# 6. 기타 교과목 이수 안내\n\n## [paragraph] ##\n가. 이러닝 강좌(온라인 강좌 / 블렌디드 강좌)\n\n## [paragraph] ##\n1) 수강신청 : 일반 교과목과 동일한 방법으로 수강신청\n\n## [list] ##\n- * 온라인강좌 : 온라인 수업 수강\n- * 블렌디드강좌 : 온라인+오프라인 수업 수강', '[마이크로디그리(영어) (글로벌)] 영역에 개설된 강의 목록입니다.\n\n[기술문서작성:공학] 1학년 대상 / 교수: Nicolas Caballero / 월요일 1,2,3교시 / 강의실 2510호 / 학점: 3 / 전공필수 과목 아님 / 온라인강의 아님 / P/F 평가 과목 아님 / 원어강의 맞음\n\n[문맥으로읽는공학기술용어] 전체 학년 대상 / 교수: Molly Clare Fleming / 수요일 4,5,6교시 / 강의실 2508호 / 학점: 3 / 전공필수 과목 아님 / 온라인강의 아님 / P/F 평가 과목 아님 / 원어강의 맞음', '[공통] 2025-1학기 마이크로전공 신청 안내\n\n[공통] 2025-1학기 마이크로전공 신청 안내\n\n2025-1학기 마이크로전공 신청 안내\n\n마이크로전공의 2025-1학기 신청자를 모집하오니 아래 내용을 참고하여 관심있는 학생은 신청 바랍니다.\n\n- 아 래 -\n\n1. 마이크로전공이란 ?\n\n학위과정과는 별도로 학과 ( 부 )/ 전공 ( 이하 학과 ), 미네르바 교양대학 , 부서 또는 학제간 지정된 최소 학점을 이수하는 모듈형 교육과정을 말함\n\n2. 신청 자격 : 1 개 학기 이상 유효한 성적이 있는 재학생\n\n※ 아래의 경우 신청 불가 함\n\n- 1 개 학과 ( 교양 제외 ) 가 운영하는 마이크로전공 : 해당 학과를 1 전공 혹은 이중 ( 부 ) 전공으로 이수하는 학생\n\n- 참여학과가 2 개인 마이크로전공 : 학생의 1 전공과 이중 ( 부 ) 전공이 모두 참여학과인 학생', '| 미디어커뮤니케이션학부 (이중전공/부전공) | 글로벌캠퍼스 소속 이중전공 학생은 서울캠퍼스에서는 미디 어커뮤니케이션학부 공통과목과 자신의 세부전공 과목만 수 강가능함(부전공은 소속 캠퍼스에서 이수함/이중전공은 양캠 퍼스에서 이수가능) |', '[공통] 2025-1학기 마이크로전공 신청 안내\n\n02-2173-2111\n\n글로벌캠퍼스\n\nandy@hufs.ac.kr\n\n031-330-4028\n\n2025.\xa01.\n\n교무처장', '[마이크로디그리(영어) (글로벌)] 영역에 개설된 강의 목록입니다.\n\n[기술문서작성:공학] 1학년 대상 / 교수: Nicolas Caballero / 월요일 1,2,3교시 / 강의실 2510호 / 학점: 3 / 전공필수 과목 아님 / 온라인강의 아님 / P/F 평가 과목 아님 / 원어강의 맞음\n\n[문맥으로읽는공학기술용어] 전체 학년 대상 / 교수: Molly Clare Fleming / 수요일 4,5,6교시 / 강의실 2508호 / 학점: 3 / 전공필수 과목 아님 / 온라인강의 아님 / P/F 평가 과목 아님 / 원어강의 맞음\n\n[문맥으로읽는공학기술용어] 전체 학년 대상 / 교수: Molly Clare Fleming / 수요일 7,8,9교시 / 강의실 2507호 / 학점: 3 / 전공필수 과목 아님 / 온라인강의 아님 / P/F 평가 과목 아님 / 원어강의 맞음', '습 등을 이용한 최신 딥러닝 응용분야를 배웁니다.\n학과(부) 특별 프로그램 \n-  수시, 정시 합격자 성적장학금 지급 및 매 학기 성적우수자 장학금 \n지급\n-  캡스톤디자인 프로젝트 우수팀 외부 공모전 준비 지원(프로젝트룸, \n참가경비 등)\n-  학부생들에게 교수 연구 프로젝트 참여 기회를 제공하는 학부 연구\n생 제도 운영\n-  체코슬로바키아어과와 공동 운영하는 캡스톤디자인 과목 수료자에게 \n체코 현지 기업에서 장기 인턴쉽 기회 제공', '[공통] 2025-1학기 마이크로전공 신청 안내\n\n서양고전학\n\n21\n\n통계데이터사이언스\n\n22\n\n자연어이해와언어데이터\n\n23\n\n자연어처리인공지능\n\n24\n\n비지니스영어\n\n25\n\n사회과학영어\n\n26\n\n공학영어\n\n27\n\n자연과학영어\n\n28\n\n스페인어커뮤니케이션전문가과정 ( 초급 )\n\n29\n\n중국어커뮤니케이션전문가과정 ( 초급 )\n\n30\n\n일본어커뮤니케이션전문가과정 ( 초급 )\n\n31\n\n국제무역경영\n\n32\n\n유럽고전미술사\n\n양캠퍼스\n\n33\n\n유라시아 ( 중앙아시아 ‧ 러시아 ‧ CIS) 통합지역학\n\n3. 신청 기간 : 2025.\xa01. 20.( 월 ), 10시 ~\xa01.\xa022.(수 ), 14 시까지\n\n※ 안내된 기간에만 운영하므로 신청 기간을 준수할 것\n\n4. 신청 방법 : 종합정보시스템 → 전공/교직관리 → 마이크로전공신청\n\n- 최대 3개까지 신청 가능\n\n- 신청기간 완료 후 담당자 확인 및 승인예정 (※ 승인결과는 마이크로전공 신청화면에서 확인 가능)\n\n5. 기타', 'IT 기술 스택 스터디, 교내 해커톤 대회 운영, 프로젝트 운영, 그리고 \n관심 있는 기술 분야에 대한 연사 초청 세미나 운영을 통해 학생 개발\n자로 성장할 수 있는 기회를 제공함.', '[공통] 2025-1학기 마이크로전공 신청 안내\n\n02-2173-2111\n\n글로벌캠퍼스\n\nandy@hufs.ac.kr\n\n031-330-4028\n\n2025.\xa01.\n\n교무처장\n\n| 0 | 1 | 2 |\n|:-----|:------------------------------------------|:------------|\n| 번호 | 마이크로전공명 | 운영 캠퍼스 |\n| 1 | K문화콘텐츠통번역 | 서울 |\n| 2 | 러시아외교통상 | 서울 |\n| 3 | MENA‧이슬람비즈니스 | 서울 |\n| 4 | 태국학 | 서울 |\n| 5 | 인도아세안지역학 | 서울 |\n| 6 | 국제기구와글로벌거버넌스 | 서울 |\n| 7 | 디지털브랜딩 | 서울 |\n| 8 | 영어권영상문화 | 서울 |\n| 9 | 페르시아문화학 | 서울 |\n| 10 | 독일어자연어처리 | 서울 |\n| 11 | 중동외교안보학 | 서울 |\n| 12 | 공공빅데이터분석 | 서울 |\n| 13 | 상담심리전문가 | 서울 |\n| 14 | UX심리학 | 서울 |\n| 15 | 불가리아와중동부유럽지역학 | 글로벌 |\n| 16 | 비즈니스AI컴퓨팅 | 글로벌 |\n| 17 | 금융기관및무역경영 | 글로벌 |\n| 18 | 응용및계산수학 | 글로벌 |\n| 19 | 환경독성학 | 글로벌 |\n| 20 | 서양고전학 | 글로벌 |\n| 21 | 통계데이터사이언스 | 글로벌 |\n| 22 | 자연어이해와언어데이터 | 글로벌 |\n| 23 | 자연어처리인공지능 | 글로벌 |\n| 24 | 비지니스영어 | 글로벌 |\n| 25 | 사회과학영어 | 글로벌 |\n| 26 | 공학영어 | 글로벌 |\n| 27 | 자연과학영어 | 글로벌 |\n| 28 | 스페인어커뮤니케이션전문가과정(초급) | 글로벌 |\n| 29 | 중국어커뮤니케이션전문가과정(초급) | 글로벌 |\n| 30 | 일본어커뮤니케이션전문가과정(초급) | 글로벌 |\n| 31 | 국제무역경영 | 글로벌 |\n| 32 | 유럽고전미술사 | 양캠퍼스 |\n| 33 | 유라시아(중앙아시아‧러시아‧CIS)통합지역학 | 양캠퍼스 |', '## [heading1] ##\n# 5. 마이크로전공\n\n## [heading1] ##\n# 가. 마이크로전공이란?\n\n## [paragraph] ##\n학위과정과는 별도로 학과(부)/전공(이하 학과), 미네르바 교양대학, 부서 또는 학제간\n지정된 최소 학점을 이수하는 모듈형 교육과정\n\n## [heading1] ##\n# 나. 신청자격 : 1개 학기 이상 유효한 성적이 있는 재학생\n\n## [paragraph] ##\n※ 아래의 경우 신청 불가함\n\n## [list] ##\n- - 1개 학과(교양 제외)가 운영하는 마이크로전공 : 해당 학과를 1전공 혹은 이중(부)\n- 전공으로 이수하는 학생\n- - 참여학과가 2개 이상인 마이크로전공 : 학생의 1전공과 이중(부)전공이 모두 참여\n- 학과인 학생\n- - 마이크로전공 신청 후 전과 / 이중(부)전공 변경 등으로 위 신청 불가 사유에 추후\n- 해당될 경우 신청했던 마이크로전공은 자동 취소됨\n\n## [paragraph] ##\n다. 기타', '[서울] 2025학년도 1학기 ‘한국외대-한예종’ 공동운영 교양교과목 수강 안내\n\n| 재 수 강 | 재 수 강 | ①\xa0한예종에서 기존에 수강한 교과목에 대한 재수강은 우리 대학에서 개설되는 교양선택 과목 중 택1하여 재수강 해야함. ②\xa0우리대학 교과목에 대한 재수강을 목적으로 한예종 공동교양 교과목을 수강할 수 없음. |\n| 기 타 | 기 타 | ①\xa0공동 교양학부에서 운영하는 한예종 교양 과목은,\xa0국내대학 학점 교류와는 달리 재학 중 학점제한 없이 수강할 수 있음. 단,\xa0국내 학점교류 방식을 통해 한예종 과목을 수강하는 경우에는,\xa0국내·외 학점교류규정에 따라 취득 허용 학점 제한이 있음. ※\xa0국내대학 학점교류\xa0:\xa0학기당\xa017학점 이내\xa0/\xa0재학중 수강가능학점\xa035학점 이내 ②\xa0공동 교양과목은 양교 사정에 따라 학기별로 변동될 수 있으며,\xa0매학기 강의시간표를 통해 확인할 수 있음. |', '5958\n슬기로운 대학생활 \n1학년  스포츠 산업의 개요, 역사, 주요 산업 분야 등 스포츠산업 내 기본 \n개념들을 학습합니다. 또한, 데이터 분석 및 컴퓨터 프로그래밍 \n언어의 기초와 이해, 데이터 구조, 알고리즘 등을 학습할 수 있습\n니다.\n2학년  스포츠 산업의 전문 분야인 스포츠 마케팅, 경영 전략, 스포츠 재\n무관리 등을 심층적으로 다룹니다. 특히 산업 현장에서의 경험을 \n증진시키는 데 필요한 역량을 키우는 데 중점을 둡니다.\n3학년  스포츠 산업 내 특정 분야에 대한 전문 지식 및 현장 경험을 심화\n하여 학습합니다. 예를 들어, 스포츠 이벤트를 실질적으로 기획\n하고 운영하는 교육과정을 거치게 됩니다. \n4학년  학위 취득을 위한 졸업 프로젝트 또는 논문작업을 수행하며 스포\n츠 산업 관련 연구를 진행합니다. 또한, 취업 준비를 위한 프로그\n램이나 대학원 진학을 위한 지원을 제공합니다.\n졸업 후 진로 \n-  스포츠 매니지먼트 및 이벤트 기획: 스포츠 클럽, 리그, 대회, 이벤\n트 등을 기획하고 운영하는 업무를 수행하는 직무 (프로스포츠 구단)\n-  스포츠 마케팅 및 홍보: 스포츠 산업에서 제품, 서비스, 이벤트 등을 마\n케팅하고 홍보하는 업무를 수행하는 직무 \n-  스포츠 데이터 분석가: 스포츠 경기에서 발생하는 다양한 데이터를 수\n집하고 분석하여, 팀이나 선수의 성과를 향상시키는 데 필요한 정보\n를 도출하는 직무\n-  스포츠 미디어: 스포츠 뉴스, 인터뷰, 해설, 하이라이트, 분석 등 다양\n한스포츠 관련 콘텐츠를 제작하고, 편집하여 방송, 인터넷, 모바일 등\n에서 전달하는 업무\nQ&A \nQ1. 스포츠 관련 학과인데 꼭 운동선수 경험이 필요 하나요?\nA1.  아니요! 저희는 스포츠 산업에 대한 이해와 지식을 기르는 것을 목표\n로 하기 때문에 운동선수 경험은 필요하지 않습니다. \nQ2. 스포츠 산업에 대해서 어떤 것을 주로 배우나요?\nA2.  저희는 스포츠 경영, 스포츠 마케팅, 회계/재무, 스포츠 이벤트 기\n획 등 스포츠 기업에서 필요로 하는 주요 기능들을 배우게 됩니다. \nQ3. 스포츠를 직접 하는 수업도 있나요?\nA3.  네! 저희는 매주 목요일마다 학년 별로 축구, 농구, 야구, 골프 등의 \n스포츠 종목에 대한 실습을 수업으로 진행하고 있습니다. 이를 통해 \n학생들은 자신이 근무할 수도 있는 스포츠 종목에 대한 이해도를 높\n이고 스포츠만이 가지고 있는 문화를 학습하게 됩니다. 선후배간의', '분야에서 컴퓨터 프로그래밍 및 기술을 활용하는 방법에 대해 다루\n는 수업입니다.\n-  스포츠재무관리: 스포츠 산업 내에서 재무적인 측면을 이해하는 데 필\n요한 기초적인 개념과 도구들을 다루는 과목입니다.\n-  스포츠이벤트기획 및 실습: 스포츠 이벤트를 기획하고 운영하는 데 필\n요한 전략적인 개념과 실무적인 능력을 학습하는 과목입니다.\n학과(부) 특별 프로그램 \n-  국내/국제 스포츠 이벤트 방문 및 관람\n-  해양스포츠 (스노쿨링 및 서핑 등) 참여\n-  동계스포츠 (스키 및 스노우보드) 참여\n-  교내 및 전국구 규모의 스포츠이벤트 대회 개최\n-  스포츠산업 내 다양한 분야 전문가들 특강 진행\n-  졸업생들과의 만남 \n-  본교 대학원 진학 시 장학금 지급\n학과(부) 행사 및 동아리 활동 \n-  IWAY 학회: 축구부 활동 및 축구 산업에 대한 토론 \n-  STEPPER 학회: 스포츠산업 관련 기사, 영상 및 팟캐스트 제작\n-  HIKERS 학회: 야구부 활동 및 야구구단 프런트 업무 수행\n-  FC HOLICS: 여자 축구부 활동\n-  MADDOGS: 다소 생소한 라크로스 운동부 활동\n-  라마제: 매년 개최되는 홈커밍데이', '[서울] 2025학년도 1학기 ‘한국외대-한예종’ 공동운영 교양교과목 수강 안내\n\n① 공동 교양학부에서 운영하는 한예종 교양 과목은 , 국내대학 학점 교류와는 달리 재학 중 학점제한 없이 수강할 수 있음 .\n\n단 , 국내 학점교류 방식을 통해 한예종 과목을 수강하는 경우에는 , 국내 · 외 학점교류규정에 따라 취득 허용 학점 제한이 있음 .\n\n※ 국내대학 학점교류 : 학기당 17 학점 이내 / 재학중 수강가능학점 35 학점 이내\n\n② 공동 교양과목은 양교 사정에 따라 학기별로 변동될 수 있으며 , 매학기 강의시간표를 통해 확인할 수 있음 .\n\n※ 문의 : 02-2173-2118( 서울캠퍼스 학사종합지원센터 )\n\n붙임 1. 2025 학년도\xa01 학기 공동운영 교양교과목 수강안내 ( 한국예술종합학교 ) 1 부 .\n\n2. 2025-1 학기 한예종 - 외대 공동운영교양과목 ( 한예종 개설 )_url 포함 1 부 .\n\n3. 교류학생 누리 매뉴얼 1 부 . 끝 .\n\n2025. 01.\n\n서울캠퍼스 미네르바교양대학장\n\n| 0 |\n|:------------------------------------------------------------------------|\n| [서울]\xa02025학년도 1학기\xa0‘한국외대-한예종’\xa0공동운영 교양교과목 수강 안내 |', '-  기업체: 폴란드에 진출한 국내 기업, 글로벌 기업\n-  금융계: 은행 등 금융기관, 증권·보험 회사\n-  언론계: 외신기자, PD, 방송작가\n-  공공기관: 대사관, 문화원, 문화재단, 공기업, 행정부처 공무원 등\n-  문화예술계: 번역가, 큐레이터, 어린이책 기획자 등\nQ&A \nQ1.  폴란드학과는 한국에 하나밖에 없는 유일 전공학과로 알고 있는\n데요, 그렇다면 폴란드 정부가 학과생들에게 지원하는 별도의 혜\n택이 있나요?\nA1.  네. 폴란드 정부가 우리 학과에 쏟는 애정과 관심은 실로 어마어마합\n니다. 지금껏 폴란드 대통령이나 외무부 장관, 문화부 장관, 교육부 \n장관, 국회 의장 등이 학과를 방문했고, 주한 폴란드 대사관을 통해 \n전통의상 및 폴란드 도서 기증, 원어신문 발간 지원, 말하기 경연대\n회 공동주관 등 다양한 분야에서 학생들에게 전폭적인 지원을 아끼\n지 않고 있습니다. 또한 폴란드 교육부가 매년 20명의 학과생들에\n게 폴란드 현지 대학에서의 서머스쿨 장학금을 제공하고 있습니다.\nQ2.  폴란드학과에서 진행하고 있는 다양한 비교과 프로그램과 학과 행\n사, 그리고 취업률이나 학과에서 단독으로 운영하는 장학금 현황 등\n과 관련하여 보다 상세한 정보와 현황을 알고 싶으면 어디에서 찾\n을 수 있나요?\nA2.  폴란드학과는 학과 홈페이지뿐 아니라 SNS와 유튜브 단독 계정을 \n운영하고 있습니다. 우리 학과의 다양한 프로그램과 이벤트, 학과 \n분위기나 학과생들의 Campus life가 궁금한 분들은 아래 창구로 접\n속하면 생생하고 알찬 정보를 얻을 수 있습니다. 특히 유튜브 계정\n에 접속하면, 재미있는 컨텐츠가 가득합니다.\n* Instagram: https://www.instagram.com/hufs_polski/\n* Facebook: https://www.facebook.com/polski.hufs\n* Youtube: https://www.youtube.com/@user-eb7zz1dw4j', '기획기사, 자유기사 등을 작성하고 직접 신문을 발간해보는 교과목\n학과(부) 특별 프로그램 \n-  누구나 갖는 폴란드 현지 어학연수 장학금의 기회: 폴란드 현지 대학 \n어학연수 장학금(연간 50명), 7+1 장학제도, 폴란드 교육부가 지원하\n는 서머스쿨 장학금, 폴란드 UAM 대학 교환학생 장학금, 폴란드 실롱\n스크 대학 교환학생 장학금, 폴란드 야기엘론스키 대학 교환학생 장학\n금, 특수외국어진흥사업 온라인 해외연수 등\n-  특수외국어교육진흥사업에 참여, 교육부의 재정지원으로 다채로운 \n비교과 활동 운영: 선후배가 함께 가르치고 배우는 멘토-멘티 탄뎀, \n방학 중에 운영되는 폴란드어 집중 이수과정, 폴란드 현지 명문 대학\n과 공동으로 운영하는 온라인 해외연수, 폴란드의 한국어과 학생들과 \n언어교환 프로그램, 방과 후 폴란드어 보충반, 기업체 취업을 대비하\n는 비즈니스 폴란드어 프로그램 등\n-  본교 동일계열 일반대학원 석 ·박사과정 진학 시 장학생 우선선발(장\n학금 지급 기준: 직전학기 성적 3.5)\n학과(부) 행사 및 동아리 활동 \n-  라타르니아 학술제: 폴란드학과 전공동아리의 1년 활동을 결산하는 \n학술제\n-  폴란드어 신문 발간: 2013년부터 <Predko, predzej!>라는 이름으로 \n기사 작성 및 신문 발간\n-  마주르카: 폴란드의 민속춤과 노래를 배우고 공연\n-  WOP: 폴란드와 폴란드어에 대한 전공지식 함양을 목표로 한 동아리\n-  PoTo: 폴란드어와 영어를 함께 공부\n-  햇새벽: 사회적 현안을 더불어 고민하는 토론 동아리\n-  휘뚜루: 학과 학술지 발간\n글로벌캠퍼스 GLOBAL CAMPUS\n국가전략언어대학\n폴란드학과 11\n루마니아학과 13\n체코·슬로바키아학과 14\n헝가리학과 16\n세르비아·크로아티아학과 18\n그리스·불가리아학과 19\n중앙아시아학과 21\n아프리카학부 23\n우크라이나학과 24\n한국학과 26\nCOLLEGE OF NATIONAL \nSTRATEGIC LANGUAGES', '[공통] 2025-1학기 수강신청 안내\n\n1) 타캠퍼스 학과의 전공을 이중(부)전공으로 이수 허가받은 학생에 한하여 타캠퍼스 해당 이중(부)전공 과목 수강신청 가능(단, 교양, 자유선택 수강 불가)\n\n2) 단, 아래의 경우 수강 가능한 개설캠퍼스 유의\n\n1전공 캠퍼스\n\n이수중인 타캠퍼스 이중(부)전공\n\n전공구분\n\n수강신청\n\n서울캠퍼스\n\n철학, 사학, 언어인지과학\n\n부전공\n\n서울캠퍼스\n\n글로벌캠퍼스\n\n정치외교학, 행정학, 언론·정보,\n\n광고·PR·브랜딩, 방송·영상·뉴미디어\n\n부전공\n\n글로벌캠퍼스\n\n이중전공\n\n양캠퍼스\n\n다. 집중수업 강좌 는 수강취소기간에 수강취소 불가 하므로, 수강신청 전 수업진행과 관련하여 강의계획서\n\n사전 확인 (다만, 질병 및 군입대 등의 사유로 학업이 불가능하게 된 경우는 예외)\n\n1) 집중수업이란?(※ 강의시간표 및 수강신청 강좌 비고 에 “*집중수업(수업기간)”으로 안내)\n\n교육과정 운영상 필요한 경우 개별 교과목별로 학점당 이수시간(학점 15시간 이상)을 준수하는 범위에서 수업일수를 단축하여 운영하는 수업\n\n2) 집중수업 강좌가 학기 종강 전에 종료되더라도 강의평가 및 성적평가 기간은 원활한 학사운영을 위해 학사일정에 맞춰 진행함\n\n라. 교차수업 강좌 는 본인 소속 캠퍼스에서 대면수업으로 진행될 때에는 대면수업으로 참여하고, 타 캠퍼스에서 대면수업으로 진행될 때에는 실시간 비대면으로 수업에 참여함\n\n(※ 캠퍼스별 대면수업 일정은 강의계획서 참고)\n\n▶ 교차수업이란?(※ 강의시간표 및 수강신청 강좌 비고 에 “*교차수업”으로 안내)\n\n동일한 강의시간(요일, 시간)에 동일한 교과목(학점, 시간 일치)을 동일한 담당 교수의 수업으로 양 캠퍼스에 각각 개설한 수업으로 학생은 본인 소속 캠퍼스에 개설된 강좌를 수강신청함\n\n마. 글로벌캠퍼스 강의실 배정\n\n▶ 수강 신청 전 강의실 배정이 어려운 관계로 수강 신청 시 추후 건물 이동 동선 참고\n\n계열/학과\n\n건물\n\n인문·경상계열\n\n인문·경상관\n\n어문계열\n\n어문관 / 교양관\n\n자연계열\n\n자연관 / 백년관\n\n공학계열\n\n공학관\n\n교양', '## [list] ##\n- 15시간 이상)을 준수하는 범위에서 수업일수를 단축하여 운영하는 수업\n- ※ 확인방법 : 강의시간표 및 수강신청 강좌 비고에 “*집중수업(수업기간)”으로 안내\n- ※ 집중수업 강좌가 학기 종강 전에 종료되더라도 강의평가 및 성적평가 기간은\n- 원활한 학사운영을 위해 학사일정에 맞춰 진행함\n- 17) 교차수업 강좌는 본인 소속 캠퍼스에서 대면수업으로 진행될 때에는 대면수업으로\n- 참여하고, 타 캠퍼스에서 대면수업으로 진행될 때에는 실시간 비대면으로 수업에 참\n- 여함(※ 캠퍼스별 대면수업 일정은 강의계획서 참고)\n- - 교차수업 : 동일한 강의시간(요일, 시간)에 동일한 교과목(학점, 시간 일치)을 동일\n- 한 담당 교수의 수업으로 양 캠퍼스에 각각 개설한 수업으로 학생은 본인 소속\n- 캠퍼스에 개설된 강좌를 수강신청함\n- - 확인방법 : 강의시간표 및 수강신청 강좌 비고에 “*교차수업”으로 안내\n\n## [paragraph] ##\n※ 예비수강신청함 시스템 사용법\n모의 동영상 (QR코드스캔)\n\n## [paragraph] ##\n※ 수강신청 시스템 사용법\n모의 동영상(QR코드스캔)\n\n## [heading1] ##\n# 다. 수강신청 변경\n\n## [table] ##\n| 기간 | 3. 4.(화) ~ 3. 10.(월), 10시 ~ 17시 (토요일, 일요일 제외) (단, 취소는 1~4일차 매일 22시까지, 5일차 17시까지 가능) |\n| --- | --- |\n| 방법 | 학교 홈페이지 수강신청변경 임시화면(별도 기간) ‘바로가기’ / 팝업 ‘수강신청변경 바로가기’ / HOT LINK ‘수강신청변경 바로가기’ ※ 수강신청 변경 후 본인의 강의시간표 반드시 확인 |\n\n## [paragraph] ##\n☞ 정규 수강신청과 동일하게 신청하며, 교과목 별 여석 내에서 추가로 신청할 수 있음\n\n## [caption] ##\n라. 폐강강좌 수강생 수강신청 변경', '서 최고라 자부\n-  재학생들 관련 경진 대회 수상 다수(교수진의 전폭적인 지원을 통해 \n졸업 후 취업 가능성 최대화)\n주요 실적 \n-  대학생 산업공학프로젝트 경진대회 최근 5년간 대상 2회 등 다수 수상\n-  산업공학회 석사논문경진대회 최근 5년간 대상, 최우수상 포함 다\n수 수상\n-  INFORMS Analytics & OR Student Team Competition Third \nPrize 2년 연속 수상\n-  국내 대학 산업공학과 중에 각종 학회, 경진대회 압도적인 수상 실\n적 보유\n주요 전공과목 \n-  경영과학 (Operations Research): 선형계획법 및 네트워크 이론을 \n중심으로 결정론적 최적화 이론 및 알고리즘을 학습하고 실제 문제의 \n모형화 방법 및 해법을 배웁니다. \n-  생산계획 및 통제 (Production Planning & Control): 제품 및 서비\n스의 생산 활동을 전반적으로 계획하고 통제하는 데 사용되는 수요예\n측, 자재계획, 재고관리, 일정계획, 공정관리 등에 대한 기본개념 및 \n이론을 배웁니다.\n-  데이터 사이언스 (Data Science): IT의 발달과 사물인터넷(IoT, \nInternet of Things)의 급격한 성장은 기존에 존재하지 않던 대량의 \n데이터(Big-Data)를 발생시키고 있습니다. 데이터 사이언스(Data \nScience)는 데이터에서 지식을 얻어내기 위해 Python, R등을 사용\n하여 데이터를 가공, 정제, 해석, 예측, 시각화하는 구체적인 방법들\n에 대해 배웁니다. \n-  딥러닝 응용 (Deep Learning Applications): 기계학습의 한 분야인 \n딥러닝을 이해하기 위한 기초 개념, 이론, 구현방법, 응용 등을 다룹니\n다. 이미지, 음성 등의 데이터 처리를 위한 콘볼루션신경망, 순환신경\n망과 같은 기본 딥러닝 모형을 학습하고, 생성적 적대신경망, 강화학\n습 등을 이용한 최신 딥러닝 응용분야를 배웁니다.\n학과(부) 특별 프로그램 \n-  수시, 정시 합격자 성적장학금 지급 및 매 학기 성적우수자 장학금 \n지급\n-  캡스톤디자인 프로젝트 우수팀 외부 공모전 준비 지원(프로젝트룸, \n참가경비 등)\n-  학부생들에게 교수 연구 프로젝트 참여 기회를 제공하는 학부 연구\n생 제도 운영\n-  체코슬로바키아어과와 공동 운영하는 캡스톤디자인 과목 수료자에게 \n체코 현지 기업에서 장기 인턴쉽 기회 제공', '[서울] 2025학년도 1학기 ‘한국외대-한예종’ 공동운영 교양교과목 수강 안내\n\n수강신청 방법\n\n우리대학 홈페이지 수강신청시스템 => 실용외국어 / 교양과목 => 공동교양 ( 한예종 )\n\n※ 기존 수강신청 방식과 동일하게 우리대학 수강신청 기간에 수강신청시스템에 접속하여 교양영역에서 한예종 과목을 선택하여 수강 신청함 .\n\n※ 단 , 전체학년 수강신청 기간 (2025.\xa02.\xa07( 금 )) 에만 수강신청이 가능함 .\n\n수강학점\n\n학년도별 학기당 최대 수강신청 20 학점 내에서 수강신청 가능\n\n수강변경 및 취소\n\n우리대학 홈페이지 종합정보시스템 접속\n\n※ 한예종 교양과목을 수강취소하는 경우 , 다른 한예종 교양과목을 수강신청 할 수 없으며 , 우리 대학에서 개설되는 과목으로만 수강변경이 가능함 ( 단 , 여석 내 )\n\n※ 교류과목 중 폐강이 발생할 경우 , 폐강된 교류과목을 신청했던 학생은 우리대학에서 개설되는 과목으로 수강 변경할 수 있음 .\n\n성적처리\n\n① 한예종에서 성적 정정 ( 기간 ) 완료 후 , 한예종 공동 교양과목을 수강한 한국외대 학생들의 성적 ( 백분율 점수 ) 을 우리 대학으로 전달함 .\n\n② 한예종에서 부여하는 백분율 점수를 우리 대학 평점평균 환산기준표에 따라 성적등급으로 환산하여 최종 성적등급을 결정함 .\n\n※ 평점평균 : 우리대학 4.5 만점 / 한예종 4.3 만점\n\n재 수 강\n\n① 한예종에서 기존에 수강한 교과목에 대한 재수강은 우리 대학에서 개설되는 교양선택 과목 중 택 1 하여 재수강 해야함 .\n\n② 우리대학 교과목에 대한 재수강을 목적으로 한예종 공동교양 교과목을 수강할 수 없음 .\n\n기 타\n\n① 공동 교양학부에서 운영하는 한예종 교양 과목은 , 국내대학 학점 교류와는 달리 재학 중 학점제한 없이 수강할 수 있음 .\n\n단 , 국내 학점교류 방식을 통해 한예종 과목을 수강하는 경우에는 , 국내 · 외 학점교류규정에 따라 취득 허용 학점 제한이 있음 .\n\n※ 국내대학 학점교류 : 학기당 17 학점 이내 / 재학중 수강가능학점 35 학점 이내', '이닝 및 선수 모니터링, 그리고 팬 경험의 향상을 위한 새로운 기술 도\n입 등의 다양한 영역에서 연구와 교육을 진행하고자 합니다. AI를 활용\n한 맞춤형 컨텐츠 제작, 스포츠 이벤트의 디지털화와 새로운 경험 제공, \n그리고 데이터 기반의 마케팅 전략 수립 등을 통해 스포츠 산업의 미래\n를 선도하는 인재를 양성하고자 합니다.\n필요역량 및 소양 \n-  스포츠산업에 입문하려면 스포츠에 대한 관심과 열정이 필요합니다. \n특히 스포츠에 대한 참여 경험이 있으면 도움이 됩니다. \n-  스포츠산업에서는 다양한 사람들과 협력해야 하므로 커뮤니케이션 \n및 협업 능력이 필요합니다. 학생들은 대인관계를 적극적으로 발전시\n키고, 팀 프로젝트나 그룹 활동 등을 통해 협업 능력을 키운다면 큰 도\n움이 될 것입니다.\n-  그 외에도 본 학부에서는 체육교사가 아닌 스포츠 산업 현장의 실무를 \n담당할 인재를 양성합니다. 이를 위해 경영, 마케팅 전략 및 기술적 발\n전과 데이터 분석에 대한 이해가 필수적입니다.\n-  마지막으로 실무 경험을 통해 이론을 현실에 적용하는 능력이 중요\n합니다. \n우리 학과(부)·전공 매력 \n-  스포츠경영 관련 최고 수준의 교육 커리큘럼 제공\n-  이론적 학습뿐 아니라 현장 경험을 중요시하여 실무 중심의 교육을 \n제공\n-  국제적인 시야에서의 교육과 다양한 문화를 경험할 수 있는 환경을 \n제공\n-  스포츠 산업의 최신 동향과 기술적 발전에 대한 지식을 제공\n-  국내·국제 메가스포츠이벤트 파견\n주요 실적 \n-  2014년 인천 아시안게임 자원봉사자 파견 \n-  2018년 자카르타 팔렘방 아시안게임 유급 인력 파견 \n-  2021년 스테퍼 학회, 국제e스포츠연맹 학술대회 최우수상 수상 \n-  2022년 프로야구단 KT 위즈 퓨처스 마케팅 공모전 대상 수상\n-  2024년 강원도청소년동계올림픽 유급 인력 파견\n주요 전공과목 \n-  스포츠경영학개론: 스포츠 산업과 경영에 대한 기본 개념과 이해를 제\n공하는 과목입니다.\n-  스포츠컴퓨터프로그래밍: 컴퓨터 과학과 스포츠를 결합하여, 스포츠 \n분야에서 컴퓨터 프로그래밍 및 기술을 활용하는 방법에 대해 다루\n는 수업입니다.\n-  스포츠재무관리: 스포츠 산업 내에서 재무적인 측면을 이해하는 데 필\n요한 기초적인 개념과 도구들을 다루는 과목입니다.\n-  스포츠이벤트기획 및 실습: 스포츠 이벤트를 기획하고 운영하는 데 필\n요한 전략적인 개념과 실무적인 능력을 학습하는 과목입니다.', '지급\n-  캡스톤디자인 프로젝트 우수팀 외부 공모전 준비 지원(프로젝트룸, \n참가경비 등)\n-  학부생들에게 교수 연구 프로젝트 참여 기회를 제공하는 학부 연구\n생 제도 운영\n-  체코슬로바키아어과와 공동 운영하는 캡스톤디자인 과목 수료자에게 \n체코 현지 기업에서 장기 인턴쉽 기회 제공\n-  관련 자격증 취득 시 응시료 지원\n학과(부) 행사 및 동아리 활동 \n-  단체 기업 탐방\n-  CPIM: 생산재고관리 분야 연구 학회\n-  Bigin: AI 및 data science 연구 학회\n-  홈커밍 데이: 졸업생과 재학생의 교류의 날\n슬기로운 대학생활 \n산업공학은 세부 전공의 범위가 넓고 다양합니다. 입학 후 1,2학년은 다\n양한 전공과목을 배우고 이 중에 본인의 적성에 맞는 세부 전공을 찾는 \n과정입니다. 3학년에는 본격적으로 깊은 전공 지식을 배웁니다. 4학년 \n1학기에는 그 동안 배운 전공 지식을 총동원해서 캡스톤디자인 프로젝\n트를 수행합니다. 이 과정에서 이론으로 배운 지식을 실제 문제해결 과\n정에 적용하는 방법을 배우고 더불어 졸업 후 큰 도움이 되는 특허 작성, \n논문/학회 발표, 시스템 제작 등을 수행합니다. 4학년 2학기에는 그 동\n안 배운 지식과 경험을 가지고 관심있는 기업에서 인턴과정을 수행하거\n나 더 깊은 공부를 하기 위한 대학원 과정을 준비합니다.\n졸업 후 진로 \n-  IT 관련 취업 분야: AI, 데이터 분석, 최적화 관련 연구 개발직\n-  제조 관련 취업 분야: 품질, 공정 관리, 인사 관리, 회계 등의 업무 지\n원직\n-  금융 관련 취업 분야: 금융 상품 설계 등\n-  국내/국외 석,박사 대학원 진학 다수\n-  학부생 연구 인턴 기회 제공(학회, 논문, 특허 등 작성)\nQ&A \nQ1. 산업경영공학에서는 무엇을 배우나요?\nA1.  산업경영공학은 비즈니스 전반에서 일어나는 다양한 문제들을 과학\n적/공학적으로 해결하는 방법을 배우는 전공입니다. 한국외국어대 \n산업경영공학과에서 이를 위해 다양한 과목을 공부하며, 크게 데이\n터 어낼리틱스, 시스템설계/운영관리, 품질경영/기술경영, 정보시\n스템 개발/실습 등의 분야로 나눌 수 있습니다. 전공과목에 대한 자\n세한 내용은 학과 홈페이지나 인스타그램을 참조해 주세요.\nQ2.  산업경영공학을 공대 중에 문과 특성이 많은 학과라고 하던데 수학\n을 잘 못 해도 괜찮을까요?\nA2.  산업경영공학에서 해결하려는 문제들은 경영학에서도 다루는 것', '## [heading1] ##\n# 5) 졸업 요건\n\n## [paragraph] ##\n- 졸업 과제 및 논문(전공 홈페이지에 게시)\n\n## [heading1] ##\n# 6) 문의처\n\n## [list] ##\n- - 홈페이지 : ds.hufs.ac.kr / 이메일 : seokohj@hufs.ac.kr\n- - 전공주임 연구실 전화번호 : 031-330-4680\n\n## [footer] ##\n- 54 -', '## [heading1] ##\n# ⑧ 데이터사이언스전공\n\n## [heading1] ##\n# ※ 신규신청 불가\n\n## [paragraph] ##\n1) 개요 및 교육목표\n\n## [paragraph] ##\n-\n\n## [paragraph] ##\n데이터과학은 데이터로부터 지식과 통찰을 뽑아내는 과학적 방법론을 연구하는 학문이며,\n최근 관심을 모으는 인공지능 구현의 ‘핵심 기반 학문’이다. 고도의 인공지능 학습을\n위해서는 데이터를 재료로 분석, 가공, 정제, 모델링하는 과정이 필수적인데, 이러한\n일련의 과정은 데이터과학에 그 이론적 바탕을 두고 있다. 최근 데이터과학자, 데이터\n개발자, 데이터분석가 등의 인력 수요가 급격히 증가하고 있으며, 특히 통계학, 산업경영,\n컴퓨터공학 등의 전문지식과 분야별 도메인 지식을 결합한 통합적‧실무형 데이터 과학자는\n전통적인 제조업과 IT산업은 물론, 금융‧통신‧의료‧공공 부문 등 다양한 산업분야에서\n활발히 활동할 것으로 기대된다.\n\n## [heading1] ##\n# 2) 선발 및 이수자격\n\n## [list] ##\n- - 글로벌캠퍼스에서 이중전공 또는 부전공으로 이수함 (정원 40명)\n- - 전공 구분 없이 지원가능하며, 성적순 선발을 원칙으로 함\n\n## [heading1] ##\n# 3) 이수학점 및 이수영역\n\n## [list] ##\n- - 총 이수학점 : 42학점 이상\n- - 영역별 이수학점\n\n## [list] ##\n- ‧ 기초 이론 : 12학점 이상\n- ‧ 소프트웨어 및 데이터분석 : 18학점 이상\n- ‧ 융합형 프로젝트 : 3학점 이상(캡스톤설계1, 2 중 한 과목 이상 수강)\n\n## [heading1] ##\n# 4) 교과 과정\n\n## [paragraph] ##\n총 이수학점 : 42학점\n\n## [paragraph] ##\n-', '## [heading1] ##\n# ⑦ 디지털인문한국학전공(서울캠퍼스에서 수강)\n\n## [heading1] ##\n# ※ 신규신청 불가\n\n## [paragraph] ##\n1) 한국의 인문학적 전통과 문화에 대한 심층적 지식을 바탕으로 디지털 매체를 활용한 해외\n송출과 쌍방향 소통이 가능한 지식통합형 인재를 길러내기 위한 융합전공으로 한국의 언어/\n문학, 사상, 역사에 대한 인문지식을 균형 있게 학습하고 이를 디지털 테크놀로지를 활용하\n여 콘텐츠화 하는 방법론을 습득함\n\n## [heading1] ##\n# 2) 이수학점 및 이수영역\n\n## [table] ##\n| 구분 | 이수학점 | 이수영역 |\n| --- | --- | --- |\n| 2014 학번까지 | 54학점 | 공통기초 6학점 + 연계기초 6학점 + 전공교과 42학점 |\n| 2015 학번부터 | 42학점 | 공통기초 6학점 + 연계기초 6학점 + 전공교과 30학점 |', '## [list] ##\n- ※ BRICs 국외교류 과목의 과목명은\xa0외국대학의 이수 교과목명을 국/영문으로 직역함\n- ※ 2015 학번부터의 이중전공자 중 2015~16년도 파견학생은 기존의 BRICs전공선택\n- 11학점, 펠로우십 10학점 이수 필요\n\n## [heading1] ##\n# (나) 이수 교과목 영역\n\n## [list] ##\n- 1) BRICs전공 내에 개설된 ‘BRICs지역입문’은 전공필수 과목이며, BRICs전공선택은 시간표상의\n- 브릭스전공 영역에서 이수함\n- 2) 이중전공 영역이 개설된 경우는 이중전공 영역에서 이수하여야 함\n- 3) 이중전공 영역이 개설되어 있지 않은 경우, BRICs전공을 위한 별도의 이중전공 영역 과목을\n- 개설하지 않고 제1전공 영역에서 이수함\n\n## [paragraph] ##\n※ 2016-2학기부터 ‘BRICs상거래문화’는 전공선택에서 상경선택으로, ‘BRICs국제협상론(상경선택)’은\n‘BRICs지역과한류(전공선택)’으로 변경되었으며, 2017학년 1학기부터 ‘BRICs와국제관계(전공선택)’은\n‘BRICs와세계경제(상경선택)’으로 변경되었음(해당 교과목은 수강 당시 학기에 명기된 이수영역으로 인정함)\n\n## [heading1] ##\n# 4) 이수 영역별 인정 교과목 현황\n\n## [paragraph] ##\n가) <상경트랙>\n\n## [paragraph] ##\n① 상경 학점 인정', '## [paragraph] ##\n※ 상경계열 : 상경대학, 경상대학, 경영대학 전공\n\n## [paragraph] ##\n※ BRICs전공선택 21학점 중\xa0BRICs 국외교류(펠로우십) 학점은 최대 18학점까지 인정\n\n## [footer] ##\n- 40 -']","글로벌캠퍼스에서 운영하는 마이크로전공은 다음과 같습니다:

1. 불가리아와중동부유럽지역학
2. 비즈니스 AI 컴퓨팅
3. 금융기관및무역경영
4. 응용및계산수학
5. 환경독성학
6. 서양고전학
7. 통계데이터사이언스
8. 자연어이해와언어데이터
9. 자연어처리인공지능
10. 비지니스영어
11. 사회과학영어
12. 공학영어
13. 자연과학영어
14. 스페인어커뮤니케이션전문가과정 (초급)
15. 중국어커뮤니케이션전문가과정 (초급)
16. 일본어커뮤니케이션전문가과정 (초급)
17. 국제무역경영
18. 유럽고전미술사
19. 유라시아 (중앙아시아 ‧ 러시아 ‧ CIS) 통합지역학

이 외에도 각 마이크로전공의 해당 교과목은 변경될 수 있으니, 자세한 사항은 관련 규정 및 홈페이지를 참고하시기 바랍니다. 혹시 더 도와드릴까요?","글로벌캠퍼스에서는 불가리아와중동부유럽지역학, 비즈니스AI컴퓨팅, 금융기관및무역경영, 응용및계산수학, 환경독성학, 서양고전학, 통계데이터사이언스, 자연어이해와언어데이터, 자연어처리인공지능, 비지니스영어, 사회과학영어, 공학영어, 자연과학영어, 스페인어/중국어/일본어 커뮤니케이션전문가과정(초급), 국제무역경영 등을 운영합니다.",0.4937947081829693,1.0,0.13636363636363635,0.0
이번 기말 언제부터야?,"['제1학기 기말시험 일정:\n2025-06-16 (월요일)\n2025-06-17 (화요일)\n2025-06-18 (수요일)\n2025-06-19 (목요일)\n2025-06-20 (금요일)', '제2학기 기말시험 일정:\n2025-12-15 (월요일)\n2025-12-16 (화요일)\n2025-12-17 (수요일)\n2025-12-18 (목요일)\n2025-12-19 (금요일)', '어린날부처님오신날 일정:\n2025-05-05 (월요일)', '개천절 일정:\n2025-10-03 (금요일)', '2025. 4. 25.( 금 )\n\n졸업시험\n\n졸업시험 시간표 발표\n\n5. 마 . ※\n\n2025. 5. 12.( 월 ) ∼ 5. 13.( 화 )\n\n졸업시험\n\n1 전공 졸업시험\n\n5. 나 .\n\n2025. 5. 19.( 월 ) ∼ 5. 20.( 화 )\n\n졸업시험', '삼일절 일정:\n2025-03-01 (토요일)', '대체휴업일 일정:\n2025-05-06 (화요일)\n2025-10-08 (수요일)', '2025년 후기 학위수여식 일정:\n2025-08-22 (금요일)', '제71주년 개교기념일 일정:\n2025-04-20 (일요일)', '3. 교류학생 누리 매뉴얼 1 부 . 끝 .\n\n2025. 01.\n\n서울캠퍼스 미네르바교양대학장\n\n| 0 |\n|:------------------------------------------------------------------------|\n| [서울]\xa02025학년도 1학기\xa0‘한국외대-한예종’\xa0공동운영 교양교과목 수강 안내 |', '근로자의 날 일정:\n2025-05-01 (목요일)', '[공통] 캠퍼스간 기초교과목 이중(부)전공 교차수강에 관한 공지\n\n[공통] 캠퍼스간 기초교과목 이중(부)전공 교차수강에 관한 공지\n\n안녕하세요 , 학사종합지원센터입니다 .\n\n2025-1 학기 부로 신설된 기초 교과목의 타캠퍼스 교차수강에 대해 안내드립니다 .\n\n우리 대학은 소속 캠퍼스에서 개설된 교과목을 수강하는 것을 원칙으로 하나 , 타캠퍼스 전공을 이중 ( 부 ) 전공하는 학생에 한하여 해당 전공 교과목에 한해 캠퍼스간 교차 수강을 허용하고 있습니다 .\n\n이번 기초 교과목 개설 과정에서 전산 시스템을 개발하고자 하였으나 시스템 개발에 따른 일정 및 기타 여러 가지 문제 등으로 인해 이번 2025-1 학기에는 기초교과목의 캠퍼스간 교차수강 전산 시스템이 정비되지 못하였습니다 . 그렇기 때문에 이번 학기에 한하여 특정 캠퍼스 학생이 타캠퍼스 이중 ( 부 ) 전공 학과의 필수 교과목을 수강하고자 할 경우 , 신청을 받아 수작업으로 수강을 허용하고자 합니다 .\n\n따라서 특정캠퍼스 소속 학생이 이중 ( 부 ) 전공 학생으로서 타캠퍼스에 개설된 기초 교과의\xa0수강이 필요해 이에 대한 수강신청을 희망하시는 경우 3. 5( 수 ) 17 시까지 붙임 양식을 작성하여 수강하고자 하는 기초 과목이 개설된 학과에 제출하여 주시기 바랍니다 .', '2025학년도 1학기 휴학 · 복학 신청 공고\n\n5) 수업일수 1 /4 선 후 ~ 3/4 선 이전 입대 예정자는 일반 휴학(군입대대기)으로 먼저 신청 후, 입영통지서가 나오면 군입대 휴학으로 재신청함\n\n6) 수업일수 3/4 선 후 입대 예정자가 이번 학기\xa0휴학이 아니라\xa0재학할 경우 해당 학기 성적 인정 절차를 진행하고 입대하여야 함\n\n※ 인정 절차 미이행 시 당해학기 성적 0.00 및 학사경고 처리\n\n7) 학기 3/4 선 후 입대 예정자가 이번 학기 일반\xa0휴학일 경우 일반 휴학은 사용한 것으로 처리됨\n\n8) 학기 3/4 선 후 입대 예정자가 군휴학을 신청하는 경우는 이번 학기\xa0군휴학이 아니라 다음\xa0학기 군휴학으로 신청되며, 이번 학기엔 일반 휴학 신청이 필요함\n\n다 . 모성보호 휴학\n\n1) 임신 . 출산 . 육아 관련 휴학 희망자는 학사종합지원센터 별도 문의 바람\n\n라 . 창업휴학\n\n1) 창업휴학 희망자는 창업지원운영팀으로 별도 문의 바람\n\n마 . 특별휴학\n\n1) 장애 또는 종합병원 3 개월 이상 진단서를 첨부하는 경우 일반 휴학기간에 포함되지 않고 휴학 신청이 가능하며 학사종합지원센터 별도 문의\n\n2) 국가재난 , 자연재해 등의 긴급한 사유로 귀국을 하지 못할 경우 , 별도 문의 바람 .\n\n바 . 복학\n\n1) 휴학 후 복학할 경우 반드시 복학신청을 하여야 함 ( 1 개 학기 휴학자도 복학신청 가능 )\n\n※ 일반휴학을 1 년 사용하여 복학예정일 표시가 2025 학년도\xa01 학기로 나오더라도 자동으로 복학처리 되지 않으며 반드시\xa0"" 복학신청 ""을\xa0별도로\xa0해야 함\n\n※ 휴학기간 만료 후 복학하지 않을 경우 "" 휴학기간초과제적 ""됨\n\n2) 복학생은 소정의 기간 내에 수 강 신 청 및 등록금 납부 ( 등록휴학 복학자 제외 )를 하여야 함\n\n3) 군입대 휴학자는 신청기간에 인터넷으로 복학신청 후 전역관련\xa0증빙 서류\xa0업로드\n\n- 전역자 : 전역증/병역증 사본 또는 병적증명서 또는 복무확인서\n\n- 전역예정자 : 전역예정증명서 또는 전역예정일이 나와있는 복무확인서\n\n4) 파일 업로드 유의사항', '[공통] 2025-여름계절학기 개설희망 교과목 수요조사 실시 공고\n\n라. 기초영역 에 개설된 기초중국어1 (중국언어문화학부, 중국외교통상학부)와 컨템포러리재패니즈(1) (일본언어문화학부, 융합일본지역학부) 교과목은 2025학년도\xa0여름계절학기에 개설될 예정이기 때문에 이번 수요조사에서는 제외되었습니다.\n\n마. 정확한 수요조사를 위해 불필요한 신청은 자제해 주시기 바랍니다.\n\n2025.\xa0\xa03.\xa0 27.\n\n서울.글로벌캠퍼스 교무처장', '[공통] 후기이중전공 신청 공고\n\n[공통] 후기이중전공 신청 공고\n\n(공통) 후기이중전공 신청 공고\n\n2025학년도 후기이중전공 신청 일정 및 방법 등을 공고합니다.\n\n1. 신청기간: 2025 4. 14.(월) 10:00 ~ 4. 18.(금) 16:00까지\n\n2. 신청대상: 현재 7~8학기 이수중인 자로, 후기이중전공을 희망하는 전공을 부전공으로 이수중인 자\n\n(7학기를 마치고 휴학한 학생도 이번 신청기간에 신청할 것)\n\n3. 신청방법: 인터넷 종합정보시스템에서 신청 (로그인 > 전공/교직관리 > 후기이중전공신청)\n\n4. 허가자 발표: 7월초 홈페이지 공고(예정)\n\n5. 기타사항\n\n가. 1년에 1회, 4월에만 신청하므로 반드시 희망자는 이번 신청 일정을 따를 것\n\n나. 지원학과 입학정원의 50 ~ 150% 이내에서 학과 자율 선발하되, 학과에서 요구하는 기본 자격요건 미충족 시 탈락될 수 있음\n\n(세부 배정기준은 지원학과 학과장실 문의 또는 학과 홈페이지 참조)\n\n다. 이수자 선발 이후 8학기까지 전공심화(+부전공) 또는 일반 부전공에 맞는 졸업에 필요한 졸업학점 요건을 모두 완료하여야 최종적으로 허가\n\n라. 조기졸업대상자, 학석사연계과정/석사예약제 이수자는 신청 불가(신청 희망 시 내방하여 해당 자격 취소처리 후 신청)\n\n마. 후기이중전공으로 선발되면 추가학기를 1학기 이상 무조건 등록, 수강해야 하며 등록금은 후기이중전공 학과의 등록금으로 납부해야 함\n\n바. 기타 자세한 사항은 전자규정집 ""이중전공시행규정"" 참조\n\n2025. 4.\n\n교무처장\n\n| 0 |\n|:------------------------------|\n| (공통) 후기이중전공 신청 공고 |', '## [heading1] ##\n# 2. 일정별 수강신청 지침\n\n## [heading1] ##\n# 가. 예비수강신청함\n\n## [list] ##\n- 1) 학교 홈페이지 예비수강신청 임시화면(별도 기간) ‘바로가기’ / 팝업 ‘예비수강신청 바\n- 로가기’ / HOT LINK ‘예비수강신청 바로가기’\n- 2) <HUFS Link>의 “강의시간표”에서 이번 학기 개설과목 확인 후\n- 수강희망과목을 선택하여 예비수강신청함 담기 → 최대 15강좌\n- 3) 예비수강신청함에 담은 교과목은 수강신청 기간에 반드시 수강신청으로 처리하여야\n- 해당 과목을 이수할 수 있음\n\n## [paragraph] ##\n나. 수강신청 (※ 수강신청 전 본인 종합정보시스템의 비밀번호 변경 권장)\n\n## [paragraph] ##\n1) 학교 홈페이지 수강신청 임시화면(별도 기간) ‘바로가기’ 혹은 팝업 ‘수강신청 바로가기’\n2) 수강신청은 수강신청기간 중 반드시 학생 본인이 하여야 함', '2025학년도 1학기 휴학 · 복학 신청 공고\n\n2) 복학생은 소정의 기간 내에 수 강 신 청 및 등록금 납부 ( 등록휴학 복학자 제외 )를 하여야 함\n\n3) 군입대 휴학자는 신청기간에 인터넷으로 복학신청 후 전역관련\xa0증빙 서류\xa0업로드\n\n- 전역자 : 전역증/병역증 사본 또는 병적증명서 또는 복무확인서\n\n- 전역예정자 : 전역예정증명서 또는 전역예정일이 나와있는 복무확인서\n\n4) 파일 업로드 유의사항\n\n- 1 개의 파일만 업로드 가능\n\n- JPG 파일만 업로드 가능 ( 최대 10MB)\n\n- 저장 시\xa0자동으로 파일명은 학번으로 수정\n\n- 업로드한 파일은\xa0[휴 / 복학 신청]-[결과조회]에서 확인 가능\n\n- 올바른 파일이 아닐 경우 , 반려 처리\n\n5) 수업일수 1/4 선 이전 전역자 복학 가능 , 이후 전역자 별도 문의바람\n\n※ 학생예비군은 별도로 신청해야 함 ( 학교 종합정보시스템 로그인 → 복학 및 예비군대원신청 작성 → 신청 )\n\n- 휴학 후 복학할 때마다 다시 신청해야 함\n\n-\xa0관련 문의는 예비군연대 : ( 서울 )\xa002-2173-2513\n\n( 글로벌 ) 031-330-4133, 4624, 4111\n\n사 . 기타사항\n\n1) 휴학 · 복학 승인 후 취소 또는 변경 시에는 수업일수 1/4 선 이전에 학사종합지원센터 방문을 통한 신청만 가능하므로 신중하게 신청 할 것\n\n2) 이번 학기 휴학 신청 시 이번 학기\xa0수강신청 데이터는 자동 삭제됨 ( 이후 수강신청 하지 말 것! )\n\n3) 휴학 중에는 졸업대기 또는 졸업이 불가하며 , 휴학생은\xa0반드시 복학신청 후에 해당학기 등록과 수강완료 후 수료 ( 졸업대기 ) 또는 졸업 가능함 .\n\n[ 교무처 시행세칙 : 제 2 절 학적사무 , 제 67 조 ④ 항 ] 휴학 신청시 , 반드시 확인바람\n\n4 ) 주소나 개인 연락처(전화번호, 이메일)가 변경된 경우 직접 종합정보시스템에 로그인하여 정정하여야 함\n\n5 )\xa0관련 문의처\n\n구분\n\n캠퍼스\n\n전화\n\n이메일\n\n학적 문의\n\n서울\n\n02) 2173-2130\n\nhaksamil@hufs.ac.kr\n\n글로벌', '[글로벌] 2025년 전기(2월 졸업) 학부 학위수여식 공고\n\n[글로벌] 2025년 전기(2월 졸업) 학부 학위수여식 공고\n\n[글로벌] 2025년 전기 학부 학위수여식 공고\n\n2025 년 전기 글로벌 캠퍼스\xa0학부 학 위 수 여 식 일정을 아래와 같이 공고합니다.\n\n-\xa0아\xa0 \xa0래 -\n\n1. 일 시 : 2025. 2. 14.( 금 ) 오후 2 시\n\n2. 장 소 : 글로벌캠퍼스 백년관 컨퍼런스홀 ( 강당 )\n\n※ 행사시작 20 분 전까지 학위가운을 착용하고 행사장 입장해 주시기 바랍니다 .\xa0(착용하지 않아도 입장은 가능합니다.)\n\n3. 졸업확정자 확인\n\n가 . 종합정보시스템 로그인 후 첫 화면 ( 자기정보관리 - 개인기본사항조회 ) 의 “ 졸업사정정보 ” 에서 확인\n\n1) 졸업 확정된 학생 : 졸업확정자 로 표기\n\n2) 이번 졸업이 불가능한 학생 : 졸업사정탈락자 로 표기\n\n나 . ‘ 졸업예정증명서 ’ 가 발급된다고 졸업확정이 아님 . 반드시 위와 같이 졸업확정여부 확인하기 바람 .\n\n4. 학위증 배부\n\n가 . 2 월 14 일 ( 금 ) 오후 2 시\xa0시작하는\xa0학위수여식 종료(약\xa040분 예상) 후 백년관 209호에서 배부 시작 . 졸업식 종료 전 사전 수령 불가 .\n\n※ 학위증 분실 및 훼손 방지를 위해 학위수여식 당일에만 현장 배부\n\n※ 대리인이\xa0신분증을 제시하고 대리 수령 가능\n\n나 . 2 월 14 일 ( 금 ) 받지 못한 학위증은 이후 학사종합지원센터 운영시간(방학 중 평일 09:30~15:00/ 학기 중 평일 09:00~17:00)에 방문하여 직접 혹은 대리 수령\n\n다 . 이번 졸업자가 아닌 이전 졸업생은 백년관이 아닌 학사종합지원센터 ( 학생회관 109 호 ) 로 방문\xa0수령\n\n라 . 외부제출용 ‘ 졸업증명서 ’ 는 학위수여식 당일 오후부터 인터넷 출력 가능\n\n5. 졸업가운 대여\n\n가 . 2 월 14 일 ( 금 ) ~ 16 일 (일 ) : 백년관 214 호\n\n※ 사전예약 필요 . 총학생회 공지사항에서 확인 바랍니다 . https://www.instagram.com/hufs_our', '2524\nDept. of Ukrainian Studies\n우크라이나학과\n전화번호 031-330-4873\n홈페이지 ukraine.hufs.ac.kr\n전공소개 \n우크라이나는 1991년 소비에트 연방 해체와 함께 탄생한 민주주의 국가\n로서 오랜 세월 동안 자유와 독립을 추구한 저항의 역사를 가지고 있습\n니다. 유럽에서 가장 큰 우크라이나는 구소련 지역 및 동유럽, EU 시장 \n진출의 교두보 역할을 하는 나라로서, 미래 식량, 에너지, 지하자원, 항\n공 우주기술, 북핵 문제 해결 등의 분야에서 우리나라와 협력이 가능합\n니다. 2022년 2월 24일 러시아의 우크라이나 침공이 시작된 이래 우크\n라이나 국민은 자신의 주권과 영토를 지키기 위해 각자의 자리에서 저\n항하고 있습니다. 이번 전쟁은 러시아와 우크라이나 두 나라 사이의 분\n쟁을 넘어 벌써 2년을 넘게 전 세계에 큰 영향을 미치고 있습니다. 이번 \n전쟁을 통해 우리는 다시금 우크라이나의 지정학적 중요성에 대해 인식\n하게 됩니다. 우크라이나는 전 세계의 민주주의, 자유, 주권, 영토를 지\n키기 위한 전쟁의 최전선이며, 이데올로기 충돌의 현장입니다. 우크라\n이나 문제가 어떻게 해결되는가는 한반도의 평화 정착에도 큰 영향을 \n미칠 것입니다. 이러한 상황에서 한국외대 우크라이나학과는 세계적 관\n심을 받는 우크라이나의 언어와 역사, 문화, 정치, 경제 등을 교육하고 \n연구하는 국내 유일의 학과입니다. 우리 학과는 지난 15년 동안 꾸준히 \n우크라이나 지역 전문가를 양성해 왔으며, 앞으로 전쟁 종료 이후 우크\n라이나의 복원 사업과 한국-우크라이나 관계 발전에 큰 역할을 할 수 있\n도록 최선을 다할 것입니다.\n필요역량 및 소양 \n-  우크라이나학은 지역학으로 분류되며, 우크라이나의 언어, 문화, 역\n사, 정치, 경제 등 우크라이나 지역의 특수성 및 주변 국가들과의 관계\n성을 배우는 학문입니다.\n-  따라서 세계의 언어와 문화, 정치, 경제 등에 관심이 많으며, 외국과 우\n리나라와의 관계 증진에 노력하는 지역 전문가가 되고 싶은 모든 사람\n은 이 학과에 적합합니다.\n-  우크라이나학 학습에 필요한 적성은 새로운 언어에 대한 호기심 및 학\n습 의지, 우크라이나 및 주변 지역의 역사, 문화, 정치, 경제, 국제관계\n에 대한 지속적 관심과 탐구 정신이라고 하겠습니다.\n-  우크라이나를 둘러싼 서방과 러시아의 관계, 우크라이나 전쟁이 전 세', '[공통] 2025-1학기 이중전공 변경 신청 일정 공고 새글\n\n[공통] 2025-1학기 이중전공 변경 신청 일정 공고 새글\n\n2025 학년도 제 1 학기 이중전공 변경 신청 일정을 다음과 같이 공고합니다 .\n\n1. 신청 대상 : 2~4 학년 재학생 및 휴학생\n\n※ 확인사항\n\n가 . 현재 2~4 학년으로\n\n1) 기존에 이중전공을 신청한 적이 있는 경우도 , 변경 신청 가능 ( 변경횟수제한 해제 )\n\n2) 이중전공을 신청하여 배정되지 않은 경우 ( 혹은 한번도 신청한 적이 없는 경우 ) 도 , 이번 변경 신청 신청해야하며 , 최초 신청 (5 월 26 일 ( 월 ) ~ 5 월 30 일 ( 금 ) 예정 ) 으로 신청 불가능\n\n나 . 2025 학년도 전기 편입생 ( 순수외국인전형 편입생 포함 ) 은\n\n1) 이번 변경 신청 불가\n\n2) 이중전공 신청으로만 신청 가능\n\n※ 5 월 26 일 ( 월 ) ~ 5 월 30 일 ( 금 ) 예정\n\n단 , 해당 기간에 신청하지 않으면 다음 학기부터 이중전공 변경 신청으로만 가능함\n\n2. 신청 기간 : 2025 년 5 월 12 일 ( 월 ) 10 시 ~ 5 월 16 일 ( 금 ) 16 시\n\n※ 안내된 기간에만 신청 / 변경 / 삭제 가능하므로 일정 준수할 것 ( 이후 별도 운영 계획 없음 )\n\n3. 신청 방법 : 종합정보시스템 → 전공 / 교직관리 → 이중전공 변경신청\n\n※ 1 지망만 신청 가능 , 신청 완료후 다시 조회하여 신청 결과를 반드시 확인할 것\n\n※ 제한사항\n\n가 . 신청할 학과 ( 부 )/ 전공의 본인 학번대에 여석이 없는 경우 신청 불가\n\n나 . 캠퍼스 간 이중전공을 희망하는 경우 아래의 제한학과로는 신청 불가\n\n서울캠퍼스\n\n( 글로벌캠퍼스 학생 신청 불가 학과 )\n\n글로벌캠퍼스\n\n( 서울캠퍼스 학생 신청 불가 학과 )\n\n영어대학 각 학과 ( 전공 )\n\n※ 글로벌캠퍼스 2023 학번부터 가능\n\n영어통번역학부\n\n프랑스어학부 ( 기존 프랑스어과 포함 )\n\n※ 글로벌캠퍼스 2023 학번부터 가능\n\n프랑스학과\n\n독일어과\n\n※ 글로벌캠퍼스 2024 학번부터 가능\n\n독일어통번역학과\n\n노어과', '(서울) 2025년 전기(2월 졸업) 졸업예비사정 결과 조회 안내\n\n| - 이수구분 수정(교류과목 자선->전공, 전공인정 교양과목->전공 자선->교양 등)을 하지 않아 학점이 미비 된 학생은 반드시 단과대학 교학과에 1/14 오전까지 이수구분 변경을 하여야 졸업 또는 수료가 가능함. | 이수구분 변경신청서 서식함 게시글 바로가기 클릭 |\n| - 졸업희망자는 외국어인증 서류를 1/14 오전까지 단과대학 교학과로 제출 바람 (단, 외국어연수평가원 겨울방학 특별과정 이수자는 과정 종료일 당일 수료증 제출자에 한하여(야간반의 경우 다음날 오전까지)졸업사정에 반영함) | 외국어인증신청서 제출안내 학사공지 게시글 바로가기 클릭 |\n| - 코어사업 지역학사/지역전문가과정/학석사연계과정 신청자 중 이번 졸업 또는 수료(학점완료 후 졸업을 미룬 상태)를 희망하는 학생은 관련 서류 작성하여 학과 확인 받은 후 학사종합지원센터에 1/14 오전까지 제출하여야 학위증 및 졸업증명서에 지역학사 또는 지역전문학과정 이수가 반영됨. (방문제출(학사종합지원센터 1번창구) 또는 이메일 haksamil@hufs.ac.kr 제출 가능하며 기제출자는 제출 불필요. 졸업 이후 학위명 변경 불가함.) | 관련 서류 학사공지 게시글 바로가기 클릭 |\n| - 2024학년도 2학기 현장실습 학점 인정 후 졸업이 필요한 학생은 1/21까지 학점인정 처리를 완료하기 바람. | 관련 진로취업지원센터 문의 |', '(서울) 2025년 전기(2월 졸업) 학부 학위수여식 공고\n\n(서울) 2025년 전기(2월 졸업) 학부 학위수여식 공고\n\n(서울) 2025년 전기 학부 학위수여식 공고\n\n2025 년 전기 서울캠퍼스 학위수여식 ( 학부 ) 일정을 아래와 같이 공고함 .\n\n아\xa0 \xa0\xa0래\n\n1. 일 자 : 2025. 02. 14.( 금 )\n\n2. 시간 및 장소 : 단과대학 ( 독립학부 ) 별 진행\n\n단과대학 ( 학부 )\n\n장소\n\n시간\n\n영어대학\n\n애경홀\n\n11:00\n\n아시아언어문화대학\n\n14:00\n\n경영대학\n\n사이버관 대강당\n\n11:00\n\n서양어대학\n\n14:00\n\n사회과학대학\n\n사이버관 소강당\n\n11:00\n\n상경대학\n\n14:00\n\n중국학대학\n\n대학원 6226\n\n11:00\n\n일본학대학\n\n14:00\n\n사범대학\n\n대학원 6105\n\n11:00\n\nKFL 학부\n\n14:00\n\nLD/LT 학부 ( 합동진행 )\n\n미네르바 국제회의실\n\n11:00\n\n국제학부\n\n14:00\n\n3. 학위증 수령 : 학위수여식 당일 학과사무실에서 배부\n\n( 단과대학별 학위수여식장에서 수여하는 학과도 있으니 , 관련 학과사무실 문의 )\n\n4. 졸업 확정여부 확인\n\n종합정보시스템 자기정보관리->개인기본사항조회->\xa0졸업사정정보에 “ [2025/02/14] 졸업사정대상자 / 졸업확정자 ” 로 표기 “ 졸업확정자 ” 표기가 없는 학생은 이번 졸업대상이 아님\n\n5. 학사모 및 가운대여 관련 : 총학생회 문의 ( http://www.hufsstudent.com ), 사전예약 필요(연락처: 02-2173-2770)\n\n6. 비고 : 교내 혼잡이 예상되오니 가급적 대중교통을 이용해 주시기 바랍니다 .\n\n여러분의 졸업을 진심으로 축하합니다 .\n\n2025. 02\n\n서울캠퍼스 교무처장', '[공통] 2025-여름계절학기 개설희망 교과목 수요조사 실시 공고\n\n[공통] 2025-여름계절학기 개설희망 교과목 수요조사 실시 공고\n\n계절학기 개설희망 교과목 수요조사 실시 공고\n\n2025 학년도\xa0여름계절학기 개설희망 교과목에 대한 수요조사 실시를 아래와 같이 공고함\n\n- 아\xa0\xa0\xa0\xa0 래 -\n\n1. 수요조사 기간: 2 025 . 4 . 1. (화 ) 1 0 : 0 0 ~ 4 . 3. (목) 1 6:00\n\n2. 참여대상: 2025학년도\xa01학기 재학생(휴학생, 교류생은 참여 불가)\n\n3. 참여방법\n\n가. 학교 홈페이지 → HOT LINK → “2025-여름계절학기 수요조사” 클릭 후 로그인\n\n나. 개설을 희망하는 교과목 신청\n\n다. 수요조사는 계절학기 수강학점(최대 6학점) 한도 내에서 신청 가능\n\n※ 캠퍼스간 교차 수요조사 참여가 가능하며 학과(부)간 신청의 제한 없음\n\n( 예-글로벌캠퍼스 학생도 서울캠퍼스의 교과목에 대해 수요조사 참여 가능하며\n\n서울캠퍼스 학생도 글로벌캠퍼스 교과목에 대해서 수요조사 참여 가능,\n\n또한 본인 전공 외에 타 학과의 전공에 대해서도 수요조사 참여 가능)\n\n※ 자세한 사항은 첨부된 [계절학기 개설희망 교과목 수요조사 참여 안내문] 확인\n\n4. 유의사항\n\n가. 수요조사는 정규학기에 개설된 교과목을 대상( 여름계 절학기는\xa01 학기 개설 교과목 ,\xa0겨울 계절학기는 1학기 개설 교과목 대상 ) 으로 하며 캠퍼스·학과(부)간 수요조사 참여의 제 한은 없습니다.\n\n나. 본 수요조사는 강좌개설을 위한 참고자료로만 활용되며, 실제 강좌 개설 여부는 각 학 과(부) 사무실로 문의 하시기 바랍니다.\n\n다. 실제 수강신청 시 해당 교과목의 수강제한 여부와 학생의 과거 수강 내역 등에 따라 수강 신청이 제한될 수 있습니다.\n\n라. 기초영역 에 개설된 기초중국어1 (중국언어문화학부, 중국외교통상학부)와 컨템포러리재패니즈(1) (일본언어문화학부, 융합일본지역학부) 교과목은 2025학년도\xa0여름계절학기에 개설될 예정이기 때문에 이번 수요조사에서는 제외되었습니다.', '(서울) 2025년 전기(2월 졸업) 졸업예비사정 결과 조회 안내\n\n이수구분 변경신청서 서식함 게시글 바로가기 클릭\n\n- 졸업희망자는 외국어인증 서류를 1/14 오전 까지 단과대학 교학과로 제출 바람\n\n( 단 , 외국어연수평가원 겨울방학 특별과정 이수자는 과정 종료일 당일 수료증 제출자에 한하여 ( 야간반의 경우 다음날 오전까지 ) 졸업사정에 반영함 )\n\n외국어인증신청서 제출안내 학사공지 게시글 바로가기 클릭\n\n- 코어사업 지역학사 / 지역전문가과정 / 학석사연계과정 신청자 중 이번 졸업 또는 수료 ( 학점완료 후 졸업을 미룬 상태 ) 를 희망하는 학생은 관련 서류 작성하여 학과 확인 받은 후 학사종합지원센터에 1/14 오전 까지 제출하여야 학위증 및 졸업증명서에 지역학사 또는 지역전문학과정 이수가 반영 됨 .\n\n( 방문제출 ( 학사종합지원센터 1 번창구 ) 또는 이메일 haksamil@hufs.ac.kr 제출 가능하며 기제출자는 제출 불필요 . 졸업 이후 학위명 변경 불가 함 .)\n\n관련 서류 학사공지 게시글 바로가기 클릭\n\n- 2024 학년도 2 학기 현장실습 학점 인정 후 졸업이 필요한 학생은 1/21 까지 학점인정 처리를 완료 하기 바람 .\n\n관련 진로취업지원센터 문의\n\n* 부득이한 사정으로 1 월 14 일까지 제출이 어려운 학생은 별도 문의바람 .\n\n5. 문의처\n\n- 졸업시험 / 논문 , 전공필수 관련 : 해당학과 사무실 ( 연락처 : 02-2173- 아래의 내선번호 )\n\nELLT 학과 ( 영어학과 )\n\n2266\n\n태국어과\n\n2299\n\n경제학부\n\n2333\n\n영미문학 . 문화학과 ( 영문학과 )\n\n2267\n\n베트남어과\n\n2300\n\n국제통상학과\n\n2332\n\nEICC 학과 ( 영어통번역학과 )\n\n2268\n\n페르시아어 . 이란학과\n\n2303\n\n경영학부\n\n2334\n\n프랑스어학부\n\n2282\n\n인도어과\n\n2301\n\n영어교육과\n\n2342\n\n독일어과\n\n2283\n\n터키 . 아제르바이잔어과\n\n2302\n\n프랑스어교육과\n\n2343\n\n노어과\n\n2284\n\n몽골어과\n\n2415\n\n독일어교육과\n\n2344\n\n스페인어과\n\n2285\n\n중국언어문화학부', '## [paragraph] ##\n9) 수강학점 이월(정규학기 기준) : 동일 년도 1학기 최대 수강학점을 수강하지 않은 학점\n수만큼 동일 년도 2학기에 최대 3학점까지(국내외 학점교류자는 최대 2학점까지)\n이월되어 신청할 수 있음(9학기 이상 재학생 제외)\n\n## [heading1] ##\n# ※ 학점이월 예시\n\n## [table] ##\n| 구분 | 수강신청학점 | 수강신청학점 | 비고 |\n| --- | --- | --- | --- |\n| 구분 | 1학기 | 2학기 | 비고 |\n| 전체 학생 아래 ①, ② 해당 학생 제외 | 19 | 21 | ※ 수강신청 시기에 전산 상에 자동으로 반영됨 |\n| 전체 학생 아래 ①, ② 해당 학생 제외 | 18 | 22 | ※ 수강신청 시기에 전산 상에 자동으로 반영됨 |\n| 전체 학생 아래 ①, ② 해당 학생 제외 | 17 이하 | 23 | ※ 수강신청 시기에 전산 상에 자동으로 반영됨 |\n| ① 통번역대학 2008학번 이후 ② 융합인재대학 | 21 | 23 | ※ 수강신청 시기에 전산 상에 자동으로 반영됨 |\n| ① 통번역대학 2008학번 이후 ② 융합인재대학 | 20 | 24 |  |\n| ① 통번역대학 2008학번 이후 ② 융합인재대학 | 19 이하 | 25 |  |\n\n## [list] ##\n- 10) 재수강 학점은 2016학년도부터 재학 중 총 21학점으로 제한함(계절학기 제외)\n- 11) 수강신청 후 이번 학기 휴학을 신청하여 승인이 되는 경우, 수강신청은 일괄 삭제됨\n- 12) 졸업예정자 및 8학기 이상 학생은 타 대학에서 수강할 수 없으며(계절학기 포함),\n- ‘사회봉사(농활)’ 또는 ‘사회봉사(해외)’를 이수할 수 없음\n- 13) 학사운영의 투명성 및 공정성을 제고하기 위해 교수-자녀 간 강의 수강 지양\n- 14) 아래의 경우 저작권 침해행위에 해당하니 수업 참여시 유념하기 바람', '(공통)2025-1학기 부전공 신청 및 이중/부전공 취소 일정 공고\n\n※ 이번 학기 졸업예정자 (4 학년 수료 , 졸업대기 포함 ) 는 1 월 초 까지\n\n이수구분 변경을 신청하여 졸업 학점이 누락되는 일이 없도록 해야 함\n\n나 . 이중 / 부전공 취소 ( 단일전공 희망자 ) : 이중전공 / 부전공 취소 신청\n\n1) 이중 / 부전공을 취소하는 경우 1 전공을 심화로 필수 이수 해야 함\n\n( 단 , 편입생 및 15 학번 이후 순수외국인전형 입학생 ( 사범대생 제외 ) 은 의무 없음 )\n\n2) 전공심화 시 1 전공 이수학점 은 학번대별 / 단과대학별 다를 수 있으므로 소속캠퍼스의\n\n수 강편람을 반드시 확인 할 것\n\n※ 신청 예시 : ( 전공이수제도 변경 관련 ) 첨부파일 참조\n\n전공심화를 하면서 부전공을 이수할 경우\n\n① “ 전공심화 + 부전공 ” 선택\n\n② 이수할 부전공 선택 후 [ 신청하기 ] 클릭\n\n전공심화를 하지 않고 부전공만 이수할 경우\n\n① “ 부전공 ” 선택\n\n② 이수할 부전공 선택 후 [ 신청하기 ] 클릭\n\n이중전공을 부전공으로 변경할 경우\n\n부전공을 다른 부전공으로 변경할 경우\n\n이중 / 부전공을 취소하고 전공심화를 이수할 경우\n\n“ 부전공 / 이중전공 취소 신청 ( 단일전공 희망자 ) ” 화면에서 [ 취소 신청하기 ] 클릭\n\n※ 제한사항\n\n가 . 캠퍼스 간 부전공을 희망하는 경우 아래의 학과로는 신청 불가\n\n서울캠퍼스\n\n( 글로벌캠퍼스 학생 신청 불가 학과 )\n\n글로벌캠퍼스\n\n( 서울캠퍼스 학생 신청 불가 학과 )\n\n영어대학 각 학과 ( 전공 )\n\n※ 글로벌캠퍼스 2023 학번부터 가능\n\n영어통번역학부\n\n프랑스어학부 ( 기존 프랑스어과 포함 )\n\n※ 글로벌캠퍼스 2023 학번부터 가능\n\n프랑스학과\n\n독일어과\n\n※ 글로벌캠퍼스 2024 학번부터 가능\n\n독일어통번역학과\n\n노어과\n\n※ 글로벌캠퍼스 2023 학번부터 가능\n\n러시아학과\n\n스페인어과\n\n※ 글로벌캠퍼스 2024 학번부터 가능\n\n스페인어통번역학과\n\n이탈리아어과\n\n※ 글로벌캠퍼스 2024 학번부터 가능\n\n이탈리아어통번역학과\n\n포르투갈어과', '2025학년도 1학기 휴학 · 복학 신청 공고\n\n나 ) 학업을 계속할 수 없는 명백한 사유가 있는 경우 :\xa0학사캘린더 에 의한 중간시험일 이전 까지만 허용\n\n( 공식적인 서류로 사유를 증명할 수 있어야 함 . 증빙서류 미비 또는 요건 미충족 시 허가하지 않음 .)\n\n6) 일반 휴학 중 입대할 경우, 군입대 휴학으로 재신청하여야 함 ( 입 영 관련 증빙 서류 업로드 )\n\n※ 미처리 시 일반 휴학기간 종료 후\xa0"" 휴학기간초과제적 ""됨\n\n7) 군입대휴학 기간 만료후 바로 일반휴학을 할 수 있음 ( 전역관련 증빙 서류 업로드 )\n\n8) 학적상태가 \'휴학\'인 경우에는\xa0도중에 졸업요건이 충족된 졸업대상자여도 바로 졸업할 수 없으며, 반드시 복학 후 돌아오는 졸업사정을 통해 졸업 가능\n\n나 . 군입대 휴학 (신입생, 편입생 첫 학기 가능)\n\n1) 입대일 이전 학교 종합정보시스템에서 신청 후 입영통지서 사본 제출\n\n※ 군입대 휴학자 중 장기복무자는 입영통지서 제출 시 또는 장기확정 시 필히 학사종합지원센터로\xa0신고하여야 함\n\n2) 파일 업로드 유의사항\n\n- 1 개의 파일만 업로드 가능\n\n- JPG 파일만 업로드 가능 ( 최대 10MB)\n\n- 저장\xa0시\xa0자동으로 파일명은 학번으로 수정\n\n- 업로드한 파일은\xa0[휴 / 복학신청]-[결과조회]에서 확인 가능\n\n- 올바른 파일이 아닐 경우 , 반려 처리\n\n3) 휴학기간 : 입영일부터 전역일까지 ( 귀향조치 시 관련 증빙서류 제출 후 상담 요망 )\n\n4) 전역일 이후 계속 휴학을 원하는 경우 복학예정일이 남아있더라도 일반 휴학으로 전환하여야 함 ( 전역관련 증빙 서류 업로드 )\n\n5) 수업일수 1 /4 선 후 ~ 3/4 선 이전 입대 예정자는 일반 휴학(군입대대기)으로 먼저 신청 후, 입영통지서가 나오면 군입대 휴학으로 재신청함\n\n6) 수업일수 3/4 선 후 입대 예정자가 이번 학기\xa0휴학이 아니라\xa0재학할 경우 해당 학기 성적 인정 절차를 진행하고 입대하여야 함\n\n※ 인정 절차 미이행 시 당해학기 성적 0.00 및 학사경고 처리', '[공통] 2024-2학기 이중전공 변경 배정 확정 공고\n\n[공통] 2024-2학기 이중전공 변경 배정 확정 공고\n\n[공통] 2024-2 학기 이중전공 변경 배정 확정 공고\n\n2024 학년도 제 2 학기 이중전공 변경 배정 결과를 아래와 같이 공고합니다 .\n\n- 아 래 -\n\n1. 결과 조회 : 종합정보시스템 → 전공 / 교직관리 → 이중전공 변경신청 → 안내사항\n\n*\xa01 월 7 일 오후 13 시 30 분부터 조회 가능\n\n2. 배정 결과에 따른 확인 사항\n\n가 . 이중전공 변경에 배정 된 경우\n\n1) 기존에 이수 중인 이중 / 부전공 은 자동 취소 됨 ( ※ 별도 취소 절차 없음 )\n\n2) “ 3. 이수구분 변경 안내 ” 를 참고하여 이중전공 변경으로 인한 이수구분 변경 신청\n\n※ 이번 학기 졸업예정자 (4 학년 수료 , 졸업대기 포함 ) 는 이수구분 변경을 신 청 하여 졸업 학점에 누락되는 일이 없도록 해야함\n\n3) 후기이중전공 선발자 가 이중전공 변경 배정된 경우 이중전공 변경으로 처리 됨\n\n( 단 , 후기이중전공 이수 희망자 제외 )\n\n나 . 이중전공 변경에 미배정 된 경우\n\n1) 기존에 이수 중인 이중 / 부전공 은 그대로 유지 됨\n\n3. 이수구분 변경 안내 : 이수구분 변경이 필요한 경우 학사종합지원센터 홈페이지 서식함의 “ 이수구분 변경 신청서 ” 작성 제출 ( ※ 상시 제출 가능 )\n\n▶ ( 서울 ) 이수구분 변경 신청서 바로가기 / ▶ ( 글로벌 ) 이수구분 변경 신청서 바로가기\n\n4. 기타 안내사항\n\n가 . 부전공 희망자 및 단일전공 희망자 의 경우 추후 종합정보시스템으로 별도 신청 예정\n\n1) 부전공 희망자 : 일반 부전공 또는 전공심화 + 부전공 신청\n\n2) 단일전공 희망자 : 기존 이중 / 부전공 취소\n\n※ 자세한 일정은 2025 년 1 월 중순 학사공지 예정인 “ 부전공 신청 및 이중전공 / 부전공 취소 일정 ” 확인\n\n※ 단 , 8 학기 이상인 학생 은 학사종합지원센터 단과대학 교학과 이메일 또는\n\n방문 신청', '(공통)2025-1학기 부전공 신청 및 이중/부전공 취소 일정 공고\n\n(공통)2025-1학기 부전공 신청 및 이중/부전공 취소 일정 공고\n\n2025 학년도 제 1 학기 부전공 신청 및 이중 / 부전공 취소 일정을 아래와 같이 공고합니다 .\n\n- 아 래 -\n\n1. 신청 대상 : (2025-1 학기 기준 ) 2 학기 ~ 7 학기 재학생 및 휴학생 중\n\n가 . 부전공 희망자 : 일반 부전공 또는 전공심화 + 부전공 신청\n\n( 전공심화 + 부전공 신청자는 1 전공의 졸업이수학점 늘어남 . 반드시 확인할 것 )\n\n나 . 이중 / 부전공 취소 희망자 ( 단일전공 희망자 ) : 이중 / 부전공을 취소하고 전공심화 이수\n\n※ 단 , 8 학기 이상인 학생 은 이중 ( 부 ) 전공 변경 신청서 ( 첨부파일 ) 를 작성하여\n\n학사종합지원센터 단과대학 교학과 이메일 또는 방문 신청\n\n▶ ( 서울 ) 제출처 안내 바로가기\n\n▶ ( 글로벌 ) hufsdbl@hufs.ac.kr 로 이메일 제출\n\n2. 일 정\n\n가 . 신청 기간 : 2025 년 1 월 22 일 ( 수 ) 10 시 ~ 1 월 23 일 ( 목 ) 14 시\n\n※ 안내된 기간에만 운영하므로 일정 준수할 것 ( 이후 별도 운영 계획 없음 )\n\n나 . 결과 확인 : 2025 년 1 월 24 일 ( 금 ) 14 시 , 종합정보시스템\n\n3. 신청 방법 : 종합정보시스템 → 전공 / 교직관리 ( ※ 가 . / 나 . 중 하나의 방법으로 신청 )\n\n가 . 부전공 신청 : 전공심화 + 부전공 또는 부전공 신청\n\n1) 신청 시 기존에 이수 중인 이중 / 부전공 은 자동 취소 됨 ( ※ 별도 취소 절차 없음 )\n\n2) “4. 유의 사항 ” 의 다 . 참고 하여 부전공 신청으로 인한 이수구분 변경 신청\n\n※ 이번 학기 졸업예정자 (4 학년 수료 , 졸업대기 포함 ) 는 1 월 초 까지\n\n이수구분 변경을 신청하여 졸업 학점이 누락되는 일이 없도록 해야 함\n\n나 . 이중 / 부전공 취소 ( 단일전공 희망자 ) : 이중전공 / 부전공 취소 신청\n\n1) 이중 / 부전공을 취소하는 경우 1 전공을 심화로 필수 이수 해야 함', '## [heading1] ##\n# ⑥ 세계문화예술경영전공\n\n## [paragraph] ##\n1) 전공개요 : 세계문화예술경영은 문화예술 분야의 다양한 활동에 경영의 원리를 적용하여 이론\n과 실제를 결합함으로써 전문지식과 실무역량을 고루 갖춘 문화 미디에이터(Cultural\nMediator) 양성을 목표로 함. 문화 예술 경영 분야에 관한 체계적인 교육을 받고 배출된\n문화 미디에이터는 기획, 마케팅 및 전략 수립, 교육, 조직관리, 프로그램 개발, 프로젝트\n관리 등의 역할을 수행할 수 있는 전문가로 활동하며, 해당 분야의 장기적인 비전과 정\n책, 행정, 운영방법 등을 제시함으로써 21세기 문화예술경영 분야의 가치를 창출함\n2) 이수학점 및 이수영역 (이수학점 : 2014학번 이전 54학점 / 2015학번 이후 42학점)\n\n## [table] ##\n| 구분 | 구분 | 1학기 | 2학기 | 총학점 |\n| --- | --- | --- | --- | --- |\n| 융합전공 전공교과 | 2학년 | 3~6학점 | 3~6학점 | 30학점 |\n| 융합전공 전공교과 | 3학년 | 3~6학점 | 3~6학점 | 30학점 |\n| 융합전공 전공교과 | 4학년 | 3~6학점 | 3~6학점 | 30학점 |\n| 융합전공 공통기초 | 융합전공 공통기초 | 언어와논리, 문화예술경영론, 디지털인문학입문 인지과학입문, 미디어연구방법론, 인문한국학입문 | 언어와논리, 문화예술경영론, 디지털인문학입문 인지과학입문, 미디어연구방법론, 인문한국학입문 | 30학점 |\n| 융합전공 연계기초 | 융합전공 연계기초 | 세계문화예술경영학과 ‘전공교류 교과목 현황’ 기재 과목 | 세계문화예술경영학과 ‘전공교류 교과목 현황’ 기재 과목 | 12학점 이내 |', '## [heading1] ##\n# 4) 국제교류 학점 인정\n\n## [table] ##\n| 국제교류프로그램명 | 인정학점 |\n| --- | --- |\n| 국제교류팀 교환학생/7+1파견학생 프로그램 | 최대 9학점 인정 |\n| KOTRA/해외문화홍보원/재외공관/ 학교와MOU체결기관 인턴십프로그램 | 원칙적으로 학기당 최대 6학점 인정 |\n\n## [paragraph] ##\n* 국제교류 학점 인정 및 해외 취득 성적 산정은 주임교수가 판단하여 결정함\n5) 기대효과\n\n## [list] ##\n- - 전문성과 실용성을 갖춘 콘텐츠 기획자 양성\n- - 인문학적 창의성과 외국어 능력을 바탕으로 관련 기업체 및 공공기관 진출\n- - K-Move 해외 취업 및 지역 NGO/NPO 전문 인력 공급\n\n## [paragraph] ##\n6) 문의(협력학과) : 서울캠퍼스 대학원 글로벌문화콘텐츠학과(02-2173-2936)\n\n## [footer] ##\n- 47 -']","2025년 제2학기 기말시험 일정은 다음과 같습니다:

- 2025년 12월 15일 (월요일)
- 2025년 12월 16일 (화요일)
- 2025년 12월 17일 (수요일)
- 2025년 12월 18일 (목요일)
- 2025년 12월 19일 (금요일)

정확한 일정은 학과별로 다를 수 있으니, 수업 담당 교수님께 확인하시기 바랍니다. 혹시 더 도와드릴까요?",2025년 1학기 기말시험은 6월 16일(월)부터 6월 20일(금)까지입니다.,0.9999999999,1.0,0.6666666666666666,0.0
통대에는 어떤 언어가 있어?,"['이병도 교수님은 태국어통번역학과 학과 소속입니다. 교수 직위를 맡고 있습니다. 연구실은 연구동(글로벌) 202호입니다.', '통번역대학\n\n한국외국어대학교 통번역대학은 2008년 3월 출범한 대한민국 최초의 학부과정 통역·번역학 단과대학으로 세계 각 지역의 언어와 문화적 다양성을 이해하고 소통할수 있는 진정한 글로벌 인재양성을 목표로 하고있습니다.용인에 소재한 통번역대학은 1개 학부(영어통번역학부)와 8개 학과 (스페인어, 이탈리아어, 중국어, 일본어,아랍어, 말레이·인도네시아어, 태국어통번역학과)로 구성되어 있습니다.\n\n031-330-4061', 'A1.  언어를 합리적으로 분석하고 그 지식을 활용할 수 있는 방법을 배웁\n니다. 순수 언어학 분야는 음성학, 음운론, 형태론, 통사론, 의미론, \n화용론 등이 있으며, 응용언어학 분야는 심리/신경언어학, 사회언어\n학, 전산언어학, 언어 교육 등이 있습니다.\nQ2.  언어인지과학과에 들어가려면 영어 이외의 제2외국어도 할 줄 알\n아야 하나요?\nA2.  아닙니다. 언어인지과학과의 교육은 세계의 언어학자들이 정리한 \n각 언어의 데이터를 통해 언어의 일반적인 특성을 배우는 과정이기 \n때문에 외국어 능력보다 이성적인 추론 능력을 더 필요로 합니다.', '학, 전산언어학, 언어 교육 등이 있습니다.\nQ2.  언어인지과학과에 들어가려면 영어 이외의 제2외국어도 할 줄 알\n아야 하나요?\nA2.  아닙니다. 언어인지과학과의 교육은 세계의 언어학자들이 정리한 \n각 언어의 데이터를 통해 언어의 일반적인 특성을 배우는 과정이기 \n때문에 외국어 능력보다 이성적인 추론 능력을 더 필요로 합니다.\nQ3.  고등학교에서 한국어와 영어 문법을 잘 하지 못했습니다. 그런데도 \n언어인지과학과에 진학해서 공부를 잘 할 수 있을까요?\nA3.  문제 없습니다. 언어인지과학과에 진학하면 고등학교에서의 학습 \n방법과는 달리 과학적인 관점에서 언어를 분석하기 때문에 기존의 \n문법지식이 부족하더라도 잘 할 수 있습니다.\nDept. of Linguistics and Cognitive Science\n언어인지과학과\n전화번호 031-330-4286\n홈페이지 linguistics.hufs.ac.kr\n전공소개 \n언어를 통해 인간을 이해하려는 인문과학의 하나로서 언어학은 자연과\n학적 방법론을 사용하는 ‘자연과학적’ 인문학이라고 할 수 있습니다. 현\n대 언어학의 태동 이래로 언어학은 철학을 포함한 정신과학적 방법론뿐\n만 아니라 논리학, 전산학 등의 방법론을 도입하여 인간 언어에 대한 탐\n구를 진행해 왔습니다. 이러한 언어학 연구방법론은 인공지능, 빅데이\n터 등의 키워드로 특정 지어지는 현대사회에서 다시금 강조되고, 언어(\n학)이 중요한 분야로 떠오르고 있습니다. 1987년 언어학과로 시작한 언\n어인지과학과는 어느덧 불혹의 나이에 가까워지고 있습니다. 언어가 중\n요한 역할을 하는 4차 산업혁명 시대에 우리 언어인지과학과는 이에 필\n요한 지식뿐 아니라 여러 학문들을 융합하여 활용할 수 있는 분석 능력\n을 갖춘 융합적 인재를 양성하고자 노력하고 있습니다. 시대가 요구하\n는 교육을 행하고 있는 언어인지과학과에서 쌓은 지식과 경험이 여러분\n의 인생에 도움이 되길 바랍니다.\n필요역량 및 소양 \n-  언어학은 사람의 머릿속에 들어있는 언어 능력을 명료하게 밝히는 학\n문입니다.\n-  언어학은 다양한 인문학을 탐구하는 기본적인 자세인 학문적 호기심\n을 필요로 합니다.\n-  언어기호의 형태/내용/용법에 대한 이해를 심화시키고, 인지 체계에 \n대한 통찰력을 얻고 언어를 처리하는 통계, 프로그래밍언어 등의 현대\n적 학문 도구들을 배울 수 있는 역량을 필요로 합니다.\n우리 학과(부)·전공 매력', '통번역대학\n\n한국외국어대학교 통번역대학은 2008년 3월 출범한 대한민국 최초의 학부과정 통역·번역학 단과대학으로 세계 각 지역의 언어와 문화적 다양성을 이해하고 소통할수 있는 진정한 글로벌 인재양성을 목표로 하고있습니다. 용인에 소재한 통번역대학은 1개 학부(영어통번역학부)와 8개 학과 (스페인어, 이탈리아어, 중국어, 일본어,아랍어, 말레이·인도네시아어, 태국어통번역학과)로 구성되어 있습니다.\n\n영어통번역학부 031-330-4202 / 독일어통번역학과 031-330-4206 / 스페인어통번역학과 031-330-4210 / 이탈리아어통번역학과 031-330-4214 / 중국어통번역학과 031-330-4232 / 일본어통번역학과 031-330-4234 / 아랍어통번역학과 031-330-4236 / 말레이·인도네시아어통번역학과 031-330-4238 / 태국어통번역학과 031-330-4240', '학, 전산언어학, 언어 교육 등이 있습니다.\nQ2.  언어인지과학과에 들어가려면 영어 이외의 제2외국어도 할 줄 알\n아야 하나요?\nA2.  아닙니다. 언어인지과학과의 교육은 세계의 언어학자들이 정리한 \n각 언어의 데이터를 통해 언어의 일반적인 특성을 배우는 과정이기 \n때문에 외국어 능력보다 이성적인 추론 능력을 더 필요로 합니다.\nQ3.  고등학교에서 한국어와 영어 문법을 잘 하지 못했습니다. 그런데도 \n언어인지과학과에 진학해서 공부를 잘 할 수 있을까요?\nA3.  문제 없습니다. 언어인지과학과에 진학하면 고등학교에서의 학습 \n방법과는 달리 과학적인 관점에서 언어를 분석하기 때문에 기존의 \n문법지식이 부족하더라도 잘 할 수 있습니다.\nDept. of Linguistics and Cognitive Science\n언어인지과학과\n전화번호 031-330-4286\n홈페이지 linguistics.hufs.ac.kr\n전공소개 \n언어를 통해 인간을 이해하려는 인문과학의 하나로서 언어학은 자연과', '필요역량 및 소양 \n-  외국어에 대한 학문적·실질적 관심과 더불어 인문학과 사회과학 전반\n에 대한 관심과 역량이 필요합니다.\n-  대학 진학 후 1,2학년 과정에서는 전공 언어를 중심으로 학습하며, 3,4\n학년 과정에서는 전공 지역을 중심으로 한 인문학과 지역학 심화 학\n습을 선택할 수 있습니다. 따라서 입학 전 다양한 독서 활동을 통해 외\n국어 학습 및 인문학과 지역학 심화 학습을 위한 토대를 마련한다면 \n보다 효과적인 대학에서의 전공 학습이 이루어질 수 있을 것입니다. \n-  전공어와 전공 지역에 대한 관심, 탐구 의지, 학문적 호기심을 가지고 \n특수어 전문가로 거듭날 수 있습니다.\n우리 학과(부)·전공 매력 \n-  국내 유일 특수전략어 전문가 교육과 이를 통한 자부심 획득', '학, 전산언어학, 언어 교육 등이 있습니다.\nQ2.  언어인지과학과에 들어가려면 영어 이외의 제2외국어도 할 줄 알\n아야 하나요?\nA2.  아닙니다. 언어인지과학과의 교육은 세계의 언어학자들이 정리한 \n각 언어의 데이터를 통해 언어의 일반적인 특성을 배우는 과정이기 \n때문에 외국어 능력보다 이성적인 추론 능력을 더 필요로 합니다.\nQ3.  고등학교에서 한국어와 영어 문법을 잘 하지 못했습니다. 그런데도 \n언어인지과학과에 진학해서 공부를 잘 할 수 있을까요?\nA3.  문제 없습니다. 언어인지과학과에 진학하면 고등학교에서의 학습 \n방법과는 달리 과학적인 관점에서 언어를 분석하기 때문에 기존의 \n문법지식이 부족하더라도 잘 할 수 있습니다.', '해결 방안을 함께 살펴본다.\n-  통사론: 낱말이나 구와 같은 문법 단위가 형태적/기능적으로 어떤 속\n성을 가지고 있는지, 이들이 어떻게 결합되어 보다 큰 단위인 구나 문\n장을 만드는가에 대해 알아본다. 나아가 통사론에서 기본적으로 다루\n어야 할 언어 현상을 배우고, 이를 설명하기 위해 필요한 개념을 함\n께 학습한다.', '라. 기초영역 에 개설된 기초중국어1 (중국언어문화학부, 중국외교통상학부)와 컨템포러리재패니즈(1) (일본언어문화학부, 융합일본지역학부) 교과목은 2025학년도\xa0여름계절학기에 개설될 예정이기 때문에 이번 수요조사에서는 제외되었습니다.', '필요역량 및 소양 \n-  외국어에 대한 학문적·실질적 관심과 더불어 인문학과 사회과학 전반\n에 대한 관심과 역량이 필요합니다.\n-  대학 진학 후 1,2학년 과정에서는 전공 언어를 중심으로 학습하며, 3,4\n학년 과정에서는 전공 지역을 중심으로 한 인문학과 지역학 심화 학\n습을 선택할 수 있습니다. 따라서 입학 전 다양한 독서 활동을 통해 외\n국어 학습 및 인문학과 지역학 심화 학습을 위한 토대를 마련한다면 \n보다 효과적인 대학에서의 전공 학습이 이루어질 수 있을 것입니다. \n-  전공어와 전공 지역에 대한 관심, 탐구 의지, 학문적 호기심을 가지고 \n특수어 전문가로 거듭날 수 있습니다.\n우리 학과(부)·전공 매력 \n-  국내 유일 특수전략어 전문가 교육과 이를 통한 자부심 획득\n-  세계화 시대에 국제적으로 활약하는 인재, 국가의 미래를 견인하는 인재 양성\n-  매스미디어 인터랙티브를 통한 다양한 학과 동아리 활동과 문화·예술제 개최', '방법과는 달리 과학적인 관점에서 언어를 분석하기 때문에 기존의 \n문법지식이 부족하더라도 잘 할 수 있습니다.\nDept. of Linguistics and Cognitive Science\n언어인지과학과\n전화번호 031-330-4286\n홈페이지 linguistics.hufs.ac.kr\n전공소개 \n언어를 통해 인간을 이해하려는 인문과학의 하나로서 언어학은 자연과\n학적 방법론을 사용하는 ‘자연과학적’ 인문학이라고 할 수 있습니다. 현\n대 언어학의 태동 이래로 언어학은 철학을 포함한 정신과학적 방법론뿐\n만 아니라 논리학, 전산학 등의 방법론을 도입하여 인간 언어에 대한 탐\n구를 진행해 왔습니다. 이러한 언어학 연구방법론은 인공지능, 빅데이\n터 등의 키워드로 특정 지어지는 현대사회에서 다시금 강조되고, 언어(', '에 배운 영어나 다른 제2외국어와 달라 단어 공부에 노력을 기울여\n야 합니다.\nQ2. 헝가리학과에서는 헝가리어만 배우나요?\nA2.  헝가리학과에서는 기본적으로 헝가리어를 교육합니다. 그러나 단\n순히 언어만 배우는 게 아니라 이를 바탕으로 헝가리 정치, 경제, 역\n사, 문화, 문학도 배울 수 있습니다. 위의 주요 전공과목 내용을 참\n고해 주십시오.', '외대 폴란드학과는 한국에서 폴란드어를 배울 수 있는 유일한 학과로서 \n대체불가의 독보적인 강점을 갖고 있습니다. 언어와 문학뿐 아니라 정\n치, 경제, 역사, 사회, 문화 등 지역학 전반에 걸쳐 실용적이고 전문적인 \n지식을 함양할 수 있습니다. 또한 폴란드 정부의 전폭적인 지원, 현지 대\n학들과의 활발한 교류를 통해 다양한 장학금과 현장실습의 기회를 제공\n합니다. 폴란드학과에 입학하면, 누구나 최소 한 학기는 폴란드 현지에\n서 언어를 배우고 문화를 체험할 수 있는 장학금의 혜택을 누리게 됩니\n다. 한-폴 관계는 발전 잠재력이 무궁무진하며, 방산, 원전, 2차 전지 산\n업 등 다양한 분야에서 폴란드어 전공자에 대한 수요가 급증하고 있어 \n최근 3년간 졸업생 취업률은 65%를 상회하고 있습니다.', ""문입니다.\n-  언어학은 다양한 인문학을 탐구하는 기본적인 자세인 학문적 호기심\n을 필요로 합니다.\n-  언어기호의 형태/내용/용법에 대한 이해를 심화시키고, 인지 체계에 \n대한 통찰력을 얻고 언어를 처리하는 통계, 프로그래밍언어 등의 현대\n적 학문 도구들을 배울 수 있는 역량을 필요로 합니다.\n우리 학과(부)·전공 매력 \n-  정통 언어학을 통한 인간 자체에 대한 인문학적 탐구 가능\n-  빅데이터 분석을 통한 IT, NLP 전문가 양성\n-  다양한 융합전공 교육: 법언어학, 컴퓨터언어학, 외국어교육, 언어치\n료 등\n-  국내 최고 수준의 연구능력을 갖춘 학과 교수진\n-  성적장학금, 공로장학금 지급 및 7+1파견 등의 다양한 기회\n주요 실적 \n-  한국연구재단의 '2022 우수학자' 지원사업 선정\n-  사학과, 철학과, 한국학과와 함께 디지털인문한국학연구소 공동 운영\n-  디코라(DICORA) 연구센터, 응용언어 센터, 언어와 지식처리 연구센\n터 운영\n주요 전공과목"", '그리고 토론 등의 방법으로 수업을 합니다. 철학은 크게 동양철학\n과 서양철학으로 나뉩니다. 동양철학은 분야에 따라 유가철학, 도\n가철학, 불교철학으로 구분되고, 지역에 따라 한국철학, 중국철학, \n인도철학으로 구분됩니다. 동양철학 공부를 위해서는 한문과 중국\n어, 일본어 그리고 영어를 익히는 것이 좋습니다. 서양철학은 주제\n에 따라 논리학, 인식론, 형이상학, 존재론, 윤리학, 현상학, 해석학, \n언어철학, 과학철학, 심리철학, 미학, 수사학, 논술 등으로 구분됩니\n다. 시대적으로 서양고/중세철학, 서양근/현대철학으로 구분되고 \n지역에 따라 독일철학, 프랑스철학, 영미철학 등으로 구분됩니다. \n이외에 영화와 철학, 문학과 철학, 문화와 철학 등의 응용분야를 공\n부합니다. 서양철학 공부를 위해서는 영어, 프랑스어, 독일어, 희랍\n어, 라틴어 등을 익히는 것이 좋습니다.\nQ2.  한국외국어대학교 철학과만의 특징이 있나요?', '졸업 후 진로 \n-  정부 및 공공기관: 대사관, 외교부, 국가정보원, 경찰청(외사) 등 국\n가기관 종사자, 정부 산하 공기업 및 준정부기관 종사자, 한국어 교\n원 파견 등\n-  학자 및 연구자: 대학교수, 국내외 행정 관련 연구소의 연구원, 비영리\n기구 및 국제기구 연구직 등\n-  기업체: 일반 기업체 통번역 담당, 해외영업 담당, 마케팅/해외진출 \n기획 담당\n-  창업: 중앙아시아 연계 분야 벤처 기업 창업\n-  기타: 언론기관, 금융기관, 언어 특기자 관련 전문직 등\nQ&A \nQ1.  중앙아시아학과에서는 어떤 언어들을 배우나요? 배우는 데 어렵\n지 않나요?\nA1.  중앙아시아학과에서는 국내 대학 기관 중 유일하게 우즈베크어와 \n카자흐어 정규 커리큘럼을 갖추고 있으며, 중앙아시아 공통어인 러\n시아어 강좌도 있어 학생 스스로가 선택하여 언어를 학습할 수 있습\n니다. 중앙아시아 국가의 언어가 낯선 학생들을 위해 언어별 기초 수\n업에서 문자부터 차근차근 체계적으로 가르칩니다. 이뿐만 아니라 \n한국어와 문법 체계가 유사하여 한국인이 배우는 데에 진입 장벽이 \n낮은 편입니다. 미리 우즈베크어를 공부하고 싶다면 K-MOOC 기초 \n우즈베크어 생활회화 편을 신청해 보세요.\nQ2.  중앙아시아 국가들은 한국과 어떤 협력 관계에 있나요?\nA2.  한국은 1992년 중앙아시아 국가들과 외교관계 수립 후, 2000년대 \n이후부터 중앙아시아를 중요 협력 지역으로 설정하여 협력 정책을 \n펼쳐왔습니다. 2007년 “한-중앙아 협력포럼”을 발족하여 매해 중\n앙아시아 외교장관들과 정기 회담을 통해 협력 의제 발굴 및 실천\n을 진행해 오고 있으며, 이외에도 국내에 중앙아시아와 관련하여 <\n유라시아 청년아카데미>, <유라시아 차세대 리더스 협회(EFLA)> \n등 청년이 중심이 되는 문화 교류 및 공공외교 형태로도 협력의 지\n평이 확장되어 가고 있습니다. 최근 2019년에는 한국과 우즈베키\n스탄의 관계가 ‘특별 전략적 동반자 관계’로 격상되어 중앙아시아와\n의 협력관계가 더욱 깊어지고 있습니다. 중앙아시아 국가들은 한국\n과의 협력에 매우 우호적이며, 한국의 문화, 경제, 언어 등에 대한 깊\n은 애정을 갖고 있습니다.\nQ3.  중앙아시아에 직접 갈 수 있는 프로그램에는 어떤 것들이 있나요?\nA3.  학기 중에는 7+1 프로그램과 교환학생 프로그램을 통해 중앙아시아 \n국가 내 현지 대학교에서 수학할 수 있으며, 전략지역 전문가 아너', '와 암하라(에티오피아)어, 서부는 하우사어를 중심으로 수업이 진행되\n며, 남부는 국제정치, 경제와 사회문화를 중심으로 수업이 진행됩니다. \nQ2.  아프리카를 전공하면 어떤 일을 할 수 있나요? \nA2.  아프리카를 전공한 뒤 할 수 있는 일은 학생의 의지와 관심에 달려 \n있습니다. 아프리카학부 졸업생들은 일반기업뿐 아니라 자신의 꿈\n을 살려 아프리카 관련 NGO 또는 시민단체에서 활동하기도 합니\n다. 특히 최근에 아프리카 난민과 이주민의 국내 정착이 늘어나면\n서 정부와 사회단체에서 이들을 지원하는 전문 인력의 필요성을 인\n식하고 있습니다.', '문화, 역사 등)을 쌓을 수 있는 지역학 교과목이 많이 개설되어 있습니\n다. 지역학 전공자로서 가능한 다양한 과목을 통해 진정한 중앙아시아\n를 학습하고자 하는 마음가짐이 무엇보다도 중요합니다. \n-  중앙아시아 국가들은 1991년 독립한 신생국가입니다. 중앙아시아와 \n관련된 정치·경제·역사·문학 등 다양한 분야의 서적을 읽고 기본 배경\n지식을 쌓으면 좋습니다. 특히 중앙아시아는 주변 러시아, 중국 등 주\n변 국가들과의 연관성도 높기 때문에 국제 문제에 대한 관심과 기본적\n인 시사 상식을 갖추면 학습하는 데 도움이 됩니다. \n-  입학 전 입문서로는 ‘변화하는 중앙아시아 사회와 문화’(이지은, \n2022)를 읽어보길 권합니다. 독립 이후 중앙아시아 사회가 어떤 부분\n은 유지하고 어떤 부분은 변화해가며 무엇이 오늘날 중앙아시아 사회\n를 이해하는 데 핵심이 되는지 알 수 있습니다. \n-  현지 언어를 배워보고 싶으면, 국가평생교육원의 K-MOOC에서 ‘우즈\n베크어 기초생활회화 (A1 상/하)’ 또는 사이버한국외대 평생교육원의 \n특수외국어 강좌에서 ‘우즈베크어 첫걸음(A1)’을 통해서 기본적인 우\n즈베크어 체계를 학습해볼 수 있습니다. (카자흐어는 개발 중에 있습\n니다) 언어교재로는 우즈베크어 표준교재 A1(2018), 카자흐어 표준\n교재 A1(발간 예정) 등을 추천합니다.\n우리 학과(부)·전공 매력 \n-  국내 유일 중앙아시아 전문 교수들이 중앙아시아 지역학 전문가(언어\n와 지역학 통합)를 양성하는 학과입니다. \n-  최고 수준의 다중언어(우즈베크어, 카자흐어, 러시아어) 커리큘럼 및 \n국제교류프로그램을 제공합니다. \n-  우즈베크, 카자흐 현지 교수의 전문화된 언어 교육 프로그램을 구비\n하고 있습니다. \n-  ‘특수외국어능력평가시험 우즈베크어’에 응시하면 공인된 우즈베크어 \n평가 인증서를 취득할 수 있습니다. \n-  지역학 전공자로서의 전문성을 더 강화하고자 한다면, 일반대학원 터\n키/중앙아시아/몽골학과에 진학 가능합니다.\n-  학과 관련 카카오톡 채널을 운영(한국외대 중앙아시아학과)하고 있어 \n학생뿐만 아니라 일반인들 누구도 중앙아시아에 관심이 있으면 본 채\n널을 통해 문의할 수 있습니다. \n주요 실적 \n-  특수외국어교육사업: 멘토링, 탄뎀, 대사관 인턴십, 온라인 인턴십(우\n즈베키스탄, 카자흐스탄), 다문화가정 번역 봉사 등 \n-  중앙아시아연구소 연계 운영: 시사 지역 정보 뉴스 제공, 신흥지역연', '들이 담당할 핵심분야는 의료영상시스템/바이오시스템 개발, 의료영상 \n분석을 위한 알고리즘 개발, 디지털헬스케어 시스템 구축, 의료용 로봇 \n등의 기기 개발과 관련한 설계 및 제조에 이릅니다.\nQ&A \nQ1.   바이오메디컬공학부에서는 하드웨어와 소프트웨어 중에 어떤 분야\n를 주로 배우게 되나요?\nA1.   바이오메디컬공학분야에서의 하드웨어는 진단, 치료, 웰니스기기 \n등을 포함하고, 소프트웨어는 의생명데이터, 생체(영상 또는 비영\n상)신호데이터의 분석 및 활용 등을 포함합니다. 바이오메디컬공학\n부에서는 하드웨어와 소프트웨어 분야를 함께 교육합니다. 앞으로\n는 하드웨어와 소프트웨어 분야의 융합을 통해 더 큰 가치를 창출\n할 수 있을 것으로 기대되고 있습니다. 물론, 본인의 적성에 맞추어 \n하드웨어 또는 소프트웨어 분야의 트랙으로 전공과목을 집중하여 \n들을 수도 있습니다.\nQ2.  생명정보학이라는 분야는 무엇이며 실제로 어떤 일을 하게 되나요?\nA2.  생명정보학이라는 분야는 이름에서 알 수 있듯이 의생명 데이터라\n는 정보를 분석하여 새로운 정보를 찾아내는 학문이라고 생각할 수 \n있습니다. 의생명 데이터라는 것이 단순히 DNA와 같은 유전체 데\n이터를 넘어서, DNA, RNA, Protein, microbiome (장내 미생물) \n등에 대한 연구를 포괄한다고 할 수 있습니다. 예를 들면, DNA를 분\n석하여, 유전 질환 관련 변이를 찾아내어 질병의 정확한 진단에 이\n용한다던지, 맞춤형 의료 혹은 정밀 의료라고 일컫는, 즉, 각 개인의 \ngenotype에 따른 치료법을 제시해주는 연구들이 요즘 중요시되고 \n있고, 생명정보학이 이러한 분야를 포괄한다고 말할 수 있습니다. \nQ3.  인공지능은 의료영상처리 분야에서 어떻게 활용될 수 있나요?\nA3.  MRI, CT, x-ray, ultrasound, pathology 등 다양한 종류의 의료영\n상데이터를 생성하는 과정에서도 인공지능이 적용이 될 수 있습니\n다. 인공지능기법을 적용하여 영상의 획득시간을 단축시킬 수도 있\n고, 의료영상의 품질을 관리 및 평가하거나 향상시킬 수도 있습니\n다. 또한, 기존 의료영상데이터로부터 진단에 도움이 되는 정보를 \n추출하는 데에 적용이 될 수 있습니다. 다른 측면으로는 사람의 이\n해하기 어려운 고차원 데이터에 대한 분석을 통해 새로운 정보를 효\n과적으로 추출하는 데에 활용이 될 수도 있습니다.\n글로벌캠퍼스 GLOBAL CAMPUS', '-  자연언어데이터: 현대의 빅데이터에서 중요한 역할을 하는 언어 데이\n터에 대한 이해와 이를 처리하기 위한 연구방법론을 공부하는 것을 목\n표로 한다. 기존 언어학/국어학 문법서에서 정의하는 문장의 개념, 단\n어 ~~의 개념, 수사 명사구, 고유명사, 외래어, 복합명사 등에 대한 언\n어학적 정의와 실제 온라인 언어데이터에서 나타나는 현실적 언어 단\n위들 사이의 차이점을 비교 공부한다.\n-  한국어 문법: 언어학적 관점에서 한국어의 형태론적 특성과 통사론적 \n특성을 밝히고, 이 특성을 기술하는 데에 있는 문제점들과 이에 대한 \n해결 방안을 함께 살펴본다.\n-  통사론: 낱말이나 구와 같은 문법 단위가 형태적/기능적으로 어떤 속\n성을 가지고 있는지, 이들이 어떻게 결합되어 보다 큰 단위인 구나 문\n장을 만드는가에 대해 알아본다. 나아가 통사론에서 기본적으로 다루\n어야 할 언어 현상을 배우고, 이를 설명하기 위해 필요한 개념을 함\n께 학습한다.', '한국외대 전자물리학과는 우수한 산업 및 연구 인력의 창출과 특성화 분\n야 발굴, 기획이라는 비전을 추구하고 있습니다. 우리 전자물리학과는 \n물리학 기반의 다양한 산업 분야에 종사할 인재를 위한 첨단 교육 및 특\n성화 분야의 발굴을 위한 교육과 연구를 병행하고 있습니다. 학계와 산\n업계의 연구 방향을 감안하여 인접 과학이나 공학 분야 같은 타 학문에 \n대한 지원 또한 수행하고 있습니다. 현재 우리 학과의 동문들은 국내외 \n대학의 교수진부터 기초과학, 전기, 원자력, 국방 분야 연구원, 반도체와 \n디스플레이 관련 산업체의 연구개발을 주도하는 핵심 인재로서 그 역\n량을 인정받고 있습니다. 특히 언어가 강점인 본교의 특성을 살릴 수 있\n다는 점은 국제 감각을 겸비한 과학기술자 양성에 커다란 시너지를 발\n휘하고 있습니다. 한국외대 전자물리학과는 21세기 첨단 산업의 주역이 \n되고자 하는 당신의 꿈을 이루어 줄 것입니다. \n필요역량 및 소양 \n-  물리학은 자연에 대한 물리적인 탐구를 하는 것이고 우리 학과는 그중\n에서도 전자와 관련된 움직임에 초점을 맞추고 있기에 평소에 자연에 \n대한 호기심을 가지는 것이 좋을 것입니다. \n-  자연을 관찰하고 이로부터 논리적인 과정을 거치는 것이 필요하기에, \n평소에 논리적으로 생각하는 연습을 하면 좋습니다. \n-  평소에 주위에서 볼 수 있는 일상적인 일이라도 중간마다 그 과정을 \n한 단계씩 넘어갈 때 논리적인 절차를 거쳐서 전개되어 가는지를 생각\n해보는 것은 좋은 습관이 될 것입니다. \n-  또한 전자가 움직여서 작동하는 주위의 전자기기의 작동 원리나 최신 \n동향에 대해 관심을 기울이면 추후에 도움이 될 것입니다. \n-  정성적인 면뿐만 아니라 정량적인 면을 탐구해야 하기에 이에 기본이 \n되는 수학적 교양과 수학적 능력을 키워놓는다면 추후에 진학하여 공\n부할 때 큰 도움이 될 것으로 생각됩니다.\n우리 학과(부)·전공 매력 \n-  일반 물리학과와는 다르게 전자와 빛에 초점을 맞춘 전자물리학과 \n-  반도체, 디스플레이와 같은 첨단 산업 인재 대다수 배출\n-  공기업, 공공기관에도 수많은 인재 배출 \n-  동문 졸업 선배들과의 활발한 교류 및 동문 선배들의 교외 장학금 지원\n주요 실적 \n-  산하 기관으로 산화물 연구센터와 복잡계 연구센터 운영\n주요 전공과목 \n-  일반물리: 물리학과에서 배우는 개념들의 기본이 되는 과목으로, 이', '항과 연결하기\n-  Finance 스터디: AI를 기본으로 Finance을 탐구하는 동아리 활동\n슬기로운 대학생활 \n1학년  기초교양 위주로 수업을 듣고, 수학, 통계학을 수강하게 됩니다. \n여러 교양서적을 많이 읽고 영어 능력을 키우면 전공 공부에 도\n움이 많이 됩니다. \n2학년  본격적으로 전공 수업을 듣게 됩니다. 수학과 통계학에 대한 깊\n이 있는 이론과 실습 수업을 수강하여 데이터를 분석하는 과정도 \n익히게 됩니다.\n3학년  AI와 관련된 다양한 전공심화 과목들을 수강하고 졸업 프로젝트\n를 위한 분석을 시작하게 됩니다.\n4학년  Finance & AI 캡스톤연구 및 현장실습을 통해 실무 능력을 함양\n합니다.\n졸업 후 진로 \n-  개발자: AI와 관련된 분야의 개발자로 네이버, 카카오, 쿠팡, 배달의 \n민족 등\n-  금융회사: 금융관련 회사, 은행, 증권사, 보험사, 상호저축은행 등\n-  기업체: AI 기술과 데이터 분석 기술이 필요한 일반 회사 및  벤처기업 \n-  기타: 연구소, 대학교수 등\nQ&A \nQ1. 무엇을 배우고 추후 어떤 일을 하는지 궁금합니다.\nA1.  AI융합대학 내 학부로서 가장 근저에 있는 것이 AI와 관련된 분야\n로 생각할 수 있습니다. AI와 관련된 교과과정을 우선적으로 배우게 \n될 것으로 여겨집니다. 졸업 후 진로 역시 AI와 관련된 분야로 가지 \n않을까 합니다.\nQ2.  금융 분야 학습과 AI 학습 중 중점이 어느 쪽인지와 비율은 얼마나 \n되는지 알고 싶습니다.\nA2.  현재 계획 중인 교과과정은 AI 학습에 많은 비중이 실려 있습니다. \n그렇지만 금융 학습과 AI 학습 중 상대적인 비중은 정해지지 않았\n습니다.', '슬기로운 대학생활 \n1학년  경영학원론, 경제학개론, 통계학 등 전공기초 위주로 수업을 들\n으며 금융이론 학습을 위한 준비를 하는 동시에 외국어능력을 키\n웁니다. \n2학년  금융시장론, 재무관리, 투자론 등 본격적인 전공 수업을 듣게 됩\n니다. 파이썬을 활용한 금융통계실습을 통해 데이터 분석의 기초\n를 다루는 동시에, 국제재무, 국제경영론을 공부하며 무역학의 \n기초도 쌓습니다.\n3학년  파이낸스어낼리틱스, 파생금융상품론 등으로 심화된 금융이론\n을 학습하거나 무역경영, 무역실무 등의 교과목으로 무역학에 대\n한 심층적 이해를 확립합니다. \n4학년  금융리스크관리, 고급비즈니스어낼리틱스, 경영분석, 캡스톤디\n자인을 통해 공부하며 지금까지 쌓아온 금융지식으로 실질적인 \n분석 능력을 함양합니다. \n졸업 후 진로 \n국제금융학과 졸업생들은 경영학과 무역학에 대한 탄탄한 이론과 실무 \n지식 및 현장학습을 바탕으로 학계와 연구소, 일반 기업체, 무역 관련 업\n체, 보험, 은행, 투자신탁, 증권 등의 금융권 전반, 공인회계사, 관세사, \n세무사 등의 전문직, 국내외 관련 대학원 진학과 더불어 공무원, 글로벌\n기업, 벤처기업 및 창업 등 다양한 분야로 진출할 수 있습니다.\nQ&A \nQ1. 국제금융학과에서는 주로 어떤 과목들을 배우나요?\nA1.  국제금융학과에서는 경영, 금융, 무역의 크게 세 분야에 대하여 집\n중적으로 공부하게 됩니다. 주요 전공과목으로 금융시장론, 재무관\n리, 투자론, 파이낸스어낼리틱스 등이 있습니다.\nQ2. 국제금융학과에 입학하려면 수학을 잘해야 하나요?\nA2.  물론, 학과 특성상 수학 및 통계학 지식을 필요로 합니다만, 입학한 \n후에 경영수학, 통계학 등의 과목을 통해 차근차근 배워나가게 되\n므로 크게 걱정할 필요는 없습니다. \n글로벌캠퍼스 GLOBAL CAMPUS\n자연과학대학\n수학과 32\n통계학과 34\n전자물리학과 35\n환경학과 36\n생명공학과 37\n화학과 38\nCOLLEGE OF\nNATURAL SCIENCES', '기업\t종사자\t등\n-\t\t학자\t및\t연구자:\t대학교수,\t국내\t국·공립\t기업\t연구소\t및\t국외\t관련\t연\n구기관의\t연구원\n-\t\t비영리기구\t및\t국제기구\t연구직\t등\n-\t\t기업:\tESG경영\t관련\t일반\t기업체\nQ&A \nQ1.\t기후변화융합학부는\t환경학과에서\t변경된\t것인가요?\nA1.\t\t환경학과와\t별도로\t기후변화융합학부가\t신설되었습니다.\t기후변화\n융합학부는\t에너지와\t기후변화\t정책\t및\t관련\t국제협력\t분야에서\t기\n후변화\t대응\t산업과\t연구를\t선도할\t융합인재를\t양성하는\t것에\t목표\n를\t두고\t있습니다.\t독립학부로서\t다소\t많은\t학생을\t모집하고\t있기\t때\n문에\t관심\t있는\t학생들의\t지원을\t독려\t부탁드립니다.\nQ2.\t\t수학\t성적이\t다소\t낮은\t편인데,\t기후변화융합학부에\t지원해도\t괜\n찮을까요?\nA2.\t\t어떤\t전형을\t선택하느냐에\t따라\t조금씩\t차이가\t있을\t것\t같습니다.\t\n학생부종합전형을\t염두해\t둔\t질문이라면,\t정량적인\t수치로\t나타나\n는\t교과성적\t외에\t학업역량을\t보여줄\t수\t있는\t사례들,\t그동안\t학교\n생활\t중\t해왔던\t기후변화와\t관련된\t주제탐구,\t관심의\t확장\t등을\t보\n여줄\t수\t있다면\t좋은\t평가로\t연결될\t수\t있습니다.\t학생부\t종합전형\n에서는\t지원자의\t학업역량을\t단순히\t교과성적\t수치로만\t판단하지\t\n않으며,\t교과성적을\t확인할\t때에도\t과목선택/이수단위/성취도\t등\n을\t다각적으로\t고려하여\t평가합니다.\t더불어\t교과성적\t외에\t지원자\n의\t학업역량을\t판단할\t수\t있는\t근거들이\t있다면\t충분히\t좋은\t평가\n를\t받을\t수\t있습니다.\nQ3.\t\t신설모집단위와\t관련하여\t모집단위별로\t이수해야하는(권장하는)\t\n진로선택과목이\t있을까요?\nA3.\t\t개별\t고등학교의\t과목개설현황이\t다를\t수\t있고,\t학생의\t수업선택\t자\n율권을\t보장하기\t위해\t모든\t모집단위에서\t필수로\t이수해야하는\t과\n목을\t지정하지\t않았습니다.\t진로탐색\t과정에\t맞춰\t자유롭게\t선택하\n고\t이수해도\t무방합니다.\nQ4.\t\t신설모집단위로\t입학하는\t학생들도\t동일하게\t캠퍼스\t구분없이\t이\n중전공이\t가능하나요?\nA4.\t\t기본적으로\t캠퍼스\t구분\t없이\t이중전공\t이수가\t가능합니다.\t다만,\t\n학과별로\t제한이\t있을\t수\t있으니\t추후\t한국외국어대학교\t학사공지\n에서\t관련\t정보를\t반드시\t확인하시기\t바랍니다.', '-  금융: 금융권 공기업, 은행, 증권, 투자회사\nQ&A \nQ1.  그리스어, 불가리아어를 전혀 몰라도 입학할 수 있나요?\nA1.  모든 신입생은 알파벳부터 공부하기 시작합니다. 알파벳부터 시작\n해서 외국인과 내국인 교수님이 작문, 문법, 회화, 독해, 통·번역, 실\n무 언어 등으로 나누어 수업을 진행합니다. 학년이 올라감에 따라 \n다양한 과목을 통해 어학 능력을 향상하고 영화, 드라마, 유튜브 등\n을 통해 재미있게 공부할 수 있습니다. 수업뿐만 아니라 선후배들이 \n서로 교류하는 스터디그룹 활동을 구성하여 방학 중에도 보충, 심화 \n학습을 할 수 있습니다. 그리고 현지에서 어학연수를 통해 그리스어\n와 불가리아어를 배울 수 있습니다.\nQ2.  그리스·불가리아학과에서는 그리스어와 불가리아어를 둘 다 배우\n는 것인가요?\nA2.  두 언어 중 하나를 선택하면 됩니다. 입학 직후, 전공 설명회를 듣고 \n본인의 관심과 희망에 따라 그리스학 또는 불가리아학을 직접 선택\n합니다. 그리스학 전공생과 불가리아학 전공생 모두 원하는 수업을 \n수강할 수 있도록 언제나 강의실의 문은 열려있습니다.\nQ3.  졸업 후 어떤 분야로 진출할 수 있나요?\nA3.  졸업 후에는 그리스나 불가리아에 소재한 국내 대기업의 현지법\n인, 무역 통상 관련 기관이나 기업으로 취업이 용이합니다. 또한 양\n국 주재 대사관 또는 국가공무원, KOTRA, 상공회의소 등으로 진로\n를 정할 수 있습니다. 각 기업에서는 한국에 유일하게 존재하는 그\n리스·불가리아학과를 졸업한 것에 좋은 인상을 가지고, 도전정신을 \n높이 삽니다. 교육이나 연구 분야에서는 국내외 대학교 교수, 유럽 \n지역 문화, 외교 안보 분야 및 에너지 분야에 연구원으로 진출할 수 \n있습니다. 이외에도 국내 유수의 금융기관, IT기업, 항공해운기업, \n언론 방송 분야에서 활동할 수 있습니다. \nQ4.  그리스·불가리아학과에 대한 자세한 정보를 얻을 수 있나요?\nA4.  학과 홈페이지(gb.hufs.ac.kr), YouTube 채널 “한국외대 그리스불\n가리아학과” 등에서 생생한 학과 소식을 확인할 수 있습니다.\nDept. of Central Asia Studies\n중앙아시아학과\n전화번호 031-330-4716\n홈페이지 centralasia.hufs.ac.kr\n전공소개 \n중앙아시아학과는 중앙아시아 5개국(우즈베키스탄, 카자흐스탄, 키르', '-  매 학기 성적 우수자 장학금 지급\n-  교수-학생, 졸업생-3·4학생 멘토링 프로그램 운영\n-  본교 석·박사과정 진학 시 장학생 우선선발 등(본교 내규에 따름)\n학과(부) 행사 및 동아리 활동 \n-  홈커밍 데이: 재학생과 졸업생 선배님들과의 친목 활동\n-  학회: 관심 있는 분야를 연구, 공부\n-  멘토링: 성적이 우수한 학생을 멘토로 삼아 진행하는 스터디\n-  HPC: 학부생이 주도하는 물리학에 관련된 컨퍼런스\n슬기로운 대학생활 \n1학년  기초교양 위주로 수업을 듣고, 일반물리와 일반물리실험 1,2를 \n수강하게 됩니다. 여러 교양서적을 많이 읽고 영어 능력을 키우\n면 전공 공부에 도움이 많이 됩니다.\n2학년  본격적으로 전공 수업을 듣게 됩니다. 이론과 실험 수업을 수강하여 \n실험 데이터를 직접 만들어내고 분석하는 과정도 익히게 됩니다.\n3학년  물리에 관련된 다양한 전공 심화 과목들을 수강하고 나아가 전공 \n수업뿐 아니라 진로 탐색을 위한 여러 교육과 공정실습을 수강하\n는 것이 필요합니다.\n4학년  졸업논문 작성을 위한 실험 및 졸업시험 공부를 하며 필요에 따라 \n관심 분야와 관련된 연구실에서 학부연구원 혹은 석·박사 과정을 \n통해 실무적인 다양한 실험과 논문 작성에 참여할 수 있습니다.\n졸업 후 진로 \n-  기업체: 전자 산업체(반도체, 디스플레이, 등), 소재 산업체(반도체, \n이차전지)\n-  연구개발 분야 전문직: 국·공립 및 기업 연구소, 학교 등 전문직\n-  학계 및 연구원: 국내외 대학원 진학 후 대학교수 및 연구소 연구원\n으로 진출\n-  기타: 변리사(재료와 관련된 특허 소송 등을 담당)\nQ&A \nQ1. 전자물리학과에 입학하려면 물리를 잘해야 하나요?\nA1.  전자물리학과는 단순히 물리를 잘하는 학생보다는 논리적인 사고방\n식과 자연과 물리에 대한 지적 호기심, 진지한 탐구 자세, 배움에 대\n한 열정, 융복합적 사고를 가진 학생을 선호합니다.\nQ2.  전자물리학과가 순수 물리학과 (공대)반도체학과와는 어떤 점에서 \n차이가 나는가요?\nA2.  전자물리학과는 입자물리학 분야보다는 고체물리와 광학의 기반\n이 되는 분야를 공부하고 물리적인 기초를 강조한다는 측면에서 차\n별점이 있습니다.', '크로아티아학과에 진학할 수 있을까요?\nA1.  1학년 입학과 함께 ‘문자(알파벳)’부터 기초 전공어를 학습합니다. \n문법, 작문, 번역, 회화 등의 집중 어학프로그램을 통해 2학년을 마\n치면 기본적인 회화를 할 수 있을 정도의 실력을 기를 수 있습니다.\nQ2.  세르비아·크로아티아어를 배우기 어렵나요?\nA2.  크로아티아에서는 라틴문자, 세르비아에서는 라틴문자와 키릴문자\n를 사용합니다. 30개의 자모음이 각각 하나의 음가를 갖기 때문에 \n읽고 쓰기가 그 어떤 외국어보다 쉽습니다.\nDept. of Greek Studies and Bulgarian Studies\n그리스·불가리아학과\n전화번호 031-330-4715\n홈페이지 gb.hufs.ac.kr\n전공소개 \n대체 불가능한 특별한 인재가 되는 선택! 그리스·불가리아학과입니다. \n우리 학과는 국내 최고의 그리스학 및 불가리아학 전문 교육 기관으로, \n한국-그리스, 한국-불가리아를 넘어서 유럽과 지중해, 흑해 지역 전문\n가의 꿈을 실현할 수 있는 국내 유일의 학과입니다. 그리스·불가리아학\n과는 언어와 지역학을 바탕으로 글로벌 지역 데이터 분석전문가, AI 번\n역 및 메타버스 VR 전시 전공 수업 등 시대의 변화에 맞는 교육과정을 \n운영하고 있습니다. 그리스·불가리아학과에서는 글로벌 무대에서 그리\n스와 불가리아의 전문가로 성장하기 위한 여러분의 도전을 환영합니다. \n그리스는 서양 문명의 요람이자, 서양 언어와 학문, 문화의 뿌리입니다. \n서양 언어의 문자를 가리키는 알파벳은 그리스어의 알파(α)와 베타(β)\n에서 유래하였습니다. 기원전 8세기부터 사용된 그리스 알파벳은 모든 \n서양 언어에 영향을 주었습니다. 그래서 많은 수의 그리스어 어휘가 라\n틴어, 영어, 독일어, 프랑스어, 러시아어 등에 존재하며, 그리스어에서 \n유래한 학술어나 전문용어는 한국어를 비롯하여 전 세계에서 널리 사용\n됩니다. 그리스학 전공자는 서양 문화의 정수인 그리스의 언어와 역사, \n문화 등을 배움으로써 AI 시대에 부응하는 인간 고유의 인문학적 상상\n력을 겸비한 글로벌 지역 전문가가 될 수 있습니다. 불가리아는 발칸반\n도와 흑해 연안 지역의 중심 국가로, 부상하는 아시아와 유럽을 잇는 교\n두보이자 동유럽의 허브입니다. 불가리아어는 슬라브어의 근간이 되는 \n언어로, 오늘날 러시아를 비롯한 전 세계의 많은 국가에서 약 2억 5천\n만 명이 사용하는 키릴문자는 9세기경 불가리아에서 만들어졌습니다.', ""과의 협력에 매우 우호적이며, 한국의 문화, 경제, 언어 등에 대한 깊\n은 애정을 갖고 있습니다.\nQ3.  중앙아시아에 직접 갈 수 있는 프로그램에는 어떤 것들이 있나요?\nA3.  학기 중에는 7+1 프로그램과 교환학생 프로그램을 통해 중앙아시아 \n국가 내 현지 대학교에서 수학할 수 있으며, 전략지역 전문가 아너\n스 프로그램을 통해 해외 연수뿐 아니라 현지에서의 해외인턴도 지\n원하고 있습니다. 또한 자비유학과 방학 중에 다녀올 수 있는 단기 \n어학연수 프로그램을 통해 자유롭게 선택하여 다녀올 수 있습니다.\nQ4.  중앙아시아학과에 대한 궁금증이 있다면 어디에 물어볼 수 있나요? \n학과 소식을 접할 수 있는 방법이 있나요?  \nA4.  카카오톡에서 '한국외대 중앙아시아학과'를 검색하여 학과 관련 궁\n금증 및 문의사항을 해결할 수 있습니다. 학과 소식은 네이버 밴드\n에서 '한국외대 중앙아시아학과'에 가입하여 학과 최신 소식을 얻을 \n수 있습니다. 만일 우즈베크어 관련한 학습 기회나 체험 기회 등에 \n대한 정보가 필요하면 네이버 밴드 ‘특수외국어교육진흥사업 우즈\n베크어’에 들러보세요~ \nDivision of African Studies\n아프리카학부\n전화번호 031-330-4242\n홈페이지 hufsafrica.hufs.ac.kr\n전공소개 \n아프리카학부는 국내 유일의 아프리카 관련 고등교육기관입니다. 1983\n년 스와힐리어과에서 시작해 현재까지 40년의 역사를 갖고 있는 아프\n리카학부는 스와힐리(Swahili)어 외에도 하우사(Hausa, 서아프리카)와 \n암하라(Amhara, 에티오피아) 등 아프리카의 주요 언어를 교육하고 있\n습니다. 세 언어는 모두 정부에서 지정한 국가전략 언어에 포함되어 있\n습니다. 스와힐리어과는 1998년 아프리카어과, 2008년에는 아프리카\n학부로 체제를 확장해 주요 아프리카어를 바탕으로 역사학, 문학, 정치\n학, 국제관계학, 경제학, 인류학, 개발학 등 아프리카 대륙을 이해하기 \n위한 필수 교과목을 개설해 아프리카에 관심있는 학생들의 지적 소양을 \n넓혀주고 있습니다. 본 학부 교수진은 아프리카 현지 대학뿐 아니라 영\n국과 미국, 유럽과 일본 등에서 박사학위를 받은 우수인력들입니다. 교\n수진과 아프리카에 열정을 갖고 있는 학생들이 시너지 효과를 일으키고 \n있어 학생들의 만족도를 높여주고 있습니다. \n필요역량 및 소양 \n우리 사회와 교육체계 안에서 아프리카에 대한 인식과 인지도가 떨어지"", '-  기타: 대학원 진학, 유학 등을 통해 학문후속세대로 성장할 수 있습\n니다.\nQ&A \nQ1.  AI데이터융합학부는 기존 컴퓨터공학부나 통계학과와 어떻게 다\n른가요?\nA1.  융합학부로서의 정체성을 추구합니다. 기존 유관학과(부)들은 해당 \n전공영역에서의 전문성을 강조하지만, AI데이터융합학부는 AI설계\n프로젝트를 반드시 한국외대에 특성화된 AI+X융합모듈에 연계해 \n이수토록 함으로써 차별화를 추구합니다.\nQ2.  어떤 방식으로 융합학문을 공부하게 될까요?\nA2.  AI데이터융합학부 및 유관학과 교수진으로 구성된 학부운영위원회\n에서 지정한 융합모듈을 12학점 이상 수강하게 됩니다. 융합모듈은 \n한국외대 내 다양한 전공영역(전략언어, 인문, 경상, 문화산업, 바이\n오, 반도체공학 등)의 학과에서 제공합니다. \nDivision of Finance & AI\nFinance & AI융합학부\n전화번호 미정\n홈페이지 aifinance.hufs.ac.kr\n전공소개 \nFinance & AI융합학부는 이름 그대로 융합학부입니다. AI 전공 지식\n을 기반으로 하여 Finance 전공 지식을 응용하는 것이 Finance & AI\n융합학부의 목표입니다. Finance & AI융합학부는 AI와 Finance에 대\n한 융합적 이해를 심화시키는 융합형 인재를 길러내고 있습니다. 앞으\n로의 사회에서 가장 필요한 AI 능력을 Finance 분야에 적용하기 위해 \n비판적 사고력, 분석력, 창의력과 표현력, 응용력을 키우는 것을 교육 목\n표로 하는 본 학부는 4차 산업혁명이 촉발한 변화의 물결 속에서 세계\n를 이끌어갈 융합형 지식인을 양성하고자 합니다. 프로그램 코딩과 통\n계학을 AI 전공 지식으로 전환하여 Finance와의 접점을 통해 가르치\n는 본 학과의 커리큘럼은 국내 대학에서 가장 다양한 분야를 융합하여 \nAI 코딩 능력 함양에서 출발하여 Finance 분야로 폭넓은 실용적 적용 \n지식을 쌓을 수 있습니다. 졸업 후 AI 산업 분야, 빅 데이터 분석 분야, \nFinance 분야 등 다양한 영역으로 뻗어나갈 수 있는 마중물이 되고자 \n노력하고 있습니다. \n필요역량 및 소양 \n-  Finance & AI 분야는 융합의 여왕이라 불릴 만큼 서로 다른 두 분야\n가 융합된 학문입니다. \n-  AI를 체계적으로 공부하기 위해 필요한 전공 역량은 프로그래밍 능력, \n수학 지식, 통계 지식, 기계학습, 데이터 베이스, 클라우드에 대한 지', '그리고 토론 등의 방법으로 수업을 합니다. 철학은 크게 동양철학\n과 서양철학으로 나뉩니다. 동양철학은 분야에 따라 유가철학, 도\n가철학, 불교철학으로 구분되고, 지역에 따라 한국철학, 중국철학, \n인도철학으로 구분됩니다. 동양철학 공부를 위해서는 한문과 중국\n어, 일본어 그리고 영어를 익히는 것이 좋습니다. 서양철학은 주제\n에 따라 논리학, 인식론, 형이상학, 존재론, 윤리학, 현상학, 해석학, \n언어철학, 과학철학, 심리철학, 미학, 수사학, 논술 등으로 구분됩니\n다. 시대적으로 서양고/중세철학, 서양근/현대철학으로 구분되고 \n지역에 따라 독일철학, 프랑스철학, 영미철학 등으로 구분됩니다. \n이외에 영화와 철학, 문학과 철학, 문화와 철학 등의 응용분야를 공\n부합니다. 서양철학 공부를 위해서는 영어, 프랑스어, 독일어, 희랍\n어, 라틴어 등을 익히는 것이 좋습니다.\nQ2.  한국외국어대학교 철학과만의 특징이 있나요?\nA2.  우리 한국외국어대학교 철학과의 특성을 다른 대학교와 비교해 볼 \n때, 철학을 제1전공으로 하면서 세계 모든 나라의 언어를 제2전공\n으로 하는 것이 가능하기 때문에 세계 어떤 문화권 철학도 공부할 \n수 있는 장점이 있습니다. 그래서 유학을 희망하는 학생들에게 유\n리합니다. 또한, 어학 이외에도 언론, 상경, 사회, 이공계열을 자유\n롭게 부전공, 제2전공 및 복수 전공으로 하여 철학적 사고력을 바\n탕으로 다른 전공에서 실력을 발휘하여 다양한 분야에 진출할 수 \n있습니다. 1988년 교직 과정 인가 이후 많은 동문이 교사 자격증\n을 취득하고 학교 선생님을 하고 있으며, 또 2007년 논술 교육인\n증 프로그램 실시 이후 많은 학생들이 이 자격을 동시에 취득하고 \n졸업하고 있습니다. 특히 논술 교육인증 프로그램은 국내 최초로 \n실시하여 앞으로 MEET, LEET 및 각종 공무원 시험에서 실시되는 \n논술 및 추리논증 시험을 대비하는 데에도 유리합니다.\nQ3.  철학과를 졸업하면 무엇을 하나요?\nA3.  철학과 졸업생들은 전공 공부를 통해 사물을 종합적으로 바라보면\n서도 예리하게 분석하는 안목 그리고 창의적 사유력을 기르게 되\n기 때문에 교직을 비롯하여 언론계, PD, 작가 등으로 많이 진출하\n였으며, 기타 일반 기업체, 금융기관, 국가기관, 영화계, 컴퓨터프\n로그래밍 등 매우 다양한 분야에 진출하고 있습니다.', '4학년  전공심화과목을 수강하고, 본인 진로와 관련된 강좌를 집중적으로 \n이수합니다. 학과 전임교수의 지도하에 졸업논문을 작성합니다. \n졸업 후 진로 \n-  정부 및 공공기관: 국공립 박물관의 학예직공무원, 국가기록원 및 지\n자체·대학역사관의 기록연구사, 공무원 등\n-  교육 및 연구: 대학교수, 역사교사, 역사문화 관련 연구소 및 박물관\n의 큐레이터 등\n-  기업체: 일반기업체 및 벤처기업 회사원\n-  기타: 문화예술종사자, 프로그래머 등\nQ&A \nQ1.  역사학을 공부하려면 암기력이 중요한가요?\nA1.  꼭 그렇지만은 않습니다. 역사학은 사료를 검증, 분석하고, 추론하\n면서 역사의 지속과 변화를 탐구하는 학문입니다. 우리 사학과에서 \n공부하면서 이러한 학술적 능력과 함께 창의력을 체계적으로 함양\n할 수 있습니다.\nQ2.  사학을 공부하고 졸업하면 순수한 학술연구 외에 전공 관련해서 \n어떤 일을 할 수 있나요?\nA2.  적지 않은 졸업생들이 기록연구사, 역사교사, 학예연구원 등으로 \n활발하게 활동하고 있습니다. 최근에는 역사콘텐츠의 중요성이 제\n고되면서, 문화예술, 게임분야에서 활약하는 졸업생들도 늘어나\n고 있습니다. \n학과(부) 행사 및 동아리 활동 \n-  동사무소(동양철학): 공자, 맹자 등 특정 철학자의 사상에만 국한되지 \n않고, 전반적인 동양 철학사의 흐름과 이에 따른 사상적 차이들을 학\n습하며 이에 대한 의견을 학회원들끼리 토의합니다.\n-  엑스페르고(서양철학): 혼자 읽고 이해하기엔 버거운 여러 철학 고전 \n서적들을 함께 읽어나가며 자유롭게 토론합니다. 이를 통해 철학자들\n의 사유를 이해하고 비판적 시각을 통해 스스로의 철학적 사유를 기르\n는 훈련을 할 수 있습니다.\n-  앤솔로지(예술철학): 아름다움과 예술 이전의 논의들을 학습한 후 현\n대 문화를 파악하는 여러 방법들을 공부합니다.\n-  LOPES(서양철학사&데이터분석): 영어 원문 번역방식의 서양철학사 \n스터디와 데이터 분석을 통해 통계분석용 프로그램 및 다양한 데이터 \n분석기법과 머신러닝 같은 기술 등을 학습합니다.\n-  철학인의 밤: 학생들의 학술 세미나 및 친목 활동 \n-  철학과 한마당 행사: 연말 중 시행되는 철학과 선배, 교수님들이 함\n께하는 행사로 다양한 이벤트 등과 함께 선배, 교수님과 담소를 나누\n는 친목 활동 \n-  한국외대 총장배 토론대회: 2008년도부터 시작된 토론대회로 인문', '법, 다변량분석, 데이터마이닝, 베이지안통계학, 표본조사론 등 \n실무에 활용되는 통계학의 세부분야를 심화 학습 합니다.\n4학년  통계적기계학습, 데이터시각화, 데이터사이언스세미나, 데이터\n어낼리틱스세미나 등 실무에 밀접한 과목을 수강하고, 배정된 지\n도교수와 졸업논문 작성을 통해 실무 능력을 함양합니다.\n졸업 후 진로 \n-  정부/공공기관 및 연구소 : 보건복지부, 통계청, 식약청, 백신연구소 \n및 대학연구소\n-  진학 및 연구 : 국내/해외 대학원 석박사, 대학교수, 일반대학원, 의학\n전문대학원, 금융전문대학원 등 다양한 분야로 진학\n-  기업체 : 금융분야(은행, 보험회사, 증권회사 등), 의학분야(제약회사, \n병원), IT분야(통신사, 게임업체) 및 대기업 및 CRM 컨설팅 회사 등\n-  기타 : 다양한 산업분야에서 통계분석전문가, 데이터사이언티스트, 빅\n데이터전문가, 데이터엔지니어 등으로 활약\nQ&A \nQ1. 수학에 자신이 없는데 통계학과에서 잘 공부할 수 있을까요?\nA1.  학과 교육과정을 이수하는 과정에서 통계학 공부에 필요한 기초 수\n학 교육을 체계적으로 받게 되기 때문에 크게 염려할 필요는 없습니\n다. 아무래도 수학을 잘하면 도움이 되겠지만 통계학의 학문 특성상 \n수학 그 자체보다는 주어진 문제를 수리적 감각을 통해 해결 방안을 \n도출해 내는 역량이 중요합니다.\nQ2.  통계학과에 입학한 후 이중전공 또는 부전공으로 선택하면 좋은 학\n과를 추천해 주세요.\nA2.  통계학은 모든 학문 분야와 접점을 가지고 있습니다. 따라서 본인\n이 진지하게 관심을 두고 있고 데이터를 활용하는 분야의 학과라면 \n어떤 학과를 선택하더라도 좋은 선택이 될 것입니다. 입학 후 신입\n생 세미나 또는 학과 교수님과의 상담을 통해 보다 나은 의사 결정\n을 할 수 있을 것입니다.\nDept. of Electronic Physics\n전자물리학과\n전화번호 031-330-4264\n홈페이지 physics.hufs.ac.kr\n전공소개 \n한국외대 전자물리학과는 우수한 산업 및 연구 인력의 창출과 특성화 분\n야 발굴, 기획이라는 비전을 추구하고 있습니다. 우리 전자물리학과는 \n물리학 기반의 다양한 산업 분야에 종사할 인재를 위한 첨단 교육 및 특\n성화 분야의 발굴을 위한 교육과 연구를 병행하고 있습니다. 학계와 산\n업계의 연구 방향을 감안하여 인접 과학이나 공학 분야 같은 타 학문에', '4학년  기후변화에 대한 실무를 접하고 다양한 실험과 논문 작성에 참여\n하여 기후변화 전문가의 자질을 갖추게 됩니다.\n졸업 후 진로 \n-  정부 및 공공기관: 정부(중앙정부와 지방자치단체) 및 정부 산하 공\n기업 종사자 등\n-  학자 및 연구자: 대학교수, 국내 국·공립 기업 연구소 및 국외 관련 연\n구기관의 연구원\n-  비영리기구 및 국제기구 연구직 등\n-  기업: ESG경영 관련 일반 기업체\nQ&A \nQ1. 기후변화융합학부는 환경학과에서 변경된 것인가요?\nA1.  환경학과와 별도로 기후변화융합학부가 신설되었습니다. 기후변화\n융합학부는 에너지와 기후변화 정책 및 관련 국제협력 분야에서 기\n후변화 대응 산업과 연구를 선도할 융합인재를 양성하는 것에 목표\n를 두고 있습니다. 독립학부로서 다소 많은 학생을 모집하고 있기 때\n문에 관심 있는 학생들의 지원을 독려 부탁드립니다.\nQ2.  수학 성적이 다소 낮은 편인데, 기후변화융합학부에 지원해도 괜\n찮을까요?\nA2.  어떤 전형을 선택하느냐에 따라 조금씩 차이가 있을 것 같습니다. \n학생부종합전형을 염두해 둔 질문이라면, 정량적인 수치로 나타나\n는 교과성적 외에 학업역량을 보여줄 수 있는 사례들, 그동안 학교\n생활 중 해왔던 기후변화와 관련된 주제탐구, 관심의 확장 등을 보\n여줄 수 있다면 좋은 평가로 연결될 수 있습니다. 학생부 종합전형\n에서는 지원자의 학업역량을 단순히 교과성적 수치로만 판단하지 \n않으며, 교과성적을 확인할 때에도 과목선택/이수단위/성취도 등\n을 다각적으로 고려하여 평가합니다. 더불어 교과성적 외에 지원자\n의 학업역량을 판단할 수 있는 근거들이 있다면 충분히 좋은 평가\n를 받을 수 있습니다.\nQ3.  신설모집단위와 관련하여 모집단위별로 이수해야하는(권장하는) \n진로선택과목이 있을까요?\nA3.  개별 고등학교의 과목개설현황이 다를 수 있고, 학생의 수업선택 자\n율권을 보장하기 위해 모든 모집단위에서 필수로 이수해야하는 과\n목을 지정하지 않았습니다. 진로탐색 과정에 맞춰 자유롭게 선택하\n고 이수해도 무방합니다.\nQ4.  신설모집단위로 입학하는 학생들도 동일하게 캠퍼스 구분없이 이\n중전공이 가능하나요?\nA4.  기본적으로 캠퍼스 구분 없이 이중전공 이수가 가능합니다. 다만, \n학과별로 제한이 있을 수 있으니 추후 한국외국어대학교 학사공지\n에서 관련 정보를 반드시 확인하시기 바랍니다.', ""네 분야 중 학생이 선택한 분야에 초점을 맞추어 강의를 듣게 됩니다.\n3학년  2학년에 수강한 분야들 중 하나 혹은 두 분야에 초점을 맞추어 수\n업을 들으면서 졸업논문 프로젝트를 위한 강의도 수강하게 됩니다.\n4학년  실습이나 연습 과목 위주로 수강하면서 졸업논문 계획서 제출, \n졸업논문 작성 및 완성본 제출을 하게 됩니다.\n졸업 후 진로 \n-  기업: 마케팅, 콘텐츠 비즈니스, 콘텐츠 기획, 해외전략기획 \n-  공기업: 관광, 민간외교, 문화교류, 전시, 기록관리 \n-  대학원: 국제대학원, 일반대학원의 한국어교육 및 한국학 관련 학과 \nQ&A \nQ1. 한국학과 학생들은 졸업 후 주로 어떤 분야로 진출하나요? \nA1.  한국학과 졸업생들은 학과에서 이수한 전공 교육에 기초하여 국내·외\n의 다양한 한국문화·한국학·한국어교육 관련 영역으로 진출하고 있습\n니다. 이를테면 학과 졸업과 동시에 '한국어교원 자격증'을 발급받아 세\n종학당과 같은 국내외 한국어 교육기관에서 한국어 선생님으로 일하고 \n있는 졸업생, 한국학 기록관리 영역으로 진출한 졸업생(기록관리사로 \n국가기관이나 공기업 취직), 한국학 관련 국내외 도서관이나 박물관에\n서 일하고 있는 졸업생, 한국 관광산업 관련 기업에 취업한 졸업생, 유\n엔과 같은 국제기구나 아리랑TV와 같은 언론 영역으로 진출한 졸업생 \n등이 있습니다. 이 모든 졸업생들은 한국의 우수한 문화를 세계에 널리 \n알리겠다는 어린 시절 자신의 꿈을 계속 현실화시켜 나가고 있습니다. \nQ2. 한국학과 입학을 위해서는 국어와 역사를 잘 알아야 하나요? \nA2.  한국학과는 한국학 관련 입문과목부터 단계적·체계적으로 커리큘럼\n을 운영하고 있습니다. 따라서 기존에 한국문화 관련 지식이 부족하더\n라도 충분히 흥미진진하게 전공과목을 수강할 수 있습니다. 게다가 한\n국학과에는 한국 문학이나 역사 관련 수업을 제외하고도 <한국미술사\n>, <한국문화와영화> 등 다양한 영역의 전공과목이 개설되어 있으므\n로 학생들은 본인의 개인적 목표와 흥미, 이중전공 제도의 활용 등을 \n통해 다채로운 한국문화 관련 세부 전공을 개척해 나갈 수 있습니다. \nQ3. 한국어 교원 자격증이 무엇인가요? \nA3.  한국어 교원 자격증은 국립국어원 주관하에 문화체육관광부에서 \n부여하는 자격증으로서 한국어가 모국어가 아닌 외국인이나 다문\n화가정을 대상으로 한국어를 가르칠 수 있는 자격증입니다. 한국학""]","통번역대학에는 다음과 같은 언어 전공이 있습니다:

1. 영어통번역학부
2. 스페인어통번역학과
3. 이탈리아어통번역학과
4. 중국어통번역학과
5. 일본어통번역학과
6. 아랍어통번역학과
7. 말레이·인도네시아어통번역학과
8. 태국어통번역학과

각 전공은 해당 언어와 문화에 대한 깊이 있는 교육을 제공하며, 글로벌 인재 양성을 목표로 하고 있습니다. 혹시 더 도와드릴까요?","한국외대 통번역대학에는 1개 학부(영어통번역학부)와 8개 학과 (스페인어, 이탈리아어, 중국어, 일본어, 아랍어, 말레이·인도네시아어, 태국어통번역학과)가 있습니다.",0.39999999998666663,1.0,1.0,0.7956065358372039
환경학과 학과장 교수님 알려줘.,"['조재창 교수 교수님은 환경학과 학과 소속입니다. 교수 직위를 맡고 있습니다. 이학박사, 서울대 학위를 가지고 있습니다. 연구분야는 환경유전체입니다. 이메일은 chojc@hufs.ac.kr입니다. 연구실은 자연대 408입니다.', '천세진 겸임교수 교수님은 환경학과 학과 소속입니다. 겸임교수 직위를 맡고 있습니다. 이학박사, 한국외국어대학교 학위를 가지고 있습니다. 연구분야는 환경학입니다. 이메일은 sjchun1003@hanmail.net입니다.', '유선정 객원강의교수 교수님은 환경학과 학과 소속입니다. 객원강의교수 직위를 맡고 있습니다. 이학박사, 한국외국어대학교 학위를 가지고 있습니다. 연구분야는 유해물질관리, 환경학입니다. 이메일은 sjrue@hanmail.net입니다.', '정태용 교수 교수님은 환경학과 학과 소속입니다. 조교수 직위를 맡고 있습니다. 공학박사, 광주과학기술원 학위를 가지고 있습니다. 연구분야는 환경공학입니다. 이메일은 tyj@hufs.ac.kr입니다. 연구실은 자연대 505-1호(https://www.aquabiomlab.com/)입니다.', '이강웅 교수 교수님은 환경학과 학과 소속입니다. 교수 직위를 맡고 있습니다. 이학박사, Rhode Island Univ. 학위를 가지고 있습니다. 연구분야는 대기화학입니다. 이메일은 gwlee@hufs.ac.kr입니다. 연구실은 백년관  811호입니다.', '이성종 겸임교수 교수님은 환경학과 학과 소속입니다. 겸임교수 직위를 맡고 있습니다. 이학박사, 한국외국어대학교 학위를 가지고 있습니다. 연구분야는 환경학입니다. 이메일은 sjlee80@hufs.ac.kr입니다. 연구실은 자연대 513호(https://hufswaters.modoo.at/)입니다.', '명예교수 강구영  교수 교수님은 환경학과 학과 소속입니다. 명예교수 직위를 맡고 있습니다. 공학박사, Utah State Univ. 학위를 가지고 있습니다. 연구분야는 수질오염입니다. 이메일은 kanggy@hufs.ac.kr입니다.', '명예교수 박갑성  교수 교수님은 환경학과 학과 소속입니다. 명예교수 직위를 맡고 있습니다. 공학박사, Utah State Univ. 학위를 가지고 있습니다. 연구분야는 유해물질관리입니다. 이메일은 mayday515151@hufs.ac.kr입니다.', '이지은 교수님은 중앙아시아학과 학과 소속입니다. 학과장 교수 직위를 맡고 있습니다. 이메일은 eurasia@hufs.ac.kr입니다.', '윤경원 교수님은 태국어통번역학과 학과 소속입니다. 교수 / 학과장 직위를 맡고 있습니다. 연구실은 연구동(글로벌) 203호입니다.', '김원명 교수님은 철학과 학과 소속입니다. 교수, 학과장 직위를 맡고 있습니다. 철학박사 학위를 가지고 있습니다. 연구분야는 한국철학, 불교철학입니다. 이메일은 wonhyoph@hanmail.net입니다. 연구실은 인문경상관 305호입니다.', '| 환경학과 | 4 | 지구환경론 | 기후변화론(1학기) | 7개 영역에서 각 1과목이상, 총 7과목/21학점 이상 이수 |\n| 환경학과 | 5 | 생물환경론 | 환경미생물학(1학기), 미생물생태학, 분자생태학방법론(2학기) | 7개 영역에서 각 1과목이상, 총 7과목/21학점 이상 이수 |\n| 환경학과 | 6 7 | 해양환경론 환경보호론 | 수생생태계(2학기) 환경화학및실험(1학기) | 7개 영역에서 각 1과목이상, 총 7과목/21학점 이상 이수 |', '이상엽 교수 교수님은 이탈리아어통번역학과 학과 소속입니다. 학과장 직위를 맡고 있습니다. 연구분야는 이탈리아 시문학 (중세 르네상스 Dante, Petrarca, 근현대 Leopardi, Montale)입니다. 이메일은 isypv@hufs.ac.kr입니다. 연구실은 어문학관 연구동 310호입니다.', '이승일 교수님은 철학과 학과 소속입니다. 조교수, 학과장 직위를 맡고 있습니다. Ph.D., Philosophy, University of Illinois at Urbana-Champaign 학위를 가지고 있습니다. 연구분야는 과학철학, 분석철학입니다. 이메일은 slees@hufs.ac.kr입니다. 연구실은 인문경상관 321호입니다.', '홍석우(Sogu Hong) 교수 교수님은 우크라이나학과 학과 소속입니다. 학과장 직위를 맡고 있습니다. 우크라이나 민속학 박사, University of Alberta, Canada 학위를 가지고 있습니다. 연구분야는 우크라이나 민속, 대중문화, 이민자 문화연구입니다. 이메일은 soguhong@hufs.ac.kr입니다. 연구실은 어문학관 434호입니다.', '| 질병 및 상해 로 인한 입원 또는 감염병 으로 인한 격 리(치료) | 법정감염병 (**질병관리청의 법정감염병에 한함) | 격리(치료) 기간 또는 감염우려 기간 | 해당 증빙서류 | 담당교수에게 증빙서류 제출 |  |\n| 졸업시험 | 졸업시험 | 졸업시험 당일 | 학과장 확인서 | 담당교수에게 증빙서류 제출 |  |\n| 수업일수 4분의 3선 후 징병에 의한 군입대 | 수업일수 4분의 3선 후 징병에 의한 군입대 | - | 입영통지서 | 담당교수에게 증빙서류 제출 |  |\n| 출산 | 출산 | 본인:20일 배우자:10일 | 본인 : 출생(출산예정)증 명서 등, 배우자 : 출생 (출산예정)증명서 및 가족관계증명서 등 | 담당교수에게 증빙서류 제출 |  |\n| 생리 | 생리 | 생리기간 (학기중 2회) | 유고결석신청서 (생리공결제) | 담당교수에게 증빙서류 제출 | ※ 자세한 사항은 학사공지사항 생리 유고 신청안내 참조 |\n| 교직과정이수자의 학교현장실습 | 교직과정이수자의 학교현장실습 | 교육실습 기간 | 교직담당자가 발급한 확인서 | 담당교수에게 증빙서류 제출 |  |\n| 졸업예정자(해당학기 졸업가능자) 로서 조기취업자 | 졸업예정자(해당학기 졸업가능자) 로서 조기취업자 | 취업기간 | 학과장 승인받은 유고결석 인정원, 재직(계약)증명서 및 4대보험가입내역 확인서 또는 이에 준하는 재직증명서류 | 입사확정 후 즉시 ￬ 유고결석인정원과 증빙서류에 대해 학과장 승인 ￬ 소속 단과대에 제출 ￬ 유고결석확인서를 발급받아 담당교수에게 제출 ￬ 수업종료 직전 취업사실에 대해 재확인 | ※ 자세한 사항은 학사공지사항 졸업예정자(해 당학기 졸업가능자)의 조기취업 유고결석 신청 안내 참조 |', '| 전자 물리학과 | 2 | 전자기학 | 전자기학및연습(1,2학기) | 7개 영역에서 각 1과목이상, 총 7과목/21학점 이상 이수 |\n| 전자 물리학과 | 3 | 양자역학 | 양자물리및연습(1,2학기) | 7개 영역에서 각 1과목이상, 총 7과목/21학점 이상 이수 |\n| 전자 물리학과 | 4 | 열및통계물리 | 열물리(1학기), 통계물리(2학기) | 7개 영역에서 각 1과목이상, 총 7과목/21학점 이상 이수 |\n| 전자 물리학과 | 5 | 파동및광학 | 광학(1학기), 레이저물리(2학기) | 7개 영역에서 각 1과목이상, 총 7과목/21학점 이상 이수 |\n| 전자 물리학과 | 6 | 전산물리 | 수리물리(1,2학기) | 7개 영역에서 각 1과목이상, 총 7과목/21학점 이상 이수 |\n| 전자 물리학과 | 7 | 현대물리학 | 현대물리학, 고체물리(1,2학기) | 7개 영역에서 각 1과목이상, 총 7과목/21학점 이상 이수 |\n| 환경학과 | 8 1 | 물리교육실험 대기오염론 | 전자물리및실험, 현대물리실험(1,2학기) 대기오염개론, 대기화학(1학기), 대기과학, 대기환경관리(2학기) | 7개 영역에서 각 1과목이상, 총 7과목/21학점 이상 이수 |\n| 환경학과 | 2 | 수질오염론 | 수질오염개론및실험(2학기) | 7개 영역에서 각 1과목이상, 총 7과목/21학점 이상 이수 |\n| 환경학과 |  |  |  | 7개 영역에서 각 1과목이상, 총 7과목/21학점 이상 이수 |\n| 환경학과 | 3 | 환경법과정책 | 환경안전및위해성평가(2학기) | 7개 영역에서 각 1과목이상, 총 7과목/21학점 이상 이수 |\n| 환경학과 | 4 | 지구환경론 | 기후변화론(1학기) | 7개 영역에서 각 1과목이상, 총 7과목/21학점 이상 이수 |\n| 환경학과 | 5 | 생물환경론 | 환경미생물학(1학기), 미생물생태학, 분자생태학방법론(2학기) | 7개 영역에서 각 1과목이상, 총 7과목/21학점 이상 이수 |', '김혜진 객원강의교수 교수님은 환경학과 학과 소속입니다. 객원강의교수 직위를 맡고 있습니다. 이학박사, 한국외국어대학교 학위를 가지고 있습니다. 연구분야는 환경 미생물 생태학입니다. 이메일은 hjinkim327@gmail.com입니다.', '이태형 교수 교수님은 환경학과 학과 소속입니다. 교수 직위를 맡고 있습니다. 이학박사, Colorado State Univ. 학위를 가지고 있습니다. 연구분야는 대기화학입니다. 이메일은 thlee@hufs.ac.kr입니다. 연구실은 자연대 503호(https://www.hufsaql.com)입니다.', '최용주 교수 교수님은 환경학과 학과 소속입니다. 조교수(환경학과 학과장, 환경과학연구소 연구소장) 직위를 맡고 있습니다. 이학박사, 한국외국어대학교 학위를 가지고 있습니다. 연구분야는 환경학입니다. 이메일은 choingjoo@hufs.ac.kr입니다. 연구실은 자연대 505호 (\ufeffhttp://arl2-hufs.xyz/)입니다.']","환경학과의 학과장 교수님은 이강웅 교수님입니다. 이강웅 교수님은 이학박사 학위를 가지고 있으며, 연구분야는 대기화학입니다. 이메일은 gwlee@hufs.ac.kr이며, 연구실은 백년관 811호에 위치해 있습니다. 

혹시 더 도와드릴까요?","환경학과의 학과장 교수님은 최용주 교수님이며, 전화번호는 '031-330-4552', 이메일은 'choingjoo@hufs.ac.kr', 연구실은 '자연대 505호'에 위치해 있습니다.",0.049999999995,0.75,0.8,0.8424681180109562
"월요일 7, 8교시에 들을 수 있는 교양 있으면 알려줘.","['제1학기 성적 열람 및 정정 일정:\n2025-06-30 (월요일)\n2025-07-01 (화요일)\n2025-07-02 (수요일)\n2025-07-03 (목요일)\n2025-07-04 (금요일)', '[언어학연구방법론] 4학년 대상 / 교수: 이해윤 / 월요일 7,8교시 / 강의실 4210호 / 학점: 2 / 전공필수 과목 아님 / 온라인강의 아님 / P/F 평가 과목 아님 / 원어강의 아님', '[세계사와한국] 전체 학년 대상 / 교수: 이수기 / 수요일 7,8교시 / 강의실 2311호 / 학점: 2 / 전공필수 과목 아님 / 온라인강의 아님 / P/F 평가 과목 아님 / 원어강의 아님\n\n[신화와종교] 전체 학년 대상 / 교수: 강미라 / 월요일 7,8교시 / 강의실 2303-3호 / 학점: 2 / 전공필수 과목 아님 / 온라인강의 아님 / P/F 평가 과목 아님 / 원어강의 아님\n\n[역사란무엇인가] 전체 학년 대상 / 교수: 서상현 / 월요일 3,4교시 / 강의실 2502호 / 학점: 2 / 전공필수 과목 아님 / 온라인강의 아님 / P/F 평가 과목 아님 / 원어강의 아님\n\n[요가경전강독] 전체 학년 대상 / 교수: 최원호 / 금요일 7,8교시 / 강의실 2313호 / 학점: 2 / 전공필수 과목 아님 / 온라인강의 아님 / P/F 평가 과목 아님 / 원어강의 아님', '[역사란무엇인가] 전체 학년 대상 / 교수: 서상현 / 화요일 7,8교시 / 강의실 2502호 / 학점: 2 / 전공필수 과목 아님 / 온라인강의 아님 / P/F 평가 과목 아님 / 원어강의 아님\n\n[윤리적사고와문제해결] 전체 학년 대상 / 교수: 김신 / 목요일 3,4교시 / 강의실 5208호 / 학점: 2 / 전공필수 과목 아님 / 온라인강의 아님 / P/F 평가 과목 아님 / 원어강의 아님\n\n[종교철학입문] 전체 학년 대상 / 교수: 조명동 / 월요일 7,8교시 / 강의실 2503호 / 학점: 2 / 전공필수 과목 아님 / 온라인강의 아님 / P/F 평가 과목 아님 / 원어강의 아님\n\n[철학으로의초대] 전체 학년 대상 / 교수: 김영걸 / 화요일 5,6교시 / 강의실 2504호 / 학점: 2 / 전공필수 과목 아님 / 온라인강의 아님 / P/F 평가 과목 아님 / 원어강의 아님', '[시사토론중국어] 3학년 대상 / 교수: 남종호 / 화요일 7,8교시 / 강의실 1309호 / 학점: 2 / 전공필수 과목 아님 / 온라인강의 아님 / P/F 평가 과목 아님 / 원어강의 아님\n\n[제자백가다시읽기] 3학년 대상 / 교수: 이은주 / 수요일 7,8교시 / 강의실 2315호 / 학점: 2 / 전공필수 과목 아님 / 온라인강의 아님 / P/F 평가 과목 아님 / 원어강의 아님\n\n[제자백가다시읽기] 3학년 대상 / 교수: 이은주 / 월요일 7,8교시 / 강의실 2315호 / 학점: 2 / 전공필수 과목 아님 / 온라인강의 아님 / P/F 평가 과목 아님 / 원어강의 아님', '[미네르바인성교육] 전체 학년 대상 / 교수: 박남용 / 목요일 5,6교시 / 강의실 2408호 / 학점: 2 / 전공필수 과목 아님 / 온라인강의 아님 / P/F 평가 과목 아님 / 원어강의 아님\n\n[분노와용서] 전체 학년 대상 / 교수: 조준래 / 수요일 7,8교시 / 강의실 2309호 / 학점: 2 / 전공필수 과목 아님 / 온라인강의 아님 / P/F 평가 과목 아님 / 원어강의 아님\n\n[사람다운삶을위한관계] 전체 학년 대상 / 교수: 박성준 / 금요일 7,8교시 / 강의실 2412호 / 학점: 2 / 전공필수 과목 아님 / 온라인강의 아님 / P/F 평가 과목 아님 / 원어강의 아님', '[실용스페인어기초다지기] 전체 학년 대상 / 교수: 이강국 / 월요일 7,8교시 / 강의실 1303호 / 학점: 2 / 전공필수 과목 아님 / 온라인강의 아님 / P/F 평가 과목 아님 / 원어강의 아님\n\n[아랍어의이해1] 전체 학년 대상 / 교수: 이계연 / 목요일 5,6교시 / 강의실 0503호 / 학점: 2 / 전공필수 과목 아님 / 온라인강의 아님 / P/F 평가 과목 아님 / 원어강의 아님\n\n[애니메이션일본어] 전체 학년 대상 / 교수: 김용미 / 금요일 3,4교시 / 강의실 2311호 / 학점: 2 / 전공필수 과목 아님 / 온라인강의 아님 / P/F 평가 과목 아님 / 원어강의 아님', '[공공브랜딩] 4학년 대상 / 교수: 이효복 / 화요일 7,8,9교시 / 강의실 0512호 / 학점: 3 / 전공필수 과목 아님 / 온라인강의 아님 / P/F 평가 과목 아님 / 원어강의 아님', '[논리학입문] 전체 학년 대상 / 교수: 정재환 / 목요일 3,4교시 / 강의실 2407-1호 / 학점: 2 / 전공필수 과목 아님 / 온라인강의 아님 / P/F 평가 과목 아님 / 원어강의 아님\n\n[동서문명교류사] 전체 학년 대상 / 교수: 이영희 / 목요일 7,8교시 / 강의실 4214호 / 학점: 2 / 전공필수 과목 아님 / 온라인강의 아님 / P/F 평가 과목 아님 / 원어강의 아님\n\n[동아시아근현대사] 전체 학년 대상 / 교수: 정일교 / 월요일 3,4교시 / 강의실 2407호 / 학점: 2 / 전공필수 과목 아님 / 온라인강의 아님 / P/F 평가 과목 아님 / 원어강의 아님', '[인문학명저산책] 전체 학년 대상 / 교수: 조준래 / 목요일 7,8교시 / 강의실 2501호 / 학점: 2 / 전공필수 과목 아님 / 온라인강의 아님 / P/F 평가 과목 아님 / 원어강의 아님\n\n[인문학의이해-문학,역사,철학] 전체 학년 대상 / 교수: 소병선 / 목요일 7,8교시 / 강의실 4411호 / 학점: 2 / 전공필수 과목 아님 / 온라인강의 아님 / P/F 평가 과목 아님 / 원어강의 아님\n\n[창의적독서와자기발견] 전체 학년 대상 / 교수: 한상효 / 월요일 3,4교시 / 강의실 2504호 / 학점: 2 / 전공필수 과목 아님 / 온라인강의 아님 / P/F 평가 과목 아님 / 원어강의 아님\n\n[한시로읽는동양의삶과미학] 전체 학년 대상 / 교수: 박남용 / 화요일 1,2교시 / 강의실 2406호 / 학점: 2 / 전공필수 과목 아님 / 온라인강의 아님 / P/F 평가 과목 아님 / 원어강의 아님', '[미네르바인문(2)읽기와토의.토론] 1학년 대상 / 교수: 양선이 / 월요일 7,8,9교시 / 강의실 2214호 / 학점: 3 / 전공필수 과목 아님 / 온라인강의 아님 / P/F 평가 과목 아님 / 원어강의 아님\n\n[미네르바인문(2)읽기와토의.토론] 1학년 대상 / 교수: 양선이 / 수요일 4,5,6교시 / 강의실 2412호 / 학점: 3 / 전공필수 과목 아님 / 온라인강의 아님 / P/F 평가 과목 아님 / 원어강의 아님\n\n[미네르바인문(2)읽기와토의.토론] 1학년 대상 / 교수: 양선이 / 목요일 4,5,6교시 / 강의실 2214호 / 학점: 3 / 전공필수 과목 아님 / 온라인강의 아님 / P/F 평가 과목 아님 / 원어강의 아님\n\n[미네르바인문(2)읽기와토의.토론] 1학년 대상 / 교수: 이정은 / 화요일 1,2,3교시 / 강의실 2408호 / 학점: 3 / 전공필수 과목 아님 / 온라인강의 아님 / P/F 평가 과목 아님 / 원어강의 아님', '[서양명작의이해와감상] 전체 학년 대상 / 교수: 김경랑 / 수요일 7,8교시 / 강의실 2301호 / 학점: 2 / 전공필수 과목 아님 / 온라인강의 아님 / P/F 평가 과목 아님 / 원어강의 아님\n\n[설득과소통의레토릭] 전체 학년 대상 / 교수: 한우섭 / 금요일 1,2교시 / 강의실 2303-2호 / 학점: 2 / 전공필수 과목 아님 / 온라인강의 아님 / P/F 평가 과목 아님 / 원어강의 아님\n\n[언어와문화(교양)] 전체 학년 대상 / 교수: 박주연 / 목요일 5,6교시 / 강의실 2402-1호 / 학점: 2 / 전공필수 과목 아님 / 온라인강의 아님 / P/F 평가 과목 아님 / 원어강의 아님\n\n[언어와현대미디어사회] 전체 학년 대상 / 교수: 윤상호 / 화요일 7,8교시 / 강의실 2307호 / 학점: 2 / 전공필수 과목 아님 / 온라인강의 아님 / P/F 평가 과목 아님 / 원어강의 아님', '[인문학명저산책] 전체 학년 대상 / 교수: 조준래 / 목요일 7,8교시 / 강의실 2309호 / 학점: 2 / 전공필수 과목 아님 / 온라인강의 아님 / P/F 평가 과목 아님 / 원어강의 아님\n\n[젠더와문학] 전체 학년 대상 / 교수: 홍구슬 / 금요일 5,6교시 / 강의실 1507호 / 학점: 2 / 전공필수 과목 아님 / 온라인강의 아님 / P/F 평가 과목 아님 / 원어강의 아님\n\n[졸업하기전에읽어야할러시아고전명작] 전체 학년 대상 / 교수: 전미라 / 화요일 7,8교시 / 강의실 2412호 / 학점: 2 / 전공필수 과목 아님 / 온라인강의 아님 / P/F 평가 과목 아님 / 원어강의 아님', '[심리언어학] 4학년 대상 / 교수: 전종섭 / 수요일 7,8,9교시 / 강의실 4210호 / 학점: 3 / 전공필수 과목 아님 / 온라인강의 아님 / P/F 평가 과목 아님 / 원어강의 아님\n\n[언어학연구방법론] 4학년 대상 / 교수: 이해윤 / 월요일 7,8교시 / 강의실 4210호 / 학점: 2 / 전공필수 과목 아님 / 온라인강의 아님 / P/F 평가 과목 아님 / 원어강의 아님', '[생명과학과불교철학특강] 3학년 대상 / 교수: 김원명 / 월요일 7,8,9교시 / 강의실 4216호 / 학점: 3 / 전공필수 과목 아님 / 온라인강의 아님 / P/F 평가 과목 아님 / 원어강의 아님\n\n[존재론] 3학년 대상 / 교수: 김영걸 / 목요일 7,8,9교시 / 강의실 4216호 / 학점: 3 / 전공필수 과목 아님 / 온라인강의 아님 / P/F 평가 과목 아님 / 원어강의 아님\n\n[합리론] 3학년 대상 / 교수: 한우섭 / 금요일 4,5,6교시 / 강의실 4216호 / 학점: 3 / 전공필수 과목 아님 / 온라인강의 아님 / P/F 평가 과목 아님 / 원어강의 아님\n\n[문학과철학] 4학년 대상 / 교수: 송석랑 / 월요일 4,5,6교시 / 강의실 4214호 / 학점: 3 / 전공필수 과목 아님 / 온라인강의 아님 / P/F 평가 과목 아님 / 원어강의 아님', '[종교철학입문] 전체 학년 대상 / 교수: 조명동 / 월요일 7,8교시 / 강의실 2503호 / 학점: 2 / 전공필수 과목 아님 / 온라인강의 아님 / P/F 평가 과목 아님 / 원어강의 아님\n\n[철학으로의초대] 전체 학년 대상 / 교수: 김영걸 / 화요일 5,6교시 / 강의실 2504호 / 학점: 2 / 전공필수 과목 아님 / 온라인강의 아님 / P/F 평가 과목 아님 / 원어강의 아님\n\n[한국사의이해] 전체 학년 대상 / 교수: 정동민 / 목요일 7,8교시 / 강의실 2503호 / 학점: 2 / 전공필수 과목 아님 / 온라인강의 아님 / P/F 평가 과목 아님 / 원어강의 아님', '[미네르바인문(1)읽기와 쓰기] 1학년 대상 / 교수: 서세영 / 목요일 7,8,9교시 / 강의실 2415호 / 학점: 3 / 전공필수 과목 아님 / 온라인강의 아님 / P/F 평가 과목 아님 / 원어강의 아님', '[스포츠방송저널리즘실습] 3학년 대상 / 교수: 이승구 / 월요일 7,8,9교시 / 강의실 0212호 / 학점: 3 / 전공필수 과목 아님 / 온라인강의 아님 / P/F 평가 과목 맞음 / 원어강의 아님', '[공연예술기획] 3학년 대상 / 교수: 서정미 / 화요일 7,8,9교시 / 강의실 4213호 / 학점: 3 / 전공필수 과목 아님 / 온라인강의 아님 / P/F 평가 과목 아님 / 원어강의 아님\n\n[문화콘텐츠창업개발] 3학년 대상 / 교수: 배은석 / 화요일 4,5,6교시 / 강의실 4415호 / 학점: 3 / 전공필수 과목 아님 / 온라인강의 아님 / P/F 평가 과목 아님 / 원어강의 아님\n\n[축제와문화콘텐츠2] 3학년 대상 / 교수: 김남희 / 목요일 7,8,9교시 / 강의실 4415호 / 학점: 3 / 전공필수 과목 아님 / 온라인강의 아님 / P/F 평가 과목 아님 / 원어강의 아님', '## [list] ##\n- ※ 세계문화예술경영전공 교과는 (2) 융합전공 공통기초 및 (3) 융합전공 전공교과 교과목\n- 내에서 최소 30학점 이상을 이수해야 함\n- ※ 인문기반 융합전공을 이중전공으로 선택하는 경우, “융합전공 연계기초 교과목 일람표\n- (전공교류 교과목 현황)”에 개설된 교과목 안에서 12학점 이내로 들을 수 있음.\n- 연계기초 교과목은 학과 소속과 관계없이 목록에 포함된 수업을 모두 들을 수 있음\n- ※ 융합전공 연계기초 및 공통기초과목은 필수가 아닌 권고사항임\n- ※ 융합전공 공통기초 교과목은 ‘전공교류 교과목 현황’의 <공통기초> 참조 (공통기초\n- 교과목 내에서 3학점만 인정)\n- ※ 7+1, 교환학생의 해외이수학점 및 인턴십 프로그램의 경우 유관성이 있는 해당\n- 과목이나 내용에 따라 전공학점 및 연계기초 과목을 대체할 수 있으며, 이는 세계\n- 문화예술경영 관련 내규에 따라 인정됨\n\n## [footer] ##\n- 49 -', '덕션의 과정을 실습하는 프로그램에 참여합니다. (스튜디오/편집실)\n-  스토리콘텐츠 창작 프로그램: 영화 시나리오, 드라마 대본, 웹소설 등 \n스토리콘텐츠 기획과 창작을 위한 프로그램에 참여합니다. (창작실)\nDivision of Digital Contents\n디지털콘텐츠학부\n전화번호 031-330-4067\n홈페이지 dicon.hufs.ac.kr\n학과(부) 행사 및 동아리 활동 \n-  콘텐츠 제작 대회 및 마켓: 특정 주제와 장르로 콘텐츠를 제작하고 이\n를 전시할 수 있는 마켓을 제공합니다. 게임, 애니메이션, 웹디자인 등 \n다양한 분야에 참가하여 본인의 역량을 강화하고 발휘할 수 있는 열\n린 소통의 장입니다.\n-  비즈니스 강연 및 워크숍: 디지털콘텐츠와 관련한 주요 비즈니스 전\n문가를 초청하여 강연 및 워크숍을 개최합니다. 현업에서의 경험과 통\n찰력을 얻을 수 있는 기회를 넘어서, 실무 인맥을 형성할 수 있는 기\n회를 제공합니다.\n-  콘텐츠 기반 창업 프로젝트: 창업에 흥미를 느끼는 학생을 위해 콘텐\n츠를 중심으로 한 창업 아이디어 구상부터 비즈니스 모델 개발까지 창\n업 프로세스 전반을 경험할 수 있도록 합니다. 실제 사업가로 나아가\n는데 필요한 역량을 갖출 수 있는 기회입니다.\n-  다양한 동아리: 디자인 커뮤니티 동아리, 콘텐츠 제작 동아리, AR/\nVR 체험 동아리, 스토리 창작 동아리, 창업 및 비즈니스 동아리 등 전\n공 분야에서의 역량을 함께 키울 수 있는 다양한 커뮤니티에 참여할 \n수 있습니다.\n슬기로운 대학생활 \n1학년  디지털 문화콘텐츠/디지털 테크놀로지/빅데이터 등의 기본 개념\n을 배우고 디지털콘텐츠 분야에 대한 이해도를 높이는 시기입니\n다. 1학년의 학습 내용이 2~4학년으로 연계되므로, 디지털콘텐\n츠에 대한 기초 내용을 잘 학습하고 기억하는 것이 중요합니다.\n2학년  수업의 종류가 많아지므로, 학생이 원하는 분야를 선택해서 들을 \n수 있습니다. 한 가지 분야에 초점을 맞춰도 되지만 자신의 잠재\n력이 잘 드러날 수 있는 비주얼콘텐츠/스토리콘텐츠/K-콘텐츠/\n콘텐츠비즈니스 중에서 2가지 이상 분야의 다양한 수업의 수강\n을 권장합니다.\n3학년  더욱 심화된 내용을 통해 진로 선택에 있어 도움이 되는 분야를 \n정해 집중적으로 수강하기를 권장합니다. 현장실습을 고려하고 \n있다면 1~3학년까지 배웠던 수업을 정리하는 일도 중요합니다.', '2928\nDivision of Global Business & Technology\nGlobal Business & \nTechnology학부\n전화번호 031-330-4509\n홈페이지 gbt.hufs.ac.kr\n전공소개 \nGBT학부에서는 “정보기술을 잘 활용할 수 있는 경영인”을 양성합니다. \n미래에는 인공지능과 빅데이터 등 첨단 정보기술이 모든 비즈니스에 활\n용될 것이므로 이러한 정보기술에 대한 이해와 활용 능력이 점점 더 중\n요해질 것입니다. GBT학부는 이러한 시대적 요구에 부응하여 소셜 미\n디어, 빅데이터, 인공지능과 같은 신기술들을 비즈니스 모델과 융합하\n여 경제와 산업, 문화에 걸쳐 새로운 상품과 비즈니스를 창출할 수 있는 \n‘융합형 인재’를 육성하고 있습니다. 이를 위해 영어 커뮤니케이션 능력\n과 경영학 지식, IT 역량을 갖출 수 있는 커리큘럼을 구성하였고 각 분야\n의 전문가들이 체계적이고 전문화된 교육을 진행하고 있습니다.\nGBT 학부에서는 산학 협력 프로그램 및 인턴쉽 프로그램을 운영하\n며 실무 중심의 현장 체험형 교육 기회를 제공하고 있습니다. 또한 \nResidential College, 세계 유명 대학과의 협력을 통한 복수학위제, 학\n과 전용 교환학생 제도 등을 운영하여 국제적 감각을 지닌 리더로 성장\n할 기회를 제공하고 있습니다. GBT학부는 구글, 아마존 같은 글로벌 빅\n테크 기업에서 주도적으로 일할 수 있는 인재를 양성하는 것을 목표로 \n하고 있으며 이미 성공적인 사례가 나오고 있습니다.\n필요역량 및 소양 \n-  GBT학부는 경영학과 IT기술의 융합학부이므로 인공지능, 컴퓨터프로\n그래밍 언어 등 새로운 기술에 대한 호기심과 관심이 있으면 좋고, 이\n러한 IT기술을 활용한 비즈니스에 대한 관심이 필요합니다.\n-  한국어, 영어를 사용한 커뮤니케이션 역량, 데이터 수집 및 분석 역량, \n팀을 이끌 수 있는 리더십 역량, 서로 다른 문화를 이해하고 차이를 수\n용할 수 있는 역량 등이 핵심역량이라고 할 수 있습니다. \n-  GBT학부의 수업에서도 이러한 역량을 집중적으로 가르치고 있으며 \n스스로 상당한 역량을 갖춘 학생들은 수업에 더욱 흥미를 느낄 수 있\n으며 더욱 크게 성장할 것입니다. \n우리 학과(부)·전공 매력 \n-  모든 교수님이 참여하여 전공을 소개하는 GBT Special Lecture 과\n목 운영\n-  학생들이 중심이 되는 마케팅학회, 데이터분석학회 등 전공 관련 학\n회 운영', '## [list] ##\n- 4) 전공으로 미인정된 타 학과 전공교류과목, 각종 전공 변경 후 동일 이수영역에 남아\n- 있는 전 전공 교과목, 잘못 분류된 교과목 등이 있는지 반드시 확인한 후 이수학점을\n- 계산할 것(추후 졸업예비사정 시 졸업요건 미충족이 될 수 있음)\n- 5) 국내․외 학점교류프로그램 성적은 8학기 개강 전까지 처리할 것을 권장함(미처리 시\n- 졸업예정자 분류 또는 졸업 확정에서 누락될 수 있음)\n- 6) 글로벌자유전공학부로 입학하여 전공을 배정받은 학생은 학번에 관계없이 배정받은\n- 전공 이수학점 표에 따름\n\n## [list] ##\n- ※ 이 경우 교양필수 이수 규정도 배정받은 전공의 이수 규정에 따르므로 유의할 것\n- ※ 교양 외국어 필수는 아래 표 참고하여 이수\n\n## [table] ##\n| 구분 | 교양 외국어 필수 |\n| --- | --- |\n| S등급 | ‧ 기존 글로벌자유전공학부 규정에 따라 이수(6학점) ▶ English for HASS 또는 English for STEM 3학점 ▶ English Writing for HASS 또는 English Writing for STEM 3학점 |\n| A, B, C등급 | ‧ 배정받은 학과(단과대학)의 규정에 따라 필수 학점만 채우면 되며 교과목은 기존 글로벌자유전공학부 규정에 있는 CE영역 교과목을 수강함 예) 글로벌자유전공학부 → 철학과 ▶ 인문대학 규정에 따라 교양 외국어 6학점만 이수하면 되고 교과목은 대학외국어가 아닌 CE영역 교과목을 수강함 |\n\n## [heading1] ##\n# 자유선택(자선)학점이란?\n\n## [heading1] ##\n# 가. 성적표에 자선으로 표기되는 경우', '(비교과) 전공탐색 연계한 자기탐색, 진로탐색 프로그램 지원\n1학년(여름방학) 학과 설명회\n2학기 희망 전공의 학문기초 교과목을 선택할 수 있도록 정보제공 \n1학년 2학기 전공 진입 전 기초교육 \n(교과) 교양 교과목 이수 및 희망 전공의 학문기초 교과목 이수 \n(비교과) 다양한 프로그램 연계 전공탐색학기제 운영 \n슬기로운 대학생활 \n자유전공학부(글로벌)는 전공이 정해지지 않아 학생들에게 보다 많은 \n경험을 제공할 수 있는 발판을 마련합니다. 다른 학생들과 다르게 자유\n전공학부(글로벌) 학생들은 전공을 미리 선택하지 않은 상태로 학교에 \n입학하게 됩니다. 이런 기회를 토대로 다양한 수업들을 통해서 자신과 \n잘 맞는 전공을 탐색하여 자신이 원하는 진로를 스스로 개척해 나가는 \n미래를 가져가시길 바랍니다.\nQ&A \nQ1. 2학년 진급시 주전공으로 선택할 수 있는 학과를 알고 싶습니다.\nA1.  입학 시 글로벌캠퍼스의 모든 학과(부)를 주전공으로 선택할 수 있\n는 기회가 부여됩니다. 단, 우크라이나학과와 한국학과는 2학년 배\n정이 불가하여 선택할 수 없습니다.\nQ2.  2학년 진급시 이중(부)전공으로 선택할 수 있는 학과를 알고 싶\n습니다.\nA2.  서울, 글로벌캠퍼스 구분 없이 모든 학과를 선택할 수 있습니다. 단, \n글로벌캠퍼스의 융합인재학부와 서울캠퍼스 사범대학의 학과는 해\n당 모집단위의 커리큘럼 특성 상 선택할 수 없습니다.\nQ3.  2학년 진급 시 학과 선택을 할 때, 선발기준에 대해서 알고 싶습\n니다.\nA3.  2학년 진급 시 이루어지는 학과 선택과정에서의 선발기준은 따로 \n존재하지 않습니다. 자유전공학부(글로벌)에 입학한 모든 신입생들\n에게 원하는 전공을 자유롭게 선택할 수 있는 기회를 제공하고 있\n으니 참고 바랍니다.\nOpen Major Division(Global Campus)\n자유전공학부(글로벌)\n전화번호 031-330-4797\n홈페이지 gomd.hufs.ac.kr\n글로벌캠퍼스 GLOBAL CAMPUS\nDIVISION OF \nCLIMATE CHANGE\n기후변화융합학부\n기후변화융합학부 68', '해를 바탕으로 다양한 분야에 응용될 수 있습니다. 인간의 건강에 직결되\n는 의약학 분야(Red Biotech), 산업적 소재를 생산하는 공학분야(White \nBiotech), 유용 식물을 연구하는 농업 분야(Green Biotech), 그리고 해양\n자원분야(Blue Biotech)가 대표적인 예입니다. 지난 20여 년간 IT가 인류\n의 삶을 혁신했다면, 향후에는 BT(Bio Technology)가 그 주인공이 될 것이\n라는 게 미래학자들의 예측입니다. 우리 학과에서는 생명공학에 대한 시대\n적 요구에 부응하는 인재 양성을 위해 수준 높은 강의와 교과과정을 운영 \n중입니다. 고가의 첨단장비를 완비해 학부생이 직접 연구에 참여하는 기회\n도 확대하고 있습니다. 생명공학은 기본적으로 생명과학 지식에 기반을 둔 \n학문입니다. 이에 생명과학자로서 갖춰야 할 소양인 ‘논리적 사고’와 ‘현상\n에 대한 비판적 관찰 능력‘이 반드시 요구됩니다. 또한, 이를 이용해 BT 산\n업 발전에 기여할 도전정신도 필요합니다. 학생들은 향후에 전공 과정에서 \n생물학지식 전반을 완벽히 습득과 함께 연관 과학 분야들을 통합하여 이해\n하게 될 것입니다. 또한 교과서와 전공 논문을 읽을 수 있는 영어 실력의 배\n양도 빼놓을 수 없습니다. 이러한 통합적 교육을 통해 국제화된 과학 인재\n로 거듭나는 데 필요한 소양과 자기 주도적 역량을 강화하게 될 것입니다.\n필요역량 및 소양 \n생명 현상에 대한 호기심과 논리적 사고를 갖출 수 있으면 좋습니다. 특\n히, 물리, 화학, 수학과 같은 기초 과학에 대한 이해도가 높을수록 생명 \n현상과 그 기저에 있는 원리를 이해하고 응용하는 데 도움이 됩니다. \n아울러, 글을 잘 쓰고 이해하는 능력이 있다면 교재를 읽고 이해하고 \n그를 바탕으로 과학적 가설을 세워 증명하는 과정을 이해할 수 있습니\n다. 마지막으로, 영어 독해력을 기르면 유수의 우수한 논문들을 읽고 이\n를 통해 연구자의 첫걸음을 내디딜 수 있는 힘을 기를 수 있게 됩니다. \n우리 학과(부)·전공 매력 \n-  논리적사고 + 비판적 관찰력 + 도전적 정신 함양\n-  학부생의 다양한 연구 참여기회\n-  미래 생명과학 인재를 위한 소양과 역량 강화\n-  국제적 혁신 연구를 수행할 생명공학 전문가 양성\n주요 실적 \n-  과학기술정보통신부, 보건복지부 등 정부 주요 기관 지원을 받는 다\n양한 연구 과제 수행\n-  바이오융합센터 운영\n-  다수의 바이오벤처 창업', '## [heading1] ##\n# 나. 재수강 연결\n\n## [table] ##\n| 원칙 | ① 이전 취득성적과 동일한 과목 이수 ② 타 대학 취득성적 및 학점인정 성적은 재수강 불가 ③ 동일과목이 여러 학과에 개설되어 있는 경우 → 최초 수강한 학과의 교과목 으로 재수강 ④ 교양 선택은 영역 간 자유롭게 재수강 가능(단, 교양 필수, RC, CE영역 제외) ※ 새로 재수강하는 교양 영역으로 학점이 산정되므로 영역 간 이수학점 유의 ※ 자선에서 교양으로 이수구분 변경한 경우 본래 수강하였던 자선 교과목으로 재수강하여야 함 ⑤ 계절학기 수강신청 시 직전 정규학기 수강과목 재수강 불가 ※ [예시] 2025-1학기 수강과목을 2025-여름계절학기에 재수강 불가 |\n| --- | --- |\n| 예외 | ① 해당 과목이 폐지되어 동일과목이 존재하지 않는 경우 ※ 전공과목 폐지 여부 → ☎해당학과 문의 ② 교양 선택 영역에 해당하는 경우 → 위 ①, ②의 경우 종합정보시스템에서 본인이 직접 재수강할 이전 성적 선 택 가능함. 단, 본인이 직접 선택할 수 없는 경우 학사종합지원센터 전화문의 |\n\n## [paragraph] ##\n※ 재수강 연결 대상과목 구분 및 연결 방법', '문화, 역사 등)을 쌓을 수 있는 지역학 교과목이 많이 개설되어 있습니\n다. 지역학 전공자로서 가능한 다양한 과목을 통해 진정한 중앙아시아\n를 학습하고자 하는 마음가짐이 무엇보다도 중요합니다. \n-  중앙아시아 국가들은 1991년 독립한 신생국가입니다. 중앙아시아와 \n관련된 정치·경제·역사·문학 등 다양한 분야의 서적을 읽고 기본 배경\n지식을 쌓으면 좋습니다. 특히 중앙아시아는 주변 러시아, 중국 등 주\n변 국가들과의 연관성도 높기 때문에 국제 문제에 대한 관심과 기본적\n인 시사 상식을 갖추면 학습하는 데 도움이 됩니다. \n-  입학 전 입문서로는 ‘변화하는 중앙아시아 사회와 문화’(이지은, \n2022)를 읽어보길 권합니다. 독립 이후 중앙아시아 사회가 어떤 부분\n은 유지하고 어떤 부분은 변화해가며 무엇이 오늘날 중앙아시아 사회\n를 이해하는 데 핵심이 되는지 알 수 있습니다. \n-  현지 언어를 배워보고 싶으면, 국가평생교육원의 K-MOOC에서 ‘우즈\n베크어 기초생활회화 (A1 상/하)’ 또는 사이버한국외대 평생교육원의 \n특수외국어 강좌에서 ‘우즈베크어 첫걸음(A1)’을 통해서 기본적인 우\n즈베크어 체계를 학습해볼 수 있습니다. (카자흐어는 개발 중에 있습\n니다) 언어교재로는 우즈베크어 표준교재 A1(2018), 카자흐어 표준\n교재 A1(발간 예정) 등을 추천합니다.\n우리 학과(부)·전공 매력 \n-  국내 유일 중앙아시아 전문 교수들이 중앙아시아 지역학 전문가(언어\n와 지역학 통합)를 양성하는 학과입니다. \n-  최고 수준의 다중언어(우즈베크어, 카자흐어, 러시아어) 커리큘럼 및 \n국제교류프로그램을 제공합니다. \n-  우즈베크, 카자흐 현지 교수의 전문화된 언어 교육 프로그램을 구비\n하고 있습니다. \n-  ‘특수외국어능력평가시험 우즈베크어’에 응시하면 공인된 우즈베크어 \n평가 인증서를 취득할 수 있습니다. \n-  지역학 전공자로서의 전문성을 더 강화하고자 한다면, 일반대학원 터\n키/중앙아시아/몽골학과에 진학 가능합니다.\n-  학과 관련 카카오톡 채널을 운영(한국외대 중앙아시아학과)하고 있어 \n학생뿐만 아니라 일반인들 누구도 중앙아시아에 관심이 있으면 본 채\n널을 통해 문의할 수 있습니다. \n주요 실적 \n-  특수외국어교육사업: 멘토링, 탄뎀, 대사관 인턴십, 온라인 인턴십(우\n즈베키스탄, 카자흐스탄), 다문화가정 번역 봉사 등 \n-  중앙아시아연구소 연계 운영: 시사 지역 정보 뉴스 제공, 신흥지역연', '6766\n전공소개 \n자유전공학부(글로벌)는 글로벌캠퍼스에 2023년도에 신설된 학부입\n니다. 1학년 동안 다양한 분야의 전공 탐색 기회를 제공하여 학생들에게 \n자신이 맞는 전공을 선택할 시간을 충분히 배정하고자 노력하고 있으\n며, 이를 통해 주전공 및 이중전공 선택 시 보다 정확하고 합리적인 의사\n결정을 하도록 돕고 있습니다. 무엇보다도 우리 자유전공학부(글로벌)\n에서는 1학년 때 다양한 교과목 수업 수강을 통하여 어떤 전공을 선택\n하더라도 쉽게 적응할 수 있는 커리큘럼을 제공하고자 노력 중이며, 이\n를 위해 미네르바 인문영역, Residential College 영어 영역, 소프트웨\n어 기초영역 등 다양한 기초 수업을 진행 중에 있습니다. \n필요역량 및 소양 \n자유전공학부(글로벌)는 1학년 동안 교내 다양한 전공 탐색의 기회를 제\n공하는 데 주요 목적이 있습니다. 교과 측면에서 전공선택과 관련된 다\n양한 과목들을 두루두루 학습하면서, 동시에 자신에게 맞는 전공 분야\n를 찾는 노력이 중요합니다. 인문계열 과목을 통해서는 다양한 사회 분\n야에 대한 통찰 및 사고 활동을 통해서 사회현상을 바라보는 시각을 기\n르고, 문학 작품을 통해선 종합적인 인문학적 소양을 기르면 좋겠습니\n다. 자연계열 과목을 통해서는 논리적 사고 및 입증 과정을 통해서 세\n상을 구성하는 다양한 과학적 원리를 탐구하며, 이들을 실생활에 집약\n한 공학 부분에선, 이들 학문이 우리 사회에 어떻게 활용되는지 대해 탐\n구하면 좋겠습니다.\n우리 학과(부)·전공 매력 \n1)  1학년 동안 지도교수 지도 아래 다양한 학사/진로지도 및 멘토링 제\n공을 받을 수 있습니다.\n2)  교내외 전공탐색박람회 등 다양한 프로그램을 통해서 전공 탐색의 \n기회가 제공 됩니다.\n3)  1학년 동안 다양한 교과 프로그램을 통해 미래 전공에 대한 충분한 고\n민과 체험을 제공받을 수 있습니다.\n전공탐색 교육과정 \n1학년 1학기  교양 교육 중심\n(교과) 교양 교육을 통한 기초소양 함양, 전공탐색 \n(비교과) 전공탐색 연계한 자기탐색, 진로탐색 프로그램 지원\n1학년(여름방학) 학과 설명회\n2학기 희망 전공의 학문기초 교과목을 선택할 수 있도록 정보제공 \n1학년 2학기 전공 진입 전 기초교육 \n(교과) 교양 교과목 이수 및 희망 전공의 학문기초 교과목 이수 \n(비교과) 다양한 프로그램 연계 전공탐색학기제 운영 \n슬기로운 대학생활', '게 수집하고 활용이 되고 있는지에 대한 관심이 있고, 공학기술의 실\n생활적용에 흥미를 가지고 있으면 좋습니다.\n-  생물, 물리, 수학, 컴퓨터 등에 대한 기초가 첨단의료기기 및 의료데이\n터의 활용과 관련된 전공과목을 이수하는 데에 도움이 될 것입니다. \n우리 학과(부)·전공 매력 \n-  의학과 공학의 만남이라는 첨단 융복합 학문의 전문가를 양성\n-  빅데이터, 인공지능, 첨단의료기기 등 IT 중심의 바이오메디컬 분야 \n핵심 인재 양성\n-  긴밀한 산학연병 협력으로 현장형 인재 중심 교육 실현 및 현장실\n습 지원 \n-  평생 지도 교수 제도를 통한 지속적인 학생 상담 및 경력 관리 \n주요 실적 \n-  한국연구재단, 범부처전주기의료기기연구개발사업단, 한국지능정보\n사회진흥원 등의 지원으로 바이오메디컬공학 분야의 산학연병 협동\n연구를 수행 중입니다.\n-  학부학생들이 보건복지부, 한국보건산업진흥원, 산업통상자원부, \nMICCAI 주관의 다수의 공모전에서 최우수상, 우수상 등을 수상했습\n니다.\n-  학부학생들이 매년 국내외 바이오메디컬공학 관련 분야의 주요학술\n대회(ISMRM, MICCAI, MIDL, RSNA, ICMRI 등)에서 연구성과를 발\n표했습니다.\n주요 전공과목 \n-  생체신호계측기기설계및실습: 생체 신호 계측 시스템의 이해를 위\n한 기초 과목으로 전자 회로 및 반도체 시스템에 대한 개념을 이해하\n고, 인체 내에서 정보 전달을 위해 발생 되는 전기적인 신호를 측정하\n고 해석하는 데에 필수적인 전자회로의 내용을 공부하고 실습합니다.\n-  바이오메디컬인공지능: 바이오메디컬 데이터에 대한 인공지능 적용\n을 위한 딥러닝의 기초를 배우고, 컴퓨터를 이용해 실제 데이터에 적\n용할 수 있는 능력을 배양합니다.\n-  의료영상처리및실습: 디지털 영상 처리의 기초가 되는 다양한 이론과 \n방법을 배우고, 컴퓨터를 이용하여 실제 의료영상에 적용할 수 있는 \n능력을 배양합니다. 실습을 통해 의료영상의 분류, 영역 검출 및 분할, \n정합 등의 과정을 진행하는 방법을 익힙니다.\n-  의생명정보학: 의생명정보학 분야의 대표적인 데이터들을 소개하고, \n각각의 데이터들에 대해 이해하고 이를 다운로드 받아 다뤄보는 것 이\n외에 실제 시퀀스데이터를 가지고 분석하는 여러 가지 툴들을 다뤄보\n고, 이를 통해 실제 분석하는 것으로 진행합니다.\n-  바이오메디컬공학특강: 바이오메디컬공학 분야와 연관된 산업체, 연', '잘해야 하나요?\nA3.  수학은 반도체공학의 기초 학문으로서 필요합니다. 고교 수학이 준\n비가 미흡한 학생들을 위해 1학년 교양으로 수학을 배우게 합니다. \n현재 우리 대학교에서는 어문계 학생들도 공학 관련 복수전공 및 부\n전공을 선택하고 있습니다. 따라서 수학 과목들을 성실히 배울 자\n세가 있는 학생이라면, 누구나 반도체공학에 도전할 수 있습니다.\nDivision of Semiconductor and Electronics Engineering\n(Electronics Major)\n반도체전자공학부\n(전자공학전공)\n전화번호 031-330-4094\n홈페이지 ee.hufs.ac.kr\n전공소개 \n반도체전자공학부의 전자공학전공은 1993년에 신설된 전자공학과가 \n2024학년도부터 개편된 전공으로서 ‘국제적 감각과 첨단기술을 주도하\n는 반도체·전자공학 전문가 양성’이라는 교육목표를 가지고 있습니다. 특\n히 반도체/회로설계 분야와 통신시스템 분야에 대한 집중 교육을 실시함\n으로써 시스템반도체 설계와 응용 2024학년도부터 반도체전자공학부로 \n확대됨에 따라 반도체 분야의 이론과 실습 교육을 더욱 강화할 예정이며, \n학생들이 반도체 및 전자공학 전문가로서의 역량을 갖출 수 있도록 돕고 \n있습니다. 특히 반도체전공은 SoC, 메모리, 초고주파 회로 등의 설계를 위\n한 전문 과목을, 전자공학전공은 반도체, 회로, 통신, 신호처리 등의 분야\n에 대해 집중 교육함으로써 학생들은 졸업 후 전자공학 전문가로서 역량\n을 마음껏 발휘할 수 있습니다. \n필요역량 및 소양 \n-  공학의 시작은 호기심입니다. 스마트폰, IoT, 레이더, 스마트 자동차, \n등의 기기에 관심이 많고, 그 기기들의 내부구조나 동작원리가 궁금했\n던 학생이라면 누구든 환영합니다. \n-  교과 측면에서는 전자공학의 출발점인 수학, 물리 과목과, 컴퓨터 활\n용이나 원리에 흥미가 있으면 절반의 가능성은 가진 셈이고, 나머지의 \n절반은 우리 학부에서 함께 채워갈 수 있을 것입니다. \n우리 학과(부)·전공 매력 \n-  반도체전자공학부(전자공학전공)\n-  반도체, 회로설계, 통신시스템에 특화된 커리큘럼 제공\n-  실무·연구 능력 향상을 위한 다양한 인턴 프로그램 제공\n-  국제적 감각을 지니고 첨단기술 개발을 주도하는 전자공학 전문가 양성\n주요 실적 \n-  경기 BRIDGE 사업 참여\n-  체코&공학 글로벌 인턴쉽 프로그램 참여\n-  반도체설계교육센터 IDEC캠퍼스사업 참여', '라 환경공학 분야, 청정에너지 분야, 생명공학 응용분야에 대한 깊이 있\n는 학습을 하게 됩니다. 더불어 교과 시간에 학습한 내용을 토대로 석/\n박사과정의 대학원생들과 함께 구체적인 연구 및 실습을 할 수 있도록 \n교과과정이 편성되어 있으며, 6개의 실험실에서 대학원생과 교수님의 \n지도 아래 연구실험을 할 수 있는 기회가 주어집니다.\n졸업 후 진로 \n-  공기업, 공공기관: 한국환경공단, 국립환경과학원, 한국산업환경기술\n원, 한국석유공사, 한국수자원공사, 한국수력원자력, 한국지역난방공\n사, 대한지적공사, 국립공원관리공단 등\n-  일반기업: 삼성전자, LG화학, SK네트웍스, 현대중공업, 대한항공, 웅\n진케미칼 등\n-  기타 국내외 대학원 진학\nQ&A \nQ1. 환경학을 공부하기 위해 특별히 공부해야 할 기초 과목들이 있나요?\nA1.  환경학 과목은 수학, 화학, 통계 등의 요소와 연결되는 학문이므로 \n기초적인 지식이 있으면 더욱 도움이 됩니다. 물론 고등학교 때 수\n학, 화학 과목에 관심 없는 학생이어도 대학 진학 후 다른 과의 기초\n과목을 함께 수강하면서 공부하면 충분히 가능합니다.\nQ2. 환경학과에 입학하면 취업이 잘 되나요?\nA2.  각 기업의 환경 관련 부서가 하나 이상 있고 연구소, 환경 관련 업체 \n등 다양하게 취업의 문이 열려있으므로 학부 과정을 졸업한 학생들\n도 취업률이 높은 편입니다. 또한 우리 과를 졸업한 선배들이 공기\n업, 대학교수 등 분야별로 포진되어 있기 때문에 후배들에게 더 많\n은 취업의 기회를 주고자 노력하고 있습니다.\nDept. of Bioscience and Biotechnology\n생명공학과\n전화번호 031-330-4272\n홈페이지 bio.hufs.ac.kr\n전공소개 \n20세기 중반 분자생물학의 태동으로 생명체 연구의 패러다임이 바뀌었\n고, 2003년 게놈 프로젝트의 완성은 생명공학의 신기원을 열었습니다. 초\n거대 다국적 제약업체는 물론 국내·외 굴지의 대기업들이 생명공학 분야\n로 사업영역을 확장하는 중입니다. 생명공학은 생명과학에 대한 기본적 이\n해를 바탕으로 다양한 분야에 응용될 수 있습니다. 인간의 건강에 직결되\n는 의약학 분야(Red Biotech), 산업적 소재를 생산하는 공학분야(White \nBiotech), 유용 식물을 연구하는 농업 분야(Green Biotech), 그리고 해양\n자원분야(Blue Biotech)가 대표적인 예입니다. 지난 20여 년간 IT가 인류', '5554\n전공소개 \n디지털콘텐츠학부는 현대의 글로벌한 디지털콘텐츠 산업 분야에서 독\n자적으로 활동할 수 있는 능력을 갖춘 콘텐츠 전문가를 양성하는 데 교\n육 목표를 두고 있습니다. 이를 위해 학생이 호기심을 키우고, 창의성을 \n발휘하고, 세계 시민으로서 책임의 정신을 기를 수 있도록 하는 내실화\n된 교육 커리큘럼을 제공합니다. 학생은 콘텐츠와 테크놀로지 기반의 \n지식과 정보를 습득하고 실무를 위한 실습 활동에 참여할 수 있습니다. \n학생은 이러한 기회를 통해 우리 학부의 커리큘럼 내에서 디지털콘텐츠 \n전반에 관한 핵심적인 역량을 쌓을 수 있습니다. 졸업 이후 콘텐츠 기획 \n및 제작, 개발 분야를 넘어서 콘텐츠 유통•투자•정책 결정, 콘텐츠 비\n즈니스 등 다양한 영역으로 무한하게 뻗어나갈 수 있는 발판을 제공하\n고자 합니다. 나아가, 최근 AR, VR, AI 등 새로운 기술의 도입으로 디지\n털콘텐츠가 더욱 혁신적인 방향으로 발전하는 상황 속에서, 이에 걸맞\n은 인재로 성장할 수 있도록 노력하고 있습니다. \n필요역량 및 소양 \n-  디지털콘텐츠 전반에 대한 관심을 가지고, 이에 몰입할 수 있는 역량\n이 필요합니다.\n-  디지털콘텐츠의 제작과 분석 역량을 함양할 수 있도록 창의성과 논리\n성을 발휘할 수 있는 적극적인 태도가 필요합니다.\n-  디지털콘텐츠 산업은 현재도 급변하고 있기에, 새로운 지식을 습득하\n고 변화에 빠르게 적응할 수 있는 열린 자세가 필요합니다.\n-  디지털콘텐츠 관련 테크놀로지에 대한 관심으로 기술과 공학을 접목\n할 수 있는 역량이 필요합니다.\n우리 학과(부)·전공 매력 \n-  디지털콘텐츠와 테크놀로지를 이끌어 갈 세계 시민 양성\n-  디지털콘텐츠의 최신 트렌드와 지식을 반영한 교육과정 운영\n-  디지털콘텐츠 산업과 밀접한 협력 체계를 갖춘 실무 연계 교육기회 \n제공\n-  디지털콘텐츠 전문가로서 글로벌 역량을 갖춘 인재로 성장할 수 있는 \n독자적인 프로그램 제공\n주요 전공과목 \n-  비주얼콘텐츠: 비주얼콘텐츠의 동향과 장르를 비평적으로 분석하며, \n이를 통해 비주얼 스토리 작성에 필요한 통찰력을 키울 수 있도록 합\n니다. 뿐만 아니라, 최신 비주얼콘텐츠 제작 기술을 이해할 수 있는 기\n회를 제공하는 수업입니다. 나아가, 시각언어의 의미론적인 측면을 탐\n색하고, 이러한 이론적 기반 위에서 창의적인 비주얼콘텐츠를 제작하\n기 위한 능력을 함양할 수 있습니다.', '들이 담당할 핵심분야는 의료영상시스템/바이오시스템 개발, 의료영상 \n분석을 위한 알고리즘 개발, 디지털헬스케어 시스템 구축, 의료용 로봇 \n등의 기기 개발과 관련한 설계 및 제조에 이릅니다.\nQ&A \nQ1.   바이오메디컬공학부에서는 하드웨어와 소프트웨어 중에 어떤 분야\n를 주로 배우게 되나요?\nA1.   바이오메디컬공학분야에서의 하드웨어는 진단, 치료, 웰니스기기 \n등을 포함하고, 소프트웨어는 의생명데이터, 생체(영상 또는 비영\n상)신호데이터의 분석 및 활용 등을 포함합니다. 바이오메디컬공학\n부에서는 하드웨어와 소프트웨어 분야를 함께 교육합니다. 앞으로\n는 하드웨어와 소프트웨어 분야의 융합을 통해 더 큰 가치를 창출\n할 수 있을 것으로 기대되고 있습니다. 물론, 본인의 적성에 맞추어 \n하드웨어 또는 소프트웨어 분야의 트랙으로 전공과목을 집중하여 \n들을 수도 있습니다.\nQ2.  생명정보학이라는 분야는 무엇이며 실제로 어떤 일을 하게 되나요?\nA2.  생명정보학이라는 분야는 이름에서 알 수 있듯이 의생명 데이터라\n는 정보를 분석하여 새로운 정보를 찾아내는 학문이라고 생각할 수 \n있습니다. 의생명 데이터라는 것이 단순히 DNA와 같은 유전체 데\n이터를 넘어서, DNA, RNA, Protein, microbiome (장내 미생물) \n등에 대한 연구를 포괄한다고 할 수 있습니다. 예를 들면, DNA를 분\n석하여, 유전 질환 관련 변이를 찾아내어 질병의 정확한 진단에 이\n용한다던지, 맞춤형 의료 혹은 정밀 의료라고 일컫는, 즉, 각 개인의 \ngenotype에 따른 치료법을 제시해주는 연구들이 요즘 중요시되고 \n있고, 생명정보학이 이러한 분야를 포괄한다고 말할 수 있습니다. \nQ3.  인공지능은 의료영상처리 분야에서 어떻게 활용될 수 있나요?\nA3.  MRI, CT, x-ray, ultrasound, pathology 등 다양한 종류의 의료영\n상데이터를 생성하는 과정에서도 인공지능이 적용이 될 수 있습니\n다. 인공지능기법을 적용하여 영상의 획득시간을 단축시킬 수도 있\n고, 의료영상의 품질을 관리 및 평가하거나 향상시킬 수도 있습니\n다. 또한, 기존 의료영상데이터로부터 진단에 도움이 되는 정보를 \n추출하는 데에 적용이 될 수 있습니다. 다른 측면으로는 사람의 이\n해하기 어려운 고차원 데이터에 대한 분석을 통해 새로운 정보를 효\n과적으로 추출하는 데에 활용이 될 수도 있습니다.\n글로벌캠퍼스 GLOBAL CAMPUS', '3736\nDept. of Environmental Science\n환경학과\n전화번호 031-330-4270\n홈페이지 envi.hufs.ac.kr\n전공소개 \n환경학이란 인류의 삶의 질 향상과 지속가능한 발전을 궁극적 목표로 하\n는 학문으로 생물학, 화학, 물리학, 통계학, 공학 등 다양한 학문 분야를 \n포함하는 종합 학문의 성격을 띠고 있습니다. 산업이 다양화·고도화되\n면서 각종 환경문제가 야기됨에 따라 환경오염의 심각성이 인식되고 있\n고 환경보전에 대한 인류의 관심이 점차 심화되고 있습니다. 환경은 인\n간이 살아가는 데 있어서 생활 전반에 중요한 부분을 차지하고 있으며 \n이제 지구온난화·물 부족 등의 환경문제는 어느 한 지역 또는 한 국가에 \n국한되는 국지적, 지역적 차원의 문제가 아니라 범지구적 차원의 문제\n라고 할 수 있습니다. 이로 인해 환경 관련 기술 개발을 위한 투자와 전\n문지식을 가진 환경기술자의 사회적 요구가 나날이 증가하고 있기 때문\n에 향후 무궁무진한 비전을 가진 학문이라 할 수 있습니다.\n필요역량 및 소양 \n-  환경학은 평소 환경에 대한 많은 관심과 사명감이 있고 지적 호기심을 \n가진 학생이라면 누구든지 접할 수 있는 학문입니다. \n-  환경학에 필요한 적성은 환경 분야에 조금이라도 관심을 갖고 있고 과\n학, 수학 과목을 특히 좋아하면 쉽게 배울 수 있는 학문입니다. \n-  기초이론을 공학적으로 응용할 수 있는 사고력과 응용력이 요망되며 \n응용 분야가 광범위하여 환경학 전반을 이해할 수 있는 폭넓은 시야를 \n가진다면 학습의 동력이 배가될 것입니다.\n우리 학과(부)·전공 매력 \n-  대기, 수질, 생물 등 5개의 실험실을 운영하여 심도깊은 연구를 할 수 \n있는 기회 제공\n-  각종 환경오염분석/방지기기를 경험해 볼 수 있는 교과과정 운영\n-  환경공학뿐 아니라 환경정책에 관한 사회적 시각을 넓힐 수 있도록 외\n부전문가 초청강연의 기회 제공\n-  취득가능한 자격증: 대기환경기사(한국산업인력공단), 수질환경기사(\n한국산업인력공단), 폐기물처리기사(한국산업인력공단), 토양환경기\n사(한국산업인력공단) 등\n주요 실적 \n-  연 1회 환경학과 졸업생분들과 함께하는 동문모임을 개최하여 취업 등\n의 정보를 제공합니다.\n-  외국인 교수님의 영어수업으로 양질의 강의를 수강할 수 있습니다.\n-  트랙별 교과과정을 운영하여 1학년을 마치고 2학년 때부터 원하는 분\n야의 과목을 집중적으로 수강할 수 있습니다.', '1514\n전공소개 \n체코·슬로바키아학과는 체코어와 슬로바키아어를 교육하는 국내 유일\n의 고등교육 기관으로 어문학, 지역학을 비롯한 다양한 문화를 공부할 \n수 있는 곳입니다. 안정된 정치, 경제적 기반과 높은 문화 수준을 자랑하\n는 체코와 슬로바키아는 한국과의 정치, 외교, 경제, 문화를 비롯한 다양\n한 글로벌 이슈에 있어 긴밀한 협력관계를 맺고 있으며, 우리 학과는 양\n국 관계에 있어 중요한 역할을 담당하는 글로벌 전문가를 양성하는 기\n관입니다. 전공자들은 두 개의 특수외국어 습득을 위한 체계화된 교과\n과정들과 해외연수, 인턴십 등의 다양한 교육프로그램들을 이수하게 됩\n니다. 체코어와 슬로바키아어 학습, 문학을 포함한 문화와 지역에 대한 \n전문적인 내용을 공부하므로 특수외국어에 관한 관심과 해당 지역에 대\n한 흥미가 있으면 좋습니다.\n필요역량 및 소양 \n-  교과의 측면에서는 인문학적 소양을 위한 체코와 슬로바키아에 대한 \n역사와 사회문화에 관한 관심을 가지고 준비하고, 전공과 관련한 다양\n한 문학작품 등의 저서를 읽는 것도 좋습니다. \n-  체코와 슬로바키아에 관한 지역전문가 양성에 필요한 지역에 대한 다\n양한 정보를 찾아보고 숙지하는 올바른 이해 역시 중요합니다. \n-  체코·슬로바키아학과에는 공학도와 함께 공부하고, 해외에서 현장실\n습을 진행하는 융복합 과목이 있으므로 이런 과목에 관한 관심도 필\n요합니다. \n우리 학과(부)·전공 매력 \n-  체코와 슬로바키아 관련 국내 유일의 어문학 및 지역학 전문가 양성\n-  체계화된 교과과정과 다양한 비교과 과정을 통한 통합적 교육\n-  산업경영공학과, 전자공학과와 함께하는 캡스톤 수업을 통한 융복합 \n교육\n-  해외 진출 국내 유수 기업에서의 인턴십 운영\n주요 실적 \n-  2022학년도/2023학년도 대학혁신사업 HUFS 학과 특성화 프로그\n램 진행 \n-  동유럽발칸연구소 “인문사회연구소 사업단” 참여\n-  동유럽발칸연구소 운영 참여\n-  체코문화원과 함께 ‘수사나 로드(Susanna Roth) 세계 체코문학번역\n대회’ 한국 주관 기관 \n주요 전공과목 \n-  체코·슬로바키아 어학: 체코어와 슬로바키아어를 문법, 회화, 통번역 \n연습 등을 통해 기초부터 체계적으로 배워서 최종적으로 체코어와 슬\n로바키아어를 이해하고 활용할 수 있도록 합니다. \n-  체코·슬로바키아 문학: 체코·슬로바키아 문학에 대한 지식을 통시적', '통해 다채로운 한국문화 관련 세부 전공을 개척해 나갈 수 있습니다. \nQ3. 한국어 교원 자격증이 무엇인가요? \nA3.  한국어 교원 자격증은 국립국어원 주관하에 문화체육관광부에서 \n부여하는 자격증으로서 한국어가 모국어가 아닌 외국인이나 다문\n화가정을 대상으로 한국어를 가르칠 수 있는 자격증입니다. 한국학\n과 내의 일정 영역별 학점을 이수하면 국내외에서 한국어 교사로 활\n동할 수 있는 한국어교원 자격증을 취득할 수 있습니다. \n글로벌캠퍼스 GLOBAL CAMPUS\n경상대학\nGlobal Business & Technology학부 28\n국제금융학과 30\nCOLLEGE OF ECONOMICS\nAND BUSINESS', ""과의 협력에 매우 우호적이며, 한국의 문화, 경제, 언어 등에 대한 깊\n은 애정을 갖고 있습니다.\nQ3.  중앙아시아에 직접 갈 수 있는 프로그램에는 어떤 것들이 있나요?\nA3.  학기 중에는 7+1 프로그램과 교환학생 프로그램을 통해 중앙아시아 \n국가 내 현지 대학교에서 수학할 수 있으며, 전략지역 전문가 아너\n스 프로그램을 통해 해외 연수뿐 아니라 현지에서의 해외인턴도 지\n원하고 있습니다. 또한 자비유학과 방학 중에 다녀올 수 있는 단기 \n어학연수 프로그램을 통해 자유롭게 선택하여 다녀올 수 있습니다.\nQ4.  중앙아시아학과에 대한 궁금증이 있다면 어디에 물어볼 수 있나요? \n학과 소식을 접할 수 있는 방법이 있나요?  \nA4.  카카오톡에서 '한국외대 중앙아시아학과'를 검색하여 학과 관련 궁\n금증 및 문의사항을 해결할 수 있습니다. 학과 소식은 네이버 밴드\n에서 '한국외대 중앙아시아학과'에 가입하여 학과 최신 소식을 얻을 \n수 있습니다. 만일 우즈베크어 관련한 학습 기회나 체험 기회 등에 \n대한 정보가 필요하면 네이버 밴드 ‘특수외국어교육진흥사업 우즈\n베크어’에 들러보세요~ \nDivision of African Studies\n아프리카학부\n전화번호 031-330-4242\n홈페이지 hufsafrica.hufs.ac.kr\n전공소개 \n아프리카학부는 국내 유일의 아프리카 관련 고등교육기관입니다. 1983\n년 스와힐리어과에서 시작해 현재까지 40년의 역사를 갖고 있는 아프\n리카학부는 스와힐리(Swahili)어 외에도 하우사(Hausa, 서아프리카)와 \n암하라(Amhara, 에티오피아) 등 아프리카의 주요 언어를 교육하고 있\n습니다. 세 언어는 모두 정부에서 지정한 국가전략 언어에 포함되어 있\n습니다. 스와힐리어과는 1998년 아프리카어과, 2008년에는 아프리카\n학부로 체제를 확장해 주요 아프리카어를 바탕으로 역사학, 문학, 정치\n학, 국제관계학, 경제학, 인류학, 개발학 등 아프리카 대륙을 이해하기 \n위한 필수 교과목을 개설해 아프리카에 관심있는 학생들의 지적 소양을 \n넓혀주고 있습니다. 본 학부 교수진은 아프리카 현지 대학뿐 아니라 영\n국과 미국, 유럽과 일본 등에서 박사학위를 받은 우수인력들입니다. 교\n수진과 아프리카에 열정을 갖고 있는 학생들이 시너지 효과를 일으키고 \n있어 학생들의 만족도를 높여주고 있습니다. \n필요역량 및 소양 \n우리 사회와 교육체계 안에서 아프리카에 대한 인식과 인지도가 떨어지"", '1312\n전공소개 \n2007년 유럽연합 회원국이 된 루마니아(인구: 8위, 국토면적: 9위)는 ‘\n유럽의 보석’이라 불릴 정도로 아름다운 자연환경과 풍부한 천연자원으\n로 동유럽 국가 중에서 경제적 성장잠재력이 가장 높은 나라로 주목받\n고 있습니다. 1987년 설립된 루마니아학과는 루마니아(Romania)와 몰\n도바(Moldova)공화국의 어문학 및 지역학을 공부할 수 있는 국내 유일\n의 고등교육기관입니다. 라틴어에 뿌리를 둔 루마니아어의 실질적인 구\n사력 및 문헌 이해 능력의 배양과 더불어 루마니아 지역학 관련 지식의 \n습득으로 현지에 특화된 전문가를 양성하고 있습니다. 우리나라의 공기\n업을 비롯한 대기업과 중소기업들이 판매 및 제조법인 등 다양한 형태로 \n루마니아에 투자하거나 사업진출을 도모하고 있습니다.\n필요역량 및 소양 \n교과의 측면에서는 발칸반도, 나아가 동부 유럽에 대한 역사와 문화에 \n대해 관심을 갖고 특히 루마니아의 역사와 사회문화에 대해 흥미를 가\n지고 있으면 좋습니다. 또한 전공과 관련해서 문학, 지역학 등 다양한 분\n야의 서적을 읽는 것도 도움이 됩니다. 이는 단순히 언어만 배우는 게 아\n닌 루마니아의 문화, 정치, 역사 등 다양한 분야에 대해 입학 후 배우기 \n때문입니다. 아울러, 언어적인 측면에서는 루마니아어를 모르더라도 새\n로운 언어를 배우는 데에 두려움을 갖지 말고 호기심을 가지고 적극적\n인 자세를 함양하는 게 도움이 되리라 생각합니다.\n우리 학과(부)·전공 매력 \n-  루마니아어는 동유럽 유일의 라틴 로망스어로 이태리어, 프랑스어, \n스페인어와 유사\n-  루마니아를 포함한 중부유럽 전체를 조망하며 국내외 연구기관과 유\n기적 연계\n-  루마니아 진출 및 유관 한국기업과의 협업\n-  취득 가능한 자격증: 유럽 언어 공통 기준(Common European \nFramework of Reference for Languages, CEFR by CE) 평가등급, \nFLEX 루마니아어 졸업인증\n주요 전공과목 \n1학년  루마니아학입문, 기초루마니아어문법작문, 초급루마니아어번역\n연습, 초급루마니아어회화, 초급시청각루마니아어, 초급루마니\n아어문법작문\n2학년  루마니아사정, 중급루마니아어문법작문, 중급루마니아어번역연\n습, 중급루마니아어회화, 루마니아문화, 고급루마니아어문법작문\n3학년  고급루마니아어회화, 루마니아 문학사, 루마니아 현대문학, 루마', '학자를 배출함으로써, 국제사회에서 탄소외교의 신뢰성을 확보할 수 \n있을 것으로 기대합니다. \n-  기후변화 관련 국제적 수준의 연구경험을 쌓을 수 있는 기회를 제공\n합니다.\n-  대기환경기사 또는 온실가스 관리기사 자격증을 취득할 수 있는 커리\n큘럼으로 구성되어 있습니다.\n주요 전공과목 \n기후변화융합학부는 온실가스 감시 및 예측, 기후변화경제, 에너지 관\n리 및 정책 총 세 개의 트랙으로 구성되어 있습니다. 각 트랙별로 짜임\n새 있는 강의 계획을 통해, 해당 트랙에 관심이 있는 학부생들에게 학습 \n방향을 제시해줄 것입니다.\n-  기후 빅데이터 프로그래밍 및 실습: 기후변화와 관련된 빅데이터를 \n처리하고 분석하는 방법을 학습하는 과목입니다. 이 과목에서는 데이\n터 수집, 데이터 저장, 데이터 처리, 데이터 분석, 데이터 시각화 등의 \n내용을 다룹니다. 학습에 사용할 프로그램은 주로 오픈소스인 R이나 \npython을 사용합니다. 기후변화연구에 특화된 분석법을 소개하고 다\n양한 형태의 입력자료들을 처리하는 방법에 대해 수업합니다.\n-  기후변화개론: 기후변화로 인해 발생한 현상들을 중점적으로 살펴보\n며, 학생들이 환경 이슈에 대한 자신의 생각을 정립하는 것을 목표로 \n합니다. 학생들은 수업을 통해 기후변화의 이론과 현상, 관련 정책, 그\n리고 지구적 차원의 대응 양상에 대해 학습하게 됩니다. 이 과목은 기\n후변화에 대한 전반적인 이해를 넘어 기후변화 적응의 필요성을 이론\n적으로 검토하고, 기후변화 적응 전략을 어떻게 구체적으로 수립할 것\n인지를 모색하기 위해 기존에 이루어진 적응전략들을 깊이 있게 검토 \n분석함으로써 기후변화 적응전략을 수립할 수 있는 인재를 양성하는 \n것을 목표로 합니다. \n-  기후계량경제학: 경제이론의 실증적인 분석을 위해 근대 통계학과 경\n제수학에 대해 학습합니다. (1) 경제이론형성에서는 경제이론에 대한 \n기본적인 내용을 배웁니다. (2) 모형구성은 형성된 경제이론의 수식화\n에 대해 학습합니다. (3) 통계분석법에서는 수식화에서 얻은 식에 통\n계방법을 이용하여 과거의 통계자료를 부합시키는 과정을 배웁니다(\n상관계수, 다중공선성, 식별, 자기상관등의 제반계량경제의 모형 등). \n이외에도 여러 가지 경제자료의 출처와 자료를 읽는 능력, 수집된 경\n제자료를 배열하고 처리하는 능력 등을 배웁니다. 이를 통해 경제현\n상에 대한 가설들을 실증적으로 검증할 수 있는 능력을 양성합니다.']","월요일 7, 8교시에 들을 수 있는 교양 과목은 다음과 같습니다:

1. **비즈니스협상**  
   - 교수: 신진호  
   - 강의실: 4411호  
   - 학점: 2  
   - 전공필수 과목 아님  
   - 온라인강의 아님  
   - P/F 평가 과목 아님  

2. **법률과일상생활**  
   - 교수: 박한성  
   - 강의실: 2201호  
   - 학점: 2  
   - 전공필수 과목 아님  
   - 온라인강의 아님  
   - P/F 평가 과목 아님  

이 과목들은 교양 과목으로, 수강신청 시 확인하시기 바랍니다. 혹시 더 도와드릴까요?","월요일 7,8교시에 들을 수 있는 교양 과목에는 '인간과 사회', '대중문화 예술의 이해', '비즈니스협상' 등이 있습니다.",0.0,0.0,,0.7912963930587479
글스산 졸업하면 뭐해?,"['2025학년도 교직과정 이수예정자 선발 공고 (비사범대학 교직 이수 예정자) 새글', '2025학년도 교직과정 이수예정자 선발 공고 (비사범대학 교직 이수 예정자) 새글\n\n◆ 글로벌캠퍼스 학사종합지원센터\xa0 교직담당 031-330-4953, min sun@hufs.ac.kr\n\n2 0 25 . 4.\n\n사범대학장 · 글로벌캠퍼스 교무처장\n\n| 0 |\n|:-----------------------------------------|\n| 2025학년도 교직과정 이수예정자 선발 공고 |', '3학년  통번역을 중점적으로 다루며 졸업시험을 위한 FLEX 준비도 시\n작하게 됩니다. \n4학년  인터뷰하기, 이력서 쓰기, 계약 서류 작성하기와 같은 실용 그\n리스어·불가리아어를 가르칩니다. 그리스·불가리아에 대한 다면\n적, 다각도적인 심화 교육을 위해 그리스·불가리아 데이터를 활\n용한 빅데이터 분석, 메타버스 활용 수업, 무역 실습 등을 동시\n에 운영합니다. \n졸업 후 진로 \n-  정부 및 공공기관: 대사관, 정부 산하 공기업 및 준정부기관\n-  기업: 국내, 아테네 및 소피아 소재 대기업, 방송사, 항공사, 언론사, \n광고·PR사, IT 등\n-  학계: 대학교수, 국내외 연구기관 연구원, 국내외 석·박사 진학\n-  창업: 한국-그리스, 한국-불가리아 수출입 및 이커머스 기업 창업', '을 공부해 두는 것이 좋습니다. 졸업 후 취업 또는 진학에 관계없이 영어 \n구사 능력은 항시 요구되므로 대학 입학 이후부터 읽기, 듣기, 말하기, \n쓰기 모든 분야에서 영어 능력을 지속적으로 계발하는 것이 매우 중요\n합니다. 고학년 기간에는 이론적인 지식이 아니라 연구실 인턴을 통해 \n관심분야의 연구를 경험해보며 자신의 진로를 준비하는 것이 좋습니다.\n졸업 후 진로 \n-  기업체: 석유화학, 반도체/전자, 에너지, 신소재, 재료, 바이오, 의료 및 \n제약, 화장품 및 식품 분야\n-  정부 및 공공기관: 국가/지방 공무원 및 정부 산하 공기업\n-  학자 및 연구직: 대학 교수, 국공립연구소 및 정부 출연 연구소, 기\n업 연구소\n-  기타: 교사(교직이수), 창업\nQ&A', '네 분야 중 학생이 선택한 분야에 초점을 맞추어 강의를 듣게 됩니다.\n3학년  2학년에 수강한 분야들 중 하나 혹은 두 분야에 초점을 맞추어 수\n업을 들으면서 졸업논문 프로젝트를 위한 강의도 수강하게 됩니다.\n4학년  실습이나 연습 과목 위주로 수강하면서 졸업논문 계획서 제출, \n졸업논문 작성 및 완성본 제출을 하게 됩니다.\n졸업 후 진로 \n-  기업: 마케팅, 콘텐츠 비즈니스, 콘텐츠 기획, 해외전략기획 \n-  공기업: 관광, 민간외교, 문화교류, 전시, 기록관리 \n-  대학원: 국제대학원, 일반대학원의 한국어교육 및 한국학 관련 학과 \nQ&A \nQ1. 한국학과 학생들은 졸업 후 주로 어떤 분야로 진출하나요? \nA1.  한국학과 졸업생들은 학과에서 이수한 전공 교육에 기초하여 국내·외', '전공 공부에 도움이 됩니다. \n2학년  자연스럽고 유창한 그리스어·불가리아어 구사 능력을 기르기 위\n해 회화, 강독 심화 과목을 수강하게 됩니다. 언어와 더불어 기본\n적인 문화에서 더 나아가 역사, 지중해 유산, 지리연구 등 지역학 \n과목을 함께 수강합니다.\n3학년  통번역을 중점적으로 다루며 졸업시험을 위한 FLEX 준비도 시\n작하게 됩니다. \n4학년  인터뷰하기, 이력서 쓰기, 계약 서류 작성하기와 같은 실용 그\n리스어·불가리아어를 가르칩니다. 그리스·불가리아에 대한 다면\n적, 다각도적인 심화 교육을 위해 그리스·불가리아 데이터를 활\n용한 빅데이터 분석, 메타버스 활용 수업, 무역 실습 등을 동시\n에 운영합니다. \n졸업 후 진로 \n-  정부 및 공공기관: 대사관, 정부 산하 공기업 및 준정부기관\n-  기업: 국내, 아테네 및 소피아 소재 대기업, 방송사, 항공사, 언론사, \n광고·PR사, IT 등\n-  학계: 대학교수, 국내외 연구기관 연구원, 국내외 석·박사 진학', '본인의 관심과 희망에 따라 그리스학 또는 불가리아학을 직접 선택\n합니다. 그리스학 전공생과 불가리아학 전공생 모두 원하는 수업을 \n수강할 수 있도록 언제나 강의실의 문은 열려있습니다.\nQ3.  졸업 후 어떤 분야로 진출할 수 있나요?\nA3.  졸업 후에는 그리스나 불가리아에 소재한 국내 대기업의 현지법\n인, 무역 통상 관련 기관이나 기업으로 취업이 용이합니다. 또한 양\n국 주재 대사관 또는 국가공무원, KOTRA, 상공회의소 등으로 진로\n를 정할 수 있습니다. 각 기업에서는 한국에 유일하게 존재하는 그\n리스·불가리아학과를 졸업한 것에 좋은 인상을 가지고, 도전정신을 \n높이 삽니다. 교육이나 연구 분야에서는 국내외 대학교 교수, 유럽 \n지역 문화, 외교 안보 분야 및 에너지 분야에 연구원으로 진출할 수 \n있습니다. 이외에도 국내 유수의 금융기관, IT기업, 항공해운기업, \n언론 방송 분야에서 활동할 수 있습니다. \nQ4.  그리스·불가리아학과에 대한 자세한 정보를 얻을 수 있나요?', '리합니다. 또한, 어학 이외에도 언론, 상경, 사회, 이공계열을 자유\n롭게 부전공, 제2전공 및 복수 전공으로 하여 철학적 사고력을 바\n탕으로 다른 전공에서 실력을 발휘하여 다양한 분야에 진출할 수 \n있습니다. 1988년 교직 과정 인가 이후 많은 동문이 교사 자격증\n을 취득하고 학교 선생님을 하고 있으며, 또 2007년 논술 교육인\n증 프로그램 실시 이후 많은 학생들이 이 자격을 동시에 취득하고 \n졸업하고 있습니다. 특히 논술 교육인증 프로그램은 국내 최초로 \n실시하여 앞으로 MEET, LEET 및 각종 공무원 시험에서 실시되는 \n논술 및 추리논증 시험을 대비하는 데에도 유리합니다.\nQ3.  철학과를 졸업하면 무엇을 하나요?\nA3.  철학과 졸업생들은 전공 공부를 통해 사물을 종합적으로 바라보면', '해결하세요. 처음에는 힘들고 오랜 시간이 걸리겠지만, 이러한 어려\n움 통과해야 성장하고 시대가 요구하는 인재가 되는 것입니다.\n3.  산책 등 스스로 생각하는 습관을 만들고 동시에 글쓰기 실력을 기르\n세요. 한편, ChatGPT에게 다양한 질문과 요구를 연습하는 것도 논리\n적으로 생각을 정리하여 표현하는 능력을 기르는 좋은 방법입니다.\n졸업 후 진로 \n수학과 졸업생의 진로를 아래와 같이 크게 세 분야로 나눌 수 있습니다. \n우리 수학과는 항상 시대의 요구를 살펴 학생들이 사회에서 제 몫을 다 \n할 수 있도록 최선을 다해 노력하고 있습니다.\n-   IT 분야: 프로그램 개발자, data engineer, MLOps, data analysis \n수학과 졸업생들은 논리를 전개할 수 있는 능력과 사고력으로 높은 \n수준의 프로그래밍에 강합니다. 우리 과에는 수치해석을 전공하신 교\n수님뿐만 아니라 컴퓨터공학에 전문성을 가지신 교수님도 계셔서 IT \n분야에 진출을 원하는 학생들에게 수준 높은 교육이 가능합니다.\n-  금융 분야: 은행, 증권사, 보험계리사 \n우리 학과에는 금융 수학을 전공하신 두 분의 교수님이 계십니다. 관\n련 학회의 회장을 하시는 등 학계에서 중추적인 역할을 하실 뿐만 아\n니라 다양한 활동을 활발히 하고 계십니다. 그래서 졸업생들이 은행, \n증권사에서 혹은 보험계리사 등으로 왕성하게 활동 중입니다.\n-  교육과 연구 분야: 중-고등학교 교사, 교수 \n평균으로 볼 때 우리 학과는 최근 10년간 임용시험 합격자를 꾸준하\n게 배출하고 있습니다. 또한 미국 명문대학교에서 교수로 활동하고 \n있는 졸업생도 있는 등 교육 분야에서 졸업생들의 활동이 괄목할 만\n합니다. 수학이라는 전공 특성으로 출판 등 다양한 교육계에서 활동\n하는 졸업생들도 많습니다.\nQ&A \nQ1.  수학과를 졸업하면, 진로 선택이 교육과 연구 분야로 제한되나요?\nA1.   수학과 졸업생의 장점은 엄밀한 논리 전개와 사고의 자유로움입니\n다. 기술의 발달로 다양한 분야의 많은 직무가 자동화되어 수준 높\n은 사고를 할 수 있는 인재가 시대의 요구입니다. 이러한 면에서 수\n학과 졸업생은 IT분야뿐 아니라 금융권 등 다양한 분야에 진출하고 \n있습니다. 또한 우리 학과는 졸업생들이 많이 진출하는 금융과 IT \n분야에 맞춤형 커리쿨럼을 제공하고 있습니다.\nQ2. 수학과의 전공 수학은 고등학교 수학과 다른가요?', '을 공부해 두는 것이 좋습니다. 졸업 후 취업 또는 진학에 관계없이 영어 \n구사 능력은 항시 요구되므로 대학 입학 이후부터 읽기, 듣기, 말하기, \n쓰기 모든 분야에서 영어 능력을 지속적으로 계발하는 것이 매우 중요\n합니다. 고학년 기간에는 이론적인 지식이 아니라 연구실 인턴을 통해 \n관심분야의 연구를 경험해보며 자신의 진로를 준비하는 것이 좋습니다.\n졸업 후 진로 \n-  기업체: 석유화학, 반도체/전자, 에너지, 신소재, 재료, 바이오, 의료 및 \n제약, 화장품 및 식품 분야\n-  정부 및 공공기관: 국가/지방 공무원 및 정부 산하 공기업\n-  학자 및 연구직: 대학 교수, 국공립연구소 및 정부 출연 연구소, 기\n업 연구소\n-  기타: 교사(교직이수), 창업\nQ&A \nQ1.  한국외대 화학과에 진학하려고 하는데 영어를 잘해야 하나요?\nA1.   한국외대 화학과에서는 원서 전공 교과목 수업과 영어 졸업논문 발\n표 등을 통해 화학 전문 영어를 습득하게 합니다. 또한, 외국어 대', '기본 지식을 배우고 필요한 기술 및 연구 능력을 배양합니다.\n학과(부) 특별 프로그램 \n-  졸업생들의 정성으로 모은 동문장학금 지급(가계 곤란자와 성적우수자) \n-  매 학기 성적 우수자 장학금 지급\n-  교수-학생, 졸업생-3·4학생 멘토링 프로그램 운영\n-  본교 석·박사과정 진학 시 장학생 우선선발 등(본교 내규에 따름)\n학과(부) 행사 및 동아리 활동 \n-  홈커밍 데이: 재학생과 졸업생 선배님들과의 친목 활동\n-  학회: 관심 있는 분야를 연구, 공부', '수님뿐만 아니라 컴퓨터공학에 전문성을 가지신 교수님도 계셔서 IT \n분야에 진출을 원하는 학생들에게 수준 높은 교육이 가능합니다.\n-  금융 분야: 은행, 증권사, 보험계리사 \n우리 학과에는 금융 수학을 전공하신 두 분의 교수님이 계십니다. 관\n련 학회의 회장을 하시는 등 학계에서 중추적인 역할을 하실 뿐만 아\n니라 다양한 활동을 활발히 하고 계십니다. 그래서 졸업생들이 은행, \n증권사에서 혹은 보험계리사 등으로 왕성하게 활동 중입니다.\n-  교육과 연구 분야: 중-고등학교 교사, 교수 \n평균으로 볼 때 우리 학과는 최근 10년간 임용시험 합격자를 꾸준하\n게 배출하고 있습니다. 또한 미국 명문대학교에서 교수로 활동하고 \n있는 졸업생도 있는 등 교육 분야에서 졸업생들의 활동이 괄목할 만\n합니다. 수학이라는 전공 특성으로 출판 등 다양한 교육계에서 활동\n하는 졸업생들도 많습니다.\nQ&A \nQ1.  수학과를 졸업하면, 진로 선택이 교육과 연구 분야로 제한되나요?', '금을 지급합니다.\n슬기로운 대학생활 \n1학년 과정에서는 자연과학의 필수적인 기초지식과 환경문제와 관련된 \n교양과정을 학습한 후, 2, 3, 4학년 과정에서는 개인의 적성과 관심에 따\n라 환경공학 분야, 청정에너지 분야, 생명공학 응용분야에 대한 깊이 있\n는 학습을 하게 됩니다. 더불어 교과 시간에 학습한 내용을 토대로 석/\n박사과정의 대학원생들과 함께 구체적인 연구 및 실습을 할 수 있도록 \n교과과정이 편성되어 있으며, 6개의 실험실에서 대학원생과 교수님의 \n지도 아래 연구실험을 할 수 있는 기회가 주어집니다.\n졸업 후 진로', '해석하고 실제 물리적 학습 내용을 바탕으로 반도체 등에 적용 가능한 \n기본 지식을 배우고 필요한 기술 및 연구 능력을 배양합니다.\n학과(부) 특별 프로그램 \n-  졸업생들의 정성으로 모은 동문장학금 지급(가계 곤란자와 성적우수자) \n-  매 학기 성적 우수자 장학금 지급\n-  교수-학생, 졸업생-3·4학생 멘토링 프로그램 운영\n-  본교 석·박사과정 진학 시 장학생 우선선발 등(본교 내규에 따름)\n학과(부) 행사 및 동아리 활동 \n-  홈커밍 데이: 재학생과 졸업생 선배님들과의 친목 활동\n-  학회: 관심 있는 분야를 연구, 공부', '슬기로운 대학생활 \n산업공학은 세부 전공의 범위가 넓고 다양합니다. 입학 후 1,2학년은 다\n양한 전공과목을 배우고 이 중에 본인의 적성에 맞는 세부 전공을 찾는 \n과정입니다. 3학년에는 본격적으로 깊은 전공 지식을 배웁니다. 4학년 \n1학기에는 그 동안 배운 전공 지식을 총동원해서 캡스톤디자인 프로젝\n트를 수행합니다. 이 과정에서 이론으로 배운 지식을 실제 문제해결 과\n정에 적용하는 방법을 배우고 더불어 졸업 후 큰 도움이 되는 특허 작성, \n논문/학회 발표, 시스템 제작 등을 수행합니다. 4학년 2학기에는 그 동\n안 배운 지식과 경험을 가지고 관심있는 기업에서 인턴과정을 수행하거\n나 더 깊은 공부를 하기 위한 대학원 과정을 준비합니다.\n졸업 후 진로', '니라 다양한 활동을 활발히 하고 계십니다. 그래서 졸업생들이 은행, \n증권사에서 혹은 보험계리사 등으로 왕성하게 활동 중입니다.\n-  교육과 연구 분야: 중-고등학교 교사, 교수 \n평균으로 볼 때 우리 학과는 최근 10년간 임용시험 합격자를 꾸준하\n게 배출하고 있습니다. 또한 미국 명문대학교에서 교수로 활동하고 \n있는 졸업생도 있는 등 교육 분야에서 졸업생들의 활동이 괄목할 만\n합니다. 수학이라는 전공 특성으로 출판 등 다양한 교육계에서 활동\n하는 졸업생들도 많습니다.\nQ&A \nQ1.  수학과를 졸업하면, 진로 선택이 교육과 연구 분야로 제한되나요?\nA1.   수학과 졸업생의 장점은 엄밀한 논리 전개와 사고의 자유로움입니\n다. 기술의 발달로 다양한 분야의 많은 직무가 자동화되어 수준 높', '-  학계: 대학교수, 국내외 연구기관 연구원, 국내외 석·박사 진학\n-  창업: 한국-그리스, 한국-불가리아 수출입 및 이커머스 기업 창업\n-  금융: 금융권 공기업, 은행, 증권, 투자회사\nQ&A \nQ1.  그리스어, 불가리아어를 전혀 몰라도 입학할 수 있나요?\nA1.  모든 신입생은 알파벳부터 공부하기 시작합니다. 알파벳부터 시작\n해서 외국인과 내국인 교수님이 작문, 문법, 회화, 독해, 통·번역, 실\n무 언어 등으로 나누어 수업을 진행합니다. 학년이 올라감에 따라', '학습을 할 수 있습니다. 그리고 현지에서 어학연수를 통해 그리스어\n와 불가리아어를 배울 수 있습니다.\nQ2.  그리스·불가리아학과에서는 그리스어와 불가리아어를 둘 다 배우\n는 것인가요?\nA2.  두 언어 중 하나를 선택하면 됩니다. 입학 직후, 전공 설명회를 듣고 \n본인의 관심과 희망에 따라 그리스학 또는 불가리아학을 직접 선택\n합니다. 그리스학 전공생과 불가리아학 전공생 모두 원하는 수업을 \n수강할 수 있도록 언제나 강의실의 문은 열려있습니다.\nQ3.  졸업 후 어떤 분야로 진출할 수 있나요?\nA3.  졸업 후에는 그리스나 불가리아에 소재한 국내 대기업의 현지법\n인, 무역 통상 관련 기관이나 기업으로 취업이 용이합니다. 또한 양\n국 주재 대사관 또는 국가공무원, KOTRA, 상공회의소 등으로 진로', '그리고 토론 등의 방법으로 수업을 합니다. 철학은 크게 동양철학\n과 서양철학으로 나뉩니다. 동양철학은 분야에 따라 유가철학, 도\n가철학, 불교철학으로 구분되고, 지역에 따라 한국철학, 중국철학, \n인도철학으로 구분됩니다. 동양철학 공부를 위해서는 한문과 중국\n어, 일본어 그리고 영어를 익히는 것이 좋습니다. 서양철학은 주제\n에 따라 논리학, 인식론, 형이상학, 존재론, 윤리학, 현상학, 해석학, \n언어철학, 과학철학, 심리철학, 미학, 수사학, 논술 등으로 구분됩니\n다. 시대적으로 서양고/중세철학, 서양근/현대철학으로 구분되고 \n지역에 따라 독일철학, 프랑스철학, 영미철학 등으로 구분됩니다. \n이외에 영화와 철학, 문학과 철학, 문화와 철학 등의 응용분야를 공\n부합니다. 서양철학 공부를 위해서는 영어, 프랑스어, 독일어, 희랍\n어, 라틴어 등을 익히는 것이 좋습니다.\nQ2.  한국외국어대학교 철학과만의 특징이 있나요?\nA2.  우리 한국외국어대학교 철학과의 특성을 다른 대학교와 비교해 볼 \n때, 철학을 제1전공으로 하면서 세계 모든 나라의 언어를 제2전공\n으로 하는 것이 가능하기 때문에 세계 어떤 문화권 철학도 공부할 \n수 있는 장점이 있습니다. 그래서 유학을 희망하는 학생들에게 유\n리합니다. 또한, 어학 이외에도 언론, 상경, 사회, 이공계열을 자유\n롭게 부전공, 제2전공 및 복수 전공으로 하여 철학적 사고력을 바\n탕으로 다른 전공에서 실력을 발휘하여 다양한 분야에 진출할 수 \n있습니다. 1988년 교직 과정 인가 이후 많은 동문이 교사 자격증\n을 취득하고 학교 선생님을 하고 있으며, 또 2007년 논술 교육인\n증 프로그램 실시 이후 많은 학생들이 이 자격을 동시에 취득하고 \n졸업하고 있습니다. 특히 논술 교육인증 프로그램은 국내 최초로 \n실시하여 앞으로 MEET, LEET 및 각종 공무원 시험에서 실시되는 \n논술 및 추리논증 시험을 대비하는 데에도 유리합니다.\nQ3.  철학과를 졸업하면 무엇을 하나요?\nA3.  철학과 졸업생들은 전공 공부를 통해 사물을 종합적으로 바라보면\n서도 예리하게 분석하는 안목 그리고 창의적 사유력을 기르게 되\n기 때문에 교직을 비롯하여 언론계, PD, 작가 등으로 많이 진출하\n였으며, 기타 일반 기업체, 금융기관, 국가기관, 영화계, 컴퓨터프\n로그래밍 등 매우 다양한 분야에 진출하고 있습니다.', '4학년  전공심화과목을 수강하고, 본인 진로와 관련된 강좌를 집중적으로 \n이수합니다. 학과 전임교수의 지도하에 졸업논문을 작성합니다. \n졸업 후 진로 \n-  정부 및 공공기관: 국공립 박물관의 학예직공무원, 국가기록원 및 지\n자체·대학역사관의 기록연구사, 공무원 등\n-  교육 및 연구: 대학교수, 역사교사, 역사문화 관련 연구소 및 박물관\n의 큐레이터 등\n-  기업체: 일반기업체 및 벤처기업 회사원\n-  기타: 문화예술종사자, 프로그래머 등\nQ&A \nQ1.  역사학을 공부하려면 암기력이 중요한가요?\nA1.  꼭 그렇지만은 않습니다. 역사학은 사료를 검증, 분석하고, 추론하\n면서 역사의 지속과 변화를 탐구하는 학문입니다. 우리 사학과에서 \n공부하면서 이러한 학술적 능력과 함께 창의력을 체계적으로 함양\n할 수 있습니다.\nQ2.  사학을 공부하고 졸업하면 순수한 학술연구 외에 전공 관련해서 \n어떤 일을 할 수 있나요?\nA2.  적지 않은 졸업생들이 기록연구사, 역사교사, 학예연구원 등으로 \n활발하게 활동하고 있습니다. 최근에는 역사콘텐츠의 중요성이 제\n고되면서, 문화예술, 게임분야에서 활약하는 졸업생들도 늘어나\n고 있습니다. \n학과(부) 행사 및 동아리 활동 \n-  동사무소(동양철학): 공자, 맹자 등 특정 철학자의 사상에만 국한되지 \n않고, 전반적인 동양 철학사의 흐름과 이에 따른 사상적 차이들을 학\n습하며 이에 대한 의견을 학회원들끼리 토의합니다.\n-  엑스페르고(서양철학): 혼자 읽고 이해하기엔 버거운 여러 철학 고전 \n서적들을 함께 읽어나가며 자유롭게 토론합니다. 이를 통해 철학자들\n의 사유를 이해하고 비판적 시각을 통해 스스로의 철학적 사유를 기르\n는 훈련을 할 수 있습니다.\n-  앤솔로지(예술철학): 아름다움과 예술 이전의 논의들을 학습한 후 현\n대 문화를 파악하는 여러 방법들을 공부합니다.\n-  LOPES(서양철학사&데이터분석): 영어 원문 번역방식의 서양철학사 \n스터디와 데이터 분석을 통해 통계분석용 프로그램 및 다양한 데이터 \n분석기법과 머신러닝 같은 기술 등을 학습합니다.\n-  철학인의 밤: 학생들의 학술 세미나 및 친목 활동 \n-  철학과 한마당 행사: 연말 중 시행되는 철학과 선배, 교수님들이 함\n께하는 행사로 다양한 이벤트 등과 함께 선배, 교수님과 담소를 나누\n는 친목 활동 \n-  한국외대 총장배 토론대회: 2008년도부터 시작된 토론대회로 인문', '2026년 전기 학위수여식 일정:\n2026-02-20 (금요일)', '## [footer] ##\n- 53 -', '## [heading1] ##\n# ⑦ 디지털인문한국학전공(서울캠퍼스에서 수강)\n\n## [heading1] ##\n# ※ 신규신청 불가\n\n## [paragraph] ##\n1) 한국의 인문학적 전통과 문화에 대한 심층적 지식을 바탕으로 디지털 매체를 활용한 해외\n송출과 쌍방향 소통이 가능한 지식통합형 인재를 길러내기 위한 융합전공으로 한국의 언어/\n문학, 사상, 역사에 대한 인문지식을 균형 있게 학습하고 이를 디지털 테크놀로지를 활용하\n여 콘텐츠화 하는 방법론을 습득함\n\n## [heading1] ##\n# 2) 이수학점 및 이수영역\n\n## [table] ##\n| 구분 | 이수학점 | 이수영역 |\n| --- | --- | --- |\n| 2014 학번까지 | 54학점 | 공통기초 6학점 + 연계기초 6학점 + 전공교과 42학점 |\n| 2015 학번부터 | 42학점 | 공통기초 6학점 + 연계기초 6학점 + 전공교과 30학점 |', '## [list] ##\n- - 공통기초 과목(6개 과목, 과목당 3학점) : 디지털인문학 입문, 인문한국학 입문(이상\n- 디지털인문한국학 과목), 언어와 논리, 인지과학 입문(이상 언어와 공학 과목),\n- 문화예술 경영론, 미디어연구 방법론(이상 세계문화예술경영 과목)\n- - 연계기초 과목 (과목당 3학점) : 한국철학사 (철학과), [한국사입문(사학과), 문화사와\n- 이문화이해(사학과), 한국문화사(사학 부전공), 한국근세사(사학 부전공) 중 택1], KFL\n- 문법(언어인지과학과), 인문지식위키(지식콘텐츠학부) 또는 디지털시대의텍스트와지식\n- (문화콘텐츠학융합전공), 한국현대사회와문학, 한국근대사(이상 한국학과 과목), 기록\n- 의조직화와정보-문화 서비스(정보기록문화유산관리학전공), 컴퓨터프로그래밍(융복합\n- 소프트웨어전공) 또는 언어분석을 위한 프로그래밍(언어와공학전공)\n- 기타 연계기초과목과 유사과목으로 주임교수가 인정한 과목\n- - 전공교과 과목 (과목당 3학점) : 한국사상과 철학, 한국사회와 역사, 한국어와 문화,\n- 디지털한국학과 한국문화 탐방, 인문콘텐츠와 시맨틱 웹, 한국기록문화와 디지털화,\n- 한국문학과 스토리텔링, 디지털한국어 문법, 한국학콘텐츠와 시각적 활용, 한국학\n- 아카이빙과 지식맵, 디지털한국학과 데이터베이스, 한국의 미와 디지털화, 한국학교육\n- 방법론, 한국학 자료 기록관리와 빅데이터, 디지털인문한국학콘텐츠와 한국사상, 공공\n- 데이터 서비스와 문화정책 연구, 한국학과 CDN, 한국학 이러닝 방법론\n- - 공통기초 과목과 연계기초 과목은 서울캠퍼스와 글로벌캠퍼스에서 개설되며(일부는\n- 대체과목으로 지정), 전공교과 과목은 서울캠퍼스에서만 개설됨\n- - 공통기초, 연계기초 과목 타학과(전공)에서 수강 시 유의사항 : 수강신청 후 학사종합\n- 지원센터 단과대학 교학파트(본인 1전공 소속 기준)에 방문하여 ‘이수구분변경신청서’를\n- 작성하여야 이중전공 학점으로 처리됨', '## [list] ##\n- 3) 졸업 요건 : 졸업논문 심사(지도교수가 배정되어 졸업 논문을 지도함.)\n- 4) 문의처 : 031-330-4488~92\n\n## [footer] ##\n- 51 -', '## [heading1] ##\n# ⑧ 데이터사이언스전공\n\n## [heading1] ##\n# ※ 신규신청 불가\n\n## [paragraph] ##\n1) 개요 및 교육목표\n\n## [paragraph] ##\n-\n\n## [paragraph] ##\n데이터과학은 데이터로부터 지식과 통찰을 뽑아내는 과학적 방법론을 연구하는 학문이며,\n최근 관심을 모으는 인공지능 구현의 ‘핵심 기반 학문’이다. 고도의 인공지능 학습을\n위해서는 데이터를 재료로 분석, 가공, 정제, 모델링하는 과정이 필수적인데, 이러한\n일련의 과정은 데이터과학에 그 이론적 바탕을 두고 있다. 최근 데이터과학자, 데이터\n개발자, 데이터분석가 등의 인력 수요가 급격히 증가하고 있으며, 특히 통계학, 산업경영,\n컴퓨터공학 등의 전문지식과 분야별 도메인 지식을 결합한 통합적‧실무형 데이터 과학자는\n전통적인 제조업과 IT산업은 물론, 금융‧통신‧의료‧공공 부문 등 다양한 산업분야에서\n활발히 활동할 것으로 기대된다.\n\n## [heading1] ##\n# 2) 선발 및 이수자격\n\n## [list] ##\n- - 글로벌캠퍼스에서 이중전공 또는 부전공으로 이수함 (정원 40명)\n- - 전공 구분 없이 지원가능하며, 성적순 선발을 원칙으로 함\n\n## [heading1] ##\n# 3) 이수학점 및 이수영역\n\n## [list] ##\n- - 총 이수학점 : 42학점 이상\n- - 영역별 이수학점\n\n## [list] ##\n- ‧ 기초 이론 : 12학점 이상\n- ‧ 소프트웨어 및 데이터분석 : 18학점 이상\n- ‧ 융합형 프로젝트 : 3학점 이상(캡스톤설계1, 2 중 한 과목 이상 수강)\n\n## [heading1] ##\n# 4) 교과 과정\n\n## [paragraph] ##\n총 이수학점 : 42학점\n\n## [paragraph] ##\n-', '## [list] ##\n- ‧ 기초 이론 : 12학점 이상\n- ‧ 소프트웨어 및 데이터분석 : 18학점 이상\n- ‧ 융합형 프로젝트 : 3학점 이상(캡스톤설계1, 2 중 한 과목 이상 수강)\n\n## [heading1] ##\n# 4) 교과 과정\n\n## [paragraph] ##\n총 이수학점 : 42학점\n\n## [paragraph] ##\n-\n\n## [table] ##\n| 학년 | 이수영역 | 1학기 | 2학기 |\n| --- | --- | --- | --- |\n| 1학년 | 교양 | 컴퓨팅사고 또는 컴퓨터프로그래밍 | 컴퓨팅사고 또는 컴퓨터프로그래밍 |\n| 2학년 | 기초 이론 | 데이터사이언스개론 데이터사이언스를위한수학군* (필수, 택1) | 기초확률및통계군* (필수, 택1) 회귀분석군* (필수, 택1) 확률분포론 |\n| 2학년 | 소프트웨어 및 데이터 분석 | 자료구조 (필수) | 알고리즘 |\n| 3학년 | 소프트웨어 및 데이터 분석 | 수리통계학 시계열분석 경영과학 웹프로그래밍 기계학습군* (필수, 택1) | 다변량자료분석 운영체제 데이터베이스 텍스트애널리틱스 |\n| 4학년 | 소프트웨어 및 데이터 분석 | 데이터시각화 딥러닝응용 | 데이터사이언스특론 |\n| 4학년 | 융합형 프로젝트 | 캡스톤설계1 | 캡스톤설계2 |\n\n## [footer] ##\n- 52 -', '## [heading1] ##\n# < 동일과목 군(괄호 안은 개설학과/학기) >\n\n## [list] ##\n- - 기초확률 및 통계군 : 통계학및연습2(통계/2), 확률과통계(컴전(컴공)/2), 기초확률및통계(산경/2)\n- - 데이터사이언스를 위한 수학군 : 통계행렬론(통계/1), 선형대수(컴공/2)\n- - 회귀분석군 : 공학통계(산경/1), 회귀분석(통계/2)\n- - 기계학습군 : 데이터마이닝및실습(통계/2), 데이터마이닝응용(산경/2), 기계학습(컴전(컴공)/2),\n- 통계적기계학습및실습(통계/1)\n- ※ 각 군 내의 교과목은 동일 교과목들로서 1개 과목을 선택하며 중복 수강은 허용되지 않음\n- (수강 학기는 자율 선택)\n\n## [list] ##\n- < 전공교류교과목 >\n- - 아래 목록의 교과목 수강 시 데이터사이언스전공의 전공이수학점으로 인정됨', '## [table] ##\n| 개설학과(전공) | 교과목명 | 이수영역 |\n| --- | --- | --- |\n| 통계학과 | 통계학및연습2 | 기초 이론 : 기초확률및통계군(택1) |\n| 컴퓨터.전자시스템공학전공/컴퓨터공학전공 | 확률과통계 | 기초 이론 : 기초확률및통계군(택1) |\n| 산업경영공학과 | 기초확률및통계 | 기초 이론 : 기초확률및통계군(택1) |\n| 통계학과 | 통계행렬론 | 기초 이론 : 데이터사이언스를위한수학군(택1) |\n| 컴퓨터.전자시스템공학전공/컴퓨터공학전공 | 선형대수 | 기초 이론 : 데이터사이언스를위한수학군(택1) |\n| 산업경영공학과 | 공학통계 | 기초 이론 - 회귀분석군(택1) |\n| 통계학과 | 회귀분석 | 기초 이론 - 회귀분석군(택1) |\n| 컴퓨터.전자시스템공학전공/컴퓨터공학전공 | 자료구조 | 소프트웨어 및 데이터 분석 |\n| 컴퓨터.전자시스템공학전공/컴퓨터공학전공 | 알고리즘 | 소프트웨어 및 데이터 분석 |\n| 컴퓨터.전자시스템공학전공/컴퓨터공학전공 | 웹프로그래밍 | 소프트웨어 및 데이터 분석 |\n| 통계학과 | 확률분포론 | 기초 이론 |\n| 통계학과 | 수리통계학 | 소프트웨어 및 데이터 분석 |\n| 통계학과 | 다변량분석및실습 | 소프트웨어 및 데이터 분석 |\n| 통계학과 | 데이터마이닝및실습 | 소프트웨어 및 데이터 분석 : 기계학습군(택1) |\n| 산업경영공학과 | 데이터마이닝응용 | 소프트웨어 및 데이터 분석 : 기계학습군(택1) |\n| 컴퓨터.전자시스템공학전공/컴퓨터공학전공 | 기계학습 | 소프트웨어 및 데이터 분석 : 기계학습군(택1) |\n| 통계학과 | 통계적기계학습및실습 | 소프트웨어 및 데이터 분석 : 기계학습군(택1) |\n| 컴퓨터.전자시스템공학전공/컴퓨터공학전공 | 데이터베이스 | 소프트웨어 및 데이터 분석 |\n| 컴퓨터.전자시스템공학전공/컴퓨터공학전공 | 운영체제 | 소프트웨어 및 데이터 분석 |\n| 컴퓨터공학전공 | 자연어처리 | 소프트웨어 및 데이터 분석 |', '| 통계학과 | 통계적기계학습및실습 | 소프트웨어 및 데이터 분석 : 기계학습군(택1) |\n| 컴퓨터.전자시스템공학전공/컴퓨터공학전공 | 데이터베이스 | 소프트웨어 및 데이터 분석 |\n| 컴퓨터.전자시스템공학전공/컴퓨터공학전공 | 운영체제 | 소프트웨어 및 데이터 분석 |\n| 컴퓨터공학전공 | 자연어처리 | 소프트웨어 및 데이터 분석 |\n| 컴퓨터공학전공 | 컴퓨터비전 | 소프트웨어 및 데이터 분석 |\n| 컴퓨터공학전공 | 소셜네트워크분석 | 소프트웨어 및 데이터 분석 |\n| 컴퓨터공학전공 | 딥러닝 | 소프트웨어 및 데이터 분석 |\n| 컴퓨터공학전공 | 컴퓨터보안 | 소프트웨어 및 데이터 분석 |', '## [table] ##\n| 개설학과(전공) | 교과목명 | 이수영역 |\n| --- | --- | --- |\n| 컴퓨터공학전공 | 컴퓨터보안 | 소프트웨어 및 데이터 분석 |\n| 산업경영공학과 | 텍스트어낼리틱스 | 소프트웨어 및 데이터 분석 |\n| 산업경영공학과 | 경영과학 | 소프트웨어 및 데이터 분석 |\n| 산업경영공학과 | 딥러닝응용 | 소프트웨어 및 데이터 분석 |\n| 산업경영공학과 | 데이터사이언스개론 | 소프트웨어 및 데이터 분석 |\n| 산업경영공학과 | 데이터사이언스응용 | 소프트웨어 및 데이터 분석 |\n| AI융합전공 | 자료구조 | 소프트웨어 및 데이터 분석 |\n| AI융합전공(SW&AI) | 알고리즘 | 소프트웨어 및 데이터 분석 |\n| AI융합전공(SW&AI) | 운영체제 | 소프트웨어 및 데이터 분석 |\n| AI융합전공(SW&AI) | 웹프로그래밍 | 소프트웨어 및 데이터 분석 |\n| AI융합전공(SW&AI) | 데이터베이스 | 소프트웨어 및 데이터 분석 |\n| AI융합전공(SW&AI) | 기계학습 | 소프트웨어 및 데이터 분석 |\n| 통계학과 | 데이터시각화 | 소프트웨어 및 데이터 분석 |\n| 통계학과 | 시계열분석및연습 | 소프트웨어 및 데이터 분석 |\n| 통계학과 | 베이지안통계학 | 소프트웨어 및 데이터 분석 |\n| 통계학과 | 데이터사이언스세미나 | 소프트웨어 및 데이터 분석 |\n| 통계학과 | 통계행렬론연습 | 통계행렬론을 수강해야 인정함 |\n| 통계학과 | 회귀분석연습 | 회귀분석을 수강해야 인정함 |\n| 통계학과 | 확률분포론연습 | 확률분포론을 수강해야 인정함 |\n| 통계학과 | 수리통계학연습 | 수리통계학을 수강해야 인정함 |\n\n## [heading1] ##\n# 5) 졸업 요건\n\n## [paragraph] ##\n- 졸업 과제 및 논문(전공 홈페이지에 게시)\n\n## [heading1] ##\n# 6) 문의처', '## [paragraph] ##\n(6) 이수요건 : 총 42학점 이수 및 트랙별 이수요건 충족 필수\n\n## [table] ##\n| 트랙 | 졸업요건 |\n| --- | --- |\n| Software & AI | ① 트랙 필수과목 수강 ②  트랙(공통과목 포함)에서 트랙 필수 과목을 포함한 30학점 이상 이수 ③ 졸업논문 통과 - 졸업논문은 <종합설계> 과목(필수)을 이수한 후 다음 학기에 작성 제출함 - 단, 8학기 이상 등록생으로서 부득이한 사유가 인정된 경우, 주임교수의 승인을 얻어 종합설계 수강과 졸업논문 작성을 병행할 수 있음. |\n| Language & AI | ① 트랙 필수과목 수강 ②  트랙(공통과목 포함)에서 트랙 필수 과목을 포함한 33학점 이상 이수, 언어학기초과목(*) 2학점 또는 3학점 이수 ③ 졸업시험 통과 * 언어학기초 과목은 언어 계열 학과에 개설된 언어학 개론 성격의 교과목임 (예 : 영어학개론, 불어학개론, 독어학개론, 언어학입문 등) - 상세 내용은 수강편람 또는 전공 홈페이지 참조 |\n| Business & AI | ① 트랙 필수과목 수강 ②  트랙에서 공통과목, 필수과목을 제외하고 18학점 이상 이수 |\n\n## [heading1] ##\n# (7) 문의처 : AI융합전공(\uf000 http://ai.hufs.ac.kr)\n\n## [table] ##\n| 트랙 | 문의처 |\n| --- | --- |\n| AI융합전공 공통과정 | AI융합전공 사무실 (☎ 02-2173-2643 / Email: aic@hufs.ac.kr) |\n| Software & AI | 컴퓨터공학부 (☎ 031-330-4268 / Email: ces@hufs.ac.kr) |\n| Language & AI | 언어공학연구소 (☎ 02-2173-2872 / Email: langai@hufs.ac.kr) |\n| Business & AI | AI융합전공 사무실 (☎ 02-2173-2643 / Email: bizai@hufs.ac.kr) |\n\n## [footer] ##\n- 59 -', '## [heading1] ##\n# 5) 졸업 요건\n\n## [paragraph] ##\n- 졸업 과제 및 논문(전공 홈페이지에 게시)\n\n## [heading1] ##\n# 6) 문의처\n\n## [list] ##\n- - 홈페이지 : ds.hufs.ac.kr / 이메일 : seokohj@hufs.ac.kr\n- - 전공주임 연구실 전화번호 : 031-330-4680\n\n## [footer] ##\n- 54 -', '## [heading1] ##\n# ⑨ 바이오데이터사이언스전공\n\n## [heading1] ##\n# ※ 신규신청 불가\n\n## [heading1] ##\n# 1) 개요 및 교육목표\n\n## [paragraph] ##\n- 헬스케어와 의료 빅데이터 분야의 고급 인력을 양성하는 프로그램으로 바이오데이터로부터\n지식과 인사이트를 뽑아내기 위해 사용하는 과학적 방법론을 교육함. 바이오메디컬공학과\n컴퓨터공학의 분야별 도메인 지식을 융합하는 학제 간 분야임.\n\n## [heading1] ##\n# 2) 이수학점 및 이수영역\n\n## [table] ##\n| 구분 | 이수학점 | 이수영역 |\n| --- | --- | --- |\n| 2015학번부터 | 42학점 | AI융합전공(A) 21학점 + 바이오메디컬공학(B) 21학점 + 컴퓨터공학부(C) 9학점 + 융합형(캡스톤설계 I, II) 교과목 6학점(필수) |\n\n## [heading1] ##\n# 3) 교과목 목록\n\n## [table] ##\n|  |  | 1학기 | 2학기 |\n| --- | --- | --- | --- |\n| 공통기초 | 공통기초 | 컴퓨팅사고(교양) | 컴퓨팅사고(교양) |\n| 전공 | 2학년 | 고급파이썬프로그래밍(A) 자료구조(C) | 자료구조(A) 확률과통계(A) 의학유전학 또는 의학유전학(의생명프로그래밍)(B) 선형대수(C) |\n| 전공 | 3학년 | 데이터사이언스(A) 생체신호계측기기설계및실습(B) 바이오메디컬인공지능(B) 생명정보학을위한 데이터마이닝(B) | 기계학습(A) 데이터베이스(A) 인공지능을 이용한 의료영상처리및실습 또는 의료영상처리의이론및실습(B) 의생명정보학(B) |\n| 전공 | 4학년 | 웹프로그래밍(A) 컴퓨터비전(C) 캡스톤설계 I(필수) | 정보시각화 또는 데이터시각화및실습(B) 캡스톤설계 II(필수) |\n\n## [paragraph] ##\n※ 각 교과목은 3학점/3시간으로 구성', '## [paragraph] ##\n※ 각 교과목은 3학점/3시간으로 구성\n\n## [list] ##\n- - 공통기초과목은 교양과목으로서 학생들은 컴퓨팅사고를 수강해야 함\n- - 전공 교과목은 AI융합전공 공통 및 Software&AI트랙(A), BME학부(B), 컴퓨터공학부\n- (C), 융합형 교과목(I, II) 영역으로 구성됨\n- - 자료구조는 1학기는 컴퓨터공학부, 2학기는 AI융합전공에서 선택(중복불가)\n- - 캡스톤설계 I은 AI융합전공 Software&AI 트랙 1학기에 개설하는 종합설계, BME전공\n- 1학기에 개설하는 BME캡스톤디자인실습, 컴퓨터공학전공에 매학기 개설하는 캡스톤\n- 설계 중에서 선택\n\n## [footer] ##\n- 55 -', '## [paragraph] ##\n- 전공 교과목은 AI융합전공 공통 및 Software&AI트랙 개설교과목이나, BME학부 개설\n교과목이나, 컴퓨터공학부의 개설 교과목을 이수함으로써 <바이오데이터사이언스>\n전공 학점을 충족시킬 수 있음.\n\n## [list] ##\n- ‧ AI융합전공 공통 및 Software&AI에서 개설되는 교과목(A)은 위에서 지정된 과목\n- 이외의 교과목은 지도교수의 승인에 의해 (A) 영역 교과목으로 인정받을 수 있음.\n- ‧ 바이오메디컬공학전공에서 개설되는 교과목(B)은 위에서 지정된 과목 교과목은 지도\n- 교수의 승인에 의해 (B) 영역 교과목으로 인정받을 수 있음.\n- ‧ 컴퓨터공학전공에서 개설되는 교과목(C)은 위에서 지정된 과목 이외의 교과목은\n- 지도교수의 승인에 의해 (C) 영역 교과목으로 인정받을 수 있음.\n\n## [paragraph] ##\n- ‘전공’ 인정과목\n\n## [list] ##\n- ‧ 운영학과(BME학부, 컴퓨터공학부, AI융합전공 공통 및 Software&AI)에 개설된 유사\n- 과목(주임교수 사전 승인)\n- ‧ 2학점의 관련 과목이 3학점인 ‘언어와공학’의 선택과목으로 인정될 때는 2학점만\n- 이수한 것으로 인정. 단, 2학점인 과목은 ‘언어와 공학’의 필수과목으로 인정될 수는 없음\n\n## [paragraph] ##\n4) 학생 선발\n\n## [paragraph] ##\n- 바이오데이터사이언스 융합전공은 모든 전공의 학생들이 선택할 수 있음. 각 전공의\n학생들이 이 융합전공을 이수하는 방식은 다음과 같음\n\n## [paragraph] ##\n<바이오데이터사이언스> 전공이수 방식', '## [paragraph] ##\n4) 학생 선발\n\n## [paragraph] ##\n- 바이오데이터사이언스 융합전공은 모든 전공의 학생들이 선택할 수 있음. 각 전공의\n학생들이 이 융합전공을 이수하는 방식은 다음과 같음\n\n## [paragraph] ##\n<바이오데이터사이언스> 전공이수 방식\n\n## [table] ##\n| 학생 구분 | 수강 과목 | 기대 효과 |\n| --- | --- | --- |\n| SW 전공학생 (컴퓨터공학부, 정보통신공학과) | SW 전공 57학점 SW 영역 추가 21학점 바이오메디컬영역 21학점 | - SW 영역 교과목 78학점 이수 - 바이오메디컬영역 21학점 이수 - SW 전공 과목을 <전공> 또는 <이중전공>으로 구분할 수 있음 |\n| 바이오메디컬전공 학생 | BME 전공 57학점 바이오메디컬영역 21학점 SW 영역 21학점 | - 바이오메디컬 영역 78학점 이수 - SW 영역 21학점 이수 - BME 전공 과목을 <전공> 또는 <이중전공>으로 구분할 수 있음 |\n| 기타 전공 학생 | 본인 전공 54학점 바이오데이터사이언스 42학점 | - 바이오데이터사이언스 융합전공 42학점 이수 |\n\n## [paragraph] ##\n5) 졸업 요건 : 졸업논문 심사(지도교수가 배정되어 졸업 논문을 지도함)\n\n## [list] ##\n- 6) 문의처 : 바이오메디컬공학부(031-330-4723)\n\n## [footer] ##\n- 56 -', '## [heading1] ##\n# ⑩ AI융합전공(Software&AI, Language&AI, Business&AI 트랙)\n\n## [heading1] ##\n# ※ 신규신청 불가\n\n## [heading1] ##\n# (1) 개요 및 교육목표\n\n## [paragraph] ##\n미래 산업이 AI 기반의 소프트웨어 중심으로 재편되면서 AI-SW 인재 양성이 국가적 핵심과제가\n되었고, 특히 소프트웨어 개발 능력과 함께 언어, 문화, 경제 등 여러 분야의 지식을 겸비한\n융복합형 전문인력이 요구되고 있다. 이러한 사회적 요구에 부응하여 본 과정은 AI 분야와\n언어, 비즈니스, 공학 지식을 결합한 AI 소프트웨어 융합인재 양성을 목표로 한다. 2학년은\n공통 과정을 이수하며, 3학년 진입 시에 다음 트랙 중 하나를 선택해야 한다.\n\n## [heading1] ##\n# 가. Software & AI 트랙\n\n## [paragraph] ##\n인문학 소양을 갖춘 융합형 IT 전문인력 양성을 목표로 한다. 이를 위해 핵심 소프트웨어\n교과목과 종합설계, 인턴십으로 구성된 교과과정을 중심으로 최근 AI와 관련한 사회적\n요구에 부응하기 위해 데이터사이언스, 빅데이터처리, 기계학습, 딥러닝 등 소프트웨어와\nAI 융합 교육을 제공한다.\n\n## [heading1] ##\n# 나. Language & AI 트랙\n\n## [paragraph] ##\n언어학(Language)과 공학(AI)이 융합된 교육 과정을 통해, 인문·사회 계열의 학생들도\n실용 기술 분야로 진출할 수 있도록 실질적인 도움을 주는 것이 목표이다. 인공지능 기술의\n발전과 함께 차세대 사용자 인터페이스로 떠오르고 있는 음성 언어 및 자연어 처리 기반의\n인터페이스를 실현하는데 필요한, 언어 이론의 과학적 분석 및 데이터 처리 능력을 갖춘\n전문 인력을 양성하기 위한 필수 교육을 제공한다.\n\n## [heading1] ##\n# 다. Business & AI 트랙']","글로벌스포츠산업학부(글스산) 졸업 후에는 다양한 진로를 선택할 수 있습니다. 졸업생들은 주로 다음과 같은 분야로 진출합니다:

1. **스포츠 매니지먼트 및 이벤트 기획**: 스포츠 클럽, 리그, 대회, 이벤트 등을 기획하고 운영하는 직무입니다.
2. **스포츠 마케팅 및 홍보**: 스포츠 산업에서 제품, 서비스, 이벤트 등을 마케팅하고 홍보하는 업무를 수행합니다.
3. **스포츠 데이터 분석가**: 스포츠 경기에서 발생하는 다양한 데이터를 수집하고 분석하여 팀이나 선수의 성과를 향상시키는 데 필요한 정보를 도출하는 직무입니다.
4. **스포츠 미디어**: 스포츠 뉴스, 인터뷰, 해설, 하이라이트, 분석 등 다양한 스포츠 관련 콘텐츠를 제작하고 편집하여 방송, 인터넷, 모바일 등에서 전달하는 업무를 수행합니다.

또한, 졸업 후 대학원 진학이나 관련 분야의 연구 및 교육 분야로도 진출할 수 있습니다. 졸업생들은 스포츠 산업의 다양한 영역에서 전문성을 발휘하며 활동하고 있습니다. 혹시 더 도와드릴까요?","글로벌스포츠산업학부를 졸업하면 주로 다음과 같은 분야에서 활동하게 됩니다:
1. 스포츠매니지먼트 및 이벤트 기획
2. 스포츠 마케팅 및 홍보
3. 스포츠 데이터 분석가
4. 스포츠 미디어",,1.0,1.0,0.7635632882229627
후기 이중이 뭐야?,"['| 구분 | 기간 | 비고 |', '| (기타) | 후기이중전공 | 후기이중전공(진입)\xa0학생은\xa09학기 추가학기 수강신청 가능 탈락시 후기이중전공 불가 | 기타 특이사항 명시 ※\xa0해당사항이 없는 학생은 표시되지 않고,\xa0대상자에만 표시 |', '[공통] 후기이중전공 신청 공고\n\n[공통] 후기이중전공 신청 공고\n\n(공통) 후기이중전공 신청 공고\n\n2025학년도 후기이중전공 신청 일정 및 방법 등을 공고합니다.\n\n1. 신청기간: 2025 4. 14.(월) 10:00 ~ 4. 18.(금) 16:00까지\n\n2. 신청대상: 현재 7~8학기 이수중인 자로, 후기이중전공을 희망하는 전공을 부전공으로 이수중인 자\n\n(7학기를 마치고 휴학한 학생도 이번 신청기간에 신청할 것)\n\n3. 신청방법: 인터넷 종합정보시스템에서 신청 (로그인 > 전공/교직관리 > 후기이중전공신청)\n\n4. 허가자 발표: 7월초 홈페이지 공고(예정)\n\n5. 기타사항\n\n가. 1년에 1회, 4월에만 신청하므로 반드시 희망자는 이번 신청 일정을 따를 것\n\n나. 지원학과 입학정원의 50 ~ 150% 이내에서 학과 자율 선발하되, 학과에서 요구하는 기본 자격요건 미충족 시 탈락될 수 있음\n\n(세부 배정기준은 지원학과 학과장실 문의 또는 학과 홈페이지 참조)', '을까요?\nA3.  전쟁 이후 우크라이나어의 위상은 높아지고 사용 빈도는 증가할 것\n입니다. 그리고 우크라이나의 복구 사업에 우리 기업들이 많이 참\n여할 것으로 예상되며, 우리 학생들이 전공을 살려 통역, 무역, 비\n즈니스, 공공서비스, 연구 등 여러 분야에서 활발히 일할 수 있을 \n것입니다.', '[공통] 후기이중전공 신청 공고\n\n[공통] 후기이중전공 신청 공고\n\n(공통) 후기이중전공 신청 공고\n\n2025학년도 후기이중전공 신청 일정 및 방법 등을 공고합니다.\n\n1. 신청기간: 2025 4. 14.(월) 10:00 ~ 4. 18.(금) 16:00까지\n\n2. 신청대상: 현재 7~8학기 이수중인 자로, 후기이중전공을 희망하는 전공을 부전공으로 이수중인 자\n\n(7학기를 마치고 휴학한 학생도 이번 신청기간에 신청할 것)\n\n3. 신청방법: 인터넷 종합정보시스템에서 신청 (로그인 > 전공/교직관리 > 후기이중전공신청)\n\n4. 허가자 발표: 7월초 홈페이지 공고(예정)\n\n5. 기타사항\n\n가. 1년에 1회, 4월에만 신청하므로 반드시 희망자는 이번 신청 일정을 따를 것', '미완료\n\n해당학과 학과사무실에 문의\n\n(3) 이중전공\n\n(3) 졸시논문\n\n완료\n\n이중전공 졸업논문 , 졸업시험 , 졸업시험대체성적 제출 및 입력 완료\n\n이중전공 졸업논문 ,\n\n졸업시험 등\n\n통과여부\n\n미완료\n\n해당학과 학과사무실에 문의\n\n비대상\n\n이중전공 비대상자', '[공통] 후기이중전공 신청 공고\n\n[공통] 후기이중전공 신청 공고\n\n(공통) 후기이중전공 신청 공고\n\n2025학년도 후기이중전공 신청 일정 및 방법 등을 공고합니다.\n\n1. 신청기간: 2025 4. 14.(월) 10:00 ~ 4. 18.(금) 16:00까지\n\n2. 신청대상: 현재 7~8학기 이수중인 자로, 후기이중전공을 희망하는 전공을 부전공으로 이수중인 자\n\n(7학기를 마치고 휴학한 학생도 이번 신청기간에 신청할 것)\n\n3. 신청방법: 인터넷 종합정보시스템에서 신청 (로그인 > 전공/교직관리 > 후기이중전공신청)\n\n4. 허가자 발표: 7월초 홈페이지 공고(예정)\n\n5. 기타사항\n\n가. 1년에 1회, 4월에만 신청하므로 반드시 희망자는 이번 신청 일정을 따를 것\n\n나. 지원학과 입학정원의 50 ~ 150% 이내에서 학과 자율 선발하되, 학과에서 요구하는 기본 자격요건 미충족 시 탈락될 수 있음\n\n(세부 배정기준은 지원학과 학과장실 문의 또는 학과 홈페이지 참조)\n\n다. 이수자 선발 이후 8학기까지 전공심화(+부전공) 또는 일반 부전공에 맞는 졸업에 필요한 졸업학점 요건을 모두 완료하여야 최종적으로 허가\n\n라. 조기졸업대상자, 학석사연계과정/석사예약제 이수자는 신청 불가(신청 희망 시 내방하여 해당 자격 취소처리 후 신청)\n\n마. 후기이중전공으로 선발되면 추가학기를 1학기 이상 무조건 등록, 수강해야 하며 등록금은 후기이중전공 학과의 등록금으로 납부해야 함\n\n바. 기타 자세한 사항은 전자규정집 ""이중전공시행규정"" 참조\n\n2025. 4.\n\n교무처장\n\n| 0 |\n|:------------------------------|\n| (공통) 후기이중전공 신청 공고 |', '- 서술형 평가의 답변도 담당 교강사에게 익명으로 공개되니 좋았던 점과 개선할 점에 대해 구체적으로 기재해주시기 바랍니다 .\n\n- 건전한 소통을 위해 상대방을 존중하는 표현을 사용해주시고 , 비속어 , 비하적 표현은 삼가해 주시기 바랍니다 .\n\n교육혁신원', '라. 조기졸업대상자, 학석사연계과정/석사예약제 이수자는 신청 불가(신청 희망 시 내방하여 해당 자격 취소처리 후 신청)\n\n마. 후기이중전공으로 선발되면 추가학기를 1학기 이상 무조건 등록, 수강해야 하며 등록금은 후기이중전공 학과의 등록금으로 납부해야 함\n\n바. 기타 자세한 사항은 전자규정집 ""이중전공시행규정"" 참조\n\n2025. 4.\n\n교무처장\n\n| 0 |\n|:------------------------------|\n| (공통) 후기이중전공 신청 공고 |', '[역사란무엇인가] 전체 학년 대상 / 교수: 서상현 / 월요일 3,4교시 / 강의실 2502호 / 학점: 2 / 전공필수 과목 아님 / 온라인강의 아님 / P/F 평가 과목 아님 / 원어강의 아님\n\n[요가경전강독] 전체 학년 대상 / 교수: 최원호 / 금요일 7,8교시 / 강의실 2313호 / 학점: 2 / 전공필수 과목 아님 / 온라인강의 아님 / P/F 평가 과목 아님 / 원어강의 아님\n\n[유럽근현대사] 전체 학년 대상 / 교수: 윤용선 / 수요일 5,6교시 / 강의실 2314호 / 학점: 2 / 전공필수 과목 아님 / 온라인강의 아님 / P/F 평가 과목 아님 / 원어강의 아님', '( 아래 설명은 본인의 결과가 아니며 , 반드시 종합정보시스템 로그인 ( 클릭 시 이동 ) 하여 학생\xa0개인별 확인하기 바람 )\n\n구분\n\n결과 표기\n\n결과 설명\n\n비고\n\n(1) 학점\n\n완료\n\n졸업대기 ( 수료 ). 추가학기 수강신청 불가 .\n\n① 후기이중전공 ( 진입 ) 학생은 9 학기 추가학기 수강신청 가능\n\n② 졸업대기 ( 수료 ) 학생 중 교직 추가이수 필요 또는 학과 내규 위반에 따른 학점 추가 이수 필요자는 학과 요청이 있을 경우 추가학기 이수 필요\n\n이수영역별 학점충족\n\n여부 , 필수교과목\n\n이수 여부 등\n\n미완료\n\n미이수 내역 참고하여 추가학기 이수 ( 등록 ) 필요\n\n(2) 제 1 전공\n\n(2) 졸시논문\n\n완료\n\n1 전공 졸업논문 , 졸업시험 , 졸업시험대체성적 제출 및 입력 완료\n\n1 전공 졸업논문 ,\n\n졸업시험 등\n\n통과여부\n\n미완료\n\n해당학과 학과사무실에 문의\n\n(3) 이중전공\n\n(3) 졸시논문\n\n완료', '3) 후기이중전공 선발자 가 이중전공 변경 배정된 경우 이중전공 변경으로 처리 됨\n\n( 단 , 후기이중전공 이수 희망자 제외 )\n\n나 . 이중전공 변경에 미배정 된 경우\n\n1) 기존에 이수 중인 이중 / 부전공 은 그대로 유지 됨\n\n3. 이수구분 변경 안내 : 이수구분 변경이 필요한 경우 학사종합지원센터 홈페이지 서식함의 “ 이수구분 변경 신청서 ” 작성 제출 ( ※ 상시 제출 가능 )\n\n▶ ( 서울 ) 이수구분 변경 신청서 바로가기 / ▶ ( 글로벌 ) 이수구분 변경 신청서 바로가기\n\n4. 기타 안내사항\n\n가 . 부전공 희망자 및 단일전공 희망자 의 경우 추후 종합정보시스템으로 별도 신청 예정\n\n1) 부전공 희망자 : 일반 부전공 또는 전공심화 + 부전공 신청\n\n2) 단일전공 희망자 : 기존 이중 / 부전공 취소\n\n※ 자세한 일정은 2025 년 1 월 중순 학사공지 예정인 “ 부전공 신청 및 이중전공 / 부전공 취소 일정 ” 확인', '-\xa0강의평가를 완료하고 저장하면 어따한 경우에도\xa0수정이 불가능합니다 .\n\n- 강의평가 결과는 익명 ( 출석부 순서가 아님 ) 으로 처리되어 담당 교원에게 공개합니다 .\n\n- 서술형 평가의 답변도 담당 교강사에게 익명으로 공개되니 좋았던 점과 개선할 점에 대해 구체적으로 기재해주시기 바랍니다 .\n\n- 건전한 소통을 위해 상대방을 존중하는 표현을 사용해주시고 , 비속어 , 비하적 표현은 삼가해 주시기 바랍니다 .\n\n교육혁신원', '[경제학개론] 전체 학년 대상 / 교수: 이천영 / 목요일 4,5,6교시 / 강의실 4411호 / 학점: 3 / 전공필수 과목 아님 / 온라인강의 아님 / P/F 평가 과목 아님 / 원어강의 아님', '6. 전 과 ····································································· 77', '| (3)이중전공 (3)졸시논문 | 완료 | 이중전공 졸업논문,\xa0졸업시험,\xa0졸업시험대체성적 제출 및 입력 완료 | 이중전공 졸업논문, 졸업시험 등 통과여부 |\n| (3)이중전공 (3)졸시논문 | 미완료 | 해당학과 학과사무실에 문의 | 이중전공 졸업논문, 졸업시험 등 통과여부 |', '2. 유고결석·결시 처리 절차 ····································································· 68\n3. 이중전공 및 부전공(전공심화) ····································································· 70\n4. 후기이중전공 ····································································· 75\n5. 조기졸업 ····································································· 76', '| 7 | 13 | 14 | 15 | 16 | 17 | 18 | 19 | 6. 30(월) - 7. 4(금) 7. 11(금) 7. 30(수) | 제1학기 성적 열람 및 정정 계절학기 종강 2025년 후기 졸업 사정회의 |\n| 7 | 20 | 21 | 22 | 23 | 24 | 25 | 26 | 6. 30(월) - 7. 4(금) 7. 11(금) 7. 30(수) | 제1학기 성적 열람 및 정정 계절학기 종강 2025년 후기 졸업 사정회의 |\n| 7 | 27 | 28 | 29 | 30 | 31 |  |  | 6. 30(월) - 7. 4(금) 7. 11(금) 7. 30(수) | 제1학기 성적 열람 및 정정 계절학기 종강 2025년 후기 졸업 사정회의 |\n| 8 |  |  |  | 6 |  | 1 | 2 | 8. 4(월) - 8. 8(금) 8. 15(금) 8. 22(금) | 제2학기 휴․복학 신청 제2학기 수강신청 광복절 2025년 후기 학위수여식 |\n| 8 | 3 | 4 | 5 |  | 7 | 8 | 9 | 8. 4(월) - 8. 8(금) 8. 15(금) 8. 22(금) | 제2학기 휴․복학 신청 제2학기 수강신청 광복절 2025년 후기 학위수여식 |\n| 8 | 10 | 11 | 12 | 13 | 14 | 15 | 16 | 8. 4(월) - 8. 8(금) 8. 15(금) 8. 22(금) | 제2학기 휴․복학 신청 제2학기 수강신청 광복절 2025년 후기 학위수여식 |\n| 8 | 17 | 18 | 19 | 20 | 21 | 22 | 23 | 8. 4(월) - 8. 8(금) 8. 15(금) 8. 22(금) | 제2학기 휴․복학 신청 제2학기 수강신청 광복절 2025년 후기 학위수여식 |\n| 8 | 24 31 | 25 | 26 | 27 | 28 | 29 | 30 | 8. 4(월) - 8. 8(금) 8. 15(금) 8. 22(금) | 제2학기 휴․복학 신청 제2학기 수강신청 광복절 2025년 후기 학위수여식 |', '2025년 후기 학위수여식 일정:\n2025-08-22 (금요일)', '2025년 후기 졸업 사정회의 일정:\n2025-07-30 (수요일)', '| 6 | 15 | 16 | 17 | 18 | 19 | 20 | 21 | 6. 6(금) 6. 9(월) - 6. 13(금) 6. 13(금) 6. 16(월) - 6. 20(금) 6. 20(금) - 6. 27(금) 6. 23(월) | 현충일 제1학기 보강주간 졸업시험 성적보고서 및 졸업논문 심사보고서 제출 마감 제1학기 기말시험 제1학기 성적입력 하계방학 및 계절학기 개강 |\n| 6 | 22 | 23 | 24 | 25 | 26 | 27 | 28 | 6. 6(금) 6. 9(월) - 6. 13(금) 6. 13(금) 6. 16(월) - 6. 20(금) 6. 20(금) - 6. 27(금) 6. 23(월) | 현충일 제1학기 보강주간 졸업시험 성적보고서 및 졸업논문 심사보고서 제출 마감 제1학기 기말시험 제1학기 성적입력 하계방학 및 계절학기 개강 |\n| 6 | 29 | 30 |  |  |  |  |  | 6. 6(금) 6. 9(월) - 6. 13(금) 6. 13(금) 6. 16(월) - 6. 20(금) 6. 20(금) - 6. 27(금) 6. 23(월) | 현충일 제1학기 보강주간 졸업시험 성적보고서 및 졸업논문 심사보고서 제출 마감 제1학기 기말시험 제1학기 성적입력 하계방학 및 계절학기 개강 |\n| 7 |  |  | 1 | 2 | 3 | 4 | 5 | 6. 30(월) - 7. 4(금) 7. 11(금) 7. 30(수) | 제1학기 성적 열람 및 정정 계절학기 종강 2025년 후기 졸업 사정회의 |\n| 7 | 6 | 7 | 8 | 9 | 10 | 11 | 12 | 6. 30(월) - 7. 4(금) 7. 11(금) 7. 30(수) | 제1학기 성적 열람 및 정정 계절학기 종강 2025년 후기 졸업 사정회의 |\n| 7 | 13 | 14 | 15 | 16 | 17 | 18 | 19 | 6. 30(월) - 7. 4(금) 7. 11(금) 7. 30(수) | 제1학기 성적 열람 및 정정 계절학기 종강 2025년 후기 졸업 사정회의 |', '## [heading1] ##\n# 4. 융합전공\n\n## [heading1] ##\n# 가. 융합전공 개요\n\n## [list] ##\n- 1) 2개 이상의 학과(학부/전공)가 연계하여 개설한 전공으로, 융합전공은 이중(제2)전공\n- 으로만 이수 가능함(국가리더전공 및 데이터사이언스전공은 부전공도 가능)\n- 2) 이중전공으로 이수하므로, 학번대에 따라 42학점 또는 54학점을 이수하여야 함\n- 3) 2006학번 이전 학생은 문화콘텐츠학, EU, 동북아전공에 한해 이수 가능\n- 4) 융합전공 졸업논문/졸업시험 시행은 관련 학과 협의로 시행하되, 그 절차는\n- “졸업논문 및 졸업시험 시행규정”에 따름\n- 5) 융합전공은 후기 이중전공 불가\n- 6) 개설 전공\n\n## [table] ##\n| 일반융합전공 | 일반융합전공 |\n| --- | --- |\n| 나-① | BRICs(브릭스)전공 |\n| 나-② | EU(유럽연합)전공 (EU전공(글로벌)은 2023학년도부터 폐지, 서울에 개설된 EU전공만 신청 가능) |\n| 나-③ | 동북아외교통상전공[(구) 동북아전공] (동북아전공(글로벌)은 2018-2학기부터 폐지, 서울에 개설된 동북아외교통상전공만 신청 가능) |\n| 나-④ | 문화콘텐츠학전공 |\n| 나-⑤ | 국가리더전공 |\n| 나-⑥ | 세계문화예술경영전공 |\n| 나-⑦ | 디지털인문한국학전공(신규신청 불가) |\n| 나-⑧ | 데이터사이언스전공(신규신청 불가) |\n| 나-⑨ | 바이오데이터사이언스전공(신규신청 불가) |\n| 나-⑩ | AI융합전공(Software&AI, Language&AI, Business&AI 트랙)(신규신청 불가) |\n| 나-⑪ | Business & AI전공 |', '## [table] ##\n| 개설학과(전공) | 교과목명 | 이수영역 |\n| --- | --- | --- |\n| 통계학과 | 통계학및연습2 | 기초 이론 : 기초확률및통계군(택1) |\n| 컴퓨터.전자시스템공학전공/컴퓨터공학전공 | 확률과통계 | 기초 이론 : 기초확률및통계군(택1) |\n| 산업경영공학과 | 기초확률및통계 | 기초 이론 : 기초확률및통계군(택1) |\n| 통계학과 | 통계행렬론 | 기초 이론 : 데이터사이언스를위한수학군(택1) |\n| 컴퓨터.전자시스템공학전공/컴퓨터공학전공 | 선형대수 | 기초 이론 : 데이터사이언스를위한수학군(택1) |\n| 산업경영공학과 | 공학통계 | 기초 이론 - 회귀분석군(택1) |\n| 통계학과 | 회귀분석 | 기초 이론 - 회귀분석군(택1) |\n| 컴퓨터.전자시스템공학전공/컴퓨터공학전공 | 자료구조 | 소프트웨어 및 데이터 분석 |\n| 컴퓨터.전자시스템공학전공/컴퓨터공학전공 | 알고리즘 | 소프트웨어 및 데이터 분석 |\n| 컴퓨터.전자시스템공학전공/컴퓨터공학전공 | 웹프로그래밍 | 소프트웨어 및 데이터 분석 |\n| 통계학과 | 확률분포론 | 기초 이론 |\n| 통계학과 | 수리통계학 | 소프트웨어 및 데이터 분석 |\n| 통계학과 | 다변량분석및실습 | 소프트웨어 및 데이터 분석 |\n| 통계학과 | 데이터마이닝및실습 | 소프트웨어 및 데이터 분석 : 기계학습군(택1) |\n| 산업경영공학과 | 데이터마이닝응용 | 소프트웨어 및 데이터 분석 : 기계학습군(택1) |\n| 컴퓨터.전자시스템공학전공/컴퓨터공학전공 | 기계학습 | 소프트웨어 및 데이터 분석 : 기계학습군(택1) |\n| 통계학과 | 통계적기계학습및실습 | 소프트웨어 및 데이터 분석 : 기계학습군(택1) |\n| 컴퓨터.전자시스템공학전공/컴퓨터공학전공 | 데이터베이스 | 소프트웨어 및 데이터 분석 |\n| 컴퓨터.전자시스템공학전공/컴퓨터공학전공 | 운영체제 | 소프트웨어 및 데이터 분석 |\n| 컴퓨터공학전공 | 자연어처리 | 소프트웨어 및 데이터 분석 |', '| 4 | 1 | J04406 | 공연예술매니지먼트 | 선택 | 2/2 | 세계문화예술경영 |\n| 4 | 1 | J04401 | 공연기획과프로덕션 | 선택 | 2/2 | 세계문화예술경영 |\n| 4 | 1 | J04404 | 박물관경영및행정 | 선택 | 3/3 | 세계문화예술경영 |\n| 4 | 1 | J04013 | 세계영화와디지털테크놀로지 | 선택 | 2/2 | 세계문화예술경영 |\n| 4 | 2 | J04011 | 논문세미나와토론 | 선택 | 2/2 | 세계문화예술경영 |\n| 4 | 2 | J04402 | 박물관전시교육및보존 | 선택 | 3/3 | 세계문화예술경영 |\n| 4 | 2 | J04408 | 세계영화정책과산업 | 선택 | 3/3 | 세계문화예술경영 |', '## [paragraph] ##\n4) 졸업 요건 : 졸업 시험 및 논문 중 택일(지도교수가 배정 졸업 논문 지도)\n\n## [list] ##\n- 5) 문의처 : wacihufs@hufs.ac.kr(홈페이지 : wacimajor.hufs.ac.kr)\n\n## [footer] ##\n- 50 -', '## [heading1] ##\n# ⑦ 디지털인문한국학전공(서울캠퍼스에서 수강)\n\n## [heading1] ##\n# ※ 신규신청 불가\n\n## [paragraph] ##\n1) 한국의 인문학적 전통과 문화에 대한 심층적 지식을 바탕으로 디지털 매체를 활용한 해외\n송출과 쌍방향 소통이 가능한 지식통합형 인재를 길러내기 위한 융합전공으로 한국의 언어/\n문학, 사상, 역사에 대한 인문지식을 균형 있게 학습하고 이를 디지털 테크놀로지를 활용하\n여 콘텐츠화 하는 방법론을 습득함\n\n## [heading1] ##\n# 2) 이수학점 및 이수영역\n\n## [table] ##\n| 구분 | 이수학점 | 이수영역 |\n| --- | --- | --- |\n| 2014 학번까지 | 54학점 | 공통기초 6학점 + 연계기초 6학점 + 전공교과 42학점 |\n| 2015 학번부터 | 42학점 | 공통기초 6학점 + 연계기초 6학점 + 전공교과 30학점 |', '## [list] ##\n- - 공통기초 과목(6개 과목, 과목당 3학점) : 디지털인문학 입문, 인문한국학 입문(이상\n- 디지털인문한국학 과목), 언어와 논리, 인지과학 입문(이상 언어와 공학 과목),\n- 문화예술 경영론, 미디어연구 방법론(이상 세계문화예술경영 과목)\n- - 연계기초 과목 (과목당 3학점) : 한국철학사 (철학과), [한국사입문(사학과), 문화사와\n- 이문화이해(사학과), 한국문화사(사학 부전공), 한국근세사(사학 부전공) 중 택1], KFL\n- 문법(언어인지과학과), 인문지식위키(지식콘텐츠학부) 또는 디지털시대의텍스트와지식\n- (문화콘텐츠학융합전공), 한국현대사회와문학, 한국근대사(이상 한국학과 과목), 기록\n- 의조직화와정보-문화 서비스(정보기록문화유산관리학전공), 컴퓨터프로그래밍(융복합\n- 소프트웨어전공) 또는 언어분석을 위한 프로그래밍(언어와공학전공)\n- 기타 연계기초과목과 유사과목으로 주임교수가 인정한 과목\n- - 전공교과 과목 (과목당 3학점) : 한국사상과 철학, 한국사회와 역사, 한국어와 문화,\n- 디지털한국학과 한국문화 탐방, 인문콘텐츠와 시맨틱 웹, 한국기록문화와 디지털화,\n- 한국문학과 스토리텔링, 디지털한국어 문법, 한국학콘텐츠와 시각적 활용, 한국학\n- 아카이빙과 지식맵, 디지털한국학과 데이터베이스, 한국의 미와 디지털화, 한국학교육\n- 방법론, 한국학 자료 기록관리와 빅데이터, 디지털인문한국학콘텐츠와 한국사상, 공공\n- 데이터 서비스와 문화정책 연구, 한국학과 CDN, 한국학 이러닝 방법론\n- - 공통기초 과목과 연계기초 과목은 서울캠퍼스와 글로벌캠퍼스에서 개설되며(일부는\n- 대체과목으로 지정), 전공교과 과목은 서울캠퍼스에서만 개설됨\n- - 공통기초, 연계기초 과목 타학과(전공)에서 수강 시 유의사항 : 수강신청 후 학사종합\n- 지원센터 단과대학 교학파트(본인 1전공 소속 기준)에 방문하여 ‘이수구분변경신청서’를\n- 작성하여야 이중전공 학점으로 처리됨', '## [list] ##\n- 3) 졸업 요건 : 졸업논문 심사(지도교수가 배정되어 졸업 논문을 지도함.)\n- 4) 문의처 : 031-330-4488~92\n\n## [footer] ##\n- 51 -', '## [heading1] ##\n# ⑧ 데이터사이언스전공\n\n## [heading1] ##\n# ※ 신규신청 불가\n\n## [paragraph] ##\n1) 개요 및 교육목표\n\n## [paragraph] ##\n-\n\n## [paragraph] ##\n데이터과학은 데이터로부터 지식과 통찰을 뽑아내는 과학적 방법론을 연구하는 학문이며,\n최근 관심을 모으는 인공지능 구현의 ‘핵심 기반 학문’이다. 고도의 인공지능 학습을\n위해서는 데이터를 재료로 분석, 가공, 정제, 모델링하는 과정이 필수적인데, 이러한\n일련의 과정은 데이터과학에 그 이론적 바탕을 두고 있다. 최근 데이터과학자, 데이터\n개발자, 데이터분석가 등의 인력 수요가 급격히 증가하고 있으며, 특히 통계학, 산업경영,\n컴퓨터공학 등의 전문지식과 분야별 도메인 지식을 결합한 통합적‧실무형 데이터 과학자는\n전통적인 제조업과 IT산업은 물론, 금융‧통신‧의료‧공공 부문 등 다양한 산업분야에서\n활발히 활동할 것으로 기대된다.\n\n## [heading1] ##\n# 2) 선발 및 이수자격\n\n## [list] ##\n- - 글로벌캠퍼스에서 이중전공 또는 부전공으로 이수함 (정원 40명)\n- - 전공 구분 없이 지원가능하며, 성적순 선발을 원칙으로 함\n\n## [heading1] ##\n# 3) 이수학점 및 이수영역\n\n## [list] ##\n- - 총 이수학점 : 42학점 이상\n- - 영역별 이수학점\n\n## [list] ##\n- ‧ 기초 이론 : 12학점 이상\n- ‧ 소프트웨어 및 데이터분석 : 18학점 이상\n- ‧ 융합형 프로젝트 : 3학점 이상(캡스톤설계1, 2 중 한 과목 이상 수강)\n\n## [heading1] ##\n# 4) 교과 과정\n\n## [paragraph] ##\n총 이수학점 : 42학점\n\n## [paragraph] ##\n-', '## [list] ##\n- ‧ 기초 이론 : 12학점 이상\n- ‧ 소프트웨어 및 데이터분석 : 18학점 이상\n- ‧ 융합형 프로젝트 : 3학점 이상(캡스톤설계1, 2 중 한 과목 이상 수강)\n\n## [heading1] ##\n# 4) 교과 과정\n\n## [paragraph] ##\n총 이수학점 : 42학점\n\n## [paragraph] ##\n-\n\n## [table] ##\n| 학년 | 이수영역 | 1학기 | 2학기 |\n| --- | --- | --- | --- |\n| 1학년 | 교양 | 컴퓨팅사고 또는 컴퓨터프로그래밍 | 컴퓨팅사고 또는 컴퓨터프로그래밍 |\n| 2학년 | 기초 이론 | 데이터사이언스개론 데이터사이언스를위한수학군* (필수, 택1) | 기초확률및통계군* (필수, 택1) 회귀분석군* (필수, 택1) 확률분포론 |\n| 2학년 | 소프트웨어 및 데이터 분석 | 자료구조 (필수) | 알고리즘 |\n| 3학년 | 소프트웨어 및 데이터 분석 | 수리통계학 시계열분석 경영과학 웹프로그래밍 기계학습군* (필수, 택1) | 다변량자료분석 운영체제 데이터베이스 텍스트애널리틱스 |\n| 4학년 | 소프트웨어 및 데이터 분석 | 데이터시각화 딥러닝응용 | 데이터사이언스특론 |\n| 4학년 | 융합형 프로젝트 | 캡스톤설계1 | 캡스톤설계2 |\n\n## [footer] ##\n- 52 -', '## [heading1] ##\n# < 동일과목 군(괄호 안은 개설학과/학기) >\n\n## [list] ##\n- - 기초확률 및 통계군 : 통계학및연습2(통계/2), 확률과통계(컴전(컴공)/2), 기초확률및통계(산경/2)\n- - 데이터사이언스를 위한 수학군 : 통계행렬론(통계/1), 선형대수(컴공/2)\n- - 회귀분석군 : 공학통계(산경/1), 회귀분석(통계/2)\n- - 기계학습군 : 데이터마이닝및실습(통계/2), 데이터마이닝응용(산경/2), 기계학습(컴전(컴공)/2),\n- 통계적기계학습및실습(통계/1)\n- ※ 각 군 내의 교과목은 동일 교과목들로서 1개 과목을 선택하며 중복 수강은 허용되지 않음\n- (수강 학기는 자율 선택)\n\n## [list] ##\n- < 전공교류교과목 >\n- - 아래 목록의 교과목 수강 시 데이터사이언스전공의 전공이수학점으로 인정됨', '2026년 전기 학위수여식 일정:\n2026-02-20 (금요일)', '| 통계학과 | 통계적기계학습및실습 | 소프트웨어 및 데이터 분석 : 기계학습군(택1) |\n| 컴퓨터.전자시스템공학전공/컴퓨터공학전공 | 데이터베이스 | 소프트웨어 및 데이터 분석 |\n| 컴퓨터.전자시스템공학전공/컴퓨터공학전공 | 운영체제 | 소프트웨어 및 데이터 분석 |\n| 컴퓨터공학전공 | 자연어처리 | 소프트웨어 및 데이터 분석 |\n| 컴퓨터공학전공 | 컴퓨터비전 | 소프트웨어 및 데이터 분석 |\n| 컴퓨터공학전공 | 소셜네트워크분석 | 소프트웨어 및 데이터 분석 |\n| 컴퓨터공학전공 | 딥러닝 | 소프트웨어 및 데이터 분석 |\n| 컴퓨터공학전공 | 컴퓨터보안 | 소프트웨어 및 데이터 분석 |', '## [table] ##\n| 개설학과(전공) | 교과목명 | 이수영역 |\n| --- | --- | --- |\n| 컴퓨터공학전공 | 컴퓨터보안 | 소프트웨어 및 데이터 분석 |\n| 산업경영공학과 | 텍스트어낼리틱스 | 소프트웨어 및 데이터 분석 |\n| 산업경영공학과 | 경영과학 | 소프트웨어 및 데이터 분석 |\n| 산업경영공학과 | 딥러닝응용 | 소프트웨어 및 데이터 분석 |\n| 산업경영공학과 | 데이터사이언스개론 | 소프트웨어 및 데이터 분석 |\n| 산업경영공학과 | 데이터사이언스응용 | 소프트웨어 및 데이터 분석 |\n| AI융합전공 | 자료구조 | 소프트웨어 및 데이터 분석 |\n| AI융합전공(SW&AI) | 알고리즘 | 소프트웨어 및 데이터 분석 |\n| AI융합전공(SW&AI) | 운영체제 | 소프트웨어 및 데이터 분석 |\n| AI융합전공(SW&AI) | 웹프로그래밍 | 소프트웨어 및 데이터 분석 |\n| AI융합전공(SW&AI) | 데이터베이스 | 소프트웨어 및 데이터 분석 |\n| AI융합전공(SW&AI) | 기계학습 | 소프트웨어 및 데이터 분석 |\n| 통계학과 | 데이터시각화 | 소프트웨어 및 데이터 분석 |\n| 통계학과 | 시계열분석및연습 | 소프트웨어 및 데이터 분석 |\n| 통계학과 | 베이지안통계학 | 소프트웨어 및 데이터 분석 |\n| 통계학과 | 데이터사이언스세미나 | 소프트웨어 및 데이터 분석 |\n| 통계학과 | 통계행렬론연습 | 통계행렬론을 수강해야 인정함 |\n| 통계학과 | 회귀분석연습 | 회귀분석을 수강해야 인정함 |\n| 통계학과 | 확률분포론연습 | 확률분포론을 수강해야 인정함 |\n| 통계학과 | 수리통계학연습 | 수리통계학을 수강해야 인정함 |\n\n## [heading1] ##\n# 5) 졸업 요건\n\n## [paragraph] ##\n- 졸업 과제 및 논문(전공 홈페이지에 게시)\n\n## [heading1] ##\n# 6) 문의처', '## [heading1] ##\n# 5) 졸업 요건\n\n## [paragraph] ##\n- 졸업 과제 및 논문(전공 홈페이지에 게시)\n\n## [heading1] ##\n# 6) 문의처\n\n## [list] ##\n- - 홈페이지 : ds.hufs.ac.kr / 이메일 : seokohj@hufs.ac.kr\n- - 전공주임 연구실 전화번호 : 031-330-4680\n\n## [footer] ##\n- 54 -', '## [heading1] ##\n# ⑨ 바이오데이터사이언스전공\n\n## [heading1] ##\n# ※ 신규신청 불가\n\n## [heading1] ##\n# 1) 개요 및 교육목표\n\n## [paragraph] ##\n- 헬스케어와 의료 빅데이터 분야의 고급 인력을 양성하는 프로그램으로 바이오데이터로부터\n지식과 인사이트를 뽑아내기 위해 사용하는 과학적 방법론을 교육함. 바이오메디컬공학과\n컴퓨터공학의 분야별 도메인 지식을 융합하는 학제 간 분야임.\n\n## [heading1] ##\n# 2) 이수학점 및 이수영역\n\n## [table] ##\n| 구분 | 이수학점 | 이수영역 |\n| --- | --- | --- |\n| 2015학번부터 | 42학점 | AI융합전공(A) 21학점 + 바이오메디컬공학(B) 21학점 + 컴퓨터공학부(C) 9학점 + 융합형(캡스톤설계 I, II) 교과목 6학점(필수) |\n\n## [heading1] ##\n# 3) 교과목 목록\n\n## [table] ##\n|  |  | 1학기 | 2학기 |\n| --- | --- | --- | --- |\n| 공통기초 | 공통기초 | 컴퓨팅사고(교양) | 컴퓨팅사고(교양) |\n| 전공 | 2학년 | 고급파이썬프로그래밍(A) 자료구조(C) | 자료구조(A) 확률과통계(A) 의학유전학 또는 의학유전학(의생명프로그래밍)(B) 선형대수(C) |\n| 전공 | 3학년 | 데이터사이언스(A) 생체신호계측기기설계및실습(B) 바이오메디컬인공지능(B) 생명정보학을위한 데이터마이닝(B) | 기계학습(A) 데이터베이스(A) 인공지능을 이용한 의료영상처리및실습 또는 의료영상처리의이론및실습(B) 의생명정보학(B) |\n| 전공 | 4학년 | 웹프로그래밍(A) 컴퓨터비전(C) 캡스톤설계 I(필수) | 정보시각화 또는 데이터시각화및실습(B) 캡스톤설계 II(필수) |\n\n## [paragraph] ##\n※ 각 교과목은 3학점/3시간으로 구성', '## [paragraph] ##\n※ 각 교과목은 3학점/3시간으로 구성\n\n## [list] ##\n- - 공통기초과목은 교양과목으로서 학생들은 컴퓨팅사고를 수강해야 함\n- - 전공 교과목은 AI융합전공 공통 및 Software&AI트랙(A), BME학부(B), 컴퓨터공학부\n- (C), 융합형 교과목(I, II) 영역으로 구성됨\n- - 자료구조는 1학기는 컴퓨터공학부, 2학기는 AI융합전공에서 선택(중복불가)\n- - 캡스톤설계 I은 AI융합전공 Software&AI 트랙 1학기에 개설하는 종합설계, BME전공\n- 1학기에 개설하는 BME캡스톤디자인실습, 컴퓨터공학전공에 매학기 개설하는 캡스톤\n- 설계 중에서 선택\n\n## [footer] ##\n- 55 -']","후기 이중전공은 부전공을 이수 중인 학생이 정규 8학기 내에 제1전공 졸업학점(부전공 21학점 포함)을 모두 취득한 후, 추가로 1~2학기를 더 수학하여 해당 부전공의 이중전공화에 필요한 나머지 학점을 취득함으로써 제1전공과 이중전공 학위를 동시에 취득하는 제도입니다.

후기 이중전공으로 선발되면 추가학기를 1학기 이상 무조건 등록하고 수강해야 하며, 등록금은 후기 이중전공 학과의 등록금으로 납부해야 합니다. 이 제도는 학생들이 다양한 전공을 통해 전문성을 높이고, 졸업 후 더 넓은 진로 선택의 기회를 제공하기 위해 운영됩니다.

자세한 사항은 전자규정집 ""이중전공시행규정""을 참조하시기 바랍니다. 혹시 더 도와드릴까요?","후기 이중전공은 부전공 이수자가 정규 8학기 내에 제1전공 졸업학점(부전공 21학점 포함)을 모두 취득한 후, 1~2학기 추가 수학하여 해당 부전공의 이중전공화에 필요한 나머지 학점을 취득함으로써, 제1전공과 이중전공 학위를 동시에 취득하는 제도입니다.",0.5376184817312413,1.0,0.6,0.8425973559873269
졸업하기 전에 무슨 영어성적 제출해야 된다고 했던거 같은데 그건 뭐야?,"['졸업시험 성적보고서 및 졸업논문 심사보고서 제출 마감 일정:\n2025-06-13 (금요일)\n2025-12-12 (금요일)', '| 제출마감일 | 재학기간 동안\xa01회,\xa0외국어 인증 신청서를 제출하고자 하는 학기 말까지 ※\xa0졸업예정자는 졸업하고자 하는 최종 학기 말까지 반드시 제출해야함. | 재학기간 동안\xa01회,\xa0외국어 인증 신청서를 제출하고자 하는 학기 말까지 ※\xa0졸업예정자는 졸업하고자 하는 최종 학기 말까지 반드시 제출해야함. | 재학기간 동안\xa01회,\xa0외국어 인증 신청서를 제출하고자 하는 학기 말까지 ※\xa0졸업예정자는 졸업하고자 하는 최종 학기 말까지 반드시 제출해야함. | 재학기간 동안\xa01회,\xa0외국어 인증 신청서를 제출하고자 하는 학기 말까지 ※\xa0졸업예정자는 졸업하고자 하는 최종 학기 말까지 반드시 제출해야함. |\n| 제출처 | 학생의\xa01전공 소속 단과대학 담당에게\xa0E-mail\xa0제출 | 학생의\xa01전공 소속 단과대학 담당에게\xa0E-mail\xa0제출 | 학생의\xa01전공 소속 단과대학 담당에게\xa0E-mail\xa0제출 | 학생의\xa01전공 소속 단과대학 담당에게\xa0E-mail\xa0제출 |', '- 졸업희망자는 외국어인증 서류를 1/14 오전 까지 단과대학 교학과로 제출 바람\n\n( 단 , 외국어연수평가원 겨울방학 특별과정 이수자는 과정 종료일 당일 수료증 제출자에 한하여 ( 야간반의 경우 다음날 오전까지 ) 졸업사정에 반영함 )\n\n외국어인증신청서 제출안내 학사공지 게시글 바로가기 클릭', '| 제출마감일 | 재학기간 동안\xa01회,\xa0외국어 인증 신청서를 제출하고자 하는 학기 말까지 ※\xa0졸업예정자는 졸업하고자 하는 최종 학기 말까지 반드시 제출해야함. | 재학기간 동안\xa01회,\xa0외국어 인증 신청서를 제출하고자 하는 학기 말까지 ※\xa0졸업예정자는 졸업하고자 하는 최종 학기 말까지 반드시 제출해야함. | 재학기간 동안\xa01회,\xa0외국어 인증 신청서를 제출하고자 하는 학기 말까지 ※\xa0졸업예정자는 졸업하고자 하는 최종 학기 말까지 반드시 제출해야함. | 재학기간 동안\xa01회,\xa0외국어 인증 신청서를 제출하고자 하는 학기 말까지 ※\xa0졸업예정자는 졸업하고자 하는 최종 학기 말까지 반드시 제출해야함. |', '을 공부해 두는 것이 좋습니다. 졸업 후 취업 또는 진학에 관계없이 영어 \n구사 능력은 항시 요구되므로 대학 입학 이후부터 읽기, 듣기, 말하기, \n쓰기 모든 분야에서 영어 능력을 지속적으로 계발하는 것이 매우 중요\n합니다. 고학년 기간에는 이론적인 지식이 아니라 연구실 인턴을 통해 \n관심분야의 연구를 경험해보며 자신의 진로를 준비하는 것이 좋습니다.\n졸업 후 진로 \n-  기업체: 석유화학, 반도체/전자, 에너지, 신소재, 재료, 바이오, 의료 및 \n제약, 화장품 및 식품 분야\n-  정부 및 공공기관: 국가/지방 공무원 및 정부 산하 공기업\n-  학자 및 연구직: 대학 교수, 국공립연구소 및 정부 출연 연구소, 기\n업 연구소\n-  기타: 교사(교직이수), 창업\nQ&A', '※ 졸업논문을 제출하고자 하는 학생은 3 학년 2 학기 초 또는 졸업학기의 직전 학기 초에 졸업논문 작성계획서를 작성하여 소속 학과장실에 제출하여야함\n\n※ 세부일정은 해당학과에 따라 다를 수 있으니 반드시 해당학과에 문의 후 작성 제출\n\n5. 졸업시험\n\n가 . 졸업시험 기간\n\n1) 1 전공 : 2025. 5. 12.( 월 ) ∼ 5. 13.( 화 )\n\n2) 제 2 전공 , 이중전공 : 2025. 5. 19.( 월 ) ∼ 5. 20.( 화 )\n\n나 . 졸업시험 과목 : 자세한 사항은 첨부파일 참조 , 학과 사정에 따라 변경될 수 있음 ( 자세한 사항은 학과에 문의 )\n\n다 . 졸업시험 응시원서 접수 마감일 : 2025. 4. 23.( 수 )\n\n라 . 졸업시험 응시원서 교부 및 제출처 : 해당 학과 학과장실', '을 공부해 두는 것이 좋습니다. 졸업 후 취업 또는 진학에 관계없이 영어 \n구사 능력은 항시 요구되므로 대학 입학 이후부터 읽기, 듣기, 말하기, \n쓰기 모든 분야에서 영어 능력을 지속적으로 계발하는 것이 매우 중요\n합니다. 고학년 기간에는 이론적인 지식이 아니라 연구실 인턴을 통해 \n관심분야의 연구를 경험해보며 자신의 진로를 준비하는 것이 좋습니다.\n졸업 후 진로 \n-  기업체: 석유화학, 반도체/전자, 에너지, 신소재, 재료, 바이오, 의료 및 \n제약, 화장품 및 식품 분야\n-  정부 및 공공기관: 국가/지방 공무원 및 정부 산하 공기업\n-  학자 및 연구직: 대학 교수, 국공립연구소 및 정부 출연 연구소, 기\n업 연구소\n-  기타: 교사(교직이수), 창업\nQ&A \nQ1.  한국외대 화학과에 진학하려고 하는데 영어를 잘해야 하나요?\nA1.   한국외대 화학과에서는 원서 전공 교과목 수업과 영어 졸업논문 발\n표 등을 통해 화학 전문 영어를 습득하게 합니다. 또한, 외국어 대', '[공통] 외국어인증 신청서 제출 안내\n\n[공통] 외국어인증 신청서 제출 안내\n\n외국어인증 신청서 제출 안내\n\n외국어인증 신청서 제출에 대해 아래와 같이 안내합니다 .\n\n1. 외국어인증이란\n\n서울캠퍼스 수강편람 바로가기\n\n(수강편람목록- 수강편람 중 해당 페이지 참조)\n\n글로벌캠퍼스 수강편람 바로가기\n\n(수강편람목록- 수강편람 중 해당 페이지 참조 )\n\n2. 외국어인증 신청서 제출 안내\n\n제출서류\n\n1. 외국어인증 신청서(첨부파일 참조)\n\n2. 제출시점 기준 유효기간(2년) 이내의 인증 시험 성적 ( 또는 대체 과정 수료증 )\n\n※성적표 미리보기 캡쳐본\xa0성적 처리 불가\n\n제출마감일\n\n재학기간 동안 1 회 , 외국어 인증 신청서를 제출하고자 하는 학기 말 까지\n\n※ 졸업예정자는 졸업하고자 하는 최종 학기 말까지 반드시 제출해야함 .\n\n제출처\n\n학생의 1 전공 소속 단과대학 담당에게 E-mail 제출\n\n서울캠퍼스\n\n영어대학 / 아시어언어문화대학 / AI융합대학', '[글로벌] 2025년 전기(2월 졸업) 졸업예비사정 결과 조회 안내\n\n(* 교원자격증 취득 관련 : 교직 담당자 (031-330-4953) 에게 문의 )\n\n다 . 학과에서 제출한 졸업시험 및 논문 , 단과대학 교학과에 제출한 외국어인증은 기준 시점 까지 반영되었으므로 이상이 있을 경우 반드시 학과 및 단과대학 교학과 문의\n\n학과사무실 연락처 검색 ( 클릭 시 이동 )\n\n라 . 졸업 또는 졸업대기 ( 수료 ) 를 원하는 학생은 1 월 14 일 ( 화 ) 오전 까지 미비된 요건을 완료 바람 .\n\n마 . 외국어연수평가원/외국어교육센터\xa0이수자는\xa0프로그램\xa0종강에 따라 기관에서 명단\xa0반영 예정\n\n4. 추가 확인 필요 사항\n\n가 . 이수구분 수정 ( 교류과목 자선 -> 전공 , 전공인정 교양과목 -> 전공 자선 -> 교양 등 ) 을 하지 않아 학점이 미비 된 학생은 반드시 단과대학 교학과에 7 월 18 일 ( 목 ) 까지 이수구분 변경 ( 첨부 ) 을 하여야 졸업 또는 수료가 가능함 .', '(서울) 2025년 전기(2월 졸업) 졸업예비사정 결과 조회 안내\n\n이수구분 변경신청서 서식함 게시글 바로가기 클릭\n\n- 졸업희망자는 외국어인증 서류를 1/14 오전 까지 단과대학 교학과로 제출 바람\n\n( 단 , 외국어연수평가원 겨울방학 특별과정 이수자는 과정 종료일 당일 수료증 제출자에 한하여 ( 야간반의 경우 다음날 오전까지 ) 졸업사정에 반영함 )\n\n외국어인증신청서 제출안내 학사공지 게시글 바로가기 클릭\n\n- 코어사업 지역학사 / 지역전문가과정 / 학석사연계과정 신청자 중 이번 졸업 또는 수료 ( 학점완료 후 졸업을 미룬 상태 ) 를 희망하는 학생은 관련 서류 작성하여 학과 확인 받은 후 학사종합지원센터에 1/14 오전 까지 제출하여야 학위증 및 졸업증명서에 지역학사 또는 지역전문학과정 이수가 반영 됨 .\n\n( 방문제출 ( 학사종합지원센터 1 번창구 ) 또는 이메일 haksamil@hufs.ac.kr 제출 가능하며 기제출자는 제출 불필요 . 졸업 이후 학위명 변경 불가 함 .)', '네 분야 중 학생이 선택한 분야에 초점을 맞추어 강의를 듣게 됩니다.\n3학년  2학년에 수강한 분야들 중 하나 혹은 두 분야에 초점을 맞추어 수\n업을 들으면서 졸업논문 프로젝트를 위한 강의도 수강하게 됩니다.\n4학년  실습이나 연습 과목 위주로 수강하면서 졸업논문 계획서 제출, \n졸업논문 작성 및 완성본 제출을 하게 됩니다.\n졸업 후 진로 \n-  기업: 마케팅, 콘텐츠 비즈니스, 콘텐츠 기획, 해외전략기획 \n-  공기업: 관광, 민간외교, 문화교류, 전시, 기록관리 \n-  대학원: 국제대학원, 일반대학원의 한국어교육 및 한국학 관련 학과 \nQ&A \nQ1. 한국학과 학생들은 졸업 후 주로 어떤 분야로 진출하나요? \nA1.  한국학과 졸업생들은 학과에서 이수한 전공 교육에 기초하여 국내·외', '[글로벌] 2025년 전기(2월 졸업) 졸업예비사정 결과 조회 안내\n\n(* 교원자격증 취득 관련 : 교직 담당자 (031-330-4953) 에게 문의 )\n\n다 . 학과에서 제출한 졸업시험 및 논문 , 단과대학 교학과에 제출한 외국어인증은 기준 시점 까지 반영되었으므로 이상이 있을 경우 반드시 학과 및 단과대학 교학과 문의\n\n학과사무실 연락처 검색 ( 클릭 시 이동 )\n\n라 . 졸업 또는 졸업대기 ( 수료 ) 를 원하는 학생은 1 월 14 일 ( 화 ) 오전 까지 미비된 요건을 완료 바람 .\n\n마 . 외국어연수평가원/외국어교육센터\xa0이수자는\xa0프로그램\xa0종강에 따라 기관에서 명단\xa0반영 예정\n\n4. 추가 확인 필요 사항\n\n가 . 이수구분 수정 ( 교류과목 자선 -> 전공 , 전공인정 교양과목 -> 전공 자선 -> 교양 등 ) 을 하지 않아 학점이 미비 된 학생은 반드시 단과대학 교학과에 7 월 18 일 ( 목 ) 까지 이수구분 변경 ( 첨부 ) 을 하여야 졸업 또는 수료가 가능함 .\n\n이수구분 변경신청\xa0안내 ( 클릭 시 이동 )\n\n나 . 외국어인증 서류 제출 1 월 14 일 ( 화 ) 까지 단과대학 교학과로 제출 가능함\n\n( 단 , 외국어연수평가원 여름방학 특별과정 이수자는 과정 종료일 당일 수료증 제출자에 한하여 졸업사정에 반영함 )\n\n※ 특별한 사정이 있어 1 월 14 일 ( 화 ) 까지 제출이 어려운 학생은 학적 담당자 (031-330-4027) 에게 별도 문의 바람\n\n외국어 인증 안내 ( 클릭 시 이동 )\n\n다 . 글로벌 지역학사 / 지역전문가과정 신청자 중\n\n2 월 졸업 또는 졸업대기 ( 학점완료 후 졸업을 미룬 상태 ) 예정인 학생은\n\n첨부 된 서류 작성하여 학과 확인 받은 후 학사종합지원센터 학적 담당 (hufsmil@hufs.ac.kr) 에게\n\n1 월 14 일 ( 화 ) 까지 제출 하여야 학위증 및 졸업증명서에 지역학사 또는 지역전문가 반영됨 .\n\n( 단 , 미제출 하여도 졸업 또는 졸업대기가 가능함 .)\n\n( 방문제출 또는 이메일제출 가능하며 기제출자는 제출 불필요 . 졸업 / 졸업대기 이후 학위명 변경 불가 함 .)', '(서울) 2025년 전기(2월 졸업) 졸업예비사정 결과 조회 안내\n\n이수구분 변경신청서 서식함 게시글 바로가기 클릭\n\n- 졸업희망자는 외국어인증 서류를 1/14 오전 까지 단과대학 교학과로 제출 바람\n\n( 단 , 외국어연수평가원 겨울방학 특별과정 이수자는 과정 종료일 당일 수료증 제출자에 한하여 ( 야간반의 경우 다음날 오전까지 ) 졸업사정에 반영함 )\n\n외국어인증신청서 제출안내 학사공지 게시글 바로가기 클릭\n\n- 코어사업 지역학사 / 지역전문가과정 / 학석사연계과정 신청자 중 이번 졸업 또는 수료 ( 학점완료 후 졸업을 미룬 상태 ) 를 희망하는 학생은 관련 서류 작성하여 학과 확인 받은 후 학사종합지원센터에 1/14 오전 까지 제출하여야 학위증 및 졸업증명서에 지역학사 또는 지역전문학과정 이수가 반영 됨 .\n\n( 방문제출 ( 학사종합지원센터 1 번창구 ) 또는 이메일 haksamil@hufs.ac.kr 제출 가능하며 기제출자는 제출 불필요 . 졸업 이후 학위명 변경 불가 함 .)\n\n관련 서류 학사공지 게시글 바로가기 클릭\n\n- 2024 학년도 2 학기 현장실습 학점 인정 후 졸업이 필요한 학생은 1/21 까지 학점인정 처리를 완료 하기 바람 .\n\n관련 진로취업지원센터 문의\n\n* 부득이한 사정으로 1 월 14 일까지 제출이 어려운 학생은 별도 문의바람 .\n\n5. 문의처\n\n- 졸업시험 / 논문 , 전공필수 관련 : 해당학과 사무실 ( 연락처 : 02-2173- 아래의 내선번호 )\n\nELLT 학과 ( 영어학과 )\n\n2266\n\n태국어과\n\n2299\n\n경제학부\n\n2333\n\n영미문학 . 문화학과 ( 영문학과 )\n\n2267\n\n베트남어과\n\n2300\n\n국제통상학과\n\n2332\n\nEICC 학과 ( 영어통번역학과 )\n\n2268\n\n페르시아어 . 이란학과\n\n2303\n\n경영학부\n\n2334\n\n프랑스어학부\n\n2282\n\n인도어과\n\n2301\n\n영어교육과\n\n2342\n\n독일어과\n\n2283\n\n터키 . 아제르바이잔어과\n\n2302\n\n프랑스어교육과\n\n2343\n\n노어과\n\n2284\n\n몽골어과\n\n2415\n\n독일어교육과\n\n2344\n\n스페인어과\n\n2285\n\n중국언어문화학부', '( 단 , 미제출 하여도 졸업 또는 졸업대기가 가능함 .)\n\n( 방문제출 또는 이메일제출 가능하며 기제출자는 제출 불필요 . 졸업 / 졸업대기 이후 학위명 변경 불가 함 .)', 'FLEX 대체 ( 교내 )\n\n7. 나 .\n\n서울캠퍼스 시행예정\n\n4. 졸업논문\n\n가 . 졸업논문 작성계획서 제출 마감일 : 2025. 4. 23.( 수 )\n\n※ 졸업논문 제출 마감일은 학과에 문의\n\n나 . 제 1 전공 , 제 2 전공 , 이중전공 : 해당학과에서 배정한 졸업논문 지도교수로부터 졸업논문 작성에 관한 지도를 받아 기일 내에 소속 학과장실에 제출함\n\n다 . 졸업논문의 분량은 200 자 원고지 100 매 이상 분량을 원칙으로 함\n\n라 . 졸업논문을 기한 내에 제출하지 않는 학생은 졸업사정 대상에서 제외됨\n\n※ 졸업논문을 제출하고자 하는 학생은 3 학년 2 학기 초 또는 졸업학기의 직전 학기 초에 졸업논문 작성계획서를 작성하여 소속 학과장실에 제출하여야함', '가 . 해당학과 : 자세한 사항은 첨부파일 참조\n\n나 . 시험일자 : 2025. 5. 24( 토 ) 오전 10:00 서울캠퍼스 시행예정\n\n※ 정확한 시간 / 장소는 추후 통지\n\n다 . 접수기간 : 2025. 4. 16.( 수 ) ~ 4. 23.( 수 ) 해당학과 사무실에 신청 ( 기한 이후 추가 신청 불가 )\n\n* 7 학기 이상 재적생만 신청가능\n\n8. 유의 사항\n\n가 . 졸업시험 및 졸업논문 심사에 통과한 자는 졸업 시까지 그 자격이 유효함 ( 단 , 학적을 상실한 때에는 그 자격을 인정하지 아니함 )\n\n나 . 제 2 전공 , 이중전공자도 해당학과 문의 / 학과에 따른 졸업시험 응시 , 논문 제출 등 pass 하기 바람\n\n다 . 졸업시험 응시원서 제출 시 학생 본인의 연락처를 정확히 기재할 것', '[공통] 외국어인증 신청서 제출 안내\n\n| 제출서류 | 1. 외국어인증 신청서(첨부파일 참조) 2. 제출시점 기준 유효기간(2년) 이내의 인증 시험 성적(또는 대체 과정 수료증) ※성적표 미리보기 캡쳐본\xa0성적 처리 불가 | 1. 외국어인증 신청서(첨부파일 참조) 2. 제출시점 기준 유효기간(2년) 이내의 인증 시험 성적(또는 대체 과정 수료증) ※성적표 미리보기 캡쳐본\xa0성적 처리 불가 | 1. 외국어인증 신청서(첨부파일 참조) 2. 제출시점 기준 유효기간(2년) 이내의 인증 시험 성적(또는 대체 과정 수료증) ※성적표 미리보기 캡쳐본\xa0성적 처리 불가 | 1. 외국어인증 신청서(첨부파일 참조) 2. 제출시점 기준 유효기간(2년) 이내의 인증 시험 성적(또는 대체 과정 수료증) ※성적표 미리보기 캡쳐본\xa0성적 처리 불가 |\n| 제출마감일 | 재학기간 동안\xa01회,\xa0외국어 인증 신청서를 제출하고자 하는 학기 말까지 ※\xa0졸업예정자는 졸업하고자 하는 최종 학기 말까지 반드시 제출해야함. | 재학기간 동안\xa01회,\xa0외국어 인증 신청서를 제출하고자 하는 학기 말까지 ※\xa0졸업예정자는 졸업하고자 하는 최종 학기 말까지 반드시 제출해야함. | 재학기간 동안\xa01회,\xa0외국어 인증 신청서를 제출하고자 하는 학기 말까지 ※\xa0졸업예정자는 졸업하고자 하는 최종 학기 말까지 반드시 제출해야함. | 재학기간 동안\xa01회,\xa0외국어 인증 신청서를 제출하고자 하는 학기 말까지 ※\xa0졸업예정자는 졸업하고자 하는 최종 학기 말까지 반드시 제출해야함. |\n| 제출처 | 학생의\xa01전공 소속 단과대학 담당에게\xa0E-mail\xa0제출 | 학생의\xa01전공 소속 단과대학 담당에게\xa0E-mail\xa0제출 | 학생의\xa01전공 소속 단과대학 담당에게\xa0E-mail\xa0제출 | 학생의\xa01전공 소속 단과대학 담당에게\xa0E-mail\xa0제출 |\n| 제출처 | 서울캠퍼스 | 영어대학 /\xa0아시어언어문화대학 / AI융합대학 | haksa7@hufs.ac.kr | 02) 2173-2264 |', '[글로벌] 2025학년도 1학기 졸업논문 제출 및 졸업시험 일정 공고 새글\n\n[글로벌] 2025학년도 1학기 졸업논문 제출 및 졸업시험 일정 공고 새글\n\n졸업논문 제출 및 졸업시험 일정 공고\n\n2025 학년도 제 1 학기 졸업시험 및 졸업논문 제출 일정을 아래와 같이 공고함\n\n1. 자격 : 현재 3 학년 과정을 이수 완료한 7 학기 이상 재적생 (7 학기 미만 재적생은 불가 )\n\n2. 학과별 1 전공 졸업논문 / 시험 목록 : 자세한 사항은 첨부파일 참조 ( 이중전공은 해당학과에 문의 )\n\n단과대학명\n\n학과 ( 전공 )\n\n졸업논문 / 시험 방식\n\n학과사무실\n\n졸업논문\n\n졸업시험\n\nFLEX 대체\n\n기타\n\n정기시험\n\n교내\n\n인문대학\n\n철학과\n\n○\n\n031)330-4282\n\n사학과\n\n○\n\n031)330-4288\n\n언어인지과학과\n\n○\n\n031)330-4286\n\n지식콘텐츠전공\n\n○\n\n031)330-4980\n\n융합인재대학\n\n융합인재학부\n\n○\n\n○\n\n○\n\n031)330-4707\n\n통번역대학\n\n영어통번역학부\n\n○\n\n○\n\n031)330-4202, 4559\n\n독일어통번역학과\n\n○\n\n031)330-4206\n\n스페인어통번역학과\n\n○\n\n○\n\n031)330-4210\n\n이탈리아어통번역학과\n\n○\n\n○\n\n○\n\n○\n\n031)330-4214\n\n중국어통번역학과\n\n○\n\n031)330-4232\n\n일본어통번역학과\n\n○\n\n031)330-4234\n\n아랍어통번역학과\n\n○\n\n031)330-4236\n\n말레이 ･ 인도네시아어통번역학과\n\n○\n\n031)330-4238\n\n태국어통번역학과\n\n○\n\n031)330-4240\n\n국가전략언어대학\n\n폴란드학과\n\n○\n\n031)330-4216\n\n루마니아학과\n\n○\n\n○\n\n031)330-4218\n\n체코ㆍ슬로바키아학과\n\n○\n\n○\n\n031)330-4220\n\n헝가리학과\n\n○\n\n○\n\n031)330-4222\n\n세르비아ㆍ크로아티아학과\n\n○\n\n○\n\n031)330-4224\n\n그리스ㆍ불가리아학과\n\n○\n\n031)330-4715\n\n중앙아시아학과\n\n○\n\n○\n\n○\n\n031)330-4716\n\n아프리카학부 동아프리카 전공\n\n○\n\n○\n\n○\n\n031)330-4242', ""네 분야 중 학생이 선택한 분야에 초점을 맞추어 강의를 듣게 됩니다.\n3학년  2학년에 수강한 분야들 중 하나 혹은 두 분야에 초점을 맞추어 수\n업을 들으면서 졸업논문 프로젝트를 위한 강의도 수강하게 됩니다.\n4학년  실습이나 연습 과목 위주로 수강하면서 졸업논문 계획서 제출, \n졸업논문 작성 및 완성본 제출을 하게 됩니다.\n졸업 후 진로 \n-  기업: 마케팅, 콘텐츠 비즈니스, 콘텐츠 기획, 해외전략기획 \n-  공기업: 관광, 민간외교, 문화교류, 전시, 기록관리 \n-  대학원: 국제대학원, 일반대학원의 한국어교육 및 한국학 관련 학과 \nQ&A \nQ1. 한국학과 학생들은 졸업 후 주로 어떤 분야로 진출하나요? \nA1.  한국학과 졸업생들은 학과에서 이수한 전공 교육에 기초하여 국내·외\n의 다양한 한국문화·한국학·한국어교육 관련 영역으로 진출하고 있습\n니다. 이를테면 학과 졸업과 동시에 '한국어교원 자격증'을 발급받아 세\n종학당과 같은 국내외 한국어 교육기관에서 한국어 선생님으로 일하고 \n있는 졸업생, 한국학 기록관리 영역으로 진출한 졸업생(기록관리사로 \n국가기관이나 공기업 취직), 한국학 관련 국내외 도서관이나 박물관에\n서 일하고 있는 졸업생, 한국 관광산업 관련 기업에 취업한 졸업생, 유\n엔과 같은 국제기구나 아리랑TV와 같은 언론 영역으로 진출한 졸업생 \n등이 있습니다. 이 모든 졸업생들은 한국의 우수한 문화를 세계에 널리 \n알리겠다는 어린 시절 자신의 꿈을 계속 현실화시켜 나가고 있습니다. \nQ2. 한국학과 입학을 위해서는 국어와 역사를 잘 알아야 하나요? \nA2.  한국학과는 한국학 관련 입문과목부터 단계적·체계적으로 커리큘럼\n을 운영하고 있습니다. 따라서 기존에 한국문화 관련 지식이 부족하더\n라도 충분히 흥미진진하게 전공과목을 수강할 수 있습니다. 게다가 한\n국학과에는 한국 문학이나 역사 관련 수업을 제외하고도 <한국미술사\n>, <한국문화와영화> 등 다양한 영역의 전공과목이 개설되어 있으므\n로 학생들은 본인의 개인적 목표와 흥미, 이중전공 제도의 활용 등을 \n통해 다채로운 한국문화 관련 세부 전공을 개척해 나갈 수 있습니다. \nQ3. 한국어 교원 자격증이 무엇인가요? \nA3.  한국어 교원 자격증은 국립국어원 주관하에 문화체육관광부에서 \n부여하는 자격증으로서 한국어가 모국어가 아닌 외국인이나 다문\n화가정을 대상으로 한국어를 가르칠 수 있는 자격증입니다. 한국학"", '## [caption] ##\n2) 유고결시(시험 결석) : 사유발생 시 담당교수에게 알리고, 유고사유가 끝난 날부터\n7일 이내에 증빙서류를 담당교수에게 제출해야 함.', '[공통] 2025학년도 여름계절학기 국내대학 학점교류 안내\n\n※ 단, 부득이한 사유(교류대학의 수강신청 불가 및 폐강 등)\xa0로 변경할 경우, 수강신청 종료후 1주일 이내에 신청원을 다시 제출해야 함.\n\n(미제출시 교류대학에서 온 성적을 우리대학의 자선학점으로 입력)\n\n※ 타대학 성적이\xa0F학점이더라도 삭제할 수 없음.\n\n사. 수강 신청 시 유의사항\n\n1) 졸업예정자 , 졸업대기 ( 유예 ) 자는 수강할 수 없음 .\n\n2) 7 학기 재학생 으로서 금번 정규학기 (2025-1 학기 )를 포함하여 총 취득학점이 다음에 해당되는 학생은 수강할 수 없음 ( 다만, 졸업이나 진학 등 학업 계획을 위하여 수강신청이 필요할 경우(영역별 이수학점이 많이 남아 있는 경우)에는 예외로 할 수 있음)\n\n① 졸업학점이 140 학점인 학생의 경우 134 학점 이상을 취득한 학생\n\n② 졸업학점이 134 학점인 학생의 경우 128 학점 이상을 취득한 학생\n\n③ 졸업학점이 150 학점인 학생의 경우 144 학점 이상을 취득한 학생\n\n3) 우리대학 교과목에 대한 재수강 목적으로 교류대학의 과목을 수강할 수 없음 .\n\n4) 교류대학에서 이전에 수강한 과목은 우리대학 및 교류대학에서 재수강할 수 없음 .\n\n5) 우리대학 교양필수 에 해당하는 교류대학\xa0과목은 수강할 수 없음 .\n\n6) 교류대학의 교양영역에 개설된 교과목은 우리 대학의 전공학점으로 인정되지 않으므로 우리대학 전공에 해당하는 교류대학 교양과목은 수강할 수 없음.\n\n7) 우리대학 교과목과 < 동일교과목 > 및 < 유사교과목 > 은 중복 수강할 수 없음 .\n\n8) 전공 (1 전공 , 부전공 , 2 전공 , 이중전공 ) 교과목의 경우 학점교류신청원 접수 전에 우리대학 해당학과의 승인을 받아야 전공 (1 전공 , 부전공 , 2 전공 , 이중전공 ) 학점으로 인정받을 수 있음 .\n\n9) 계절학기 수강학점은 우리대학 및 교류대학 구분 없이 최대 6 학점까지 취득할 수 있음 .\n\n10) 학과에서 정한 전공필수 과목 및 교직 과목은 반드시 우리 대학에서만 수강하여야 함 .', '스템 개발/실습 등의 분야로 나눌 수 있습니다. 전공과목에 대한 자\n세한 내용은 학과 홈페이지나 인스타그램을 참조해 주세요.\nQ2.  산업경영공학을 공대 중에 문과 특성이 많은 학과라고 하던데 수학\n을 잘 못 해도 괜찮을까요?\nA2.  산업경영공학에서 해결하려는 문제들은 경영학에서도 다루는 것\n들이 많아서 그렇게 이야기 하곤 합니다. 산업경영공학의 문제 해\n결 방법은 기본적으로 모형을 바탕으로 하고, 이 모형은 대부분 수\n리 모형 또는 컴퓨터 모형입니다. 수학이나 컴퓨터공학 전공자만\n큼은 아니더라도 수학과 컴퓨터에 친숙하면 산업경영공학 공부에\n도 좋습니다. \nQ3. 산업경영공학을 전공하면 기업에서 주로 무슨 업무를 하게 되나요?\nA3.  전통적으로는 제조/물류 관련 기업에서 생산관리 직무를 담당하거\n나, 관련 솔루션/정보시스템을 서비스하는 IT/SI 업체에서 개발/컨\n설팅 직무를 수행합니다. 최근에 대다수 기업에서 비즈니스 문제 해\n결에 데이터를 활용하기 시작하면서 데이터 분석 관련 직무에도 산\n업경영공학 전공자들이 많이 종사하고 있습니다.', '## [heading1] ##\n# 9. 성범죄 경력 조회 동의서 제출\n\n## [paragraph] ##\n무시험검정원서 제출 시(졸업\xa0직전)\xa0양식 하단에 <성범죄경력\xa0조회\xa0동의> 부분에 동의\n체크하여 제출하면 학사종합지원센터로\xa0일괄 조회(동의서\xa0미제출 시\xa0교원자격증 발급 불가)\n\n## [paragraph] ##\n10. 마약·대마·향정신성 의약품 중독자 여부 확인서 제출\n\n## [paragraph] ##\n무시험검정원서\xa0제출\xa0시(졸업\xa0직전)\xa0<마약ㆍ대마ㆍ향정신성 의약품\xa0중독에\xa0관한\xa0의사\xa0진단서>를\n제출해야\xa0함.\n\n## [paragraph] ##\n※ ‘교원자격무시험검정원서’, ‘성범죄 경력 조회 동의’, ‘ 마약·대마·향정신성 의약품 중독자\n여부 확인서’ 미제출 학생은 교원자격증을 발급받을 수 없음.\n\n## [footer] ##\n- 94 -', '## [paragraph] ##\n나. 처리절차\n\n## [paragraph] ##\n1) 유고결석·결시 공통 안내사항\n\n## [paragraph] ##\n* 질병 및 상해의 경우 의원에서 발급받은 서류는 해당되지 않음\n(병원급 의료 기관 확인 : 건강보험심사평가원(https://www.hira.or.kr)\n\n## [paragraph] ##\n⇒ 검색창에서 병원이름 기입 후 검색 ⇒ 검색결과에서 해당병원 클릭\n⇒ 병원 기본정보 중 병원구분에서 병원등급 확인\n\n## [paragraph] ##\n** 질병관리청의 법정감염병 확인(https://dportal.kdca.go.kr)\n(질병관리청 감염병 포털 -> 감염병정보 -> 법정감염병에서 병명 확인)\n\n## [paragraph] ##\n2) 유고결석(수업 결석) : 사유발생 시 담당교수에게 알리고, 유고사유가 끝난 날부터\n7일 이내 증빙서류를 제출해야 함.\n(해당학기 졸업가능한 조기취업자는 입사확정 후 즉시 제출)\n\n## [table] ##\n| 사유 | 기간 | 증빙서류 | 절차 | 비고 |\n| --- | --- | --- | --- | --- |\n| 직계존비속, 배우자 및 형제 자매의 사망 | 7일 이내 (중간 공휴일 포함) | 사망진단서, 가족관계증명서 등 | 담당교수에게 증빙서류 제출 |  |\n| 본인의 결혼 | 7일 이내 (중간 공휴일 포함) | 청첩장, 예식장계약서 등 | 담당교수에게 증빙서류 제출 |  |\n| 징병검사, 입대지원시험 및 예비군 훈련 | 해당기간 | 소집영장사본 또는 징병검사 통지서사본, 교육필증 등 | 담당교수에게 증빙서류 제출 |  |\n\n## [footer] ##\n- 68 -', '2025-1학기 학부 재학생 등록 안내문\n\n○ 감면 금액 고지서 반영 일자 :3월 11일(화) 09시(이전까지는 고지서에 등록금 전액으로 표시됨)\n\n○ 등록취소 기간 (3/24~3/28) 내 수강 신청 변경 사항에 관해서는 등록금 환불 불가\n\n6. 해외 송금자\n\n○ 仅限持有微信支付钱包的学生，可通过微信支付缴纳学费（参考附件）\n\n○ 使用微信支付时缴纳期间为2025.02.17日（周一）~ 19日（周三）\n\n○ 위챗페이 e-wallet을 보유한 중국 국적 학생에 한하여 위챗페이로 등록금 납부 가능 (첨부 파일 참조)\n\n○ 위챗페이 납부는 2/17~19일까지만 가능\n\n○ 부득이하게 외화송금으로 등록금을 납부하는 경우 등록마감일 2~3일 전에 송금하여야 하며 수수료 및 환율을 감안하여 납부금액을 입금하여야 함\n\n○ 등록금액보다 입금액이 부족할 경우 등록처리 되지 않음.\n\n○ 해외송금자는 원활한 등록 업무를 위한 해외송금 정보 입력 바로가기\n\n우리은행 SWIFT CODE : HVBKKRSEXXX ※ 일부 해외은행의 경우는 HVBKKRSE로 인식하는 경우도 있으니 유의하시기 바랍니다.우리은행 본점 영문주소 : 17, WORLD CUP BUK-RO 60-GIL, MAPO-GU, SEOUL, 03921, SOUTH KOREA영문 이름: Hankuk University of Foreign Studies영문주소: 107, Imun-ro, Dongdaemun-gu, Seoul, Republic of Korea전화번호: 02-2173-2184우리은행 영문명칭 : WOORI BANK\n\n7. 분할납부\n\n구분\n\n기간\n\n비고\n\n신청\n\n2025.02.17(월) ~ 2025.02.21(금)', '[공통] 2025학년도 1학기 학부 재학생 추가등록 안내\n\n○ 감면 금액 고지서 반영 일자 :3월 11일(화) 09시(이전까지는 고지서에 등록금 전액으로 표시됨)\n\n○ 등록취소 기간 (3/24~3/28) 내 수강 신청 변경 사항에 관해서는 등록금 환불 불가\n\n6. 해외 송금자\n\n○ 仅限持有微信支付钱包的学生，可通过微信支付缴纳学费（参考附件）\n\n○ 使用微信支付时缴纳期间为2025.03.11日（周二）~ 12日（周三）\n\n○ 위챗페이 e-wallet을 보유한 중국 국적 학생에 한하여 위챗페이로 등록금 납부 가능 (첨부 파일 참조)\n\n○위챗페이 납부는 3/11~12일까지만 가능\n\n○ 부득이하게 외화송금으로 등록금을 납부하는 경우 등록마감일 2~3일 전에 송금하여야 하며 수수료 및 환율을 감안하여 납부금액을 입금하여야 함\n\n○ 등록금액보다 입금액이 부족할 경우 등록처리 되지 않음.\n\n○ 해외송금자는 원활한 등록 업무를 위한 해외송금 정보 입력 바로가기\n\n우리은행 SWIFT CODE : HVBKKRSEXXX ※ 일부 해외은행의 경우는 HVBKKRSE로 인식하는 경우도 있으니 유의하시기 바랍니다.우리은행 본점 영문주소 : 17, WORLD CUP BUK-RO 60-GIL, MAPO-GU, SEOUL, 03921, SOUTH KOREA영문 이름: Hankuk University of Foreign Studies영문주소: 107, Imun-ro, Dongdaemun-gu, Seoul, Republic of Korea전화번호: 02-2173-2184우리은행 영문명칭 : WOORI BANK\n\n7. 분할납부\n\n구분\n\n기간\n\n비고\n\n신청\n\n2025.02.17(월) ~ 2025.02.21(금)', '2025-1학기 대학원 재학생 등록 안내문\n\n3. 복학생\n\n○종합정보시스템에서 복학 신청 후 고지서 출력 가능(신청 후 승인까지 완료되어야 함)\n\n4. 재입학생\n\n○ 종합정보시스템에서 재입학 신청 후 승인된 학생만 고지서 발급 가능\n\n5. 연구등록생\n\n○ 각 대학원 등록 공지 참고\n\n6. 해외 송금자\n\n○仅限持有微信支付钱包的学生，可通过微信支付缴纳学费（参考附件）\n\n○使用微信支付时缴纳期间为2025.02.17日（周一）~ 19日（周三）\n\n○위챗페이 e-wallet을 보유한 중국 국적 학생에 한하여 위챗페이로 등록금 납부 가능 (첨부 파일 참조)\n\n○위챗페이 납부는 2/17~19일까지만 가능\n\n○부득이하게 외화송금으로 등록금을 납부하는 경우 등록마감일 2~3일 전에 송금하여야 하며 수수료 및 환율을 감안하여 납부금액을 입금하여야 함 ○등록금액보다 입금액이 부족할 경우 등록처리 되지 않음. ○해외송금자는 원할한 등록 업무를 위한 해외송금 정보 입력 바로가기\n\n우리은행 SWIFT CODE : HVBKKRSEXXX ※ 일부 해외은행의 경우는 HVBKKRSE로 인식하는 경우도 있으니 유의하시기 바랍니다. 우리은행 본점 영문주소 : 17, WORLD CUP BUK-RO 60-GIL, MAPO-GU, SEOUL, 03921, SOUTH KOREA 영문 이름: Hankuk University of Foreign Studies 영문주소: 107, Imun-ro, Dongdaemun-gu, Seoul, Republic of Korea 전화번호: 02-2173-2184 우리은행 영문명칭 : WOORI BANK\n\n7. 분할납부\n\n구분\n\n기간\n\n비고\n\n신청\n\n2025.02.17(월) ~ 2025.02.21(금)', '[공통] 2025학년도 1학기 대학원 재학생 추가등록 안내\n\n3. 복학생\n\n○종합정보시스템에서 복학 신청 후 고지서 출력 가능(신청 후 승인까지 완료되어야 함)\n\n4. 재입학생\n\n○ 종합정보시스템에서 재입학 신청 후 승인된 학생만 고지서 발급 가능\n\n5. 연구등록생\n\n○ 각 대학원 등록 공지 참고\n\n6. 해외 송금자\n\n○仅限持有微信支付钱包的学生，可通过微信支付缴纳学费（参考附件）\n\n○使用微信支付时缴纳期间为2025.03.11日（周二）~ 12日（周三）\n\n○위챗페이 e-wallet을 보유한 중국 국적 학생에 한하여 위챗페이로 등록금 납부 가능 (첨부 파일 참조)\n\n○위챗페이 납부는 3/11~12일까지만 가능\n\n○부득이하게 외화송금으로 등록금을 납부하는 경우 등록마감일 2~3일 전에 송금하여야 하며 수수료 및 환율을 감안하여 납부금액을 입금하여야 함 ○등록금액보다 입금액이 부족할 경우 등록처리 되지 않음. ○해외송금자는 원활한 등록 업무를 위한 해외송금 정보 입력 바로가기\n\n우리은행 SWIFT CODE : HVBKKRSEXXX ※ 일부 해외은행의 경우는 HVBKKRSE로 인식하는 경우도 있으니 유의하시기 바랍니다. 우리은행 본점 영문주소 : 17, WORLD CUP BUK-RO 60-GIL, MAPO-GU, SEOUL, 03921, SOUTH KOREA 영문 이름: Hankuk University of Foreign Studies 영문주소: 107, Imun-ro, Dongdaemun-gu, Seoul, Republic of Korea 전화번호: 02-2173-2184 우리은행 영문명칭 : WOORI BANK\n\n7. 분할납부\n\n구분\n\n기간\n\n비고\n\n신청\n\n2025.02.17(월) ~ 2025.02.21(금)', '## [paragraph] ##\n※ 분류별 세부과목은 \uf000 학교 홈페이지 ▶ Hot Link 강의시간표를 통하여 확인 가능\n\n## [paragraph] ##\n※ 학기마다 영역별 개설되는 교과목이 상이하고 없는 경우도 있으니 강의시간표 통해 확인\n\n## [heading1] ##\n# 다. 기초과목 이수 일반지침\n\n## [list] ##\n- (1) 2025학번 이후 입학생은 본인이 소속된 1전공 학과(단과대학 혹은 모집단위 계열)에서\n- 인정하는 기초영역에서 6학점 이상 이수하여야함\n- (2) 기본적으로 본인이 소속된 학과별(전공언어)기초(외국어계열의 경우), 모집단위 공통기초,\n- 대분류 계열기초 과목 및 대학기초에 대해서 필수 이수 6학점에 포함\n- 예) 자연과학대학 입학생 : 자연과학대학 모집단위 공통기초, 이공계열 기초, 대학기초 인정\n- (3) 자유전공학부의 경우, 전공 배정 전에 이수한 6학점의 경우 영역을 불문하고 필수\n- 이수 학점으로 인정\n- (4) 2024학번 이전 입학생에 대해서는 기초 과목에 대한 수강 의무가 없으나, 일부 학과의\n- 경우 기초 교과목을 전공 혹은 이중전공 학점으로 인정할 수 있으니 개별 학과에 문의 바람\n- (5) 본인 소속이 아닌 타 전공의 기초 수업의 수강은 가능하나 필수 이수학점에는 미포함\n- (6) 기후변화융합학부는 자연과학대학에 개설된 기초 교과목 수강, 바이오메디컬공학부는\n- 공과대학(공과계열) 개설 기초 교과목 수강함.\n- (7) 우크라이나학과 및 한국학과는 각 학과에서 개설된 학과별(전공언어)기초를 수강함\n\n## [footer] ##\n- 38 -', '## [heading1] ##\n# 4) 이수 영역별 인정 교과목 현황\n\n## [paragraph] ##\n가) <상경트랙>\n\n## [paragraph] ##\n① 상경 학점 인정\n\n## [table] ##\n| 학번 구분 | 총 이수 학점 | 이수 내용 | 이수 내용 |\n| --- | --- | --- | --- |\n| 2014 학번까지 | 30학점 | 상경필수 (4과목, 12학점) | 경제학원론1, 경제학원론2, 거시경제학 (또는 중급거시경제학), 미시경제학 (또는 중급미시경제학) |\n| 2014 학번까지 | 30학점 | 상경선택 (18학점) | 상경 필수과목을 제외한 상경대학, 경상대학, 경영 대학의 모든 교과목과 비고란에 상경 표기가 된 BRICs전공 내 일부 교과목 |\n| 2015 학번부터 | 18학점 | 상경대학, 경상대학, 경영대학의 모든 교과목과 비고란에 상경 표기가 된 BRICs전공 내 일부 교과목(상경 필수, 선택 구분 없음) | 상경대학, 경상대학, 경영대학의 모든 교과목과 비고란에 상경 표기가 된 BRICs전공 내 일부 교과목(상경 필수, 선택 구분 없음) |\n\n## [list] ##\n- ② BRICs 통상법 과목은 BRICs전공 상경선택 점수로 인정함.\n- ③ BRICs전공 내 상경선택 표시 과목 : 브라질권역별경제특성연구(구:브라질기업과통상),\n- 경제로읽는러시아-유라시아(구:러시아.CIS지역투자환경), 극동-시베리아개발과국제협력\n- (구:시베리아극동지역경제의이해), 인도의IT산업연구, 인도의경제정책론, 중국권역별상\n- 문화연구(구:중국기업경영사례), 중국문화콘텐츠와문화산업(구:한중경제관계연구),\n- BRICs상거래문화, BRICs와세계경제\n- ※ 2016-2학기 교과목 개정 전에 수강한 학생은 수강 당시 학기에 명기된 이수영역으로 인정함\n\n## [paragraph] ##\n나) <언어트랙>', '[공통] 2025-1학기 국내대학 학점교류 안내\n\n다. 교류 횟수 : 정규학기 2 개 학기 ( 편입생은\xa0정규학기 1개 학기 가능 )\n\n라. 신청절차\n\n1) 제출서류 작성\n\n2) 소속대학 및 수강과목별 해당 학과 ( 부 ) 장 허가를 받은 후\n\n3) 제출서류를 모두 제출 ( 소속 캠퍼스 학사종합지원센터 )\n\n마. 수강신청 : 수강신청 , 변경 및 취소는 수학 대학에서 정한 절차에 따름\n\n바. 등록 : 우리대학에 등록금을 납부\n\n사. 학점인정\n\n1) 교류대학에서 이수한 교과목은 우리대학의 교육과정 교과목을 취득한 것으로 인정함을 원칙으로 하며 , 장학생 선발 등에 관한 학점인정 및 평점 계산에는 삽입하지 아니함\n\n2) 교류대학에서 이수한 학점의 성적 ( 백분율 기준 ) 은 우리 대학의 성적산출 방식에 따라 환산함\n\n3) 학점교류신청원의 수강신청 교과목과 수강한 교과목이 상이할 경우 학점인정을 받을 수 없음\n\n※ 단, 부득이한 사유(교류대학의 수강신청 불가 및 폐강 등)\xa0로 변경할 경우, 수강신청 종료후 1주일 이내에 신청원을 다시 제출해야 함.\n\n(미제출시 교류대학에서 온 성적을 우리대학의 자선학점으로 입력)\n\n※ 타대학 성적이\xa0F학점이더라도 삭제할 수 없음.\n\n아. 학점교류신청의 취소 : 학점교류신청의 취소를 원하는 학생은 수업일수 4 분의 1 선 이내에 학점교류신청취소원을 우리대학에 제출하고 허가를 받아야 함\n\n자. 수강 신청 시 유의사항\n\n1) 지원자가 선발인원을 초과할 경우 학업성적 평점평균 순으로 선발함\n\n2) 우리대학 교과목에 대한 재수강 목적으로 교류대학의 과목을 수강할 수 없음\n\n3) 교류대학에서 이전에 수강한 과목은 우리대학 및 교류대학에서 재수강 할 수 없음\n\n4) 우리대학 실용외국어 , 교양외국어에 해당하는 교류대학 외국어 과목은 수강할 수 없음\n\n5) 교류대학의 교양영역에 개설된 교과목은 우리 대학의 전공학점으로 인정되지 않으므로 우리대학 전공에 해당하는 교류대학 교양과목은 수강할 수 없음 .\n\n6) 우리대학 교과목과 < 동일교과목 > 및 < 유사교과목 > 은 중복 수강할 수 없음', '[공통] 2025학년도 여름계절학기 국내대학 학점교류 안내\n\n3. 학점교류 안내\n\n가. 신청자격 : 3 학기생 ~7 학기생 (2025-1 학기 기준 )\n\n※ 1 학년 이상 (2 학년 부터 ) 의 과정을 수료하고 총성적 평점평균이 3.0 이상으로 학칙에 의거 , 징계 받은 사실이 없는 자\n\n( 편입생의 경우 편입 첫학기는 불가)\n\n나. 수강신청 허용학점 : 6학점 이내 ( 본교 및 타대학 포함 )\n\n※ 당해 방학기간에\xa0본교\xa0계절학기 및 국내 타대학 수학 , 기타 인정 학점 제도 등을 포함하여 총 6 학점을 초과할 수 없으며 ,\n\n재학중 국내 · 외 타대학 교류 , 인턴십 , 기타 인정 학점제도 등 정규 및 계절학기를 포함하여 취득할 수 있는 최대 인정 학점은 35 학점 ( 편입생은 18 학점 ) 임\n\n다. 교류 횟수 : 계절 학기 4 개 학기 ( 편입생은 2회 )\n\n라. 신청절차\n\n1) 제출서류 작성\n\n2) 소속대학 및 수강과목별 해당 학과 ( 부 ) 장 허가를 받은 후\n\n3) 제출서류를 모두 제출 ( 소속 캠퍼스 학사종합지원센터 )\n\n마. 수강신청 : 수강신청 , 변경 및 취소는 수학 대학에서 정한 절차에 따름\n\n바. 학점인정\n\n1) 교류대학에서 이수한 교과목은 우리대학의 교육과정 교과목을 취득한 것으로 인정함을 원칙으로 하며 , 장학생 선발 등에 관한 학점인정 및 평점 계산에는 삽입하지 아니함\n\n2) 교류대학에서 이수한 학점의 성적 ( 백분율 기준 ) 은 우리 대학의 성적산출 방식에 따라 환산함\n\n3) 학점교류신청원의 수강신청 교과목과 수강한 교과목이 상이할 경우 학점인정을 받을 수 없음\n\n※ 단, 부득이한 사유(교류대학의 수강신청 불가 및 폐강 등)\xa0로 변경할 경우, 수강신청 종료후 1주일 이내에 신청원을 다시 제출해야 함.\n\n(미제출시 교류대학에서 온 성적을 우리대학의 자선학점으로 입력)\n\n※ 타대학 성적이\xa0F학점이더라도 삭제할 수 없음.\n\n사. 수강 신청 시 유의사항\n\n1) 졸업예정자 , 졸업대기 ( 유예 ) 자는 수강할 수 없음 .', '[공통] 2025-1학기 수강신청 안내\n\n1) 타캠퍼스 학과의 전공을 이중(부)전공으로 이수 허가받은 학생에 한하여 타캠퍼스 해당 이중(부)전공 과목 수강신청 가능(단, 교양, 자유선택 수강 불가)\n\n2) 단, 아래의 경우 수강 가능한 개설캠퍼스 유의\n\n1전공 캠퍼스\n\n이수중인 타캠퍼스 이중(부)전공\n\n전공구분\n\n수강신청\n\n서울캠퍼스\n\n철학, 사학, 언어인지과학\n\n부전공\n\n서울캠퍼스\n\n글로벌캠퍼스\n\n정치외교학, 행정학, 언론·정보,\n\n광고·PR·브랜딩, 방송·영상·뉴미디어\n\n부전공\n\n글로벌캠퍼스\n\n이중전공\n\n양캠퍼스\n\n다. 집중수업 강좌 는 수강취소기간에 수강취소 불가 하므로, 수강신청 전 수업진행과 관련하여 강의계획서\n\n사전 확인 (다만, 질병 및 군입대 등의 사유로 학업이 불가능하게 된 경우는 예외)\n\n1) 집중수업이란?(※ 강의시간표 및 수강신청 강좌 비고 에 “*집중수업(수업기간)”으로 안내)\n\n교육과정 운영상 필요한 경우 개별 교과목별로 학점당 이수시간(학점 15시간 이상)을 준수하는 범위에서 수업일수를 단축하여 운영하는 수업\n\n2) 집중수업 강좌가 학기 종강 전에 종료되더라도 강의평가 및 성적평가 기간은 원활한 학사운영을 위해 학사일정에 맞춰 진행함\n\n라. 교차수업 강좌 는 본인 소속 캠퍼스에서 대면수업으로 진행될 때에는 대면수업으로 참여하고, 타 캠퍼스에서 대면수업으로 진행될 때에는 실시간 비대면으로 수업에 참여함\n\n(※ 캠퍼스별 대면수업 일정은 강의계획서 참고)\n\n▶ 교차수업이란?(※ 강의시간표 및 수강신청 강좌 비고 에 “*교차수업”으로 안내)\n\n동일한 강의시간(요일, 시간)에 동일한 교과목(학점, 시간 일치)을 동일한 담당 교수의 수업으로 양 캠퍼스에 각각 개설한 수업으로 학생은 본인 소속 캠퍼스에 개설된 강좌를 수강신청함\n\n마. 글로벌캠퍼스 강의실 배정\n\n▶ 수강 신청 전 강의실 배정이 어려운 관계로 수강 신청 시 추후 건물 이동 동선 참고\n\n계열/학과\n\n건물\n\n인문·경상계열\n\n인문·경상관\n\n어문계열\n\n어문관 / 교양관\n\n자연계열\n\n자연관 / 백년관\n\n공학계열\n\n공학관\n\n교양', '## [list] ##\n- 15시간 이상)을 준수하는 범위에서 수업일수를 단축하여 운영하는 수업\n- ※ 확인방법 : 강의시간표 및 수강신청 강좌 비고에 “*집중수업(수업기간)”으로 안내\n- ※ 집중수업 강좌가 학기 종강 전에 종료되더라도 강의평가 및 성적평가 기간은\n- 원활한 학사운영을 위해 학사일정에 맞춰 진행함\n- 17) 교차수업 강좌는 본인 소속 캠퍼스에서 대면수업으로 진행될 때에는 대면수업으로\n- 참여하고, 타 캠퍼스에서 대면수업으로 진행될 때에는 실시간 비대면으로 수업에 참\n- 여함(※ 캠퍼스별 대면수업 일정은 강의계획서 참고)\n- - 교차수업 : 동일한 강의시간(요일, 시간)에 동일한 교과목(학점, 시간 일치)을 동일\n- 한 담당 교수의 수업으로 양 캠퍼스에 각각 개설한 수업으로 학생은 본인 소속\n- 캠퍼스에 개설된 강좌를 수강신청함\n- - 확인방법 : 강의시간표 및 수강신청 강좌 비고에 “*교차수업”으로 안내\n\n## [paragraph] ##\n※ 예비수강신청함 시스템 사용법\n모의 동영상 (QR코드스캔)\n\n## [paragraph] ##\n※ 수강신청 시스템 사용법\n모의 동영상(QR코드스캔)\n\n## [heading1] ##\n# 다. 수강신청 변경\n\n## [table] ##\n| 기간 | 3. 4.(화) ~ 3. 10.(월), 10시 ~ 17시 (토요일, 일요일 제외) (단, 취소는 1~4일차 매일 22시까지, 5일차 17시까지 가능) |\n| --- | --- |\n| 방법 | 학교 홈페이지 수강신청변경 임시화면(별도 기간) ‘바로가기’ / 팝업 ‘수강신청변경 바로가기’ / HOT LINK ‘수강신청변경 바로가기’ ※ 수강신청 변경 후 본인의 강의시간표 반드시 확인 |\n\n## [paragraph] ##\n☞ 정규 수강신청과 동일하게 신청하며, 교과목 별 여석 내에서 추가로 신청할 수 있음\n\n## [caption] ##\n라. 폐강강좌 수강생 수강신청 변경', ""[공통] 2025학년도 여름계절학기 국내대학 학점교류 안내\n\n31\n\n세종대학교\n\n미정\n\n32\n\n숙명여자대학교\n\n미정\n\n33\n\n숭실대학교\n\n미정\n\n34\n\n중앙대학교\n\n미정\n\n35\n\n추계예술대학교\n\n미정\n\n36\n\n한성대학교\n\n미정\n\n37\n\n홍익대학교\n\n미정\n\n가. 본 공지사항은 각 교류대학에서 공문이 접수되는 대로 계속 업데이트됩니다 . 국내대학 학점교류를 원하시는 학생은 본 공지사항을 지속적으로 확인 바랍니다 .\n\n나. 접수 마감 이후에는 신청 불가\n\n다. 상대 교류 대학의 사정에 따라 해당 학기 학점교류를 시행하지 않을 수 있습니다 .\n\n2. 제출서류 및 접수장소\n\n가. 제출서류\n\n1) 학점교류신청원 (계절 학기 )( 첨부파일 ) 1 부\n\n2) 수학계획서 ( 첨부파일 ) 1 부\n\n3) 해당대학교 국내학점교류 추천자 명단 서식 ( ※ ' 대 학 별 안 내 문' 바로가기 - 링크 클릭 ▶ https://buly.kr/HHcBBox )\n\n4) 성적증명서(사본가능)\n\n5) 재학증명서(사본가능)\n\n※ 상기 제출서류 외 교류신청자가 직접 제출하는 것은 해당 대학 안내문 참조\n\n나 . 접수장소\n\n1) 서울캠퍼스 소속학생 : 서울캠퍼스\xa0본관 1 층 118 호 학사종합지원센터 ( 02-2173-2111)\n\n2) 글로벌캠퍼스 소속학생 : 글로벌캠퍼스 학생회관 1층 109호 학사종합지원센터 (031-330-4086)\n\n※ 학사종합지원센터 접수하기 전에 전공 , 부전공 , 이중전공 , 교양 등으로 수강할 경우 ,\n\n학점교류신청원에 반드시 해당 학과장 ( 교양은 교양대학장 ) 의 승인을 받아야 접수되며 수학계획서는 1 전공 학과장님의 승인을 받아야 함\n\n3. 학점교류 안내\n\n가. 신청자격 : 3 학기생 ~7 학기생 (2025-1 학기 기준 )\n\n※ 1 학년 이상 (2 학년 부터 ) 의 과정을 수료하고 총성적 평점평균이 3.0 이상으로 학칙에 의거 , 징계 받은 사실이 없는 자\n\n( 편입생의 경우 편입 첫학기는 불가)\n\n나. 수강신청 허용학점 : 6학점 이내 ( 본교 및 타대학 포함 )"", ""[공통] 2025-1학기 국내대학 학점교류 안내\n\n2) 수학계획서 ( 첨부파일 ) 1 부\n\n3) 해당대학교 국내학점교류 추천자 명단 서식 ( ※ ' 대 학 별 안 내 문' 바로가기 - 링크 클릭 ▶ https://buly.kr/3NHpiOK )\n\n4) 성적증명서\n\n5) 재학증명서\n\n※ 상기 제출서류 외 교류신청자가 직접 제출하는 것은 해당 대학 안내문 참조\n\n나 . 접수장소\n\n1) 서울캠퍼스 소속학생 : 서울캠퍼스\xa0본관 1 층 118 호 학사종합지원센터 ( 02-2173-2111)\n\n2) 글로벌캠퍼스 소속학생 : 글로벌캠퍼스 학생회관 1층 109호 학사종합지원센터 (031-330-4026)\n\n※ 학사종합지원센터 접수하기 전에 전공 , 부전공 , 이중전공 , 교양 등으로 수강할 경우 ,\n\n학점교류신청원에 반드시 해당 학과장 ( 교양은 교양대학장 ) 의 승인을 받아야 접수되며 수학계획서는 1 전공 학과장님의 승인을 받아야 함\n\n3. 학점교류 안내\n\n가. 신청자격 : 3 학기생 ~7 학기생 (2025-1 학기 기준 )\n\n※ 1 학년 이상 (2 학년 부터 ) 의 과정을 수료하고 총성적 평점평균이 3.0 이상으로 학칙에 의거 , 징계 받은 사실이 없는 자\n\n( 편입생의 경우 편입 첫학기는 불가)\n\n나. 수강신청 허용학점 : 당해학기 수강학점은 17 학점 이내 ( 본교 및 타대학 포함 )\n\n※ 당해 정규학기에 본교 및 국내 타대학 수학 , 기타 인정 학점 제도 등을 포함하여 총 17 학점을 초과할 수 없으며 ,\n\n재학중 국내 · 외 타대학 교류 , 인턴십 , 기타 인정 학점제도 등 정규 및 계절학기를 포함하여 취득할 수 있는 최대 인정 학점은 35 학점 ( 편입생은 18 학점 ) 임\n\n다. 교류 횟수 : 정규학기 2 개 학기 ( 편입생은\xa0정규학기 1개 학기 가능 )\n\n라. 신청절차\n\n1) 제출서류 작성\n\n2) 소속대학 및 수강과목별 해당 학과 ( 부 ) 장 허가를 받은 후\n\n3) 제출서류를 모두 제출 ( 소속 캠퍼스 학사종합지원센터 )\n\n마. 수강신청 : 수강신청 , 변경 및 취소는 수학 대학에서 정한 절차에 따름"", '을 공부해 두는 것이 좋습니다. 졸업 후 취업 또는 진학에 관계없이 영어 \n구사 능력은 항시 요구되므로 대학 입학 이후부터 읽기, 듣기, 말하기, \n쓰기 모든 분야에서 영어 능력을 지속적으로 계발하는 것이 매우 중요\n합니다. 고학년 기간에는 이론적인 지식이 아니라 연구실 인턴을 통해 \n관심분야의 연구를 경험해보며 자신의 진로를 준비하는 것이 좋습니다.\n졸업 후 진로 \n-  기업체: 석유화학, 반도체/전자, 에너지, 신소재, 재료, 바이오, 의료 및 \n제약, 화장품 및 식품 분야\n-  정부 및 공공기관: 국가/지방 공무원 및 정부 산하 공기업\n-  학자 및 연구직: 대학 교수, 국공립연구소 및 정부 출연 연구소, 기\n업 연구소\n-  기타: 교사(교직이수), 창업\nQ&A \nQ1.  한국외대 화학과에 진학하려고 하는데 영어를 잘해야 하나요?\nA1.   한국외대 화학과에서는 원서 전공 교과목 수업과 영어 졸업논문 발\n표 등을 통해 화학 전문 영어를 습득하게 합니다. 또한, 외국어 대\n학의 장점으로 영어를 배울 수 있는 환경(교내 English Zone 운영 \n등)이 잘 갖춰져 있어 영어가 부족하더라도 잘 적응해 나갈 수 있\n습니다.\nQ2.  고등학교 때 화학 과목을 배우지 않았는데 화학과에 진학할 수 있\n을까요?\nA2.  진학은 가능합니다만 반드시 입학 전에 고등학교 과정의 화학을 \n공부해두기 바랍니다. 고등학교 화학의 심화과정인 일반화학 과목\n은 1학년 때 배우며, 2학년부터는 완전히 새로운 전공과목을 수강\n하게 됩니다.\nQ3.  화학과 졸업 후 취업은 잘 되나요? 자연대가 공대에 비해 취업이 \n불리하지 않나요?\nA3.  화학의 큰 장점이 많은 학문 및 기술들과 링크가 되어있다는 것입\n니다. 따라서, 취업할 회사가 매우 많습니다. 석유화학, 반도체/전\n자, 에너지, 바이오, 의료 및 제약, 화장품 및 식품 등의 진로가 가능\n하며 일반 회사원뿐 아니라 연구원, 교수, 공무원, 교사로 갈 수 있\n습니다. 또한, 취업 시장에서 일반적으로 화학 계열로 모집하기 때\n문에 대부분 화학과와 화학 공학과의 차이가 별로 없습니다. 자연\n대 화학과의 경우 화학에 대하여 더 깊이있게 배우기 때문에 R&D\n와 같이 연구를 요하는 전문분야에서는 자연대 화학과를 선호하는 \n경우가 많습니다.\nQ4. 최근 반도체와 에너지 및 AI 산업에도 취업이 잘 되나요?\nA4.  반도체산업에서는 화학물질을 사용하는 공정이 많으므로 소재 및', '## [heading1] ##\n# 마. 부전공 신청대상 및 일정\n\n## [table] ##\n| 구분 | 내용 |\n| --- | --- |\n| 신청대상 | 2개 학기 이상 재학생 및 휴학생 |\n| 신청시기 | 7월 하순 / 1월 하순 |\n| 배정비율 | 제한없음 |\n| 선발기준 | 신청한 부전공으로 배정 |\n| 유의사항 | ① 사범대학 이외의 학생은 사범대학 학과의 전공 → 이수 불가 ② 융합전공 → 이수 불가 (※ 국가리더전공 및 데이터사이언스전공은 부전공 이수 가능) ③ 제한학과 설정된 학과는 소속 캠퍼스의 학과(전공)으로 이수함 |\n\n## [heading1] ##\n# 바. 유의사항\n\n## [paragraph] ##\n1) 캠퍼스 구분없이 신청가능하나 아래의 제한학과로 설정된 학과는 캠퍼스 간 이중(부) 전공\n이수를 제한함.\n\n## [table] ##\n| 구분 | 서울캠퍼스 | 글로벌캠퍼스 |\n| --- | --- | --- |\n| 학과 (부) | [아래 학과 학번별 적용] 2023학번까지 제한 / 2024학번부터 해제 | [아래 학과 학번별 적용] 2023학번까지 신청 |\n| 학과 (부) | 독일어과 스페인어과 이탈리아어과 말레이·인도네시아어과 | 독일어통번역학과 스페인어통번역학과 이탈리아어통번역학과 말레이·인도네시아어통번역학과 |\n| 학과 (부) | [아래 학과 학번별 적용] 2022학번까지 제한 / 2023학번부터 해제 | [아래 학과 학번별 적용] 2022학번까지 신청 |\n| 학과 (부) | 영어대학 각 학과(전공) 프랑스어학부 노어과 포르투갈어과 태국어과 인도어과 중국학대학 각 전공 일본학대학 각 전공 | 영어통번역학부(세부전공) 프랑스학과 러시아학과 브라질학과 태국어통번역학과 인도학과 중국어통번역학과 일본어통번역학과 |\n| 학과 (부) | [아래 학과 학번별 적용] 2020학번까지 제한 / 2021학번부터 해제 | [아래 학과 학번별 적용] 2020학번까지 신청 |\n| 학과 (부) | 아랍어과 | 아랍어통번역학과 |', '## [heading1] ##\n# ⑤ 국가리더(글로벌)전공\n\n## [heading1] ##\n# 1) 개요 및 교육목표\n\n## [list] ##\n- - 우리 사회의 모든 생활은 법률에 규율을 받으며, 법률에 대한 지식 없이는 온전한 사회 생활\n- 을 할 수 없다. 특히, 국가기관이나 기업들도 법률에 의해 조직 운영되고 법률에 큰 영향을\n- 받기 때문에, 구성원 채용 등에서 법률지식이 요구하는 것은 당연하다. 따라서 국가기관이나 공\n- 기업, 일반 사기업까지도 취업을 위해서는 기본적인 법률지식은 필수적이며, 또한 로스쿨 입\n- 학을 위해서도 법학지식의 습득여부는 합격여부의 중요한 변수이기도 하다.\n- - 그러나 우리 대학은 법학전문대학원 설치로 인하여 법학과가 폐지되고, 법학 부전공 과정도\n- 폐지되어, 교양으로서의 법률지식만 습득할 수 있는 상황이다. 그러나 교양지식만으로는 사\n- 회 각 분야 전문가에게 요구되는 법학지식을 충족할 수 없으므로, 사회 각 분야로의 취업\n- 및 로스쿨 진학 등에 요구되는 전공 수준의 법학지식을 함양시키기 위한 과정으로서 융복합\n- 공공정책 인력양성을 위한 ‘국가리더(글로벌) 융합전공’을 운영한다.\n- - 이중전공 또는 부전공으로 이수\n\n## [paragraph] ##\n2) 문의처 : Tel : 02-2173-2321 / e-mail : nationalleaderhufs@gmail.com\n\n## [footer] ##\n- 48 -']","졸업하기 전에 제출해야 하는 영어 성적은 외국어 인증을 위한 것으로, 다음과 같은 기준을 충족해야 합니다:

1. **인증 시험 성적**: 제출 시점 기준 유효기간(2년) 이내의 인증 시험 성적이 필요합니다. 인정되는 시험은 다음과 같습니다:
   - TOEIC
   - TOEFL
   - IELTS
   - FLEX 외국어 능력 시험 등

2. **대체 과정 수료증**: 인증 시험 성적 대신 외국어 연수 평가원 또는 외국어 교육센터에서 제공하는 대체 과정을 이수한 경우, 해당 수료증을 제출할 수 있습니다.

3. **제출 마감일**: 졸업하고자 하는 최종 학기 말까지 반드시 제출해야 하며, 재학 기간 동안 1회 외국어 인증 신청서를 제출할 수 있습니다.

정확한 기준과 제출 방법은 학사종합지원센터에 문의하시거나, 해당 과목의 담당 교수님께 확인하시기 바랍니다. 혹시 더 도와드릴까요?","외국어인증(졸업인증)에 대해 궁금하시군요! 2007학번 이후 모든 학생은 졸업 필수요건으로 외국어 인증을 완료해야 합니다. 1전공이 영어 관련 전공일 경우, 영어를 제외한 제2외국어로 인증 점수를 제출해야 하며, 비영어 전공인 경우 영어 인증 점수를 제출해야 합니다.",0.6270337604844176,1.0,,0.0
"AI융합전공 외국어인증 신청서 제출 이메일 주소가 뭐고, 언제까지 제출해야해?","['[공통] 외국어인증 신청서 제출 안내', '[공통] 외국어인증 신청서 제출 안내\n\n031) 330-4457\n\n자연과학대학 / 공과대학 / 바이오메디컬공학부\n\nyyj1730@hufs.ac.kr\n\n031) 330-4073\n\n경상대학 /\xa0AI융합대학(글로벌) / Culture& Technology융합대학 / 기후변화융합학부\n\nminsun@hufs.ac.kr\n\n031) 330-4953\n\n교무처 학사종합지원센터\n\n| 0 |\n|:----------------------------|\n| 외국어인증 신청서 제출 안내 |', '[공통] 외국어인증 신청서 제출 안내\n\n| 제출서류 | 1. 외국어인증 신청서(첨부파일 참조) 2. 제출시점 기준 유효기간(2년) 이내의 인증 시험 성적(또는 대체 과정 수료증) ※성적표 미리보기 캡쳐본\xa0성적 처리 불가 | 1. 외국어인증 신청서(첨부파일 참조) 2. 제출시점 기준 유효기간(2년) 이내의 인증 시험 성적(또는 대체 과정 수료증) ※성적표 미리보기 캡쳐본\xa0성적 처리 불가 | 1. 외국어인증 신청서(첨부파일 참조) 2. 제출시점 기준 유효기간(2년) 이내의 인증 시험 성적(또는 대체 과정 수료증) ※성적표 미리보기 캡쳐본\xa0성적 처리 불가 | 1. 외국어인증 신청서(첨부파일 참조) 2. 제출시점 기준 유효기간(2년) 이내의 인증 시험 성적(또는 대체 과정 수료증) ※성적표 미리보기 캡쳐본\xa0성적 처리 불가 |\n| 제출마감일 | 재학기간 동안\xa01회,\xa0외국어 인증 신청서를 제출하고자 하는 학기 말까지 ※\xa0졸업예정자는 졸업하고자 하는 최종 학기 말까지 반드시 제출해야함. | 재학기간 동안\xa01회,\xa0외국어 인증 신청서를 제출하고자 하는 학기 말까지 ※\xa0졸업예정자는 졸업하고자 하는 최종 학기 말까지 반드시 제출해야함. | 재학기간 동안\xa01회,\xa0외국어 인증 신청서를 제출하고자 하는 학기 말까지 ※\xa0졸업예정자는 졸업하고자 하는 최종 학기 말까지 반드시 제출해야함. | 재학기간 동안\xa01회,\xa0외국어 인증 신청서를 제출하고자 하는 학기 말까지 ※\xa0졸업예정자는 졸업하고자 하는 최종 학기 말까지 반드시 제출해야함. |\n| 제출처 | 학생의\xa01전공 소속 단과대학 담당에게\xa0E-mail\xa0제출 | 학생의\xa01전공 소속 단과대학 담당에게\xa0E-mail\xa0제출 | 학생의\xa01전공 소속 단과대학 담당에게\xa0E-mail\xa0제출 | 학생의\xa01전공 소속 단과대학 담당에게\xa0E-mail\xa0제출 |\n| 제출처 | 서울캠퍼스 | 영어대학 /\xa0아시어언어문화대학 / AI융합대학 | haksa7@hufs.ac.kr | 02) 2173-2264 |', '[공통] 외국어인증 신청서 제출 안내\n\n[공통] 외국어인증 신청서 제출 안내\n\n외국어인증 신청서 제출 안내\n\n외국어인증 신청서 제출에 대해 아래와 같이 안내합니다 .\n\n1. 외국어인증이란\n\n서울캠퍼스 수강편람 바로가기\n\n(수강편람목록- 수강편람 중 해당 페이지 참조)\n\n글로벌캠퍼스 수강편람 바로가기\n\n(수강편람목록- 수강편람 중 해당 페이지 참조 )\n\n2. 외국어인증 신청서 제출 안내\n\n제출서류\n\n1. 외국어인증 신청서(첨부파일 참조)\n\n2. 제출시점 기준 유효기간(2년) 이내의 인증 시험 성적 ( 또는 대체 과정 수료증 )\n\n※성적표 미리보기 캡쳐본\xa0성적 처리 불가\n\n제출마감일\n\n재학기간 동안 1 회 , 외국어 인증 신청서를 제출하고자 하는 학기 말 까지\n\n※ 졸업예정자는 졸업하고자 하는 최종 학기 말까지 반드시 제출해야함 .\n\n제출처\n\n학생의 1 전공 소속 단과대학 담당에게 E-mail 제출\n\n서울캠퍼스\n\n영어대학 / 아시어언어문화대학 / AI융합대학\n\nhaksa7@hufs.ac.kr\n\n02) 2173-2264\n\n서양어대학 / 중국학대학 / 일본학대학\n\nhana@hufs.ac.kr\n\n02) 2173-2121\n\n사회과학대학 / 상경대학 / 경영대학 / 국제학부 / LD 학부 / LT 학부 / KFL 학부\n\nhaksa6@hufs.ac.kr\n\n02) 2173-2308\n\n사범대학\n\npoisson@hufs.ac.kr\n\n02) 2173-2338\n\n글로벌캠퍼스\n\n인문대학 /\xa0통번역대학 / 융합인재대학\n\nhaksa4077@hufs.ac.kr\n\n031) 330-4077\n\n국가전략언어대학 / 국제지역대학 / 자유전공학부(글로벌)\n\n031) 330-4457\n\n자연과학대학 / 공과대학 / 바이오메디컬공학부\n\nyyj1730@hufs.ac.kr\n\n031) 330-4073\n\n경상대학 /\xa0AI융합대학(글로벌) / Culture& Technology융합대학 / 기후변화융합학부\n\nminsun@hufs.ac.kr\n\n031) 330-4953\n\n교무처 학사종합지원센터', '[공통] 외국어인증 신청서 제출 안내\n\n| 0 | 1 | 2 | 3 | 4 |\n|:-----------|:--------------------------------------------------------------------------------------------------------------------------------------------------------|:--------------------------------------------------------------------------------------------------------------------------------------------------------|:--------------------------------------------------------------------------------------------------------------------------------------------------------|:--------------------------------------------------------------------------------------------------------------------------------------------------------|', '[공통] 외국어인증 신청서 제출 안내\n\n| 제출처 | 서울캠퍼스 | 영어대학 /\xa0아시어언어문화대학 / AI융합대학 | haksa7@hufs.ac.kr | 02) 2173-2264 |\n| 제출처 | 서울캠퍼스 | 서양어대학 / 중국학대학 / 일본학대학 | hana@hufs.ac.kr | 02)\xa02173-2121 |\n| 제출처 | 서울캠퍼스 | 사회과학대학 /\xa0상경대학\xa0/\xa0경영대학\xa0/\xa0국제학부\xa0/\xa0LD학부\xa0/\xa0LT학부\xa0/\xa0KFL학부 | haksa6@hufs.ac.kr | 02)\xa02173-2308 |\n| 제출처 | 서울캠퍼스 | 사범대학 | poisson@hufs.ac.kr | 02)\xa02173-2338 |\n| 제출처 | 글로벌캠퍼스 | 인문대학 /\xa0통번역대학\xa0/\xa0융합인재대학 | haksa4077@hufs.ac.kr | 031) 330-4077 |\n| 제출처 | 글로벌캠퍼스 | 국가전략언어대학\xa0/\xa0국제지역대학\xa0/ 자유전공학부(글로벌) | lsh0613@hufs.ac.kr | 031)\xa0330-4457 |\n| 제출처 | 글로벌캠퍼스 | 자연과학대학\xa0/\xa0공과대학\xa0/\xa0바이오메디컬공학부 | yyj1730@hufs.ac.kr | 031)\xa0330-4073 |\n| 제출처 | 글로벌캠퍼스 | 경상대학 /\xa0AI융합대학(글로벌) /\xa0Culture& Technology융합대학\xa0/ 기후변화융합학부 | minsun@hufs.ac.kr | 031)\xa0330-4953 |', '[공통] 외국어인증 신청서 제출 안내\n\n[공통] 외국어인증 신청서 제출 안내\n\n외국어인증 신청서 제출 안내\n\n외국어인증 신청서 제출에 대해 아래와 같이 안내합니다 .\n\n1. 외국어인증이란\n\n서울캠퍼스 수강편람 바로가기\n\n(수강편람목록- 수강편람 중 해당 페이지 참조)\n\n글로벌캠퍼스 수강편람 바로가기\n\n(수강편람목록- 수강편람 중 해당 페이지 참조 )\n\n2. 외국어인증 신청서 제출 안내\n\n제출서류\n\n1. 외국어인증 신청서(첨부파일 참조)\n\n2. 제출시점 기준 유효기간(2년) 이내의 인증 시험 성적 ( 또는 대체 과정 수료증 )\n\n※성적표 미리보기 캡쳐본\xa0성적 처리 불가\n\n제출마감일\n\n재학기간 동안 1 회 , 외국어 인증 신청서를 제출하고자 하는 학기 말 까지\n\n※ 졸업예정자는 졸업하고자 하는 최종 학기 말까지 반드시 제출해야함 .\n\n제출처\n\n학생의 1 전공 소속 단과대학 담당에게 E-mail 제출\n\n서울캠퍼스\n\n영어대학 / 아시어언어문화대학 / AI융합대학', '| 제출마감일 | 재학기간 동안\xa01회,\xa0외국어 인증 신청서를 제출하고자 하는 학기 말까지 ※\xa0졸업예정자는 졸업하고자 하는 최종 학기 말까지 반드시 제출해야함. | 재학기간 동안\xa01회,\xa0외국어 인증 신청서를 제출하고자 하는 학기 말까지 ※\xa0졸업예정자는 졸업하고자 하는 최종 학기 말까지 반드시 제출해야함. | 재학기간 동안\xa01회,\xa0외국어 인증 신청서를 제출하고자 하는 학기 말까지 ※\xa0졸업예정자는 졸업하고자 하는 최종 학기 말까지 반드시 제출해야함. | 재학기간 동안\xa01회,\xa0외국어 인증 신청서를 제출하고자 하는 학기 말까지 ※\xa0졸업예정자는 졸업하고자 하는 최종 학기 말까지 반드시 제출해야함. |\n| 제출처 | 학생의\xa01전공 소속 단과대학 담당에게\xa0E-mail\xa0제출 | 학생의\xa01전공 소속 단과대학 담당에게\xa0E-mail\xa0제출 | 학생의\xa01전공 소속 단과대학 담당에게\xa0E-mail\xa0제출 | 학생의\xa01전공 소속 단과대학 담당에게\xa0E-mail\xa0제출 |', '[공통] 외국어인증 신청서 제출 안내\n\n[공통] 외국어인증 신청서 제출 안내\n\n외국어인증 신청서 제출 안내\n\n외국어인증 신청서 제출에 대해 아래와 같이 안내합니다 .\n\n1. 외국어인증이란\n\n서울캠퍼스 수강편람 바로가기\n\n(수강편람목록- 수강편람 중 해당 페이지 참조)\n\n글로벌캠퍼스 수강편람 바로가기\n\n(수강편람목록- 수강편람 중 해당 페이지 참조 )\n\n2. 외국어인증 신청서 제출 안내\n\n제출서류\n\n1. 외국어인증 신청서(첨부파일 참조)\n\n2. 제출시점 기준 유효기간(2년) 이내의 인증 시험 성적 ( 또는 대체 과정 수료증 )\n\n※성적표 미리보기 캡쳐본\xa0성적 처리 불가\n\n제출마감일\n\n재학기간 동안 1 회 , 외국어 인증 신청서를 제출하고자 하는 학기 말 까지', '이수구분 변경신청\xa0안내 ( 클릭 시 이동 )\n\n나 . 외국어인증 서류 제출 1 월 14 일 ( 화 ) 까지 단과대학 교학과로 제출 가능함\n\n( 단 , 외국어연수평가원 여름방학 특별과정 이수자는 과정 종료일 당일 수료증 제출자에 한하여 졸업사정에 반영함 )\n\n※ 특별한 사정이 있어 1 월 14 일 ( 화 ) 까지 제출이 어려운 학생은 학적 담당자 (031-330-4027) 에게 별도 문의 바람\n\n외국어 인증 안내 ( 클릭 시 이동 )\n\n다 . 글로벌 지역학사 / 지역전문가과정 신청자 중\n\n2 월 졸업 또는 졸업대기 ( 학점완료 후 졸업을 미룬 상태 ) 예정인 학생은\n\n첨부 된 서류 작성하여 학과 확인 받은 후 학사종합지원센터 학적 담당 (hufsmil@hufs.ac.kr) 에게\n\n1 월 14 일 ( 화 ) 까지 제출 하여야 학위증 및 졸업증명서에 지역학사 또는 지역전문가 반영됨 .\n\n( 단 , 미제출 하여도 졸업 또는 졸업대기가 가능함 .)', '- 졸업희망자는 외국어인증 서류를 1/14 오전 까지 단과대학 교학과로 제출 바람\n\n( 단 , 외국어연수평가원 겨울방학 특별과정 이수자는 과정 종료일 당일 수료증 제출자에 한하여 ( 야간반의 경우 다음날 오전까지 ) 졸업사정에 반영함 )\n\n외국어인증신청서 제출안내 학사공지 게시글 바로가기 클릭', '| 제출마감일 | 재학기간 동안\xa01회,\xa0외국어 인증 신청서를 제출하고자 하는 학기 말까지 ※\xa0졸업예정자는 졸업하고자 하는 최종 학기 말까지 반드시 제출해야함. | 재학기간 동안\xa01회,\xa0외국어 인증 신청서를 제출하고자 하는 학기 말까지 ※\xa0졸업예정자는 졸업하고자 하는 최종 학기 말까지 반드시 제출해야함. | 재학기간 동안\xa01회,\xa0외국어 인증 신청서를 제출하고자 하는 학기 말까지 ※\xa0졸업예정자는 졸업하고자 하는 최종 학기 말까지 반드시 제출해야함. | 재학기간 동안\xa01회,\xa0외국어 인증 신청서를 제출하고자 하는 학기 말까지 ※\xa0졸업예정자는 졸업하고자 하는 최종 학기 말까지 반드시 제출해야함. |', '* 융합전공의 이수구분 변경이 필요한 경우는 융합전공 담당 선생님에게 E-Mail(또는 직접 방문제출)로 제출하여 주시기 바랍니다.\n\n*** 유의사항\n\n단, 중국학대학 , 미 디어커뮤니케이션학부, 국제통상학과 ( 상경대학 ), EU전공, 동북아외교통상전공 , AI융합전공(Language&AI트랙/Business&AI트랙/Software&AI트랙) , Business & AI전공, 융복합소프트웨어전공, LD/LT 등 의 세부전공교류 ( 이수구분 ) 신청의 경우 또는 먼저 학과의 확인이 필요한 경우 , 각 전공 ( 학과 ) 사무실의 확인\xa0등 별도의 절차(양식)를 통해 처리되오니\xa0해당 전공 ( 학부 ) 사무실로 우선 문의 하여 주시기 바랍니다 .\n\n[제출시 참고]', '(공통)2025-1학기 부전공 신청 및 이중/부전공 취소 일정 공고\n\n다 . ( 부전공 신청 및 이중 / 부전공 취소에 따라 ) 이수구분 수정이 필요한 경우\n\n“ 이수구분 변경 신청서 ”( 첨부파일 ) 작성 제출 ( ※ 상시 제출 가능 )\n\n▶ ( 서울 ) 이수구분 변경 신청서 제출처 안내 바로가기 ▶ ( 글로벌 ) 이수구분 변경 신청서 제출처 안내 바로가기\n\n2025. 1.\n\n교무처장\n\n| 0 |\n|:----------------------------------------------------------------------------------------------------------------------------------------------------------------------------------------------------------|\n| ※ 단, 8학기 이상인 학생은 이중(부)전공 변경 신청서(첨부파일)를 작성하여 학사종합지원센터 단과대학 교학과 이메일 또는 방문 신청 ▶ (서울) 제출처 안내 바로가기 ▶ (글로벌) hufsdbl@hufs.ac.kr 로 이메일 제출 |', '[글로벌] 2025년 전기(2월 졸업) 졸업예비사정 결과 조회 안내\n\n| (3)이중전공 (3)졸시논문 | 완료 | 이중전공 졸업논문,\xa0졸업시험,\xa0졸업시험대체성적 제출 및 입력 완료 | 이중전공 졸업논문, 졸업시험 등 통과여부 |\n| (3)이중전공 (3)졸시논문 | 미완료 | 해당학과 학과사무실에 문의 | 이중전공 졸업논문, 졸업시험 등 통과여부 |\n| (3)이중전공 (3)졸시논문 | 비대상 | 이중전공 비대상자 | 이중전공 졸업논문, 졸업시험 등 통과여부 |\n| (4)외국어 (4)졸업인증 | 완료 | 외국어인증 제출 및 입력 완료 | 외국어인증 통과여부 |\n| (4)외국어 (4)졸업인증 | 미완료 | 외국어인증 미완료자. 1전공 단과대학 교학과로 제출 필요. 외국어인증 신청서 제출 안내 링크(클릭 시 이동) | 외국어인증 통과여부 |\n| (4)외국어 (4)졸업인증 | 비대상 | 외국어인증이 필요 없는 비대상자 | 외국어인증 통과여부 |\n| ▶졸업가능 여부 | 가능 | 별도 신청 불필요. 2월\xa014일(금)\xa0학위수여식 참석. (졸업 가운 및 앨범 관련 문의\xa0: 031-330-4160\xa0총학생회) | 2월 졸업가능 여부 표기 |\n| ▶졸업가능 여부 | 불가 | (1) ~ (4)\xa0항목 참고하여 충족되면\xa0“가능”으로 변경 가능 | 2월 졸업가능 여부 표기 |\n| (기타) | 조기졸업 | 탈락자는\xa08학기 정규학기에 다녀야함. 이수할 학점이 없어도\xa01학점 이상 필히 수강해야하며 등록금\xa0100%\xa0납부해야 함 | 기타 특이사항 명시 ※\xa0해당사항이 없는 학생은 표시되지 않고,\xa0대상자에만 표시 |\n| (기타) | 학석사연계 | 정보없음 | 기타 특이사항 명시 ※\xa0해당사항이 없는 학생은 표시되지 않고,\xa0대상자에만 표시 |\n| (기타) | 석사예약제 | 정보없음 | 기타 특이사항 명시 ※\xa0해당사항이 없는 학생은 표시되지 않고,\xa0대상자에만 표시 |\n| (기타) | 후기이중전공 | 후기이중전공(진입)\xa0학생은\xa09학기 추가학기 수강신청 가능 탈락시 후기이중전공 불가 | 기타 특이사항 명시 ※\xa0해당사항이 없는 학생은 표시되지 않고,\xa0대상자에만 표시 |', '[글로벌] 2025년 전기(2월 졸업) 졸업예비사정 결과 조회 안내\n\n1 전공 졸업논문 ,\n\n졸업시험 등\n\n통과여부\n\n미완료\n\n해당학과 학과사무실에 문의\n\n(3) 이중전공\n\n(3) 졸시논문\n\n완료\n\n이중전공 졸업논문 , 졸업시험 , 졸업시험대체성적 제출 및 입력 완료\n\n이중전공 졸업논문 ,\n\n졸업시험 등\n\n통과여부\n\n미완료\n\n해당학과 학과사무실에 문의\n\n비대상\n\n이중전공 비대상자\n\n(4) 외국어\n\n(4) 졸업인증\n\n완료\n\n외국어인증 제출 및 입력 완료\n\n외국어인증 통과여부\n\n미완료\n\n외국어인증 미완료자 . 1 전공 단과대학 교학과로 제출 필요 .\n\n외국어인증 신청서 제출 안내 링크 ( 클릭 시 이동 )\n\n비대상\n\n외국어인증이 필요 없는 비대상자\n\n▶졸업가능\n\n여부\n\n가능\n\n별도 신청 불필요 . 2 월 14 일 ( 금 ) 학위수여식 참석 .\n\n( 졸업 가운 및 앨범 관련 문의 : 031-330-4160 총학생회 )\n\n2월 졸업가능\n\n여부 표기\n\n불가\n\n(1) ~ (4) 항목 참고하여 충족되면 “ 가능 ” 으로 변경 가능\n\n( 기타)\n\n조기졸업\n\n탈락자는 8 학기 정규학기에 다녀야함 .\n\n이수할 학점이 없어도 1 학점 이상 필히 수강해야하며 등록금 100% 납부해야 함\n\n기타 특이사항 명시\n\n※ 해당사항이 없는 학생은 표시되지 않고 , 대상자에만 표시\n\n학석사연계\n\n석사예약제\n\n후기이중전공\n\n후기이중전공 ( 진입 ) 학생은 9 학기 추가학기 수강신청 가능\n\n탈락시 후기이중전공 불가\n\n글로벌지역학\n\n확인서미제출이더라도 졸업대기 , 졸업 가능\n\n졸업대기 처리 이후 , 졸업 이후 학위명 변경 불가\n\n재학년한\n\n초과제적\n\n“ 미졸업시 재학년한초과제적 예정 ” 이라고 표시되었더라도\xa02 월 졸업 가능 시 제적되지 않음\n\n가 . 졸업가능자 예시 : (1) 학점 : 완료 (2) 제 1 전공졸시논문 : 완료 (3) 이중전공졸시논문 : 비대상 (4) 외국어졸업인증 : 비대상 ▶ 졸업가능여부 : 가능', '[서울]2025-1학기 폐강(2차) 공고(서울캠퍼스)\n\n| 2025학년도 제1학기 서울캠퍼스 폐강(2차) 강좌를 아래와 같이 공고하오니 해당 강좌 수강생은 기간 내에 수강신청을 변경하시기 바랍니다. - 아 래 - ■ 폐강(2차) 강좌 수강생 수강신청 변경 안내 1. 변경 기간 :\xa02025. 3. 14.(금) ~ 3. 18.(화), 오후 4시까지 ※\xa03. 18.(화) 오후 4시까지 수신된 이메일에 한하여 접수하오니\xa0기한 내 이메일 발송 2. 신청 방법 : 신청서 작성 후\xa0이메일 제출 가. 신청서 : 붙임의\xa0“폐강과목 대체 수강 신청서” 다운로드 나. 제출처 :\xa0본인 1전공 소속 단과대학 교학파트 제출(※ 전공/교양 모두 작성 제출) 단과대학 이메일 전화문의 창구 서양어대학, 중국학대학, 일본학대학 hana@hufs.ac.kr 02) 2173 - 2121 5번 사회과학대학, 상경대학, 경영대학, 국제학부, LD학부, LT학부, KFL학부 haksa6@hufs.ac.kr 02) 2173 - 2308 6번 영어대학, 아시아언어문화대학, AI융합대학 haksa7@hufs.ac.kr 02) 2173 - 2264 7번 사범대학 poisson@hufs.ac.kr 02) 2173 - 2338 4번 자유전공학부(서울) haksaseoul@hufs.ac.kr 02) 2173 - 2109 9번 3. 유의 사항 가. 폐강된 과목의 수강은 자동 취소됨 나.\xa0폐강된 과목 수와 동일한 과목 수 만큼 신청 가능(단, 최대 수강신청 학점 초과 불가) 다', '[서울]2025-1학기 폐강(2차) 공고(서울캠퍼스)\n\n[서울]2025-1학기 폐강(2차) 공고(서울캠퍼스)\n\n2025-1학기 폐강(2차) 공고(서울캠퍼스)\n\n2025학년도 제1학기 서울캠퍼스 폐강(2차) 강좌를 아래와 같이 공고하오니\n\n해당 강좌 수강생은 기간 내에 수강신청을 변경하시기 바랍니다.\n\n- 아\xa0\xa0 래 -\n\n■ 폐강(2차) 강좌 수강생 수강신청 변경 안내\n\n1. 변경 기간 : 2025. 3. 14.(금) ~ 3. 18.(화), 오후 4시까지\n\n※ 3. 18.(화) 오후 4시까지 수신된 이메일에 한하여 접수하오니 기한 내 이메일 발송\n\n2. 신청 방법 : 신청서 작성 후 이메일 제출\n\n가. 신청서 : 붙임의 “폐강과목 대체 수강 신청서” 다운로드\n\n나. 제출처 : 본인 1전공 소속 단과대학 교학파트 제출 (※ 전공/교양 모두 작성 제출)\n\n단과대학\n\n이메일\n\n전화문의\n\n창구\n\n서양어대학, 중국학대학, 일본학대학\n\nhana@hufs.ac.kr\n\n02) 2173 - 2121\n\n5번\n\n사회과학대학, 상경대학, 경영대학,\n\n국제학부, LD학부, LT학부, KFL학부\n\nhaksa6@hufs.ac.kr\n\n02) 2173 - 2308\n\n6번\n\n영어대학, 아시아언어문화대학,\n\nAI융합대학\n\nhaksa7@hufs.ac.kr\n\n02) 2173 - 2264\n\n7번\n\n사범대학\n\npoisson@hufs.ac.kr\n\n02) 2173 - 2338\n\n4번\n\n자유전공학부(서울)\n\nhaksaseoul@hufs.ac.kr\n\n02) 2173 - 2109\n\n9번\n\n3. 유의 사항\n\n가. 폐강된 과목의 수강은 자동 취소됨\n\n나. 폐강된 과목 수와 동일한 과목 수 만큼 신청 가능 (단, 최대 수강신청 학점 초과 불가)\n\n다. 수강신청 변경 시점 기준으로 제한 인원을 초과하지 않는 과목으로 변경 가능\n\n※ 수강 가능 강좌(신청/제한인원) 확인 방법 : ▶ “강의시간표 조회” 바로가기\n\n■ 2025학년도 제1학기 폐강(2차) 강좌 현황\n\n개설학과\n\n이수\n\n영역\n\n학년\n\n학수번호\n\n교과목명\n\n학점\n\n시간\n\n교강사명\n\n강의시간\n\n독일어과\n\n전공\n\n2', '[글로벌]2025-1학기 폐강(2차) 공고(글로벌캠퍼스)\n\n[글로벌]2025-1학기 폐강(2차) 공고(글로벌캠퍼스)\n\n2025-1 학기 폐강 (2 차 ) 공고 ( 글로벌캠퍼스 )\n\n2025-1 학기 글로벌캠퍼스 폐강 (2 차 ) 강좌를 아래와 같이 공고 합니다 .\n\n폐강 강좌를 수강신청한 학생은 아래와 같이 해당 기한 내에 수강신청을 변경 하기 바랍니다 .\n\n- 아 래 -\n\n■ 폐강강좌 수강생 수강신청 변경\n\n1. 변경 기간 : 2025. 3. 14.( 금 ) ~ 3. 18.( 화 ) 오후 4:00 까지 ( 이메일 발송 기한엄수 )\n\n( ※ 3.\xa018.( 화 ) 오후 4 시까지 수신된 이메일에 한하여 접수하오니 기한 내 이메일 발송 )\n\n2. 작성양식 : 이 공지의 첨부 파일 (‘ 폐강과목 대체 수강 신청서 ’) 작성\n\n3. 제 출 처 : 본인 1 전공 소속 단과대학 교학파트 ( 학사종합지원센터 ) 이메일 제출\n\n단과대학 구분\n\n전화번호\n\n(031-330- 내선 )\n\n담당자 이메일\n\n사무실 위치\n\n인문대학, 통번역대학, 융합인재대학\n\n내선 4077\n\nhaksa4077@hufs.ac.kr\n\n학생회관 109 호\n\n국가전략언어대학, 국제지역대학, 자유전공학부\n\n내선 4457\n\nlsh0613@hufs.ac.kr\n\n공과대학, 자연과학대학, 바이오메디컬공학부\n\n내선 4073\n\nyyj1730@hufs.ac.kr\n\n교직, 경상대학, Culture&Technology융합대학, 기후변화융합학부, AI융합대학\n\n내선 4953\n\nminsun@hufs.ac.kr\n\n※ 수강과목 이수구분 ( 전공 , 교양 등 ) 상관 없이 본인 1 전공 소속 단과대학 교학 파트 이메일 제출\n\n4. 유의 사항\n\n가 . 폐강된 과목수와 동일한 과목수 만큼 수강신청 변경 가능 ( 단 , 최대수강신청 학점 초과 불가 )\n\n나 . 수강신청 변경 시점 기준으로 제한인원을 초과하지 않는 과목으로 변경 가능 수강 가능 강좌 확인 ☞ 강의시간표 조회 ( 클릭 )\n\n다 . 폐강 강좌를 수강하지 않은 학생은 이 기간에 수강신청 변경을 할 수 없음', '(서울) 2025년 전기(2월 졸업) 졸업예비사정 결과 조회 안내\n\n| - 이수구분 수정(교류과목 자선->전공, 전공인정 교양과목->전공 자선->교양 등)을 하지 않아 학점이 미비 된 학생은 반드시 단과대학 교학과에 1/14 오전까지 이수구분 변경을 하여야 졸업 또는 수료가 가능함. | 이수구분 변경신청서 서식함 게시글 바로가기 클릭 |\n| - 졸업희망자는 외국어인증 서류를 1/14 오전까지 단과대학 교학과로 제출 바람 (단, 외국어연수평가원 겨울방학 특별과정 이수자는 과정 종료일 당일 수료증 제출자에 한하여(야간반의 경우 다음날 오전까지)졸업사정에 반영함) | 외국어인증신청서 제출안내 학사공지 게시글 바로가기 클릭 |\n| - 코어사업 지역학사/지역전문가과정/학석사연계과정 신청자 중 이번 졸업 또는 수료(학점완료 후 졸업을 미룬 상태)를 희망하는 학생은 관련 서류 작성하여 학과 확인 받은 후 학사종합지원센터에 1/14 오전까지 제출하여야 학위증 및 졸업증명서에 지역학사 또는 지역전문학과정 이수가 반영됨. (방문제출(학사종합지원센터 1번창구) 또는 이메일 haksamil@hufs.ac.kr 제출 가능하며 기제출자는 제출 불필요. 졸업 이후 학위명 변경 불가함.) | 관련 서류 학사공지 게시글 바로가기 클릭 |\n| - 2024학년도 2학기 현장실습 학점 인정 후 졸업이 필요한 학생은 1/21까지 학점인정 처리를 완료하기 바람. | 관련 진로취업지원센터 문의 |', ""(공통) 2025학년도 1학기 조기졸업 신청 공고\n\n(공통) 2025학년도 1학기 조기졸업 신청 공고\n\n2025학년도 1학기 조기졸업 신청 공고\n\n2025 학년도 1 학기 조기졸업 신청 일정 및 방법을 공고합니다 .\n\n1. 신청기간\n\n- 종합정보시스템 신청 기간 : 2025. 2. 26( 수 ) ~ 3. 7( 금 ) 오후 3 시까지\n\n- 신청서 제출 기간 : 2025. 2. 26( 수 ) ~ 3. 7( 금 ) 오후 4 시까지\n\n※ 종합정보시스템에서만 신청하고 신청서 미제출 시 선발되지 않음\n\n2. 신청자격\n\n- 3 학년 1 학기 진급예정자\n\n- 2 학년 2 학기까지 “ 매 학기 ” 소정의 학점을 취득한 자 ( 수강편람 참조 )\n\n서울캠퍼스 : 2025 학년도 1 학기 수강편람 81 페이지\n\n글로벌캠퍼스 : 2025 학년도 1 학기 수강편람 76 페이지\n\n- 총 성적 평점평균이 4.00 이상인 자\n\n※ 위 세가지 요건을 모두 만족하여야 함\n\n3. 신청방법 : 종합정보시스템 로그인 -> 학적변동신청 -> 조기졸업신청\n\n- 종합정보시스템 신청 및 신청서 출력 -> 학과 ( 부 ) 장님께 의견 작성 요청 ( 학과 ( 부 ) 장 서명 또는 도장 날인 필수 ) -> 본인 소속 캠퍼스 학사종합지원센터 방문 또는 이메일 제출\n\n( 서울캠퍼스 : 본관 1 층 118 호 , haksamil@hufs.ac.kr / 글로벌캠퍼스 : 학생회관 1 층 109 호 , hufsmil@hufs.ac.kr)\n\n4. 기타\n\n- 조기졸업제도는 졸업학기를 1 개학기 단축하여 졸업하는 제도임 (7 학기 졸업 )\n\n- 수강신청 변경기간에 3 학점 추가 신청 가능 ( 서류제출 시점부터 가능 )\n\n- 조기졸업 대상자 선정 후 취소 또는 자격을 상실할 경우 수강학점 이월 미적용\n\n- 조기졸업이 취소된 학생의 경우 7 학기까지 학점이수가 완료되어도 8 학기 수강 신청 및 등록이 필수 사항임\n\n- 수강편람 조기졸업 안내 및 홈페이지 전자규정집 ' 조기졸업제운영규정 ' 참고\n\n2025. 2.\n\n서울 . 글로벌캠퍼스 교무처장"", '[공통] 2024-2학기 이중전공 변경 배정 확정 공고\n\n[공통] 2024-2학기 이중전공 변경 배정 확정 공고\n\n[공통] 2024-2 학기 이중전공 변경 배정 확정 공고\n\n2024 학년도 제 2 학기 이중전공 변경 배정 결과를 아래와 같이 공고합니다 .\n\n- 아 래 -\n\n1. 결과 조회 : 종합정보시스템 → 전공 / 교직관리 → 이중전공 변경신청 → 안내사항\n\n*\xa01 월 7 일 오후 13 시 30 분부터 조회 가능\n\n2. 배정 결과에 따른 확인 사항\n\n가 . 이중전공 변경에 배정 된 경우\n\n1) 기존에 이수 중인 이중 / 부전공 은 자동 취소 됨 ( ※ 별도 취소 절차 없음 )\n\n2) “ 3. 이수구분 변경 안내 ” 를 참고하여 이중전공 변경으로 인한 이수구분 변경 신청\n\n※ 이번 학기 졸업예정자 (4 학년 수료 , 졸업대기 포함 ) 는 이수구분 변경을 신 청 하여 졸업 학점에 누락되는 일이 없도록 해야함\n\n3) 후기이중전공 선발자 가 이중전공 변경 배정된 경우 이중전공 변경으로 처리 됨\n\n( 단 , 후기이중전공 이수 희망자 제외 )\n\n나 . 이중전공 변경에 미배정 된 경우\n\n1) 기존에 이수 중인 이중 / 부전공 은 그대로 유지 됨\n\n3. 이수구분 변경 안내 : 이수구분 변경이 필요한 경우 학사종합지원센터 홈페이지 서식함의 “ 이수구분 변경 신청서 ” 작성 제출 ( ※ 상시 제출 가능 )\n\n▶ ( 서울 ) 이수구분 변경 신청서 바로가기 / ▶ ( 글로벌 ) 이수구분 변경 신청서 바로가기\n\n4. 기타 안내사항\n\n가 . 부전공 희망자 및 단일전공 희망자 의 경우 추후 종합정보시스템으로 별도 신청 예정\n\n1) 부전공 희망자 : 일반 부전공 또는 전공심화 + 부전공 신청\n\n2) 단일전공 희망자 : 기존 이중 / 부전공 취소\n\n※ 자세한 일정은 2025 년 1 월 중순 학사공지 예정인 “ 부전공 신청 및 이중전공 / 부전공 취소 일정 ” 확인\n\n※ 단 , 8 학기 이상인 학생 은 학사종합지원센터 단과대학 교학과 이메일 또는\n\n방문 신청', '[공통] 2024-2학기 이중전공 변경 배정 확정 공고\n\n1) 부전공 희망자 : 일반 부전공 또는 전공심화 + 부전공 신청\n\n2) 단일전공 희망자 : 기존 이중 / 부전공 취소\n\n※ 자세한 일정은 2025 년 1 월 중순 학사공지 예정인 “ 부전공 신청 및 이중전공 / 부전공 취소 일정 ” 확인\n\n※ 단 , 8 학기 이상인 학생 은 학사종합지원센터 단과대학 교학과 이메일 또는\n\n방문 신청\n\n▶ ( 서울 ) 이중전공 / 부전공 / 단일전공 변경 신청서 (8 학기 이상 ) 바로가기\n\n▶ ( 글로벌 ) 이중전공 , 부전공 및 전공심화 변경 신청서 (8 학기 이상 ) 바로가기\n\n나 . 다음 학기 이중전공 변경 신청 기간은 5 월 예정\n\n2025. 1.\n\n교무처장\n\n| 0 |\n|:-----------------------------------------------------------------------------------------------------------------------------------------------------------------------------------------------------------------------------|\n| ※ 단, 8학기 이상인 학생은 학사종합지원센터 단과대학 교학과 이메일 또는 방문 신청 ▶ (서울) 이중전공/부전공/단일전공 변경 신청서(8학기 이상) 바로가기 ▶ (글로벌) 이중전공, 부전공 및 전공심화 변경 신청서(8학기 이상) 바로가기 |', '[공통] 2025-1학기 이중전공 변경 신청 일정 공고 새글\n\n라 . 부전공 희망자 및 전공심화 ( 단일전공 ) 희망자 의 경우 추후 종합정보시스템으로 별도 신청 예정\n\n1) 부전공 희망자 : 일반 부전공 또는 전공심화 ＋ 부전공 신청\n\n2) 단일전공 희망자 : 기존 이중 / 부전공 취소\n\n※ 자세한 일정은 2025 년 7 월 중순 학사공지 예정인 “ 부전공 신청 및 이중전공 / 부전공 취소 일정 ” 확인\n\n마 . 편입생도 희망 시 이중전공 , 부전공 , 전공심화 ( 부전공 ) 로 이수할 수 있음\n\n※ 이수 시 졸업이수학점 및 외국어인증기준이 변경될 수 있음\n\n바 . ( 이중전공 변경에 따라 ) 이수구분 수정이 필요한 경우 학사종합지원센터 홈페이지 서식함의 “ 이수구분 변경 신청서 ” 를 작성하여 제출 바람\n\n※ 상시 제출 가능\n\n▶ ( 서울 ) 이수구분 변경 신청서 바로가기\n\n▶ ( 글로벌 ) 이수구분 변경 신청서 바로가기\n\n2025. 4.\n\n교무처장', '[공통] 2025-1학기 재수강 과목 연결 일정 공고\n\n[공통] 2025-1학기 재수강 과목 연결 일정 공고\n\n2025-1학기 재수강 과목 연결 일정 공고\n\n2025학년도 제1학기 재수강 과목 연결 일정을 아래와 같이 안내합니다.\n\n- 아\xa0 래 -\n\n1. 재수강 연결기간 : 2025. 3. 14.(금) 10시 ~ 3. 20.(목) 17시\n\n※ 재수강으로 수강 신청한 과목은 반드시 이 기간에 모두 연결해야함\n\n※ 추가 연결기간 없음\n\n2. 재수강 연결방법\n\n가. 재수강 연결 안내문(붙임파일) 및 수강편람 확인\n\n나. 전산 자동연결이 안된 경우, 학생이 직접 홈페이지 종합정보시스템 로그인 한 후 “종합정보시스템 → 수업/수강관리 → 재수강과목선택” 메뉴에서 재수강할 이전 성적을 선택하여 재수강 연결함.\n\n다. <재수강 과목 선택> 프로그램 사용\n\n학교 홈페이지 → 종합정보시스템 → 수업/수강관리 → <재수강 과목 선택>\n\n※ 수강신청 시 재수강을 잘못 신청한 경우 :\n\n“ 재수강 지정 / 취소 신청서 ” 를 작성하여 단과대학 교학파트에 이메일 제출\n\n▶ 서울캠퍼스 게시글 바로가기 / ▶ 글로벌캠퍼스 게시글 바로가기\n\n2025. 3.\n\n서울·글로벌캠퍼스 교무처장', '(서울) 2025년 전기(2월 졸업) 졸업예비사정 결과 조회 안내\n\n이수구분 변경신청서 서식함 게시글 바로가기 클릭\n\n- 졸업희망자는 외국어인증 서류를 1/14 오전 까지 단과대학 교학과로 제출 바람\n\n( 단 , 외국어연수평가원 겨울방학 특별과정 이수자는 과정 종료일 당일 수료증 제출자에 한하여 ( 야간반의 경우 다음날 오전까지 ) 졸업사정에 반영함 )\n\n외국어인증신청서 제출안내 학사공지 게시글 바로가기 클릭\n\n- 코어사업 지역학사 / 지역전문가과정 / 학석사연계과정 신청자 중 이번 졸업 또는 수료 ( 학점완료 후 졸업을 미룬 상태 ) 를 희망하는 학생은 관련 서류 작성하여 학과 확인 받은 후 학사종합지원센터에 1/14 오전 까지 제출하여야 학위증 및 졸업증명서에 지역학사 또는 지역전문학과정 이수가 반영 됨 .\n\n( 방문제출 ( 학사종합지원센터 1 번창구 ) 또는 이메일 haksamil@hufs.ac.kr 제출 가능하며 기제출자는 제출 불필요 . 졸업 이후 학위명 변경 불가 함 .)\n\n관련 서류 학사공지 게시글 바로가기 클릭\n\n- 2024 학년도 2 학기 현장실습 학점 인정 후 졸업이 필요한 학생은 1/21 까지 학점인정 처리를 완료 하기 바람 .\n\n관련 진로취업지원센터 문의\n\n* 부득이한 사정으로 1 월 14 일까지 제출이 어려운 학생은 별도 문의바람 .\n\n5. 문의처\n\n- 졸업시험 / 논문 , 전공필수 관련 : 해당학과 사무실 ( 연락처 : 02-2173- 아래의 내선번호 )\n\nELLT 학과 ( 영어학과 )\n\n2266\n\n태국어과\n\n2299\n\n경제학부\n\n2333\n\n영미문학 . 문화학과 ( 영문학과 )\n\n2267\n\n베트남어과\n\n2300\n\n국제통상학과\n\n2332\n\nEICC 학과 ( 영어통번역학과 )\n\n2268\n\n페르시아어 . 이란학과\n\n2303\n\n경영학부\n\n2334\n\n프랑스어학부\n\n2282\n\n인도어과\n\n2301\n\n영어교육과\n\n2342\n\n독일어과\n\n2283\n\n터키 . 아제르바이잔어과\n\n2302\n\n프랑스어교육과\n\n2343\n\n노어과\n\n2284\n\n몽골어과\n\n2415\n\n독일어교육과\n\n2344\n\n스페인어과\n\n2285\n\n중국언어문화학부', '[글로벌]2025-1학기 폐강(2차) 공고(글로벌캠퍼스)\n\n| 2025-1학기 글로벌캠퍼스 폐강(2차) 강좌를 아래와 같이 공고합니다. 폐강 강좌를 수강신청한 학생은 아래와 같이 해당 기한 내에 수강신청을 변경하기 바랍니다. - 아 래 - ■ 폐강강좌 수강생 수강신청 변경 1. 변경 기간 : 2025. 3. 14.(금) ~ 3. 18.(화) 오후 4:00까지(이메일 발송 기한엄수) (※ 3.\xa018.(화) 오후 4시까지 수신된 이메일에 한하여 접수하오니 기한 내 이메일 발송) 2. 작성양식 : 이 공지의\xa0첨부 파일(‘폐강과목 대체 수강 신청서’) 작성 3. 제 출 처 : 본인 1전공 소속 단과대학 교학파트(학사종합지원센터) 이메일 제출 단과대학 구분 전화번호 (031-330-내선) 담당자 이메일 사무실 위치 인문대학, 통번역대학, 융합인재대학 내선 4077 haksa4077@hufs.ac.kr 학생회관 109호 국가전략언어대학, 국제지역대학, 자유전공학부 내선 4457 lsh0613@hufs.ac.kr 공과대학, 자연과학대학, 바이오메디컬공학부 내선 4073 yyj1730@hufs.ac.kr 교직, 경상대학, Culture&Technology융합대학, 기후변화융합학부, AI융합대학 내선 4953 minsun@hufs.ac.kr ※ 수강과목 이수구분(전공, 교양 등) 상관 없이 본인 1전공 소속 단과대학 교학 파트 이메일 제출 4. 유의 사항 가. 폐강된 과목수와 동일한 과목수 만큼 수강신청 변경 가능(단, 최대수강신청 학점 초과 불가) 나. 수강신청 변경 시점 기준으로 제한인원을 초과하지 않는 과목으로 변경 가능\xa0수강 가능 강좌 확인 ☞ 강의시간표 조회(클릭) 다', '[공통] 2024-2학기 이중전공 배정 확정 공고\n\n[공통] 2024-2학기 이중전공 배정 확정 공고\n\n2024 학년도 제 2 학기 이중전공 배정 결과를 다음과 같이 공고합니다 .\n\n1. 결과 조회 : 종합정보시스템 → 전공 / 교직관리 → 이수중인 전공\n\n2. 배정 결과에 따른 확인 사항\n\n가 . 이중전공 배정 된 경우 : ( 이중전공 배정에 따라 ) 이수구분 변경이 필요 한 학생은 “ 이수구분 변경 신청서 ” 작성 제출\n\n( ※ 상시 제출 가능 )\n\n▶ ( 서울 ) 이수구분 변경 신청서 바로가기\n\n▶ ( 글로벌 ) 이수구분 변경 신청서 바로가기\n\n나 . 배정내역이 없는 경우 ( 이중전공 미배정 ) : 추후 부전공 또는 이중전공 변경 신청 가능\n\n1) 부전공 신청 : 2025. 1. 22. ( 수 ) 10 시 ~ 2025. 1. 23. ( 목 ) 14 시\n\n( ※ 자세한 내용은 학사공지 “ 부전공 신청 및 이중전공 / 부전공 취소 일정 ” 확인 )\n\n2) 다음 학기 이중전공 변경 신청 : 2025 년 5 월 초 학사공지 예정\n\n2025. 1.\n\n교무처장']","AI융합전공의 외국어 인증 신청서 제출 이메일 주소는 **haksa7@hufs.ac.kr**입니다. 

제출 마감일은 재학 기간 동안 1회, 외국어 인증 신청서를 제출하고자 하는 학기 말까지이며, 졸업예정자는 졸업하고자 하는 최종 학기 말까지 반드시 제출해야 합니다. 

정확한 기준은 학과 담당 교수님께 확인하시기 바랍니다. 혹시 더 도와드릴까요?",2025년 1학기 졸업을 희망하는 AI융합대학(글로벌) 소속 학생의 경우 'minsun@hufs.ac.kr'로 후기 졸업심사일인 7월 30일 전까지 제출하시면 됩니다.,0.6171584141927449,1.0,,0.8559825835013813
자과대는 이수구분변경 신청 어떻게 해?,"[""[서울] 이수구분 변경 신청 방법 안내\n\n[서울] 이수구분 변경 신청 방법 안내\n\n이수구분 변경 신청서\n\n○ 졸업학기 졸업사정일 전까지\n\n○ 교과목 이수영역 변경 신청서는 E-Mail로 제출(직접 방문제출도 가능)시 접수하여 처리하고 있습니다. 교과목 이수영역의 변경이 필요한 경우, 첨부한 '이수구분 변경 신청서'를\xa0작성하여 이수구분 변경이 필요한 전공 소속 단과대학 담당 선생님에게 E-M ail(또는 직접 방문제출) 로 제출 하여 주시기 바랍니다.\n\n* 융합전공의 이수구분 변경이 필요한 경우는 융합전공 담당 선생님에게 E-Mail(또는 직접 방문제출)로 제출하여 주시기 바랍니다.\n\n*** 유의사항"", '[글로벌] 이수구분변경 신청 방법 안내\n\n다. 이수구분 신청 전, 전공교류교과목을 수강편람에서 확인하고 문의 사항이 있을 경우 신청전 미리 상담 (수강편람 확인 클릭)\n\n라. 신청 후 3~4일 (평일 기준) 이후\xa0종합정보시스템에서 변경결과를 반드시 확인하고 변경이 안된 경우, 담당자에게 연락하여 반드시 확인', '[공통] 2025-1학기 이중전공 변경 신청 일정 공고 새글\n\n바 . ( 이중전공 변경에 따라 ) 이수구분 수정이 필요한 경우 학사종합지원센터 홈페이지 서식함의 “ 이수구분 변경 신청서 ” 를 작성하여 제출 바람\n\n※ 상시 제출 가능\n\n▶ ( 서울 ) 이수구분 변경 신청서 바로가기\n\n▶ ( 글로벌 ) 이수구분 변경 신청서 바로가기\n\n2025. 4.\n\n교무처장', '[글로벌] 이수구분변경 신청 방법 안내\n\n[글로벌] 이수구분변경 신청 방법 안내\n\n이수구분변경 신청 방법\n\n1. 시기\n\n가. 졸업학기 졸업사정일 전까지\n\n나. 당해 학기 수강신청건에 대해서는 성적 취득후 신청 권장\n\n2 . 제출처\n\n본인의 1전공 단과대학\n\n이메일 제출\n\n문의 전화\n\n방문 제출\n\n인문대학, 통번역대학, 융합인재대학\n\nhaksa4077@hufs.ac.kr\n\n031-330-4077\n\n학생회관 109호\n\n국가전략언어대학, 국제지역대학, 자유전공학부(글로벌)\n\nlsh0613@hufs.ac.kr\n\n031-330-4457\n\n경상대 학, Culture& Technology융합대학,\n\nAI융합대학(글로벌), 기후변화융합학부,\n\nminsun@hufs.ac.kr\n\n031-330-4953\n\n자연과학대학, 공과대학, 바이오메디컬공학부\n\nyyj1730@hufs.ac.kr\n\n031-330-4073\n\n3.\xa0제출 서류 : 첨부파일(이수구분 변경신청서) 다운로드 후, 작성하여 제출\n\n4.\xa0유의사항\n\n가. 이중(부)전공이 글로벌캠퍼스일 경우, 본인의 1전공 단과대학 담당자에게 제출\n\n나 . 이중(부)전공이 서울캠퍼스일 경우, 본인의 서울캠퍼스\xa0담당자에게 제출 (담당자 확인 클릭)\n\n다. 이수구분 신청 전, 전공교류교과목을 수강편람에서 확인하고 문의 사항이 있을 경우 신청전 미리 상담 (수강편람 확인 클릭)\n\n라. 신청 후 3~4일 (평일 기준) 이후\xa0종합정보시스템에서 변경결과를 반드시 확인하고 변경이 안된 경우, 담당자에게 연락하여 반드시 확인', '[글로벌] 이수구분변경 신청 방법 안내\n\n다. 이수구분 신청 전, 전공교류교과목을 수강편람에서 확인하고 문의 사항이 있을 경우 신청전 미리 상담 (수강편람 확인 클릭)\n\n라. 신청 후 3~4일 (평일 기준) 이후\xa0종합정보시스템에서 변경결과를 반드시 확인하고 변경이 안된 경우, 담당자에게 연락하여 반드시 확인\n\n| 0 | 1 | 2 | 3 |\n|:-----------------------------------------------------------------------------|:---------------------|:-------------|:---------------|\n| 본인의 1전공 단과대학 | 이메일 제출 | 문의 전화 | 방문 제출 |\n| 인문대학, 통번역대학, 융합인재대학 | haksa4077@hufs.ac.kr | 031-330-4077 | 학생회관\xa0109호 |\n| 국가전략언어대학, 국제지역대학, 자유전공학부(글로벌) | lsh0613@hufs.ac.kr | 031-330-4457 | 학생회관\xa0109호 |\n| 경상대학,\xa0Culture& Technology융합대학, AI융합대학(글로벌),\xa0기후변화융합학부, | minsun@hufs.ac.kr | 031-330-4953 | 학생회관\xa0109호 |\n| 자연과학대학,\xa0공과대학, 바이오메디컬공학부 | yyj1730@hufs.ac.kr | 031-330-4073 | 학생회관\xa0109호 |', ""[서울] 이수구분 변경 신청 방법 안내\n\n[서울] 이수구분 변경 신청 방법 안내\n\n이수구분 변경 신청서\n\n○ 졸업학기 졸업사정일 전까지\n\n○ 교과목 이수영역 변경 신청서는 E-Mail로 제출(직접 방문제출도 가능)시 접수하여 처리하고 있습니다. 교과목 이수영역의 변경이 필요한 경우, 첨부한 '이수구분 변경 신청서'를\xa0작성하여 이수구분 변경이 필요한 전공 소속 단과대학 담당 선생님에게 E-M ail(또는 직접 방문제출) 로 제출 하여 주시기 바랍니다.\n\n* 융합전공의 이수구분 변경이 필요한 경우는 융합전공 담당 선생님에게 E-Mail(또는 직접 방문제출)로 제출하여 주시기 바랍니다.\n\n*** 유의사항\n\n단, 중국학대학 , 미 디어커뮤니케이션학부, 국제통상학과 ( 상경대학 ), EU전공, 동북아외교통상전공 , AI융합전공(Language&AI트랙/Business&AI트랙/Software&AI트랙) , Business & AI전공, 융복합소프트웨어전공, LD/LT 등 의 세부전공교류 ( 이수구분 ) 신청의 경우 또는 먼저 학과의 확인이 필요한 경우 , 각 전공 ( 학과 ) 사무실의 확인\xa0등 별도의 절차(양식)를 통해 처리되오니\xa0해당 전공 ( 학부 ) 사무실로 우선 문의 하여 주시기 바랍니다 .\n\n[제출시 참고]\n\n● 1전공으로 이수구분 변경이 필요할 경우 →\xa01전공 단과대학 담당 선생님에게 제출\n\n● 이중전공으로 이수구분 변경이 필요한 경우 → 이중전공 단과대학 담당 선생님에게 제출\n\n● 부 전 공으로 이수구분 변경이 필요한 경우 → 부전공 단과대학 담당 선생님에게 제출\n\n● 자 선 을 교양으로 이수구분 변경이 필요한 경우 → 1전공 단과대학 담당 선생님에게 제출\n\n● 교 양 을 1전공 또는 이중(부)전공으로 이수구분 변경이 필요한 경우\n\n→ 1전공으로 변경시 : 1전공 단과대학 담당 선생님에게 제출\n\n→ 이중(부)전공으로 변경시 : 이중(부)전공 단과대학 담당 선생님에게 제출\n\n● 융합전공의 이수구분 변경이 필요할 경우 → 융합전공 담당 선생님에게 제출"", '[서울] 이수구분 변경 신청 방법 안내\n\n● 교 양 을 1전공 또는 이중(부)전공으로 이수구분 변경이 필요한 경우\n\n→ 1전공으로 변경시 : 1전공 단과대학 담당 선생님에게 제출\n\n→ 이중(부)전공으로 변경시 : 이중(부)전공 단과대학 담당 선생님에게 제출\n\n● 융합전공의 이수구분 변경이 필요할 경우 → 융합전공 담당 선생님에게 제출\n\n○ 신청서가 접수된 이후 통상적으로 3~4일(평일기준)\xa0이내에 처리되며 이후 신 청한 학생은\xa0종합정보 교과목 정보를 조회하여 변경사항을 정확히 확인하시기 바랍니다. 또한, 변경이 되지 않은 경우나 이상이 있는 경우는 즉시 담당 선생님에게 연락하여 확인하시기 바랍니다.\n\n○ 제출하기 전\xa0신청내역 중 이수구분 변경이 규정상 불가능한 교과목이 있는지 확인해 주시기 바랍니다.(수강편람 참조/전공교류(인정)교과목 참조/학과 문의/단과대학 담당 선생님 문의 등을 통해 확인, 변경이 불가능한 경우는 처리 불가 )', '바 . ( 이중전공 변경에 따라 ) 이수구분 수정이 필요한 경우 학사종합지원센터 홈페이지 서식함의 “ 이수구분 변경 신청서 ” 를 작성하여 제출 바람\n\n※ 상시 제출 가능\n\n▶ ( 서울 ) 이수구분 변경 신청서 바로가기\n\n▶ ( 글로벌 ) 이수구분 변경 신청서 바로가기\n\n2025. 4.\n\n교무처장', '[서울] 이수구분 변경 신청 방법 안내\n\n● 교 양 을 1전공 또는 이중(부)전공으로 이수구분 변경이 필요한 경우\n\n→ 1전공으로 변경시 : 1전공 단과대학 담당 선생님에게 제출\n\n→ 이중(부)전공으로 변경시 : 이중(부)전공 단과대학 담당 선생님에게 제출\n\n● 융합전공의 이수구분 변경이 필요할 경우 → 융합전공 담당 선생님에게 제출\n\n○ 신청서가 접수된 이후 통상적으로 3~4일(평일기준)\xa0이내에 처리되며 이후 신 청한 학생은\xa0종합정보 교과목 정보를 조회하여 변경사항을 정확히 확인하시기 바랍니다. 또한, 변경이 되지 않은 경우나 이상이 있는 경우는 즉시 담당 선생님에게 연락하여 확인하시기 바랍니다.', '[글로벌] 이수구분변경 신청 방법 안내\n\n[글로벌] 이수구분변경 신청 방법 안내\n\n이수구분변경 신청 방법\n\n1. 시기\n\n가. 졸업학기 졸업사정일 전까지\n\n나. 당해 학기 수강신청건에 대해서는 성적 취득후 신청 권장\n\n2 . 제출처\n\n본인의 1전공 단과대학\n\n이메일 제출\n\n문의 전화\n\n방문 제출\n\n인문대학, 통번역대학, 융합인재대학\n\nhaksa4077@hufs.ac.kr\n\n031-330-4077\n\n학생회관 109호\n\n국가전략언어대학, 국제지역대학, 자유전공학부(글로벌)\n\nlsh0613@hufs.ac.kr\n\n031-330-4457\n\n경상대 학, Culture& Technology융합대학,\n\nAI융합대학(글로벌), 기후변화융합학부,\n\nminsun@hufs.ac.kr\n\n031-330-4953\n\n자연과학대학, 공과대학, 바이오메디컬공학부\n\nyyj1730@hufs.ac.kr\n\n031-330-4073\n\n3.\xa0제출 서류 : 첨부파일(이수구분 변경신청서) 다운로드 후, 작성하여 제출\n\n4.\xa0유의사항', '- 지원센터 단과대학 교학파트(본인 1전공 소속 기준)에 방문하여 ‘이수구분변경신청서’를\n- 작성하여야 이중전공 학점으로 처리됨', '[글로벌] 이수구분변경 신청 방법 안내\n\n[글로벌] 이수구분변경 신청 방법 안내\n\n이수구분변경 신청 방법\n\n1. 시기\n\n가. 졸업학기 졸업사정일 전까지\n\n나. 당해 학기 수강신청건에 대해서는 성적 취득후 신청 권장\n\n2 . 제출처\n\n본인의 1전공 단과대학\n\n이메일 제출\n\n문의 전화\n\n방문 제출\n\n인문대학, 통번역대학, 융합인재대학\n\nhaksa4077@hufs.ac.kr\n\n031-330-4077\n\n학생회관 109호\n\n국가전략언어대학, 국제지역대학, 자유전공학부(글로벌)\n\nlsh0613@hufs.ac.kr\n\n031-330-4457\n\n경상대 학, Culture& Technology융합대학,\n\nAI융합대학(글로벌), 기후변화융합학부,\n\nminsun@hufs.ac.kr\n\n031-330-4953', '[제출시 참고]\n\n● 1전공으로 이수구분 변경이 필요할 경우 →\xa01전공 단과대학 담당 선생님에게 제출\n\n● 이중전공으로 이수구분 변경이 필요한 경우 → 이중전공 단과대학 담당 선생님에게 제출\n\n● 부 전 공으로 이수구분 변경이 필요한 경우 → 부전공 단과대학 담당 선생님에게 제출\n\n● 자 선 을 교양으로 이수구분 변경이 필요한 경우 → 1전공 단과대학 담당 선생님에게 제출\n\n● 교 양 을 1전공 또는 이중(부)전공으로 이수구분 변경이 필요한 경우\n\n→ 1전공으로 변경시 : 1전공 단과대학 담당 선생님에게 제출\n\n→ 이중(부)전공으로 변경시 : 이중(부)전공 단과대학 담당 선생님에게 제출\n\n● 융합전공의 이수구분 변경이 필요할 경우 → 융합전공 담당 선생님에게 제출', '● 교 양 을 1전공 또는 이중(부)전공으로 이수구분 변경이 필요한 경우\n\n→ 1전공으로 변경시 : 1전공 단과대학 담당 선생님에게 제출\n\n→ 이중(부)전공으로 변경시 : 이중(부)전공 단과대학 담당 선생님에게 제출\n\n● 융합전공의 이수구분 변경이 필요할 경우 → 융합전공 담당 선생님에게 제출', '다. 이수구분 신청 전, 전공교류교과목을 수강편람에서 확인하고 문의 사항이 있을 경우 신청전 미리 상담 (수강편람 확인 클릭)\n\n라. 신청 후 3~4일 (평일 기준) 이후\xa0종합정보시스템에서 변경결과를 반드시 확인하고 변경이 안된 경우, 담당자에게 연락하여 반드시 확인', '○ 제출하기 전\xa0신청내역 중 이수구분 변경이 규정상 불가능한 교과목이 있는지 확인해 주시기 바랍니다.(수강편람 참조/전공교류(인정)교과목 참조/학과 문의/단과대학 담당 선생님 문의 등을 통해 확인, 변경이 불가능한 경우는 처리 불가 )\n\n○ 처리된 이후\xa0이수구분/이수학점/이수영역/졸업요건 등에 이상이 있거나\xa0문제가 없는지를 정확히 확인해 주시기 바랍니다.\n\n○ 상시 제출( 졸업예정자는 졸업학기 졸업사정일 전까지) 이 가능하며 당해 학기 수강신청 건에\xa0대해서는 성적 취득 후 신청을 권장합니다. 단, 당해 학기 수강신청 건과 관련하여\xa0졸업예정자 및 필요한 경우에는\xa0별도 문의해 주시기 바랍니다.', '4.\xa0유의사항\n\n가. 이중(부)전공이 글로벌캠퍼스일 경우, 본인의 1전공 단과대학 담당자에게 제출\n\n나 . 이중(부)전공이 서울캠퍼스일 경우, 본인의 서울캠퍼스\xa0담당자에게 제출 (담당자 확인 클릭)\n\n다. 이수구분 신청 전, 전공교류교과목을 수강편람에서 확인하고 문의 사항이 있을 경우 신청전 미리 상담 (수강편람 확인 클릭)\n\n라. 신청 후 3~4일 (평일 기준) 이후\xa0종합정보시스템에서 변경결과를 반드시 확인하고 변경이 안된 경우, 담당자에게 연락하여 반드시 확인', '4140\n글로벌캠퍼스 GLOBAL CAMPUS\n공과대학\n컴퓨터공학부 41\n정보통신공학과 43\n반도체전자공학부(반도체공학전공) 45\n반도체전자공학부(전자공학전공) 47\n산업경영공학과 48\nCOLLEGE OF\nENGINEERING\nDivision of Computer Engineering\n컴퓨터공학부\n전화번호 031-330-4268\n홈페이지 computer.hufs.ac.kr\n전공소개 \n-  컴퓨터공학은 4차 산업혁명을 이끄는 핵심 전공으로서 스마트폰부\n터 인공지능까지, 컴퓨터공학이 어떻게 세상을 변화시키고 있는지 누\n구보다 빨리 이해하고 그 변화를 이끄는 인재를 양성합니다. 인공지\n능(AI), 웹(Web), 앱(App), 빅데이터, 클라우드 컴퓨팅, 사물인터넷\n(IoT), 게임 개발처럼 여러분이 매일 같이 사용하는 것이 어떻게 작동\n하는지 또 어떻게 만드는지 배웁니다.\n-  한국외대 컴퓨터공학부는 과학기술정보통신부에서 선정한 소프트웨\n어(SW) 중심대학으로, 정부의 전폭적인 지원에 힘입어 4차 산업혁명\n시대를 견인할 창의적 SW융합인재 양성을 위한 최신 커리큘럼을 제\n공합니다. 2021년부터는 컴퓨터공학부로 새롭게 명명되었으며, 소프\n트웨어와 AI 교육이 강화되었습니다. \n-  SW중심대학 주체 학과로서 우리 학생들에게는 다음과 같은 특별한 \n기회가 주어집니다: 단기/장기 국내외 인턴십 및 견학 프로그램, 해외 \n70여개 우수 대학 (미국, 영국, 아일랜드, 호주 등)에 7+1 파견 유학, \n산학연계 캡스톤 프로젝트, 학과 내 다양한 학회와 동아리 활동, 학생\n별 지도교수 매칭, 프로그래밍 경진대회, 코딩 테스트 준비 캠프, 자체 \n해커톤, 기업 실무자 초청 특강 등. \n-  이곳에서 배우게 될 최첨단 기술과 지식은 여러분이 세계 곳곳에서 혁\n신적인 프로젝트와 연구에 참여할 수 있는 기반을 마련해 줄 것입니\n다. 컴퓨터공학부 학생이 되어 여러분의 꿈을 현실로 만들어 보세요!\n필요역량 및 소양 \n-  고등학교까지의 수학, 과학 등의 기본 과목들과 컴퓨터 프로그래밍에 \n도움이 되는 논리적인 사고력이 가장 기본입니다. 실제 프로그램 개발 \n경험이 있는 경우가 아니더라도 논리적인 사고 능력과 수학과 과학 과\n목으로 대표되는 고등학교 과목의 내용을 나름의 원리로 스스로 체계\n화하는 연습을 한 번 더 한다면, 전공 공부에 큰 도움이 될 것입니다.\n-  진학 직전 방학 기간에는 파이썬과 같은 프로그래밍 언어를 미리 학', '[공통] 2025-1학기 이중전공 변경 신청 일정 공고 새글\n\n[공통] 2025-1학기 이중전공 변경 신청 일정 공고 새글\n\n2025 학년도 제 1 학기 이중전공 변경 신청 일정을 다음과 같이 공고합니다 .\n\n1. 신청 대상 : 2~4 학년 재학생 및 휴학생\n\n※ 확인사항\n\n가 . 현재 2~4 학년으로\n\n1) 기존에 이중전공을 신청한 적이 있는 경우도 , 변경 신청 가능 ( 변경횟수제한 해제 )\n\n2) 이중전공을 신청하여 배정되지 않은 경우 ( 혹은 한번도 신청한 적이 없는 경우 ) 도 , 이번 변경 신청 신청해야하며 , 최초 신청 (5 월 26 일 ( 월 ) ~ 5 월 30 일 ( 금 ) 예정 ) 으로 신청 불가능\n\n나 . 2025 학년도 전기 편입생 ( 순수외국인전형 편입생 포함 ) 은\n\n1) 이번 변경 신청 불가\n\n2) 이중전공 신청으로만 신청 가능\n\n※ 5 월 26 일 ( 월 ) ~ 5 월 30 일 ( 금 ) 예정\n\n단 , 해당 기간에 신청하지 않으면 다음 학기부터 이중전공 변경 신청으로만 가능함\n\n2. 신청 기간 : 2025 년 5 월 12 일 ( 월 ) 10 시 ~ 5 월 16 일 ( 금 ) 16 시\n\n※ 안내된 기간에만 신청 / 변경 / 삭제 가능하므로 일정 준수할 것 ( 이후 별도 운영 계획 없음 )\n\n3. 신청 방법 : 종합정보시스템 → 전공 / 교직관리 → 이중전공 변경신청\n\n※ 1 지망만 신청 가능 , 신청 완료후 다시 조회하여 신청 결과를 반드시 확인할 것\n\n※ 제한사항\n\n가 . 신청할 학과 ( 부 )/ 전공의 본인 학번대에 여석이 없는 경우 신청 불가\n\n나 . 캠퍼스 간 이중전공을 희망하는 경우 아래의 제한학과로는 신청 불가\n\n서울캠퍼스\n\n( 글로벌캠퍼스 학생 신청 불가 학과 )\n\n글로벌캠퍼스\n\n( 서울캠퍼스 학생 신청 불가 학과 )\n\n영어대학 각 학과 ( 전공 )\n\n※ 글로벌캠퍼스 2023 학번부터 가능\n\n영어통번역학부\n\n프랑스어학부 ( 기존 프랑스어과 포함 )\n\n※ 글로벌캠퍼스 2023 학번부터 가능\n\n프랑스학과\n\n독일어과\n\n※ 글로벌캠퍼스 2024 학번부터 가능\n\n독일어통번역학과\n\n노어과', '4948\nDept. of Industrial and Management Engineering\n산업경영공학과\n전화번호 031-330-4093\n홈페이지 ime.hufs.ac.kr\n전공소개 \n산업경영공학은 산업공학과 경영학을 접목한 학문입니다. 공학적인 지\n식을 토대로 합리적이고 과학적으로 조직과 시스템을 관리·경영하는 방\n법을 다룹니다. 생산공정, 공급망을 비롯하여 경영전략, 회계, 인사 등 \n경영 전반에 걸친 문제를 분석하고 공학적인 해법을 제시합니다. 문제 \n상황을 분석해 의사결정을 최적화하는 일도 산업경영공학의 중요한 목\n표 중의 하나입니다. 산업경영공학에서는 빅데이터/인공지능으로 대표\n되는 공학적 지식과 경영학으로 대표되는 인문·사회학적 지식을 모두 \n요구하므로 통시적이고 전체적인 통찰력을 배양합니다. 한국외국어대\n학교 산업경영공학과에서는 특히 현실 문제에 전공지식을 응용함으로\n써 실무 능력을 키우고자 노력하고 있습니다. 아울러 전 세계 각국의 다\n양한 언어를 교육하고 있는 본교만의 장점을 살려, 전공에 대한 심층적 \n지식과 함께 외국어 능력 및 각국의 문화에 대한 이해를 겸비한 인재 양\n성을 지향합니다.\n필요역량 및 소양 \n-  산업경영공학은 종합적인 학문입니다. 공학적인 소양과 인문학적 소\n양 모두 필요합니다. \n-  공학적인 소양은 문제를 공학적인 관점에서 분석하고 최선의 해결책\n을 찾아내는 문제해결 능력을 키우기 위해 필요합니다. 평소에 일상적\n인 활동에서 불편하고 비효율적인 면을 찾고 어떻게 개선할 수 있을지 \n고민하는 습관이 큰 도움이 됩니다.\n-  또한 모든 일은 “인간”이 수행하기 때문에 사람들 간의 관계를 어떻게 \n관리하고 이해할지가 중요합니다. 논리적으로 말하는 능력과 듣는 사\n람이 이해하기 쉽게 설명하는 연습을 해보세요. \n우리 학과(부)·전공 매력 \n-  인공지능, 4차 산업혁명을 위한 인재 양성\n-  최고 수준은 교수진이 제공하는 최고의 교육\n-  실용적/문제 해결 능력 중심 교육을 통한 졸업 후 취업의 질과 양에\n서 최고라 자부\n-  재학생들 관련 경진 대회 수상 다수(교수진의 전폭적인 지원을 통해 \n졸업 후 취업 가능성 최대화)\n주요 실적 \n-  대학생 산업공학프로젝트 경진대회 최근 5년간 대상 2회 등 다수 수상\n-  산업공학회 석사논문경진대회 최근 5년간 대상, 최우수상 포함 다\n수 수상', '## [heading1] ##\n# 다. Business & AI 트랙\n\n## [paragraph] ##\nBusiness & AI 트랙은 4차 산업혁명을 대표하는 인공지능(AI)기술의 활용이 다양한 비즈니스\n영역에서 어떻게 기업과 소비자를 변화시키고 있는지 이해하는 것을 목표로 한다. 이를 위해\n경영학 관련 과목과 AI 관련 과목의 단순한 동시 학습이 아닌, 한 개의 과목 안에서 AI\n기술에 대한 이해와 이에 대한 경영학적 접근이 같은 흐름으로 완성될 수 있도록 교과목을\n운영한다. 또한 인턴십, 산학협력 프로젝트 등 다양한 비교과활동을 통해 산업 현장에서\n실제 필요로 하는 지식/기술 기반 교육을 실천한다.\n\n## [paragraph] ##\n(2) 이수자격\n\n## [paragraph] ##\nAI융합전공 진입 시에는 자격 제한이 없음.\n단, 컴퓨터공학부, 정보통신공학과, 산업경영공학과 학생은 Software & AI 트랙을 선택할\n수 없음\n\n## [footer] ##\n- 57 -', '(공통)2025-1학기 부전공 신청 및 이중/부전공 취소 일정 공고\n\n(공통)2025-1학기 부전공 신청 및 이중/부전공 취소 일정 공고\n\n2025 학년도 제 1 학기 부전공 신청 및 이중 / 부전공 취소 일정을 아래와 같이 공고합니다 .\n\n- 아 래 -\n\n1. 신청 대상 : (2025-1 학기 기준 ) 2 학기 ~ 7 학기 재학생 및 휴학생 중\n\n가 . 부전공 희망자 : 일반 부전공 또는 전공심화 + 부전공 신청\n\n( 전공심화 + 부전공 신청자는 1 전공의 졸업이수학점 늘어남 . 반드시 확인할 것 )\n\n나 . 이중 / 부전공 취소 희망자 ( 단일전공 희망자 ) : 이중 / 부전공을 취소하고 전공심화 이수\n\n※ 단 , 8 학기 이상인 학생 은 이중 ( 부 ) 전공 변경 신청서 ( 첨부파일 ) 를 작성하여\n\n학사종합지원센터 단과대학 교학과 이메일 또는 방문 신청\n\n▶ ( 서울 ) 제출처 안내 바로가기\n\n▶ ( 글로벌 ) hufsdbl@hufs.ac.kr 로 이메일 제출\n\n2. 일 정\n\n가 . 신청 기간 : 2025 년 1 월 22 일 ( 수 ) 10 시 ~ 1 월 23 일 ( 목 ) 14 시\n\n※ 안내된 기간에만 운영하므로 일정 준수할 것 ( 이후 별도 운영 계획 없음 )\n\n나 . 결과 확인 : 2025 년 1 월 24 일 ( 금 ) 14 시 , 종합정보시스템\n\n3. 신청 방법 : 종합정보시스템 → 전공 / 교직관리 ( ※ 가 . / 나 . 중 하나의 방법으로 신청 )\n\n가 . 부전공 신청 : 전공심화 + 부전공 또는 부전공 신청\n\n1) 신청 시 기존에 이수 중인 이중 / 부전공 은 자동 취소 됨 ( ※ 별도 취소 절차 없음 )\n\n2) “4. 유의 사항 ” 의 다 . 참고 하여 부전공 신청으로 인한 이수구분 변경 신청\n\n※ 이번 학기 졸업예정자 (4 학년 수료 , 졸업대기 포함 ) 는 1 월 초 까지\n\n이수구분 변경을 신청하여 졸업 학점이 누락되는 일이 없도록 해야 함\n\n나 . 이중 / 부전공 취소 ( 단일전공 희망자 ) : 이중전공 / 부전공 취소 신청\n\n1) 이중 / 부전공을 취소하는 경우 1 전공을 심화로 필수 이수 해야 함', '[공통] 후기이중전공 신청 공고\n\n[공통] 후기이중전공 신청 공고\n\n(공통) 후기이중전공 신청 공고\n\n2025학년도 후기이중전공 신청 일정 및 방법 등을 공고합니다.\n\n1. 신청기간: 2025 4. 14.(월) 10:00 ~ 4. 18.(금) 16:00까지\n\n2. 신청대상: 현재 7~8학기 이수중인 자로, 후기이중전공을 희망하는 전공을 부전공으로 이수중인 자\n\n(7학기를 마치고 휴학한 학생도 이번 신청기간에 신청할 것)\n\n3. 신청방법: 인터넷 종합정보시스템에서 신청 (로그인 > 전공/교직관리 > 후기이중전공신청)\n\n4. 허가자 발표: 7월초 홈페이지 공고(예정)\n\n5. 기타사항\n\n가. 1년에 1회, 4월에만 신청하므로 반드시 희망자는 이번 신청 일정을 따를 것\n\n나. 지원학과 입학정원의 50 ~ 150% 이내에서 학과 자율 선발하되, 학과에서 요구하는 기본 자격요건 미충족 시 탈락될 수 있음\n\n(세부 배정기준은 지원학과 학과장실 문의 또는 학과 홈페이지 참조)\n\n다. 이수자 선발 이후 8학기까지 전공심화(+부전공) 또는 일반 부전공에 맞는 졸업에 필요한 졸업학점 요건을 모두 완료하여야 최종적으로 허가\n\n라. 조기졸업대상자, 학석사연계과정/석사예약제 이수자는 신청 불가(신청 희망 시 내방하여 해당 자격 취소처리 후 신청)\n\n마. 후기이중전공으로 선발되면 추가학기를 1학기 이상 무조건 등록, 수강해야 하며 등록금은 후기이중전공 학과의 등록금으로 납부해야 함\n\n바. 기타 자세한 사항은 전자규정집 ""이중전공시행규정"" 참조\n\n2025. 4.\n\n교무처장\n\n| 0 |\n|:------------------------------|\n| (공통) 후기이중전공 신청 공고 |', '-  자연언어데이터: 현대의 빅데이터에서 중요한 역할을 하는 언어 데이\n터에 대한 이해와 이를 처리하기 위한 연구방법론을 공부하는 것을 목\n표로 한다. 기존 언어학/국어학 문법서에서 정의하는 문장의 개념, 단\n어 ~~의 개념, 수사 명사구, 고유명사, 외래어, 복합명사 등에 대한 언\n어학적 정의와 실제 온라인 언어데이터에서 나타나는 현실적 언어 단\n위들 사이의 차이점을 비교 공부한다.\n-  한국어 문법: 언어학적 관점에서 한국어의 형태론적 특성과 통사론적 \n특성을 밝히고, 이 특성을 기술하는 데에 있는 문제점들과 이에 대한 \n해결 방안을 함께 살펴본다.\n-  통사론: 낱말이나 구와 같은 문법 단위가 형태적/기능적으로 어떤 속\n성을 가지고 있는지, 이들이 어떻게 결합되어 보다 큰 단위인 구나 문\n장을 만드는가에 대해 알아본다. 나아가 통사론에서 기본적으로 다루\n어야 할 언어 현상을 배우고, 이를 설명하기 위해 필요한 개념을 함\n께 학습한다.', '2025학년도 1학기 BRICs 융합전공 증원 신청 공지\n\n2025학년도 1학기 BRICs 융합전공 증원 신청 공지\n\n2025학년도 1학기 BRICs 융합전공 증원 신청 공지\n\n2025 학년도 1 학기 BRICs 융합전공 증원 신청을 아래와 같이 공고합니다 .\n\n- 내 용 -\n\nBRICs 융합전공 홈페이지를 개설하였습니다 .\n\n앞으로 BRICs 융합전공의\xa0공지사항은 BRICs 융합전공 홈페이지 공지사항 게시판을 통해 공지합니다 .\n\n아래 링크에 2025 학년도 1 학기 BRICs 융합전공 증원 신청 공지를 게시하였으니 확인 바랍니다 .\n\nBRICs전공 홈페이지 : https://url.kr/w5jpym\n\n문의 : brics@hufs.ac.kr\n\nBRICs 융합전공', '[공통] 2025-1학기 마이크로전공 신청 안내\n\n[공통] 2025-1학기 마이크로전공 신청 안내\n\n2025-1학기 마이크로전공 신청 안내\n\n마이크로전공의 2025-1학기 신청자를 모집하오니 아래 내용을 참고하여 관심있는 학생은 신청 바랍니다.\n\n- 아 래 -\n\n1. 마이크로전공이란 ?\n\n학위과정과는 별도로 학과 ( 부 )/ 전공 ( 이하 학과 ), 미네르바 교양대학 , 부서 또는 학제간 지정된 최소 학점을 이수하는 모듈형 교육과정을 말함\n\n2. 신청 자격 : 1 개 학기 이상 유효한 성적이 있는 재학생\n\n※ 아래의 경우 신청 불가 함\n\n- 1 개 학과 ( 교양 제외 ) 가 운영하는 마이크로전공 : 해당 학과를 1 전공 혹은 이중 ( 부 ) 전공으로 이수하는 학생\n\n- 참여학과가 2 개인 마이크로전공 : 학생의 1 전공과 이중 ( 부 ) 전공이 모두 참여학과인 학생\n\n- 마이크로전공 신청 후 전과 / 이중 ( 부 ) 전공 변경 등으로 위 신청 불가 사유에 추후 해당될 경우 신청했던 마이크로전공은\xa0취소됨\n\n○ 2025-1학기 운영 마이크로전공\n\n번호\n\n마이크로전공명\n\n운영 캠퍼스\n\n1\n\nK 문화콘텐츠통번역\n\n서울\n\n2\n\n러시아외교통상\n\n3\n\nMENA ‧ 이슬람비즈니스\n\n4\n\n태국학\n\n5\n\n인도아세안지역학\n\n6\n\n국제기구와글로벌거버넌스\n\n7\n\n디지털브랜딩\n\n8\n\n영어권영상문화\n\n9\n\n페르시아문화학\n\n10\n\n독일어자연어처리\n\n11\n\n중동외교안보학\n\n12\n\n공공빅데이터분석\n\n13\n\n상담심리전문가\n\n14\n\nUX 심리학\n\n15\n\n불가리아와중동부유럽지역학\n\n글로벌\n\n16\n\n비즈니스 AI 컴퓨팅\n\n17\n\n금융기관및무역경영\n\n18\n\n응용및계산수학\n\n19\n\n환경독성학\n\n20\n\n서양고전학\n\n21\n\n통계데이터사이언스\n\n22\n\n자연어이해와언어데이터\n\n23\n\n자연어처리인공지능\n\n24\n\n비지니스영어\n\n25\n\n사회과학영어\n\n26\n\n공학영어\n\n27\n\n자연과학영어\n\n28\n\n스페인어커뮤니케이션전문가과정 ( 초급 )\n\n29\n\n중국어커뮤니케이션전문가과정 ( 초급 )\n\n30\n\n일본어커뮤니케이션전문가과정 ( 초급 )\n\n31\n\n국제무역경영\n\n32', '[공통] 2024-2학기 이중전공 변경 배정 확정 공고\n\n1) 부전공 희망자 : 일반 부전공 또는 전공심화 + 부전공 신청\n\n2) 단일전공 희망자 : 기존 이중 / 부전공 취소\n\n※ 자세한 일정은 2025 년 1 월 중순 학사공지 예정인 “ 부전공 신청 및 이중전공 / 부전공 취소 일정 ” 확인\n\n※ 단 , 8 학기 이상인 학생 은 학사종합지원센터 단과대학 교학과 이메일 또는\n\n방문 신청\n\n▶ ( 서울 ) 이중전공 / 부전공 / 단일전공 변경 신청서 (8 학기 이상 ) 바로가기\n\n▶ ( 글로벌 ) 이중전공 , 부전공 및 전공심화 변경 신청서 (8 학기 이상 ) 바로가기\n\n나 . 다음 학기 이중전공 변경 신청 기간은 5 월 예정\n\n2025. 1.\n\n교무처장\n\n| 0 |\n|:-----------------------------------------------------------------------------------------------------------------------------------------------------------------------------------------------------------------------------|\n| ※ 단, 8학기 이상인 학생은 학사종합지원센터 단과대학 교학과 이메일 또는 방문 신청 ▶ (서울) 이중전공/부전공/단일전공 변경 신청서(8학기 이상) 바로가기 ▶ (글로벌) 이중전공, 부전공 및 전공심화 변경 신청서(8학기 이상) 바로가기 |', '2025학년도 1학기 휴학 · 복학 신청 공고\n\n2025학년도 1학기 휴학 · 복학 신청 공고\n\n2025학년도\xa01 학기 휴학 · 복학 신청 공고\n\n2025 학년도 제1 학기 휴학 · 복학 신청 일정 및 방법 등을 공고합니다 .\n\n1. 일정 : 2025.\xa02.\xa03.( 월 ) ~\xa02.\xa07. (금 )\n\n2. 방법 : 학교 홈페이지 로그인 → [MyPage] → [ 종합정보시스템 ] → [ 휴 / 복학 신청 ]\n\n3. 유의사항\n\n가 . 일반 휴학\n\n1) 휴학은 1 년 단위로 신청 ( 단 , 1 개 학기만 사용하고 복학 가능 )\n\n2) 일반 휴학 신청 시 등록금 납부 ·미납부 는 선택 사항임\n\n가 ) 등록 휴학 : 신청기간에 휴학 신청 후,\xa0등록기간(2월 20일 경)에 등록금 납부 시 등록 휴학\xa0처리됨\n\n3) 휴학기간 만료 후 다시 휴학 연장\xa0신청 가능하며, 재학 중 3 년(6개 학기)을 초과할 수 없음\n\n( 단 , 2012 년 2 학기 이후 3 학년으로 편입학한 학생은 2 년(4개 학기)을 초과할 수 없음 )\n\n※ 휴학기간 만료 후 복학하지 않을 경우 “ 휴학기간초과제적 ” 됨\n\n4) 신 · 편입생 , 재입학생의 첫 학기는 휴학 불가\n\n( 단 , 질병으로 인해 4 주 이상 치료를 요하는 경우에 한해서 일반휴학을 허가할 수 있음 . 별도문의. )\n\n5) 수업일수 1/4 선 이후 아래의 경우에 한해서만 휴학을 허가하고 등록금 차액은 환불함 [ 학사캘린더 ( 클 릭 시 이 동 ) ]\n\n가 ) 질병 또는 입원으로 인하여 4 주 이상의 치료를 요하는 경우 : 3/4 선까지 만 허용\n\n( 병원에서 발급받은 4 주 이상 입원진단서 또는 4 주 이상 수업참여가 어렵다는 의사소견진단서 제출. 별도 문의. )\n\n나 ) 학업을 계속할 수 없는 명백한 사유가 있는 경우 :\xa0학사캘린더 에 의한 중간시험일 이전 까지만 허용\n\n( 공식적인 서류로 사유를 증명할 수 있어야 함 . 증빙서류 미비 또는 요건 미충족 시 허가하지 않음 .)\n\n6) 일반 휴학 중 입대할 경우, 군입대 휴학으로 재신청하여야 함 ( 입 영 관련 증빙 서류 업로드 )', '[공통] 2025-1학기 마이크로전공 신청 안내\n\n서양고전학\n\n21\n\n통계데이터사이언스\n\n22\n\n자연어이해와언어데이터\n\n23\n\n자연어처리인공지능\n\n24\n\n비지니스영어\n\n25\n\n사회과학영어\n\n26\n\n공학영어\n\n27\n\n자연과학영어\n\n28\n\n스페인어커뮤니케이션전문가과정 ( 초급 )\n\n29\n\n중국어커뮤니케이션전문가과정 ( 초급 )\n\n30\n\n일본어커뮤니케이션전문가과정 ( 초급 )\n\n31\n\n국제무역경영\n\n32\n\n유럽고전미술사\n\n양캠퍼스\n\n33\n\n유라시아 ( 중앙아시아 ‧ 러시아 ‧ CIS) 통합지역학\n\n3. 신청 기간 : 2025.\xa01. 20.( 월 ), 10시 ~\xa01.\xa022.(수 ), 14 시까지\n\n※ 안내된 기간에만 운영하므로 신청 기간을 준수할 것\n\n4. 신청 방법 : 종합정보시스템 → 전공/교직관리 → 마이크로전공신청\n\n- 최대 3개까지 신청 가능\n\n- 신청기간 완료 후 담당자 확인 및 승인예정 (※ 승인결과는 마이크로전공 신청화면에서 확인 가능)\n\n5. 기타\n\n- 마이크로전공은 이중 / 부전공과는 별도로 운영되는 비 학위과정이며 졸업요건과 무관 함\n\n( 단 , 졸업이수학점 충족 전까지 마이크로전공을 이수 완료해야 하며 , 이수 완료하지 못하면 신청했던 마이크로전공은 자동 취소됨 )\n\n- 최대 3 개까지 신청 및 이수할 수 있으며 , 각 마이크로전공에서 제시하는 교과목 이수 조건만 완료하면\xa0이수 완료 가능 ( 이수 완료 확인은 추후 안내 예정임 )\n\n- 각 마이크로전공의 해당 교과목을 이전에 이수한 경우에도 인정 하며 , 이번에 마이크로전공을 신청하지 않더라도 해당 교과목을 먼저 수강하고 추후에 신청 할 수 있음\n\n- 각 마이크로전공의 해당 교과목은 교과목의 폐지 / 변경 등에 따라 수정될 수 있음 ( 별 도 안내 예정 )\n\n- 그 외 내용은 관련 규정 참고 바람\n\n6. 문의\n\n캠퍼스\n\n이메일\n\n전화번호\n\n서울캠퍼스\n\nhaksahelp@hufs.ac.kr\n\n02-2173-2111\n\n글로벌캠퍼스\n\nandy@hufs.ac.kr\n\n031-330-4028\n\n2025.\xa01.\n\n교무처장', ""(공통) 2025학년도 1학기 조기졸업 신청 공고\n\n(공통) 2025학년도 1학기 조기졸업 신청 공고\n\n2025학년도 1학기 조기졸업 신청 공고\n\n2025 학년도 1 학기 조기졸업 신청 일정 및 방법을 공고합니다 .\n\n1. 신청기간\n\n- 종합정보시스템 신청 기간 : 2025. 2. 26( 수 ) ~ 3. 7( 금 ) 오후 3 시까지\n\n- 신청서 제출 기간 : 2025. 2. 26( 수 ) ~ 3. 7( 금 ) 오후 4 시까지\n\n※ 종합정보시스템에서만 신청하고 신청서 미제출 시 선발되지 않음\n\n2. 신청자격\n\n- 3 학년 1 학기 진급예정자\n\n- 2 학년 2 학기까지 “ 매 학기 ” 소정의 학점을 취득한 자 ( 수강편람 참조 )\n\n서울캠퍼스 : 2025 학년도 1 학기 수강편람 81 페이지\n\n글로벌캠퍼스 : 2025 학년도 1 학기 수강편람 76 페이지\n\n- 총 성적 평점평균이 4.00 이상인 자\n\n※ 위 세가지 요건을 모두 만족하여야 함\n\n3. 신청방법 : 종합정보시스템 로그인 -> 학적변동신청 -> 조기졸업신청\n\n- 종합정보시스템 신청 및 신청서 출력 -> 학과 ( 부 ) 장님께 의견 작성 요청 ( 학과 ( 부 ) 장 서명 또는 도장 날인 필수 ) -> 본인 소속 캠퍼스 학사종합지원센터 방문 또는 이메일 제출\n\n( 서울캠퍼스 : 본관 1 층 118 호 , haksamil@hufs.ac.kr / 글로벌캠퍼스 : 학생회관 1 층 109 호 , hufsmil@hufs.ac.kr)\n\n4. 기타\n\n- 조기졸업제도는 졸업학기를 1 개학기 단축하여 졸업하는 제도임 (7 학기 졸업 )\n\n- 수강신청 변경기간에 3 학점 추가 신청 가능 ( 서류제출 시점부터 가능 )\n\n- 조기졸업 대상자 선정 후 취소 또는 자격을 상실할 경우 수강학점 이월 미적용\n\n- 조기졸업이 취소된 학생의 경우 7 학기까지 학점이수가 완료되어도 8 학기 수강 신청 및 등록이 필수 사항임\n\n- 수강편람 조기졸업 안내 및 홈페이지 전자규정집 ' 조기졸업제운영규정 ' 참고\n\n2025. 2.\n\n서울 . 글로벌캠퍼스 교무처장"", '(공통)2025-1학기 부전공 신청 및 이중/부전공 취소 일정 공고\n\n※ 이번 학기 졸업예정자 (4 학년 수료 , 졸업대기 포함 ) 는 1 월 초 까지\n\n이수구분 변경을 신청하여 졸업 학점이 누락되는 일이 없도록 해야 함\n\n나 . 이중 / 부전공 취소 ( 단일전공 희망자 ) : 이중전공 / 부전공 취소 신청\n\n1) 이중 / 부전공을 취소하는 경우 1 전공을 심화로 필수 이수 해야 함\n\n( 단 , 편입생 및 15 학번 이후 순수외국인전형 입학생 ( 사범대생 제외 ) 은 의무 없음 )\n\n2) 전공심화 시 1 전공 이수학점 은 학번대별 / 단과대학별 다를 수 있으므로 소속캠퍼스의\n\n수 강편람을 반드시 확인 할 것\n\n※ 신청 예시 : ( 전공이수제도 변경 관련 ) 첨부파일 참조\n\n전공심화를 하면서 부전공을 이수할 경우\n\n① “ 전공심화 + 부전공 ” 선택\n\n② 이수할 부전공 선택 후 [ 신청하기 ] 클릭\n\n전공심화를 하지 않고 부전공만 이수할 경우\n\n① “ 부전공 ” 선택\n\n② 이수할 부전공 선택 후 [ 신청하기 ] 클릭\n\n이중전공을 부전공으로 변경할 경우\n\n부전공을 다른 부전공으로 변경할 경우\n\n이중 / 부전공을 취소하고 전공심화를 이수할 경우\n\n“ 부전공 / 이중전공 취소 신청 ( 단일전공 희망자 ) ” 화면에서 [ 취소 신청하기 ] 클릭\n\n※ 제한사항\n\n가 . 캠퍼스 간 부전공을 희망하는 경우 아래의 학과로는 신청 불가\n\n서울캠퍼스\n\n( 글로벌캠퍼스 학생 신청 불가 학과 )\n\n글로벌캠퍼스\n\n( 서울캠퍼스 학생 신청 불가 학과 )\n\n영어대학 각 학과 ( 전공 )\n\n※ 글로벌캠퍼스 2023 학번부터 가능\n\n영어통번역학부\n\n프랑스어학부 ( 기존 프랑스어과 포함 )\n\n※ 글로벌캠퍼스 2023 학번부터 가능\n\n프랑스학과\n\n독일어과\n\n※ 글로벌캠퍼스 2024 학번부터 가능\n\n독일어통번역학과\n\n노어과\n\n※ 글로벌캠퍼스 2023 학번부터 가능\n\n러시아학과\n\n스페인어과\n\n※ 글로벌캠퍼스 2024 학번부터 가능\n\n스페인어통번역학과\n\n이탈리아어과\n\n※ 글로벌캠퍼스 2024 학번부터 가능\n\n이탈리아어통번역학과\n\n포르투갈어과', '[공통] 2025-1학기 이중전공 변경 신청 일정 공고 새글\n\n라 . 부전공 희망자 및 전공심화 ( 단일전공 ) 희망자 의 경우 추후 종합정보시스템으로 별도 신청 예정\n\n1) 부전공 희망자 : 일반 부전공 또는 전공심화 ＋ 부전공 신청\n\n2) 단일전공 희망자 : 기존 이중 / 부전공 취소\n\n※ 자세한 일정은 2025 년 7 월 중순 학사공지 예정인 “ 부전공 신청 및 이중전공 / 부전공 취소 일정 ” 확인\n\n마 . 편입생도 희망 시 이중전공 , 부전공 , 전공심화 ( 부전공 ) 로 이수할 수 있음\n\n※ 이수 시 졸업이수학점 및 외국어인증기준이 변경될 수 있음\n\n바 . ( 이중전공 변경에 따라 ) 이수구분 수정이 필요한 경우 학사종합지원센터 홈페이지 서식함의 “ 이수구분 변경 신청서 ” 를 작성하여 제출 바람\n\n※ 상시 제출 가능\n\n▶ ( 서울 ) 이수구분 변경 신청서 바로가기\n\n▶ ( 글로벌 ) 이수구분 변경 신청서 바로가기\n\n2025. 4.\n\n교무처장', '(공통)2025-1학기 부전공 신청 및 이중/부전공 취소 일정 공고\n\n다 . ( 부전공 신청 및 이중 / 부전공 취소에 따라 ) 이수구분 수정이 필요한 경우\n\n“ 이수구분 변경 신청서 ”( 첨부파일 ) 작성 제출 ( ※ 상시 제출 가능 )\n\n▶ ( 서울 ) 이수구분 변경 신청서 제출처 안내 바로가기 ▶ ( 글로벌 ) 이수구분 변경 신청서 제출처 안내 바로가기\n\n2025. 1.\n\n교무처장\n\n| 0 |\n|:----------------------------------------------------------------------------------------------------------------------------------------------------------------------------------------------------------|\n| ※ 단, 8학기 이상인 학생은 이중(부)전공 변경 신청서(첨부파일)를 작성하여 학사종합지원센터 단과대학 교학과 이메일 또는 방문 신청 ▶ (서울) 제출처 안내 바로가기 ▶ (글로벌) hufsdbl@hufs.ac.kr 로 이메일 제출 |', '[공통] 2024-2학기 이중전공 배정 확정 공고\n\n[공통] 2024-2학기 이중전공 배정 확정 공고\n\n2024 학년도 제 2 학기 이중전공 배정 결과를 다음과 같이 공고합니다 .\n\n1. 결과 조회 : 종합정보시스템 → 전공 / 교직관리 → 이수중인 전공\n\n2. 배정 결과에 따른 확인 사항\n\n가 . 이중전공 배정 된 경우 : ( 이중전공 배정에 따라 ) 이수구분 변경이 필요 한 학생은 “ 이수구분 변경 신청서 ” 작성 제출\n\n( ※ 상시 제출 가능 )\n\n▶ ( 서울 ) 이수구분 변경 신청서 바로가기\n\n▶ ( 글로벌 ) 이수구분 변경 신청서 바로가기\n\n나 . 배정내역이 없는 경우 ( 이중전공 미배정 ) : 추후 부전공 또는 이중전공 변경 신청 가능\n\n1) 부전공 신청 : 2025. 1. 22. ( 수 ) 10 시 ~ 2025. 1. 23. ( 목 ) 14 시\n\n( ※ 자세한 내용은 학사공지 “ 부전공 신청 및 이중전공 / 부전공 취소 일정 ” 확인 )\n\n2) 다음 학기 이중전공 변경 신청 : 2025 년 5 월 초 학사공지 예정\n\n2025. 1.\n\n교무처장', '[공통] 2025학년도 신/편입생 군휴학 신청 안내\n\n[공통] 2025학년도 신/편입생 군휴학 신청 안내\n\n2025학년도 신/편입생 군휴학 신청 안내\n\n2025 학년도 신 / 편입생 군휴학 신청 일정을 공고합니다.\n\n1. 대상 : 2025 학년도 신입생 / 편입생 중 현재 군복무자 및 2025. 5. 23. 이전 입대자\n\n2. 일정 : 현재 군복무자 - 2025. 3. 4.( 화 ) ~ 3. 11.( 화 )\n\n입영 예정자 (5. 23. 이전 ) - 2025. 3. 4.( 화 ) ~ 입대 3 일 전\n\n3. 방법 : [ 종합정보시스템 ] 로그인 → 좌측 메뉴 중 [ 휴 / 복학 신청 ] → 군휴학 선택 및 파일 업로드\n\n* 종합정보시스템의 아이디는 학번이며 , 비밀번호는 주민번호 앞 6 자리 ( 로그인 이후 본인이 비밀번호 변경 )\n\n* 파일 업로드 유의사항\n\n- 입대를 증빙할 수 있는 서류 ( 입영통지서 사본 , 병적증명서 , 복무확인서 등 ) 중 1 개의 파일 업로드\n\n- JPG 파일만 업로드 가능 ( 최대 10MB)\n\n4. 유의사항 : 3/4 선 후 입대자 (5.23. 후 입대 ) 는 반드시 2025 학년도 제 1 학기 성적을 인정받아야 하므로 ( 입대일 이후는 유고결석 처리 ) 반드시 수강신청을 하고\n\n입대 전까지 수업에 참여하여야 함 . 2 학기부터 군휴학 처리됨 . 관련사항 소속캠퍼스 수강편람의 유고결석 . 결시 처리절차 참고 바람.\n\n2025. 2.\n\n서울 . 글로벌 학사종합지원센터\n\n| 0 |\n|:--------------------------------------------------------------------------------------------------------------------------------|\n| - 입대를 증빙할 수 있는 서류(입영통지서 사본, 병적증명서, 복무확인서 등) 중 1개의\xa0파일 업로드 - JPG파일만 업로드 가능(최대10MB) |']","자연과학대학(자과대)의 이수구분 변경 신청은 다음과 같은 절차로 진행됩니다:

1. **신청서 작성**: 이수구분 변경 신청서를 작성합니다. 해당 서식은 학사종합지원센터 홈페이지에서 다운로드할 수 있습니다.

2. **제출처**: 작성한 신청서는 본인의 1전공 단과대학 담당 선생님에게 이메일로 제출하거나 직접 방문하여 제출할 수 있습니다.

3. **제출 기한**: 졸업학기 졸업사정일 전까지 제출해야 하며, 당해 학기 수강신청 건에 대해서는 성적 취득 후 신청하는 것이 권장됩니다.

4. **변경 결과 확인**: 신청 후 3~4일(평일 기준) 이내에 종합정보시스템에서 변경 결과를 확인해야 하며, 변경이 되지 않은 경우 즉시 담당자에게 연락하여 확인해야 합니다.

정확한 절차와 제출처는 자과대의 학사 공지사항을 참고하시거나, 해당 학과의 담당 교수님께 문의하시기 바랍니다. 혹시 더 도와드릴까요?",이수구분 변경 신청을 하기 위해서는 본인의 1전공 단과대학에 신청서를 제출해야 합니다. 신청서는 홈페이지 공지사항에서 다운받을 수 있습니다.,0.9299798720869299,,,0.0
나 정보통신공학과인데 혹시 졸업시험 대신 졸업논문을 선택해도 될까? 논문을 쓰게 되면 기계학습 관련해서 작성하고 싶은데 이와 관련해서 상담할 수 있는 교수님이 계시면 이메일 좀 알려줘.,"['한희일 교수님 교수님은 정보통신공학과 학과 소속입니다. 이메일은 hihahn@hufs.ac.kr입니다. 연구실은 백년관 721호입니다.', '정일영 명예교수님 교수님은 정보통신공학과 학과 소속입니다. 이메일은 iychong@hufs.ac.kr입니다.', '김명진 명예교수님 교수님은 정보통신공학과 학과 소속입니다. 이메일은 mjkim@hufs.ac.kr입니다.', '손경락 교수님 교수님은 정보통신공학과 학과 소속입니다. 이메일은 krson@hufs.ac.kr입니다. 연구실은 공학관 414호입니다.', '교내해커톤 등 다양한 공모전에 팀을 이루어서 프로젝트를 수행하고 \n발표하는 경험을 쌓는 것도 좋습니다. 전공심화 학생은 정보통신종합\n설계및실습 과목을 통해 프로젝트를 수행하고 졸업논문을 작성하고 \n발표하는 경험을 쌓는 것이 필요하며, 이를 통해 다양한 정보통신 분\n야로의 사회 진출을 준비할 수 있습니다.\n졸업 후 진로 \n-  정부 및 공공기관: 기술직 공무원 / 정보통신 표준화 관련 기관 등\n-  연구소: 국책연구소 / 통신 사업자 연구소 / 정보통신 산업체 연구소\n-  기업체: 삼성전자, LG전자 등 정보통신기기 제조업체 / KT, SKT, LG \nU+등 주요 통신사업자 / 네이버, 카카오 등 정보통신 서비스 업체 / 삼\n성 SDS, LG CNS 등 SI 사업체 / 부가통신서비스 사업자 / 은행, 증권\n회사 등 금융기관 / 게임회사 / 정보보안 회사 등\n-  기타: 국내/해외 대학 석·박사 진학\nQ&A \nQ1.  인공지능 전문가가 되고 싶습니다. 정보통신공학과에서 이 목표를 \n달성할 수 있을까요?\nA1.  정보통신공학과는 최신 AI 기술과 실전 경험을 갖춘 혁신적 인공지\n능 전문가를 양성하는 것을 목표로 하고 있습니다. 학과에서 제공하\n는 커리큘럼을 통해 하드웨어와 소프트웨어 기술을 망라하여 정보\n와 통신이 결합된 융복합 인공지능 전문가가 될 수 있습니다.\nQ2.  요즘은 융복합 시대입니다. 정보통신공학과는 다가오는 시대에 적\n합한 분야인가요?\nA2.  정보통신공학과는 정보와 통신이 결합된 융복합을 지향하는 학과\n입니다. 세상에서 만들어지거나 처리해야 하는 다양한 정보를 기계\n와 인간 간 소통을 통하여 더 나은 시대를 여는 것을 연구하는 분\n야입니다.\nQ3.  인문계 학생의 경우 고등학교 때 수학을 많이 배우지 않습니다. 그\n래도 정보통신공학과 커리큘럼을 따라갈 수 있는지요?\nA3.  고등학교 때 기본적으로 배우는 수학으로 준비가 충분합니다. 부족\n한 부분을 학부 1학년과 2학년 때 다양한 기본 및 심화 수학 과목이 \n있으므로 이를 학습하는 것으로 충분합니다. \nQ4.  졸업 후 통신과 관련한 곳으로 진로가 한정되나요?\nA4.  정보통신공학은 정보와 통신의 융합 학문으로서 IT 모든 분야로 진\n출이 가능합니다. 통신 분야뿐만 아니라 전자 기기, 자동차, 조선, 금\n융, 엔터테인먼트, 유통, 교육, 행정과 같이 정보통신 서비스가 결합\n되어 새로운 시너지가 창출되는 산업 전 분야로 진출이 가능합니다.', '교내해커톤 등 다양한 공모전에 팀을 이루어서 프로젝트를 수행하고 \n발표하는 경험을 쌓는 것도 좋습니다. 전공심화 학생은 정보통신종합\n설계및실습 과목을 통해 프로젝트를 수행하고 졸업논문을 작성하고 \n발표하는 경험을 쌓는 것이 필요하며, 이를 통해 다양한 정보통신 분\n야로의 사회 진출을 준비할 수 있습니다.\n졸업 후 진로 \n-  정부 및 공공기관: 기술직 공무원 / 정보통신 표준화 관련 기관 등\n-  연구소: 국책연구소 / 통신 사업자 연구소 / 정보통신 산업체 연구소\n-  기업체: 삼성전자, LG전자 등 정보통신기기 제조업체 / KT, SKT, LG \nU+등 주요 통신사업자 / 네이버, 카카오 등 정보통신 서비스 업체 / 삼\n성 SDS, LG CNS 등 SI 사업체 / 부가통신서비스 사업자 / 은행, 증권\n회사 등 금융기관 / 게임회사 / 정보보안 회사 등\n-  기타: 국내/해외 대학 석·박사 진학\nQ&A \nQ1.  인공지능 전문가가 되고 싶습니다. 정보통신공학과에서 이 목표를', '교내해커톤 등 다양한 공모전에 팀을 이루어서 프로젝트를 수행하고 \n발표하는 경험을 쌓는 것도 좋습니다. 전공심화 학생은 정보통신종합\n설계및실습 과목을 통해 프로젝트를 수행하고 졸업논문을 작성하고 \n발표하는 경험을 쌓는 것이 필요하며, 이를 통해 다양한 정보통신 분\n야로의 사회 진출을 준비할 수 있습니다.\n졸업 후 진로 \n-  정부 및 공공기관: 기술직 공무원 / 정보통신 표준화 관련 기관 등\n-  연구소: 국책연구소 / 통신 사업자 연구소 / 정보통신 산업체 연구소\n-  기업체: 삼성전자, LG전자 등 정보통신기기 제조업체 / KT, SKT, LG \nU+등 주요 통신사업자 / 네이버, 카카오 등 정보통신 서비스 업체 / 삼\n성 SDS, LG CNS 등 SI 사업체 / 부가통신서비스 사업자 / 은행, 증권', '수업뿐 아니라 진로 탐색을 위한 여러 교육과 공정실습을 수강하\n는 것이 필요합니다.\n4학년  졸업논문 작성을 위한 실험 및 졸업시험 공부를 하며 필요에 따라 \n관심 분야와 관련된 연구실에서 학부연구원 혹은 석·박사 과정을 \n통해 실무적인 다양한 실험과 논문 작성에 참여할 수 있습니다.\n졸업 후 진로 \n-  기업체: 전자 산업체(반도체, 디스플레이, 등), 소재 산업체(반도체, \n이차전지)\n-  연구개발 분야 전문직: 국·공립 및 기업 연구소, 학교 등 전문직\n-  학계 및 연구원: 국내외 대학원 진학 후 대학교수 및 연구소 연구원\n으로 진출\n-  기타: 변리사(재료와 관련된 특허 소송 등을 담당)\nQ&A \nQ1. 전자물리학과에 입학하려면 물리를 잘해야 하나요?\nA1.  전자물리학과는 단순히 물리를 잘하는 학생보다는 논리적인 사고방\n식과 자연과 물리에 대한 지적 호기심, 진지한 탐구 자세, 배움에 대\n한 열정, 융복합적 사고를 가진 학생을 선호합니다.', '과 논문 작성에 참여합니다.\n졸업 후 진로 \n-  정부 및 공공기관: 과학기술정보통신부,산업자원부,방송통신전파위원회 등\n-  연구소 및 연구: 국내외 정부출연 연구소, 한국전자통신연구원, 한국\n전자기술연구원, 국립전파연구원 등\n-  기업체 : 반도체 설계 및 장비, 의료기기, 방위산업, 자동차, 인공지능 등\n-  기타: 대학교수, 교사(교직이수), 대학원 진학\nQ&A \nQ1.   반도체전자공학부에서는 무엇을 배우나요?\nA1.   전자 및 통신 시스템과 그 핵심인 반도체의 동작 원리, 설계, 프로그\n래밍 등 전반에 걸친 종합적인 이론과 활용 지식을 배웁니다.\nQ2. 졸업자의 취업 전망은 어떤가요? \nA2.  반도체·전자 공학은 산업의 씨앗인 반도체 설계, 제조 및 이를 응용', 'U+등 주요 통신사업자 / 네이버, 카카오 등 정보통신 서비스 업체 / 삼\n성 SDS, LG CNS 등 SI 사업체 / 부가통신서비스 사업자 / 은행, 증권\n회사 등 금융기관 / 게임회사 / 정보보안 회사 등\n-  기타: 국내/해외 대학 석·박사 진학\nQ&A \nQ1.  인공지능 전문가가 되고 싶습니다. 정보통신공학과에서 이 목표를 \n달성할 수 있을까요?\nA1.  정보통신공학과는 최신 AI 기술과 실전 경험을 갖춘 혁신적 인공지\n능 전문가를 양성하는 것을 목표로 하고 있습니다. 학과에서 제공하\n는 커리큘럼을 통해 하드웨어와 소프트웨어 기술을 망라하여 정보\n와 통신이 결합된 융복합 인공지능 전문가가 될 수 있습니다.\nQ2.  요즘은 융복합 시대입니다. 정보통신공학과는 다가오는 시대에 적\n합한 분야인가요?', 'Q&A \nQ1.  인공지능 전문가가 되고 싶습니다. 정보통신공학과에서 이 목표를 \n달성할 수 있을까요?\nA1.  정보통신공학과는 최신 AI 기술과 실전 경험을 갖춘 혁신적 인공지\n능 전문가를 양성하는 것을 목표로 하고 있습니다. 학과에서 제공하\n는 커리큘럼을 통해 하드웨어와 소프트웨어 기술을 망라하여 정보\n와 통신이 결합된 융복합 인공지능 전문가가 될 수 있습니다.\nQ2.  요즘은 융복합 시대입니다. 정보통신공학과는 다가오는 시대에 적\n합한 분야인가요?\nA2.  정보통신공학과는 정보와 통신이 결합된 융복합을 지향하는 학과\n입니다. 세상에서 만들어지거나 처리해야 하는 다양한 정보를 기계\n와 인간 간 소통을 통하여 더 나은 시대를 여는 것을 연구하는 분\n야입니다.\nQ3.  인문계 학생의 경우 고등학교 때 수학을 많이 배우지 않습니다. 그\n래도 정보통신공학과 커리큘럼을 따라갈 수 있는지요?\nA3.  고등학교 때 기본적으로 배우는 수학으로 준비가 충분합니다. 부족', '업체 현장 실습 경험을 쌓는 것이 좋습니다. 임베디드SW경진대회나 \n교내해커톤 등 다양한 공모전에 팀을 이루어서 프로젝트를 수행하고 \n발표하는 경험을 쌓는 것도 좋습니다. 전공심화 학생은 정보통신종합\n설계및실습 과목을 통해 프로젝트를 수행하고 졸업논문을 작성하고 \n발표하는 경험을 쌓는 것이 필요하며, 이를 통해 다양한 정보통신 분\n야로의 사회 진출을 준비할 수 있습니다.\n졸업 후 진로', '수강하게 됩니다. 여러 교양서적을 많이 읽고 영어 능력을 키우\n면 전공 공부에 도움이 많이 됩니다.\n2학년  본격적으로 전공 수업을 듣게 됩니다. 이론과 실험 수업을 수강하여 \n실험 데이터를 직접 만들어내고 분석하는 과정도 익히게 됩니다.\n3학년  물리에 관련된 다양한 전공 심화 과목들을 수강하고 나아가 전공 \n수업뿐 아니라 진로 탐색을 위한 여러 교육과 공정실습을 수강하\n는 것이 필요합니다.\n4학년  졸업논문 작성을 위한 실험 및 졸업시험 공부를 하며 필요에 따라 \n관심 분야와 관련된 연구실에서 학부연구원 혹은 석·박사 과정을 \n통해 실무적인 다양한 실험과 논문 작성에 참여할 수 있습니다.\n졸업 후 진로 \n-  기업체: 전자 산업체(반도체, 디스플레이, 등), 소재 산업체(반도체, \n이차전지)', '[글로벌] 2025학년도 1학기 졸업논문 제출 및 졸업시험 일정 공고 새글\n\n졸업시험 ( 대체 )\n\n졸업시험 응시원서\n\n양식 2\n\n7. 다 .\n\nFLEX 대체 ( 교내 )\n\n2025. 4. 25.( 금 )\n\n졸업시험\n\n졸업시험 시간표 발표\n\n5. 마 . ※\n\n2025. 5. 12.( 월 ) ∼ 5. 13.( 화 )\n\n졸업시험\n\n1 전공 졸업시험\n\n5. 나 .\n\n2025. 5. 19.( 월 ) ∼ 5. 20.( 화 )\n\n졸업시험\n\n제 2 전공 , 이중전공 졸업시험\n\n5. 나 .\n\n2025. 5. 24.( 토 ) 오전 10:00\n\n졸업시험 ( 대체 )\n\nFLEX 대체 ( 교내 )\n\n7. 나 .\n\n서울캠퍼스 시행예정\n\n4. 졸업논문\n\n가 . 졸업논문 작성계획서 제출 마감일 : 2025. 4. 23.( 수 )\n\n※ 졸업논문 제출 마감일은 학과에 문의\n\n나 . 제 1 전공 , 제 2 전공 , 이중전공 : 해당학과에서 배정한 졸업논문 지도교수로부터 졸업논문 작성에 관한 지도를 받아 기일 내에 소속 학과장실에 제출함\n\n다 . 졸업논문의 분량은 200 자 원고지 100 매 이상 분량을 원칙으로 함\n\n라 . 졸업논문을 기한 내에 제출하지 않는 학생은 졸업사정 대상에서 제외됨\n\n※ 졸업논문을 제출하고자 하는 학생은 3 학년 2 학기 초 또는 졸업학기의 직전 학기 초에 졸업논문 작성계획서를 작성하여 소속 학과장실에 제출하여야함\n\n※ 세부일정은 해당학과에 따라 다를 수 있으니 반드시 해당학과에 문의 후 작성 제출\n\n5. 졸업시험\n\n가 . 졸업시험 기간\n\n1) 1 전공 : 2025. 5. 12.( 월 ) ∼ 5. 13.( 화 )\n\n2) 제 2 전공 , 이중전공 : 2025. 5. 19.( 월 ) ∼ 5. 20.( 화 )\n\n나 . 졸업시험 과목 : 자세한 사항은 첨부파일 참조 , 학과 사정에 따라 변경될 수 있음 ( 자세한 사항은 학과에 문의 )\n\n다 . 졸업시험 응시원서 접수 마감일 : 2025. 4. 23.( 수 )\n\n라 . 졸업시험 응시원서 교부 및 제출처 : 해당 학과 학과장실', '4학년  전공심화과목을 수강하고, 본인 진로와 관련된 강좌를 집중적으로 \n이수합니다. 학과 전임교수의 지도하에 졸업논문을 작성합니다. \n졸업 후 진로 \n-  정부 및 공공기관: 국공립 박물관의 학예직공무원, 국가기록원 및 지\n자체·대학역사관의 기록연구사, 공무원 등\n-  교육 및 연구: 대학교수, 역사교사, 역사문화 관련 연구소 및 박물관\n의 큐레이터 등\n-  기업체: 일반기업체 및 벤처기업 회사원\n-  기타: 문화예술종사자, 프로그래머 등\nQ&A \nQ1.  역사학을 공부하려면 암기력이 중요한가요?\nA1.  꼭 그렇지만은 않습니다. 역사학은 사료를 검증, 분석하고, 추론하\n면서 역사의 지속과 변화를 탐구하는 학문입니다. 우리 사학과에서 \n공부하면서 이러한 학술적 능력과 함께 창의력을 체계적으로 함양\n할 수 있습니다.\nQ2.  사학을 공부하고 졸업하면 순수한 학술연구 외에 전공 관련해서 \n어떤 일을 할 수 있나요?\nA2.  적지 않은 졸업생들이 기록연구사, 역사교사, 학예연구원 등으로 \n활발하게 활동하고 있습니다. 최근에는 역사콘텐츠의 중요성이 제\n고되면서, 문화예술, 게임분야에서 활약하는 졸업생들도 늘어나\n고 있습니다. \n학과(부) 행사 및 동아리 활동 \n-  동사무소(동양철학): 공자, 맹자 등 특정 철학자의 사상에만 국한되지 \n않고, 전반적인 동양 철학사의 흐름과 이에 따른 사상적 차이들을 학\n습하며 이에 대한 의견을 학회원들끼리 토의합니다.\n-  엑스페르고(서양철학): 혼자 읽고 이해하기엔 버거운 여러 철학 고전 \n서적들을 함께 읽어나가며 자유롭게 토론합니다. 이를 통해 철학자들\n의 사유를 이해하고 비판적 시각을 통해 스스로의 철학적 사유를 기르\n는 훈련을 할 수 있습니다.\n-  앤솔로지(예술철학): 아름다움과 예술 이전의 논의들을 학습한 후 현\n대 문화를 파악하는 여러 방법들을 공부합니다.\n-  LOPES(서양철학사&데이터분석): 영어 원문 번역방식의 서양철학사 \n스터디와 데이터 분석을 통해 통계분석용 프로그램 및 다양한 데이터 \n분석기법과 머신러닝 같은 기술 등을 학습합니다.\n-  철학인의 밤: 학생들의 학술 세미나 및 친목 활동 \n-  철학과 한마당 행사: 연말 중 시행되는 철학과 선배, 교수님들이 함\n께하는 행사로 다양한 이벤트 등과 함께 선배, 교수님과 담소를 나누\n는 친목 활동 \n-  한국외대 총장배 토론대회: 2008년도부터 시작된 토론대회로 인문', '[글로벌] 2025학년도 1학기 졸업논문 제출 및 졸업시험 일정 공고 새글\n\n나 . 졸업시험 과목 : 자세한 사항은 첨부파일 참조 , 학과 사정에 따라 변경될 수 있음 ( 자세한 사항은 학과에 문의 )\n\n다 . 졸업시험 응시원서 접수 마감일 : 2025. 4. 23.( 수 )\n\n라 . 졸업시험 응시원서 교부 및 제출처 : 해당 학과 학과장실\n\n마 . 졸업시험 시간표 발표 : 2025. 4. 25.( 금 ) 소속학과 게시판 참조 ( 학과 자체 발표 )\n\n※ 해당학과 ( 부 ) 에 따라 시험일정이 다를 수 있으니 반드시 해당학과에 문의 후 응시\n\n6. FLEX 대체 ( 정기시험 : 영어 , 중국어 , 일본어 , 프랑스어 , 독일어 , 러시아어 , 스페인어 )\n\n가 . 해당학과 : 자세한 사항은 첨부파일 참조\n\n나 . 일정 : 시험 일정 ( 클릭 ) 에 따라 학생 개별 응시하고 성적표 학과 제출\n\n다 . 제출기간 : 해당학과 사무실 문의\n\n7. FLEX 대체 ( 이탈리아어 , 태국어 , 폴란드어 , 루마니아어 , 체코어 , 헝가리어 , 세르비아어 , 그리스어 , 불가리아어 , 힌디어 )\n\n가 . 해당학과 : 자세한 사항은 첨부파일 참조\n\n나 . 시험일자 : 2025. 5. 24( 토 ) 오전 10:00 서울캠퍼스 시행예정\n\n※ 정확한 시간 / 장소는 추후 통지\n\n다 . 접수기간 : 2025. 4. 16.( 수 ) ~ 4. 23.( 수 ) 해당학과 사무실에 신청 ( 기한 이후 추가 신청 불가 )\n\n* 7 학기 이상 재적생만 신청가능\n\n8. 유의 사항\n\n가 . 졸업시험 및 졸업논문 심사에 통과한 자는 졸업 시까지 그 자격이 유효함 ( 단 , 학적을 상실한 때에는 그 자격을 인정하지 아니함 )\n\n나 . 제 2 전공 , 이중전공자도 해당학과 문의 / 학과에 따른 졸업시험 응시 , 논문 제출 등 pass 하기 바람\n\n다 . 졸업시험 응시원서 제출 시 학생 본인의 연락처를 정확히 기재할 것\n\n라 . 졸업시험은 과목별 40 점이상 , 전과목 평균 60 점 이상 취득하여야 합격임\n\n마 . 졸업논문은 D° 이상 판정 받아야 합격임', '[글로벌] 2025학년도 1학기 졸업논문 제출 및 졸업시험 일정 공고 새글\n\n컴퓨터 · 전자시스템공학전공\n\n○\n\n031)330-4268\n\n컴퓨터공학과\n\n○\n\n031)330-4268\n\n디지털정보공학과\n\n○\n\n031)330-4268\n\n정보통신공학과\n\n○\n\n○\n\n031)330-4255\n\n전자공학과\n\n○\n\n○\n\n031)330-4094\n\n산업경영공학과\n\n○\n\n○\n\n031)330-4093\n\n바이오메디컬공학부\n\n바이오메디컬공학전공\n\n○\n\n031)330-4723\n\n융합전공\n\n정보 · 기록학전공\n\n○\n\n문화콘텐츠학전공\n\n○\n\n02)2173-2936\n\nAI 융합전공 (Software&AI)\n\n○\n\n031-330-4509\n\nAI 융합전공 (Business & AI 트랙 )\n\n○\n\n02)2173-2643\n\nEU 전공\n\n○\n\n○\n\n02)2173-3284\n\n광역특화전공\n\n○\n\n세계문화예술경영전공\n\n○\n\n○\n\n02)2173-2286\n\n국가리더전공 ( 글로벌 )\n\n○\n\n○\n\n02)2173-2321\n\n데이터사이언스전공\n\n○\n\n031)330-4680\n\n바이오데이터사이언스전공\n\n○\n\n031)330-4723\n\n※ 학과사정에 따라 변경될 수 있음 ( 자세한 사항은 학과에 문의 )\n\n3. 일정별 계획\n\n마감일 / 일정\n\n구분\n\n제출서류\n\n서식 / 양식\n\n제출처\n\n유의사항\n\n( 아래 공지번호 )\n\n비고\n\n2025. 4. 23.( 수 )\n\n졸업논문\n\n졸업논문\n\n서식 1, 양식 4, 양식 5\n\n해당학과\n\n4. 나 ., 다 ., 라 .\n\n마감일정 학과 문의\n\n졸업논문\n\n졸업논문 작성계획서\n\n양식 1\n\n4. 라 . ※\n\n졸업시험\n\n졸업시험 응시원서\n\n양식 2\n\n5. 가 ., 마 .\n\n2025. 4. 23.( 수 )\n\n졸업시험 ( 대체 )\n\n졸업시험 응시원서\n\n양식 2\n\n7. 다 .\n\nFLEX 대체 ( 교내 )\n\n2025. 4. 25.( 금 )\n\n졸업시험\n\n졸업시험 시간표 발표\n\n5. 마 . ※\n\n2025. 5. 12.( 월 ) ∼ 5. 13.( 화 )\n\n졸업시험\n\n1 전공 졸업시험\n\n5. 나 .\n\n2025. 5. 19.( 월 ) ∼ 5. 20.( 화 )\n\n졸업시험', '## [heading1] ##\n# 2. 졸업시험 / 논문\n\n## [list] ##\n- 가. 1전공, 이중전공, 제2전공(2006학번 이전)은 반드시 졸업시험이나 논문을 통과하여야\n- 졸업이 가능함\n- 나. 매 학기 중반(4~5월, 10~11월)에 졸업시험 및 논문작성/심사 등을 진행하며, 학과별,\n- 전공별 조건 및 일정은 각 학과사무실에 확인하여 기간 내 조치토록 함\n- 다. 졸업시험/논문에 합격 후 졸업 시까지 그 자격이 유효하나, 합격 후 제적처리가 되는\n- 경우에는 합격이 취소됨\n- 라. 졸업시험FLEX와 외국어인증은 별도이므로 각각 요건을 확인하고 응시 / 처리하여야 함\n\n## [paragraph] ##\n3. 외국어인증(졸업인증) : 입학과 동시에 제출 가능\n\n## [paragraph] ##\n가. 외국어인증 : 2007학번 이후 모든 학생은 졸업 필수요건으로 외국어인증을 완료해야 함\n(편입생, 군위탁생, 새터민은 인증 면제 / 2004~2006학번은 아래 졸업인증 기준을 따름.\n단, 편입생 및 군위탁생으로 면제대상이거나 2006학번 이전 학생이더라도 이중전공이\n나 전공심화+부전공을 이수한 경우 외국어인증을 완료해야 함)\n※ 외국어인증은 입학과 동시에 가능하며 졸업 전 미리 인증하는 것을 권고함\n(단 제출시점 당시 증명서의 유효기간(기준 2년 이내 취득)이 남아 있어야 함)\n\n## [paragraph] ##\n※ 외국어인증 기준', '기후변화융합학부\n\n기후변화융합학부는 기후변화 대응 패러다임 변화에 대응할 수 있는 교육과정을 마련하고 국내외 유관기관과의 협력강화를 통해 기후변화 관련 전문지식을 갖춘 인재양성을 도모하고자 신설되었습니다. 이를 위해 에너지와 기후변화 정책 및 관련 국제협력 분야에서 기후변화 대응산업과 연구를 선도할 융합인력 양성이 목표이며 기후감시 및 예측, 기후변화 정책, 온실가스 및 에너지 관리 3개 트랙으로 교육과정을 운영할 예정입니다. 이와 같은 교육과정에 따라 사회과학적 소양과 자연과학/공학과의 융복합적인 교육을 통해 과학 및 정책을 포함한 미래의 기후변화 관련 업무를 국제사회에서 선도할 수 있는 거시적 안목을 갖춘 글로벌 융합인재를 배출하고자 합니다.\n\n031-330-4114', '1312\n전공소개 \n2007년 유럽연합 회원국이 된 루마니아(인구: 8위, 국토면적: 9위)는 ‘\n유럽의 보석’이라 불릴 정도로 아름다운 자연환경과 풍부한 천연자원으\n로 동유럽 국가 중에서 경제적 성장잠재력이 가장 높은 나라로 주목받\n고 있습니다. 1987년 설립된 루마니아학과는 루마니아(Romania)와 몰\n도바(Moldova)공화국의 어문학 및 지역학을 공부할 수 있는 국내 유일\n의 고등교육기관입니다. 라틴어에 뿌리를 둔 루마니아어의 실질적인 구\n사력 및 문헌 이해 능력의 배양과 더불어 루마니아 지역학 관련 지식의 \n습득으로 현지에 특화된 전문가를 양성하고 있습니다. 우리나라의 공기\n업을 비롯한 대기업과 중소기업들이 판매 및 제조법인 등 다양한 형태로 \n루마니아에 투자하거나 사업진출을 도모하고 있습니다.\n필요역량 및 소양 \n교과의 측면에서는 발칸반도, 나아가 동부 유럽에 대한 역사와 문화에 \n대해 관심을 갖고 특히 루마니아의 역사와 사회문화에 대해 흥미를 가\n지고 있으면 좋습니다. 또한 전공과 관련해서 문학, 지역학 등 다양한 분\n야의 서적을 읽는 것도 도움이 됩니다. 이는 단순히 언어만 배우는 게 아\n닌 루마니아의 문화, 정치, 역사 등 다양한 분야에 대해 입학 후 배우기 \n때문입니다. 아울러, 언어적인 측면에서는 루마니아어를 모르더라도 새\n로운 언어를 배우는 데에 두려움을 갖지 말고 호기심을 가지고 적극적\n인 자세를 함양하는 게 도움이 되리라 생각합니다.\n우리 학과(부)·전공 매력 \n-  루마니아어는 동유럽 유일의 라틴 로망스어로 이태리어, 프랑스어, \n스페인어와 유사\n-  루마니아를 포함한 중부유럽 전체를 조망하며 국내외 연구기관과 유\n기적 연계\n-  루마니아 진출 및 유관 한국기업과의 협업\n-  취득 가능한 자격증: 유럽 언어 공통 기준(Common European \nFramework of Reference for Languages, CEFR by CE) 평가등급, \nFLEX 루마니아어 졸업인증\n주요 전공과목 \n1학년  루마니아학입문, 기초루마니아어문법작문, 초급루마니아어번역\n연습, 초급루마니아어회화, 초급시청각루마니아어, 초급루마니\n아어문법작문\n2학년  루마니아사정, 중급루마니아어문법작문, 중급루마니아어번역연\n습, 중급루마니아어회화, 루마니아문화, 고급루마니아어문법작문\n3학년  고급루마니아어회화, 루마니아 문학사, 루마니아 현대문학, 루마', '[글로벌] 2025학년도 1학기 졸업논문 제출 및 졸업시험 일정 공고 새글\n\n나 . 제 2 전공 , 이중전공자도 해당학과 문의 / 학과에 따른 졸업시험 응시 , 논문 제출 등 pass 하기 바람\n\n다 . 졸업시험 응시원서 제출 시 학생 본인의 연락처를 정확히 기재할 것\n\n라 . 졸업시험은 과목별 40 점이상 , 전과목 평균 60 점 이상 취득하여야 합격임\n\n마 . 졸업논문은 D° 이상 판정 받아야 합격임\n\n※ 졸업시험 및 졸업논문 관련서식은 첨부파일 참조\n\n2025. 4.\n\n글로벌캠퍼스 교무처장\n\n| 0 |\n|:------------------------------------|\n| 졸업논문 제출 및 졸업시험 일정 공고 |', '4544\n슬기로운 대학생활 \n학과 커리큘럼(교과과정)을 충실히 따라 기초 교양 과목을 통해 전공에 \n필요한 기초를 다지고, 이를 기반으로 전공 심화 수업을 잘 따라가는 것\n이 중요합니다.\n<1, 2학년 저학년 생활 안내> \n-  코딩 능력 함양: 정보통신공학에서는 기본적으로 프로그래밍 능력이 \n필수적이기 때문에, 1학년 교과목을 통해 C, Python, Java 등 다양한 \n기초 프로그래밍 언어를 습득하고, 이를 기반으로 2학년 교과목을 통\n해 자료구조와 알고리즘 이론을 익혀 코딩에 관한 기본 실력을 갖추는 \n것이 필요합니다. 학과에서는 고학년 학과 재학생이 조교이자 멘토로 \n활동하는 학과 코딩존을 운영하고 있으며, 이를 잘 활용해 본인의 기\n본 코딩 실력을 잘 배양하는 것이 필요합니다.\n-  기초 수학 능력 배양: AI 정보 이론과 신호 및 시스템 등의 과목을 통해 \n정보통신을 위한 기초적인 수학 능력을 배양하여야 합니다. \n-  기초 컴퓨터 시스템 능력 배양: 논리회로, 회로이론, 컴퓨터구조 등의 \n과목을 통해 실제 임베디드 보드를 활용한 시스템 경험을 쌓는 것이 \n필요합니다. 아울러 오픈소스소프트웨어 등의 과목을 통해 최신 소프\n트웨어 개발 동향을 파악하는 습관을 기르고, 컴퓨터 시스템을 활용하\n는 기본 실력을 배양하는 것이 필요합니다. \n<3, 4학년 고학년 생활 안내> \n-  전공 심화 능력 배양: 3, 4학년 과목들은 인공지능, 통신 네트워크, 정\n보 보안, 임베디드 시스템, 클라우드 컴퓨팅, IoT 시스템의 다양한 분\n야로 진출할 수 있는 정보통신 기술을 습득하기 위해 필수적인 과목\n들입니다. 이들 과목을 통해 다양한 하드웨어와 소프트웨어를 활용한 \n실습과 프로젝트를 수행하여 실전적인 경험을 쌓는 것이 중요합니다.\n-  캡스톤 프로젝트 능력 배양: 인턴 프로그램, 정보통신기초종합설계 과\n목 등을 통해 기업체 인턴쉽을 수행할 수 있으며, 이를 통해 다양한 기\n업체 현장 실습 경험을 쌓는 것이 좋습니다. 임베디드SW경진대회나 \n교내해커톤 등 다양한 공모전에 팀을 이루어서 프로젝트를 수행하고 \n발표하는 경험을 쌓는 것도 좋습니다. 전공심화 학생은 정보통신종합\n설계및실습 과목을 통해 프로젝트를 수행하고 졸업논문을 작성하고 \n발표하는 경험을 쌓는 것이 필요하며, 이를 통해 다양한 정보통신 분\n야로의 사회 진출을 준비할 수 있습니다.\n졸업 후 진로', '-  아프리카학부 동문회 장학금\n-  학부 장학금\n-  아프리카 관련 학회 활동\n-  케냐 현지 스와힐리어 연수\n-  동문 초청 Job담회 개최\n-  ‘아프리카의 날’ 행사 진행\n-  한-아프리카재단, 아프리카 인사이트 등 정부 출연기관과 시민단체 \n인턴 기회 제공\n학과(부) 행사 및 동아리 활동 \n-  트윔보: 아프리카 춤패로 각종 행사와 축제에 참여\n-  Asaz: 아프리카 시사 관련 공부 모임\n-  잠보리카: 아프리카 관련 카드 뉴스제작 홍보\n-  아사필(24년 학회 등록 예정): 아프리카 인식 제고를 위한 각종 프로\n그램과 행사 기획, 운영\n-  아봉: 아프리카 봉사 학회로 국내 아프리카 이주민을 대상으로 한 행사 진행\n슬기로운 대학생활 \n1학년  전공기초과목으로 5개의 ‘아프리카 00개론’ 과목을 수강합니다. \n이를 바탕으로 2학기에 적성에 따라 전공계열(동부, 서부, 남부)\n을 선택하게 됩니다.\n2학년  본격적으로 언어와 지역학에 대한 수업을 듣게 됩니다. \n3학년  아프리카에 대한 전공심화와 함께 향후 진로에 도움이 되는 아프\n리카 연관 이중전공을 심화학습 합니다.(예, 글로벌비즈니스, 정\n치외교, 생명공학 등 이공계)\n4학년  졸업논문을 작성하고 졸업시험을 치르며 향후 진로에 대한 탐구\n를 합니다. \n졸업 후 진로 \n-  정부 및 공공기관 : 외교부, 한-아프리카재단, KOTRA, KOICA, KIEP 등\n-  연구소 및 연구 : 국내외 정부출연 연구소 / 해외 아프리카 관련 연구소\n-  기업체 : 아프리카에 진출해 있거나 진출을 노리는 기업 / 아프리카 현지 기업\n-  기타 : 대학교수, 교사(교직이수), 개발협력 NGOs, 시민단체\nQ&A \nQ1. 아프리카라는 지역이 너무 광대한데 무엇을 어떻게 배우나요? \nA1.  아프리카학부는 1학년 1학기에 기초 공통과목을 듣고 2학기부터 계\n열(동부, 서부, 남부)을 선택해 4학년까지 교육받게 됩니다. 각 계열은 \n언어와 지역학 프로그램으로 구성되어 있습니다. 동부는 스와힐리어\n와 암하라(에티오피아)어, 서부는 하우사어를 중심으로 수업이 진행되\n며, 남부는 국제정치, 경제와 사회문화를 중심으로 수업이 진행됩니다. \nQ2.  아프리카를 전공하면 어떤 일을 할 수 있나요? \nA2.  아프리카를 전공한 뒤 할 수 있는 일은 학생의 의지와 관심에 달려 \n있습니다. 아프리카학부 졸업생들은 일반기업뿐 아니라 자신의 꿈', '2928\nDivision of Global Business & Technology\nGlobal Business & \nTechnology학부\n전화번호 031-330-4509\n홈페이지 gbt.hufs.ac.kr\n전공소개 \nGBT학부에서는 “정보기술을 잘 활용할 수 있는 경영인”을 양성합니다. \n미래에는 인공지능과 빅데이터 등 첨단 정보기술이 모든 비즈니스에 활\n용될 것이므로 이러한 정보기술에 대한 이해와 활용 능력이 점점 더 중\n요해질 것입니다. GBT학부는 이러한 시대적 요구에 부응하여 소셜 미\n디어, 빅데이터, 인공지능과 같은 신기술들을 비즈니스 모델과 융합하\n여 경제와 산업, 문화에 걸쳐 새로운 상품과 비즈니스를 창출할 수 있는 \n‘융합형 인재’를 육성하고 있습니다. 이를 위해 영어 커뮤니케이션 능력\n과 경영학 지식, IT 역량을 갖출 수 있는 커리큘럼을 구성하였고 각 분야\n의 전문가들이 체계적이고 전문화된 교육을 진행하고 있습니다.\nGBT 학부에서는 산학 협력 프로그램 및 인턴쉽 프로그램을 운영하\n며 실무 중심의 현장 체험형 교육 기회를 제공하고 있습니다. 또한 \nResidential College, 세계 유명 대학과의 협력을 통한 복수학위제, 학\n과 전용 교환학생 제도 등을 운영하여 국제적 감각을 지닌 리더로 성장\n할 기회를 제공하고 있습니다. GBT학부는 구글, 아마존 같은 글로벌 빅\n테크 기업에서 주도적으로 일할 수 있는 인재를 양성하는 것을 목표로 \n하고 있으며 이미 성공적인 사례가 나오고 있습니다.\n필요역량 및 소양 \n-  GBT학부는 경영학과 IT기술의 융합학부이므로 인공지능, 컴퓨터프로\n그래밍 언어 등 새로운 기술에 대한 호기심과 관심이 있으면 좋고, 이\n러한 IT기술을 활용한 비즈니스에 대한 관심이 필요합니다.\n-  한국어, 영어를 사용한 커뮤니케이션 역량, 데이터 수집 및 분석 역량, \n팀을 이끌 수 있는 리더십 역량, 서로 다른 문화를 이해하고 차이를 수\n용할 수 있는 역량 등이 핵심역량이라고 할 수 있습니다. \n-  GBT학부의 수업에서도 이러한 역량을 집중적으로 가르치고 있으며 \n스스로 상당한 역량을 갖춘 학생들은 수업에 더욱 흥미를 느낄 수 있\n으며 더욱 크게 성장할 것입니다. \n우리 학과(부)·전공 매력 \n-  모든 교수님이 참여하여 전공을 소개하는 GBT Special Lecture 과\n목 운영\n-  학생들이 중심이 되는 마케팅학회, 데이터분석학회 등 전공 관련 학\n회 운영', '[글로벌]2025-1학기 폐강(2차) 공고(글로벌캠퍼스)\n\n[글로벌]2025-1학기 폐강(2차) 공고(글로벌캠퍼스)\n\n2025-1 학기 폐강 (2 차 ) 공고 ( 글로벌캠퍼스 )\n\n2025-1 학기 글로벌캠퍼스 폐강 (2 차 ) 강좌를 아래와 같이 공고 합니다 .\n\n폐강 강좌를 수강신청한 학생은 아래와 같이 해당 기한 내에 수강신청을 변경 하기 바랍니다 .\n\n- 아 래 -\n\n■ 폐강강좌 수강생 수강신청 변경\n\n1. 변경 기간 : 2025. 3. 14.( 금 ) ~ 3. 18.( 화 ) 오후 4:00 까지 ( 이메일 발송 기한엄수 )\n\n( ※ 3.\xa018.( 화 ) 오후 4 시까지 수신된 이메일에 한하여 접수하오니 기한 내 이메일 발송 )\n\n2. 작성양식 : 이 공지의 첨부 파일 (‘ 폐강과목 대체 수강 신청서 ’) 작성\n\n3. 제 출 처 : 본인 1 전공 소속 단과대학 교학파트 ( 학사종합지원센터 ) 이메일 제출\n\n단과대학 구분\n\n전화번호\n\n(031-330- 내선 )\n\n담당자 이메일\n\n사무실 위치\n\n인문대학, 통번역대학, 융합인재대학\n\n내선 4077\n\nhaksa4077@hufs.ac.kr\n\n학생회관 109 호\n\n국가전략언어대학, 국제지역대학, 자유전공학부\n\n내선 4457\n\nlsh0613@hufs.ac.kr\n\n공과대학, 자연과학대학, 바이오메디컬공학부\n\n내선 4073\n\nyyj1730@hufs.ac.kr\n\n교직, 경상대학, Culture&Technology융합대학, 기후변화융합학부, AI융합대학\n\n내선 4953\n\nminsun@hufs.ac.kr\n\n※ 수강과목 이수구분 ( 전공 , 교양 등 ) 상관 없이 본인 1 전공 소속 단과대학 교학 파트 이메일 제출\n\n4. 유의 사항\n\n가 . 폐강된 과목수와 동일한 과목수 만큼 수강신청 변경 가능 ( 단 , 최대수강신청 학점 초과 불가 )\n\n나 . 수강신청 변경 시점 기준으로 제한인원을 초과하지 않는 과목으로 변경 가능 수강 가능 강좌 확인 ☞ 강의시간표 조회 ( 클릭 )\n\n다 . 폐강 강좌를 수강하지 않은 학생은 이 기간에 수강신청 변경을 할 수 없음', '## [heading1] ##\n# 다. 교직과목 : 수강편람 교직과정 항목 참조\n\n## [paragraph] ##\n라. 논술교육자격인증제(2007학년도 제1학기부터 시행)\n\n## [list] ##\n- 1) 철학과 전공 및 철학 부전공 과정에서 실시하며, 논술교육자격 인증과목을 수강하여\n- 총 24학점 이상을 이수하고, 과목별 성적이 ‘B0 이상’이어야 하며, 졸업논문 심사를\n- 통과하여야 함\n- 2) 철학과 학생은 졸업논문으로 대체하고, 철학 부전공 및 타 전공 학생은 철학과 졸업\n- 논문에 준하는 논문을 철학과 사무실에 제출하여 반드시 심사를 받아야 함\n- 3) 논술교육자격인증 과정은 철학 부전공(21학점 이수)과 별개 과정으로, 논술교육자격인증을\n- 위해서는 반드시 해당 인증과목을 추가로 이수하여 총 24학점 이상을 이수하여야 함\n- 4) 인증 교과목은 강의시간표 비고란에 ‘논술교육자격인증 과목’으로 표시됨\n- 5) 소정의 인증학점과 졸업논문을 통과한 학생들에게는 총장 명의 ‘논술교육자격 인증서’\n- (졸업논문 명칭 병기)를 발급함\n- 6) 인증과목은 아래와 같으며, 총 4개 영역에서 빠짐없이 수강하여 총 24학점 이상을\n- 이수하여야 함\n\n## [paragraph] ##\n※ 논술교육자격인증 교과목', '매년 「In vivo」발간\n-  로테이션: 각 실험실에서 일정 기간 동안 실험에 참여하면서 연구 경\n험을 쌓는 활동\n슬기로운 대학생활 \n1학년  기초교양 위주로 수업을 듣고, 일반 생물학을 수강하게 됩니다. 일\n반 화학, 일반 물리, 대학 수학 등 과학과 수학 전반에 대한 책을 많\n이 읽고 영어 능력을 키우면 전공 공부에 크게 도움이 됩니다. \n2학년  본격적으로 전공 수업을 듣게 됩니다. 이론과 실험 수업을 수강하여 \n실험 데이터를 직접 만들어내고 분석하는 과정도 익히게 됩니다.\n3학년  생명공학에 관련된 다양한 전공심화 과목들을 수강하며 깊이 있\n는 탐구를 수행합니다. 실험실 로테이션을 통해 심도 깊은 연구\n를 수행하기도 합니다. \n4학년  생명공학 실험 및 리뷰 연구를 통해 논문을 작성하고 발표함으로\n써 생명공학 연구를 경험하게 됩니다. \n졸업 후 진로 \n1.취업: 학사급 연구원: 기업 및 국가 기관 연구소\n2.진학/연구\n- 대학원 석, 박사 및 석.박 통합과정 진학 또는 해외 대학원 진학\n-  석사 및 박사 학위 취득 후 각각 석사급, 박사급 연구원: 기업, 학교 및 \n국가 기관 연구소\n3.바이오벤처 창업\nQ&A \nQ1. 생명공학과에 입학하려면 영어를 잘해야 하나요?\nA1.  생명공학과 대부분의 수업은 원서로 진행되며, 관련 전문 용어는 영\n어로 배워야 하므로 수업 내용을 잘 이해하기 위해서는 영어 실력이 \n뒷받침되어야 합니다.\nQ2. 생명공학과 졸업 후 취업은 잘 되나요?\nA2.  최근 코로나19 이후 바이오 연구 인력의 중요성은 점점 증가하고 있\n습니다. 생명공학과 졸업 후 제약, 바이오산업과 관련된 다양한 기\n업들에서 일할 수 있습니다.', '6968\n전공소개 \n기후변화융합학부는 기후변화 대응 패러다임 변화에 대응할 수 있는 교\n육과정을 마련하고 국내외 유관기관과의 협력강화를 통해 기후변화 관\n련 전문지식을 갖춘 인재양성을 도모하고자 신설되었습니다. 이를 위해 \n에너지와 기후변화 정책 및 관련 국제협력 분야에서 기후변화 대응산업\n과 연구를 선도할 융합인력 양성이 목표이며 기후감시 및 예측, 기후변\n화 정책, 온실가스 및 에너지 관리 3개 트랙으로 교육과정을 운영할 예\n정입니다. 이와 같은 교육과정에 따라 사회과학적 소양과 자연과학/공\n학과의 융복합적인 교육을 통해 과학 및 정책을 포함한 미래의 기후변\n화 관련 업무를 국제사회에서 선도할 수 있는 거시적 안목을 갖춘 글로\n벌 융합 인재를 배출하고자 합니다.\n필요역량 및 소양 \n-  과학적 기후변화 및 에너지시스템 관리 분야의 기초 및 심화 교육을 통\n한 자연과학/공학형 인재를 양성합니다.\n-  배출권거래제도, 탄소배출 정책 및 기후변화 대응에 대한 실무 능력을 \n갖춘 사회과학적 인재를 양성합니다.\n-  자연과학/공학형 능력과 사회과학적 능력을 갖춰 기후 변화 문제를 \n적극적으로 해결할 수 있는 창의성과 응용력을 갖춘 융합 인재를 양\n성합니다.\n-  기후변화에 대한 지역학 및 국제 정세에 대한 높은 이해도를 가짐으\n로써 탄소중립 시대를 선도하는 아래와 같은 능력을 가진 융합 인재 \n를 양성합니다.\n-  1) 기후변화 이해 역량\n-  2) 환경정책 기획 역량 \n-  3) 온실가스 및 환경 기기분석 분석 역량 \n-  4) 에너지 시장 분석 역량 \n-  5) 기후경제학 이해 역량 \n-  6) ESG 경영 기획 역량\n우리 학과(부)·전공 매력 \n-  우리학교의 강점인 국제 지역학 및 어학을 특화시킨 전문가를 양성하\n여 국제기구와 같은 글로벌 무대에서 활약할 수 있도록 양성합니다. \n자연과학에 대한 이해도와 기후변화 정책 및 시장 동향에 대한 지식과 \n경험을 갖춘 행정가를 배출하여 국내 정책 및 해외 외교 대응에 중추\n적인 역할을 기대할 수 있습니다.\n-  정확하고 정밀한 온실가스 측정 및 배출량 산정에 대한 능력을 갖춘 과\n학자를 배출함으로써, 국제사회에서 탄소외교의 신뢰성을 확보할 수 \n있을 것으로 기대합니다. \n-  기후변화 관련 국제적 수준의 연구경험을 쌓을 수 있는 기회를 제공\n합니다.\n-  대기환경기사 또는 온실가스 관리기사 자격증을 취득할 수 있는 커리\n큘럼으로 구성되어 있습니다.\n주요 전공과목', '[공통] 2025-1학기 군 복무 중 원격수업 학점인정 안내문\n\n나 . 수강기간 중에는 반드시 나라사랑포털의 군 e- 러닝 공지사항과 메일 수시 확인\n\n10. 상담 및 문의사항\n\n가 . 나라사랑포털 군 -e 러닝 문의 : www.narasarang.or.kr 군인공제회 C&C 군 e- 러닝 담당\n\n나 . 군 복무 중 학점인정 제도 관련 문의 : 소속캠퍼스 학사종합지원센터 이메일 문의\n\n( 서울 )haksa-seoul@hufs.ac.kr / ( 글로벌 )andy@hufs.ac.kr\n\n붙임 : ( 군인공제회 C&C) 군 복무 중 학점취득 수강신청 안내 (PC, 모바일 ) 각 1 부\n\n2025. 2.\n\n교무처장\n\n| 0 |\n|:-----------------------------------------------|\n| 2025-1학기\xa0⌜군 복무 중 원격수업 학점인정⌟\xa0안내 |', '(공통)2025-1학기 부전공 신청 및 이중/부전공 취소 일정 공고\n\n(공통)2025-1학기 부전공 신청 및 이중/부전공 취소 일정 공고\n\n2025 학년도 제 1 학기 부전공 신청 및 이중 / 부전공 취소 일정을 아래와 같이 공고합니다 .\n\n- 아 래 -\n\n1. 신청 대상 : (2025-1 학기 기준 ) 2 학기 ~ 7 학기 재학생 및 휴학생 중\n\n가 . 부전공 희망자 : 일반 부전공 또는 전공심화 + 부전공 신청\n\n( 전공심화 + 부전공 신청자는 1 전공의 졸업이수학점 늘어남 . 반드시 확인할 것 )\n\n나 . 이중 / 부전공 취소 희망자 ( 단일전공 희망자 ) : 이중 / 부전공을 취소하고 전공심화 이수\n\n※ 단 , 8 학기 이상인 학생 은 이중 ( 부 ) 전공 변경 신청서 ( 첨부파일 ) 를 작성하여\n\n학사종합지원센터 단과대학 교학과 이메일 또는 방문 신청\n\n▶ ( 서울 ) 제출처 안내 바로가기\n\n▶ ( 글로벌 ) hufsdbl@hufs.ac.kr 로 이메일 제출\n\n2. 일 정\n\n가 . 신청 기간 : 2025 년 1 월 22 일 ( 수 ) 10 시 ~ 1 월 23 일 ( 목 ) 14 시\n\n※ 안내된 기간에만 운영하므로 일정 준수할 것 ( 이후 별도 운영 계획 없음 )\n\n나 . 결과 확인 : 2025 년 1 월 24 일 ( 금 ) 14 시 , 종합정보시스템\n\n3. 신청 방법 : 종합정보시스템 → 전공 / 교직관리 ( ※ 가 . / 나 . 중 하나의 방법으로 신청 )\n\n가 . 부전공 신청 : 전공심화 + 부전공 또는 부전공 신청\n\n1) 신청 시 기존에 이수 중인 이중 / 부전공 은 자동 취소 됨 ( ※ 별도 취소 절차 없음 )\n\n2) “4. 유의 사항 ” 의 다 . 참고 하여 부전공 신청으로 인한 이수구분 변경 신청\n\n※ 이번 학기 졸업예정자 (4 학년 수료 , 졸업대기 포함 ) 는 1 월 초 까지\n\n이수구분 변경을 신청하여 졸업 학점이 누락되는 일이 없도록 해야 함\n\n나 . 이중 / 부전공 취소 ( 단일전공 희망자 ) : 이중전공 / 부전공 취소 신청\n\n1) 이중 / 부전공을 취소하는 경우 1 전공을 심화로 필수 이수 해야 함', '해결하세요. 처음에는 힘들고 오랜 시간이 걸리겠지만, 이러한 어려\n움 통과해야 성장하고 시대가 요구하는 인재가 되는 것입니다.\n3.  산책 등 스스로 생각하는 습관을 만들고 동시에 글쓰기 실력을 기르\n세요. 한편, ChatGPT에게 다양한 질문과 요구를 연습하는 것도 논리\n적으로 생각을 정리하여 표현하는 능력을 기르는 좋은 방법입니다.\n졸업 후 진로 \n수학과 졸업생의 진로를 아래와 같이 크게 세 분야로 나눌 수 있습니다. \n우리 수학과는 항상 시대의 요구를 살펴 학생들이 사회에서 제 몫을 다 \n할 수 있도록 최선을 다해 노력하고 있습니다.\n-   IT 분야: 프로그램 개발자, data engineer, MLOps, data analysis \n수학과 졸업생들은 논리를 전개할 수 있는 능력과 사고력으로 높은 \n수준의 프로그래밍에 강합니다. 우리 과에는 수치해석을 전공하신 교\n수님뿐만 아니라 컴퓨터공학에 전문성을 가지신 교수님도 계셔서 IT \n분야에 진출을 원하는 학생들에게 수준 높은 교육이 가능합니다.\n-  금융 분야: 은행, 증권사, 보험계리사 \n우리 학과에는 금융 수학을 전공하신 두 분의 교수님이 계십니다. 관\n련 학회의 회장을 하시는 등 학계에서 중추적인 역할을 하실 뿐만 아\n니라 다양한 활동을 활발히 하고 계십니다. 그래서 졸업생들이 은행, \n증권사에서 혹은 보험계리사 등으로 왕성하게 활동 중입니다.\n-  교육과 연구 분야: 중-고등학교 교사, 교수 \n평균으로 볼 때 우리 학과는 최근 10년간 임용시험 합격자를 꾸준하\n게 배출하고 있습니다. 또한 미국 명문대학교에서 교수로 활동하고 \n있는 졸업생도 있는 등 교육 분야에서 졸업생들의 활동이 괄목할 만\n합니다. 수학이라는 전공 특성으로 출판 등 다양한 교육계에서 활동\n하는 졸업생들도 많습니다.\nQ&A \nQ1.  수학과를 졸업하면, 진로 선택이 교육과 연구 분야로 제한되나요?\nA1.   수학과 졸업생의 장점은 엄밀한 논리 전개와 사고의 자유로움입니\n다. 기술의 발달로 다양한 분야의 많은 직무가 자동화되어 수준 높\n은 사고를 할 수 있는 인재가 시대의 요구입니다. 이러한 면에서 수\n학과 졸업생은 IT분야뿐 아니라 금융권 등 다양한 분야에 진출하고 \n있습니다. 또한 우리 학과는 졸업생들이 많이 진출하는 금융과 IT \n분야에 맞춤형 커리쿨럼을 제공하고 있습니다.\nQ2. 수학과의 전공 수학은 고등학교 수학과 다른가요?', '해를 바탕으로 다양한 분야에 응용될 수 있습니다. 인간의 건강에 직결되\n는 의약학 분야(Red Biotech), 산업적 소재를 생산하는 공학분야(White \nBiotech), 유용 식물을 연구하는 농업 분야(Green Biotech), 그리고 해양\n자원분야(Blue Biotech)가 대표적인 예입니다. 지난 20여 년간 IT가 인류\n의 삶을 혁신했다면, 향후에는 BT(Bio Technology)가 그 주인공이 될 것이\n라는 게 미래학자들의 예측입니다. 우리 학과에서는 생명공학에 대한 시대\n적 요구에 부응하는 인재 양성을 위해 수준 높은 강의와 교과과정을 운영 \n중입니다. 고가의 첨단장비를 완비해 학부생이 직접 연구에 참여하는 기회\n도 확대하고 있습니다. 생명공학은 기본적으로 생명과학 지식에 기반을 둔 \n학문입니다. 이에 생명과학자로서 갖춰야 할 소양인 ‘논리적 사고’와 ‘현상\n에 대한 비판적 관찰 능력‘이 반드시 요구됩니다. 또한, 이를 이용해 BT 산\n업 발전에 기여할 도전정신도 필요합니다. 학생들은 향후에 전공 과정에서 \n생물학지식 전반을 완벽히 습득과 함께 연관 과학 분야들을 통합하여 이해\n하게 될 것입니다. 또한 교과서와 전공 논문을 읽을 수 있는 영어 실력의 배\n양도 빼놓을 수 없습니다. 이러한 통합적 교육을 통해 국제화된 과학 인재\n로 거듭나는 데 필요한 소양과 자기 주도적 역량을 강화하게 될 것입니다.\n필요역량 및 소양 \n생명 현상에 대한 호기심과 논리적 사고를 갖출 수 있으면 좋습니다. 특\n히, 물리, 화학, 수학과 같은 기초 과학에 대한 이해도가 높을수록 생명 \n현상과 그 기저에 있는 원리를 이해하고 응용하는 데 도움이 됩니다. \n아울러, 글을 잘 쓰고 이해하는 능력이 있다면 교재를 읽고 이해하고 \n그를 바탕으로 과학적 가설을 세워 증명하는 과정을 이해할 수 있습니\n다. 마지막으로, 영어 독해력을 기르면 유수의 우수한 논문들을 읽고 이\n를 통해 연구자의 첫걸음을 내디딜 수 있는 힘을 기를 수 있게 됩니다. \n우리 학과(부)·전공 매력 \n-  논리적사고 + 비판적 관찰력 + 도전적 정신 함양\n-  학부생의 다양한 연구 참여기회\n-  미래 생명과학 인재를 위한 소양과 역량 강화\n-  국제적 혁신 연구를 수행할 생명공학 전문가 양성\n주요 실적 \n-  과학기술정보통신부, 보건복지부 등 정부 주요 기관 지원을 받는 다\n양한 연구 과제 수행\n-  바이오융합센터 운영\n-  다수의 바이오벤처 창업']","정보통신공학과에서는 졸업시험 대신 졸업논문을 선택할 수 있습니다. 졸업논문을 작성할 경우, 기계학습 관련 주제로 연구를 진행할 수 있습니다. 

기계학습 관련 상담을 원하신다면, 다음 교수님들께 문의하시면 됩니다:

1. **최재걸 교수님**  
   - 이메일: jaekeol.choi@hufs.ac.kr  
   - 연구실: 교수연구동 402호 (어문관 뒷편)  
   - 연구 분야: 자연어처리, 정보검색

2. **장원제 교수님**  
   - 이메일: wonje@hufs.ac.kr  
   - 연구실: 교수연구동 308호 (어문관 뒷편)  
   - 연구 분야: 컴퓨터비전, 스마트 모빌리티 시스템, 로보틱스

이 교수님들께 이메일로 문의하시면 기계학습 관련 논문 주제에 대한 상담을 받을 수 있습니다. 혹시 더 도와드릴까요?",정보통신공학과는 졸업시험과 졸업논문 중 한 가지를 선택할 수 있습니다. 기계학습 관련 지도 교수는 전자공학과 이정훈 교수님(tantheta@hufs.ac.kr)께 요청 가능합니다.,0.52809914486033,0.5,,0.8503699511114374
종합설계 보강일 언제야?,"['제1학기 보강주간 일정:\n2025-06-09 (월요일)\n2025-06-10 (화요일)\n2025-06-11 (수요일)\n2025-06-12 (목요일)\n2025-06-13 (금요일)', '제2학기 보강주간 일정:\n2025-12-08 (월요일)\n2025-12-09 (화요일)\n2025-12-10 (수요일)\n2025-12-11 (목요일)\n2025-12-12 (금요일)', '대체휴업일 일정:\n2025-05-06 (화요일)\n2025-10-08 (수요일)', '근로자의 날 일정:\n2025-05-01 (목요일)', '광복절 일정:\n2025-08-15 (금요일)', '제1학기 개강 대체휴업일 일정:\n2025-03-03 (월요일)', '어린날부처님오신날 일정:\n2025-05-05 (월요일)', '[공통] 휴·보강 공고(공휴일)\n\n[공통] 휴·보강 공고(공휴일)\n\n휴·보강 공고\n\n아래와 같이 휴 · 보강함을 공고함 .\n\n- 아\xa0 래 -\n\n휴강일\n\n보강일\n\n3. 3.(월 ) /\xa0삼일절 대체휴일\n\n2025. 6.\xa09.(월 )\n\n5.\xa05.(월 ) /\xa0어린이날\n\n2025.\xa06. 11.(수 )\n\n5. 6.( 화 ) /\xa0부처님오신날 대체휴일\n\n2025.\xa06.\xa010.( 화 )\n\n6.\xa06.(금 ) /\xa0현충일\n\n2025.\xa06. 13.( 금 )\n\n개인사정으로 인한 휴강\n\n2025. 6. 12.(목)\n\n※ 공휴일로 인한 휴강 및 개인사정으로 인한 휴강에 대한 보강은 보강주간 (2025. 6.\xa09.( 월 ) ~\xa06. 13.( 금 )) 에 실시해야 함 .\n\n2025. 1. 9.\n\n서울 · 글로벌캠퍼스 교무처장\n\n| 0 | 1 |\n|:----------------------------------|:-----------------|\n| 휴강일 | 보강일 |\n| 3. 3.(월) /\xa0삼일절 대체휴일 | 2025. 6.\xa09.(월) |\n| 5.\xa05.(월) /\xa0어린이날 | 2025.\xa06. 11.(수) |\n| 5. 6.(화) /\xa0부처님오신날 대체휴일 | 2025.\xa06.\xa010.(화) |\n| 6.\xa06.(금) /\xa0현충일 | 2025.\xa06. 13.(금) |\n| 개인사정으로 인한 휴강 | 2025. 6. 12.(목) |', '[공통] 휴·보강 공고(공휴일)\n\n[공통] 휴·보강 공고(공휴일)\n\n휴·보강 공고\n\n아래와 같이 휴 · 보강함을 공고함 .\n\n- 아\xa0 래 -\n\n휴강일\n\n보강일\n\n3. 3.(월 ) /\xa0삼일절 대체휴일\n\n2025. 6.\xa09.(월 )\n\n5.\xa05.(월 ) /\xa0어린이날\n\n2025.\xa06. 11.(수 )\n\n5. 6.( 화 ) /\xa0부처님오신날 대체휴일\n\n2025.\xa06.\xa010.( 화 )\n\n6.\xa06.(금 ) /\xa0현충일\n\n2025.\xa06. 13.( 금 )\n\n개인사정으로 인한 휴강\n\n2025. 6. 12.(목)\n\n※ 공휴일로 인한 휴강 및 개인사정으로 인한 휴강에 대한 보강은 보강주간 (2025. 6.\xa09.( 월 ) ~\xa06. 13.( 금 )) 에 실시해야 함 .\n\n2025. 1. 9.\n\n서울 · 글로벌캠퍼스 교무처장', '[종합설계] 4학년 대상 / 교수: 고석훈 / 월요일 7,8,9교시 / 강의실 0515호 / 학점: 3 / 전공필수 과목 아님 / 온라인강의 아님 / P/F 평가 과목 아님 / 원어강의 아님', '이후부터 확인 가능 편입생 – 2월 22일(토) 이후부터 확인 가능 바로가기 Click▶ 강의시간표·강의계획서 핫링크 강의시간표 Click▶ 수강편람 핫링크 수강편람(서울) Click▶ 수강편람(글로벌) Click▶ 전공 교육과정 안내 종합정보 시스템 종합정보시스템 로그인 →\xa0학과(부) 교육과정 안내도\xa0메뉴 ※ 각 전공의 전체교과목 및 최근 개설된 강좌 정보 확인 가능 예비수강신청함 바로가기 핫링크 바로가기 Click▶ 수강신청 바로가기 핫링크 ※ 수강신청\xa0당일 학교 홈페이지에 바로가기 안내됨 ★ 사용법 모의 동영상 예비수강신청함 모의 동영상 Click▶ 수강신청 모의 동영상 Click▶ 종합정보시스템 바로가기 Click▶ ☎ 학과사무실 연락처 (강좌별 “비고”란 수강생 안내 및 기타 문의) 바로가기 Click▶ 2025. 2. 교무처장 | 정보없음 | 정보없음 | 정보없음 | 정보없음 |', '바. 2023-1학기부터 종합정보시스템에서 “ 전공 교육과정 안내 ”를 운영(※ 붙임3 참조) 하오니 참고 바람\n\n구분\n\n일정 및 안내사항\n\n강의시간표·강의계획서\n\n핫링크\n\n상시 조회 가능\n\n강의시간표 Click▶\n\n수강편람 열람\n\n핫링크\n\n1월 말 게시 예정\n\n수강편람\n\n서울 Click▶\n\n글로벌 Click▶\n\n수강유의교과목\n\n서울 Click▶\n\n글로벌 Click▶\n\n전공 교육과정 안내\n\n종합정보\n\n시스템\n\n종합정보시스템 로그인 → 학과(부) 교육과정 안내도 메뉴\n\n※ 각 전공의 전체교과목 및 최근 개설된 강좌 정보 확인 가능\n\n★ 예비수강신청함\n\n모의 동영상 Click▶\n\n핫링크\n\n1. 23.(목) (시간미정) ~ 수강신청 변경 종료시까지\n\n※ 수강희망과목 최대 15강좌 등록 가능\n\n★ 수강신청\n\n모의 동영상 Click▶\n\n핫링크\n\n수강학년\n\n※2025-1학기 등록횟수 기준\n\n(단, 편입생은 학년 기준)\n\n일정\n\n이용시간\n\n재\n\n학\n\n생\n\n4학년\n\n(등록 7회 이상)', '개천절 일정:\n2025-10-03 (금요일)', '## [paragraph] ##\n(6) 이수요건 : 총 42학점 이수 및 트랙별 이수요건 충족 필수\n\n## [table] ##\n| 트랙 | 졸업요건 |\n| --- | --- |\n| Software & AI | ① 트랙 필수과목 수강 ②  트랙(공통과목 포함)에서 트랙 필수 과목을 포함한 30학점 이상 이수 ③ 졸업논문 통과 - 졸업논문은 <종합설계> 과목(필수)을 이수한 후 다음 학기에 작성 제출함 - 단, 8학기 이상 등록생으로서 부득이한 사유가 인정된 경우, 주임교수의 승인을 얻어 종합설계 수강과 졸업논문 작성을 병행할 수 있음. |\n| Language & AI | ① 트랙 필수과목 수강 ②  트랙(공통과목 포함)에서 트랙 필수 과목을 포함한 33학점 이상 이수, 언어학기초과목(*) 2학점 또는 3학점 이수 ③ 졸업시험 통과 * 언어학기초 과목은 언어 계열 학과에 개설된 언어학 개론 성격의 교과목임 (예 : 영어학개론, 불어학개론, 독어학개론, 언어학입문 등) - 상세 내용은 수강편람 또는 전공 홈페이지 참조 |\n| Business & AI | ① 트랙 필수과목 수강 ②  트랙에서 공통과목, 필수과목을 제외하고 18학점 이상 이수 |\n\n## [heading1] ##\n# (7) 문의처 : AI융합전공(\uf000 http://ai.hufs.ac.kr)\n\n## [table] ##\n| 트랙 | 문의처 |\n| --- | --- |\n| AI융합전공 공통과정 | AI융합전공 사무실 (☎ 02-2173-2643 / Email: aic@hufs.ac.kr) |\n| Software & AI | 컴퓨터공학부 (☎ 031-330-4268 / Email: ces@hufs.ac.kr) |\n| Language & AI | 언어공학연구소 (☎ 02-2173-2872 / Email: langai@hufs.ac.kr) |\n| Business & AI | AI융합전공 사무실 (☎ 02-2173-2643 / Email: bizai@hufs.ac.kr) |\n\n## [footer] ##\n- 59 -', '| 통계학과 | 통계적기계학습및실습 | 소프트웨어 및 데이터 분석 : 기계학습군(택1) |\n| 컴퓨터.전자시스템공학전공/컴퓨터공학전공 | 데이터베이스 | 소프트웨어 및 데이터 분석 |\n| 컴퓨터.전자시스템공학전공/컴퓨터공학전공 | 운영체제 | 소프트웨어 및 데이터 분석 |\n| 컴퓨터공학전공 | 자연어처리 | 소프트웨어 및 데이터 분석 |\n| 컴퓨터공학전공 | 컴퓨터비전 | 소프트웨어 및 데이터 분석 |\n| 컴퓨터공학전공 | 소셜네트워크분석 | 소프트웨어 및 데이터 분석 |\n| 컴퓨터공학전공 | 딥러닝 | 소프트웨어 및 데이터 분석 |\n| 컴퓨터공학전공 | 컴퓨터보안 | 소프트웨어 및 데이터 분석 |', '| 4 | 1 | J04406 | 공연예술매니지먼트 | 선택 | 2/2 | 세계문화예술경영 |\n| 4 | 1 | J04401 | 공연기획과프로덕션 | 선택 | 2/2 | 세계문화예술경영 |\n| 4 | 1 | J04404 | 박물관경영및행정 | 선택 | 3/3 | 세계문화예술경영 |\n| 4 | 1 | J04013 | 세계영화와디지털테크놀로지 | 선택 | 2/2 | 세계문화예술경영 |\n| 4 | 2 | J04011 | 논문세미나와토론 | 선택 | 2/2 | 세계문화예술경영 |\n| 4 | 2 | J04402 | 박물관전시교육및보존 | 선택 | 3/3 | 세계문화예술경영 |\n| 4 | 2 | J04408 | 세계영화정책과산업 | 선택 | 3/3 | 세계문화예술경영 |', '## [paragraph] ##\n4) 졸업 요건 : 졸업 시험 및 논문 중 택일(지도교수가 배정 졸업 논문 지도)\n\n## [list] ##\n- 5) 문의처 : wacihufs@hufs.ac.kr(홈페이지 : wacimajor.hufs.ac.kr)\n\n## [footer] ##\n- 50 -', '## [heading1] ##\n# ⑦ 디지털인문한국학전공(서울캠퍼스에서 수강)\n\n## [heading1] ##\n# ※ 신규신청 불가\n\n## [paragraph] ##\n1) 한국의 인문학적 전통과 문화에 대한 심층적 지식을 바탕으로 디지털 매체를 활용한 해외\n송출과 쌍방향 소통이 가능한 지식통합형 인재를 길러내기 위한 융합전공으로 한국의 언어/\n문학, 사상, 역사에 대한 인문지식을 균형 있게 학습하고 이를 디지털 테크놀로지를 활용하\n여 콘텐츠화 하는 방법론을 습득함\n\n## [heading1] ##\n# 2) 이수학점 및 이수영역\n\n## [table] ##\n| 구분 | 이수학점 | 이수영역 |\n| --- | --- | --- |\n| 2014 학번까지 | 54학점 | 공통기초 6학점 + 연계기초 6학점 + 전공교과 42학점 |\n| 2015 학번부터 | 42학점 | 공통기초 6학점 + 연계기초 6학점 + 전공교과 30학점 |', '## [list] ##\n- - 공통기초 과목(6개 과목, 과목당 3학점) : 디지털인문학 입문, 인문한국학 입문(이상\n- 디지털인문한국학 과목), 언어와 논리, 인지과학 입문(이상 언어와 공학 과목),\n- 문화예술 경영론, 미디어연구 방법론(이상 세계문화예술경영 과목)\n- - 연계기초 과목 (과목당 3학점) : 한국철학사 (철학과), [한국사입문(사학과), 문화사와\n- 이문화이해(사학과), 한국문화사(사학 부전공), 한국근세사(사학 부전공) 중 택1], KFL\n- 문법(언어인지과학과), 인문지식위키(지식콘텐츠학부) 또는 디지털시대의텍스트와지식\n- (문화콘텐츠학융합전공), 한국현대사회와문학, 한국근대사(이상 한국학과 과목), 기록\n- 의조직화와정보-문화 서비스(정보기록문화유산관리학전공), 컴퓨터프로그래밍(융복합\n- 소프트웨어전공) 또는 언어분석을 위한 프로그래밍(언어와공학전공)\n- 기타 연계기초과목과 유사과목으로 주임교수가 인정한 과목\n- - 전공교과 과목 (과목당 3학점) : 한국사상과 철학, 한국사회와 역사, 한국어와 문화,\n- 디지털한국학과 한국문화 탐방, 인문콘텐츠와 시맨틱 웹, 한국기록문화와 디지털화,\n- 한국문학과 스토리텔링, 디지털한국어 문법, 한국학콘텐츠와 시각적 활용, 한국학\n- 아카이빙과 지식맵, 디지털한국학과 데이터베이스, 한국의 미와 디지털화, 한국학교육\n- 방법론, 한국학 자료 기록관리와 빅데이터, 디지털인문한국학콘텐츠와 한국사상, 공공\n- 데이터 서비스와 문화정책 연구, 한국학과 CDN, 한국학 이러닝 방법론\n- - 공통기초 과목과 연계기초 과목은 서울캠퍼스와 글로벌캠퍼스에서 개설되며(일부는\n- 대체과목으로 지정), 전공교과 과목은 서울캠퍼스에서만 개설됨\n- - 공통기초, 연계기초 과목 타학과(전공)에서 수강 시 유의사항 : 수강신청 후 학사종합\n- 지원센터 단과대학 교학파트(본인 1전공 소속 기준)에 방문하여 ‘이수구분변경신청서’를\n- 작성하여야 이중전공 학점으로 처리됨', '## [list] ##\n- 3) 졸업 요건 : 졸업논문 심사(지도교수가 배정되어 졸업 논문을 지도함.)\n- 4) 문의처 : 031-330-4488~92\n\n## [footer] ##\n- 51 -', '## [heading1] ##\n# ⑧ 데이터사이언스전공\n\n## [heading1] ##\n# ※ 신규신청 불가\n\n## [paragraph] ##\n1) 개요 및 교육목표\n\n## [paragraph] ##\n-\n\n## [paragraph] ##\n데이터과학은 데이터로부터 지식과 통찰을 뽑아내는 과학적 방법론을 연구하는 학문이며,\n최근 관심을 모으는 인공지능 구현의 ‘핵심 기반 학문’이다. 고도의 인공지능 학습을\n위해서는 데이터를 재료로 분석, 가공, 정제, 모델링하는 과정이 필수적인데, 이러한\n일련의 과정은 데이터과학에 그 이론적 바탕을 두고 있다. 최근 데이터과학자, 데이터\n개발자, 데이터분석가 등의 인력 수요가 급격히 증가하고 있으며, 특히 통계학, 산업경영,\n컴퓨터공학 등의 전문지식과 분야별 도메인 지식을 결합한 통합적‧실무형 데이터 과학자는\n전통적인 제조업과 IT산업은 물론, 금융‧통신‧의료‧공공 부문 등 다양한 산업분야에서\n활발히 활동할 것으로 기대된다.\n\n## [heading1] ##\n# 2) 선발 및 이수자격\n\n## [list] ##\n- - 글로벌캠퍼스에서 이중전공 또는 부전공으로 이수함 (정원 40명)\n- - 전공 구분 없이 지원가능하며, 성적순 선발을 원칙으로 함\n\n## [heading1] ##\n# 3) 이수학점 및 이수영역\n\n## [list] ##\n- - 총 이수학점 : 42학점 이상\n- - 영역별 이수학점\n\n## [list] ##\n- ‧ 기초 이론 : 12학점 이상\n- ‧ 소프트웨어 및 데이터분석 : 18학점 이상\n- ‧ 융합형 프로젝트 : 3학점 이상(캡스톤설계1, 2 중 한 과목 이상 수강)\n\n## [heading1] ##\n# 4) 교과 과정\n\n## [paragraph] ##\n총 이수학점 : 42학점\n\n## [paragraph] ##\n-', '## [list] ##\n- ‧ 기초 이론 : 12학점 이상\n- ‧ 소프트웨어 및 데이터분석 : 18학점 이상\n- ‧ 융합형 프로젝트 : 3학점 이상(캡스톤설계1, 2 중 한 과목 이상 수강)\n\n## [heading1] ##\n# 4) 교과 과정\n\n## [paragraph] ##\n총 이수학점 : 42학점\n\n## [paragraph] ##\n-\n\n## [table] ##\n| 학년 | 이수영역 | 1학기 | 2학기 |\n| --- | --- | --- | --- |\n| 1학년 | 교양 | 컴퓨팅사고 또는 컴퓨터프로그래밍 | 컴퓨팅사고 또는 컴퓨터프로그래밍 |\n| 2학년 | 기초 이론 | 데이터사이언스개론 데이터사이언스를위한수학군* (필수, 택1) | 기초확률및통계군* (필수, 택1) 회귀분석군* (필수, 택1) 확률분포론 |\n| 2학년 | 소프트웨어 및 데이터 분석 | 자료구조 (필수) | 알고리즘 |\n| 3학년 | 소프트웨어 및 데이터 분석 | 수리통계학 시계열분석 경영과학 웹프로그래밍 기계학습군* (필수, 택1) | 다변량자료분석 운영체제 데이터베이스 텍스트애널리틱스 |\n| 4학년 | 소프트웨어 및 데이터 분석 | 데이터시각화 딥러닝응용 | 데이터사이언스특론 |\n| 4학년 | 융합형 프로젝트 | 캡스톤설계1 | 캡스톤설계2 |\n\n## [footer] ##\n- 52 -', '## [heading1] ##\n# < 동일과목 군(괄호 안은 개설학과/학기) >\n\n## [list] ##\n- - 기초확률 및 통계군 : 통계학및연습2(통계/2), 확률과통계(컴전(컴공)/2), 기초확률및통계(산경/2)\n- - 데이터사이언스를 위한 수학군 : 통계행렬론(통계/1), 선형대수(컴공/2)\n- - 회귀분석군 : 공학통계(산경/1), 회귀분석(통계/2)\n- - 기계학습군 : 데이터마이닝및실습(통계/2), 데이터마이닝응용(산경/2), 기계학습(컴전(컴공)/2),\n- 통계적기계학습및실습(통계/1)\n- ※ 각 군 내의 교과목은 동일 교과목들로서 1개 과목을 선택하며 중복 수강은 허용되지 않음\n- (수강 학기는 자율 선택)\n\n## [list] ##\n- < 전공교류교과목 >\n- - 아래 목록의 교과목 수강 시 데이터사이언스전공의 전공이수학점으로 인정됨', '## [table] ##\n| 개설학과(전공) | 교과목명 | 이수영역 |\n| --- | --- | --- |\n| 통계학과 | 통계학및연습2 | 기초 이론 : 기초확률및통계군(택1) |\n| 컴퓨터.전자시스템공학전공/컴퓨터공학전공 | 확률과통계 | 기초 이론 : 기초확률및통계군(택1) |\n| 산업경영공학과 | 기초확률및통계 | 기초 이론 : 기초확률및통계군(택1) |\n| 통계학과 | 통계행렬론 | 기초 이론 : 데이터사이언스를위한수학군(택1) |\n| 컴퓨터.전자시스템공학전공/컴퓨터공학전공 | 선형대수 | 기초 이론 : 데이터사이언스를위한수학군(택1) |\n| 산업경영공학과 | 공학통계 | 기초 이론 - 회귀분석군(택1) |\n| 통계학과 | 회귀분석 | 기초 이론 - 회귀분석군(택1) |\n| 컴퓨터.전자시스템공학전공/컴퓨터공학전공 | 자료구조 | 소프트웨어 및 데이터 분석 |\n| 컴퓨터.전자시스템공학전공/컴퓨터공학전공 | 알고리즘 | 소프트웨어 및 데이터 분석 |\n| 컴퓨터.전자시스템공학전공/컴퓨터공학전공 | 웹프로그래밍 | 소프트웨어 및 데이터 분석 |\n| 통계학과 | 확률분포론 | 기초 이론 |\n| 통계학과 | 수리통계학 | 소프트웨어 및 데이터 분석 |\n| 통계학과 | 다변량분석및실습 | 소프트웨어 및 데이터 분석 |\n| 통계학과 | 데이터마이닝및실습 | 소프트웨어 및 데이터 분석 : 기계학습군(택1) |\n| 산업경영공학과 | 데이터마이닝응용 | 소프트웨어 및 데이터 분석 : 기계학습군(택1) |\n| 컴퓨터.전자시스템공학전공/컴퓨터공학전공 | 기계학습 | 소프트웨어 및 데이터 분석 : 기계학습군(택1) |\n| 통계학과 | 통계적기계학습및실습 | 소프트웨어 및 데이터 분석 : 기계학습군(택1) |\n| 컴퓨터.전자시스템공학전공/컴퓨터공학전공 | 데이터베이스 | 소프트웨어 및 데이터 분석 |\n| 컴퓨터.전자시스템공학전공/컴퓨터공학전공 | 운영체제 | 소프트웨어 및 데이터 분석 |\n| 컴퓨터공학전공 | 자연어처리 | 소프트웨어 및 데이터 분석 |', '## [footer] ##\n- 53 -', '## [heading1] ##\n# 3) 융합전공 전공교과 교과목 일람표', '## [table] ##\n| 개설학과(전공) | 교과목명 | 이수영역 |\n| --- | --- | --- |\n| 컴퓨터공학전공 | 컴퓨터보안 | 소프트웨어 및 데이터 분석 |\n| 산업경영공학과 | 텍스트어낼리틱스 | 소프트웨어 및 데이터 분석 |\n| 산업경영공학과 | 경영과학 | 소프트웨어 및 데이터 분석 |\n| 산업경영공학과 | 딥러닝응용 | 소프트웨어 및 데이터 분석 |\n| 산업경영공학과 | 데이터사이언스개론 | 소프트웨어 및 데이터 분석 |\n| 산업경영공학과 | 데이터사이언스응용 | 소프트웨어 및 데이터 분석 |\n| AI융합전공 | 자료구조 | 소프트웨어 및 데이터 분석 |\n| AI융합전공(SW&AI) | 알고리즘 | 소프트웨어 및 데이터 분석 |\n| AI융합전공(SW&AI) | 운영체제 | 소프트웨어 및 데이터 분석 |\n| AI융합전공(SW&AI) | 웹프로그래밍 | 소프트웨어 및 데이터 분석 |\n| AI융합전공(SW&AI) | 데이터베이스 | 소프트웨어 및 데이터 분석 |\n| AI융합전공(SW&AI) | 기계학습 | 소프트웨어 및 데이터 분석 |\n| 통계학과 | 데이터시각화 | 소프트웨어 및 데이터 분석 |\n| 통계학과 | 시계열분석및연습 | 소프트웨어 및 데이터 분석 |\n| 통계학과 | 베이지안통계학 | 소프트웨어 및 데이터 분석 |\n| 통계학과 | 데이터사이언스세미나 | 소프트웨어 및 데이터 분석 |\n| 통계학과 | 통계행렬론연습 | 통계행렬론을 수강해야 인정함 |\n| 통계학과 | 회귀분석연습 | 회귀분석을 수강해야 인정함 |\n| 통계학과 | 확률분포론연습 | 확률분포론을 수강해야 인정함 |\n| 통계학과 | 수리통계학연습 | 수리통계학을 수강해야 인정함 |\n\n## [heading1] ##\n# 5) 졸업 요건\n\n## [paragraph] ##\n- 졸업 과제 및 논문(전공 홈페이지에 게시)\n\n## [heading1] ##\n# 6) 문의처', '## [heading1] ##\n# 5) 졸업 요건\n\n## [paragraph] ##\n- 졸업 과제 및 논문(전공 홈페이지에 게시)\n\n## [heading1] ##\n# 6) 문의처\n\n## [list] ##\n- - 홈페이지 : ds.hufs.ac.kr / 이메일 : seokohj@hufs.ac.kr\n- - 전공주임 연구실 전화번호 : 031-330-4680\n\n## [footer] ##\n- 54 -', '## [heading1] ##\n# ⑨ 바이오데이터사이언스전공\n\n## [heading1] ##\n# ※ 신규신청 불가\n\n## [heading1] ##\n# 1) 개요 및 교육목표\n\n## [paragraph] ##\n- 헬스케어와 의료 빅데이터 분야의 고급 인력을 양성하는 프로그램으로 바이오데이터로부터\n지식과 인사이트를 뽑아내기 위해 사용하는 과학적 방법론을 교육함. 바이오메디컬공학과\n컴퓨터공학의 분야별 도메인 지식을 융합하는 학제 간 분야임.\n\n## [heading1] ##\n# 2) 이수학점 및 이수영역\n\n## [table] ##\n| 구분 | 이수학점 | 이수영역 |\n| --- | --- | --- |\n| 2015학번부터 | 42학점 | AI융합전공(A) 21학점 + 바이오메디컬공학(B) 21학점 + 컴퓨터공학부(C) 9학점 + 융합형(캡스톤설계 I, II) 교과목 6학점(필수) |\n\n## [heading1] ##\n# 3) 교과목 목록\n\n## [table] ##\n|  |  | 1학기 | 2학기 |\n| --- | --- | --- | --- |\n| 공통기초 | 공통기초 | 컴퓨팅사고(교양) | 컴퓨팅사고(교양) |\n| 전공 | 2학년 | 고급파이썬프로그래밍(A) 자료구조(C) | 자료구조(A) 확률과통계(A) 의학유전학 또는 의학유전학(의생명프로그래밍)(B) 선형대수(C) |\n| 전공 | 3학년 | 데이터사이언스(A) 생체신호계측기기설계및실습(B) 바이오메디컬인공지능(B) 생명정보학을위한 데이터마이닝(B) | 기계학습(A) 데이터베이스(A) 인공지능을 이용한 의료영상처리및실습 또는 의료영상처리의이론및실습(B) 의생명정보학(B) |\n| 전공 | 4학년 | 웹프로그래밍(A) 컴퓨터비전(C) 캡스톤설계 I(필수) | 정보시각화 또는 데이터시각화및실습(B) 캡스톤설계 II(필수) |\n\n## [paragraph] ##\n※ 각 교과목은 3학점/3시간으로 구성', '## [paragraph] ##\n※ 각 교과목은 3학점/3시간으로 구성\n\n## [list] ##\n- - 공통기초과목은 교양과목으로서 학생들은 컴퓨팅사고를 수강해야 함\n- - 전공 교과목은 AI융합전공 공통 및 Software&AI트랙(A), BME학부(B), 컴퓨터공학부\n- (C), 융합형 교과목(I, II) 영역으로 구성됨\n- - 자료구조는 1학기는 컴퓨터공학부, 2학기는 AI융합전공에서 선택(중복불가)\n- - 캡스톤설계 I은 AI융합전공 Software&AI 트랙 1학기에 개설하는 종합설계, BME전공\n- 1학기에 개설하는 BME캡스톤디자인실습, 컴퓨터공학전공에 매학기 개설하는 캡스톤\n- 설계 중에서 선택\n\n## [footer] ##\n- 55 -', '## [paragraph] ##\n- 전공 교과목은 AI융합전공 공통 및 Software&AI트랙 개설교과목이나, BME학부 개설\n교과목이나, 컴퓨터공학부의 개설 교과목을 이수함으로써 <바이오데이터사이언스>\n전공 학점을 충족시킬 수 있음.\n\n## [list] ##\n- ‧ AI융합전공 공통 및 Software&AI에서 개설되는 교과목(A)은 위에서 지정된 과목\n- 이외의 교과목은 지도교수의 승인에 의해 (A) 영역 교과목으로 인정받을 수 있음.\n- ‧ 바이오메디컬공학전공에서 개설되는 교과목(B)은 위에서 지정된 과목 교과목은 지도\n- 교수의 승인에 의해 (B) 영역 교과목으로 인정받을 수 있음.\n- ‧ 컴퓨터공학전공에서 개설되는 교과목(C)은 위에서 지정된 과목 이외의 교과목은\n- 지도교수의 승인에 의해 (C) 영역 교과목으로 인정받을 수 있음.\n\n## [paragraph] ##\n- ‘전공’ 인정과목\n\n## [list] ##\n- ‧ 운영학과(BME학부, 컴퓨터공학부, AI융합전공 공통 및 Software&AI)에 개설된 유사\n- 과목(주임교수 사전 승인)\n- ‧ 2학점의 관련 과목이 3학점인 ‘언어와공학’의 선택과목으로 인정될 때는 2학점만\n- 이수한 것으로 인정. 단, 2학점인 과목은 ‘언어와 공학’의 필수과목으로 인정될 수는 없음\n\n## [paragraph] ##\n4) 학생 선발\n\n## [paragraph] ##\n- 바이오데이터사이언스 융합전공은 모든 전공의 학생들이 선택할 수 있음. 각 전공의\n학생들이 이 융합전공을 이수하는 방식은 다음과 같음\n\n## [paragraph] ##\n<바이오데이터사이언스> 전공이수 방식', '## [paragraph] ##\n4) 학생 선발\n\n## [paragraph] ##\n- 바이오데이터사이언스 융합전공은 모든 전공의 학생들이 선택할 수 있음. 각 전공의\n학생들이 이 융합전공을 이수하는 방식은 다음과 같음\n\n## [paragraph] ##\n<바이오데이터사이언스> 전공이수 방식\n\n## [table] ##\n| 학생 구분 | 수강 과목 | 기대 효과 |\n| --- | --- | --- |\n| SW 전공학생 (컴퓨터공학부, 정보통신공학과) | SW 전공 57학점 SW 영역 추가 21학점 바이오메디컬영역 21학점 | - SW 영역 교과목 78학점 이수 - 바이오메디컬영역 21학점 이수 - SW 전공 과목을 <전공> 또는 <이중전공>으로 구분할 수 있음 |\n| 바이오메디컬전공 학생 | BME 전공 57학점 바이오메디컬영역 21학점 SW 영역 21학점 | - 바이오메디컬 영역 78학점 이수 - SW 영역 21학점 이수 - BME 전공 과목을 <전공> 또는 <이중전공>으로 구분할 수 있음 |\n| 기타 전공 학생 | 본인 전공 54학점 바이오데이터사이언스 42학점 | - 바이오데이터사이언스 융합전공 42학점 이수 |\n\n## [paragraph] ##\n5) 졸업 요건 : 졸업논문 심사(지도교수가 배정되어 졸업 논문을 지도함)\n\n## [list] ##\n- 6) 문의처 : 바이오메디컬공학부(031-330-4723)\n\n## [footer] ##\n- 56 -']","종합설계 보강일은 다음과 같습니다:

- 2025년 12월 8일 (월요일)
- 2025년 12월 9일 (화요일)
- 2025년 12월 10일 (수요일)
- 2025년 12월 11일 (목요일)
- 2025년 12월 12일 (금요일)

정확한 일정은 학과별로 다를 수 있으니, 수업 담당 교수님께 확인하시기 바랍니다. 혹시 더 도와드릴까요?",종합설계는 삼일절 대체휴일로 인한 6월 9일(월)과 어린이날로 인한 6월 11일(수)에 보강수업이 예정되어 있습니다.,0.5277777777601852,1.0,0.75,0.0
일통 FLEX 시험 점수 제출 기간 알고 싶어.,"['[글로벌] 2025학년도 1학기 졸업논문 제출 및 졸업시험 일정 공고 새글\n\n나 . 졸업시험 과목 : 자세한 사항은 첨부파일 참조 , 학과 사정에 따라 변경될 수 있음 ( 자세한 사항은 학과에 문의 )\n\n다 . 졸업시험 응시원서 접수 마감일 : 2025. 4. 23.( 수 )\n\n라 . 졸업시험 응시원서 교부 및 제출처 : 해당 학과 학과장실\n\n마 . 졸업시험 시간표 발표 : 2025. 4. 25.( 금 ) 소속학과 게시판 참조 ( 학과 자체 발표 )\n\n※ 해당학과 ( 부 ) 에 따라 시험일정이 다를 수 있으니 반드시 해당학과에 문의 후 응시\n\n6. FLEX 대체 ( 정기시험 : 영어 , 중국어 , 일본어 , 프랑스어 , 독일어 , 러시아어 , 스페인어 )\n\n가 . 해당학과 : 자세한 사항은 첨부파일 참조\n\n나 . 일정 : 시험 일정 ( 클릭 ) 에 따라 학생 개별 응시하고 성적표 학과 제출\n\n다 . 제출기간 : 해당학과 사무실 문의\n\n7. FLEX 대체 ( 이탈리아어 , 태국어 , 폴란드어 , 루마니아어 , 체코어 , 헝가리어 , 세르비아어 , 그리스어 , 불가리아어 , 힌디어 )\n\n가 . 해당학과 : 자세한 사항은 첨부파일 참조\n\n나 . 시험일자 : 2025. 5. 24( 토 ) 오전 10:00 서울캠퍼스 시행예정\n\n※ 정확한 시간 / 장소는 추후 통지\n\n다 . 접수기간 : 2025. 4. 16.( 수 ) ~ 4. 23.( 수 ) 해당학과 사무실에 신청 ( 기한 이후 추가 신청 불가 )\n\n* 7 학기 이상 재적생만 신청가능\n\n8. 유의 사항\n\n가 . 졸업시험 및 졸업논문 심사에 통과한 자는 졸업 시까지 그 자격이 유효함 ( 단 , 학적을 상실한 때에는 그 자격을 인정하지 아니함 )\n\n나 . 제 2 전공 , 이중전공자도 해당학과 문의 / 학과에 따른 졸업시험 응시 , 논문 제출 등 pass 하기 바람\n\n다 . 졸업시험 응시원서 제출 시 학생 본인의 연락처를 정확히 기재할 것\n\n라 . 졸업시험은 과목별 40 점이상 , 전과목 평균 60 점 이상 취득하여야 합격임\n\n마 . 졸업논문은 D° 이상 판정 받아야 합격임', '[글로벌] 2025학년도 1학기 졸업논문 제출 및 졸업시험 일정 공고 새글\n\n졸업시험 ( 대체 )\n\n졸업시험 응시원서\n\n양식 2\n\n7. 다 .\n\nFLEX 대체 ( 교내 )\n\n2025. 4. 25.( 금 )\n\n졸업시험\n\n졸업시험 시간표 발표\n\n5. 마 . ※\n\n2025. 5. 12.( 월 ) ∼ 5. 13.( 화 )\n\n졸업시험\n\n1 전공 졸업시험\n\n5. 나 .\n\n2025. 5. 19.( 월 ) ∼ 5. 20.( 화 )\n\n졸업시험\n\n제 2 전공 , 이중전공 졸업시험\n\n5. 나 .\n\n2025. 5. 24.( 토 ) 오전 10:00\n\n졸업시험 ( 대체 )\n\nFLEX 대체 ( 교내 )\n\n7. 나 .\n\n서울캠퍼스 시행예정\n\n4. 졸업논문\n\n가 . 졸업논문 작성계획서 제출 마감일 : 2025. 4. 23.( 수 )\n\n※ 졸업논문 제출 마감일은 학과에 문의\n\n나 . 제 1 전공 , 제 2 전공 , 이중전공 : 해당학과에서 배정한 졸업논문 지도교수로부터 졸업논문 작성에 관한 지도를 받아 기일 내에 소속 학과장실에 제출함\n\n다 . 졸업논문의 분량은 200 자 원고지 100 매 이상 분량을 원칙으로 함\n\n라 . 졸업논문을 기한 내에 제출하지 않는 학생은 졸업사정 대상에서 제외됨\n\n※ 졸업논문을 제출하고자 하는 학생은 3 학년 2 학기 초 또는 졸업학기의 직전 학기 초에 졸업논문 작성계획서를 작성하여 소속 학과장실에 제출하여야함\n\n※ 세부일정은 해당학과에 따라 다를 수 있으니 반드시 해당학과에 문의 후 작성 제출\n\n5. 졸업시험\n\n가 . 졸업시험 기간\n\n1) 1 전공 : 2025. 5. 12.( 월 ) ∼ 5. 13.( 화 )\n\n2) 제 2 전공 , 이중전공 : 2025. 5. 19.( 월 ) ∼ 5. 20.( 화 )\n\n나 . 졸업시험 과목 : 자세한 사항은 첨부파일 참조 , 학과 사정에 따라 변경될 수 있음 ( 자세한 사항은 학과에 문의 )\n\n다 . 졸업시험 응시원서 접수 마감일 : 2025. 4. 23.( 수 )\n\n라 . 졸업시험 응시원서 교부 및 제출처 : 해당 학과 학과장실', '[글로벌] 2025학년도 1학기 졸업논문 제출 및 졸업시험 일정 공고 새글\n\n| 0 | 1 | 2 | 3 | 4 | 5 | 6 |\n|:------------------------------|:---------------|:---------------------------|:---------------------------|:---------------------------|:-------------------------|:--------------------|\n| 마감일 / 일정 | 구분 | 제출서류 | 서식/양식 | 제출처 | 유의사항 (아래 공지번호) | 비고 |\n| 2025. 4. 23.(수) | 졸업논문 | 졸업논문 | 서식1, 양식4, 양식5 | 해당학과 | 4. 나., 다., 라. | 마감일정 학과 문의 |\n| 2025. 4. 23.(수) | 졸업논문 | 졸업논문 작성계획서 | 양식1 | 해당학과 | 4. 라. ※ | 정보없음 |\n| 2025. 4. 23.(수) | 졸업시험 | 졸업시험 응시원서 | 양식2 | 해당학과 | 5. 가., 마. | 정보없음 |\n| 2025. 4. 23.(수) | 졸업시험(대체) | 졸업시험 응시원서 | 양식2 | 해당학과 | 7. 다. | FLEX 대체(교내) |\n| 2025. 4. 25.(금) | 졸업시험 | 졸업시험 시간표 발표 | 졸업시험 시간표 발표 | 졸업시험 시간표 발표 | 5. 마. ※ | 정보없음 |\n| 2025. 5. 12.(월) ∼ 5. 13.(화) | 졸업시험 | 1전공 졸업시험 | 1전공 졸업시험 | 1전공 졸업시험 | 5. 나. | 정보없음 |\n| 2025. 5. 19.(월) ∼ 5. 20.(화) | 졸업시험 | 제2전공, 이중전공 졸업시험 | 제2전공, 이중전공 졸업시험 | 제2전공, 이중전공 졸업시험 | 5. 나. | 정보없음 |\n| 2025. 5. 24.(토) 오전 10:00 | 졸업시험(대체) | FLEX 대체(교내) | FLEX 대체(교내) | FLEX 대체(교내) | 7. 나. | 서울캠퍼스 시행예정 |', '[글로벌] 2025학년도 1학기 졸업논문 제출 및 졸업시험 일정 공고 새글\n\n[글로벌] 2025학년도 1학기 졸업논문 제출 및 졸업시험 일정 공고 새글\n\n졸업논문 제출 및 졸업시험 일정 공고\n\n2025 학년도 제 1 학기 졸업시험 및 졸업논문 제출 일정을 아래와 같이 공고함\n\n1. 자격 : 현재 3 학년 과정을 이수 완료한 7 학기 이상 재적생 (7 학기 미만 재적생은 불가 )\n\n2. 학과별 1 전공 졸업논문 / 시험 목록 : 자세한 사항은 첨부파일 참조 ( 이중전공은 해당학과에 문의 )\n\n단과대학명\n\n학과 ( 전공 )\n\n졸업논문 / 시험 방식\n\n학과사무실\n\n졸업논문\n\n졸업시험\n\nFLEX 대체\n\n기타\n\n정기시험\n\n교내\n\n인문대학\n\n철학과\n\n○\n\n031)330-4282\n\n사학과\n\n○\n\n031)330-4288\n\n언어인지과학과\n\n○\n\n031)330-4286\n\n지식콘텐츠전공\n\n○\n\n031)330-4980\n\n융합인재대학\n\n융합인재학부\n\n○\n\n○\n\n○\n\n031)330-4707\n\n통번역대학\n\n영어통번역학부\n\n○\n\n○\n\n031)330-4202, 4559\n\n독일어통번역학과\n\n○\n\n031)330-4206\n\n스페인어통번역학과\n\n○\n\n○\n\n031)330-4210\n\n이탈리아어통번역학과\n\n○\n\n○\n\n○\n\n○\n\n031)330-4214\n\n중국어통번역학과\n\n○\n\n031)330-4232\n\n일본어통번역학과\n\n○\n\n031)330-4234\n\n아랍어통번역학과\n\n○\n\n031)330-4236\n\n말레이 ･ 인도네시아어통번역학과\n\n○\n\n031)330-4238\n\n태국어통번역학과\n\n○\n\n031)330-4240\n\n국가전략언어대학\n\n폴란드학과\n\n○\n\n031)330-4216\n\n루마니아학과\n\n○\n\n○\n\n031)330-4218\n\n체코ㆍ슬로바키아학과\n\n○\n\n○\n\n031)330-4220\n\n헝가리학과\n\n○\n\n○\n\n031)330-4222\n\n세르비아ㆍ크로아티아학과\n\n○\n\n○\n\n031)330-4224\n\n그리스ㆍ불가리아학과\n\n○\n\n031)330-4715\n\n중앙아시아학과\n\n○\n\n○\n\n○\n\n031)330-4716\n\n아프리카학부 동아프리카 전공\n\n○\n\n○\n\n○\n\n031)330-4242', '6. FLEX 대체 ( 정기시험 : 영어 , 중국어 , 일본어 , 프랑스어 , 독일어 , 러시아어 , 스페인어 )\n\n가 . 해당학과 : 자세한 사항은 첨부파일 참조\n\n나 . 일정 : 시험 일정 ( 클릭 ) 에 따라 학생 개별 응시하고 성적표 학과 제출\n\n다 . 제출기간 : 해당학과 사무실 문의\n\n7. FLEX 대체 ( 이탈리아어 , 태국어 , 폴란드어 , 루마니아어 , 체코어 , 헝가리어 , 세르비아어 , 그리스어 , 불가리아어 , 힌디어 )\n\n가 . 해당학과 : 자세한 사항은 첨부파일 참조\n\n나 . 시험일자 : 2025. 5. 24( 토 ) 오전 10:00 서울캠퍼스 시행예정\n\n※ 정확한 시간 / 장소는 추후 통지', '다 . 제출기간 : 해당학과 사무실 문의\n\n7. FLEX 대체 ( 이탈리아어 , 태국어 , 폴란드어 , 루마니아어 , 체코어 , 헝가리어 , 세르비아어 , 그리스어 , 불가리아어 , 힌디어 )\n\n가 . 해당학과 : 자세한 사항은 첨부파일 참조\n\n나 . 시험일자 : 2025. 5. 24( 토 ) 오전 10:00 서울캠퍼스 시행예정\n\n※ 정확한 시간 / 장소는 추후 통지\n\n다 . 접수기간 : 2025. 4. 16.( 수 ) ~ 4. 23.( 수 ) 해당학과 사무실에 신청 ( 기한 이후 추가 신청 불가 )\n\n* 7 학기 이상 재적생만 신청가능\n\n8. 유의 사항\n\n가 . 졸업시험 및 졸업논문 심사에 통과한 자는 졸업 시까지 그 자격이 유효함 ( 단 , 학적을 상실한 때에는 그 자격을 인정하지 아니함 )\n\n나 . 제 2 전공 , 이중전공자도 해당학과 문의 / 학과에 따른 졸업시험 응시 , 논문 제출 등 pass 하기 바람', '[글로벌] 2025학년도 1학기 졸업논문 제출 및 졸업시험 일정 공고 새글\n\n나 . 졸업시험 과목 : 자세한 사항은 첨부파일 참조 , 학과 사정에 따라 변경될 수 있음 ( 자세한 사항은 학과에 문의 )\n\n다 . 졸업시험 응시원서 접수 마감일 : 2025. 4. 23.( 수 )\n\n라 . 졸업시험 응시원서 교부 및 제출처 : 해당 학과 학과장실\n\n마 . 졸업시험 시간표 발표 : 2025. 4. 25.( 금 ) 소속학과 게시판 참조 ( 학과 자체 발표 )\n\n※ 해당학과 ( 부 ) 에 따라 시험일정이 다를 수 있으니 반드시 해당학과에 문의 후 응시\n\n6. FLEX 대체 ( 정기시험 : 영어 , 중국어 , 일본어 , 프랑스어 , 독일어 , 러시아어 , 스페인어 )\n\n가 . 해당학과 : 자세한 사항은 첨부파일 참조', '[글로벌] 2025학년도 1학기 졸업논문 제출 및 졸업시험 일정 공고 새글\n\n나 . 졸업시험 과목 : 자세한 사항은 첨부파일 참조 , 학과 사정에 따라 변경될 수 있음 ( 자세한 사항은 학과에 문의 )\n\n다 . 졸업시험 응시원서 접수 마감일 : 2025. 4. 23.( 수 )\n\n라 . 졸업시험 응시원서 교부 및 제출처 : 해당 학과 학과장실\n\n마 . 졸업시험 시간표 발표 : 2025. 4. 25.( 금 ) 소속학과 게시판 참조 ( 학과 자체 발표 )\n\n※ 해당학과 ( 부 ) 에 따라 시험일정이 다를 수 있으니 반드시 해당학과에 문의 후 응시\n\n6. FLEX 대체 ( 정기시험 : 영어 , 중국어 , 일본어 , 프랑스어 , 독일어 , 러시아어 , 스페인어 )\n\n가 . 해당학과 : 자세한 사항은 첨부파일 참조\n\n나 . 일정 : 시험 일정 ( 클릭 ) 에 따라 학생 개별 응시하고 성적표 학과 제출\n\n다 . 제출기간 : 해당학과 사무실 문의', '3. 평 가 방 법\n\n가 . 필답고사 , 과제물 , 출석률 등을 참작하여 평가함 .\n\n나 . 시험시간표는 별도로 발표하지 않으며 정해진 시험기간에 실시함 .\n\n4. 성적입력 알림 서비스 실시 : 성적입력 시스템에서 ‘ 최종제출 ’ 을 클릭하여 성적입력이 완료되면 해당 학생들에게 ‘ 성적이 입력되어 확인할 수 있다 ’ 는 문자가 (HUFS 앱 설치자에 한함 ) 발송됨 .\n\n2025. 4.\n\n서울 · 글로벌캠퍼스 교무처장\n\n| 0 |\n|:-------------------------|\n| 2025-1학기 중간시험 공고 |', '[글로벌] 2025학년도 1학기 졸업논문 제출 및 졸업시험 일정 공고 새글\n\n졸업시험 ( 대체 )\n\n졸업시험 응시원서\n\n양식 2\n\n7. 다 .\n\nFLEX 대체 ( 교내 )\n\n2025. 4. 25.( 금 )\n\n졸업시험\n\n졸업시험 시간표 발표\n\n5. 마 . ※\n\n2025. 5. 12.( 월 ) ∼ 5. 13.( 화 )\n\n졸업시험\n\n1 전공 졸업시험\n\n5. 나 .\n\n2025. 5. 19.( 월 ) ∼ 5. 20.( 화 )\n\n졸업시험\n\n제 2 전공 , 이중전공 졸업시험\n\n5. 나 .\n\n2025. 5. 24.( 토 ) 오전 10:00\n\n졸업시험 ( 대체 )\n\nFLEX 대체 ( 교내 )\n\n7. 나 .\n\n서울캠퍼스 시행예정\n\n4. 졸업논문\n\n가 . 졸업논문 작성계획서 제출 마감일 : 2025. 4. 23.( 수 )', '| 2025. 5. 24.(토) 오전 10:00 | 졸업시험(대체) | FLEX 대체(교내) | FLEX 대체(교내) | FLEX 대체(교내) | 7. 나. | 서울캠퍼스 시행예정 |', '[글로벌] 2025학년도 1학기 졸업논문 제출 및 졸업시험 일정 공고 새글\n\n졸업시험 ( 대체 )\n\n졸업시험 응시원서\n\n양식 2\n\n7. 다 .\n\nFLEX 대체 ( 교내 )\n\n2025. 4. 25.( 금 )\n\n졸업시험\n\n졸업시험 시간표 발표\n\n5. 마 . ※\n\n2025. 5. 12.( 월 ) ∼ 5. 13.( 화 )\n\n졸업시험\n\n1 전공 졸업시험\n\n5. 나 .\n\n2025. 5. 19.( 월 ) ∼ 5. 20.( 화 )\n\n졸업시험\n\n제 2 전공 , 이중전공 졸업시험\n\n5. 나 .\n\n2025. 5. 24.( 토 ) 오전 10:00\n\n졸업시험 ( 대체 )\n\nFLEX 대체 ( 교내 )\n\n7. 나 .\n\n서울캠퍼스 시행예정\n\n4. 졸업논문\n\n가 . 졸업논문 작성계획서 제출 마감일 : 2025. 4. 23.( 수 )\n\n※ 졸업논문 제출 마감일은 학과에 문의', '이수한 것으로 처리 7) FLEX외국어능력시험 교양선택 학점 인정(2015학번 이후) (대학외국어필수 대체 아님) - 인정성적 : FLEX외국어능력시험(대한상공회의소 주관, 듣기․읽기) 성적 701점 이상 - 인정학점 : ‘FLEX~어(교양)’ 2학점(701~800점 A0, 801점 이상 A+), 1회에 한함 - 1전공과 동일언어 학점 불인정 - FLEX 학점인정 문의 : 학사종합지원센터 학점인정담당(Tel : 031-330-4026) ※ 외국어연수평가원의 외국어과정 수료는 학점인정 대상이 아님 8) ‘사회봉사’(정규), ‘사회봉사(농활)’, ‘사회봉사(해외)’는 재학 중 최대 2과목(4학점)까지 이수 가능 9) 외대 정규 개설과목 외 교양학점으로 인정 가능한 국내외 교류학점, 현장실습 교양학점 등은 교양 선택으로 인정함 10) 글로벌캠퍼스 소속 학생이 서울캠퍼스 계절학기 등으로 아래 교과목 이수 시 - Communicative English 교과목 : 대학영어 교과목으로 인정', 'FLEX 대체 ( 교내 )\n\n7. 나 .\n\n서울캠퍼스 시행예정\n\n4. 졸업논문\n\n가 . 졸업논문 작성계획서 제출 마감일 : 2025. 4. 23.( 수 )\n\n※ 졸업논문 제출 마감일은 학과에 문의\n\n나 . 제 1 전공 , 제 2 전공 , 이중전공 : 해당학과에서 배정한 졸업논문 지도교수로부터 졸업논문 작성에 관한 지도를 받아 기일 내에 소속 학과장실에 제출함\n\n다 . 졸업논문의 분량은 200 자 원고지 100 매 이상 분량을 원칙으로 함\n\n라 . 졸업논문을 기한 내에 제출하지 않는 학생은 졸업사정 대상에서 제외됨\n\n※ 졸업논문을 제출하고자 하는 학생은 3 학년 2 학기 초 또는 졸업학기의 직전 학기 초에 졸업논문 작성계획서를 작성하여 소속 학과장실에 제출하여야함', '- 3) 외국인전형 입학자가 전공 또는 이중전공을 언어관련 전공으로 하는 경우, 전공 또는\n- 이중전공 졸업시험 통과 시 외국어인증으로 자동 처리됨(수료 희망자는 별도 문의)\n- 4) FLEX 시험 안내는 대한상공회의소 홈페이지, 학교 홈페이지 <FLEX센터>를 통하여 확\n- 인할 수 있으며, 시험 횟수가 제한적이므로 미리 준비하여 졸업에 차질이 없도록 할 것', '제외) : FLEX 인증 원칙(해당언어 전공학과 기준) • 국가공인한자능력시험 : 3급 이상 • KBS한국어능력시험 : 3-급 이상 • 해당언어 전공 기초어학강좌 : 6학점 이상 이수(이중/부전공 언어 제외) | • 제2외국어(영어 제외) : FLEX 인증 원칙(해당언어 전공학과 기준) • 국가공인한자능력시험 : 3급 이상 • KBS한국어능력시험 : 3-급 이상 • 해당언어 전공 기초어학강좌 : 6학점 이상 이수(이중/부전공 언어 제외) | • 제2외국어(영어 제외) : FLEX 인증 원칙(해당언어 전공학과 기준) • 국가공인한자능력시험 : 3급 이상 • KBS한국어능력시험 : 3-급 이상 • 해당언어 전공 기초어학강좌 : 6학점 이상 이수(이중/부전공 언어 제외) | • 제2외국어(영어 제외) :', '| 1 | 영어관련 전공 | 기타언어 | • 제2외국어(영어 제외) : FLEX 인증 원칙(해당언어 전공학과 기준) • 국가공인한자능력시험 : 3급 이상 • KBS한국어능력시험 : 3-급 이상 • 해당언어 전공 기초어학강좌 : 6학점 이상 이수(이중/부전공 언어 제외) | • 제2외국어(영어 제외) : FLEX 인증 원칙(해당언어 전공학과 기준) • 국가공인한자능력시험 : 3급 이상 • KBS한국어능력시험 : 3-급 이상 • 해당언어 전공 기초어학강좌 : 6학점 이상 이수(이중/부전공 언어 제외) | • 제2외국어(영어 제외) : FLEX 인증 원칙(해당언어 전공학과 기준) • 국가공인한자능력시험 : 3급 이상 • KBS한국어능력시험 : 3-급 이상 • 해당언어 전공 기초어학강좌 : 6학점 이상', '[글로벌] 2025학년도 1학기 졸업논문 제출 및 졸업시험 일정 공고 새글\n\n[글로벌] 2025학년도 1학기 졸업논문 제출 및 졸업시험 일정 공고 새글\n\n졸업논문 제출 및 졸업시험 일정 공고\n\n2025 학년도 제 1 학기 졸업시험 및 졸업논문 제출 일정을 아래와 같이 공고함\n\n1. 자격 : 현재 3 학년 과정을 이수 완료한 7 학기 이상 재적생 (7 학기 미만 재적생은 불가 )\n\n2. 학과별 1 전공 졸업논문 / 시험 목록 : 자세한 사항은 첨부파일 참조 ( 이중전공은 해당학과에 문의 )\n\n단과대학명\n\n학과 ( 전공 )\n\n졸업논문 / 시험 방식\n\n학과사무실\n\n졸업논문\n\n졸업시험\n\nFLEX 대체\n\n기타\n\n정기시험\n\n교내\n\n인문대학\n\n철학과\n\n○\n\n031)330-4282\n\n사학과\n\n○\n\n031)330-4288', '| 1 | 영어관련 전공 | 기타언어 | • 제2외국어(영어 제외) : FLEX 인증 원칙(해당언어 전공학과 기준) • 국가공인한자능력시험 : 3급 이상 • KBS한국어능력시험 : 3-급 이상 • 해당언어 전공 기초어학강좌 : 6학점 이상 이수(이중/부전공 언어 제외) | • 제2외국어(영어 제외) : FLEX 인증 원칙(해당언어 전공학과 기준) • 국가공인한자능력시험 : 3급 이상 • KBS한국어능력시험 : 3-급 이상 • 해당언어 전공 기초어학강좌 : 6학점 이상 이수(이중/부전공 언어 제외) | • 제2외국어(영어 제외) : FLEX 인증 원칙(해당언어 전공학과 기준) • 국가공인한자능력시험 : 3급 이상 • KBS한국어능력시험 : 3-급 이상 • 해당언어 전공 기초어학강좌 : 6학점 이상 이수(이중/부전공 언어 제외) | • 제2외국어(영어 제외) : FLEX 인증 원칙(해당언어 전공학과 기준) • 국가공인한자능력시험 : 3급 이상 • KBS한국어능력시험 : 3-급 이상 •', '가 . 해당학과 : 자세한 사항은 첨부파일 참조\n\n나 . 시험일자 : 2025. 5. 24( 토 ) 오전 10:00 서울캠퍼스 시행예정\n\n※ 정확한 시간 / 장소는 추후 통지\n\n다 . 접수기간 : 2025. 4. 16.( 수 ) ~ 4. 23.( 수 ) 해당학과 사무실에 신청 ( 기한 이후 추가 신청 불가 )\n\n* 7 학기 이상 재적생만 신청가능\n\n8. 유의 사항\n\n가 . 졸업시험 및 졸업논문 심사에 통과한 자는 졸업 시까지 그 자격이 유효함 ( 단 , 학적을 상실한 때에는 그 자격을 인정하지 아니함 )\n\n나 . 제 2 전공 , 이중전공자도 해당학과 문의 / 학과에 따른 졸업시험 응시 , 논문 제출 등 pass 하기 바람\n\n다 . 졸업시험 응시원서 제출 시 학생 본인의 연락처를 정확히 기재할 것', '[공통] 외국어인증 신청서 제출 안내\n\n| 제출서류 | 1. 외국어인증 신청서(첨부파일 참조) 2. 제출시점 기준 유효기간(2년) 이내의 인증 시험 성적(또는 대체 과정 수료증) ※성적표 미리보기 캡쳐본\xa0성적 처리 불가 | 1. 외국어인증 신청서(첨부파일 참조) 2. 제출시점 기준 유효기간(2년) 이내의 인증 시험 성적(또는 대체 과정 수료증) ※성적표 미리보기 캡쳐본\xa0성적 처리 불가 | 1. 외국어인증 신청서(첨부파일 참조) 2. 제출시점 기준 유효기간(2년) 이내의 인증 시험 성적(또는 대체 과정 수료증) ※성적표 미리보기 캡쳐본\xa0성적 처리 불가 | 1. 외국어인증 신청서(첨부파일 참조) 2. 제출시점 기준 유효기간(2년) 이내의 인증 시험 성적(또는 대체 과정 수료증) ※성적표 미리보기 캡쳐본\xa0성적 처리 불가 |\n| 제출마감일 | 재학기간 동안\xa01회,\xa0외국어 인증 신청서를 제출하고자 하는 학기 말까지 ※\xa0졸업예정자는 졸업하고자 하는 최종 학기 말까지 반드시 제출해야함. | 재학기간 동안\xa01회,\xa0외국어 인증 신청서를 제출하고자 하는 학기 말까지 ※\xa0졸업예정자는 졸업하고자 하는 최종 학기 말까지 반드시 제출해야함. | 재학기간 동안\xa01회,\xa0외국어 인증 신청서를 제출하고자 하는 학기 말까지 ※\xa0졸업예정자는 졸업하고자 하는 최종 학기 말까지 반드시 제출해야함. | 재학기간 동안\xa01회,\xa0외국어 인증 신청서를 제출하고자 하는 학기 말까지 ※\xa0졸업예정자는 졸업하고자 하는 최종 학기 말까지 반드시 제출해야함. |\n| 제출처 | 학생의\xa01전공 소속 단과대학 담당에게\xa0E-mail\xa0제출 | 학생의\xa01전공 소속 단과대학 담당에게\xa0E-mail\xa0제출 | 학생의\xa01전공 소속 단과대학 담당에게\xa0E-mail\xa0제출 | 학생의\xa01전공 소속 단과대학 담당에게\xa0E-mail\xa0제출 |\n| 제출처 | 서울캠퍼스 | 영어대학 /\xa0아시어언어문화대학 / AI융합대학 | haksa7@hufs.ac.kr | 02) 2173-2264 |', ""## [heading1] ##\n# 라. 기타사항\n\n## [list] ##\n- 1) 위 인증기준을 충족하는 인증시험 성적, 대체과정 수료증 등의 '인증서 사본'(제출시점\n- 기준 2년 이내 취득)을 최종 학기 말까지 학사종합지원센터에 제출(기타언어 FLEX의\n- 경우 해당 언어학과에 일정 확인 후 학과 사무실에 제출)\n- 2) 기타언어 제출 대상자(영어통번역학부 소속 학생)가 언어관련 이중전공을 하는 경우,\n- 이중전공 졸업시험 통과 시 외국어인증으로 자동 처리됨(수료 희망자는 별도 문의)\n- 3) 외국인전형 입학자가 전공 또는 이중전공을 언어관련 전공으로 하는 경우, 전공 또는\n- 이중전공 졸업시험 통과 시 외국어인증으로 자동 처리됨(수료 희망자는 별도 문의)\n- 4) FLEX 시험 안내는 대한상공회의소 홈페이지, 학교 홈페이지 <FLEX센터>를 통하여 확\n- 인할 수 있으며, 시험 횟수가 제한적이므로 미리 준비하여 졸업에 차질이 없도록 할 것\n\n## [heading1] ##\n# 4. 기타 졸업관련 사항\n\n## [paragraph] ##\n가. 졸업예정자 졸업요건 충족여부 필수 확인사항 정리\n\n## [list] ##\n- 1) 졸업에 필요한 이수학점 수 / 총평점(F포함) 2.0이상 여부\n- 2) 교양필수 및 전공(이중전공) 필수 교과목 이수여부\n\n## [paragraph] ##\n※ 전공필수 : 각 학과 문의\n교양필수 : 수강편람 교양 안내문 참조\n\n## [list] ##\n- 3) 전공 및 이중전공 졸업시험(논문/또는 대체시험 등) 합격여부\n- 4) 외국어인증(졸업인증) 완료여부\n\n## [paragraph] ##\n나. 졸업요건 충족여부에 따른 학적사항 안내"", '인 인증 시험\n주요 실적 \n-  특수외국어 교육진흥법의 특수외국어 교육학과\n-  EcoProBM과 업무협약 MOU 체결 \n-  헝가리 법인 삼성 SDI, 헝가리 법인 삼성전자, 주헝 한국문화원 등과\n의 인턴 협약\n-  유럽공인인증시험 ECL 헝가리어 시험 센터 구축\n-  헝가리 국립 시청각 자료 이용 가능한 한국 센터 구축\n-  한국 인증 헝가리어 자격시험 FLEX 시험 운영\n-  헝가리 파견 주재원 헝가리어 위탁 교육 기관\n주요 전공과목 \n-  헝가리어 관련 교과목: 헝가리어를 회화, 시청각, 번역연습, 문법·작문\n으로 나누어서 하나의 교재로 반복, 심화 학습합니다. 1학년 주 9시간, \n2학년 주 7시간 헝가리어 수업이 진행됩니다. 3학년에는 실무에서 사\n용하는 전문용어를 학습하는 <비지니스 헝가리어>를 학습하고, 번역\n에 관심이 있는 경우 <헝가리 시 번역> 과목에서 번역의 기본 이론과 \n실제적 경험을 쌓을 수 있습니다. \n-  헝가리의 외교와 정치: 1학년에서는 헝가리를 유럽과 연결해서 고찰\n하는 <유럽과 헝가리> 강의가 마련되어 있으며. 2학년에서는 <헝가\n리의 외교 정책> 강의에서 헝가리 외교의 기본방향과 목표를 배우실 \n수 있습니다. 3학년에서는 <헝가리 정치의 이해>를 통해 현실적인 정\n치의 흐름을 학습하며 4학년 때에는 <헝가리 지역연구 1,2> 과목으로 \n헝가리의 현재 정치적 현황과 방향을 배우게 됩니다. \n-  헝가리 사회·문화 교과목: 1학년에서는 헝가리 전반에 대한 <헝가리 \n개관>이라는 강의가 마련되며, 2학년에서는 <헝가리 역사와 문화>, \n<헝가리의 외교 정책>이라는 강의로 헝가리와 주변의 유럽 국가들에 \n대한 전체적인 이해를 위한 학습을 합니다. 3학년에서는 <헝가리 사\n회 연구>, <유럽 속의 헝가리 문화>를 통해 헝가리의 사회 문화적 고\n유성과 특징을 학습합니다. 4학년에서는 <헝가리 영화 1,2> 강의에서 \n헝가리 문화의 흐름과 맥락을 배우게 됩니다. \n-  헝가리어 공인인증 시험 관련 교과목: 헝가리어 자격증 취득을 준비하\n는 <FLEX 헝가리어>가 3학년 2학기에 걸쳐 강의되며, 4학년에서는 \nECL 자격증 취득을 위한 <고급 헝가리어 번역연습>으로 헝가리어의 \n단계적 학습을 하실 수 있습니다. \n-  헝가리 문학 교과목: 헝가리 문학은 3학년 전공 수업에서 접하실 수 있\n으며 3학년의 <헝가리 전래동화와 콘텐츠>에서 배우는 구비문학과', '| 질병 및 상해 로 인한 입원 또는 감염병 으로 인한 격 리(치료) | 법정감염병 (**질병관리청의 법정감염병에 한함) | 격리(치료) 기간 또는 감염우려 기간 | 해당 증빙서류 | 담당교수에게 증빙서류 제출 |  |\n| 졸업시험 | 졸업시험 | 졸업시험 당일 | 학과장 확인서 | 담당교수에게 증빙서류 제출 |  |\n| 수업일수 4분의 3선 후 징병에 의한 군입대 | 수업일수 4분의 3선 후 징병에 의한 군입대 | - | 입영통지서 | 담당교수에게 증빙서류 제출 |  |\n| 출산 | 출산 | 본인:20일 배우자:10일 | 본인 : 출생(출산예정)증 명서 등, 배우자 : 출생 (출산예정)증명서 및 가족관계증명서 등 | 담당교수에게 증빙서류 제출 |  |\n| 생리 | 생리 | 생리기간 (학기중 2회) | 유고결석신청서 (생리공결제) | 담당교수에게 증빙서류 제출 | ※ 자세한 사항은 학사공지사항 생리 유고 신청안내 참조 |\n| 교직과정이수자의 학교현장실습 | 교직과정이수자의 학교현장실습 | 교육실습 기간 | 교직담당자가 발급한 확인서 | 담당교수에게 증빙서류 제출 |  |\n| 졸업예정자(해당학기 졸업가능자) 로서 조기취업자 | 졸업예정자(해당학기 졸업가능자) 로서 조기취업자 | 취업기간 | 학과장 승인받은 유고결석 인정원, 재직(계약)증명서 및 4대보험가입내역 확인서 또는 이에 준하는 재직증명서류 | 입사확정 후 즉시 ￬ 유고결석인정원과 증빙서류에 대해 학과장 승인 ￬ 소속 단과대에 제출 ￬ 유고결석확인서를 발급받아 담당교수에게 제출 ￬ 수업종료 직전 취업사실에 대해 재확인 | ※ 자세한 사항은 학사공지사항 졸업예정자(해 당학기 졸업가능자)의 조기취업 유고결석 신청 안내 참조 |', '[공통] 외국어인증 신청서 제출 안내\n\n[공통] 외국어인증 신청서 제출 안내\n\n외국어인증 신청서 제출 안내\n\n외국어인증 신청서 제출에 대해 아래와 같이 안내합니다 .\n\n1. 외국어인증이란\n\n서울캠퍼스 수강편람 바로가기\n\n(수강편람목록- 수강편람 중 해당 페이지 참조)\n\n글로벌캠퍼스 수강편람 바로가기\n\n(수강편람목록- 수강편람 중 해당 페이지 참조 )\n\n2. 외국어인증 신청서 제출 안내\n\n제출서류\n\n1. 외국어인증 신청서(첨부파일 참조)\n\n2. 제출시점 기준 유효기간(2년) 이내의 인증 시험 성적 ( 또는 대체 과정 수료증 )\n\n※성적표 미리보기 캡쳐본\xa0성적 처리 불가\n\n제출마감일\n\n재학기간 동안 1 회 , 외국어 인증 신청서를 제출하고자 하는 학기 말 까지\n\n※ 졸업예정자는 졸업하고자 하는 최종 학기 말까지 반드시 제출해야함 .\n\n제출처\n\n학생의 1 전공 소속 단과대학 담당에게 E-mail 제출\n\n서울캠퍼스\n\n영어대학 / 아시어언어문화대학 / AI융합대학\n\nhaksa7@hufs.ac.kr\n\n02) 2173-2264\n\n서양어대학 / 중국학대학 / 일본학대학\n\nhana@hufs.ac.kr\n\n02) 2173-2121\n\n사회과학대학 / 상경대학 / 경영대학 / 국제학부 / LD 학부 / LT 학부 / KFL 학부\n\nhaksa6@hufs.ac.kr\n\n02) 2173-2308\n\n사범대학\n\npoisson@hufs.ac.kr\n\n02) 2173-2338\n\n글로벌캠퍼스\n\n인문대학 /\xa0통번역대학 / 융합인재대학\n\nhaksa4077@hufs.ac.kr\n\n031) 330-4077\n\n국가전략언어대학 / 국제지역대학 / 자유전공학부(글로벌)\n\n031) 330-4457\n\n자연과학대학 / 공과대학 / 바이오메디컬공학부\n\nyyj1730@hufs.ac.kr\n\n031) 330-4073\n\n경상대학 /\xa0AI융합대학(글로벌) / Culture& Technology융합대학 / 기후변화융합학부\n\nminsun@hufs.ac.kr\n\n031) 330-4953\n\n교무처 학사종합지원센터', '## [table] ##\n| 본 대학교 및 소속 단과대학을 대표하는 공무, 행사 또는 운동경기참가 | 단과대학 규모 이상의 행사 및 체육대회임원, 간부 및 선수로서 참가 | 행사시간 | 기간과 참여인이 명시된 대학장의 행사 허가원 또는 협조공문 등 | 소속단과대학에서 유고결석 확인서를 발급받아 담당교수에게 제출 |  |\n| --- | --- | --- | --- | --- | --- |\n| 본 대학교 및 소속 단과대학을 대표하는 공무, 행사 또는 운동경기참가 | 정부 또는 지방자 치단체의 공식적 인 행사에 참가 | 행사기간 | 기간과 참여인이 명시된 부서·기관의 협조공문 등 | 담당교수에게 증빙서류 제출 |  |\n| 본 대학교 및 소속 단과대학을 대표하는 공무, 행사 또는 운동경기참가 | 총학생회의 회의 (대의원회의, 상 임위원회 및 운 영위원회 포함) 졸 업 준 비 위 원 의 업무수행 | 해당기간 매학기 7일 이내 | 기간과 참여인이 명시된 부서·기관의 협조공문 등 | 담당교수에게 증빙서류 제출 |  |\n| 본 대학교 및 소속 단과대학을 대표하는 공무, 행사 또는 운동경기참가 | 학보, 디 아거스 및 방송국의 기사작성 및 편집 | 편집부 당일 | 기간과 참여인이 명시된 부서·기관의 협조공문 등 | 담당교수에게 증빙서류 제출 |  |\n| 본 대학교 및 소속 단과대학을 대표하는 공무, 행사 또는 운동경기참가 | 학교 주관 행사 및 업무 지원 | 해당기간 | 담당부서에서 발급한 확인서 | 담당교수에게 증빙서류 제출 |  |\n| 질병 및 상해 로 인한 입원 또는 감염병 으로 인한 격 리(치료) | 질병 및 상해 | 입원기간 | 해당 증빙서류 (*병원급 이상의 의료기관) | 담당교수에게 증빙서류 제출 |  |\n| 질병 및 상해 로 인한 입원 또는 감염병 으로 인한 격 리(치료) | 법정감염병 (**질병관리청의 법정감염병에 한함) | 격리(치료) 기간 또는 감염우려 기간 | 해당 증빙서류 | 담당교수에게 증빙서류 제출 |  |', '[서울] 2025학년도 1학기 ‘한국외대-한예종’ 공동운영 교양교과목 수강 안내\n\n수강신청 방법\n\n우리대학 홈페이지 수강신청시스템 => 실용외국어 / 교양과목 => 공동교양 ( 한예종 )\n\n※ 기존 수강신청 방식과 동일하게 우리대학 수강신청 기간에 수강신청시스템에 접속하여 교양영역에서 한예종 과목을 선택하여 수강 신청함 .\n\n※ 단 , 전체학년 수강신청 기간 (2025.\xa02.\xa07( 금 )) 에만 수강신청이 가능함 .\n\n수강학점\n\n학년도별 학기당 최대 수강신청 20 학점 내에서 수강신청 가능\n\n수강변경 및 취소\n\n우리대학 홈페이지 종합정보시스템 접속\n\n※ 한예종 교양과목을 수강취소하는 경우 , 다른 한예종 교양과목을 수강신청 할 수 없으며 , 우리 대학에서 개설되는 과목으로만 수강변경이 가능함 ( 단 , 여석 내 )\n\n※ 교류과목 중 폐강이 발생할 경우 , 폐강된 교류과목을 신청했던 학생은 우리대학에서 개설되는 과목으로 수강 변경할 수 있음 .\n\n성적처리\n\n① 한예종에서 성적 정정 ( 기간 ) 완료 후 , 한예종 공동 교양과목을 수강한 한국외대 학생들의 성적 ( 백분율 점수 ) 을 우리 대학으로 전달함 .\n\n② 한예종에서 부여하는 백분율 점수를 우리 대학 평점평균 환산기준표에 따라 성적등급으로 환산하여 최종 성적등급을 결정함 .\n\n※ 평점평균 : 우리대학 4.5 만점 / 한예종 4.3 만점\n\n재 수 강\n\n① 한예종에서 기존에 수강한 교과목에 대한 재수강은 우리 대학에서 개설되는 교양선택 과목 중 택 1 하여 재수강 해야함 .\n\n② 우리대학 교과목에 대한 재수강을 목적으로 한예종 공동교양 교과목을 수강할 수 없음 .\n\n기 타\n\n① 공동 교양학부에서 운영하는 한예종 교양 과목은 , 국내대학 학점 교류와는 달리 재학 중 학점제한 없이 수강할 수 있음 .\n\n단 , 국내 학점교류 방식을 통해 한예종 과목을 수강하는 경우에는 , 국내 · 외 학점교류규정에 따라 취득 허용 학점 제한이 있음 .\n\n※ 국내대학 학점교류 : 학기당 17 학점 이내 / 재학중 수강가능학점 35 학점 이내', '1716\nDept. of Hungarian Studies\n헝가리학과\n전화번호 031-330-4222\n홈페이지 hungary.hufs.ac.kr\n전공소개 \n헝가리학과는 한국에서 유일하게 헝가리의 언어와 문화를 교육하는 기\n관으로 특수외국어교육진흥법의 지원을 받아 헝가리어에 대한 교육을 \n기본으로 헝가리 문화, 역사, 정치, 경제, 문학에 대해 배울 수 있는 기\n관입니다. 또한 학부과정 중에 헝가리어 연수, 헝가리 법인 한국 기업의 \n인턴, 방학중 헝가리어 무료집중 온오프 과정을 진행하여 헝가리어만이 \n아니라, 헝가리 전반에 관한 지식과 이해를 겸비한 우수한 인재를 배출\n하고 있습니다. 유럽연합 국가인 헝가리에 교두보를 마련한 SK ON, 삼\n성SDI, 삼성전자, 한국타이어, 두산, LG전자, Eco ProBM과 산하협력업\n체가 현지에 진출해 있어 헝가리 전공자에 대한 높은 수요가 있습니다. \n또한 우리 학교의 교환학생 제도와 헝가리 정부장학생(연 100명) 제도\n로 현지에서 공부할 수 있는 다양한 기회가 제공되고 있습니다.\n필요역량 및 소양 \n-  헝가리에 관한 책을 읽어보시면 좋습니다. 헝가리어 문법이나 회화 \n등의 언어 학습을 도와주는 서적도 많지만, 이보다는 헝가리의 정치, \n사회, 문화, 문학작품 등 다양한 각도에서 헝가리와 헝가리학을 접해\n본다면 폭넓은 관심과 방향성을 가지고 전공 공부를 시작할 수 있습\n니다. \n-  헝가리어 자체에 대해 관심이 있다면, 우리 학교의 <특수어교육진흥\n원>에서 일반인을 대상으로 진행하는 온라인 헝가리어 수업을 듣는 \n것을 추천합니다. 중학생부터 헝가리 파견 주재원까지 구성원의 특성\n에 따라 분반하여 연 2회 12주의 강좌를 진행하고 있습니다.\n우리 학과(부)·전공 매력 \n-  국내 대기업의 대규모 헝가리 투자로 인한 높은 취업률\n-  교육부의 특수외국어 제정 및 프로그램 지원 학과\n-  선후배 간의 튜터링 및 방중 헝가리어 무료 온오프라인집중과정 등 다\n양한 학습 프로그램\n-  자격증 취득 가능: 헝가리어 FLEX 공인 인증 시험, ECL 헝가리어 공\n인 인증 시험\n주요 실적 \n-  특수외국어 교육진흥법의 특수외국어 교육학과\n-  EcoProBM과 업무협약 MOU 체결 \n-  헝가리 법인 삼성 SDI, 헝가리 법인 삼성전자, 주헝 한국문화원 등과\n의 인턴 협약\n-  유럽공인인증시험 ECL 헝가리어 시험 센터 구축\n-  헝가리 국립 시청각 자료 이용 가능한 한국 센터 구축', '(비교과) 전공탐색 연계한 자기탐색, 진로탐색 프로그램 지원\n1학년(여름방학) 학과 설명회\n2학기 희망 전공의 학문기초 교과목을 선택할 수 있도록 정보제공 \n1학년 2학기 전공 진입 전 기초교육 \n(교과) 교양 교과목 이수 및 희망 전공의 학문기초 교과목 이수 \n(비교과) 다양한 프로그램 연계 전공탐색학기제 운영 \n슬기로운 대학생활 \n자유전공학부(글로벌)는 전공이 정해지지 않아 학생들에게 보다 많은 \n경험을 제공할 수 있는 발판을 마련합니다. 다른 학생들과 다르게 자유\n전공학부(글로벌) 학생들은 전공을 미리 선택하지 않은 상태로 학교에 \n입학하게 됩니다. 이런 기회를 토대로 다양한 수업들을 통해서 자신과 \n잘 맞는 전공을 탐색하여 자신이 원하는 진로를 스스로 개척해 나가는 \n미래를 가져가시길 바랍니다.\nQ&A \nQ1. 2학년 진급시 주전공으로 선택할 수 있는 학과를 알고 싶습니다.\nA1.  입학 시 글로벌캠퍼스의 모든 학과(부)를 주전공으로 선택할 수 있\n는 기회가 부여됩니다. 단, 우크라이나학과와 한국학과는 2학년 배\n정이 불가하여 선택할 수 없습니다.\nQ2.  2학년 진급시 이중(부)전공으로 선택할 수 있는 학과를 알고 싶\n습니다.\nA2.  서울, 글로벌캠퍼스 구분 없이 모든 학과를 선택할 수 있습니다. 단, \n글로벌캠퍼스의 융합인재학부와 서울캠퍼스 사범대학의 학과는 해\n당 모집단위의 커리큘럼 특성 상 선택할 수 없습니다.\nQ3.  2학년 진급 시 학과 선택을 할 때, 선발기준에 대해서 알고 싶습\n니다.\nA3.  2학년 진급 시 이루어지는 학과 선택과정에서의 선발기준은 따로 \n존재하지 않습니다. 자유전공학부(글로벌)에 입학한 모든 신입생들\n에게 원하는 전공을 자유롭게 선택할 수 있는 기회를 제공하고 있\n으니 참고 바랍니다.\nOpen Major Division(Global Campus)\n자유전공학부(글로벌)\n전화번호 031-330-4797\n홈페이지 gomd.hufs.ac.kr\n글로벌캠퍼스 GLOBAL CAMPUS\nDIVISION OF \nCLIMATE CHANGE\n기후변화융합학부\n기후변화융합학부 68', '| --- | --- | --- | --- | --- | --- | --- | --- | --- |\n| 1 | 영어관련 전공 | 기타언어 | • 제2외국어(영어 제외) : FLEX 인증 원칙(해당언어 전공학과 기준) • 국가공인한자능력시험 : 3급 이상 • KBS한국어능력시험 : 3-급 이상 • 해당언어 전공 기초어학강좌 : 6학점 이상 이수(이중/부전공 언어 제외) | • 제2외국어(영어 제외) : FLEX 인증 원칙(해당언어 전공학과 기준) • 국가공인한자능력시험 : 3급 이상 • KBS한국어능력시험 : 3-급 이상 • 해당언어 전공 기초어학강좌 : 6학점 이상 이수(이중/부전공 언어 제외) | • 제2외국어(영어 제외) : FLEX 인증 원칙(해당언어 전공학과 기준) • 국가공인한자능력시험 : 3급 이상 • KBS한국어능력시험 : 3-급 이상 • 해당언어 전공 기초어학강좌 : 6학점 이상 이수(이중/부전공 언어 제외) | • 제2외국어(영어 제외) : FLEX 인증 원칙(해당언어 전공학과 기준) • 국가공인한자능력시험 : 3급 이상 • KBS한국어능력시험 : 3-급 이상 • 해당언어 전공 기초어학강좌 : 6학점 이상 이수(이중/부전공 언어 제외) | • 제2외국어(영어 제외) : FLEX 인증 원칙(해당언어 전공학과 기준) • 국가공인한자능력시험 : 3급 이상 • KBS한국어능력시험 : 3-급 이상 • 해당언어 전공 기초어학강좌 : 6학점 이상 이수(이중/부전공 언어 제외) | • 제2외국어(영어 제외) : FLEX 인증 원칙(해당언어 전공학과 기준) • 국가공인한자능력시험 : 3급 이상 • KBS한국어능력시험 : 3-급 이상 • 해당언어 전공 기초어학강좌 : 6학점 이상 이수(이중/부전공 언어 제외) |\n| 2 | 비영어 전공 | 영어 | 구분 | FLEX | FLEX 스피킹 | TOEIC | TOEIC 스피킹 | OPIc |', '[공통] 2025년 2월 졸업예정자 교원자격취득 관련 ""약물 중독 여부 검사 결\n\n[공통] 2025년 2월 졸업예정자 교원자격취득 관련 ""약물 중독 여부 검사 결\n\n｢ 초 ‧ 중등교육법 ｣ 제 21 조의 2 ( 교사 자격 취득의 결격사유 )와 ｢ 교원자격검정령 시행규칙 ｣ 제 9조 법령에 근거하여 2025년\xa02월 졸업자 중 교원자격증 취득 예정자 는 무시험검정원\n\n서 제출시 < 마약 ‧ 대마 ‧ 향정 신성 의약 품 중독자 여부 >\xa0진단\xa0결 과 확인서 를 같이 제출 하여야 합니다.\n\n아래의 내용을 참고하여 교원자격증 취득 대상 학생(사범대학 및 비사범대 교직과정)들은 해당 기간에\xa0검사 기관을 방문 하여 검사 시행 후 결과확인서(반드시 원본)를\n\n무시험검정원서와 같이 제출 하시기 바랍니다.\n\n- 아래\xa0-\n\n2. 검진 방법 : 해당 기관 검사 예약 후 방문 검사 → 음성반응 검사결과 통보서 발급 →\xa0\xa0학사종합지원센터로 제출\n\n* 양성반응의 경우 2차 정밀 검사\xa0/ 기존 치료용 약물 복용자는 별도의 중독자 아님을 증명하 는 진단서(또는 확인서) 제출\n\n* 검사는 12월\xa016일\xa0부터\xa0 개인별 검사 진행하고\xa0\xa0해당 결과를 제출하여야 함(해당 기간 이전 검사는 인정하지 않음).\n\n4. 기타 : 검사 결과지는 반드시 원본으로 제출 하여야 하며 방문 제출이 어려운 경우, 무시험검정원서와 함께\xa0등기 우편 발송 가능\n\n5. 등기 발송 주소\xa0:\xa0서울시 동대문구 이문로 107 한국외국어대학교 본관\xa01층\xa0118호\xa0학사종합지원센터 사범대학 및 교직 담당자 앞\n\n경기도 용인시 처인구 모현읍 외대로 81 한국외국어대학교\xa0학사종합지원센터\xa0 교직 담당자 앞', '[글로벌] 2025학년도 1학기 졸업논문 제출 및 졸업시험 일정 공고 새글\n\n| 0 | 1 | 2 | 3 | 4 | 5 | 6 | 7 |\n|:-----------------|:------------------------------|:-------------------|:-------------------|:-------------------|:-------------------|:-------------------|:-------------------|\n| 단과대학명 | 학과(전공) | 졸업논문/시험 방식 | 졸업논문/시험 방식 | 졸업논문/시험 방식 | 졸업논문/시험 방식 | 졸업논문/시험 방식 | 학과사무실 |\n| 단과대학명 | 학과(전공) | 졸업논문 | 졸업시험 | FLEX 대체 | FLEX 대체 | 기타 | 학과사무실 |\n| 단과대학명 | 학과(전공) | 졸업논문 | 졸업시험 | 정기시험 | 교내 | 기타 | 학과사무실 |\n| 인문대학 | 철학과 | ○ | 정보없음 | 정보없음 | 정보없음 | 정보없음 | 031)330-4282 |\n| 인문대학 | 사학과 | ○ | 정보없음 | 정보없음 | 정보없음 | 정보없음 | 031)330-4288 |\n| 인문대학 | 언어인지과학과 | ○ | 정보없음 | 정보없음 | 정보없음 | 정보없음 | 031)330-4286 |\n| 인문대학 | 지식콘텐츠전공 | ○ | 정보없음 | 정보없음 | 정보없음 | 정보없음 | 031)330-4980 |\n| 융합인재대학 | 융합인재학부 | 정보없음 | ○ | ○ | 정보없음 | ○ | 031)330-4707 |\n| 통번역대학 | 영어통번역학부 | 정보없음 | 정보없음 | ○ | 정보없음 | ○ | 031)330-4202, 4559 |\n| 통번역대학 | 독일어통번역학과 | 정보없음 | 정보없음 | ○ | 정보없음 | 정보없음 | 031)330-4206 |\n| 통번역대학 | 스페인어통번역학과 | 정보없음 | ○ | ○ | 정보없음 | 정보없음 | 031)330-4210 |', '[서울]2025-1학기 폐강(2차) 공고(서울캠퍼스)\n\n[서울]2025-1학기 폐강(2차) 공고(서울캠퍼스)\n\n2025-1학기 폐강(2차) 공고(서울캠퍼스)\n\n2025학년도 제1학기 서울캠퍼스 폐강(2차) 강좌를 아래와 같이 공고하오니\n\n해당 강좌 수강생은 기간 내에 수강신청을 변경하시기 바랍니다.\n\n- 아\xa0\xa0 래 -\n\n■ 폐강(2차) 강좌 수강생 수강신청 변경 안내\n\n1. 변경 기간 : 2025. 3. 14.(금) ~ 3. 18.(화), 오후 4시까지\n\n※ 3. 18.(화) 오후 4시까지 수신된 이메일에 한하여 접수하오니 기한 내 이메일 발송\n\n2. 신청 방법 : 신청서 작성 후 이메일 제출\n\n가. 신청서 : 붙임의 “폐강과목 대체 수강 신청서” 다운로드\n\n나. 제출처 : 본인 1전공 소속 단과대학 교학파트 제출 (※ 전공/교양 모두 작성 제출)\n\n단과대학\n\n이메일\n\n전화문의\n\n창구\n\n서양어대학, 중국학대학, 일본학대학\n\nhana@hufs.ac.kr\n\n02) 2173 - 2121\n\n5번\n\n사회과학대학, 상경대학, 경영대학,\n\n국제학부, LD학부, LT학부, KFL학부\n\nhaksa6@hufs.ac.kr\n\n02) 2173 - 2308\n\n6번\n\n영어대학, 아시아언어문화대학,\n\nAI융합대학\n\nhaksa7@hufs.ac.kr\n\n02) 2173 - 2264\n\n7번\n\n사범대학\n\npoisson@hufs.ac.kr\n\n02) 2173 - 2338\n\n4번\n\n자유전공학부(서울)\n\nhaksaseoul@hufs.ac.kr\n\n02) 2173 - 2109\n\n9번\n\n3. 유의 사항\n\n가. 폐강된 과목의 수강은 자동 취소됨\n\n나. 폐강된 과목 수와 동일한 과목 수 만큼 신청 가능 (단, 최대 수강신청 학점 초과 불가)\n\n다. 수강신청 변경 시점 기준으로 제한 인원을 초과하지 않는 과목으로 변경 가능\n\n※ 수강 가능 강좌(신청/제한인원) 확인 방법 : ▶ “강의시간표 조회” 바로가기\n\n■ 2025학년도 제1학기 폐강(2차) 강좌 현황\n\n개설학과\n\n이수\n\n영역\n\n학년\n\n학수번호\n\n교과목명\n\n학점\n\n시간\n\n교강사명\n\n강의시간\n\n독일어과\n\n전공\n\n2', '## [paragraph] ##\n4) 졸업 요건 : 졸업 시험 및 논문 중 택일(지도교수가 배정 졸업 논문 지도)\n\n## [list] ##\n- 5) 문의처 : wacihufs@hufs.ac.kr(홈페이지 : wacimajor.hufs.ac.kr)\n\n## [footer] ##\n- 50 -', '## [paragraph] ##\n나. 처리절차\n\n## [paragraph] ##\n1) 유고결석·결시 공통 안내사항\n\n## [paragraph] ##\n* 질병 및 상해의 경우 의원에서 발급받은 서류는 해당되지 않음\n(병원급 의료 기관 확인 : 건강보험심사평가원(https://www.hira.or.kr)\n\n## [paragraph] ##\n⇒ 검색창에서 병원이름 기입 후 검색 ⇒ 검색결과에서 해당병원 클릭\n⇒ 병원 기본정보 중 병원구분에서 병원등급 확인\n\n## [paragraph] ##\n** 질병관리청의 법정감염병 확인(https://dportal.kdca.go.kr)\n(질병관리청 감염병 포털 -> 감염병정보 -> 법정감염병에서 병명 확인)\n\n## [paragraph] ##\n2) 유고결석(수업 결석) : 사유발생 시 담당교수에게 알리고, 유고사유가 끝난 날부터\n7일 이내 증빙서류를 제출해야 함.\n(해당학기 졸업가능한 조기취업자는 입사확정 후 즉시 제출)\n\n## [table] ##\n| 사유 | 기간 | 증빙서류 | 절차 | 비고 |\n| --- | --- | --- | --- | --- |\n| 직계존비속, 배우자 및 형제 자매의 사망 | 7일 이내 (중간 공휴일 포함) | 사망진단서, 가족관계증명서 등 | 담당교수에게 증빙서류 제출 |  |\n| 본인의 결혼 | 7일 이내 (중간 공휴일 포함) | 청첩장, 예식장계약서 등 | 담당교수에게 증빙서류 제출 |  |\n| 징병검사, 입대지원시험 및 예비군 훈련 | 해당기간 | 소집영장사본 또는 징병검사 통지서사본, 교육필증 등 | 담당교수에게 증빙서류 제출 |  |\n\n## [footer] ##\n- 68 -', '-  기업체: 폴란드에 진출한 국내 기업, 글로벌 기업\n-  금융계: 은행 등 금융기관, 증권·보험 회사\n-  언론계: 외신기자, PD, 방송작가\n-  공공기관: 대사관, 문화원, 문화재단, 공기업, 행정부처 공무원 등\n-  문화예술계: 번역가, 큐레이터, 어린이책 기획자 등\nQ&A \nQ1.  폴란드학과는 한국에 하나밖에 없는 유일 전공학과로 알고 있는\n데요, 그렇다면 폴란드 정부가 학과생들에게 지원하는 별도의 혜\n택이 있나요?\nA1.  네. 폴란드 정부가 우리 학과에 쏟는 애정과 관심은 실로 어마어마합\n니다. 지금껏 폴란드 대통령이나 외무부 장관, 문화부 장관, 교육부 \n장관, 국회 의장 등이 학과를 방문했고, 주한 폴란드 대사관을 통해 \n전통의상 및 폴란드 도서 기증, 원어신문 발간 지원, 말하기 경연대\n회 공동주관 등 다양한 분야에서 학생들에게 전폭적인 지원을 아끼\n지 않고 있습니다. 또한 폴란드 교육부가 매년 20명의 학과생들에\n게 폴란드 현지 대학에서의 서머스쿨 장학금을 제공하고 있습니다.\nQ2.  폴란드학과에서 진행하고 있는 다양한 비교과 프로그램과 학과 행\n사, 그리고 취업률이나 학과에서 단독으로 운영하는 장학금 현황 등\n과 관련하여 보다 상세한 정보와 현황을 알고 싶으면 어디에서 찾\n을 수 있나요?\nA2.  폴란드학과는 학과 홈페이지뿐 아니라 SNS와 유튜브 단독 계정을 \n운영하고 있습니다. 우리 학과의 다양한 프로그램과 이벤트, 학과 \n분위기나 학과생들의 Campus life가 궁금한 분들은 아래 창구로 접\n속하면 생생하고 알찬 정보를 얻을 수 있습니다. 특히 유튜브 계정\n에 접속하면, 재미있는 컨텐츠가 가득합니다.\n* Instagram: https://www.instagram.com/hufs_polski/\n* Facebook: https://www.facebook.com/polski.hufs\n* Youtube: https://www.youtube.com/@user-eb7zz1dw4j']","일본어통번역학과(일통)의 FLEX 시험 점수 제출 기간은 다음과 같습니다:

- **제출 기간**: 2025년 4월 16일 (수요일) ~ 4월 23일 (수요일)

이 기간 내에 FLEX 시험 성적표를 해당 학과 사무실에 제출하셔야 합니다. 정확한 제출 방법이나 추가적인 사항은 학과 사무실에 문의하시기 바랍니다. 혹시 더 도와드릴까요?",졸업시험 점수 제출 기간은 공지사항에 따라 각 학과 사무실로 문의해야 합니다. 일본어통번역학과 사무실 연락처는 '031-330-4234'입니다.,0.7787878787767532,0.5,0.75,0.0
2학기 중간고사 이후에 데이터 베이스 관련해서 교수님한테 상담 받고 싶은데 언제부터 가능할까? 그리고 교수님 연락처도 알고 싶어.,"['[Machine Learning] 3학년 대상 / 교수: 박민규 / 목요일 7,8,9교시 / 강의실 0410호 / 학점: 3 / 전공필수 과목 아님 / 온라인강의 아님 / P/F 평가 과목 아님 / 원어강의 아님\n\n[Big Data] 4학년 대상 / 교수: 서성현 / 금요일 1,2,3교시 / 강의실 0213호 / 학점: 3 / 전공필수 과목 아님 / 온라인강의 아님 / P/F 평가 과목 아님 / 원어강의 아님', '[표본조사론] 3학년 대상 / 교수: 신기일 / 월요일 3,수,5,6교시 / 강의실 0302호 / 학점: 3 / 전공필수 과목 아님 / 온라인강의 아님 / P/F 평가 과목 아님 / 원어강의 아님\n\n[데이터사이언스세미나] 4학년 대상 / 교수: 장혜진 / 수요일 7,8,9교시 / 강의실 0302호 / 학점: 3 / 전공필수 과목 아님 / 온라인강의 아님 / P/F 평가 과목 아님 / 원어강의 아님\n\n[통계적방법론] 4학년 대상 / 교수: 이현주 / 월요일 5,6,화,3교시 / 강의실 0302호 / 학점: 3 / 전공필수 과목 아님 / 온라인강의 아님 / P/F 평가 과목 아님 / 원어강의 아님', '미완료\n\n해당학과 학과사무실에 문의\n\n(3) 이중전공\n\n(3) 졸시논문\n\n완료\n\n이중전공 졸업논문 , 졸업시험 , 졸업시험대체성적 제출 및 입력 완료\n\n이중전공 졸업논문 ,\n\n졸업시험 등\n\n통과여부\n\n미완료\n\n해당학과 학과사무실에 문의\n\n비대상\n\n이중전공 비대상자', '가 . 해당학과 : 자세한 사항은 첨부파일 참조\n\n나 . 시험일자 : 2025. 5. 24( 토 ) 오전 10:00 서울캠퍼스 시행예정\n\n※ 정확한 시간 / 장소는 추후 통지\n\n다 . 접수기간 : 2025. 4. 16.( 수 ) ~ 4. 23.( 수 ) 해당학과 사무실에 신청 ( 기한 이후 추가 신청 불가 )\n\n* 7 학기 이상 재적생만 신청가능\n\n8. 유의 사항\n\n가 . 졸업시험 및 졸업논문 심사에 통과한 자는 졸업 시까지 그 자격이 유효함 ( 단 , 학적을 상실한 때에는 그 자격을 인정하지 아니함 )\n\n나 . 제 2 전공 , 이중전공자도 해당학과 문의 / 학과에 따른 졸업시험 응시 , 논문 제출 등 pass 하기 바람\n\n다 . 졸업시험 응시원서 제출 시 학생 본인의 연락처를 정확히 기재할 것', '1. 평가기간 : 2025.\xa04. 7.( 월 ) 10:00 ~ 2025.\xa04.\xa025.( 금 ) 17:00\n\n2. 평가대상 : 2025 학년도 1 학기 개설 강좌\n\n3. 평가방법 : 홈페이지 핫링크 “2025-1 학기\xa0중간\xa0강의평가 바로가기 ”\n\n4. 유의사항\n\n- 중간 강의평가에 대한 학생의 수행 여부는 선택 사항입니다.\n\n-\xa0강의평가를 완료하고 저장하면 어따한 경우에도\xa0수정이 불가능합니다 .\n\n- 강의평가 결과는 익명 ( 출석부 순서가 아님 ) 으로 처리되어 담당 교원에게 공개합니다 .\n\n- 서술형 평가의 답변도 담당 교강사에게 익명으로 공개되니 좋았던 점과 개선할 점에 대해 구체적으로 기재해주시기 바랍니다 .', '2025-1학기 중간 강의평가 실시 안내\n\n2025-1학기 중간 강의평가 실시 안내\n\n2025-1학기 중간\xa0강의평가 실시 안내\n\n2025 학년도 1 학기\xa0중간\xa0강의평가를 다음과 같이 실시합니다 .\n\n우리 대학 강의의 질 개선을 위해 중간 강의평가를 실시하오니, 학생 여러분은 아래의 안내에 따라 참여해주시기 바랍니다. 중간 강의평가 제도는 강의가 실제로 이루어지는 학기 중에 강의평가를 실시함으로써, 강의에 대한 학생들의 의견을 파악하고, 남은 학기 중 수업의 질적 개선을 도모할 수 있습니다.\n\n1. 평가기간 : 2025.\xa04. 7.( 월 ) 10:00 ~ 2025.\xa04.\xa025.( 금 ) 17:00\n\n2. 평가대상 : 2025 학년도 1 학기 개설 강좌\n\n3. 평가방법 : 홈페이지 핫링크 “2025-1 학기\xa0중간\xa0강의평가 바로가기 ”\n\n4. 유의사항\n\n- 중간 강의평가에 대한 학생의 수행 여부는 선택 사항입니다.\n\n-\xa0강의평가를 완료하고 저장하면 어따한 경우에도\xa0수정이 불가능합니다 .\n\n- 강의평가 결과는 익명 ( 출석부 순서가 아님 ) 으로 처리되어 담당 교원에게 공개합니다 .\n\n- 서술형 평가의 답변도 담당 교강사에게 익명으로 공개되니 좋았던 점과 개선할 점에 대해 구체적으로 기재해주시기 바랍니다 .\n\n- 건전한 소통을 위해 상대방을 존중하는 표현을 사용해주시고 , 비속어 , 비하적 표현은 삼가해 주시기 바랍니다 .\n\n교육혁신원', '3. 평 가 방 법\n\n가 . 필답고사 , 과제물 , 출석률 등을 참작하여 평가함 .\n\n나 . 시험시간표는 별도로 발표하지 않으며 정해진 시험기간에 실시함 .\n\n4. 성적입력 알림 서비스 실시 : 성적입력 시스템에서 ‘ 최종제출 ’ 을 클릭하여 성적입력이 완료되면 해당 학생들에게 ‘ 성적이 입력되어 확인할 수 있다 ’ 는 문자가 (HUFS 앱 설치자에 한함 ) 발송됨 .\n\n2025. 4.\n\n서울 · 글로벌캠퍼스 교무처장\n\n| 0 |\n|:-------------------------|\n| 2025-1학기 중간시험 공고 |', '다. 이수구분 신청 전, 전공교류교과목을 수강편람에서 확인하고 문의 사항이 있을 경우 신청전 미리 상담 (수강편람 확인 클릭)\n\n라. 신청 후 3~4일 (평일 기준) 이후\xa0종합정보시스템에서 변경결과를 반드시 확인하고 변경이 안된 경우, 담당자에게 연락하여 반드시 확인', '2025-1학기 중간 강의평가 실시 안내\n\n2025-1학기 중간 강의평가 실시 안내\n\n2025-1학기 중간\xa0강의평가 실시 안내\n\n2025 학년도 1 학기\xa0중간\xa0강의평가를 다음과 같이 실시합니다 .\n\n우리 대학 강의의 질 개선을 위해 중간 강의평가를 실시하오니, 학생 여러분은 아래의 안내에 따라 참여해주시기 바랍니다. 중간 강의평가 제도는 강의가 실제로 이루어지는 학기 중에 강의평가를 실시함으로써, 강의에 대한 학생들의 의견을 파악하고, 남은 학기 중 수업의 질적 개선을 도모할 수 있습니다.\n\n1. 평가기간 : 2025.\xa04. 7.( 월 ) 10:00 ~ 2025.\xa04.\xa025.( 금 ) 17:00\n\n2. 평가대상 : 2025 학년도 1 학기 개설 강좌\n\n3. 평가방법 : 홈페이지 핫링크 “2025-1 학기\xa0중간\xa0강의평가 바로가기 ”\n\n4. 유의사항\n\n- 중간 강의평가에 대한 학생의 수행 여부는 선택 사항입니다.\n\n-\xa0강의평가를 완료하고 저장하면 어따한 경우에도\xa0수정이 불가능합니다 .', '[빅데이터분석] 3학년 대상 / 교수: 안민정 / 금요일 4,5,6교시 / 강의실 0305호 / 학점: 3 / 전공필수 과목 아님 / 온라인강의 아님 / P/F 평가 과목 아님 / 원어강의 아님\n\n[빅데이터시각화] 3학년 대상 / 교수: 이선순 / 월요일 7,8,9교시 / 강의실 0514호 / 학점: 3 / 전공필수 과목 아님 / 온라인강의 아님 / P/F 평가 과목 아님 / 원어강의 아님', '- 서술형 평가의 답변도 담당 교강사에게 익명으로 공개되니 좋았던 점과 개선할 점에 대해 구체적으로 기재해주시기 바랍니다 .\n\n- 건전한 소통을 위해 상대방을 존중하는 표현을 사용해주시고 , 비속어 , 비하적 표현은 삼가해 주시기 바랍니다 .\n\n교육혁신원', '4.\xa0유의사항\n\n가. 이중(부)전공이 글로벌캠퍼스일 경우, 본인의 1전공 단과대학 담당자에게 제출\n\n나 . 이중(부)전공이 서울캠퍼스일 경우, 본인의 서울캠퍼스\xa0담당자에게 제출 (담당자 확인 클릭)\n\n다. 이수구분 신청 전, 전공교류교과목을 수강편람에서 확인하고 문의 사항이 있을 경우 신청전 미리 상담 (수강편람 확인 클릭)\n\n라. 신청 후 3~4일 (평일 기준) 이후\xa0종합정보시스템에서 변경결과를 반드시 확인하고 변경이 안된 경우, 담당자에게 연락하여 반드시 확인', '2025-1학기 중간 강의평가 실시 안내\n\n2025-1학기 중간 강의평가 실시 안내\n\n2025-1학기 중간\xa0강의평가 실시 안내\n\n2025 학년도 1 학기\xa0중간\xa0강의평가를 다음과 같이 실시합니다 .\n\n우리 대학 강의의 질 개선을 위해 중간 강의평가를 실시하오니, 학생 여러분은 아래의 안내에 따라 참여해주시기 바랍니다. 중간 강의평가 제도는 강의가 실제로 이루어지는 학기 중에 강의평가를 실시함으로써, 강의에 대한 학생들의 의견을 파악하고, 남은 학기 중 수업의 질적 개선을 도모할 수 있습니다.\n\n1. 평가기간 : 2025.\xa04. 7.( 월 ) 10:00 ~ 2025.\xa04.\xa025.( 금 ) 17:00\n\n2. 평가대상 : 2025 학년도 1 학기 개설 강좌', '[그래프마이닝] 4학년 대상 / 교수: 장익범 / 수요일 5,금,5,6교시 / 강의실 5309호 / 학점: 3 / 전공필수 과목 아님 / 온라인강의 아님 / P/F 평가 과목 아님 / 원어강의 맞음\n\n[데이터베이스설계] 4학년 대상 / 교수: 손기락 / 월요일 1,2,수,4교시 / 강의실 5309호 / 학점: 3 / 전공필수 과목 아님 / 온라인강의 아님 / P/F 평가 과목 아님 / 원어강의 아님\n\n[멀티코어컴퓨팅] 4학년 대상 / 교수: 김승욱 / 금요일 7,8,9교시 / 강의실 5309호 / 학점: 3 / 전공필수 과목 아님 / 온라인강의 아님 / P/F 평가 과목 아님 / 원어강의 아님', '따라서 특정캠퍼스 소속 학생이 이중 ( 부 ) 전공 학생으로서 타캠퍼스에 개설된 기초 교과의\xa0수강이 필요해 이에 대한 수강신청을 희망하시는 경우 3. 5( 수 ) 17 시까지 붙임 양식을 작성하여 수강하고자 하는 기초 과목이 개설된 학과에 제출하여 주시기 바랍니다 .', '이후부터 확인 가능 편입생 – 2월 22일(토) 이후부터 확인 가능 바로가기 Click▶ 강의시간표·강의계획서 핫링크 강의시간표 Click▶ 수강편람 핫링크 수강편람(서울) Click▶ 수강편람(글로벌) Click▶ 전공 교육과정 안내 종합정보 시스템 종합정보시스템 로그인 →\xa0학과(부) 교육과정 안내도\xa0메뉴 ※ 각 전공의 전체교과목 및 최근 개설된 강좌 정보 확인 가능 예비수강신청함 바로가기 핫링크 바로가기 Click▶ 수강신청 바로가기 핫링크 ※ 수강신청\xa0당일 학교 홈페이지에 바로가기 안내됨 ★ 사용법 모의 동영상 예비수강신청함 모의 동영상 Click▶ 수강신청 모의 동영상 Click▶ 종합정보시스템 바로가기 Click▶ ☎ 학과사무실 연락처 (강좌별 “비고”란 수강생 안내 및 기타 문의) 바로가기 Click▶ 2025. 2. 교무처장 | 정보없음 | 정보없음 | 정보없음 | 정보없음 |', '[기계학습] 3학년 대상 / 교수: 윤일동 / 화요일 7,목,5,6교시 / 강의실 5201호 / 학점: 3 / 전공필수 과목 아님 / 온라인강의 아님 / P/F 평가 과목 아님 / 원어강의 아님\n\n[데이터베이스] 3학년 대상 / 교수: 손기락 / 화요일 1,2,목,3교시 / 강의실 5309호 / 학점: 3 / 전공필수 과목 아님 / 온라인강의 아님 / P/F 평가 과목 아님 / 원어강의 아님\n\n[데이터베이스] 3학년 대상 / 교수: 손기락 / 화요일 3,목,1,2교시 / 강의실 5309호 / 학점: 3 / 전공필수 과목 아님 / 온라인강의 아님 / P/F 평가 과목 아님 / 원어강의 아님', '[비즈니스어낼리틱스입문] 1학년 대상 / 교수: 이충목 / 월요일 2,3,화,1교시 / 강의실 5403호 / 학점: 3 / 전공필수 과목 아님 / 온라인강의 아님 / P/F 평가 과목 아님 / 원어강의 아님\n\n[데이터베이스설계및응용] 2학년 대상 / 교수: 이석룡 / 월 1 (5403) 수 1 2 (5203) / 학점: 3 / 전공필수 과목 아님 / 온라인강의 아님 / P/F 평가 과목 아님 / 원어강의 아님\n\n[데이터사이언스개론] 2학년 대상 / 교수: 윤재욱 / 월요일 4,수,7,8교시 / 강의실 5203호 / 학점: 3 / 전공필수 과목 아님 / 온라인강의 아님 / P/F 평가 과목 아님 / 원어강의 아님\n\n[생산계획및통제] 2학년 대상 / 교수: 선지웅 / 화요일 1,2,금,3교시 / 강의실 5310호 / 학점: 3 / 전공필수 과목 맞음 / 온라인강의 아님 / P/F 평가 과목 아님 / 원어강의 아님', '(비교과) 전공탐색 연계한 자기탐색, 진로탐색 프로그램 지원\n1학년(여름방학) 학과 설명회\n2학기 희망 전공의 학문기초 교과목을 선택할 수 있도록 정보제공 \n1학년 2학기 전공 진입 전 기초교육 \n(교과) 교양 교과목 이수 및 희망 전공의 학문기초 교과목 이수 \n(비교과) 다양한 프로그램 연계 전공탐색학기제 운영 \n슬기로운 대학생활 \n자유전공학부(글로벌)는 전공이 정해지지 않아 학생들에게 보다 많은 \n경험을 제공할 수 있는 발판을 마련합니다. 다른 학생들과 다르게 자유\n전공학부(글로벌) 학생들은 전공을 미리 선택하지 않은 상태로 학교에 \n입학하게 됩니다. 이런 기회를 토대로 다양한 수업들을 통해서 자신과 \n잘 맞는 전공을 탐색하여 자신이 원하는 진로를 스스로 개척해 나가는 \n미래를 가져가시길 바랍니다.\nQ&A \nQ1. 2학년 진급시 주전공으로 선택할 수 있는 학과를 알고 싶습니다.\nA1.  입학 시 글로벌캠퍼스의 모든 학과(부)를 주전공으로 선택할 수 있\n는 기회가 부여됩니다. 단, 우크라이나학과와 한국학과는 2학년 배\n정이 불가하여 선택할 수 없습니다.\nQ2.  2학년 진급시 이중(부)전공으로 선택할 수 있는 학과를 알고 싶\n습니다.\nA2.  서울, 글로벌캠퍼스 구분 없이 모든 학과를 선택할 수 있습니다. 단, \n글로벌캠퍼스의 융합인재학부와 서울캠퍼스 사범대학의 학과는 해\n당 모집단위의 커리큘럼 특성 상 선택할 수 없습니다.\nQ3.  2학년 진급 시 학과 선택을 할 때, 선발기준에 대해서 알고 싶습\n니다.\nA3.  2학년 진급 시 이루어지는 학과 선택과정에서의 선발기준은 따로 \n존재하지 않습니다. 자유전공학부(글로벌)에 입학한 모든 신입생들\n에게 원하는 전공을 자유롭게 선택할 수 있는 기회를 제공하고 있\n으니 참고 바랍니다.\nOpen Major Division(Global Campus)\n자유전공학부(글로벌)\n전화번호 031-330-4797\n홈페이지 gomd.hufs.ac.kr\n글로벌캠퍼스 GLOBAL CAMPUS\nDIVISION OF \nCLIMATE CHANGE\n기후변화융합학부\n기후변화융합학부 68', '-  기업체: 폴란드에 진출한 국내 기업, 글로벌 기업\n-  금융계: 은행 등 금융기관, 증권·보험 회사\n-  언론계: 외신기자, PD, 방송작가\n-  공공기관: 대사관, 문화원, 문화재단, 공기업, 행정부처 공무원 등\n-  문화예술계: 번역가, 큐레이터, 어린이책 기획자 등\nQ&A \nQ1.  폴란드학과는 한국에 하나밖에 없는 유일 전공학과로 알고 있는\n데요, 그렇다면 폴란드 정부가 학과생들에게 지원하는 별도의 혜\n택이 있나요?\nA1.  네. 폴란드 정부가 우리 학과에 쏟는 애정과 관심은 실로 어마어마합\n니다. 지금껏 폴란드 대통령이나 외무부 장관, 문화부 장관, 교육부 \n장관, 국회 의장 등이 학과를 방문했고, 주한 폴란드 대사관을 통해 \n전통의상 및 폴란드 도서 기증, 원어신문 발간 지원, 말하기 경연대\n회 공동주관 등 다양한 분야에서 학생들에게 전폭적인 지원을 아끼\n지 않고 있습니다. 또한 폴란드 교육부가 매년 20명의 학과생들에\n게 폴란드 현지 대학에서의 서머스쿨 장학금을 제공하고 있습니다.\nQ2.  폴란드학과에서 진행하고 있는 다양한 비교과 프로그램과 학과 행\n사, 그리고 취업률이나 학과에서 단독으로 운영하는 장학금 현황 등\n과 관련하여 보다 상세한 정보와 현황을 알고 싶으면 어디에서 찾\n을 수 있나요?\nA2.  폴란드학과는 학과 홈페이지뿐 아니라 SNS와 유튜브 단독 계정을 \n운영하고 있습니다. 우리 학과의 다양한 프로그램과 이벤트, 학과 \n분위기나 학과생들의 Campus life가 궁금한 분들은 아래 창구로 접\n속하면 생생하고 알찬 정보를 얻을 수 있습니다. 특히 유튜브 계정\n에 접속하면, 재미있는 컨텐츠가 가득합니다.\n* Instagram: https://www.instagram.com/hufs_polski/\n* Facebook: https://www.facebook.com/polski.hufs\n* Youtube: https://www.youtube.com/@user-eb7zz1dw4j', '## [list] ##\n- ‧ 기초 이론 : 12학점 이상\n- ‧ 소프트웨어 및 데이터분석 : 18학점 이상\n- ‧ 융합형 프로젝트 : 3학점 이상(캡스톤설계1, 2 중 한 과목 이상 수강)\n\n## [heading1] ##\n# 4) 교과 과정\n\n## [paragraph] ##\n총 이수학점 : 42학점\n\n## [paragraph] ##\n-\n\n## [table] ##\n| 학년 | 이수영역 | 1학기 | 2학기 |\n| --- | --- | --- | --- |\n| 1학년 | 교양 | 컴퓨팅사고 또는 컴퓨터프로그래밍 | 컴퓨팅사고 또는 컴퓨터프로그래밍 |\n| 2학년 | 기초 이론 | 데이터사이언스개론 데이터사이언스를위한수학군* (필수, 택1) | 기초확률및통계군* (필수, 택1) 회귀분석군* (필수, 택1) 확률분포론 |\n| 2학년 | 소프트웨어 및 데이터 분석 | 자료구조 (필수) | 알고리즘 |\n| 3학년 | 소프트웨어 및 데이터 분석 | 수리통계학 시계열분석 경영과학 웹프로그래밍 기계학습군* (필수, 택1) | 다변량자료분석 운영체제 데이터베이스 텍스트애널리틱스 |\n| 4학년 | 소프트웨어 및 데이터 분석 | 데이터시각화 딥러닝응용 | 데이터사이언스특론 |\n| 4학년 | 융합형 프로젝트 | 캡스톤설계1 | 캡스톤설계2 |\n\n## [footer] ##\n- 52 -', '강보험심사평가원, 건강증진개발원 등\n-  연구소 및 연구: 문화관광 연구소, 보건산업진흥연구원 등 \n-  기업체: Tourism & Hospitality 관련 스타트업, 관관 관련 플랫폼 기\n업, 건강 및 예방의학 관련 스타트업, 웰니스 플랫폼 관련 기업, 병원 \n및 재활센터, 글로벌 제약회사, 실버타운 등 \nQ&A \nQ1. 트랙식 교육이 무엇인가요?\nA1.  트랙식 교육은 학습자가 전공과 학문 간의 경계를 넘어 자신의 관심\n사나 요구 사항에 따라 필요한 트랙을 선택적으로 고를 수 있는 집\n중형 교육 과정입니다. \nQ2. 진로와 취업 관련 어떤 지원이 있나요? \nA2.  인턴십과 현장실습, 해당 분야 전문가 특강과 세미나를 진행할 예정\n이며, 현재 창업 또는 기업에서 활동 중인 전문 기업인으로부터 현\n장에 대한 전문 지식과 경험, 기술 또는 능력을 배울 수 있는 팀티칭 \n수업도 구상 중에 있습니다. 그 외 다양한 취업 지원 및 경력 개발 \n서비스 지원도 진행할 예정입니다. \nGlobal Sport Industry\n글로벌스포츠산업학부\n전화번호 031-330-4524\n홈페이지 sport.hufs.ac.kr\n전공소개 \n한국외국어대학교 글로벌스포츠산업학부는 스포츠산업의 다양한 영역\n을 아우르는 전문 교육과 연구를 목표로 하는 학부입니다. 본 학부는 스\n포츠경영, 마케팅, 스포츠 미디어, 이벤트 기획 및 운영 관리, 스포츠 재\n무회계 등 스포츠 산업 내 다양한 분야에 걸쳐 폭넓은 교육과정을 제공\n하며, 현장 경험을 통한 실무 중심의 교육과 함께, 국제적인 협업 기회 \n및 네트워킹 활동을 통해 학생들의 진로 개발과 국제적 역량 강화를 지\n원합니다. 또한, 글로벌스포츠산업학부는 스포츠 산업에 AI(인공지능)\n와의 융합을 적극적으로 추구하고 있습니다. 이를 통해 스포츠 분야에\n서의 혁신적인 기술과 데이터 분석을 활용하여 새로운 비즈니스 모델을 \n개척하고자 합니다. AI 기술을 활용한 스포츠 데이터 분석, 스포츠 트레\n이닝 및 선수 모니터링, 그리고 팬 경험의 향상을 위한 새로운 기술 도\n입 등의 다양한 영역에서 연구와 교육을 진행하고자 합니다. AI를 활용\n한 맞춤형 컨텐츠 제작, 스포츠 이벤트의 디지털화와 새로운 경험 제공, \n그리고 데이터 기반의 마케팅 전략 수립 등을 통해 스포츠 산업의 미래\n를 선도하는 인재를 양성하고자 합니다.\n필요역량 및 소양', '4학년  전공심화과목을 수강하고, 본인 진로와 관련된 강좌를 집중적으로 \n이수합니다. 학과 전임교수의 지도하에 졸업논문을 작성합니다. \n졸업 후 진로 \n-  정부 및 공공기관: 국공립 박물관의 학예직공무원, 국가기록원 및 지\n자체·대학역사관의 기록연구사, 공무원 등\n-  교육 및 연구: 대학교수, 역사교사, 역사문화 관련 연구소 및 박물관\n의 큐레이터 등\n-  기업체: 일반기업체 및 벤처기업 회사원\n-  기타: 문화예술종사자, 프로그래머 등\nQ&A \nQ1.  역사학을 공부하려면 암기력이 중요한가요?\nA1.  꼭 그렇지만은 않습니다. 역사학은 사료를 검증, 분석하고, 추론하\n면서 역사의 지속과 변화를 탐구하는 학문입니다. 우리 사학과에서 \n공부하면서 이러한 학술적 능력과 함께 창의력을 체계적으로 함양\n할 수 있습니다.\nQ2.  사학을 공부하고 졸업하면 순수한 학술연구 외에 전공 관련해서 \n어떤 일을 할 수 있나요?\nA2.  적지 않은 졸업생들이 기록연구사, 역사교사, 학예연구원 등으로 \n활발하게 활동하고 있습니다. 최근에는 역사콘텐츠의 중요성이 제\n고되면서, 문화예술, 게임분야에서 활약하는 졸업생들도 늘어나\n고 있습니다. \n학과(부) 행사 및 동아리 활동 \n-  동사무소(동양철학): 공자, 맹자 등 특정 철학자의 사상에만 국한되지 \n않고, 전반적인 동양 철학사의 흐름과 이에 따른 사상적 차이들을 학\n습하며 이에 대한 의견을 학회원들끼리 토의합니다.\n-  엑스페르고(서양철학): 혼자 읽고 이해하기엔 버거운 여러 철학 고전 \n서적들을 함께 읽어나가며 자유롭게 토론합니다. 이를 통해 철학자들\n의 사유를 이해하고 비판적 시각을 통해 스스로의 철학적 사유를 기르\n는 훈련을 할 수 있습니다.\n-  앤솔로지(예술철학): 아름다움과 예술 이전의 논의들을 학습한 후 현\n대 문화를 파악하는 여러 방법들을 공부합니다.\n-  LOPES(서양철학사&데이터분석): 영어 원문 번역방식의 서양철학사 \n스터디와 데이터 분석을 통해 통계분석용 프로그램 및 다양한 데이터 \n분석기법과 머신러닝 같은 기술 등을 학습합니다.\n-  철학인의 밤: 학생들의 학술 세미나 및 친목 활동 \n-  철학과 한마당 행사: 연말 중 시행되는 철학과 선배, 교수님들이 함\n께하는 행사로 다양한 이벤트 등과 함께 선배, 교수님과 담소를 나누\n는 친목 활동 \n-  한국외대 총장배 토론대회: 2008년도부터 시작된 토론대회로 인문', '## [heading1] ##\n# ⑥ 세계문화예술경영전공\n\n## [paragraph] ##\n1) 전공개요 : 세계문화예술경영은 문화예술 분야의 다양한 활동에 경영의 원리를 적용하여 이론\n과 실제를 결합함으로써 전문지식과 실무역량을 고루 갖춘 문화 미디에이터(Cultural\nMediator) 양성을 목표로 함. 문화 예술 경영 분야에 관한 체계적인 교육을 받고 배출된\n문화 미디에이터는 기획, 마케팅 및 전략 수립, 교육, 조직관리, 프로그램 개발, 프로젝트\n관리 등의 역할을 수행할 수 있는 전문가로 활동하며, 해당 분야의 장기적인 비전과 정\n책, 행정, 운영방법 등을 제시함으로써 21세기 문화예술경영 분야의 가치를 창출함\n2) 이수학점 및 이수영역 (이수학점 : 2014학번 이전 54학점 / 2015학번 이후 42학점)\n\n## [table] ##\n| 구분 | 구분 | 1학기 | 2학기 | 총학점 |\n| --- | --- | --- | --- | --- |\n| 융합전공 전공교과 | 2학년 | 3~6학점 | 3~6학점 | 30학점 |\n| 융합전공 전공교과 | 3학년 | 3~6학점 | 3~6학점 | 30학점 |\n| 융합전공 전공교과 | 4학년 | 3~6학점 | 3~6학점 | 30학점 |\n| 융합전공 공통기초 | 융합전공 공통기초 | 언어와논리, 문화예술경영론, 디지털인문학입문 인지과학입문, 미디어연구방법론, 인문한국학입문 | 언어와논리, 문화예술경영론, 디지털인문학입문 인지과학입문, 미디어연구방법론, 인문한국학입문 | 30학점 |\n| 융합전공 연계기초 | 융합전공 연계기초 | 세계문화예술경영학과 ‘전공교류 교과목 현황’ 기재 과목 | 세계문화예술경영학과 ‘전공교류 교과목 현황’ 기재 과목 | 12학점 이내 |', '이닝 및 선수 모니터링, 그리고 팬 경험의 향상을 위한 새로운 기술 도\n입 등의 다양한 영역에서 연구와 교육을 진행하고자 합니다. AI를 활용\n한 맞춤형 컨텐츠 제작, 스포츠 이벤트의 디지털화와 새로운 경험 제공, \n그리고 데이터 기반의 마케팅 전략 수립 등을 통해 스포츠 산업의 미래\n를 선도하는 인재를 양성하고자 합니다.\n필요역량 및 소양 \n-  스포츠산업에 입문하려면 스포츠에 대한 관심과 열정이 필요합니다. \n특히 스포츠에 대한 참여 경험이 있으면 도움이 됩니다. \n-  스포츠산업에서는 다양한 사람들과 협력해야 하므로 커뮤니케이션 \n및 협업 능력이 필요합니다. 학생들은 대인관계를 적극적으로 발전시\n키고, 팀 프로젝트나 그룹 활동 등을 통해 협업 능력을 키운다면 큰 도\n움이 될 것입니다.\n-  그 외에도 본 학부에서는 체육교사가 아닌 스포츠 산업 현장의 실무를 \n담당할 인재를 양성합니다. 이를 위해 경영, 마케팅 전략 및 기술적 발\n전과 데이터 분석에 대한 이해가 필수적입니다.\n-  마지막으로 실무 경험을 통해 이론을 현실에 적용하는 능력이 중요\n합니다. \n우리 학과(부)·전공 매력 \n-  스포츠경영 관련 최고 수준의 교육 커리큘럼 제공\n-  이론적 학습뿐 아니라 현장 경험을 중요시하여 실무 중심의 교육을 \n제공\n-  국제적인 시야에서의 교육과 다양한 문화를 경험할 수 있는 환경을 \n제공\n-  스포츠 산업의 최신 동향과 기술적 발전에 대한 지식을 제공\n-  국내·국제 메가스포츠이벤트 파견\n주요 실적 \n-  2014년 인천 아시안게임 자원봉사자 파견 \n-  2018년 자카르타 팔렘방 아시안게임 유급 인력 파견 \n-  2021년 스테퍼 학회, 국제e스포츠연맹 학술대회 최우수상 수상 \n-  2022년 프로야구단 KT 위즈 퓨처스 마케팅 공모전 대상 수상\n-  2024년 강원도청소년동계올림픽 유급 인력 파견\n주요 전공과목 \n-  스포츠경영학개론: 스포츠 산업과 경영에 대한 기본 개념과 이해를 제\n공하는 과목입니다.\n-  스포츠컴퓨터프로그래밍: 컴퓨터 과학과 스포츠를 결합하여, 스포츠 \n분야에서 컴퓨터 프로그래밍 및 기술을 활용하는 방법에 대해 다루\n는 수업입니다.\n-  스포츠재무관리: 스포츠 산업 내에서 재무적인 측면을 이해하는 데 필\n요한 기초적인 개념과 도구들을 다루는 과목입니다.\n-  스포츠이벤트기획 및 실습: 스포츠 이벤트를 기획하고 운영하는 데 필\n요한 전략적인 개념과 실무적인 능력을 학습하는 과목입니다.', '| 통계학과 | 통계적기계학습및실습 | 소프트웨어 및 데이터 분석 : 기계학습군(택1) |\n| 컴퓨터.전자시스템공학전공/컴퓨터공학전공 | 데이터베이스 | 소프트웨어 및 데이터 분석 |\n| 컴퓨터.전자시스템공학전공/컴퓨터공학전공 | 운영체제 | 소프트웨어 및 데이터 분석 |\n| 컴퓨터공학전공 | 자연어처리 | 소프트웨어 및 데이터 분석 |\n| 컴퓨터공학전공 | 컴퓨터비전 | 소프트웨어 및 데이터 분석 |\n| 컴퓨터공학전공 | 소셜네트워크분석 | 소프트웨어 및 데이터 분석 |\n| 컴퓨터공학전공 | 딥러닝 | 소프트웨어 및 데이터 분석 |\n| 컴퓨터공학전공 | 컴퓨터보안 | 소프트웨어 및 데이터 분석 |', '항과 연결하기\n-  Finance 스터디: AI를 기본으로 Finance을 탐구하는 동아리 활동\n슬기로운 대학생활 \n1학년  기초교양 위주로 수업을 듣고, 수학, 통계학을 수강하게 됩니다. \n여러 교양서적을 많이 읽고 영어 능력을 키우면 전공 공부에 도\n움이 많이 됩니다. \n2학년  본격적으로 전공 수업을 듣게 됩니다. 수학과 통계학에 대한 깊\n이 있는 이론과 실습 수업을 수강하여 데이터를 분석하는 과정도 \n익히게 됩니다.\n3학년  AI와 관련된 다양한 전공심화 과목들을 수강하고 졸업 프로젝트\n를 위한 분석을 시작하게 됩니다.\n4학년  Finance & AI 캡스톤연구 및 현장실습을 통해 실무 능력을 함양\n합니다.\n졸업 후 진로 \n-  개발자: AI와 관련된 분야의 개발자로 네이버, 카카오, 쿠팡, 배달의 \n민족 등\n-  금융회사: 금융관련 회사, 은행, 증권사, 보험사, 상호저축은행 등\n-  기업체: AI 기술과 데이터 분석 기술이 필요한 일반 회사 및  벤처기업 \n-  기타: 연구소, 대학교수 등\nQ&A \nQ1. 무엇을 배우고 추후 어떤 일을 하는지 궁금합니다.\nA1.  AI융합대학 내 학부로서 가장 근저에 있는 것이 AI와 관련된 분야\n로 생각할 수 있습니다. AI와 관련된 교과과정을 우선적으로 배우게 \n될 것으로 여겨집니다. 졸업 후 진로 역시 AI와 관련된 분야로 가지 \n않을까 합니다.\nQ2.  금융 분야 학습과 AI 학습 중 중점이 어느 쪽인지와 비율은 얼마나 \n되는지 알고 싶습니다.\nA2.  현재 계획 중인 교과과정은 AI 학습에 많은 비중이 실려 있습니다. \n그렇지만 금융 학습과 AI 학습 중 상대적인 비중은 정해지지 않았\n습니다.', '## [table] ##\n| 개설학과(전공) | 교과목명 | 이수영역 |\n| --- | --- | --- |\n| 컴퓨터공학전공 | 컴퓨터보안 | 소프트웨어 및 데이터 분석 |\n| 산업경영공학과 | 텍스트어낼리틱스 | 소프트웨어 및 데이터 분석 |\n| 산업경영공학과 | 경영과학 | 소프트웨어 및 데이터 분석 |\n| 산업경영공학과 | 딥러닝응용 | 소프트웨어 및 데이터 분석 |\n| 산업경영공학과 | 데이터사이언스개론 | 소프트웨어 및 데이터 분석 |\n| 산업경영공학과 | 데이터사이언스응용 | 소프트웨어 및 데이터 분석 |\n| AI융합전공 | 자료구조 | 소프트웨어 및 데이터 분석 |\n| AI융합전공(SW&AI) | 알고리즘 | 소프트웨어 및 데이터 분석 |\n| AI융합전공(SW&AI) | 운영체제 | 소프트웨어 및 데이터 분석 |\n| AI융합전공(SW&AI) | 웹프로그래밍 | 소프트웨어 및 데이터 분석 |\n| AI융합전공(SW&AI) | 데이터베이스 | 소프트웨어 및 데이터 분석 |\n| AI융합전공(SW&AI) | 기계학습 | 소프트웨어 및 데이터 분석 |\n| 통계학과 | 데이터시각화 | 소프트웨어 및 데이터 분석 |\n| 통계학과 | 시계열분석및연습 | 소프트웨어 및 데이터 분석 |\n| 통계학과 | 베이지안통계학 | 소프트웨어 및 데이터 분석 |\n| 통계학과 | 데이터사이언스세미나 | 소프트웨어 및 데이터 분석 |\n| 통계학과 | 통계행렬론연습 | 통계행렬론을 수강해야 인정함 |\n| 통계학과 | 회귀분석연습 | 회귀분석을 수강해야 인정함 |\n| 통계학과 | 확률분포론연습 | 확률분포론을 수강해야 인정함 |\n| 통계학과 | 수리통계학연습 | 수리통계학을 수강해야 인정함 |\n\n## [heading1] ##\n# 5) 졸업 요건\n\n## [paragraph] ##\n- 졸업 과제 및 논문(전공 홈페이지에 게시)\n\n## [heading1] ##\n# 6) 문의처', '3130\nDept. of International Finance\n국제금융학과\n전화번호 031-330-4981\n홈페이지 if.hufs.ac.kr\n전공소개 \n국제금융학과는 ‘글로벌 경영·금융·무역 비즈니스 인재 양성’이라는 목\n표 아래 실용적 지식과 국제적 경쟁력을 갖춘 인재를 양성하고자 합니\n다. 탄탄한 금융이론을 바탕으로 금융학 기반의 집중 교육, 국내외 기\n업 인턴 활동과 금융현장 실습, 지역특성화 청년 무역 전문가 양성사업\n단 활동을 통한 무역학 교육 및 실습, 데이터 분석능력, 어학능력의 겸\n비를 통해 ‘이론+실무+어학’이 조화된 교육을 실현해 나가는 동시에 시\n대적 흐름을 선도할 금융전문인 배출에 앞장서고 있습니다. 급변하는 \n글로벌 환경에서 뛰어난 적응력과 개방성을 지닌 경영, 금융, 무역 융합\n형 전문인이 되고 싶다면 한국외대 국제금융학과는 최고의 선택이 될 \n수 있을 것입니다.\n필요역량 및 소양 \n국제금융학과에 입학한 이후에 경영, 금융, 무역에 대하여 이론 및 실습 \n교과목에 대해 배우게 됩니다. 따라서 국제금융학과에 입학하고자 하는 \n학생들은 논리적 사고와 문제해결 능력과 더불어 글로벌 금융에 대한 기\n초지식 및 IT 활용 능력을 함양하고 있다면 도움이 될 수 있습니다. 다만, \n입학한 이후 학생들이 차근차근 전문성을 높일 수 있도록 커리큘럼이 구\n성되어 있기 때문에 구체적인 지식이 필수적으로 요구되는 것은 아닙니\n다. 무엇보다도 해당 분야에 대한 학생들의 높은 관심과 흥미가 가장 주\n요한 권장 소양이라고 할 수 있겠습니다.\n우리 학과(부)·전공 매력 \n-  최고 교수진과 단합된 학과 분위기와 학과의 지원 \n-  대신증권, 상장기업 등 대외 현장실습 및 인턴십 프로그램\n-  산업통상자원부 지원 지역특화청년무역전문가 양성사업 (GTEP)\n-  뉴욕주립대 오스웨고(SUNY Oswego) 대학과의 복수학위 프로그램 \n및 국제교류 프로그램\n주요 실적 \n-  현장실습 MOU 기업(대신증권, 해피브릿지, 체스터톤스코리아, 솔루\n티스 원차이나, 후니드, 글로벌 에프엠)\n-  GVIF(학과 동아리) 보고대회 (2023.6.1., 2023.12.6.)\n-  지역특화청년무역전문가양성사업단 학과 발대식(2023.3.8.)\n주요 전공과목 \n-  금융시장론: 은행, 증권, 보험 등 여러 금융영역을 다루며 금융의 기본\n적 이해를 돕는 수업으로 금융시장의 종류, 내용, 구조 및 거래상품 등', '## [table] ##\n| 개설학과(전공) | 교과목명 | 이수영역 |\n| --- | --- | --- |\n| 통계학과 | 통계학및연습2 | 기초 이론 : 기초확률및통계군(택1) |\n| 컴퓨터.전자시스템공학전공/컴퓨터공학전공 | 확률과통계 | 기초 이론 : 기초확률및통계군(택1) |\n| 산업경영공학과 | 기초확률및통계 | 기초 이론 : 기초확률및통계군(택1) |\n| 통계학과 | 통계행렬론 | 기초 이론 : 데이터사이언스를위한수학군(택1) |\n| 컴퓨터.전자시스템공학전공/컴퓨터공학전공 | 선형대수 | 기초 이론 : 데이터사이언스를위한수학군(택1) |\n| 산업경영공학과 | 공학통계 | 기초 이론 - 회귀분석군(택1) |\n| 통계학과 | 회귀분석 | 기초 이론 - 회귀분석군(택1) |\n| 컴퓨터.전자시스템공학전공/컴퓨터공학전공 | 자료구조 | 소프트웨어 및 데이터 분석 |\n| 컴퓨터.전자시스템공학전공/컴퓨터공학전공 | 알고리즘 | 소프트웨어 및 데이터 분석 |\n| 컴퓨터.전자시스템공학전공/컴퓨터공학전공 | 웹프로그래밍 | 소프트웨어 및 데이터 분석 |\n| 통계학과 | 확률분포론 | 기초 이론 |\n| 통계학과 | 수리통계학 | 소프트웨어 및 데이터 분석 |\n| 통계학과 | 다변량분석및실습 | 소프트웨어 및 데이터 분석 |\n| 통계학과 | 데이터마이닝및실습 | 소프트웨어 및 데이터 분석 : 기계학습군(택1) |\n| 산업경영공학과 | 데이터마이닝응용 | 소프트웨어 및 데이터 분석 : 기계학습군(택1) |\n| 컴퓨터.전자시스템공학전공/컴퓨터공학전공 | 기계학습 | 소프트웨어 및 데이터 분석 : 기계학습군(택1) |\n| 통계학과 | 통계적기계학습및실습 | 소프트웨어 및 데이터 분석 : 기계학습군(택1) |\n| 컴퓨터.전자시스템공학전공/컴퓨터공학전공 | 데이터베이스 | 소프트웨어 및 데이터 분석 |\n| 컴퓨터.전자시스템공학전공/컴퓨터공학전공 | 운영체제 | 소프트웨어 및 데이터 분석 |\n| 컴퓨터공학전공 | 자연어처리 | 소프트웨어 및 데이터 분석 |', '## [table] ##\n| 2학기 | 2학기 | 2학기 | 2학기 | 2학기 |\n| --- | --- | --- | --- | --- |\n| 학년 | 교과목명 | 학점 | 시간 | 비고 |\n| 1 | 우크라이나학입문(2) | 2 | 2 | 지역학기본 |\n| 2 | 우크라이나역사와문화(2) | 2 | 2 | 지역학기본 |\n| 3 | 우크라이나비즈니스및투자환경 | 2 | 2 | 지역학심화 |\n| 3 | 우크라이나현지조사 (캡스톤디자인)2 | 2 | 2 | 지역학기본 |\n| 3 | 현대우크라이나 문화코드의이해(2) | 2 | 2 | 지역학기본 |\n| 3 | 현대우크라이나의정치와경제(2) | 2 | 2 | 지역학기본 |\n| 4 | 우크라이나문화세미나(2) | 2 | 2 | 지역학심화 |\n| 4 | 우크라이나지역연구세미나(2) | 2 | 2 | 지역학심화 |\n| 4 | 현대우크라이나문화콘텐츠와 사회상(2) | 2 | 2 | 지역학심화 |\n\n## [paragraph] ##\n5) CORE 글로벌지역학 인문학공통 과목\n\n## [paragraph] ##\n글로벌캠퍼스', '## [table] ##\n| 2학기 | 2학기 | 2학기 | 2학기 | 2학기 |\n| --- | --- | --- | --- | --- |\n| 학년 | 교과목명 | 학점 | 시간 | 비고 |\n| 1 | 유고학입문(2) | 2 | 2 | 지역학기본 |\n| 2 | 유고역사(2) | 2 | 2 | 지역학기본 |\n| 3 | 유고문화콘텐츠연구 (캡스톤디자인) | 2 | 2 | 지역학기본 |\n| 3 | 시사세/크어 | 2 | 2 | 지역학기본 |\n| 3 | 유고문학사2 | 2 | 2 | 지역학기본 |\n| 3 | 전공인문학세미나 | 2 | 2 | 지역학기본 |\n| 4 | 유고지역언어상황연구 | 2 | 2 | 지역학심화 |\n| 4 | 유고지역문화유산연구 | 2 | 2 | 지역학심화 |\n| 4 | EU와유고지역연구 | 2 | 2 | 지역학심화 |\n| 4 | 유고인문학텍스트분석 | 2 | 2 | 지역학심화 |\n\n## [footer] ##\n- 87 -', '## [table] ##\n| 2학기 | 2학기 | 2학기 | 2학기 | 2학기 |\n| --- | --- | --- | --- | --- |\n| 학년 | 교과목명 | 학점 | 시간 | 비고 |\n| 1 | 스페인역사문화세미나(2) | 2 | 2 |  |\n| 2 | 라틴아메리카역사세미나(2) | 2 | 2 |  |\n| 2 | 매스미디어로본이베로아메리카(2) | 2 | 2 |  |\n| 3 | 라틴아메리카경제(2) | 2 | 2 |  |\n| 3 | 라틴아메리카문화와사회사(2) | 2 | 2 |  |\n| 3 | 라틴아메리카정치(2) | 2 | 2 |  |\n| 3 | 이베로아메리카지역음악과미술(2) | 2 | 2 |  |\n| 3 | 픽션과영화로본이베로아메리카세계(2) | 2 | 2 |  |\n| 4 | 라틴아메리카시사토픽(2) | 2 | 2 |  |\n| 4 | 라틴아메리카주요인물연구 | 2 | 2 |  |\n| 4 | 이베로아메리카지역과EU정치경제(2) | 2 | 2 |  |\n| 4 | 라틴아메리카와미국 | 2 | 2 |  |\n\n## [footer] ##\n- 84 -', '0706\nDept. of History\n사학과\n전화번호 031-330-4288\n홈페이지 history.hufs.ac.kr\n전공소개 \n한국외대 사학과는 엄격한 역사교육을 통해서 창의적인 전문 지식인을 \n양성하는 것을 교육목표로 삼고 있습니다. 역사학의 학문적 발전과 시\n대적인 변화에 발맞추어, 한국사·동양사·서양사 등 각 전공분야의 내실 \n있는 교육과 함께 역사문화콘텐츠와 정보기록관리학 등 응용역사학 교\n육에도 노력을 기울여 왔습니다. 전국을 8개 권역으로 나누어 진행하\n고 있는 ‘학술고적답사’는 세미나식 수업과 긴밀하게 연동시켜 운용함\n으로써, 교내외로부터 호평을 받고 있습니다. 사학과에서는 학과 창립\n과 동시에 ‘역사문화연구소’를 개설하여, 교육과 더불어 연구풍토 조성\n에도 매진해 왔습니다. 우리 학과는 언론기관에서 실시한 대학평가에서 \n최상급 평가를 받았을 뿐 아니라, 인문학 분야 전체에서 교수들이 연구\n를 가장 열심히 하는 학과로 선정된 바 있습니다. 현재 우리 사학과 졸\n업생들은 교수, 연구원, 기록연구사(Archivist), 교사, 학예직공무원, 기\n업인, 영화감독 등 다양한 전문분야에서 활발하게 활동하고 있습니다.\n필요역량 및 소양 \n-  역사학은 인문학의 중심에 위치한 기초학문입니다. 학문적인 호기심\n과 진리탐구를 위한 열정 그리고 성실성을 갖추면 됩니다.\n-  역사에 대한 관심과 문화유산에 대한 애정이 있다면 누구나 사학 공부\n를 시작할 수 있습니다.\n-  독서와 글쓰기는 역사학에 대한 접근과 이해를 도와줄 것입니다. 한\n문, 영어 등 외국어 학습도 역사학 공부에 많은 도움이 됩니다.\n우리 학과(부)·전공 매력 \n-  한국사·동양사·서양사를 아우르는 내실 있는 전공교육\n-  정보기록관리학, 역사문화콘텐츠 등 응용역사학 분야\n-  전국을 8개 권역으로 나누어 세미나식 강의와 연동해서 진행하고 있\n는 ‘학술고적답사’\n주요 실적 \n-  언론기관에서 실시한 대학평가에서 높은 평가를 받음. 학과 교수들이 \n가장 열심히 연구하는 사학과로 선정된 바 있음.\n-  역사문화연구소 운영: 한국연구재단 등재학술지 <역사문화연구> 발\n행. 역사문화연구소총서 발행.\n-  HK+ <접경인문학>연구단 운영.\n주요 전공과목 \n-  유물유적탐구 / 지역문화탐구: ‘학술고적답사’와 연동해서 세미나식 \n수업으로 진행합니다. \n-  한국사입문 / 동아시아현대사, 서양생활문화사: 신입생들이 필수와', '프 모델, kernel 방법론, VC 차원과 같은 고전적인 내용부터 latent \nstable diffusion, transformer 그리고 CLIP과 같은 최근 모델까지 \n학생들이 전공 수학을 통해 꼼꼼하게 학습하고, 실습할 수 있도록 하\n고 있습니다. 또한 우리 학과는 1학년 과목인 논리 및 기초 프로그래\n밍을 통해 그들의 수학 눈높이에서 맞춘 deep learning 교육을 진행\n하고 있습니다.\n학과(부) 특별 프로그램 \n-  매 학기 성적우수자 장학금 지급\n-  졸업 후 진로선택을 위한 캡스톤디자인 프로그램 (예정)\n-  학부생 조교로 활동 가능\n-  교수님 과제 참여로 연구조원으로 활동 가능\n학과(부) 행사 및 동아리 활동 \n-  수학과 콜로키움과 특별강연: 최근에는 미국 아마 AWS의 software \nengineering manager님과 스톤브릿지벤쳐스에서 수석팀장님, 스탠\n다임의 AI tech leader님을 연사로 모셨습니다.\n-  과동아리 HABIT은 프로그래밍과 기계학습을 공부하는 학생들의 연\n구모임입니다.\nDept. of Mathematics\n수학과\n전화번호 031-330-4262\n홈페이지 math.hufs.ac.kr\n슬기로운 대학생활 \n수학과는 깊은 사고력과 추상적인 개념을 능숙하게 다룰 수 있는 논리\n력을 지닌 인재를 길러내고자 합니다. 문명과 기술이 첨단화되고 고도\n화되면서 많은 업무가 자동화되는 지금은 단순한 지식 습득의 수준을 \n넘어 수학과가 지향하는 인재가 요구되고 있습니다. 대학생활은 어떠한 \n분야에 본인이 어울리는지, 그리고 필요한 준비를 해야 하는 시기입니\n다. 관련하여 다음과 같이 몇 가지 조언을 제시합니다.\n1.  다양한 경험을 쌓으세요. 실패를 통해 남을 이해할 수 있는 아량을 얻\n고, 어려움을 극복하고 성공한 경험을 통해 미래의 힘든 시기를 이겨\n낼 수 있게 하는 자존감을 쌓으세요. \n2.  수학 전공 과목에서 다루는 정리와 문제를 가능한 스스로 고민하고, \n해결하세요. 처음에는 힘들고 오랜 시간이 걸리겠지만, 이러한 어려\n움 통과해야 성장하고 시대가 요구하는 인재가 되는 것입니다.\n3.  산책 등 스스로 생각하는 습관을 만들고 동시에 글쓰기 실력을 기르\n세요. 한편, ChatGPT에게 다양한 질문과 요구를 연습하는 것도 논리\n적으로 생각을 정리하여 표현하는 능력을 기르는 좋은 방법입니다.\n졸업 후 진로', '## [heading1] ##\n# 헝가리어과\n\n## [table] ##\n| 1학기 | 1학기 | 1학기 | 1학기 | 1학기 |\n| --- | --- | --- | --- | --- |\n| 학년 | 교과목명 | 학점 | 시간 | 비고 |\n| 1 | 헝가리개관 | 2 | 2 |  |\n| 2 | 헝가리역사와문화 | 2 | 2 |  |\n| 3 | 헝가리사회연구 | 2 | 2 |  |\n| 3 | 유럽속의헝가리문화 | 2 | 2 |  |\n| 3 | 핀란드어와문화 | 3 | 3 |  |\n| 4 | 헝가리예술과문화코드(1) | 2 | 2 |  |\n| 4 | 헝가리지역연구(1) | 2 | 2 |  |\n\n## [table] ##\n| 2학기 | 2학기 | 2학기 | 2학기 | 2학기 |\n| --- | --- | --- | --- | --- |\n| 학년 | 교과목명 | 학점 | 시간 | 비고 |\n| 1 | 유럽과헝가리 | 2 | 2 |  |\n| 2 | 헝가리도시와지역문화 | 2 | 2 |  |\n| 3 | 헝가리문화의이해 | 2 | 2 |  |\n| 3 | 헝가리민요와민속문화 | 2 | 2 |  |\n| 3 | 핀우그르학입문: 핀란드 언어와 문화 | 3 | 3 |  |\n| 4 | 헝가리예술과문화코드(2) | 2 | 2 |  |\n| 4 | 헝가리지역연구(2) | 2 | 2 |  |\n| 4 | 헝가리현대사 | 2 | 2 |  |\n\n## [heading1] ##\n# 세르비아·크로아티아어과', '## [heading1] ##\n# 2) 중남미 지역\n\n## [table] ##\n| 2학기 | 2학기 | 2학기 | 2학기 | 2학기 |\n| --- | --- | --- | --- | --- |\n| 학년 | 교과목명 | 학점 | 시간 | 비고 |\n| 1 | 영어어휘의그리스어어원연구 | 2 | 2 | 지역학기본 |\n| 1 | 현대그리스와그리스학입문 | 1 | 1 | 지역학기본 |\n| 1 | 한국과유럽문화비교답사 (종합설계) | 1 | 1 | 지역학기본 |\n| 2 | 그리스와지중해사회의이슈 | 2 | 2 | 지역학기본 |\n| 2 | 그리스와지중해세계유산 (종합설계) | 2 | 2 | 지역학기본 |\n| 3 | 그리스와EU지역문화번역 (종합설계) | 2 | 2 | 지역학심화 |\n| 3 | 현대그리스사회와문화연구 (종합설계) | 2 | 2 | 지역학심화 |\n| 3 | 그리스문화콘텐츠와VR전시기획실습 (종합설계) | 2 | 2 | 지역학심화 |\n| 3 | 그리스로마신화연구 | 2 | 2 | 지역학심화 |\n| 4 | 글로벌지역데이터프로세싱 (종합설계) | 2 | 2 | 지역학심화 |\n| 1 | 동유럽지역종교와민족연구 | 2 | 2 | 지역학기본 |\n| 2 | 불가리아와러시아 | 2 | 2 | 지역학기본 |\n| 3 | 발칸다문화문명론 | 2 | 2 | 지역학심화 |\n| 3 | 중동부유럽이슈세미나 | 2 | 2 | 지역학심화 |\n| 3 | 흑해지역지정학세미나 | 2 | 2 | 지역학심화 |\n| 4 | 불가리아무역실습(2) | 2 | 2 | 지역학심화 |\n| 4 | 불가리아문학명장면 | 2 | 2 | 지역학심화 |\n\n## [paragraph] ##\n스페인어통번역학과', '[공통] 2025-1학기 중간시험 공고 새글\n\n[공통] 2025-1학기 중간시험 공고 새글\n\n2025-1 학기 중간시험 공고\n\n2025 학년도 제 1 학기 중간시험을 아래와 같이 실시함 .\n\n- 아 래 -\n\n1. 시 험 기 간 : 2025. 4. 21.( 월 ) ~ 4. 25.( 금 )\n\n2. 성적확인기간 : 2025. 4. 25.( 금 ) ~ 5. 2.( 금 )\n\n홈페이지 핫링크 “ 중간고사 성적 확인 ”\n\n3. 평 가 방 법\n\n가 . 필답고사 , 과제물 , 출석률 등을 참작하여 평가함 .\n\n나 . 시험시간표는 별도로 발표하지 않으며 정해진 시험기간에 실시함 .\n\n4. 성적입력 알림 서비스 실시 : 성적입력 시스템에서 ‘ 최종제출 ’ 을 클릭하여 성적입력이 완료되면 해당 학생들에게 ‘ 성적이 입력되어 확인할 수 있다 ’ 는 문자가 (HUFS 앱 설치자에 한함 ) 발송됨 .\n\n2025. 4.\n\n서울 · 글로벌캠퍼스 교무처장\n\n| 0 |\n|:-------------------------|\n| 2025-1학기 중간시험 공고 |']","2학기 중간고사 이후에 데이터베이스 관련 상담은 중간고사 성적 확인 기간 이후부터 가능할 것으로 예상됩니다. 일반적으로 중간고사 성적 확인 기간은 중간고사 종료 후 1주일 이내에 이루어지므로, 그 시점부터 상담이 가능할 것입니다.

데이터베이스 관련 상담을 원하신다면, 이석룡 교수님께 문의하시면 됩니다. 교수님의 연락처는 다음과 같습니다:

- **이석룡 교수님**  
  - 이메일: sllee@hufs.ac.kr  
  - 연구실: 공학관 531호  

상담을 원하실 경우 이메일로 미리 문의하시면 좋습니다. 혹시 더 도와드릴까요?",2025학년도 2학기 중간고사는 10월 20일(월)부터 10월 24일(금)까지 예정되어 있습니다. 따라서 교수님과의 상담은 10월 25일(토) 이후부터 가능합니다.,0.08388157894317434,1.0,0.0,0.0
딥러닝이 연구분야인 교수님들의 소속 단과대와 학부를 알고 싶어.,"['이해윤 교수님은 디지털인문한국학전공 전공 소속입니다. 연구분야는 언어인지과학과입니다.', '신동화 교수 교수님은 수학과 학과 소속입니다. 이메일은 dhshin@hufs.ac.kr입니다. 연구실은 자연과학대학 401호입니다.', '김상범 교수님은 디지털인문한국학전공 전공 소속입니다. 연구분야는 사학과입니다.', '장익범 교수 Jang, Ikbeom 교수님은 컴퓨터공학부 학과 소속입니다. 공학박사 학위를 가지고 있습니다. 연구분야는 딥러닝, 의료영상분석, 생성형AI, 뇌질환입니다. 이메일은 ijang@hufs.ac.kr입니다. 연구실은 공학관 418호입니다.', '신찬수 교수 교수님은 Software-AI전공 전공 소속입니다. 공학박사(KAIST) 학위를 가지고 있습니다. 연구분야는 알고리즘, 계산기하학입니다.', '정대인 교수 Jeong, Dae In 교수님은 컴퓨터공학부 학과 소속입니다. 공학박사 학위를 가지고 있습니다. 연구분야는 네트워크 분석 및 설계입니다. 이메일은 djeong@hufs.ac.kr입니다. 연구실은 공학관 533호입니다.', '망과 같은 기본 딥러닝 모형을 학습하고, 생성적 적대신경망, 강화학\n습 등을 이용한 최신 딥러닝 응용분야를 배웁니다.\n학과(부) 특별 프로그램 \n-  수시, 정시 합격자 성적장학금 지급 및 매 학기 성적우수자 장학금 \n지급\n-  캡스톤디자인 프로젝트 우수팀 외부 공모전 준비 지원(프로젝트룸, \n참가경비 등)\n-  학부생들에게 교수 연구 프로젝트 참여 기회를 제공하는 학부 연구\n생 제도 운영\n-  체코슬로바키아어과와 공동 운영하는 캡스톤디자인 과목 수료자에게 \n체코 현지 기업에서 장기 인턴쉽 기회 제공', '습 등을 이용한 최신 딥러닝 응용분야를 배웁니다.\n학과(부) 특별 프로그램 \n-  수시, 정시 합격자 성적장학금 지급 및 매 학기 성적우수자 장학금 \n지급\n-  캡스톤디자인 프로젝트 우수팀 외부 공모전 준비 지원(프로젝트룸, \n참가경비 등)\n-  학부생들에게 교수 연구 프로젝트 참여 기회를 제공하는 학부 연구\n생 제도 운영\n-  체코슬로바키아어과와 공동 운영하는 캡스톤디자인 과목 수료자에게 \n체코 현지 기업에서 장기 인턴쉽 기회 제공', '(비교과) 전공탐색 연계한 자기탐색, 진로탐색 프로그램 지원\n1학년(여름방학) 학과 설명회\n2학기 희망 전공의 학문기초 교과목을 선택할 수 있도록 정보제공 \n1학년 2학기 전공 진입 전 기초교육 \n(교과) 교양 교과목 이수 및 희망 전공의 학문기초 교과목 이수 \n(비교과) 다양한 프로그램 연계 전공탐색학기제 운영 \n슬기로운 대학생활 \n자유전공학부(글로벌)는 전공이 정해지지 않아 학생들에게 보다 많은 \n경험을 제공할 수 있는 발판을 마련합니다. 다른 학생들과 다르게 자유\n전공학부(글로벌) 학생들은 전공을 미리 선택하지 않은 상태로 학교에 \n입학하게 됩니다. 이런 기회를 토대로 다양한 수업들을 통해서 자신과 \n잘 맞는 전공을 탐색하여 자신이 원하는 진로를 스스로 개척해 나가는 \n미래를 가져가시길 바랍니다.\nQ&A \nQ1. 2학년 진급시 주전공으로 선택할 수 있는 학과를 알고 싶습니다.\nA1.  입학 시 글로벌캠퍼스의 모든 학과(부)를 주전공으로 선택할 수 있\n는 기회가 부여됩니다. 단, 우크라이나학과와 한국학과는 2학년 배\n정이 불가하여 선택할 수 없습니다.\nQ2.  2학년 진급시 이중(부)전공으로 선택할 수 있는 학과를 알고 싶\n습니다.\nA2.  서울, 글로벌캠퍼스 구분 없이 모든 학과를 선택할 수 있습니다. 단, \n글로벌캠퍼스의 융합인재학부와 서울캠퍼스 사범대학의 학과는 해\n당 모집단위의 커리큘럼 특성 상 선택할 수 없습니다.\nQ3.  2학년 진급 시 학과 선택을 할 때, 선발기준에 대해서 알고 싶습\n니다.\nA3.  2학년 진급 시 이루어지는 학과 선택과정에서의 선발기준은 따로 \n존재하지 않습니다. 자유전공학부(글로벌)에 입학한 모든 신입생들\n에게 원하는 전공을 자유롭게 선택할 수 있는 기회를 제공하고 있\n으니 참고 바랍니다.\nOpen Major Division(Global Campus)\n자유전공학부(글로벌)\n전화번호 031-330-4797\n홈페이지 gomd.hufs.ac.kr\n글로벌캠퍼스 GLOBAL CAMPUS\nDIVISION OF \nCLIMATE CHANGE\n기후변화융합학부\n기후변화융합학부 68', '-  기업체: 폴란드에 진출한 국내 기업, 글로벌 기업\n-  금융계: 은행 등 금융기관, 증권·보험 회사\n-  언론계: 외신기자, PD, 방송작가\n-  공공기관: 대사관, 문화원, 문화재단, 공기업, 행정부처 공무원 등\n-  문화예술계: 번역가, 큐레이터, 어린이책 기획자 등\nQ&A \nQ1.  폴란드학과는 한국에 하나밖에 없는 유일 전공학과로 알고 있는\n데요, 그렇다면 폴란드 정부가 학과생들에게 지원하는 별도의 혜\n택이 있나요?\nA1.  네. 폴란드 정부가 우리 학과에 쏟는 애정과 관심은 실로 어마어마합\n니다. 지금껏 폴란드 대통령이나 외무부 장관, 문화부 장관, 교육부 \n장관, 국회 의장 등이 학과를 방문했고, 주한 폴란드 대사관을 통해 \n전통의상 및 폴란드 도서 기증, 원어신문 발간 지원, 말하기 경연대\n회 공동주관 등 다양한 분야에서 학생들에게 전폭적인 지원을 아끼\n지 않고 있습니다. 또한 폴란드 교육부가 매년 20명의 학과생들에\n게 폴란드 현지 대학에서의 서머스쿨 장학금을 제공하고 있습니다.\nQ2.  폴란드학과에서 진행하고 있는 다양한 비교과 프로그램과 학과 행\n사, 그리고 취업률이나 학과에서 단독으로 운영하는 장학금 현황 등\n과 관련하여 보다 상세한 정보와 현황을 알고 싶으면 어디에서 찾\n을 수 있나요?\nA2.  폴란드학과는 학과 홈페이지뿐 아니라 SNS와 유튜브 단독 계정을 \n운영하고 있습니다. 우리 학과의 다양한 프로그램과 이벤트, 학과 \n분위기나 학과생들의 Campus life가 궁금한 분들은 아래 창구로 접\n속하면 생생하고 알찬 정보를 얻을 수 있습니다. 특히 유튜브 계정\n에 접속하면, 재미있는 컨텐츠가 가득합니다.\n* Instagram: https://www.instagram.com/hufs_polski/\n* Facebook: https://www.facebook.com/polski.hufs\n* Youtube: https://www.youtube.com/@user-eb7zz1dw4j', '## [paragraph] ##\n* 2020학번부터 미네르바 교양대학의 “컴퓨터프로그래밍”, “컴퓨팅사고” 이수를 권장함\n(두 과목을 모두 이수하는 경우, 한 과목은 전공교류 이중전공으로 이수하고, 한 과목은\n교양필수로 이수해야 함. 두 과목 중 한 과목만 이수하는 경우 교양필수로 이수해야 함)\n\n## [heading1] ##\n# (5) 수강안내\n\n## [list] ##\n- 가. 트랙 선택 전 공통 과목은 소속 캠퍼스에서 수강\n- 나. 소속 캠퍼스에 개설되지 않은 트랙(<Language & AI>, <Business & AI>)을 선택한 경우에\n- 한해 캠퍼스 교차 수강 가능\n- 다. <Software & AI> 트랙 교과목은 소속 캠퍼스에 개설된 과목 수강\n- 라. 전공 과목은 본 전공생, 해당 학년 우선으로 수강 기회 부여\n\n## [paragraph] ##\n(6) 이수요건 : 총 42학점 이수 및 트랙별 이수요건 충족 필수', '## [table] ##\n| 본 대학교 및 소속 단과대학을 대표하는 공무, 행사 또는 운동경기참가 | 단과대학 규모 이상의 행사 및 체육대회임원, 간부 및 선수로서 참가 | 행사시간 | 기간과 참여인이 명시된 대학장의 행사 허가원 또는 협조공문 등 | 소속단과대학에서 유고결석 확인서를 발급받아 담당교수에게 제출 |  |\n| --- | --- | --- | --- | --- | --- |\n| 본 대학교 및 소속 단과대학을 대표하는 공무, 행사 또는 운동경기참가 | 정부 또는 지방자 치단체의 공식적 인 행사에 참가 | 행사기간 | 기간과 참여인이 명시된 부서·기관의 협조공문 등 | 담당교수에게 증빙서류 제출 |  |\n| 본 대학교 및 소속 단과대학을 대표하는 공무, 행사 또는 운동경기참가 | 총학생회의 회의 (대의원회의, 상 임위원회 및 운 영위원회 포함) 졸 업 준 비 위 원 의 업무수행 | 해당기간 매학기 7일 이내 | 기간과 참여인이 명시된 부서·기관의 협조공문 등 | 담당교수에게 증빙서류 제출 |  |\n| 본 대학교 및 소속 단과대학을 대표하는 공무, 행사 또는 운동경기참가 | 학보, 디 아거스 및 방송국의 기사작성 및 편집 | 편집부 당일 | 기간과 참여인이 명시된 부서·기관의 협조공문 등 | 담당교수에게 증빙서류 제출 |  |\n| 본 대학교 및 소속 단과대학을 대표하는 공무, 행사 또는 운동경기참가 | 학교 주관 행사 및 업무 지원 | 해당기간 | 담당부서에서 발급한 확인서 | 담당교수에게 증빙서류 제출 |  |\n| 질병 및 상해 로 인한 입원 또는 감염병 으로 인한 격 리(치료) | 질병 및 상해 | 입원기간 | 해당 증빙서류 (*병원급 이상의 의료기관) | 담당교수에게 증빙서류 제출 |  |\n| 질병 및 상해 로 인한 입원 또는 감염병 으로 인한 격 리(치료) | 법정감염병 (**질병관리청의 법정감염병에 한함) | 격리(치료) 기간 또는 감염우려 기간 | 해당 증빙서류 | 담당교수에게 증빙서류 제출 |  |', '## [heading1] ##\n# 4) 안내사항\n\n## [table] ##\n| 구분 | 내용 |\n| --- | --- |\n| 글로벌캠퍼스 경상대학 학생 | 서울캠퍼스 경영대학 이중전공 이수 불가(부전공 가능) |\n| 2015년 1학기 이후 서울캠퍼스 경영학전공을 이중(부)전공하는 글로벌캠퍼스 소속 학생 | 서울캠퍼스 경영대학 경영학부에서 개설되는 경영학 강좌를 수강하여야 경영대학 경영학부 이중(부)전공 이수학점으로 인정함.(글로벌캠퍼스 국제경영학과 또는 국제금융학부에서 개설되는 유사 경영학 과목들을 수강하는 경우 이수학점으 로 인정하지 않음) 단, 2015학년도 1학기까지 경영대학 부전공을 이수한 글로 벌캠퍼스 학생들은 종전대로 경상대학에서 개설한 대체과목 을 수강하면 부전공으로 인정함. |\n| 미디어커뮤니케이션학부 (이중전공/부전공) | 글로벌캠퍼스 소속 이중전공 학생은 서울캠퍼스에서는 미디 어커뮤니케이션학부 공통과목과 자신의 세부전공 과목만 수 강가능함(부전공은 소속 캠퍼스에서 이수함/이중전공은 양캠 퍼스에서 이수가능) |\n\n## [heading1] ##\n# 사. 이중(부)전공 교과목 수강\n\n## [list] ##\n- 1) 이중(부)전공 영역 개설 학과 : 이중(부)전공 영역에서 수강\n- 2) 제1전공 영역만 개설 학과 : 제1전공 영역에서 수강(학과에 따라 일부 강좌의 수강을 제\n- 한할 수 있음. 강의시간표 비고란 참조)\n- ※ 제1전공 학생은 소속 학과(부)에서 이중(부)전공 영역에 개설한 과목을 수강할 수 없음.\n\n## [list] ##\n- 아. 기타사항 : 부전공의 경우에도 졸업시험/논문을 부과할 수 있음\n- 자. 문의\n\n## [list] ##\n- - 신청 및 배정 관련 : 학사종합지원센터(Tel : 031-330-4026)\n- - 수업 관련 : 학사종합지원센터(Tel : 031-330-4028)\n\n## [footer] ##\n- 74 -', '[공통] 외국어인증 신청서 제출 안내\n\n| 제출서류 | 1. 외국어인증 신청서(첨부파일 참조) 2. 제출시점 기준 유효기간(2년) 이내의 인증 시험 성적(또는 대체 과정 수료증) ※성적표 미리보기 캡쳐본\xa0성적 처리 불가 | 1. 외국어인증 신청서(첨부파일 참조) 2. 제출시점 기준 유효기간(2년) 이내의 인증 시험 성적(또는 대체 과정 수료증) ※성적표 미리보기 캡쳐본\xa0성적 처리 불가 | 1. 외국어인증 신청서(첨부파일 참조) 2. 제출시점 기준 유효기간(2년) 이내의 인증 시험 성적(또는 대체 과정 수료증) ※성적표 미리보기 캡쳐본\xa0성적 처리 불가 | 1. 외국어인증 신청서(첨부파일 참조) 2. 제출시점 기준 유효기간(2년) 이내의 인증 시험 성적(또는 대체 과정 수료증) ※성적표 미리보기 캡쳐본\xa0성적 처리 불가 |\n| 제출마감일 | 재학기간 동안\xa01회,\xa0외국어 인증 신청서를 제출하고자 하는 학기 말까지 ※\xa0졸업예정자는 졸업하고자 하는 최종 학기 말까지 반드시 제출해야함. | 재학기간 동안\xa01회,\xa0외국어 인증 신청서를 제출하고자 하는 학기 말까지 ※\xa0졸업예정자는 졸업하고자 하는 최종 학기 말까지 반드시 제출해야함. | 재학기간 동안\xa01회,\xa0외국어 인증 신청서를 제출하고자 하는 학기 말까지 ※\xa0졸업예정자는 졸업하고자 하는 최종 학기 말까지 반드시 제출해야함. | 재학기간 동안\xa01회,\xa0외국어 인증 신청서를 제출하고자 하는 학기 말까지 ※\xa0졸업예정자는 졸업하고자 하는 최종 학기 말까지 반드시 제출해야함. |\n| 제출처 | 학생의\xa01전공 소속 단과대학 담당에게\xa0E-mail\xa0제출 | 학생의\xa01전공 소속 단과대학 담당에게\xa0E-mail\xa0제출 | 학생의\xa01전공 소속 단과대학 담당에게\xa0E-mail\xa0제출 | 학생의\xa01전공 소속 단과대학 담당에게\xa0E-mail\xa0제출 |\n| 제출처 | 서울캠퍼스 | 영어대학 /\xa0아시어언어문화대학 / AI융합대학 | haksa7@hufs.ac.kr | 02) 2173-2264 |', '## [list] ##\n- 2) 양 캠퍼스 동일하게 개설되는 융합전공과 부전공은 본인 소속 캠퍼스에서 이수해야 함.\n- 3) 외국어로서의한국어교육전공 및 외국어로서의한국어통번역전공은 입학전형 기준 순수외국인\n- 모집 전형 입학생만 가능(외국어로서의한국어통번역전공은 2018학번부터만 신청 가능)\n\n## [footer] ##\n- 73 -', '[공통] 캠퍼스간 기초교과목 이중(부)전공 교차수강에 관한 공지\n\n[공통] 캠퍼스간 기초교과목 이중(부)전공 교차수강에 관한 공지\n\n안녕하세요 , 학사종합지원센터입니다 .\n\n2025-1 학기 부로 신설된 기초 교과목의 타캠퍼스 교차수강에 대해 안내드립니다 .\n\n우리 대학은 소속 캠퍼스에서 개설된 교과목을 수강하는 것을 원칙으로 하나 , 타캠퍼스 전공을 이중 ( 부 ) 전공하는 학생에 한하여 해당 전공 교과목에 한해 캠퍼스간 교차 수강을 허용하고 있습니다 .\n\n이번 기초 교과목 개설 과정에서 전산 시스템을 개발하고자 하였으나 시스템 개발에 따른 일정 및 기타 여러 가지 문제 등으로 인해 이번 2025-1 학기에는 기초교과목의 캠퍼스간 교차수강 전산 시스템이 정비되지 못하였습니다 . 그렇기 때문에 이번 학기에 한하여 특정 캠퍼스 학생이 타캠퍼스 이중 ( 부 ) 전공 학과의 필수 교과목을 수강하고자 할 경우 , 신청을 받아 수작업으로 수강을 허용하고자 합니다 .\n\n따라서 특정캠퍼스 소속 학생이 이중 ( 부 ) 전공 학생으로서 타캠퍼스에 개설된 기초 교과의\xa0수강이 필요해 이에 대한 수강신청을 희망하시는 경우 3. 5( 수 ) 17 시까지 붙임 양식을 작성하여 수강하고자 하는 기초 과목이 개설된 학과에 제출하여 주시기 바랍니다 .', '항과 연결하기\n-  Finance 스터디: AI를 기본으로 Finance을 탐구하는 동아리 활동\n슬기로운 대학생활 \n1학년  기초교양 위주로 수업을 듣고, 수학, 통계학을 수강하게 됩니다. \n여러 교양서적을 많이 읽고 영어 능력을 키우면 전공 공부에 도\n움이 많이 됩니다. \n2학년  본격적으로 전공 수업을 듣게 됩니다. 수학과 통계학에 대한 깊\n이 있는 이론과 실습 수업을 수강하여 데이터를 분석하는 과정도 \n익히게 됩니다.\n3학년  AI와 관련된 다양한 전공심화 과목들을 수강하고 졸업 프로젝트\n를 위한 분석을 시작하게 됩니다.\n4학년  Finance & AI 캡스톤연구 및 현장실습을 통해 실무 능력을 함양\n합니다.\n졸업 후 진로 \n-  개발자: AI와 관련된 분야의 개발자로 네이버, 카카오, 쿠팡, 배달의 \n민족 등\n-  금융회사: 금융관련 회사, 은행, 증권사, 보험사, 상호저축은행 등\n-  기업체: AI 기술과 데이터 분석 기술이 필요한 일반 회사 및  벤처기업 \n-  기타: 연구소, 대학교수 등\nQ&A \nQ1. 무엇을 배우고 추후 어떤 일을 하는지 궁금합니다.\nA1.  AI융합대학 내 학부로서 가장 근저에 있는 것이 AI와 관련된 분야\n로 생각할 수 있습니다. AI와 관련된 교과과정을 우선적으로 배우게 \n될 것으로 여겨집니다. 졸업 후 진로 역시 AI와 관련된 분야로 가지 \n않을까 합니다.\nQ2.  금융 분야 학습과 AI 학습 중 중점이 어느 쪽인지와 비율은 얼마나 \n되는지 알고 싶습니다.\nA2.  현재 계획 중인 교과과정은 AI 학습에 많은 비중이 실려 있습니다. \n그렇지만 금융 학습과 AI 학습 중 상대적인 비중은 정해지지 않았\n습니다.', '[글로벌]2025-1학기 폐강(2차) 공고(글로벌캠퍼스)\n\n| 2025-1학기 글로벌캠퍼스 폐강(2차) 강좌를 아래와 같이 공고합니다. 폐강 강좌를 수강신청한 학생은 아래와 같이 해당 기한 내에 수강신청을 변경하기 바랍니다. - 아 래 - ■ 폐강강좌 수강생 수강신청 변경 1. 변경 기간 : 2025. 3. 14.(금) ~ 3. 18.(화) 오후 4:00까지(이메일 발송 기한엄수) (※ 3.\xa018.(화) 오후 4시까지 수신된 이메일에 한하여 접수하오니 기한 내 이메일 발송) 2. 작성양식 : 이 공지의\xa0첨부 파일(‘폐강과목 대체 수강 신청서’) 작성 3. 제 출 처 : 본인 1전공 소속 단과대학 교학파트(학사종합지원센터) 이메일 제출 단과대학 구분 전화번호 (031-330-내선) 담당자 이메일 사무실 위치 인문대학, 통번역대학, 융합인재대학 내선 4077 haksa4077@hufs.ac.kr 학생회관 109호 국가전략언어대학, 국제지역대학, 자유전공학부 내선 4457 lsh0613@hufs.ac.kr 공과대학, 자연과학대학, 바이오메디컬공학부 내선 4073 yyj1730@hufs.ac.kr 교직, 경상대학, Culture&Technology융합대학, 기후변화융합학부, AI융합대학 내선 4953 minsun@hufs.ac.kr ※ 수강과목 이수구분(전공, 교양 등) 상관 없이 본인 1전공 소속 단과대학 교학 파트 이메일 제출 4. 유의 사항 가. 폐강된 과목수와 동일한 과목수 만큼 수강신청 변경 가능(단, 최대수강신청 학점 초과 불가) 나. 수강신청 변경 시점 기준으로 제한인원을 초과하지 않는 과목으로 변경 가능\xa0수강 가능 강좌 확인 ☞ 강의시간표 조회(클릭) 다', '## [heading1] ##\n# 나. 주요 공지 사항\n\n## [list] ##\n- - 2학년 교과목중에서 ⸢고급파이썬프로그래밍⸥, ⸢자료구조⸥, ⸢확률과 통계⸥는 소속 캠퍼스\n- AI융합전공에서 개설되는 전공교류과목(아래 전공교류과목 참고)을 수강\n- - 2025학년도 1학기부터 개설되는 교과목은 양캠퍼스 교차수업 형태로 개설 우선\n\n## [paragraph] ##\n(5) 전공교류과목\n가. 서울캠퍼스\n\n## [table] ##\n| 개설학과(전공) | 교과목명 |\n| --- | --- |\n| AI융합전공 | 고급파이썬프로그래밍 컴퓨터수학 자료구조 확률과 통계 |\n| 융복합소프트웨어전공 | 고급파이썬프로그래밍 인공지능 |\n\n## [heading1] ##\n# 나. 글로벌캠퍼스\n\n## [table] ##\n| 개설학과(전공) | 교과목명 |\n| --- | --- |\n| AI융합전공 | 고급파이썬프로그래밍 컴퓨터수학 자료구조 확률과 통계 |\n| 국제금융학과 | 파이낸스어낼리틱스 파생금융상품론 금융프로그래밍 고급비즈니스어낼리틱스실습 경영학원론 마케팅관리 재무관리 회계원리 |\n| GBT전공 | 경영학원론 마케팅관리 회계원리 컴퓨터프로그래밍 객체지향프로그래밍 빅데이터분석 |\n| 미네르바교양대학 | 컴퓨터프로그래밍 |\n| AI데이터융합전공 | 객체지향프로그래밍 |\n\n## [heading1] ##\n# 다. 주요 공지 사항\n\n## [list] ##\n- - 소속 캠퍼스에 개설된 전공교류과목을 선택하여 수강해야 하며 캠퍼스 교차 수강 불가\n- - Business AI 전공에서는 타학과(전공)에서 개설되는 전공교류과목의 수강을 보장하지 않\n\n## [footer] ##\n- 61 -', '| 유의사항 | ① 경상대학 학생은 서울캠퍼스 경영학전공을 이중전공으로 이수할 수 없음 (부전공은 가능) ①-1 AI데이터융합학부, AI데이터융합전공 학생은 컴퓨터공학전공을 이중(부) 전공으로 이수할 수 없음 ② 영어통번역학부, 아프리카학부, 반도체전자공학부, 글로벌스포츠산업학부 소속은 동일학부 내 세부전공을 이중(부)전공으로 이수할 수 없음 ③ 서울캠퍼스에서 이중전공(부전공)으로 이수한 과목은 글로벌캠퍼스의 학과를 이중전공(부전공)으로 변경한 후에는 재수강 안됨 ⇒ 서울캠퍼스의 이중 전공(부전공)이 유지 되어 있는 상태에서 재수강을 완료 해야 함. ④ 융합인재대학은 이중전공으로만 가능(다른 단과대학 소속 학생이 희망하는 경우)하며, 전체 모듈 중 2가지를 선택하여 각 모듈별 21학점 이상(총 42학점)을 이수하여야함 ※이수대상 제한 아랍어통번역세부모듈 중국어통번역세부모듈 중국어관련 제1전공자 이수불가 미국.영연방전략세부모듈 제1전공자 이수불가 이수불가 | ① 경상대학 학생은 서울캠퍼스 경영학전공을 이중전공으로 이수할 수 없음 (부전공은 가능) ①-1 AI데이터융합학부, AI데이터융합전공 학생은 컴퓨터공학전공을 이중(부) 전공으로 이수할 수 없음 ② 영어통번역학부, 아프리카학부, 반도체전자공학부, 글로벌스포츠산업학부 소속은 동일학부 내 세부전공을 이중(부)전공으로 이수할 수 없음 ③ 서울캠퍼스에서 이중전공(부전공)으로 이수한 과목은 글로벌캠퍼스의 학과를 이중전공(부전공)으로 변경한 후에는 재수강 안됨 ⇒ 서울캠퍼스의 이중 전공(부전공)이 유지 되어 있는 상태에서 재수강을 완료 해야 함. ④ 융합인재대학은 이중전공으로만 가능(다른 단과대학 소속 학생이 희망하는 경우)하며, 전체 모듈 중 2가지를 선택하여 각 모듈별 21학점 이상(총 42학점)을 이수하여야함 ※이수대상 제한 아랍어통번역세부모듈 중국어통번역세부모듈 중국어관련 제1전공자 이수불가 미국.영연방전략세부모듈 제1전공자 이수불가 이수불가 |', '## [paragraph] ##\n- 비 용 : 무료\n\n## [paragraph] ##\n4) 교육수료 인정시기\n\n## [list] ##\n- ① 본교 교직과정 이수예정자로 선발된 후 수료한 교육부터 인정함.\n- ② 응급처치 및 심폐소생술 실습을 2회 이상 받아야 함\n- 5) 교육수료 인정 신청방법 : 신청서 양식을 작성하여 수료증과 함께 소속 캠퍼스\n- 학사종합지원센터에 제출(신청서 양식은 ‘학사종합지원센터 홈페이지-자료실-서식함’에서\n- 다운로드)\n- ※ 학사종합지원센터 홈페이지 – https://haksa.hufs.ac.kr/\n\n## [footer] ##\n- 93 -', '## [heading1] ##\n# Ⅲ. 교과영역 및 교과목 안내\n\n## [list] ##\n- 1. 전공(이중/ 부전공)\n\n## [paragraph] ##\n가. 전공필수 : 수강편람 마지막 페이지 ‘수강유의교과목’ 엑셀 파일\n\n## [heading1] ##\n# - <학과별 전공필수 교과목 현황> 참조\n\n## [paragraph] ##\n- 소속 학과(전공)의 전공필수 교과목은 반드시 이수하여야 함(부전공 제외)\n\n## [paragraph] ##\n- 전공필수 과목은 학과별, 학번별, 입학전형별로 다를 수 있으므로, 소속 학과와 상담 후 이수함\n\n## [paragraph] ##\n나. 학과 간 전공교류 : 수강편람 마지막 페이지 ‘수강유의교과목’ 엑셀 파일\n- <학과간 전공과목 교류 현황> 참조\n\n## [paragraph] ##\n- 전공교류 지정된 타 학과 교과목을 수강하여 제1전공(이중전공, 부전공) 학점을 취득할 수 있음.\n단, 전공교류 교과목을 재수강하는 경우, 재수강 과목이 전공교류 지정되어 있어야 전공 인정\n\n## [heading1] ##\n# 2. 교양\n\n## [heading1] ##\n# 가. 교양과목의 영역 구성\n\n## [table] ##\n| 구분 | 구분 | 영역 |\n| --- | --- | --- |\n| H | Humanity 미네르바 인성 | 인성교육 |\n| U | Universality 기초 | 미네르바인문, 대학외국어, 소프트웨어기초, RC영어, COLLEGE ENGLISH, 마이크로전공(영어)(2025-1학기 신설) |\n| F | Foreground 핵심 | 핵심인문기초(2025-1학기 폐지), 언어와문학, 문화와예술, 역사와철학, 인간과사회, 과학과기술 |\n| S | Synchronicity 체험 | 신입생세미나, HUFS Career Design 진로설정과취.창업경력개발, 미래시뮬레이션, 생활과스포츠, 실용외국어(선택), 외국인을위한한국학 |', '[공통] 2025-1학기 이중전공 변경 신청 일정 공고 새글\n\n마 . 동점자 배정기준\n\n1) 평점평균 동점자 : 이수학점이 높은 학생 우선 배정\n\n2) 평점평균 , 이수학점 동점자 : 동점자 전원 배정\n\n6. 유의사항\n\n가 . 양 캠퍼스에 동일하게 개설되는 융합전공은 본인 소속 캠퍼스에서 이수해야 함\n\n나 . 학과 ( 부 ) 별 전형이 있는 경우 반드시 학과 사무실에 관련 일정 및 자격 확인\n\n※ 관련 일정 및 자격 미확인으로 인한 불이익은 본인 과실임을 유의할 것\n\n학과 사무실\n\n연락처\n\n이메일\n\n노어과\n\n02-2173-2284\n\nhufsrussia@hufs.ac.kr\n\n베트남어과\n\n02-2173-2300\n\nvietnam.hufs@gmail.com\n\n정치외교학과\n\n02-2173-2312\n\nhufspsd@gmail.com\n\n경영학부\n\n02-2173-2334\n\ncob@hufs.ac.kr\n\nLanguage & Diplomacy 학부\n\n02-2173-2478\n\nlangdiplo@hufs.ac.kr\n\nLanguage & Trade 학부\n\n02-2173-3350\n\nhufsdltta@hufs.ac.kr\n\nKFL 학부\n\n02-2173-2477\n\nhufs_kfl@naver.com\n\nSocial Science & AI 융합학부\n\n02-2173-2769\n\nssai@hufs.ac.kr\n\nLanguage & AI 융합학부\n\n02-2173-2278\n\nhufs_langai@hufs.ac.kr\n\n다 . 타캠퍼스에서 이수한 이중전공 과목의 재수강 은 타캠퍼스 이중전공 이수 기간중에 재수강을 완료해야 함\n\n※ 타캠퍼스 이중전공에서 본인 소속 캠퍼스 이중전공으로 변경한 후에는 재수강 불가\n\n라 . 부전공 희망자 및 전공심화 ( 단일전공 ) 희망자 의 경우 추후 종합정보시스템으로 별도 신청 예정\n\n1) 부전공 희망자 : 일반 부전공 또는 전공심화 ＋ 부전공 신청\n\n2) 단일전공 희망자 : 기존 이중 / 부전공 취소\n\n※ 자세한 일정은 2025 년 7 월 중순 학사공지 예정인 “ 부전공 신청 및 이중전공 / 부전공 취소 일정 ” 확인', '[공통] 2025-1학기 수강신청 안내\n\n1) 타캠퍼스 학과의 전공을 이중(부)전공으로 이수 허가받은 학생에 한하여 타캠퍼스 해당 이중(부)전공 과목 수강신청 가능(단, 교양, 자유선택 수강 불가)\n\n2) 단, 아래의 경우 수강 가능한 개설캠퍼스 유의\n\n1전공 캠퍼스\n\n이수중인 타캠퍼스 이중(부)전공\n\n전공구분\n\n수강신청\n\n서울캠퍼스\n\n철학, 사학, 언어인지과학\n\n부전공\n\n서울캠퍼스\n\n글로벌캠퍼스\n\n정치외교학, 행정학, 언론·정보,\n\n광고·PR·브랜딩, 방송·영상·뉴미디어\n\n부전공\n\n글로벌캠퍼스\n\n이중전공\n\n양캠퍼스\n\n다. 집중수업 강좌 는 수강취소기간에 수강취소 불가 하므로, 수강신청 전 수업진행과 관련하여 강의계획서\n\n사전 확인 (다만, 질병 및 군입대 등의 사유로 학업이 불가능하게 된 경우는 예외)\n\n1) 집중수업이란?(※ 강의시간표 및 수강신청 강좌 비고 에 “*집중수업(수업기간)”으로 안내)\n\n교육과정 운영상 필요한 경우 개별 교과목별로 학점당 이수시간(학점 15시간 이상)을 준수하는 범위에서 수업일수를 단축하여 운영하는 수업\n\n2) 집중수업 강좌가 학기 종강 전에 종료되더라도 강의평가 및 성적평가 기간은 원활한 학사운영을 위해 학사일정에 맞춰 진행함\n\n라. 교차수업 강좌 는 본인 소속 캠퍼스에서 대면수업으로 진행될 때에는 대면수업으로 참여하고, 타 캠퍼스에서 대면수업으로 진행될 때에는 실시간 비대면으로 수업에 참여함\n\n(※ 캠퍼스별 대면수업 일정은 강의계획서 참고)\n\n▶ 교차수업이란?(※ 강의시간표 및 수강신청 강좌 비고 에 “*교차수업”으로 안내)\n\n동일한 강의시간(요일, 시간)에 동일한 교과목(학점, 시간 일치)을 동일한 담당 교수의 수업으로 양 캠퍼스에 각각 개설한 수업으로 학생은 본인 소속 캠퍼스에 개설된 강좌를 수강신청함\n\n마. 글로벌캠퍼스 강의실 배정\n\n▶ 수강 신청 전 강의실 배정이 어려운 관계로 수강 신청 시 추후 건물 이동 동선 참고\n\n계열/학과\n\n건물\n\n인문·경상계열\n\n인문·경상관\n\n어문계열\n\n어문관 / 교양관\n\n자연계열\n\n자연관 / 백년관\n\n공학계열\n\n공학관\n\n교양', '## [list] ##\n- 15시간 이상)을 준수하는 범위에서 수업일수를 단축하여 운영하는 수업\n- ※ 확인방법 : 강의시간표 및 수강신청 강좌 비고에 “*집중수업(수업기간)”으로 안내\n- ※ 집중수업 강좌가 학기 종강 전에 종료되더라도 강의평가 및 성적평가 기간은\n- 원활한 학사운영을 위해 학사일정에 맞춰 진행함\n- 17) 교차수업 강좌는 본인 소속 캠퍼스에서 대면수업으로 진행될 때에는 대면수업으로\n- 참여하고, 타 캠퍼스에서 대면수업으로 진행될 때에는 실시간 비대면으로 수업에 참\n- 여함(※ 캠퍼스별 대면수업 일정은 강의계획서 참고)\n- - 교차수업 : 동일한 강의시간(요일, 시간)에 동일한 교과목(학점, 시간 일치)을 동일\n- 한 담당 교수의 수업으로 양 캠퍼스에 각각 개설한 수업으로 학생은 본인 소속\n- 캠퍼스에 개설된 강좌를 수강신청함\n- - 확인방법 : 강의시간표 및 수강신청 강좌 비고에 “*교차수업”으로 안내\n\n## [paragraph] ##\n※ 예비수강신청함 시스템 사용법\n모의 동영상 (QR코드스캔)\n\n## [paragraph] ##\n※ 수강신청 시스템 사용법\n모의 동영상(QR코드스캔)\n\n## [heading1] ##\n# 다. 수강신청 변경\n\n## [table] ##\n| 기간 | 3. 4.(화) ~ 3. 10.(월), 10시 ~ 17시 (토요일, 일요일 제외) (단, 취소는 1~4일차 매일 22시까지, 5일차 17시까지 가능) |\n| --- | --- |\n| 방법 | 학교 홈페이지 수강신청변경 임시화면(별도 기간) ‘바로가기’ / 팝업 ‘수강신청변경 바로가기’ / HOT LINK ‘수강신청변경 바로가기’ ※ 수강신청 변경 후 본인의 강의시간표 반드시 확인 |\n\n## [paragraph] ##\n☞ 정규 수강신청과 동일하게 신청하며, 교과목 별 여석 내에서 추가로 신청할 수 있음\n\n## [caption] ##\n라. 폐강강좌 수강생 수강신청 변경', '[글로벌]2025-1학기 폐강(2차) 공고(글로벌캠퍼스)\n\n[글로벌]2025-1학기 폐강(2차) 공고(글로벌캠퍼스)\n\n2025-1 학기 폐강 (2 차 ) 공고 ( 글로벌캠퍼스 )\n\n2025-1 학기 글로벌캠퍼스 폐강 (2 차 ) 강좌를 아래와 같이 공고 합니다 .\n\n폐강 강좌를 수강신청한 학생은 아래와 같이 해당 기한 내에 수강신청을 변경 하기 바랍니다 .\n\n- 아 래 -\n\n■ 폐강강좌 수강생 수강신청 변경\n\n1. 변경 기간 : 2025. 3. 14.( 금 ) ~ 3. 18.( 화 ) 오후 4:00 까지 ( 이메일 발송 기한엄수 )\n\n( ※ 3.\xa018.( 화 ) 오후 4 시까지 수신된 이메일에 한하여 접수하오니 기한 내 이메일 발송 )\n\n2. 작성양식 : 이 공지의 첨부 파일 (‘ 폐강과목 대체 수강 신청서 ’) 작성\n\n3. 제 출 처 : 본인 1 전공 소속 단과대학 교학파트 ( 학사종합지원센터 ) 이메일 제출\n\n단과대학 구분\n\n전화번호\n\n(031-330- 내선 )\n\n담당자 이메일\n\n사무실 위치\n\n인문대학, 통번역대학, 융합인재대학\n\n내선 4077\n\nhaksa4077@hufs.ac.kr\n\n학생회관 109 호\n\n국가전략언어대학, 국제지역대학, 자유전공학부\n\n내선 4457\n\nlsh0613@hufs.ac.kr\n\n공과대학, 자연과학대학, 바이오메디컬공학부\n\n내선 4073\n\nyyj1730@hufs.ac.kr\n\n교직, 경상대학, Culture&Technology융합대학, 기후변화융합학부, AI융합대학\n\n내선 4953\n\nminsun@hufs.ac.kr\n\n※ 수강과목 이수구분 ( 전공 , 교양 등 ) 상관 없이 본인 1 전공 소속 단과대학 교학 파트 이메일 제출\n\n4. 유의 사항\n\n가 . 폐강된 과목수와 동일한 과목수 만큼 수강신청 변경 가능 ( 단 , 최대수강신청 학점 초과 불가 )\n\n나 . 수강신청 변경 시점 기준으로 제한인원을 초과하지 않는 과목으로 변경 가능 수강 가능 강좌 확인 ☞ 강의시간표 조회 ( 클릭 )\n\n다 . 폐강 강좌를 수강하지 않은 학생은 이 기간에 수강신청 변경을 할 수 없음', '[공통] 졸업예정자(해당학기 졸업가능자)의 조기취업 유고결석 신청 안내\n\n[공통] 졸업예정자(해당학기 졸업가능자)의 조기취업 유고결석 신청 안내\n\n졸업예정자 ( 해당학기 졸업가능자 ) 의 조기취업 유고결석 신청 안내\n\n졸업예정자 ( 해당학기 졸업가능자 ) 의 조기취업 관련 유고결석 신청 방법을 아래와 같이 안내합니다 .\n\n- 아 래 -\n\n1. 졸업예정자 ( 해당학기 졸업가능자 ) 의 조기취업 유고결석 신청 방법\n\n가 . 신청대상 : 졸업예정자 ( 해당학기 졸업가능자 ) 로서 조기취업자\n\n※ 직계존속자가 대표로 있는 사업장의 취업자 ( 가족회사 ), 프리랜서 , 창업자 , 인턴 , 아르바이트성 취업은 인정 불가 ( 단 , 정규직 전환형 , 채용 전환형 인턴은 가능 )\n\n나 . 인정기간 : 취업기간\n\n다 . 증빙서류\n\n구분\n\n신청서류\n\n서류 발급\n\n공통\n\n유고결석 인정원\n\n첨부파일\n\n재직기간이 명시된 재직 ( 계약 ( 고용 )) 증명서\n\n재직회사 ( 기관 )\n\n성적증명서\n\n종합정보시스템 로그인 → 인터넷증명발급\n\n해당학기 시간표\n\n종합정보시스템 로그인 → 수업 / 수강관리 → 개인시간표에서 출력\n\n국내\n\n4 대보험가입내역확인서\n\n(특수직역연금 가입자의 경우, 특수직역연금 가입서류 추가 제출 요망)\n\n4 대사회보험 정보연계센터 https://www.4insure.or.kr 에서 발급\n\n해외\n\n취업비자사본\n\n해당국가 고용보험 납입증명서 혹은 보험카드 등\n\n우리나라 4 대보험에 준하는 보험가입서류\n\n* 채용 전환형 인턴의 경우 재직 ( 계약 ( 고용 )) 증명서에 해당 내용 명시\n\n** 공무원의 경우 재직증명서 발급 전에는 공무원합격증으로 제출\n\n*** 특수직역연금: 공무원연금, 군인연금, 사립학교교직원연금 등\n\n라 . 신청시기 및 절차\n\n1) 신청시기 : 입사확정 후 즉시\n\n2) 절차 : ① 수강과목 담당교수에게 취업사실을 알리고 허락을 득한 후\n\n② 유고결석인정원과 증빙서류를 첨부하여 학과 ( 부 ) 사무실 제시\n\n③ 본인 소속 학과 ( 부 ) 장 승인\n\n④ 유고결석인정원과 증빙서류를 학사종합지원센터 소속 단과대에 제출', '서 더욱 그렇죠. 전공을 살리려는 학생에게 루마니아어의 희소성은 \n확실히 커다란 장점이 될 수 있습니다. 물론 전공과 다른 진로 선택\n을 할 경우 취약한 스펙이 될지도 모른다고 생각할지도 모르지만, \n그런 우려는 접어두셔도 좋습니다. 따라서 루마니아어는 배우면서 \n언어습득 센스를 발전시키는 데 많은 도움을 주는 언어이기에 가까\n운 미래를 위한 블루칩이 될 것입니다. 타 언어를 함께 배우다 보면 \n루마니아어가 지닌 장점을 확인할 수 있게 됩니다. 또한 언어와 함\n께 학습한 지역학 분야의 지식들도 분야를 떠나 큰 도움이 됩니다. \n하나의 현상을 입체적이고 다각적으로 바라볼 수 있게 해주거든요.\nDept. of Romanian Studies\n루마니아학과\n전화번호 031-330-4218\n홈페이지 romania.hufs.ac.kr\n슬기로운 대학생활 \n1·2학년  폴란드어 알파벳부터 시작하여 말하기, 듣기, 읽기, 쓰기, 번역\n연습 등 기초 어학실력을 체계적이고 집중적으로 배양합니다.\n3학년   폴란드 역사 정치, 폴란드와 한국 저널리즘 세미나, 폴란드 문\n학번역 실습 등의 교과목을 통해 지역학적 지식과 이문화 중개\n능력을 배웁니다. 폴란드학과 재학생 중 상당수가 3학년 때 6\n개월~1년 간 현지 유학생활을 경험합니다.\n4학년   폴란드 문화유산 탐방, 대중문화 속의 폴란드, 폴란드 지역연\n구 세미나 등의 교과목을 통해 전공역량을 더욱 심화합니다. \n기업체나 공공기관 등에서 폴란드어를 활용하여 인턴쉽이나 \n현장실습을 체험합니다.\n졸업 후 진로 \n2023년 기준 폴란드에 341개의 한국기업이 진출하였습니다. K-방산과 \n원전 수출로 폴란드어는 국가전략어로 각광받고 있으며, 폴란드학과 또\n한 높은 취업률을 자랑하고 있습니다. (특히 “전공연계 취업률”이 타 학\n과에 비해 월등히 높습니다.) \n폴란드어에 이중전공을 접목하면 다양한 분야의 핵심 인재로 성장할 \n수 있습니다.\n-  학계: 폴란드 현지 대학 한국어과 교수, 국책연구소 연구원, 국내외 \n대학 교수 \n-  기업체: 폴란드에 진출한 국내 기업, 글로벌 기업\n-  금융계: 은행 등 금융기관, 증권·보험 회사\n-  언론계: 외신기자, PD, 방송작가\n-  공공기관: 대사관, 문화원, 문화재단, 공기업, 행정부처 공무원 등\n-  문화예술계: 번역가, 큐레이터, 어린이책 기획자 등\nQ&A \nQ1.  폴란드학과는 한국에 하나밖에 없는 유일 전공학과로 알고 있는']","딥러닝이 연구 분야인 교수님들은 다음과 같은 소속 단과대와 학부에 계십니다:

1. **정유진 교수님**  
   - 소속: 컴퓨터공학부  
   - 연구 분야: Deep Learning, Information Retrieval, Algorithm  
   - 이메일: chungyj@hufs.ac.kr  
   - 연구실: 백년관 803호  

2. **최재영 교수님**  
   - 소속: 컴퓨터공학부  
   - 연구 분야: 머신러닝, 패턴인식  
   - 이메일: jychoi@hufs.ac.kr  
   - 연구실: 공학관 413호  

이 두 교수님께 딥러닝 관련 상담을 요청하실 수 있습니다. 혹시 더 도와드릴까요?","아래는 딥러닝을 연구하는 교수님들 목록의 일부입니다:
1. 장익범 교수님 — 공과대학, 컴퓨터공학부 (딥러닝, 의료영상분석, 생성형AI, 뇌질환)
2. 전병환 교수님 — 공과대학, 컴퓨터공학부 (Deep Neural Network, Medical Image Processing, Active Learning, Openset Recognition)
3. 정유진 교수님 — 공과대학, 컴퓨터공학부 (Deep learning, Information retrieval, Algorithm)
이 외에도 추가 안내 가능합니다.",0.249999999975,0.25,0.0,0.8406969355066436
체코문학사 수업 교수님 메일은 어떻게 돼?,"['김경옥 (Kim, Gyeongok) 교수님은 체코,슬로바키아학과 학과 소속입니다. 강사 직위를 맡고 있습니다. 이메일은 kko9611@hanamil.net입니다.', '양준석 (Yang, Joonseok) 교수님은 체코,슬로바키아학과 학과 소속입니다. 객원 교수 직위를 맡고 있습니다. 이메일은 chirira@hanmail.net입니다.', '박민영 교수님은 체코,슬로바키아학과 학과 소속입니다. 강사 직위를 맡고 있습니다. 이메일은 minyoung.park09@gmail.com입니다.', '이성준 교수님은 브라질학과 학과 소속입니다. 이메일은 s9114021@yahoo.com입니다.', '백종필 교수님은 세르비아,크로아티아학과 학과 소속입니다. 교수(특임강의) 직위를 맡고 있습니다. 한국외대 유고어과/노비사드대 남슬라브 비교문학과 박사과정 학위를 가지고 있습니다. 연구분야는 속담, 포스트모더니즘, 영화입니다. 이메일은 saputnici@hanmail.net입니다.', '김인천 (Kim, Inchon) 교수님은 체코,슬로바키아학과 학과 소속입니다. 교수(학과장) 직위를 맡고 있습니다. 이메일은 ceskykim@hufs.ac.kr입니다.', '권재일 (Kwon, Jaeil) 교수님은 체코,슬로바키아학과 학과 소속입니다. 명예 교수 직위를 맡고 있습니다. 이메일은 jaeikwon@naver.com입니다.', '스스로 상당한 역량을 갖춘 학생들은 수업에 더욱 흥미를 느낄 수 있\n으며 더욱 크게 성장할 것입니다. \n우리 학과(부)·전공 매력 \n-  모든 교수님이 참여하여 전공을 소개하는 GBT Special Lecture 과\n목 운영\n-  학생들이 중심이 되는 마케팅학회, 데이터분석학회 등 전공 관련 학\n회 운영\n-  SW중심대학사업, 벤처스타트업아카데미 등 정부지원사업 참여 학과\n-  인턴십을 연계한 산학협력 수업 운영\n-  4년간 배운 지식을 종합하여 비즈니스에 응용해 보는 졸업프로젝트 \n수업 운영\n주요 실적 \n-  SW중심대학사업, 벤처스타트업아카데미 등 정부지원사업 참여 학과\n-  해외 대학과 교환학생 프로그램 MOU 체결 및 운영\n-  국내 기업과 산학협력 MOU 체결\n-  매년 수업 연계 인턴십 운영\n주요 전공과목 \n-  컴퓨터프로그래밍: JAVA 언어를 사용하여 프로그래밍의 기초 및 응\n용을 프로그래밍 경험이 없는 GBT 1학년 학생의 수준에 맞춰 강의합\n니다. JAVA 프로그래밍의 기본 문법과 더불어 다양한 문제 풀이를 통\n한 프로그래밍 스킬 향상 및 경험을 획득하는데 목표를 두고 있습니\n다. 구체적으로 경제/경영 분야에서 발생할 수 있는 기초적인 계산 및 \n응용 문제를 프로그래밍할 수 있도록 다양한 예제를 학습합니다. 이 \n강의를 통해 GBT 1전공 학생들과 이중전공생들은 JAVA 프로그래밍\n뿐 아니라 타 프로그래밍 언어 학습, 혹은 IT 트랙 관련 과목들을 더욱 \n쉽게 접근할 수 있습니다.\n-  소셜콘텐츠분석: R프로그래밍 언어를 활용하여 다양한 소셜 콘텐츠\n를 수집 및 분석하며, 그 과정에서 관련된 이론들과 기업의 경영전략\n을 함께 생각해 보는 과목입니다. 학생들은 매주 새로운 주제로 R프로\n그래밍 언어를 학습하면서 동시에 그러한 기능들을 잘 활용할 경우 기\n업들은 어떤 서비스를 소비자들에게 제공할 수 있으며 그러한 서비스\n들이 경쟁하는 시장에서 소비자들은 어떻게 반응하고 행동하는 지 관\n련 사례, 아티클들을 읽으며 함께 토론하고 생각해 봅니다.\n-  디지털마케팅실습: 디지털마케팅 (digital marketing)이란 인터넷 및 \n모바일을 기반한 마케팅 툴을 통해 온라인 광고·홍보로 소비자들에게 \n제품과 서비스를 알리고, 판매하는 것을 말합니다. 본 교과는 디지털\n마케팅에 대한 이론을 배우고 실무에서 직접 쓰이는 디지털마케팅의 \n핵심적 가치 창출 결과물인 디지털마케팅 기획안을 만들고 구체화하', '4140\n글로벌캠퍼스 GLOBAL CAMPUS\n공과대학\n컴퓨터공학부 41\n정보통신공학과 43\n반도체전자공학부(반도체공학전공) 45\n반도체전자공학부(전자공학전공) 47\n산업경영공학과 48\nCOLLEGE OF\nENGINEERING\nDivision of Computer Engineering\n컴퓨터공학부\n전화번호 031-330-4268\n홈페이지 computer.hufs.ac.kr\n전공소개 \n-  컴퓨터공학은 4차 산업혁명을 이끄는 핵심 전공으로서 스마트폰부\n터 인공지능까지, 컴퓨터공학이 어떻게 세상을 변화시키고 있는지 누\n구보다 빨리 이해하고 그 변화를 이끄는 인재를 양성합니다. 인공지\n능(AI), 웹(Web), 앱(App), 빅데이터, 클라우드 컴퓨팅, 사물인터넷\n(IoT), 게임 개발처럼 여러분이 매일 같이 사용하는 것이 어떻게 작동\n하는지 또 어떻게 만드는지 배웁니다.\n-  한국외대 컴퓨터공학부는 과학기술정보통신부에서 선정한 소프트웨\n어(SW) 중심대학으로, 정부의 전폭적인 지원에 힘입어 4차 산업혁명\n시대를 견인할 창의적 SW융합인재 양성을 위한 최신 커리큘럼을 제\n공합니다. 2021년부터는 컴퓨터공학부로 새롭게 명명되었으며, 소프\n트웨어와 AI 교육이 강화되었습니다. \n-  SW중심대학 주체 학과로서 우리 학생들에게는 다음과 같은 특별한 \n기회가 주어집니다: 단기/장기 국내외 인턴십 및 견학 프로그램, 해외 \n70여개 우수 대학 (미국, 영국, 아일랜드, 호주 등)에 7+1 파견 유학, \n산학연계 캡스톤 프로젝트, 학과 내 다양한 학회와 동아리 활동, 학생\n별 지도교수 매칭, 프로그래밍 경진대회, 코딩 테스트 준비 캠프, 자체 \n해커톤, 기업 실무자 초청 특강 등. \n-  이곳에서 배우게 될 최첨단 기술과 지식은 여러분이 세계 곳곳에서 혁\n신적인 프로젝트와 연구에 참여할 수 있는 기반을 마련해 줄 것입니\n다. 컴퓨터공학부 학생이 되어 여러분의 꿈을 현실로 만들어 보세요!\n필요역량 및 소양 \n-  고등학교까지의 수학, 과학 등의 기본 과목들과 컴퓨터 프로그래밍에 \n도움이 되는 논리적인 사고력이 가장 기본입니다. 실제 프로그램 개발 \n경험이 있는 경우가 아니더라도 논리적인 사고 능력과 수학과 과학 과\n목으로 대표되는 고등학교 과목의 내용을 나름의 원리로 스스로 체계\n화하는 연습을 한 번 더 한다면, 전공 공부에 큰 도움이 될 것입니다.\n-  진학 직전 방학 기간에는 파이썬과 같은 프로그래밍 언어를 미리 학', '6766\n전공소개 \n자유전공학부(글로벌)는 글로벌캠퍼스에 2023년도에 신설된 학부입\n니다. 1학년 동안 다양한 분야의 전공 탐색 기회를 제공하여 학생들에게 \n자신이 맞는 전공을 선택할 시간을 충분히 배정하고자 노력하고 있으\n며, 이를 통해 주전공 및 이중전공 선택 시 보다 정확하고 합리적인 의사\n결정을 하도록 돕고 있습니다. 무엇보다도 우리 자유전공학부(글로벌)\n에서는 1학년 때 다양한 교과목 수업 수강을 통하여 어떤 전공을 선택\n하더라도 쉽게 적응할 수 있는 커리큘럼을 제공하고자 노력 중이며, 이\n를 위해 미네르바 인문영역, Residential College 영어 영역, 소프트웨\n어 기초영역 등 다양한 기초 수업을 진행 중에 있습니다. \n필요역량 및 소양 \n자유전공학부(글로벌)는 1학년 동안 교내 다양한 전공 탐색의 기회를 제\n공하는 데 주요 목적이 있습니다. 교과 측면에서 전공선택과 관련된 다\n양한 과목들을 두루두루 학습하면서, 동시에 자신에게 맞는 전공 분야\n를 찾는 노력이 중요합니다. 인문계열 과목을 통해서는 다양한 사회 분\n야에 대한 통찰 및 사고 활동을 통해서 사회현상을 바라보는 시각을 기\n르고, 문학 작품을 통해선 종합적인 인문학적 소양을 기르면 좋겠습니\n다. 자연계열 과목을 통해서는 논리적 사고 및 입증 과정을 통해서 세\n상을 구성하는 다양한 과학적 원리를 탐구하며, 이들을 실생활에 집약\n한 공학 부분에선, 이들 학문이 우리 사회에 어떻게 활용되는지 대해 탐\n구하면 좋겠습니다.\n우리 학과(부)·전공 매력 \n1)  1학년 동안 지도교수 지도 아래 다양한 학사/진로지도 및 멘토링 제\n공을 받을 수 있습니다.\n2)  교내외 전공탐색박람회 등 다양한 프로그램을 통해서 전공 탐색의 \n기회가 제공 됩니다.\n3)  1학년 동안 다양한 교과 프로그램을 통해 미래 전공에 대한 충분한 고\n민과 체험을 제공받을 수 있습니다.\n전공탐색 교육과정 \n1학년 1학기  교양 교육 중심\n(교과) 교양 교육을 통한 기초소양 함양, 전공탐색 \n(비교과) 전공탐색 연계한 자기탐색, 진로탐색 프로그램 지원\n1학년(여름방학) 학과 설명회\n2학기 희망 전공의 학문기초 교과목을 선택할 수 있도록 정보제공 \n1학년 2학기 전공 진입 전 기초교육 \n(교과) 교양 교과목 이수 및 희망 전공의 학문기초 교과목 이수 \n(비교과) 다양한 프로그램 연계 전공탐색학기제 운영 \n슬기로운 대학생활', '김세화 교수님 교수님은 정보통신공학과 학과 소속입니다. 이메일은 ksaehwa@hufs.ac.kr입니다. 연구실은 공학관 408-3호입니다.', '박상원 교수님 교수님은 정보통신공학과 학과 소속입니다. 이메일은 swpark@hufs.ac.kr입니다. 연구실은 백년관 815호입니다.', '정성호 교수님 교수님은 정보통신공학과 학과 소속입니다. 이메일은 shjeong@hufs.ac.kr입니다. 연구실은 백년관 702호입니다.', '한희일 교수님 교수님은 정보통신공학과 학과 소속입니다. 이메일은 hihahn@hufs.ac.kr입니다. 연구실은 백년관 721호입니다.', '전홍배 교수님 교수님은 정보통신공학과 학과 소속입니다. 이메일은 hongbae08@hufs.ac.kr입니다. 연구실은 공학관 510호입니다.', '손경락 교수님 교수님은 정보통신공학과 학과 소속입니다. 이메일은 krson@hufs.ac.kr입니다. 연구실은 공학관 414호입니다.', '황 신 환 교수님 [Shin hwan Hwang] 교수님은 전자공학과 학과 소속입니다. 겸임교수 직위를 맡고 있습니다.', '신민웅 교수님 교수님은 통계학과 학과 소속입니다. 명예교수 직위를 맡고 있습니다. 서울대학교 학위를 가지고 있습니다. 연구분야는 표본조사론입니다.', '부 준 호 교수님 [Jun-Ho Boo] 교수님은 반도체전자공학부 학과 소속입니다. 교수 (조교수) 직위를 맡고 있습니다. 연구분야는 혼성신호회로설계입니다. 이메일은 jhboo@hufs.ac.kr입니다.', '조 경 순 교수님 [Kyeongsoon Cho] 교수님은 반도체전자공학부 학과 소속입니다. 명예특임교수 직위를 맡고 있습니다. 연구분야는 시스템반도체 설계입니다. 이메일은 kscho@hufs.ac.kr입니다.', '임 채 강 교수님 [CHAEKANG LIM] 교수님은 반도체전자공학부 학과 소속입니다. 교수 (조교수) 직위를 맡고 있습니다. 연구분야는 집적시스템입니다. 이메일은 chase@hufs.ac.kr입니다.', '강준영 교수님 교수님은 중국어통번역학과 학과 소속입니다. 전임교수 직위를 맡고 있습니다. 대만 국립정치대학 동아연구소 학위를 가지고 있습니다. 연구분야는 중국정치경제학입니다. 이메일은 junka009@hanmail.net입니다.', '주 정 석 교수님 [Jung Suk Joo] 교수님은 반도체전자공학부 학과 소속입니다. 교수 (정교수) 직위를 맡고 있습니다. 연구분야는 통신신호처리입니다. 이메일은 jjs@hufs.ac.kr입니다.', '정 동 근 교수님 [Dong Geun Jeong] 교수님은 반도체전자공학부 학과 소속입니다. 명예교수 직위를 맡고 있습니다. 연구분야는 이동/무선통신, 무선응용입니다. 이메일은 dgjeong@hufs.ac.kr입니다.', '박 영 철 교수님 [Park, Youngcheol] 교수님은 반도체전자공학부 학과 소속입니다. 교수 (정교수) 직위를 맡고 있습니다. 연구분야는 무선 시스템입니다. 이메일은 ycpark@hufs.ac.kr입니다.', '김 민 준 교수님 [Minjoon Kim] 교수님은 반도체전자공학부 학과 소속입니다. 교수 (조교수) 직위를 맡고 있습니다. 연구분야는 지능형디지털시스템, SoC 설계입니다. 이메일은 mjoon@hufs.ac.kr입니다.', '김 동 식 교수님 [Dong Sik Kim] 교수님은 반도체전자공학부 학과 소속입니다. 교수 (정교수) 직위를 맡고 있습니다. 연구분야는 디지털신호처리, 바이오의료영상처리입니다. 이메일은 dskim@hufs.ac.kr입니다.']","체코문학사 수업의 교수님은 최호성 교수님입니다. 교수님의 이메일 주소는 **choe@hufs.ac.kr**입니다. 

상담이나 문의가 필요하시면 이메일로 연락하시면 됩니다. 혹시 더 도와드릴까요?","체코문학사 수업은 유선비 교수님께서 담당하며, 이메일은 'yusb@hufs.ac.kr'입니다.",0.0,0.0,0.25,0.805681002444388
